1capplegate,This year for Halloween I'm going as someone who's too cool to do a tweet about Halloween.
1capplegate,That Dove Chocolate tastes way better than that Dove beauty bar.
1capplegate,How does Donald Trump remain so humble?
1capplegate,Ever notice that all your friends that make fun of you for tweeting sound like your Dad?
1capplegate,Just another romantic evening with @jeanniegaffigan http://t.co/QO3yAW7u
1capplegate,Any truth to the rumor Im starting that the girl from the Progressive Insurance commercials is a Conservative?
1capplegate,I think its cute vitamins have an expiration date.  That implies they worked at one point.
1capplegate,RT @NikkiFinke: NBC Buys Family Comedy Created By & Starring Actor-Comedian Jim Gaffigan http://t.co/AQf3hDFi
1capplegate,Available at my @pabsttheater shows Dec 30th and NYE in Milwaukee.  (thanks @pointbrewery) http://t.co/W8GVvVuz
1capplegate,The rumors of Playboy paying me a million dollars to not pose nude are false.
1capplegate,Ill never be mature enough to hear the term natural gas and not giggle a little.
1capplegate,I heard its all the rage to give these to trick-or-treaters this year http://t.co/POuDQIrX
1capplegate,Hey you know those people that are always outside and never watch TV? How about a channel just for them.  Pitch for The Outdoor Channel
1capplegate,Its sad that @ESPN has more channels than The Outdoor Channel has viewers.
1capplegate,Am I the only that thinks their TV is broken when they watch Boise State football highlights?
1capplegate,So the Childrens Menu in a restaurant is essentially a sports bar menu but more expensive.
1capplegate,i love this.  Thanks to whoever did it. http://t.co/2MrHY255
1capplegate,On Sundays @WholeFoods should have a traffic report.
1capplegate,"Dear hotels,  how about curtains that actually block the sunlight from entering your room?"
1capplegate,When in Rome...Thanks Buffalo! Next up Los Angeles November 5th http://t.co/3B5MXHMv
1capplegate,"My stomach has an abusive relationship with McD. ""I want you but you always end up making me feel horrible."". Figure it out stomach! Jeez."
1capplegate,What? Do u think i ask to many? When? What should i do? Do u know? RT @Andy_Richter @JimGaffigan You spoil everything with your questions!
1capplegate,I have this really cool key locator thing.  If only I could find it.
1capplegate,What exactly is the difference between changing a diarrhea diaper and rubbing feces on your hands?
1capplegate,"The show Im touring with right now is all NEW material.  Nxt up  Buffalo, LA, NYC, STL, Vegas, Atlanta.  http://t.co/pFPA40RI"
1capplegate,Can we just have one debate where all participants are drunk?
1capplegate,Am I the only one against jobs?  #ImLazy
1capplegate,"Everyone thought the last line of the National Anthem was Play ball, right?"
1capplegate,At this point is it possible to stand at a podium and not look like you are a contestant on Jeopardy?
1capplegate,Since when is it not ok to audit a hot yoga class dressed as Batman?
1capplegate,It is now cheaper to make a movie than to rent one in a hotel room.
1capplegate,Wanted: A proofreader for my tweets. Must be able to type 140 characters a minute with their thumb while driving. No pay.
1capplegate,"RT @jeanniegaffigan: I wonder if the people who correct the grammar on Twitter do the same when their friends text them. ""U is actually  ..."
1capplegate,Autocorrect is like that person who just graduated college and think they know everything.
1capplegate,Why is it when I'm in a TSA line I'm always behind the person that has never left their house?
1capplegate,Finally another Twilight movie to be annoyed by.
1capplegate,If only opening a Vitamin Water could be classified as working out.
1capplegate,Congrats @BorowitzReport on the new book!  Cant wait to read it or at least appear smart by having it on my bookshelf. http://t.co/HFkSpe7y
1capplegate,One of the reasons why my 5 year old son may not see his 6th birthday. http://t.co/2bFgo2P1
1capplegate,I dont feel guilty eating my kids afterschool snacks.  I feel guilty telling them their mom did.
1capplegate,I bet you'd really feel guilty eating elephant in a peanut sauce.
1capplegate,About to watch Dexter. I hope no one dies in this episode.
1capplegate,Spelling something wrong in a tweet is like finding out you have your zipper open in public.  And not on purpose.
1capplegate,It would be really ironic if elephant burgers were not fatening.
1capplegate,Its sad people kill elephants just for their tusks.  Youd think at least theyd get a few elephant burgers out of it.  #babar
1capplegate,RT @jeanniegaffigan: Thank you Columbus for discovering this day off!
1capplegate,"If the objective of every infomercial were to get me to say What a piece of junk, theyd be killing it."
1capplegate,At this point is there anything we dont know about the Kardashians?
1capplegate,How come the term over-tired is only used to describe the behavior of babies or sitcom storylines?
1capplegate,"Sometimes when Im carrying one of my sleeping children Im tempted to wake them up & say Youre gonna do this for me in 20 years, right?"
1capplegate,What exactly is the difference between coconut  water and spoiled water?
1capplegate,Thanks to @yoyodonuts for this lovely backstage gift. http://t.co/DUplT4GZ
1capplegate,"Hey people that sit on planes not reading, listening to or watching anything: you look like serial killers."
1capplegate,"RT @jeanniegaffigan: Great news! Our apartment is going to be featured in next month's issue of ""In Sty"" magazine!"
1capplegate,Is it a coincidence that Ranch is a style of house and a horrible salad dressing?
1capplegate,At this point I view every photo of myself as a before photo.
1capplegate,"Just curious, how many weeks can you wear the same pair of jeans before its gross?"
1capplegate,Most of my life feels like i'm down a touchdown and there's 48 seconds on the clock.
1capplegate,We should just rename television viewing watching Geico commercials.
1capplegate,I like those black leggings the Baltimore Ravens are wearing tonight but I way prefer them on women.
1capplegate,Being a parent may be thankless but at least the pay is terrible.
1capplegate,I usually remember Im trying to eat healthy when I finish eating a cheeseburger.
1capplegate,RT @TheJoeMatarese: Here's the link to Ep 40 of Fixing Joe with my guest Jim Gaffigan. My wife even makes an appearance on this podcast. ...
1capplegate,"Heres something youll never hear, Look at that cool guy in the long-sleeved sun shirt."
1capplegate,I always confuse National Coffee Day with National Coughing Day or National Give Anything A National Day Day.
1capplegate,The cannoli is the pastrami sandwich of dessert. http://t.co/LOvprIaB
1capplegate,How old is your baby? is the How about this weather? of parenting.
1capplegate,"This being awake stuff is hard, right?"
1capplegate,Sometimes I feel like Im being bullied by all these anti-bullying campaigns.
1capplegate,It would take me 7 years to show someone all the photos I have of my 7 year old.  Anyone interested?
1capplegate,"Microwaves are like winter coats.  They warm quick,  people never clean them and they look ugly after a year."
1capplegate,They should have a flight to the airport.  This is taking forever.
1capplegate,"I sincerely don't know how to spell sincerely without spell check. Sincerely, Jim"
1capplegate,"Whats that feeling called when you finally agree on what to order, then you call and the place is closed?"
1capplegate,"This debate is confusing.  Republicans are for MORE government, right?"
1capplegate,"Recently I started Weight Watchers. No, thats not it. Recently I started eating a lot & dont care if I get fat. Sometimes I confuse the 2."
1capplegate,"Just ate ox tail.  ""Hey you know how you would never eat an ox? How bout some ox tail?"""
1capplegate,Im starting to think Rick Perry and Tyler Perry arent even related.
1capplegate,"I'm thinking of pitching a tv show called ""Tyler Perry's Tyler Perry"".  Think he'll mind?"
1capplegate,Why is there more dignity in stripping than auditioning?
1capplegate,Ever notice that any photo youre not in is really not that interesting?
1capplegate,"Tickets for Stand Up for Heroes w/ Jon Stewart, Ricky Gervais, Bruce Springsteen and Me.  + Complete tour list http://t.co/NyWXLutu"
1capplegate,You know what would help sell these fashionable clothes?  Bales of hay. http://t.co/YLvFexTb
1capplegate,What exactly are the ingredients of Ranch dressing? Mayo and disappointment?
1capplegate,"If you ever find yourself drinking more than one shot, you are either celebrating your birthday or trying to forget you were born."
1capplegate,"If I didnt have all these photos that Ill never look at, I dont know how I would make my computer run so slow."
1capplegate,Fashion Week is just another opportunity to prove to Al-Qaeda we are not superficial and materialistic.
1capplegate,Dick Cheney was on The View.  Looks like the Cubs are going to win The World Series.
1capplegate,"""We have to eat this before it goes bad."" - every single person who has ever eaten guacamole."
1capplegate,Just had pizza with my 7 and 5 year old. Would it be too much for them to at least offer to pay once? Jeez.
1capplegate,"Taking a survey.  How many of you have heard of this thing ""the Internet""?  Don't cheat by Googling it."
1capplegate,When are they going to come out with diet biscuits & gravy?
1capplegate,Fancy hotels always have great bonuses like the chocolate on the pillow and the hair in the bathroom.
1capplegate,"Dear Television Networks.  How about more NFL, less everything else?"
1capplegate,My 2-year-old is getting good at drawing. http://t.co/tsFCaZX
1capplegate,Why does everyone in LA look like they are on a reality show?
1capplegate,Did we ever find out why Norah Jones didn't call?
1capplegate,Toddler Crocs should have built in GPS.
1capplegate,The only time someone should drink a shot is never.
1capplegate,"""Simon says"" this, ""Simon says"" that.  Well Jim says Simon was quite the control freak."
1capplegate,Im not hungry.  I think I might be sick.
1capplegate,"Come see me live in Austin, SD, Temecula, Kingston, Morristown, MPLS, Buffalo, LA, STL, Vegas, Atlanta, Red Bank, MLK   http://t.co/OEi0m7h"
1capplegate,RT @jeanniegaffigan: Jim Gaffigan: Best Dad Ever - The Daily Beast http://t.co/hOcxWPX via @thedailybeast
1capplegate,"By the way these aren't skinny jeans, I'm just fat."
1capplegate,"I LOVE THAT GUY ""Jim Gaffigan Talks Fatherhood on 'Fallon' (VIDEO) http://t.co/xz07UFW via @huffingtonpost"
1capplegate,Babies have it good.  I'd give up the ability to talk if I could wear a diaper and have someone smile at me while they change it.
1capplegate,"I just want to go on the record that what Dick Cheney said about me in his new book is FALSE!  I dont lie and fabricate things, Dick."
1capplegate,"Boy, when they legalize pot there's gonna be the exact same people smoking pot."
1capplegate,Hey sweet old ladies that give unsolicited advice on how I should raise my children: Suck it.
1capplegate,"Oooh @laughstub has VIP tickets to my Austin, SoCal, NJ, Mpls, ATL, Buffalo and Milw shows. http://t.co/IczfMFY"
1capplegate,"Hey Taco Bell, I know your food is disgusting but can you at least try to make it look edible in your commercials? Thanks."
1capplegate,I think the most impressive thing about FaceTime on my iPhone is that I never use it.
1capplegate,I wish just one musician would dress differently than I do.
1capplegate,"If your password is longer than 7 characters, you're a lunatic."
1capplegate,"Here's something you'll never hear, ""Oh cool, you have a pink lighter."""
1capplegate,"They should just rename vacations ""eating french fries""."
1capplegate,I totally got blown out in my Fantasy Hurricane  League.
1capplegate,Hey @aplusk that Hurricane Irene was the best episode of Punkd ever.
1capplegate,"Having kids has not made me any less cool.  Now if youll excuse me, I have to use the potty."
1capplegate,"""I want to drink a lot of vodka but I also want to look pretentious."" - Inventor of the Martini."
1capplegate,"By the way, that tweet you forgot would have received 100 stars on favstar."
1capplegate,Speaking of mandatory evacuation i just ate Indian food. #MandatorydiarrheaJokeaboutThemandatoryeevacuation
1capplegate,BREAKING: Hurricane Irene may be the most over-hyped storm ever.
1capplegate,It's so obvious The @WeatherChannel is pro hurricane.  Fair and balanced my ass.
1capplegate,"""The world is ending!"" - Everyone watching the @WeatherChannel"
1capplegate,"""Aannd...we'll never get to a map showing the path of Hurricane Irene."" - @WeatherChannel"
1capplegate,Any truth to the rumor that this Irene Hurricane was organized on twitter?  I hope not.
1capplegate,During a Hurricane the @weatherchannel becomes the kid with a pool in 8th grade.
1capplegate,Im in such better shape than my 2-month-old baby.  He can barely hold his head up. Pathetic.
1capplegate,I hope i get that Apple CEO job. #fingerscrossed
1capplegate,I hope those rebels dont hurt Gadhafi.  Just kidding.
1capplegate,"Come c me do my new hr + classics.  Nxt stops Austin, SD, Pechanga, Kingston, Morristown, Mpls, Buffalo, LA, STL, Vegas http://t.co/CnABhEl"
1capplegate,"Hey people who have the alarm noise as your ringtone, I'd like you to die."
1capplegate,I'm starting to regret naming my daughter Gadhafi.
1capplegate,"Hey who else is watching ""Keeping Up with the Gadhafis"" on CNN?"
1capplegate,Quick question.  Who gets all of Gadhafi's sunglasses?
1capplegate,At this point is there a reality show premise that's ever been turned down?
1capplegate,Thanks but I don't know if I want a $20 helicopter ride. http://t.co/rdkPvUQ
1capplegate,I like swimming with a sun shirt.  People always look at me like I fell in the pool.
1capplegate,Getting ready to break out my neon orange Speedo in Myrtle Beach.   http://t.co/diOhtBo
1capplegate,The dartboard  is just the myspace of the bar. http://t.co/QddT09x
1capplegate,"I need a shirt, but I also want to showcase how long my armpit hair is.  Every guy who has bought a tank top"
1capplegate,What does the corn in unicorn stand for?
1capplegate,"Dear Cheese, Last night was a mistake.  Maybe it was the wine but I acted impulsively and now Im feeling a lot of s... http://t.co/MedJHyq"
1capplegate,I think guys that wear Speedos should have to wear the bikini top too.
1capplegate,When do vampires have time to do sit ups?
1capplegate,Headed to Myrtle Beach for my show on Friday.  Anyone know if there is a beach there? http://t.co/I4dQbkY
1capplegate,It's hard to take an airline seriously when the boarding pass looks like a McDonald's receipt. http://t.co/yHvPKQn
1capplegate,The punishment for terrorists should be standing in airport security lines.
1capplegate,Im glad eating tons of cheese makes you feel sick so you stop.  Otherwise I'd be dead right now.
1capplegate,"Dear radio stations, instead of 40 minutes of commercial free music, how about 5 minutes of good music?"
1capplegate,When I die bury me here. http://t.co/ofPSFOr
1capplegate,All this road construction makes it very difficult to Twitter while I'm driving.
1capplegate,I'd really appreciate it if they'd hold off on all road construction while I'm driving. Thanks.
1capplegate,Is it pronounced @Favstar or Obsessing on the popularity of your own tweets?
1capplegate,Is it pronounced @Favstar or @Favstar?
1capplegate,"If your movie is called Final Destination 5, its probably not the final destination."
1capplegate,The Wisconsin State Fair should just be called The Wisconsin Food Fair. http://say.ly/KPUAcG
1capplegate,When you think about it The Very Hungry Caterpillar probably had a serious eating disorder.  Emotional eating.  I've been there.
1capplegate,"I'd like to congratulate the Greeks on winning the yogurt wars.  The economic wars, not so much."
1capplegate,"First we give them a day, next thing you know they'll be asking to drive.  #nationalwomansday"
1capplegate,"It makes sense that today was national women's day, cause it was kind of a bitch."
1capplegate,"If you love your extended family like I love mine, youll ditch them and come see me perform in Las Vegas Thanksgiving. http://say.ly/uiFzMX"
1capplegate,What exactly is the difference between waking up and being punched in the face?
1capplegate,Remember the couple in The Philippines that traded their kid for a karaoke machine? I wonder if it was a really nice karaoke machine.
1capplegate,"Hey Mitt Romney,  Ron Popeil called and wants his personality back."
1capplegate,I'm not even good at being self-effacing.
1capplegate,"Ask me about my Tempur-Pedic.  Then ask my wife why there are 4 kids in it every morning.  Now enough with your questions, I'm tired."
1capplegate,"Hey 2-year-olds, I know you love spaghetti but youre horrible at eating it."
1capplegate,Already feeling sick from the Amer. Coney Island Dog Ill be eating in DETROIT tomorrow. Also be eating/performing  http://say.ly/WcmySR
1capplegate,When you think about it there arent that many songs about rainbows.
1capplegate,I find reading poetry really inspires me to not read poetry..
1capplegate,I guess Ultimate Frisbee is easier to say than only team sport people play with a Frisbee.
1capplegate,"Hey @michaelianblack Do u think people send @Mentions to friends with more followers just to get followers? Rude, right? PLZ REPLY"
1capplegate,Trying to get my 6-week-old baby to smile and failing reminds me of my first date with @jeanniegaffigan
1capplegate,"Now that the debt ceiling issue is over, I wonder what the next national crisis I dont understand will be."
1capplegate,My 6-week old baby reminds me of my father.  He blankly stares at me when hes not screaming.
1capplegate,"Hey, whatever happened to my painting of the blue vase I gave you for your birthday? http://say.ly/odwybE"
1capplegate,Last night I explained to my 5 year old son that the dark is not nearly as scary as your wife bringing home a pregnancy test.
1capplegate,Why didnt they just name this place You Wouldnt Believe What We Charge For Yogurt.? http://say.ly/KbRxXe
1capplegate,"Detroit, NW Indiana, Myrtle Bch & AUSTIN are next stops. Come see my NEW hr of stand up + classics. Tour dates -&gt;  http://say.ly/JhExK6"
1capplegate,Im starting to think I might bail on my modeling career.
1capplegate,If I knew being lazy and uncompromising qualified me to be a Congressman I would have run a long time ago.
1capplegate,"Check out this video I did for the good people @FeedingAmerica to help #barhunger #spon
WARNING:  Im in my underwear.
 http://say.ly/HCPxyb"
1capplegate,I cant wait to see that Smurf movie - Nobody
1capplegate,People treat you differently when youre holding a baby.  Especially in strip clubs.
1capplegate,At what point are we going to admit that all toddler artwork is horrible?
1capplegate,"Other people are weird, right?"
1capplegate,Maybe if they turned the economy off and then turned it back on it might run better. Works for my cable.
1capplegate,8 years ago today I married @jeanniegaffigan. Her mistake is my biggest accomplishment.
1capplegate,The bad news is we dont have any ice cream in the house.  The good news is I just ate a pint of ice cream.
1capplegate,I have to give it up to myself for being so humble.
1capplegate,"I believe Khalil Gibran said it best: ""There is no acceptable apology for the forgotten flush."""
1capplegate,Why don't they just make newborn clothes out of baby wipes?
1capplegate,Are Junior Mints the caviar or the turds of The York Peppermint Patty?
1capplegate,Waiting in line for an hour in 100 degree heat for the Dumbo rides makes you wonder who's the real Dumbo.
1capplegate,"""How about a go-kart that brings you into a dark room with a picture of Winnie-the-pooh?"" - inventor of amusement park rides from 1970"
1capplegate,The good news is that I just saw a giraffe.  The bad news is that it was giving me the finger.
1capplegate,"Map of Every Amusement Park:  Bum ride, bum ride, Churro stand, bum ride, the only reason someone goes to park, bum ride, Churro stand."
1capplegate,Shows tonight Friday in Clearwater and Orlando Saturday.  Complete tour dates here -&gt; http://tinyurl.com/6lnykv http://say.ly/goeweo
1capplegate,So far my favorite ride at Disney was air conditioned bus to the hotel.  Well worth the wait.
1capplegate,This is from that episode when salad was on waterskis ready to jump http://say.ly/RAbvST
1capplegate,Epcot is just the United Nations of commercialism. http://say.ly/zQNvPN
1capplegate,Really the only people who should be allowed to cut in line are me.
1capplegate,I don't know what is more embarrassing the fact that I just bought a candy bar or that I paid $2 dollars for it.
1capplegate,Disney is the only place where you can walk around for 12 hours and still gain weight.
1capplegate,"Has there ever been a non-high person on this huge planet that thought ""it's a small world"" was a cool ride?"
1capplegate,"TYPING IN ALL CAPS MAKES SOMEONE LOOK INSANE, RIGHT?"
1capplegate,Isn't it about time for us to find out all hand sanitizers cause cancer?
1capplegate,Is the internet slow or is it just me?
1capplegate,Just changed my sons diaper.  I noticed his penis looks exactly like mine.  Except his is much bigger.
1capplegate,Bringing the 4 kids to Orlando this wk.  Any advice or suggestions?  Heard theres this place Disney down there.  Anyone heard of that?
1capplegate,"Boy, this being unfunny for a cause is so easy. I think I'm a natural."
1capplegate,Why I come Mara bar. http://say.ly/TnCvfz
1capplegate,"At Mars Bar.  Why you would care,  I don't know."
1capplegate,Opening in LA & NYC #SALVATIONBOULEVARD #PierceBrosnan #EdHarris #GregKinnear #jenniferconnelly @marisatomei & ME! http://say.ly/noFv2t
1capplegate,Hungers no joke.  No funny tweets this weekend from me to help #FeedingAmerica #BarHunger.  #spon http://say.ly/FGtuWC
1capplegate,Its a delight to eat dinner with my four children.  #paid
1capplegate,You ever walk behind someone who is walking so slow you have to hold yourself back from stabbing em?
1capplegate,Congrats to @D2DLTheMovie a comedian's documentary I was interviewed for. Help them make an Oscar run:  http://t.co/gBTmXMI
1capplegate,"Atlanta 2nd show on sale FRI http://t.co/DooYkpD  Complete Summer/Fall tour list including FL, IN, SC, TX, MN, SD, STL, LA & Vegas"
1capplegate,Probably what makes cooked green peppers so special is that they ruin the taste of any food they are in.
1capplegate,So parenting is all about wanting your child to burp for the first 3 months and then not wanting them to burp for the next 18 years?
1capplegate,Did anyone ever really want to keep up with Kardashians?
1capplegate,Why are there so many mirrors at health clubs? I know what I look like. Thats why Im going to the gym. Or should be going to the gym.
1capplegate,Sometimes I feel unqualified to be a parent and I call those times being awake.
1capplegate,"Real Housewives is just professional wrestling for women, right?"
1capplegate,"We're breaking from Sudan. New name, um... NOT Sudan? Sudan 2: Electric Boogaloo? Sudan Sudan? The Artist Formerly Knows as Sudan?"
1capplegate,There are too many moments in my life when I feel like those ghetto kids at the fancy restaurant from that The Wire episode.
1capplegate,"Dear @WholeFoods,
Great cake.  Horrible spelling. 
Love, gim http://say.ly/tFctG0"
1capplegate,Birthday cakes are just magnets for little kids fingers.
1capplegate,I hope I get a new birthday suit today. Mine has gotten kind of baggy. Maybe a different color or some color might help.
1capplegate,"Yes, other people have the same birthday as me. These are my understudies. Their birthdays are important, just not as important as mine."
1capplegate,All the people on the streets of NYC are setting me up for a big surprise birthday party. They are totally acting like its not my birthday.
1capplegate,"In honor of my birthday, Im giving everyone access to my special pre-sale for Morristown, NJ! & all other shows http://say.ly/Pgcty1"
1capplegate,"Your warm wishes have made this the best birthday Ive had all year.  

( @BarackObama try a landline.)"
1capplegate,Hey @BarackObama its 25 minutes into my birthday.  Still no call.  Your phone broken again?
1capplegate,16 minutes into my birthday.  Still haven't gotten any presents.
1capplegate,Its my birthday in two days. For Fathers day @jeanniegaffigan gave me a baby.  Hows she going to top that?  #birthdayalert
1capplegate,"I dont want to get all Freudian but my 15-day-old baby has a really strange attachment to my wife, @jeanniegaffigan.  #Oedipus"
1capplegate,Im starting to think the Eskimos dont even make these.  #EthnicFood http://say.ly/UvotjK
1capplegate,"Why is it whenever someone says, If you know what I mean I always wish I didnt.  If you know what I mean."
1capplegate,News coverage of hot dog eating contests reminds me I need to renew subscription to NPR.
1capplegate,That guy at noreply@postmaster.twitter.com never responds to my emails. Rude!
1capplegate,"At the worst 4th of July party.  Only one hot chick and a bunch of screaming kids. Oh wait, Im at home."
1capplegate,"Those Founding Fathers may have been brilliant, but they probably smelled pretty bad.  #WigInJuly?"
1capplegate,Its the 4th of July!  Sad that to non-Americans today is just the 4th of July.
1capplegate,Wanted to take my 14-day old baby tubing the other day.  @jeanniegaffigan said no.  I guess were going to coddle him.
1capplegate,My 5-year-old is an excruciatingly slow walker but at least he complains a lot.
1capplegate,"Just remember there's no ""i"" in ""beaten to death joke formula""."
1capplegate,That Central Park gig was fun until after when they made me clean the whole damn park!
