ashleesimpson,"""Shine bright like a diamond!"" US fans, we just hit 10 million copies over on your side of the pond! Thanks :) xx"
ashleesimpson,Ella Henderson on X Factor is absolutely incredible! I LOVE her!! Good luck xx
ashleesimpson,"Adele's new James Bond theme, Skyfall, is out now. Listen to and buy Skyfall here: http://t.co/XWKFAFJS"
ashleesimpson,"Adele's new James Bond theme, Skyfall, will premiere at 0:07hr BST on Friday 5th October. Pre-order now at http://t.co/XWKFAFJS"
ashleesimpson,http://t.co/LXzCxAev
ashleesimpson,I'm not married...Zzzzzzz
ashleesimpson,Do something good for someone #whd2012 http://t.co/WqGs26nv
ashleesimpson,"I LOVED the Olympics! Thank you everyone for making it so great! Wish I was there but I'm not, enjoy x"
ashleesimpson,"Go on girls! Congrats Helen and Heather, sooo happy for you! Our 1st gold medalists :)"
ashleesimpson,Frank Ocean your so so special. Congratulations on such a STUNNING album x
ashleesimpson,Coldplay are magical!! X http://t.co/Hc8cfSMX
ashleesimpson,Tune in to NBC this Sunday June 3 at 8 PM ET for Adele Live in London with Matt Lauer
ashleesimpson,"Wow! Thank you @Billboard You've been amazing all year, thanks so much for the support. Yours always x"
ashleesimpson,Loving my Ivor! Thank you so much x
ashleesimpson,http://t.co/bIVTOWTP
ashleesimpson,"Dont miss ""Adele Live In London with Matt Lauer"" airing on NBC Sunday, June 3 at 8 PM ET http://t.co/7zCjJ6Uz"
ashleesimpson,Get a sneak peek of Adele Live in London with Matt Lauer now on @todayshow  http://t.co/0WYHL9YC
ashleesimpson,"Had a lovely birthday, thanks for all the messages. I got a blossom tree! I didn't get a cake from Rih Rih &amp; I'm not engaged, blah blah x"
ashleesimpson,thank you Canada for my Juno award :) xx
ashleesimpson,check her out! shes a lot of fun and works bloody hard http://t.co/DAfu7b6E
ashleesimpson,"Thanks so much to the Echo Awards &amp; Germany for all your support, delighted to have won best album &amp; international female. x"
ashleesimpson,Even Louie wants you to get involved! #cleanwaterforall http://t.co/C3qizBCH
ashleesimpson,Get it trending you lot #cleanwaterforall
ashleesimpson,TODAY IS WORLD WATER DAY. A DAY DEDICATED TO THE BILLION PEOPLE WITHOUT CLEAN WATER! FOLLOW @drop4drop AND THEIR MISSION #cleanwaterforall x
ashleesimpson,"Adeles brand new Android app is available now, absolutely free, from the Android Market: http://t.co/KtPWx3V0"
ashleesimpson,Someone Like You is nominated for Best British Single at the @BRIT_Awards. If you like you can vote for it here: http://t.co/osc6rVCF
ashleesimpson,"Ima be, Ima be singing at the Grammys. It's been so long I started to forget I was a singer! I can't wait, speak soon xx"
ashleesimpson,A short blog... http://t.co/rA3Matf4
ashleesimpson,Looking forward to @theGRAMMYs on Feb 12! #WeAreMusic  http://t.co/pv9vvJ9F
ashleesimpson,"fucking happy, thank you for the nods xx"
ashleesimpson,Just met a baby white tiger!! Happy new year y'all xx http://t.co/rovMNmLd
ashleesimpson,Back on the grind. Hair and make up did. Merry Christmas! Axx http://t.co/kbBE0A1e
ashleesimpson,Girls nite in with my best friend @lauradockrill. We got new hats 2day! X http://t.co/us3nPISx
ashleesimpson,How incredible is she http://t.co/nHTCfwUD x
ashleesimpson,"F*ck me that was quick!ThankU! I'm in bed,watchin Gladiator,eatin an apple. Heres a pic of me&Queen B last wk in NYC!X http://t.co/fw5NLzOE"
ashleesimpson,Right! Its me! I will start tweeting if 10k of u start following @drop4drop &their trip to India this wk. Its a wonderful charity. Go! A xxx
ashleesimpson,Adele has been nominated for 6 Grammy Awards including Record of the Year : Read More http://t.co/DlqCOgLo
ashleesimpson,"Adele's ""Live At The Royal Albert Hall"" concert film is out now on DVD/Blu-ray http://t.co/JhXwRBO9"
ashleesimpson,"RT @VEVO: Join us Monday, 11/28 for @OfficialAdele: Special Performances Live from The Royal Albert Hall: http://t.co/azIgvqwN #Adele"
ashleesimpson,I Love This... Read more from Adele on her new blog post here: http://t.co/sYRdgj2y
ashleesimpson,Hello!... Read more from Adele on her new blog post here: http://t.co/pD6D54DN
ashleesimpson,Adele has been nominated for 4 #PeoplesChoice Awards: RT Adele #femaleartist #PeoplesChoice to cast your vote!
ashleesimpson,"RT @GleeTheMusic : Check out Glee's video for @OfficialAdele's ""Rumour Has It/Someone Like You."" http://t.co/EwWfuUYP"
ashleesimpson,Apply for free tickets to cinema screenings of Live At The Royal Albert Hall in 26 cities worldwide & watch the trailer http://t.co/e8lGahYy
ashleesimpson,"Adele has been nominated for ""Artist of the Year"" at the 2011 @OfficialAMAs. You can vote here: http://t.co/7FiXhBTF #AMAs"
ashleesimpson,"With deep regret, Adele has been forced to cancel her remaining live dates and promotional appearances in 2011. http://t.co/aUYdbNXe"
ashleesimpson,Adele 'Live At The Royal Albert Hall' - Blu-Ray/DVD and CD - Pre-Order Now: http://t.co/x95Gjg3p
ashleesimpson,Adele forced to cancel US tour dates http://t.co/Rrcpd8gk
ashleesimpson,Adele is nominated for four awards at this years MTV Europe Music Awards. Voting is now open: http://t.co/KUmsqVxw
ashleesimpson,"""Someone Like You"" Official Video Premiere #SomeoneLikeYou http://t.co/9TLmMGjy"
ashleesimpson,"Visit @MTV (US) & @VEVO tonight at 7:56 PM ET for the official ""Someone Like You"" video premiere! Get a first look here http://t.co/Zouybtek"
ashleesimpson,"Additional tickets available for 10/18 show at Cynthia Woods Mitchell Pavilion in Houston, TX http://t.co/4812sJ9W"
ashleesimpson,"Thrilled to announce that the new video for ""Someone Like You"" will premiere on @MTV & @VEVO Thurs 9/29 at 7:56 EDT http://t.co/VZYb38uk"
ashleesimpson,Rescheduled tour dates announced. Read more at:  http://t.co/sUuKPjpP
ashleesimpson,"Adeles brand new official iPhone app is available now, absolutely free, from the Apple App Store: http://t.co/PHOpeCb"
ashleesimpson,Adele Resumes UK Tour: http://t.co/zBvnDEF
ashleesimpson,Wolverhampton shows postponed: http://t.co/NcJRjkE
ashleesimpson,I'm Still Not Well Enough... Read more from Adele in her latest blog post here: http://t.co/ue78JMG
ashleesimpson,"Illness forces Adele to postpone her show tonight in Cardiff 7/9 & tomorrow in Blackpool, 8/9. Full statement here: http://t.co/4efJCzJ"
ashleesimpson,The First 2 Shows... Read more from Adele on her new blog post here: http://t.co/4SFD6k5
ashleesimpson,Illness forces Adele to postpone the first 2 shows of her September UK Tour: http://t.co/rF8Vkhg
ashleesimpson,Adele will be a guest on The Jonathan Ross Show this Saturday. Tune into ITV1 at 9:45pm for chat with @wossy and more...
ashleesimpson,Send me some photos!... Read more from Adele on her new blog post here: http://t.co/0OaLIL1
ashleesimpson,"Watch ""Someone Like You"" performed live at the @MTV #VMA http://t.co/UPUqBUD"
ashleesimpson,AMY FLIES IN PARADISE X... Read more from Adele on her new blog post here:  http://t.co/faTtomY
ashleesimpson,VMAS!?... Read more from Adele on her new blog post here: http://t.co/ljabwuA
ashleesimpson,MERCURY!... Read more from Adele on her new blog post here: http://t.co/Tq7Pc3a
ashleesimpson,"In case you missed it, ADELE's #itunesfestival EP is available now on @iTunes http://t.co/jMiASdh"
ashleesimpson,"Last night, ADELE played the #itunesfestival in London. You can watch the whole show here: http://t.co/49aYist"
ashleesimpson,"ADELE is playing at #itunesfestival in London tonight! Watch live on your computer, iPad, iPhone or iPod touch: http://t.co/dPh2wsJ"
ashleesimpson,Set Fire To The Rain Club Remixes are available on iTunes UK now... http://t.co/V4uAp8a
ashleesimpson,BON IVER... Read more from Adele on her new blog post here: http://t.co/J795S6q
ashleesimpson,Adeles North American tour rescheduled with some newly added shows - Read more here: http://t.co/fl0fq9N
ashleesimpson,ON THE MEND... Read more from Adele on her new blog post here: http://t.co/FtPSM5X
ashleesimpson,Adele announcement regarding the cancellation of remaining US tour dates http://bit.ly/k2T4kW
ashleesimpson,Announcement regarding some upcoming tour dates http://bit.ly/j4pwlT
ashleesimpson,THE CIVIL WARS... Read more from Adele on her new blog post here: http://bit.ly/iY0e4g
ashleesimpson,UNORTHODOX... Read more from Adele on her new blog post here: http://bit.ly/fmTOCu
ashleesimpson,YESSSSSS!... Read more from Adele on her new blog post here: http://bit.ly/elmq8D
ashleesimpson,"Check out the latest episode of ""Tea Time"" & find out some of my favorite music moments http://bit.ly/fzArwL"
ashleesimpson,Adele celebrates @RecordStoreDay on April 16 in the U.S. with a Limited-Edition 10 Vinyl! More info here: http://bit.ly/gLcr7F
ashleesimpson,Adele's Webstore Launches Today - http://bit.ly/adelestore
ashleesimpson,"Download Adele's ""Make You Feel My Love"" on @iTunesMusic #SongsForJapan. Proceeds support Japan's recovery. http://facebook.itunes.com/1h1"
ashleesimpson,Adele will perform at the Greek Theatre in Los Angeles on June 6th. Pre-sale tomorrow at 10am PT here: http://adeletickets.sandbag.uk.com/
ashleesimpson,IMPOSSIBLE... Read more from Adele on her new blog post here: http://bit.ly/adeleimpossible
ashleesimpson,"RT @VH1: Watch @OfficialAdele's #VH1Unplugged performance AGAIN, online exclusives and meet&greet footage right here: http://ow.ly/47zpd"
ashleesimpson,Tune in to VH1.com now to watch Adele's Unplugged performance! The show also airs on @VH1 on March 4 at 11/10c. http://on.vh1.com/eAnCZu
ashleesimpson,"RT @VH1: Sneak @OfficialAdele's #VH1Unplugged performance of ""Turning Tables"" http://ow.ly/46poj Full show premieres online TOMRW at 7/6c!"
ashleesimpson,"RT @amazonmp3: Free for a limited time: A version of @OfficialAdele's ""Someone Like You"" performed live in her home http://amzn.to/fUi2WH"
ashleesimpson,Catch Adele on Chelsea Lately with @ChelseaHandler tonight on E! Tune in at 11pm ET. Check your local listings for air times.
ashleesimpson,"Pick up Adele's new album '21' at @iTunesMusic in the U.S. and get the bonus track ""I Found A Boy"" http://bit.ly/eWHef1"
ashleesimpson,Tune in to the CBS Early Show tomorrow morning 2/25 to see Adele perform live! 7-9am on CBS.
ashleesimpson,Don't miss Adele performing live on @JimmyKimmel tonight on ABC at 12am/11c!
ashleesimpson,Catch Adele performing live on @TheEllenShow tomorrow Feb. 24th! Check local listings for air times.
ashleesimpson,Watch the entire archived performance from Adele's Live on Letterman show here: http://bit.ly/dTSb7y
ashleesimpson,Adele's new album 21 is out today in the US! Pick up a copy @iTunes (http://bit.ly/eWHef1) or @AmazonMP3 (http://amzn.to/hVF2gw). #Adele21
ashleesimpson,"RT @VEVO: Just a li'l reminder that @OfficialAdele is LIVE ON LETTERMAN tonight, streaming on VEVO.com. 9PM Eastern/6PM in the West."
ashleesimpson,"Speechless!... Read more from Adele on her new blog post here:
http://bit.ly/adelespeechless"
ashleesimpson,RT @aolmusic: Don't miss Adele performing songs from '21' and an old favorite in our studio. http://aol.it/gu8ZSp
ashleesimpson,You can now download Adele's performance of 'Someone Like You' at the Brit awards directly from iTunes. http://bit.ly/efUs6l
ashleesimpson,US Fans: catch Adele performing on The Today Show tomorrow morning! Tune in at 7:00am EST on NBC - check your local listings.
ashleesimpson,You can now download Adele's performance of 'Someone Like You' at the Brit awards directly from iTunes. http://bit.ly/efUs6l
ashleesimpson,"RT @VH1: SNEAK: @OfficialAdele's #VH1Unplugged performance of ""Natural Woman"" by Aretha Franklin http://ow.ly/3XP3f"
ashleesimpson,September 2011 UK tour dates announced! Head over to Adele.tv for more details: http://bit.ly/adeleseptemberuktour
ashleesimpson,"Tickets for Adele's North American Tour go on sale Friday, 2/11. Check local markets for specific on-sale times. http://bit.ly/fhArdp"
ashleesimpson,Pre-sale tickets for Adele's upcoming North American tour are on sale now! Click here to get your tickets:  http://bit.ly/dUm2Vp
ashleesimpson,"D.C... Read more from Adele on her new blog post here:
http://bit.ly/adeledc"
ashleesimpson,Adele's new album '21' is streaming in full starting today at @NPRMusic! Listen here: http://n.pr/hQ8yO1
ashleesimpson,North American tour dates announced! Head over to Adele.tv for more details: http://bit.ly/guU0LC
ashleesimpson,"RT @nprmusic: First Listen: @OfficialAdele, '21.' The stories from the singer are familiar. But her voice is a force of nature. http://n ..."
ashleesimpson,"RT @ColumbiaRecords: In case u missed @OfficialAdele performing on @WXPNfm this afternoon, u can listen to the entire live show here htt ..."
ashleesimpson,"RT @FollowCMT: She shared the stage w/ @DariusRucker at Artist of the Year. Now see Adele's video, ""Don't You Remember (Live at Largo)."" ..."
ashleesimpson,Tune in to WXPN today at 12pm EST to listen to a live broadcast of Adele's performance at World Cafe Live! Listen here: http://bit.ly/hwW13h
ashleesimpson,RT @VH1: BIG NEWS! We'll be tweeting from the @OfficialAdele #Unplugged shoot tomrw! RT & follow VH1 for live tweets & twitpics! http:// ...
ashleesimpson,Adele will be playing the iTunes Festival in London on the 7th July. You can win a pair of tickets to the show here: http://bit.ly/i7e4DU
ashleesimpson,My Louie... Read more from Adele on her new blog post here: http://bit.ly/adelemylouie
ashleesimpson,US Fans: Counting down to the release of '21' we're launching a new feature each day at Adele.tv: http://bit.ly/Adele21 #21DaysOfAdele
ashleesimpson,"""Rolling In The Deep"" (Jamie xx Shuffle). Stream the song on Ping now. Available on iTunes (U.S.) 2/1. http://t.co/Mv4nxhF #iTunes"
ashleesimpson,"Want to come to a taping of VH1's Adele: Unplugged in NYC next week? Email VH1Audience@GothamCasting.com w/ name, age, city. Subject ""Adele"""
ashleesimpson,Bring! Bring! Read more from Adele on her new blog post here: http://bit.ly/adelebringbring
ashleesimpson,"RT @BBCR1: Wow, Adele is sounding incredible in the Live Lounge. Watch it live right here: http://www.bbc.co.uk/radio1/"
ashleesimpson,"Watch again: Adele at The Tabernacle, London. http://bit.ly/e6qNSb"
ashleesimpson,Thanks so much to everyone who came down last night... Read more from @OfficialAdele on her new blog post here: http://bit.ly/adelethankyou
ashleesimpson,Adele webcast is live! Watch here: http://www.adele.tv/ #Adele21
ashleesimpson,RT @XLRECORDINGS: Tonight's Adele show will be webcast live from 20:30 (GMT) at http://adele.tv. We will be 'live tweeting'. Join us! #A ...
ashleesimpson,"21, the new album by Adele, is OUT NOW in the UK, Europe, Japan and Australasia: http://bit.ly/adeleoutnow #adele21"
ashleesimpson,"To celebrate her new album '21', Adele is webcasting her show from London on Monday - visit http://bit.ly/adelewebcast for more info"
ashleesimpson,Happy New Year To You And Yours! Read more from @OfficialAdele on her new blog post here: http://bit.ly/hu4MOT
ashleesimpson,"If you're in the UK, Rolling In The Deep is OUT NOW on iTunes: http://bit.ly/rollinginthedeepitunes"
ashleesimpson,Check out Adele's interview with MSN UK where she talks about the making of 21. Part 1: http://bit.ly/fVmeeN & Part 2: http://bit.ly/fgPPoG
ashleesimpson,"Head over to iTunes to pre-order the new single Rolling In The Deep, released on Sunday in the UK: http://bit.ly/rollinginthedeepitunes"
ashleesimpson,Head over to @MSN to watch an intimate performance of 'Someone Like You' shot live from Adele's home in London! http://bit.ly/g57Yf5
ashleesimpson,"RT @XLRECORDINGS: Here, in all its (hometown) glory, is the full version of Jamie xxs huge Rolling In The Deep remix for @OfficialAdele ..."
ashleesimpson,RT @SpinnerTweet: Check out Adele's defining musical moment: http://aol.it/g9j9gw
ashleesimpson,"Watch Adele's ""Rolling In The Deep"" (Live Acoustic) performance now on Ping! Click here to watch: http://bit.ly/gEBYUQ"
ashleesimpson,RT @XLRECORDINGS: #gifmas continues. South London swag from Adele: http://bit.ly/eVXkq9
ashleesimpson,"Watch Adele perform ""Rolling In The Deep"" acoustic on a rooftop in Hollywood here: http://bit.ly/fV05Kh"
ashleesimpson,Check out Adele's interview with @PerezHilton here: http://bit.ly/i2KM8l
ashleesimpson,Adele will be playing across Europe and the UK in Spring next year. Go to her website for the full info http://bit.ly/adelespringtour
ashleesimpson,Have you read Adele's latest blog yet? Check it out over at Adele.tv here: http://bit.ly/hQWTgJ
ashleesimpson,RT @XLRECORDINGS: CONTEST: Count the glasses in @OfficialAdele's new video & win our undying admiration. http://bit.ly/hhdo4Q (Please do ...
ashleesimpson,"RT @VH1: VIDEO PREMIERE: ""Rolling In The Deep"" by Adele http://ow.ly/3miJ0 @officialadele @VH1Top20 #yououghtaknow"
ashleesimpson,Watch the official video for Rolling in the Deep at @VEVO now! http://www.youtube.com/watch?v=rYEDA3JcQqw
ashleesimpson,Check out a new blog from Adele over at her website! http://bit.ly/hQWTgJ
ashleesimpson,Watch Adele's @VEVO ASK:REPLY feature where she answers questions direct from the fans! See if she answered yours here: http://bit.ly/f3A52u
ashleesimpson,"The official video for ""Rolling in the Deep"" is now at iTunes! Watch the video and download the song here: http://bit.ly/fKP3VW"
ashleesimpson,Watch my CMT performance here! @ladyantebellum http://bit.ly/eHtmuF
ashleesimpson,RT @TheEllenShow: Thanks @OfficialAdele for premiering your new song Rolling in the Deep just for us. Your voice is absolutely amazing ...
ashleesimpson,RT @ColumbiaRecords: Be sure to check out Grammy award winner Adele @OfficialAdele performing her new single #RollingInTheDeep on @TheEl ...
ashleesimpson,RT @ColumbiaRecords: NEWS: Adele @OfficialAdele is set to perform @LadyAntebellum 's hit #NeedYouNow TONIGHT @ 8PM for CMT's #ArtistofTh ...
ashleesimpson,Tune in to @FollowCMT 'Artists of the Year' tomorrow 12/3 at 8pm ET to see @OfficialAdele perform a special tribute. http://bit.ly/adelecmt
ashleesimpson,"Tune in to @TheEllenShow tomorrow 12/3 to see Adele perform ""Rolling In The Deep"" live! Check local listings: http://ellen.warnerbros.com/"
ashleesimpson,Adele's '21' is now available for pre-order in the US! Get it @iTunesMusic or @Amazon here: http://www.adele.tv/21/
ashleesimpson,"Watch Adele perform a brand new song ""Someone Like You"" live on Later... With Jools Holland: http://bit.ly/adelejools"
ashleesimpson,"RT @XLRECORDINGS: Hear the BRAND NEW ADELE SONG, 'Rolling In The Deep' here: http://bit.ly/bepa33 ... features exclusive studio footage  ..."
ashleesimpson,"Listen to a new song ""Rolling In The Deep"" from Adele's forthcoming album '21'! http://bit.ly/adeleritd"
ashleesimpson,Hear two new songs next week! Read more from Adele on her new blog post here: http://bit.ly/adeleblog2
ashleesimpson,RT @XLRECORDINGS: Adele announced details of her forthcoming album '21' & new single 'Rolling In The Deep' - more details on her blog ht ...
ashleesimpson,RT @ColumbiaRecords: NEWS: Adele @OfficialAdele has a new blog at http://www.adele.tv/. check the blog TODAY for a special announcement  ...
ashleesimpson,Head over to Adele's newly re-designed website to read a new blog post with details about her upcoming album! http://bit.ly/abMOzO
ashleesimpson,"Adele has a new blog up at http://www.adele.tv/. Stay tuned to the blog on Tuesday, November 2 at 00:00 GMT for a special announcement!"
ashleesimpson,Adele has a new blog up at her website. Check it out here: http://bit.ly/adeleblog1
ashleesimpson,RT @SpinnerTweet: Adele just graced our office and floored the entire staff with music from her upcoming album. Get excited!  http://yfr ...
ashleesimpson,Adele fans! Head over to @VEVO's Facebook page to submit questions for Adele to answer! http://www.facebook.com/VEVO
ashleesimpson,"Hemos desactivado temporalmente la funcin de ""A Quin Seguir"" (enlace en ingls): http://t.co/j3UkbtY"
ashleesimpson,"el significado de las palabras, una historia argentina: http://t.co/vCse5Ca"
ashleesimpson,RT @ayuda: Hemos resuelto el problema con la raya/franja negra en la parte inferior de las imgenes. Para corregir tu avatar: http://t.c ...
ashleesimpson,"Gracias, Buenos Aires!  RT @twittbsas Cmo llegar a TwittBaires5 http://t.co/R7mhU77 #TWBA5"
ashleesimpson,"""La evolucin de nuestro ecosistema"" - post de @Ev, CEO de Twitter. http://t.co/NBIEH3S"
ashleesimpson,Aplicaciones de Twitter y OAuth (post en ingls): http://t.co/xiOWsat
ashleesimpson,RT @twittermobile: Los clientes de Digicel en El Salvador ya pueden usar Twitter por SMS - ahora puedes enviar y recibir tweets!  Envia ...
ashleesimpson,RT @G_Obieta Porqu Seguimos a Empresas en Twitter? (infografa) http://t.co/s4WjjFh
ashleesimpson,Miss Universo en Twitter @TheRealMissU
ashleesimpson,"RT @ayuda: Las @menciones estn temporalmente ""congeladas."" Gracias por su paciencia."
ashleesimpson,No te gustan los ceros? A nosotros tampoco.  Es por eso que estamos trabajando en el problema con los contadores de seguidos y seguidores.
ashleesimpson,Listas y contador de tweets han sido desactivados temporalmente. Gracias por su paciencia!
ashleesimpson,Escuchando la msica de @cerati.  Fuerza.  #MusicMonday
ashleesimpson,"RT @laura: Hablas espaol, vives en los E.E.U.U. y quieres trabajar en Twitter? http://bit.ly/anwVDW (cc @jointheflock)"
ashleesimpson,Presiona nuestro Botn de Twittear! http://t.co/HcGWcuy
ashleesimpson,"En Argentina, Twitter cambia su cara por el Da del Nio: http://t.co/dtveuHp"
ashleesimpson,RT @ayuda: Por qu Twitter pide confirmacin de correo electrnico?  http://bit.ly/awJICv
ashleesimpson,Twitter para iPhone ahora en en espaol! Descarga la aplicacin en la App Store. #mircolesdeaplicaciones #appwednesday
ashleesimpson,Quieres trabajar en @twitter? Sabes que s. Este vdeo te har desearlo an ms http://t.co/CgpikSv  (cc @jointheflock)
ashleesimpson,Blog: Descubre a quin seguir en Twitter http://t.co/LSLaS3v
ashleesimpson,Mi #FF es para @hope140 -una iniciativa de Twitter para ayudar a ONGs a cambiar el mundo.
ashleesimpson,"RT @patxilopez: Desde el corazn de twitter. De la mano de Laura, conociendo a los que hacen posible que nos conozcamos en la red. http: ..."
ashleesimpson,Tuenti integrar Twitter: http://t.co/z5jYAvO (va @elmundoes)
ashleesimpson,RT @Arturo_Sarukhan: En oficinas de Twitter discutiendo su importancia como instrumento de diplomacia publica e interaccion para relacio ...
ashleesimpson,"Blog de Twitter en espaol: ""Fiabilidad""  http://t.co/haxFDUI"
ashleesimpson,"RT @ponchohd: Upa! creo que el da del amigo aplica en varios lados de Latinoamrica.
Felicidades por el da del amigo a todos! Sin impo ..."
ashleesimpson,Felicidades a nuestros usuarios colombianos por el bicentenario de su independencia!
ashleesimpson,Alguna vez has ido a un tweetup genial? Mndanos una respuesta con los detalles y el hashtag #tweetupespaol
ashleesimpson,Tenemos varios problemas con nuestro sitio.  Para ms informacin (en ingls): http://t.co/1JRXPXy
ashleesimpson,Blog: Copa Mundial 2010 y Twitter http://t.co/MaVhKjU (infografas de @miguelrios)
ashleesimpson,RT @PremiosJuventud: Todos pongan #PJ2010 en sus tweets! Escogere a varias personas al azar para hacerles RT!
ashleesimpson,RT @Carles5puyol: Gran ambiente en la rua!!orgulloso de ver a tanta gente feliz. http://twitpic.com/24qkg5
ashleesimpson,Qu ests escuchando en este momento?  Pon el hashtag (smbolo de gato) #MusicMonday  en tu tweet y comparte con otros usuarios en Twitter!
ashleesimpson,Causa admiracin en Twitter exactitud del Pulpo Paul http://t.co/VMqHV4h
ashleesimpson,Espaa #esp vs Alemania #ger. Un replay de la Eurocopa 2008! #worldcup
ashleesimpson,"RT @ayuda: Dos artculos interesantes sobre SMS y Twitter: ""Preguntas frecuentes""- http://bit.ly/aBfvXa y ""Nmeros de telfono"" - http:/ ..."
ashleesimpson,Usuarios de Movistar Argentina ahora pueden twittear y recibir tweets va SMS. Envia 'START' al 89338 para empezar. http://t.co/pc7XFbz.
ashleesimpson,"RT @ayuda: Problemas subiendo tu imagen, foto o avatar?  http://bit.ly/aTRNLe"
ashleesimpson,Nuestra recomendacin para #appwednesday es para @recomendar.  #mircolesdeaplicaciones
ashleesimpson,Buena suerte a nuestros amigos de Paraguay #par y Espaa #esp
ashleesimpson,Se busca a Andres Felipe Ceballos (@_kant) http://t.co/lII355C desaparecido desde el 16 de Junio en Colombia. Por favor RT!
ashleesimpson,"Desarrolladores de Twitter, @bs y @mzsanford,  con los visitantes de hackspedition  http://t.co/GT6kZXC #Hxpn (va @pdp7)"
ashleesimpson,Video musical #yoconfieso de @JuanZelada http://t.co/EtaRrpN
ashleesimpson,Has recibido un email Twitter que dice que has sido reportado como spam? No hagas click en en enlace! Es una estafa ciberntica.
ashleesimpson,Lderes mundiales en Twitter: http://t.co/lvfthEX
ashleesimpson,Desde Rusia con amor (post en espaol) http://t.co/5C547kQ
ashleesimpson,Fuerza a nuestros amigos de #hon y #esp.
ashleesimpson,"Vamos, Chile! #chi"
ashleesimpson,"RT @ayuda Durante este fin de semana, estaremos procesando todas las cuentas con tweets desaparecidos.  Gracias por su paciencia."
ashleesimpson,Una semana llena de rcords (blog): http://t.co/en5i5Om
ashleesimpson,Llega la nueva publicidad a Twitter: http://t.co/LzKwfT0
ashleesimpson,"y claro, no se olviden las victorias de #arg, #chi y #uru! (cc @merodeador)"
ashleesimpson,#FRA  VS #MEX  - @twitter_fr VS @twitter_es -  Buena suerte!
ashleesimpson,La Copa Mundial y el Twitter Buzz de CNN: http://t.co/fhc083Z
ashleesimpson,Qu est pasando con Twitter? http://t.co/3kGugzt
ashleesimpson,Los Trending Topics han regresado a casa. Bienvenidos!
ashleesimpson,Los Trending Topics se fueron de vacaciones y regresarn cuando la ballena se vaya.  http://twt.tl/KT0jcFA
