NeymarJrSite,Sunrise (with @erickiskandar at Pulau Tengah) [pic]  http://t.co/nT46bDv0
NeymarJrSite,Thank you for watching pesbukers! Muaaaaa- Sekarang otw shooting the master!! Live! See me on RCTI 21.15pm 
NeymarJrSite,You should let me love you!
NeymarJrSite,Ga sabar nanti malam jadi juri paling cantik di The Master! See you on RCTI 9pm- muaaaaaa
NeymarJrSite,Menulis buku membuatku seperti terlahir kembali dan menjadi manusia baru! 
NeymarJrSite,"While you're in the other side of the world, I promise I will be good girl here. X your princess  Angels by The xx  http://t.co/sYGGiqEc"
NeymarJrSite,RT @jessiliciousss: Terimakasih utk @REVLONid sudah mengadakan kuis yg hadiahnya liburan ke Bali bareng @jess_iskandar :-)
NeymarJrSite,RT @jessiliciousss: Hai #Jessilicious ada kuiz nih. Pemenangnya akan berlibur ke Bali bareng @jess_iskandar yuk pantengin TL kita.
NeymarJrSite,Sun is set!  [pic]  http://t.co/alymLf47
NeymarJrSite,On the way meting- after this I just wanna go home and watching hangover! LOL
NeymarJrSite,Swimming this morning in a hot sun  [pic]  http://t.co/X0elpz0h
NeymarJrSite,happy birthday kakakku @erickiskandar hadiahnya mau apa?
NeymarJrSite,Happy birthday my dear @erickiskandar I love you! Come back soon to Indonesia and celebr... (w/ @erickiskandar) [pic]  http://t.co/Gam7Vd9g
NeymarJrSite,"Mamaaaaaaa, I miss someone so bad!! "
NeymarJrSite,Dinner meting!  [pic]  http://t.co/3e2YyoyL
NeymarJrSite,"mientras que, olvdate de perder! se dio cuenta de mi corazn slo hay t y yo."
NeymarJrSite,What a surprise! Look sexy tho! Fit!! X RT @olliedale: http://t.co/DBu4ZT7C
NeymarJrSite,Sweet dinner! Queenstown [pic]  http://t.co/jO00E0lQ
NeymarJrSite,"Selamat pagi, mau tau pendapatku tentang cowok dan Jakarta. Ada di buku pertamaku!"
NeymarJrSite,Keep your eyes on the stars and your feet on the ground!
NeymarJrSite,Paparazzi!! (at Hanggar Pancoran) [pic]  http://t.co/HkeQWioB
NeymarJrSite,"Yesterday will never come again, but you have today"
NeymarJrSite,Live each day as if it were your last
NeymarJrSite,Leave nothing for tomorrow that you can do today
NeymarJrSite,"Maaf, ternyata ulang tahun hitam putihnya ga live! Hehehe"
NeymarJrSite,Otw live Hitam Putih
NeymarJrSite,"In a friendship, because you share, the good times are double and the bad times are cut in half"
NeymarJrSite,"When you are surrounded by beauty, you look at life differently"
NeymarJrSite,"Malam ini live ulang tahun hitam putih, aku nyanyi apa ya? Masih bingung"
NeymarJrSite,"Queenstown, New Zealand [pic]  http://t.co/RxrdPdZM"
NeymarJrSite,Aku tulis dengan ringan dan ceria. Agar pembaca bukuku fresh setelah menikmatinya! Selamat pagi!
NeymarJrSite,"Besok di ulang tahun hitam putih, nyanyi lagu apa ya?"
NeymarJrSite,Hello Jakarta! Back to my busy life (at Soekarno-Hatta International Airport (CGK))  http://t.co/NmouyVPw
NeymarJrSite,See you soon Jakarta! Good bye Bangkok! Ga sabar nanti mau Pesbukers!! Muaaaa
NeymarJrSite,Lovely (at Lebua at The Tower 64floor. ) [pic]  http://t.co/VAJTsXoe
NeymarJrSite,Love this place (at Lebua at The Tower 64floor. ) [pic]  http://t.co/qyksyqhD
NeymarJrSite,Guess I have an ability to teleport! Flying back to Jakarta (at Suvarnabhumi Airport (BKK) )  http://t.co/oUnPW1UD
NeymarJrSite,When love takes over- I'll be flying to get over you! 55th floor Bangkok-Thailand (at Lebua State Tower) [pic]  http://t.co/4E11rVF3
NeymarJrSite,Lovely view with lovely person!  (at Breeze) [pic]  http://t.co/BeOWie4n
NeymarJrSite,What a lovely dinner! (at Breeze)  http://t.co/gNdqFdeA
NeymarJrSite,Stay in Bangkok for a night (at Lebua State Tower)  http://t.co/PonA5Iie
NeymarJrSite,Flight to bangkoksee you soon Singapore (at @fansofchangi)  http://t.co/ByNdkxSf
NeymarJrSite,"Getting ready for the voltz (with @erickiskandar, @geriazriel, and Almira at 1 River Valley Close)  http://t.co/upOhn9p5"
NeymarJrSite,Arriving!! Hello Singapore  (at @fansofchangi)  http://t.co/DXGU9SfO
NeymarJrSite,Hello Singapore!! (with @erickiskandar and Almira)
NeymarJrSite,Thank you for this beautiful trip @LuxuryNZ_ID @peppysiuly @quinnfarah New Zealand is heaven on earth!! Lovely
NeymarJrSite,Leaving Auckland long ride back to Singapore!! (at Auckland International Airport Check In)  http://t.co/tp7ffVLN
NeymarJrSite,Walking in heaven! http://t.co/QmNEyjEC
NeymarJrSite,"Me and @nickvonk at his shop! Bring me the ring before lunch time! LOL
http://t.co/q00VIgh9"
NeymarJrSite,Me and @quinnfarah (at Mt Eden Summit) [pic]  http://t.co/bLrBZBe2
NeymarJrSite,Lovely!! (at Mt Eden Summit) [pic]  http://t.co/mL9rKxvn
NeymarJrSite,"Beautiful, isn't it? (at Mt Eden Summit) [pic]  http://t.co/7xIpvXlg"
NeymarJrSite,"Alayers in Harley Davidson! Auckland, Nz  (at Hobson Bay) [pic]  http://t.co/WIxuKNRy"
NeymarJrSite, (at Mission Bay) [pic]  http://t.co/EZZB5U2i
NeymarJrSite,Beach time (at Mission Bay) [pic]  http://t.co/SCbHQ2OF
NeymarJrSite,Hot boys!! (at Mecca Stonehouse) [pic]  http://t.co/7Gqs4jo0
NeymarJrSite,RT @jgblogs: Chef @quinnfarah and Actress @jess_iskandar Tour NZ to Promote #Indonesian Cuisines http://t.co/PBHPJRdb
NeymarJrSite,Done to dinner http://t.co/X79k3O4t
NeymarJrSite,Queenstown Nz http://t.co/DwBOvrbS
NeymarJrSite,"Picture from skydiving in queenstown, Nz [pic]  http://t.co/jp2NFPOh"
NeymarJrSite,"Hello guys! I miss you- see you soon on Monday! Muaaaa
http://t.co/JAyYdRYp"
NeymarJrSite,On the way lunch (at Mecca) [pic]  http://t.co/1uSp5h1J
NeymarJrSite,"Me and my favorite photographer here in New Zealand! @olliedale check out his twitter! Muaaaa

http://t.co/fUU6Xjvw"
NeymarJrSite,Back to capital city of New Zealand! Hello Auckland  (at Domestic Terminal)  http://t.co/nLyv4j9K
NeymarJrSite,Skydiving this morning  (at NZone Skydive Base Camp) [pic]  http://t.co/8oS4PtF5
NeymarJrSite,Me and @quinnfarah (at Queenstown) [pic]  http://t.co/owbi9n52
NeymarJrSite,Skydiving today was awesome! Lovely (at NZone Skydive Base Camp) [pic]  http://t.co/hDb4gTR8
NeymarJrSite,Me and Jane in flying fox! So much fun! (at @SkylineQTown) [pic]  http://t.co/ZlkAigDn
NeymarJrSite,"Kingstown, New Zealand! Amazing (at Skyline Viewing Platform) [pic]  http://t.co/vNzun30P"
NeymarJrSite,Grilled lamb for dinner!!! Yumm (at Monteiths) [pic]  http://t.co/IgxPrjHO
NeymarJrSite,@_emilyadamson @quinnfarah @jess_iskandar thank you!!! It was nice meting you!! Xx
NeymarJrSite,RT @olliedale: @jess_iskandar and @quinnfarah standing on a glacier (gletser) in the South Island of New Zealand - Cantik!! http://t.co/ ...
NeymarJrSite,RT @olliedale: Cantik @jess_iskandar. Indah danau. http://t.co/yO7sZIf3
NeymarJrSite,"Kalau mau tahu beberapa cowok special dalam hidupku, sebentar lagi bisa kamu baca di buku pertamaku! Muaaa"
NeymarJrSite,Nanti akan ada surprise di @pesbukersANTV yaaa!!! Nonton jam 6sore! Muaaaaa
NeymarJrSite,"Lovely gondola! Queenstown, Nz (at Skyline Gondola) [pic]  http://t.co/DnLrzqik"
NeymarJrSite,LUGE!!! (at Skyline Gondola) [pic]  http://t.co/HTIzT9xd
NeymarJrSite,Luge ride was so much fun!!! (at Queenstown) [pic]  http://t.co/8z1LwvBT
NeymarJrSite,I love heliskiing (at Amisfield Winery) [pic]  http://t.co/TBFb2IDG
NeymarJrSite,I love it (at Amisfield Winery) [pic]  http://t.co/x1AJS5Vb
NeymarJrSite,Ada gombalanku sama Andre dan Azis Gagap di bukuku-
NeymarJrSite,So in love with the sky!! (at NZone Skydive Base Camp) [pic]  http://t.co/NePyF31l
NeymarJrSite,Me and my tandem! I DID IT! SKYDIVING! So bloody much fun!! (at NZone Skydive Base Camp) [pic]  http://t.co/gmyOSdSG
NeymarJrSite,The plane and the view!  (at NZone Skydive Base Camp) [pic]  http://t.co/geZfSutS
NeymarJrSite,This is my first time sky diving! Hope it's all great- so excited! Queenstown N... (at NZone Skydive Base Camp) [pic]  http://t.co/pc8obDKg
NeymarJrSite,SKY-DIVING!!! @quinnfarah (at NZone Skydive Base Camp) [pic]  http://t.co/t5HQrIYc
NeymarJrSite,I'm so ready for a sky diving (at NZone Skydive Base Camp) [pic]  http://t.co/3jK3lvPy
NeymarJrSite,What kind of expression I've made? LOL dramatic!! [pic]  http://t.co/CoUQfSlr
NeymarJrSite,lake in the middle of snow hills here in Queenstown-SPECTA!! [pic]  http://t.co/boASXmX2
NeymarJrSite,"I love snowing day!!  Queenstown, New Zealand [pic]  http://t.co/uqG490tx"
NeymarJrSite,Hello everyone!! @quinnfarah @markquickfall (at Queenstown) [pic]  http://t.co/qbK3PIsj
NeymarJrSite,On our way to dinner @quinnfarah (at Saffron) [pic]  http://t.co/fd7JDpFv
NeymarJrSite,"Lovely day at snow hills, Queenstown Nz [pic]  http://t.co/O4BSwWWr"
NeymarJrSite,I just got 'ciuman sayang!'  muaaaa
NeymarJrSite,Helicopter tour! (at The Remarkables Snow Field) [pic]  http://t.co/q0SS6veR
NeymarJrSite,Alpaca!! (at The Remarkables Snow Field) [pic]  http://t.co/Kk3W25vz
NeymarJrSite,Heliski-ing lovely!! (at The Remarkables Snow Field) [pic]  http://t.co/WvtrAwgG
NeymarJrSite,The set of 'lord of the rings' (at Arrow River) [pic]  http://t.co/iP8eqPZE
NeymarJrSite,Amazing view!! (at A J Hackett Bungeejump) [pic]  http://t.co/09fAtggM
NeymarJrSite,Look at me!!!! (at A J Hackett Bungeejump) [pic]  http://t.co/ZoVq1YI2
NeymarJrSite,Ow yeah!! @quinnfarah (at A J Hackett Bungeejump) [pic]  http://t.co/np66eZVK
NeymarJrSite,I'll be chicken in this bungee jump thing! Thank you (at A J Hackett Bungeejump) [pic]  http://t.co/NwoQHHrq
NeymarJrSite,What a perfect day! So are you ready for bungee? (with Farah Quinn at A J Hackett Bungeejump) [pic]  http://t.co/DHrmxgG7
NeymarJrSite,Good morning!! G-day!! (at Millbrook Resort) [pic]  http://t.co/p9orOm1v
NeymarJrSite,Bon appetite  (with Farah Quinn at Mantra Indian Restaurant) [pic]  http://t.co/nlMFQ3qI
NeymarJrSite,Me and Armand are dating now!! What a lovely night (at Arrowtown) [pic]  http://t.co/JoYdF7Lu
NeymarJrSite,Lovely place with lovely lady! @quinnfarah (at Millbrook Resort) [pic]  http://t.co/eWSVHcaO
NeymarJrSite,"Getting ready for dinner!! Queenstown, Nz http://t.co/KXymlp05"
NeymarJrSite,Lovely!! Can't wait for sky diving tomorrow!!  (at Millbrook Resort) [pic]  http://t.co/glvjG2TA
NeymarJrSite,Queenstown is queen of the ring!! Lovely!! (with Farah Quinn at Millbrook Resort) [pic]  http://t.co/oD0ADZEH
NeymarJrSite,"Queenstown, New Zealand http://t.co/sJjeS7Gm"
NeymarJrSite,At Domestic Terminal [pic]  http://t.co/ICRHMpoa
NeymarJrSite,Take off!! See you soon Queenstown! Muaaaa (at Domestic Terminal) [pic]  http://t.co/ASjkThZT
NeymarJrSite,Hello Auckland! @quinnfarah g'day! (with Farah Quinn at Domestic Terminal) [pic]  http://t.co/9BLdT6L1
NeymarJrSite,Just arriving in Auckland safety! Hello @quinnfarah @luxurynz_id @peppysiuly g-day! Muaaa
NeymarJrSite,Another flight to Queenstown! Exhausted- (at Domestic Terminal)  http://t.co/imkIr5EI
NeymarJrSite,"Another flight to Auckland, New Zealand! Antimo mana antimo? Lol (at @fansofchangi)  http://t.co/pj6yW77Z"
NeymarJrSite,Hello Singapore- missing someone here! (at Changi Terminal 3)  http://t.co/eZV0RL9F
NeymarJrSite,The only dollar I have- LOL (with @erickiskandar) [pic]  http://t.co/CNCGvDMK
NeymarJrSite,Boarding to Singapore (at Premier Executive Lounge Soeta Terminal 2D)  http://t.co/LfxmVICj
NeymarJrSite,Go to the airport! (with @erickiskandar at Helipad Apt. Semanggi)  http://t.co/fmwmOWeA
NeymarJrSite,On the way to the airport! Yeayy thanks @erickiskandar
NeymarJrSite,Kisah hidupku semakin hidup setelah menulisnya di buku. Love it!
NeymarJrSite,Thank you for this beautiful flowers! Smells so good here! Muaaaaaaaaaa http://t.co/5fkxeWq5
NeymarJrSite,Good morning! Packing for my trip! New Zealand here I come- so excited!
NeymarJrSite,Let us be grateful to the mirror for revealing to us our appearance only.
NeymarJrSite,"With @erickiskandar at Lap. Asyiiik - Semplak, Bogor  http://t.co/FWSBRy5d"
NeymarJrSite,Otw to Bogor
NeymarJrSite,What a wonderful life I've had! I only wish I'd realized it sooner-
NeymarJrSite,Only robots feel nothing when they hold hands!
NeymarJrSite,Can't wait for New Zealand trip tomorrow!! See you there @quinnfarah muaaaaaa
NeymarJrSite,"I know you'll read this, that's why I want to say I miss you so much!"
NeymarJrSite,RT @ZodiacFacts: #Aquarius appreciate original and creative ideas. They usually set goals which are sometimes impossible to achieve.
NeymarJrSite,Thank you to put a picture of me on your screen saver!
NeymarJrSite,Aku mau mengungkap tentang beberapa rahasia di bukuku. Nanti kalau sudah baca kasih tau ya kalau kamu kaget.
NeymarJrSite,RT @sundulgol: Kehadiran @jess_iskandar di @TheMaster5RCTI berikan warna baru rasa tegang kagum disertai tawa ... http://t.co/KDtTijeT
NeymarJrSite,Thank you @irma_piek for the flowers!! Love it!! Muaaa
NeymarJrSite,Aku mau menulis tentang pria yang dekat denganku- 
NeymarJrSite,Love it so much!!  so in loveee!! http://t.co/4wPXaRJ2
NeymarJrSite,So cute! Ahahaha thxxx. Muaaa @ParkShin_Mey http://t.co/yVhnmTI6
NeymarJrSite,"Jessiliciousss yang dateng thank you so much, maaf aku harus pergi karena ada live acara THE MASTER live jam 9malam di RCTI. Muaaaaaa"
NeymarJrSite,Nanti malam nonton lagi ya!! Jam 9 malam live RT @okta_mastriani: @jess_iskandar wkt ka jj jd juri di The Master lucuu kaa(-_-)
NeymarJrSite,Nanti malam aku jadi juri lagi di The Master nonton yaa di RCTI jam 21.00wib! Muaaaaa
NeymarJrSite,"Just landed! Back on my busy life- mix sad things! Anyway, have a nice day! Muaa"
NeymarJrSite,Which level are you?? [pic]  http://t.co/YGDPqG1h
NeymarJrSite,Menulis ternyata bisa melampiaskan emosi! I love it!
NeymarJrSite,Selamat pagi! On the way to the airport see you soon Singapore-
NeymarJrSite,Happy birthday dear @inka_noverita wish you all the best! Muaaaaaaaa
NeymarJrSite,"With @erickiskandar, Irene, and Farah Quinn [pic]  http://t.co/9tUhcZ0C"
NeymarJrSite,"Dinner premiere- the big break! Congratulation Farah Quinn  (with @erickiskandar, Irene, and Farah Quinn) [pic]  http://t.co/ygbPaT4W"
NeymarJrSite,I fall for fashion! 
NeymarJrSite,Seneng banged baru dapat hasil penjualan baju bekas-pakaiku! Langsung mau aku sumbangin ke panti asuhan hari Jumat-
NeymarJrSite,"Ternyata menulis buku itu menarik, menegangkan dan melegakan!! I love it!"
NeymarJrSite,"Some say I'll be better without you, but they don't you like I do, at least the sides I thought I knew"
NeymarJrSite,Everything means nothing if I ain't got you with me-
NeymarJrSite,Just made chicken pumpkin soup! For this rainy lunch [pic]  http://t.co/d7GMhZ2s
NeymarJrSite,"China-doll 
Princess-Haunts
Dark-Angel (with @erickiskandar, Andyn, and 2 others) [pic]  http://t.co/lrJuAZnu"
NeymarJrSite,"Mana yg paling menarik untuk kutulis,  kisah cintaku, masa kecilku atau perjalanan karirku?"
NeymarJrSite,TOGETHER [pic]  http://t.co/R9WIDriu
NeymarJrSite,Love is a fanclub with only two fans
NeymarJrSite,Love me love me love me!!!  [pic]  http://t.co/FvzkZcwJ
NeymarJrSite,"Menurutmu, apa aja yang harus aku tulis dalam bukuku? Apa yang kalian ingin tau?"
NeymarJrSite,Good morning sunshine! hope you have a wonderful day-
NeymarJrSite,Jangan bos nanti nyonya tau! Kira-kira ini isi hatinya nacho dengan ekspresi seperti itu [pic]  http://t.co/J8kpNEup
NeymarJrSite,"Rinceee, mangganya super manis! Makasi yaaaaa!!! Muaaaaaa"
NeymarJrSite,"Life is slippery, we all need a loving hand to hold on to"
NeymarJrSite,The way to love anything is to realize it might be lost
NeymarJrSite,@Danamaulanas hey!! When the meting set up! Xx
NeymarJrSite,Love suddenly makes everything seem possible
NeymarJrSite,Love is friendship set on fire
NeymarJrSite,"You know you're in love when you want to tell everyone about it, even though they haven't asked"
NeymarJrSite,You know you're in love when the same person who makes you so happy can make you so mad
NeymarJrSite,The sweetest sound of all is that of my own name spoken by a guy I care about
NeymarJrSite,I believe in love at the first sight
NeymarJrSite,Love is like wildflowers. It's often found in the most unlikely places
NeymarJrSite,Love is when the other person's happiness is more important than your own
NeymarJrSite,The ocean gets its saltiness from the tears of misunderstood sharks who just want to cuddle
NeymarJrSite,"So cute!! Thank you jessilicious Bandung! Can't wait to go to Bogor next week!! Muaaaaaaaa
http://t.co/Y1UG0WGf"
NeymarJrSite,"No passport 
No Singapore
No fun"
NeymarJrSite,Selamat pagi! Kira-kira dikasih judul apa ya buku pertamaku?
NeymarJrSite,I uploaded a @YouTube video http://t.co/oxXvyB4T Jessica Iskandar Dan jessilicious di Bandung!
NeymarJrSite,"aku bangga bisa menginspirasi, aku bahagia bisa menularkan semangat kepada seluruh penduduk dunia ha ha ha aku suka membuat orang tertawa"
NeymarJrSite,Berapa orang yang akan membaca buku aku ya? 
NeymarJrSite,Soalnya aku nikung ke hati kamu!! LOL RT @DesrianaAsti: Yah ketilang @jess_iskandar wkwkwkwkw :p
NeymarJrSite,"On the way to venue! With my lovely assistant @bedskygeboy @Bajank_Afief  Bandung rock on!! 
http://t.co/jBnodlaD"
NeymarJrSite,BANDUNG lautan rinduuu!!
NeymarJrSite,"Cantikku @venyJessy_JS happy birthday!! Coba kutau, ikut ke bandung sini, aku bedakin!!"
NeymarJrSite,On my way to Bandung!!  (at Starbucks Km. 19)  http://t.co/cvcFnSWv
NeymarJrSite,"Penulis itu romantis atau egois? aku suka yang romantis, ada yg bilang aku melankolis, apakah menulis bs bikin aku makin romantis?"
NeymarJrSite,RT @ZodiacFacts: #Aquarius: The urge to TRANSCEND.
NeymarJrSite,"@phonirindt @ogearthemus aku hampir ikut nyemplung ke kolam, untuk cuma bilang 'wow' LOL"
NeymarJrSite,@tanianjani iya sayang!! Makasiiiiiiiiiiii hehe
NeymarJrSite,How do you stay grounded?
NeymarJrSite,And master @cobuzer RT @romyrafaelmind: LIVE with @jess_iskandar only @TheMaster5RCTI on @OfficialRCTI
NeymarJrSite,"Are you ready for some magic?? Nonton RCTI 21.15wib!!! Muaaaa
http://t.co/vbagfexH"
NeymarJrSite,Selesai Pesbukers langsung melaju ke RCTI buat The Master!! See you there on TV 21.15wib
NeymarJrSite,YES!! Nonton ya!!! Harus! RT @wisnu_devilNew: Bican @jess_iskandar bener ntar mlam jdi juri tamu di @themaster5rcti wah seru nich.
NeymarJrSite,Aku jadi JURI di THE MASTER nanti malam!! RCTI 21.15wib! Nonton yaaaaaa! Muaa
NeymarJrSite,I need an idea to love you! 
NeymarJrSite,"Thank you!! RT @yolandaaass: @jess_iskandar adalah inspirasiku  orang yang cantik, baik, dan acting kebloonan ... http://t.co/QZUrVRIp"
NeymarJrSite,bantu doa ya! RT @riskasiska: @jess_iskandar iya kak jess emang waktunya km itu nulis buku :);)
NeymarJrSite,RT @mate_nate: @jess_iskandar based on the pearls of wisdom you're able to espouse on a daily basis I'm sure ... http://t.co/3ZbrXSNI
NeymarJrSite,"Thx RT @DNSkandsyah: @jess_iskandar adalah seorang gadis mandiri , cantik dan berbakat akan lebih sukses jika lebih ""fokus"" untuk apapun itu"
NeymarJrSite,"Aku lagi deket sama penulis, 
dia suka nulis dan membujuk orang untuk menulis, aku dibujuk juga, emang sudah waktunya ya aku menulis buku?"
NeymarJrSite,Cutie betty boop!! it! GOOD MORNING! Have a wonderful day! http://t.co/ncjcg4Td
NeymarJrSite,Pertanyaan kuis Bandung : Kapan Pak Ujang bayar listrik? 5org pemenang nemenin aku ke Bandung!
NeymarJrSite,My bodyguard! Hell yeah! http://t.co/FRgyoPEO
NeymarJrSite,I want to take a picture with you!! 
NeymarJrSite,Life is unpredictable! [pic]  http://t.co/6JhiY8tf
NeymarJrSite,"Muaaaaa!! Thx  RT@JesiliciousSLWS: @jess_iskandar ""ur  beautiful in ur way
'Cause God makes no mistakes"" :* We  u"
NeymarJrSite,Don't promise what you can't deliver
NeymarJrSite,Your vision of where or who you want to be is the greatest asset you have. Without having a goal it's difficult to score!
NeymarJrSite,Congratulation Barrack Obama
NeymarJrSite,"Hahaha agree! RT @LarsOskar: I already did ;) ""@jess_iskandar: 'ASTONISH ME!'"""
NeymarJrSite,'ASTONISH ME!'
NeymarJrSite,"You should adopt the pace of nature, her secret is patience. Ralph waldo Emerson said"
NeymarJrSite,Good marks will not secure you an interesting life. Your imagination will.
NeymarJrSite,"Instead of go to university, I go to work and do learning in the school of life!"
NeymarJrSite,Siap kuisnya?? 5pemenangnya ikut ke Bandung seharian- tanggal 10 nov- yg bisa ikutan ya
NeymarJrSite,"Great people have great egos, maybe that's what makes them great! Life's all about 'me' anyway"
NeymarJrSite,Too many people spend too much time trying to perfect something before they actually do it. Instead of waiting ... http://t.co/Ya6Qlilo
NeymarJrSite,"Life is about decision, everything we do we choose. You are the person you chose to be. So what is there to regret?"
NeymarJrSite,RT @LanaDelRey: We don't need nobody- cause we got each other.. http://t.co/5KrpOrb7 http://t.co/udQlWbuD
NeymarJrSite,It's better to regret what you have done than what you haven't.
NeymarJrSite,"My skinny love, distance and time  Skinny Love by Birdy  http://t.co/vxTTMSZK"
NeymarJrSite,Can't wait for New Zealand trip!!! Cc @quinnfarah 
NeymarJrSite,You were born an original. Don't die a copy.
NeymarJrSite,Attitude is a little thing that makes a big difference
NeymarJrSite,I agree! muaaaa RT @purple_njee: @jess_iskandar its false..we live everyday dear..n we die once..\^_*/
NeymarJrSite,"If you're comfortable with yourselves, then it's sexy!"
NeymarJrSite,"Knock the ""t"" off the ""can't"""
NeymarJrSite,You only live once and you don't walk past-
NeymarJrSite,Laugh as much as you breathe and love as long as you live
NeymarJrSite,The most wasted of all days is one without laughter
NeymarJrSite,"Drop the three L's - Lack, Loss, Limitation from your vocabulary"
NeymarJrSite,To use an old-fashioned but powerful phrase-dare to be what you want to be and can be
NeymarJrSite,There is to be in love between  [pic]  http://t.co/3unihzrI
NeymarJrSite,Desriiiianaaaa dimana??
NeymarJrSite,Working+breakfast! http://t.co/lxIiiMK8
NeymarJrSite,"Time is of essence, as that is the only thing that is playing against you, so get to work!"
NeymarJrSite,"When I think of people I don't think of how long they lived, but what they achieved! So age doesn't matter"
NeymarJrSite,Time is running out! Everyday is a day less!
NeymarJrSite,"Keep thinking, keep moving, keep participating"
NeymarJrSite,"Never think of failing, you don't need to!"
NeymarJrSite,The two saddest words in any language is TO AVOID and TO REMEMBER!
NeymarJrSite,EASE UP! Have a sense of humor- positive and dynamic thinking
NeymarJrSite,Get on top of things and stay there!!
NeymarJrSite,To someone that I may have possibly missed in black and white know that you are in my heart as always.
NeymarJrSite,@juliaperrez sisterrr jups!! I miss you a lot!
NeymarJrSite,Jessica loves Jessilicious!! 
NeymarJrSite,"With @erickiskandar, Hertika, and Almira at @granmelia [pic]  http://t.co/xEB2VZiJ"
NeymarJrSite,I'm scared that you won't be waiting on the other side- its like a dark paradise!
NeymarJrSite,Just watched skyfall!!  I'm gonna be Jessica Bond tonight! LOL
NeymarJrSite,@srii_JOHAN thank you!! Semoga aku bisa jadi idola yang baik dan manis..
NeymarJrSite,@ReniErill amin! Makasi ya cantikk!!
NeymarJrSite,"Baby, you're not good for me, but I want you! So bad! X"
NeymarJrSite,I have a surprise for all jessilicious in the world! Muaaaa
NeymarJrSite,Selamat pagi cinta semoga harimu menyenangkan!! XX
NeymarJrSite,@candraaa78 iyaaa makasi uda diperhatiin
NeymarJrSite,Shooting taping semangat!
NeymarJrSite,Thank you for watching Pesbukersss muaaaaa
NeymarJrSite,@raniii_JS jadi.. Kabarin ya cantik..
NeymarJrSite,So cute!! RT @ParkShin_Mey: just posted a photo CC: @jess_iskandar  http://t.co/oziJCWiH
NeymarJrSite,I wanna be closer to my Jessilicious!!
NeymarJrSite,"@jessiliciousss dilarang jualan tanpa ijin, thx CC: @jessiliciouuss"
NeymarJrSite,Please brain wash me!! LOL
NeymarJrSite,Just posted a photo  http://t.co/b1tmGaJv
NeymarJrSite,Imagine I'm riding this now http://t.co/MXSYCiUF
NeymarJrSite,"Kamu hanya perlu terima, tak harus memahami-"
NeymarJrSite,@mvie_vie iya sayang makasi yaaaaaaa
NeymarJrSite,@BojezTata tanya @dahsyatnyaolga dulu!!
NeymarJrSite,@Top_BundaAura makasi bunda.. Sayang bunda
NeymarJrSite,"Ga jadi, aku ada taping pesbukers  RT @Wikal_swidy: @jess_iskandar ka jeje emang nya bener nanti malem ka jeje ada di @OVJ_Trans7"
NeymarJrSite,"Ebi, dimana kamu? Bales*"
NeymarJrSite,OTW pesbukerss!! Miss you guysssss nonton ya LIVE nanti! Muaaa
NeymarJrSite,Can't wait vacation to New Zealand in November!! with @farahquinn 
NeymarJrSite,Bloody Halloween ever! hertika almira http://t.co/VtyFmTeu
NeymarJrSite,I'm your love dealer! http://t.co/ie9O9tKm
NeymarJrSite,I'm so sorry for what you've been trough! Happy Halloween http://t.co/S3uy0xtJ
NeymarJrSite,Take off to Jakarta
NeymarJrSite,Good morning Singapore! Will see you soon otw to airport-going back to J-town
NeymarJrSite,With Hertika and Almira at 1 River Valley Close  http://t.co/YWmvtAYl
NeymarJrSite,Universal Studio today!! YEAYY!! Halloween party part III! @hertika @almira ---
NeymarJrSite,"This is my twitter, so tweet me maybe! xxxx"
NeymarJrSite,@radityadika mau nitip?
NeymarJrSite,Dear haters! I know you're just jealous- Muaaaaa http://t.co/K9i0SkIv
NeymarJrSite,Hallo semuanya!! Happy holiday muaaaa http://t.co/3SHTRppg
NeymarJrSite,Take off to Singapore muaaaaa
NeymarJrSite,At the airport
NeymarJrSite,Lucu!! Kaosnya ada fotoku! http://t.co/M3cm8iwB
NeymarJrSite,Packing!! For Singapore trip happy holidays jessilicious.. Wherever you are! Enjoy your life- Muaa
NeymarJrSite,HBD @muss_ikha sayang! Muaaaa
NeymarJrSite,#gadiskecilberhatibesar RT @jessiliciouuss: Siapa yg udah punya ini??? Ngaacungg doong:p cc: @jess_iskandar  http://t.co/5HRPj0PI
NeymarJrSite,Yuk ahahahhahaha RT @PoppyJellow: @jess_iskandar jadiin TTI aj yuuukkk #gadiskecilberhatibesar :)
NeymarJrSite,GADIS KECIL BERHATI BESAR jadi tema TL malam ini  love it!
