chinoynacho,Ricos alfajores personalizados por sophiaclau !!!! Gracias mi nia bonitaaaaa http://t.co/IT2Ze3A4 http://t.co/109ZqbKu
chinoynacho,Tambin pueden unirse a nuestra pgina en facebook: http://t.co/We7FigAg http://t.co/Eyh4WxEw http://t.co/3ULmbdRv
chinoynacho,Tambin pueden unirse a nuestra pgina en facebook: http://t.co/We7FigAg http://t.co/Eyh4WxEw http://t.co/zlrjjB71
chinoynacho,Nuestras cuentas oficiales en twitter son: @ChinoyNacho @jesusmiranda @nacholacriatura y la de nuestro manager @pvillalobosm
chinoynacho,Disfruta el trailer de Nuestro Video Sin Ti!!!... http://t.co/TBhaGf11
chinoynacho,Primera participacin de ChinoyNacho en La Teleton de Chile directo desde el Teatro... http://t.co/4PLltKUZ
chinoynacho,"Esta noche a las 8:30pm es la gran final de #ChicaHTV.
Conoce a la nueva conductora del canal y disfruta de... http://t.co/z2FnWMiC"
chinoynacho,El Diego! http://t.co/nWJLDB3q http://t.co/BXxxBpCf
chinoynacho,Nuestro amigo El Puma! http://t.co/Vzh0Xaw2 http://t.co/fxBrKuQO
chinoynacho,sgueme en instagram como chinomiranda
chinoynacho,Primera participacin de @ChinoyNacho en La Teleton de Chile directo desde el Teatro... http://t.co/woGFrNUG
chinoynacho,El Puma Jos Luis Rodrguez y chinoynacho en Chile! Orgullo Vzlano http://t.co/22scm6ap http://t.co/qsE5EHP3
chinoynacho,Super cool el nuevo video de @victordrija Amanecer disfrutalo aqui... http://t.co/8ubHLO7s
chinoynacho,Disfruta el trailer de Nuestro Video Sin Ti!!!... http://t.co/Wbr45Rdf
chinoynacho,No te pierdas la gran final de #ChicaHTV esta noche a las 8:30pm Exclusivamente por HTV Se pone bueno! Y a partir de hoy mucho mas!
chinoynacho,Que les parece el nombre del beb de nuestra fanatica? http://t.co/o1aaE6za http://t.co/rwHbPEs6
chinoynacho,Que les parece el nombre del beb de nuestra fanatica? http://t.co/o1aaE6za http://t.co/uDDvqzua
chinoynacho,Asi recibieron a mi hijo en Chile. Hoy en su cumple le dieron tan bella sorpresa! http://t.co/59bQM2Zz http://t.co/rTipQGgF
chinoynacho,Mi muchachito ya tiene 8 aos! http://t.co/ql8vE9Wf http://t.co/sJlSQDP4
chinoynacho,La primera barriguita que firmo! Bella buenas energas para ti.... http://t.co/6qYA4cHS http://t.co/SLWrNKy1
chinoynacho,Este 01 de diciembre el do Supremo en Chica HTV 2012 http://t.co/GcFQCpiM http://t.co/uSK4uV2M
chinoynacho,Disfruta el trailer de Nuestro Video Sin Ti!!!... http://t.co/hQhpkVyM
chinoynacho,Tambin pueden unirse a nuestra pgina en facebook: http://t.co/We7FigAg http://t.co/Eyh4WxEw http://t.co/SlgyGtbT
chinoynacho,Nuestras cuentas oficiales en twitter son: @ChinoyNacho @jesusmiranda @nacholacriatura y la de nuestro manager @pvillalobosm
chinoynacho,"Te gust nuestro nuevo video ""Sin ti"" ????? Disfrtalo ya a travs de youtube"
chinoynacho,5-DIC #ESTRENO #NadieMasParaMi de @FabianYGabo Prod By @Wallymusica @DanielyYein @jesusmiranda #MackedichesRecords Estrena @OnyxSensation
chinoynacho,"Le dije a Junior que sonriera para ustedes y no,prefiri sacarles la lengua! Que mala conducta http://t.co/Pil561hf"
chinoynacho,Tambin pueden unirse a nuestra pgina en facebook: http://t.co/We7FigAg http://t.co/Eyh4WxEw http://t.co/58fAwKHc
chinoynacho,Nuestras cuentas oficiales en twitter son: @ChinoyNacho @jesusmiranda @nacholacriatura y la de nuestro manager @pvillalobosm
chinoynacho,Este 01 de diciembre el do Supremo en Chica HTV 2012 http://t.co/GcFQCpiM http://t.co/cFU0O3jr
chinoynacho,Este 01 de diciembre el do Supremo en Chica HTV 2012 http://t.co/GcFQCpiM http://t.co/jYw6td7u
chinoynacho,Siempre es bueno sonrer! http://t.co/JzqOracO http://t.co/FZYqltMn
chinoynacho,Este 01 de diciembre el do Supremo en Chica HTV 2012 http://t.co/GcFQCpiM http://t.co/8w0vqQoa
chinoynacho,Tambin pueden unirse a nuestra pgina en facebook: http://t.co/We7FigAg http://t.co/Eyh4WxEw http://t.co/hzTGp9tg
chinoynacho,Nuestras cuentas oficiales en twitter son: @ChinoyNacho @jesusmiranda @nacholacriatura y la de nuestro manager @pvillalobosm
chinoynacho,"Feliz cumple al incondicional, a el de siempre @fidelvalencia"
chinoynacho,"Alexis y Fido,Farruko,Oscarcito,Vctor Drija,Potro lvarez,Joey Montana,J Balvin(Viendo a otro lado jaja) Fo http://t.co/NglkAYM6"
chinoynacho,NYRT are u ready??? http://t.co/Q4rmIlGX http://t.co/Qwsaw27p
chinoynacho,NYRT are u ready??? http://t.co/Q4rmIlGX http://t.co/tSmFCwxZ
chinoynacho,Feliz cumpleaos!!!! lo mejor para mi amiga @vanessamaradona http://t.co/mLIDtJZ6 http://t.co/CNt7I71o
chinoynacho,Feliz cumpleaos!!!! lo mejor para mi amiga @vanessamaradona http://t.co/mLIDtJZ6 http://t.co/8FCMpR6K
chinoynacho,Tambin pueden unirse a nuestra pgina en facebook: http://t.co/We7FigAg  http://t.co/Eyh4WxEw http://t.co/fk6klUKb
chinoynacho,Nuestras cuentas oficiales en twitter son: @ChinoyNacho @jesusmiranda @nacholacriatura y la de nuestro manager @pvillalobosm
chinoynacho,Este 01 de diciembre el do Supremo en Chica HTV 2012 http://t.co/GcFQCpiM http://t.co/DLky2CMB
chinoynacho,http://t.co/GcFQCpiM
chinoynacho,Tambin pueden unirse a nuestra pgina en facebook: http://t.co/We7FigAg http://t.co/m8ZI6v8K
chinoynacho,Tambin pueden unirse a nuestra pgina en facebook: http://t.co/We7FigAg http://t.co/Eyh4WxEw
chinoynacho,Nuestras cuentas oficiales en twitter son: @ChinoyNacho @jesusmiranda @nacholacriatura y la de nuestro manager @pvillalobosm
chinoynacho,Este 01 de diciembre el do Supremo en Chica HTV 2012. http://t.co/77N7ohN5 http://t.co/uQ1sJOGb
chinoynacho,RT @leonherrera: @ChinoyNacho #regalameunmuak @ritmosonlatino @jesusmiranda @nacholacriatura http://t.co/J5kXYAqe http://t.co/yaWIH3oj
chinoynacho,RT @leonherrera: @ChinoyNacho Guatemala 24/11/2012 @pvillalobosm @JackyOlavarria http://t.co/r3paKOsl http://t.co/446Wqs8k
chinoynacho,RT @leonherrera: @ChinoyNacho @pvillalobosm @JackyOlavarria Guatemala Noviembre 2012 http://t.co/gUuLuVjN http://t.co/HFxhvjje
chinoynacho,RT @leonherrera: @ChinoyNacho en Guatemala 24/11/2012 http://t.co/LV8II9Ai http://t.co/kQNaRdbP
chinoynacho,"Nada es imposible,el cielo es el lmite.No importa tu condicin siempre lucha que lo logrars....... http://t.co/BxQqKGzD"
chinoynacho,Feliz cumpleaos al talentoso @oscarcitomundo !!!!!! Lo mejor para ti bro
chinoynacho,Bendito problema de las maanas:no puedo abrir los ojos!!!!! 5:05am seguimos trabajando http://t.co/sghUQ0rA
chinoynacho,"Gracias Guatemala! Mujeres hermosas,buena energa y msica de la mejor... Que ms podemos pedir! Son lo mximo, gracias por su cario"
chinoynacho,Luego de un gran concierto lo primero que pienso es en comer!!!!!! Jaja http://t.co/Yaqd855X
chinoynacho,Disfruta el trailer de Nuestro Video Sin Ti!!! No te lo puedes perder. Continuar......... http://t.co/TFSgfVFe
chinoynacho,Disfruta el trailer de Nuestro Video Sin Ti!!! No te lo puedes perder. Continuar......... http://t.co/uIs174Fd
chinoynacho,Tripeando en el estudio! BOOM http://t.co/LKQ0Te8i
chinoynacho,Disfruta el trailer de Nuestro Video Sin Ti!!! No te lo puedes perder. Continuar......... http://t.co/GxQPOG7k
chinoynacho,Grabamos voces de la 4ta cancin! @motiffmusic @nacholacriatura http://t.co/ZBLn0pvI http://t.co/gHcQ4ITU
chinoynacho,Disfruta el trailer de Nuestro Video Sin Ti!!! No te lo puedes perder. Continuar......... http://t.co/j8MyFSEm
chinoynacho,Disfruta el trailer de Nuestro Video Sin Ti!!! No te lo puedes perder. Continuar...... http://t.co/J8LYlglj
chinoynacho,Ya viene el videoclip  Sin ti..... http://t.co/dqdNsrVy  http://t.co/DyPQJEoZ
chinoynacho,Ya viene el videoclip  Sin ti..... http://t.co/dqdNsrVy  http://t.co/nPBCljVX
chinoynacho,Ya viene el videoclip  Sin ti..... http://t.co/dqdNsrVy  http://t.co/Cp6F3zGv
chinoynacho,Disfruta el tercer tras cmara de nuestro Video Sin Ti. Echale un vistazo! Continuar....... http://t.co/4k46BbAC
chinoynacho,Round 3 BOOM!!!! Tercer tema del nuevo lbum listooooooo.... Vamos pal 4 fight!!!! http://t.co/G2UMLfwq http://t.co/lNNplT8v
chinoynacho,Round 3 BOOM!!!! Tercer tema del nuevo lbum listooooooo.... Vamos pal 4 fight!!!! http://t.co/G2UMLfwq http://t.co/Zu9c3hvj
chinoynacho,Round 2 BOOM!!!! Acabamos el segundo tema del nuevo lbum.... Vamos pal 3ero http://t.co/u9LYNUC4
chinoynacho,"En sus marcas,listos,fuera!!!!!! Otra noche ms en el estudio...2da cancin del nuevo lbum @motiffmusic... http://t.co/4oAwYYxG"
chinoynacho,Feliz Cumpleaos a nuestro manager @pvillalobosm te deseamos lo mejor en este da!
chinoynacho,Comiendillo con el @leonherrera antes de empezar a grabar! Saludos http://t.co/rJCrPxyn http://t.co/WJqGHzTD
chinoynacho,Comiendillo con el @leonherrera antes de empezar a grabar! Saludos http://t.co/rJCrPxyn http://t.co/4uukhS88
chinoynacho,Sigueme en instagram como chinomiranda
chinoynacho,Zzz zz z http://t.co/SkCKkYqR http://t.co/hLxln7Pz
chinoynacho,Disfruta el tercer tras cmara de nuestro Video Sin Ti. Echale un vistazo! Continuar....... http://t.co/xbO3f7GQ
chinoynacho,Este 01 de diciembre el do Supremo en Chica HTV 2012. http://t.co/77N7ohN5
chinoynacho,Disfruta el tercer tras cmara de nuestro Video Sin Ti. Echale un vistazo! Continuar....... http://t.co/koztReS2
chinoynacho,En el 40 aniversario Revista Cosmopolitan #cosmo40... http://t.co/nxsHoNwi
chinoynacho,Videoclip  Sin ti parte 3 http://t.co/0dVOrKxk  http://t.co/BZyE83c5
chinoynacho,Se parece a mi???? http://t.co/iFxqkTjG http://t.co/MxFcNQbB
chinoynacho,NYRT http://t.co/I1rPx0g1  http://t.co/0pKtMQ9Y
chinoynacho,Mi torta de cumple que me regalaron en Maracaibo!!!! Gracias mis amores http://t.co/lQWWAzI9 http://t.co/jttthbED
chinoynacho,Mi torta de cumple que me regalaron en Maracaibo!!!! Gracias mis amores http://t.co/lQWWAzI9 http://t.co/MGRyZ5Mz
chinoynacho,Billboard team NYRT http://t.co/j6n4EoPW http://t.co/UiJYMEdM
chinoynacho,Videoclip  Sin ti parte 3 http://t.co/0dVOrKxk  http://t.co/Swz8NprW
chinoynacho,videoclip  sin ti  parte 2 http://t.co/TqfZsw7M  http://t.co/CtqFdSSv
chinoynacho,videoclip Sin ti parte 1 http://t.co/CSKpcztt  http://t.co/TPeoJmD2
chinoynacho,Gracias Rosita Hurtado por este fabuloso diseo chinoynacho http://t.co/KSOjsdfc http://t.co/hYeOe8Ae
chinoynacho,Gracias Karibel Montero por este sper regalo!!!!! Te quiero enormeeeee http://t.co/tXPxmeF8 http://t.co/tjDSpzc5
chinoynacho,Disfruta el tercer tras cmara de nuestro Video Sin Ti. Echale un vistazo! Continuar....... http://t.co/m06Xb0GE
chinoynacho,Disfruta el tercer tras cmara de nuestro Video Sin Ti. Echale un vistazo! Continuar....... http://t.co/PZgDyHJF
chinoynacho,Felicitaciones @davidbisbal por el Latin Grammy que muy merecidamente recibiste!!! Fuerte abrazo pana... http://t.co/xgkW2ShZ
chinoynacho,Mucho amor de mi bella amiga Rosa Caiafa!!!! Gracias por este maravilloso regalo http://t.co/BJg3pQAl http://t.co/SaAehkjh
chinoynacho,El do Supremo en #LatinGrammy2012 chinoynacho http://t.co/dAIfFhjW http://t.co/0qWm2qMA
chinoynacho,Disfruta el tercer tras cmara de nuestro Video Sin Ti. Echale un vistazo! Continuar....... http://t.co/2ZLv4iVp
chinoynacho,Vegas http://t.co/ff5MguFN http://t.co/ZIlrTzkR
chinoynacho,Celebrando con mis buenos amigos!!! http://t.co/uCOEQI1l http://t.co/tGIY9g9k
chinoynacho,A punto de comenzar la boda de Jacky!!!! http://t.co/6ked6peC http://t.co/A9BiG7NF
chinoynacho,En la capilla de matrimonio Las Vegas http://t.co/WFkNVfG5 http://t.co/vnGYSKuX
chinoynacho,la rumba http://t.co/KisCzCmh http://t.co/LjjOpsXl
chinoynacho,Empez la rumba!!!!!! http://t.co/a8hfqeif http://t.co/qK4K8TPW
chinoynacho,El Do Supremo http://t.co/ftJcpOiH
chinoynacho,Disfruta el tercer tras cmara de nuestro Video Sin Ti. Echale un vistazo! Continuar....... http://t.co/ccm5ARx2
chinoynacho,No ganamos el Latn Grammy pero igualmente nos sentimos afortunados por esta nominacin y por tener su amor y cario sincero! Pa encima
chinoynacho,Grammy para Viniloversus!!! Arribaaaaaa
chinoynacho,Grammy para Mara Teresa Chacn!!!!! Arribaaaaaa
chinoynacho,Listo para la accin!!! http://t.co/yV9Jp53n http://t.co/kk4XWT0V
chinoynacho,"Mil gracias a todos por estar tan pendientes de mi cumple! Estoy muy emocionado,ustedes son mi mejor regalo.Dios me los bendiga!!!!"
chinoynacho,Disfruta el segundo tras cmara de nuestro Video Sin Ti. Echale un vistazo! Continuar....... http://t.co/RXmzyKB8
chinoynacho,Disfruta el segundo tras cmara de nuestro Video Sin Ti. Echale un vistazo! Continuar....... http://t.co/LmEveIWG
chinoynacho,RT @pvillalobosm: Llego el gran dia @ChinoyNacho #LatinGrammy Viva Venezuela
chinoynacho,I got my nominee medal! Medalla Grammy yeah http://t.co/KGdzZmlD http://t.co/qtE3MixS
chinoynacho,Celebrando mi cumple rockeando con Enrique Iglesias http://t.co/O0bG7nKk http://t.co/cxkvpdaW
chinoynacho,RT @clarapablo: Con el cumpleaero... Mi consentido @jesusmiranda celebrando en las Vegas #happybirthdaychino... http://t.co/jyBHGDMS
chinoynacho,Mi amigo @ElHeredero Y yo celebrando!!!!! http://t.co/BJ3K2vtb http://t.co/76vpkZya
chinoynacho,Hace algn tiempo ella era mi amor platnico @maiamusical !!! Hermosaaaaaa saludos http://t.co/oOIYfPEl http://t.co/cWYWVkgz
chinoynacho,Mi primer regalo de cumpleaos @sgasperj http://t.co/sm0PtGSa http://t.co/xPvbPV6Y
chinoynacho,Nos graduamos en La Academia!!!! http://t.co/JhmolYxW http://t.co/ETkCsTvf
chinoynacho,Mi medalla! Gracias.... http://t.co/ZueMgzyy http://t.co/QemNipnR
chinoynacho,Chequeando el Twitter!!!! http://t.co/jfXBY3JQ
chinoynacho,Welcome!!! http://t.co/YTSMOopm
chinoynacho,Disfruta el segundo tras cmara de nuestro Video Sin Ti. Echale un vistazo! Continuar....... http://t.co/sCV4wz5I
chinoynacho,Rehearsal! http://t.co/qvvoNIsl
chinoynacho,Bali Hai http://t.co/lBCrWTBs http://t.co/aZwVDAIL
chinoynacho,"Videoclip ""Sin ti"" pronto.. http://t.co/JT6mrRlN http://t.co/zKbOgM7P"
chinoynacho,Doctor Yaso with chinoynacho http://t.co/YUUIuemX
chinoynacho,Disfruta el segundo tras cmara de nuestro Video Sin Ti. Echale un vistazo! Continuar....... http://t.co/C6p5kDEn
chinoynacho,La noche es young! http://t.co/jXfL4dFr http://t.co/Rmby3jI9
chinoynacho,Zarkana http://t.co/jUOp1BF6 http://t.co/K2AHoTnZ
chinoynacho,#instacollage el Chef de Tao Las Vegas Gonzalo nos hizo este maravilloso postre! Gracias bro... http://t.co/XA5XlkbF
chinoynacho,ZARKANA http://t.co/jvn0jomr http://t.co/xlCNnfiU
chinoynacho,RT @AlexaOlavarria: Gracias a @budare_Bistro Rica comida! Excelente Los Tequeos ;) #Video #DimeSiTu @EstephyMusic  y @ChinoyNacho :) ht ...
chinoynacho,Hoy me caso en Las Vegas!!!!!!! Jajaja http://t.co/o1RnxJc7 http://t.co/Wl84nuyL
chinoynacho,Vacilate el tras camara 2 de nuestro nuevo video  Sin ti http://t.co/TqfZsw7M  http://t.co/7ywda5Km
chinoynacho, Regalame un Muak  desde el Movistar Arena de Santiago de Chile http://t.co/AFcw6x62  http://t.co/ZFeCCu8z
chinoynacho, Lo que no sabes tu desde el Luna Park de Buenos Aires http://t.co/tQFhjYHa  http://t.co/odqxqHdi
chinoynacho,Walking! http://t.co/GETANiir
chinoynacho,Que harn Elvis y superman juntos? http://t.co/SUO0Xeca http://t.co/1H1HArPt
chinoynacho,Y por eso se gan 5 $! Las Vegas Nevada http://t.co/q9UBWuRs http://t.co/jaqMmicu
chinoynacho,Muy temprano para un new tattoo? http://t.co/lzv3Ot6z http://t.co/cZzuYmgw
chinoynacho,Disfruta el segundo tras cmara de nuestro Video Sin Ti. Echale un vistazo! Continuar....... http://t.co/T0zrYPiL
chinoynacho,Disfruta el segundo tras cmara de nuestro Video Sin Ti. Echale un vistazo! Continuar....... http://t.co/2bE8aUi2
chinoynacho,"Contra las cuerdas del cuadrilatero que cambiar la historia, Las Vegas! http://t.co/FwpLJjby"
chinoynacho,@jesusmiranda @nacholacriatura junto con @estephymusic y @directormf en la grabacion del video de #DimeSiTu http://t.co/WO4QwYkB
chinoynacho,Pasandola bien con @EstephyMusic grabando el video de #DimeSiTu  http://t.co/sq5TmfGT
chinoynacho,Disfruta el segundo tras cmara de nuestro Video Sin Ti. Echale un vistazo! Continuar....... http://t.co/vdwqhvdo
chinoynacho,Disfruta el segundo tras cmara de nuestro Video Sin Ti. Echale un vistazo! Continuar....... http://t.co/ol9SkPwM
chinoynacho,Disfruta el 2do captulo del tras cmara de nuestro Video Sin Ti. chale un vistazo! Continuar.... http://t.co/EianiHqP
chinoynacho,Disfruta el primer tras cmara de nuestro Video Sin Ti. Echale un vistazo! Continuar....... http://t.co/Ow5UAFn3
chinoynacho,Gracias Valencia por su grandiosa energa! La pasamos increble...  http://t.co/salYA0U0 http://t.co/zFL9Q9n9
chinoynacho,RT @AlexaOlavarria: Maana seguimos con la grabacion del #Video #DimeSiTu @EstephyMusic Feat @ChinoyNacho @directormf @ACOCHMusic Good N ...
chinoynacho,"RT @AlexaOlavarria: Maana seguimos con la grabacion del #Video #DimeSiTu @EstephyMusic Feat @ChinoyNacho @directormf @ACOCHMusic """
chinoynacho,Luna Park chinoynacho Live!!! http://t.co/tFh11na4 http://t.co/oNbJiQSr
chinoynacho,Actitud de campen!!! http://t.co/ku6hwx9o http://t.co/5aVx1cXT
chinoynacho,Disfruta el primer tras cmara de nuestro Video Sin Ti. Echale un vistazo! Continuar....... http://t.co/CF1pk0dN
chinoynacho,Disfruta el primer tras cmara de nuestro Video Sin Ti. Echale un vistazo! Continuar.... http://t.co/CSKpcztt
chinoynacho,Disfruta el primer tras cmara de nuestro Video Sin Ti. Echale un vistazo! Continuar....... http://t.co/ByekO1Je
chinoynacho,Disfruta el primer tras cmara de nuestro Video Sin Ti. Echale un vistazo! Continuar....... http://t.co/IA2VRlKO
chinoynacho,http://t.co/BnjEnagK http://t.co/8nHv9u28
chinoynacho,Mi nueva placa! Gracias Argentina http://t.co/Qw8pl6u4 http://t.co/AlKQ0u58
chinoynacho,"Quienes se perdieron nuestro show en el Luna Park,aqu les dejamos un poquito de nuestra msica... http://t.co/e7La7s3x"
chinoynacho,Disfruta el primer tras cmara de nuestro Video Sin Ti. Echale un vistazo! Continuar....... http://t.co/CA7x0M8p
chinoynacho,Disfruta el primer tras cmara de nuestro Video Sin Ti. Echale un vistazo! Continuar....... http://t.co/TZ7wiSZx
chinoynacho,Ral de pana me ganaste con los abdominales pero lo que si es q necesitas playaaaaa! Jajaaja... http://t.co/dOcYCT2O
chinoynacho,Ral de pana me ganaste con los abdominales pero lo que si es q necesitas playaaaaa! Jajaaja... http://t.co/YbhcWcYX
chinoynacho,Ral de pana me ganaste con los abdominales pero lo que si es q necesitas playaaaaa! Jajaaja... http://t.co/kHjxmtwb
chinoynacho,Disfruta el primer tras cmara de nuestro Video Sin Ti. Echale un vistazo! Continuar....... http://t.co/DOnv7J4e
chinoynacho,Disfruta el primer tras cmara de nuestro Video Sin Ti. Echale un vistazo! Continuar....... http://t.co/cYyPIcXS
chinoynacho,Y quien no medita en el bao? http://t.co/InpzZbTW http://t.co/mDuEuf2P
chinoynacho,La camiseta de ella! Jaja http://t.co/RwoUMEwG http://t.co/TZLweLZn
chinoynacho,Desde la ventana de mi aposento en Buenos Aires! http://t.co/pTmmCaBi http://t.co/v7iwxbHG
chinoynacho,Ya en Buenos Aires listo para dormir un buen rato! Nos vemos en la noche Luna Park http://t.co/bm7VvXBL http://t.co/SBj1Y7zE
chinoynacho,El deporte forma parte importante de mi da a da! #pasin http://t.co/xFpkyDEQ http://t.co/2z7vkW98
chinoynacho,Hermosa experiencia vivida ayer con nuestra gran fanaticada Chilena! Gracias por tanto amor en el concierto...nos vemos en el Teleton! Muak
chinoynacho,Orgullo Venezolano! Renny Vega y nuestro mximo goleador en el exterior @richardblanco9 antes de nuestro con... http://t.co/Ffd74xLL
chinoynacho,Nuestro hermano @richardblanco9 en el concierto en Santiago de Chile! Gracias por apoyarnos bro... Pa encima... http://t.co/4zxqnb5A
chinoynacho,@radiodisneyla VIVO a punto de empezar lo nuestro! http://t.co/mfWSEnO2 http://t.co/RQ4hcBlu
chinoynacho,RT @invershow: @chinoynacho orgullo venezolano se presentaran en #Viadelmar2013 y estaran el 02dic en... http://t.co/IzBFcps0
chinoynacho,Hermano gracias por el apoyo@enriquesantos: Felicidades caballos!  Escuchando el conteo de la semana @enriquesantos Bebe Bonita #1
chinoynacho,Escuchando el conteo de la semana @enriquesantos Bebe Bonita #1
chinoynacho,Disfruta el tras cmara de nuestro Video Sin Ti. Echale un vistazo! Continuar.... http://t.co/CSKpcztt
chinoynacho,Abriendo los ojos en Chile! http://t.co/tQZX9zLy http://t.co/ciWKSwxe
chinoynacho,"RT @leonherrera: @ChinoyNacho , Movistar Arena (Chile) Radio Disney http://t.co/PpFgsda1 http://t.co/pd5G3jhm"
chinoynacho,"Venezuela, pronto podrs ver la primicia del tras cmara de nuestro Video Sin Ti, qued Supremo. Pendientes por aqu!!!"
chinoynacho,"Es hora de vacilar un buen video ""Reglame un Muak"" http://t.co/C7qYpLZV http://t.co/jG2UDsT8"
chinoynacho,RT @JackyOlavarria: Ya el tema de @estephymusic esta disponible en iTunes!  http://t.co/vsp9kuON
chinoynacho,RT @LatinBillboards: Las mejores canciones Crossover: Chino y Nacho junto Jay Sean - Beb Bonita. Qu cancin 'crossover' te gusta? htt ...
chinoynacho,RT @nevarezpr: @ChinoyNacho confirmadisimos para el Festival de Via del Mar 2013 http://t.co/f0sCvVGx via @la_patilla
chinoynacho,Lo logramos!!!! http://t.co/ot6J50U3 http://t.co/861EdXpO
chinoynacho,Despegando para Santiago!!!! Largo viaje pero con muchas ganas de compartir con nuestras lindas fanticas de Chile.Muak
chinoynacho,RT @pvillalobosm: CONFIRMADO @ChinoyNacho llevarn su show supremo a la Quinta Vergara #Via2013 http://t.co/SgCP54YL http://t.co/8FA8heJV
chinoynacho,RT @pvillalobosm: CONFIRMADO @ChinoyNacho llevarn su show supremo a la Quinta Vergara #Via2013 http://t.co/SgCP54YL http://t.co/KDTS09vc
chinoynacho,Monkey music! http://t.co/CWu3h6nO http://t.co/8csljTOR
chinoynacho,"Es hora de vacilar un buen video ""Reglame un Muak"" http://t.co/C7qYpLZV http://t.co/vowg6SsK"
chinoynacho,"Venezuela, pronto podrs ver la primicia del tras cmara de nuestro Video Sin Ti, qued Supremo. Pendientes por aqu!!!"
chinoynacho,"Es hora de vacilar un buen video ""Reglame un Muak"" http://t.co/C7qYpLZV http://t.co/U5gPODzc"
chinoynacho,"Es hora de vacilar un buen video ""Reglame un Muak"" http://t.co/C7qYpLZV http://t.co/eCTEP61M"
chinoynacho,Anoche en el estudio con @EstephyMusic grabando Otro Hit Mundial #DimeSiTu http://t.co/rr2dBVF3
chinoynacho,Perdido en el pasillo de mis pensamientos! http://t.co/51pIoQ5U http://t.co/fQSdP83m
chinoynacho,"con la bella @EstephyMusic @EstephyMusic grabando ""Dime si tu""remix http://t.co/Ggqo1ALB http://t.co/BbUhs8gA"
chinoynacho,"con la bella @EstephyMusic @EstephyMusic grabando ""Dime si tu""remix http://t.co/Ggqo1ALB http://t.co/58ikVtK4"
chinoynacho,Quien ms??!! http://t.co/LdkegYCt http://t.co/xO0zzOKm
chinoynacho,Quien ms??!! http://t.co/LdkegYCt http://t.co/fnxcmZOd
chinoynacho,Ahora la ocasin es de gala! http://t.co/AYnJq27b http://t.co/ieapQQya
chinoynacho,Cual es tu parte favorita del video de #ReglameUnMuack (Remix) Feat. @ElPotroAlvarez3? Vanlo aqui:... http://t.co/COVdtZ5f
chinoynacho,Se reg la pintura! http://t.co/lpZxgEuY
chinoynacho,Lunes de TELEMUNDO! http://t.co/bnn9xGDJ
chinoynacho,El Pistolero @ogermenos de unnuevodia jajaja http://t.co/LtVII1cZ http://t.co/H6Frk2sJ
chinoynacho,"Listos para ""Un Nuevo Da"" por Telemundo ""Reglame un Muak"" http://t.co/eIRGPdOo http://t.co/bfLGgjjT"
chinoynacho,"Listos para ""Un Nuevo Da"" por Telemundo ""Reglame un Muak"" http://t.co/eIRGPdOo"
chinoynacho,"RT @jesusmiranda: Listos para cantar el xito ""Reglame un Muak"" en @unnuevodia por Telemundo"
chinoynacho,Ya vamos a poner a todos a bailar en @unnuevodia @Telemundo #regalameunmuack
chinoynacho,RT @UnNuevoDia: @ChinoYNacho  estn con nosotros esta maana y responden a tus preguntas en vivo. Envalas! #CHINOYNACHO
chinoynacho,"RT @jesusmiranda: Listos para ""Un Nuevo Da"" por Telemundo ""Reglame un Muak""  http://t.co/HVDxpZnY"
chinoynacho,RT @leonherrera: @ChinoyNacho en @unnuevodia por @Telemundo promocin video #RegalameUnMuack  @potroalvarez @pvillalobosm @leonherrera h ...
chinoynacho,De vuelta a casa! http://t.co/uwdaxMr3 http://t.co/043haHOa
chinoynacho,Mira el video de Regalame un Muack http://t.co/DgffuR4b
chinoynacho,Mira el video de Regalame un Muack http://t.co/s89cSBtn
chinoynacho,Mira el video de Regalame un Muack http://t.co/TgclPGnY
chinoynacho,Mira el video de Regalame un Muack http://t.co/TCk2glWt
chinoynacho,Mira el video de Regalame un Muack http://t.co/1A7lcIEJ
chinoynacho,"Desde Los ngeles el Do Supremo chinoynacho en la filmacin de ""Sin Ti"" http://t.co/YgxmEsPx ."
chinoynacho,"Desde Los ngeles el Do Supremo chinoynacho en la filmacin de ""Sin Ti"" http://t.co/YgxmEsPx"
chinoynacho,Gracias @julietandreina por este bello regalo en memoria de mi Padre! Dios te bendiga http://t.co/FpnaWoeo http://t.co/KUmOA8pe
chinoynacho,"Maracaibo que felicidad tan grande nos hacen sentir cada vez q nos dan la oportunidad de cantarles! Son increbles, mil gracias."
chinoynacho,"I-ron Man , El Gordo Batman y yo comiendo en Maracaibo!!! http://t.co/mfMSlNqq"
chinoynacho,"Solo horas para que Maracaibo disfrute de nuestro show supremo, estaremos en @expozulia ."
chinoynacho,Maracaibo estn listos para recibir al do supremo? Nos vemos en un rato en la @expozulia.
chinoynacho,Maracaibo estn listos para recibir al do supremo? Nos vemos en un rato en la @expozulia
chinoynacho,Hoy la ChinoyNachoMania en @expozulia ... No faltes!!!!
chinoynacho,"Hoy la chinoynachomania en @expozulia, no faltes!!"
chinoynacho,"Solo horas para que Maracaibo disfrute de nuestro show Supremo, estaremos en @expozulia"
chinoynacho,Maracaibo estn listos para recibir al do supremo? Nos vemos esta noche en la @expozulia
chinoynacho,Lleg el da Maracaibo!!! Hoy nos vemos en el @expozulia ... No Faltes!!!
chinoynacho,"Solo horas para que Maracaibo disfrute de nuestro show supremo, estaremos en @expozulia"
chinoynacho,Llego el da Maracaibo hoy nos vemos en el @expozulia. No faltes!!!.
chinoynacho,Llego el da Maracaibo hoy nos vemos en el @expozulia. No faltes!!!
chinoynacho,Nuestras nias bonitas de Maracaibo estn listas para disfrutar el nuevo show supremo? Nos vemos maana en el @expozulia
chinoynacho,"Maana nos vemos Maracaibo, estaremos en la @expozulia"
chinoynacho,Este viernes 02 de noviembre el do supremo llega a la @expozulia en Maracaibo. Te esperamos!
chinoynacho,Maracaibo! Estn listos para recibir la chinoynachomania?? Maana nos vemos en @expozulia No faltes!!
