desta80s,"Hahahahahhaa kereen!! RT @Iwa_Kusuma: Tanaman yg hobby-nya ngancem = Macam2, Ku TEMBAK KAU #sawityowit"
desta80s,Bunga yg Rano Karno? --&gt;'Tulap TULIP lampu di kota.. Lirak lirik matamu nakal.. &lt;--  you Bang Rano.. Senin Selasa Rano.. #sawityowit.
desta80s,Pohon yang banyak robotnya? --&gt;'PALEM Transformer 3' !!! | itu peleeeeemmmmm baang!! | #sawityowit
desta80s,"Tanaman liar yg usianya sebaya dengan ibu2.. --&gt; ""SE EMAK-SE EMAK"" #sawityowit"
desta80s,"Pohon yg selalu punya visi ke depan menggapai cita2.. --&gt;""Pohon BER INGIN"" #sawityowit"
desta80s,Hayuklaah dimulaaiii #sawityowit tema tanaman2 nyaaa.. Mariiiiiiiii.. :)
desta80s,Waduh lecet.. :(
desta80s,"Tema #sawityowit nanti: tanaman2, bisa pohon, bunga, dll.. Cnth: Bunga yg ga pernah nyeker? 'KEMBANG SEPATU'.. Sampai jumpa di sahur.. :)"
desta80s,Presiden dan Menteri2 lain diajak jg dong Pak.. ;p RT @temponewsroom: Tekno - Menteri Tifatul pun Ikutan #Sawityowit  http://bit.ly/ncl0Rw
desta80s,Eh udah liat poster nya.. GET MARRIED 3.. :) @nirina_zubir @amink80 @ringgoagus @fedigarasi http://lockerz.com/s/127719350
desta80s,Eluuhh seharian kmrn setaann!! RT @vincentrompies: Ckck..sapa tuh orgnya?! Marahin aja bos admin!! RT @desta80s: Admin ngilang saat2 kritis!
desta80s,Admin kurang ajar.. Br muncul! Ngilang muluk di saat2 kritis!! -___-' RT @vincentrompies: Yeaaaaayyy!! Tnyata Saya admin #sawityowit jg :DD
desta80s,"Met subuh an iwak pitik, iwak empal.. :D RT @Iwa_Kusuma: Ayo semua jawaaaaab : wa 'alaikum salaam, gaaan ;p RT @desta80s: Assalamualaikum :)"
desta80s,Assalamualaikum.. :)
desta80s,Saya pamit #sawityowit nya yah.. Mau siap2 Subuh an.. Yg masih mau main silakan.. Thx buat yg udah ikutan nyawit lg hr ini.. Sampai besok :)
desta80s,"Vitamin nya oke nih ;p RT @tifsembiring: Binatang ini sering dinyanyikan anak2 TK: ""ITIK-itik bunyi hujan di di atas genting.."" #sawityowit"
desta80s,Binatang yg udah ga tahan? --&gt;'Ayo Bang.. SE EMUT ajaa kok.. Janji deh Bang.. Yah yah yah? &lt;--belum imsak kan? ;p #sawityowit
desta80s,Binatang yang banyak mau.. --&gt;'PINGUIN tas.. Pinguin sepatu.. Pinguin baju.. Pinguin semuaah nyahh!' | maruk luh!! #sawityowit
desta80s,Binatang yg lg malem pertama? 'BANG AUUU.. Geli Baang.. Ihik.. Bang.. Ah..' #sawityowit
desta80s,Binatang yg takut ngebut? --&gt;'BUNG LON alon waeee!! Ra sah banter2 ah!!! Wedhiii akuuu!! :( #sawityowit
desta80s,Nongol jg nih kampret!! Hahaha RT @vincentrompies: #sawityowit Binatang yg ikut2an mulu ---&gt; Curut berbahagia..Curut berduka..Curut serta
desta80s,Binatang yg masuk keajaiban dunia? --&gt;'BURUNG KAKAK DUA..' Huaaa hebaat burungnya kakak duaa!! Pipisnya gimana kak? #sawityowit
desta80s,Binatang yg heran sama beha? --&gt;'KO BRA? | emang kenapa? | kok bra? | iye ah gue copot deh noh!! Nanya muluk!! #sawityowit
desta80s,Binatang yg selalu nolak tanpa alasan.. --&gt;'GA AJAH'.. Alasannya apa? | yaa.. ga ajah.. | Terseraaahh!! #sawityowit
desta80s,Binatang yg ada di iklan baris? --&gt;'Dijual KIJANG 2005 silver met matic body mulus ex dokter STNK panjang nego'.. #sawityowit
desta80s,Binatang yg pertamax gan? 'KUSKUS.us'&lt;--Masih newbie nih gan.. Maaf ya agan2.. Ijin nyedot gan.. Cendol ijo gan.. #sawityowit
desta80s,"Horeee akhirnya ikutaan!! Hahahahaha RT @oomleo: ..ikan apa yang cewek'nya dua, cowok'nya satu? &lt;- ikan teri.. (..teri-some..) #sawityowit"
desta80s,Binatang yg muncrat2? --&gt;'CURUTT!!! Cruutt!! Cruutt!! Curuuttt!! Cruutt!!' #sawityowit
desta80s,Binatang yang rupa2 warna nya? --&gt;'BABON' ku ada 5' &lt;--yg ijo meletus dong babon nya? #sawityowit
desta80s,Ikan yg ketawanya aneh.. --&gt;'HIUhiuhiuhiuhiu..' | dimana2 mah 'huahuahuahua' kalliiiiiii!! #sawityowit
desta80s,Ikan yang diem mulu.. --&gt;'Ikan PAUSE'  | di Play makanyaaah! Biar geraak2!! #sawityowit
desta80s,Binatang yang boring? --&gt;'Aaahh sudaaahhh!! Aku BISON!!! &lt;--bosen bang bukan bison.. | aahh biarinnn!!! Bodooo!! #sawityowit
desta80s,Binatang yg 'bersama2'? --&gt;'BERANG2' &lt;--bareng2 bang bukan berang2  | hadeeh salah muluuuk akuuuh!! :'( #sawityowit
desta80s,Binatang yg dicipok di leher? --&gt;'CAPUNG' &lt;--itu cupang bang bukan capung..  | baiklah saya mengaku salah lagi.. :( #sawityowit
desta80s,Binatang yang lawannya 'salah'? --&gt;'BELUT!!!' &lt;--betul bang bukan belut..  | oiya maap.. #sawityowit
desta80s,Yuk deeeh dimulai #sawityowit tema binatang2 nyaaa.. Sikaaaaaat!! :D
desta80s,Setengah 4 yah kita mulai bareng2 #sawityowit nya.. Nanti dikasih aba2 kok.. Saya mau nyiapin mam sahur dulu niih.. :)
desta80s,Happyyyy Birthdaaaaay sansaaan kuuuuuuuh..  @SandraDewi88
desta80s,"Tema #sawityowit nanti: ""Binatang2"".. Contoh: binatang yg raja banci.. 'KING seKONG'.. Sampai jumpaaaa sahur nanti.. Cherioo.. :)"
desta80s,Besok2 kalo belum pk clana jgn buka pintu duluu.. Hahaha RT @widikidiw: @vincentrompies @desta80s orgiill! Ga santai ngebel kamar sayah haha
desta80s,Tungguin tema #sawityowit jam 10 malem nanti yah.. Minum vitamin dulu yuk biar semangat nyanyi eh nyawit nyaaa.. ;p
desta80s,So.. Sahur nanti jadi nih kita fun2an main #sawityowit lg? Coba mau liat.. Manaaa semangaaaat nyaaaaa??? ;p
desta80s,Indahnya kalau kita bisa seneng2 dengan menjaga suasana yang damai dan bersahabat.. Setuju yah? :)
desta80s,Mandi udah.. Wudhu udah.. Duduk cakep.. Nungguin adzan Subuh.. Ga bole main keluar lg kata mama.. :)
desta80s,Sebelum sahur mandi dulu aaaahh.. &lt;--apakah ini akan memancing org berasumsi negatif yg tidak2? Hmmm.. padahal sih.. Emaaang.. ;p
desta80s,Masih ada kesempatan kalian buat jadi #1000VIPBlade cuma sampe jam 9 mlm ini!Asik kan beli motor+dapet BBM 2jt+bonus exclusive! @welovehonda
desta80s,Big hug :) RT @dagienkz: To brow @marcellsiahaan mohon maap sbesar2nya. Gr2 kami MOKONDO (MOdal KOnyol DOang) jd teribetkan. Maap ya brow :p
desta80s,"Kalo badan lg pegel2 gini, minta tolong dipijitin Mbok Sum enak nih.. :) http://lnk.ly/0h4"
desta80s,"RT @dagienkz: Stlh nyubitin @desta80s yg geblek & sentilin @vincentrompies yg ngumpet, kita sepakat #sawityowit will be back on monday saur"
desta80s,@ndorokakung sudah sana kamu mainan instagram aja sana.. :D
desta80s,Bingung ada yg ngebahas soal brenti nya #sawityowit serius bgt.. Sampe berasumsi segala.. Lha wong ini acara kan isi nya guyonan doang? :D
desta80s,Hahahaha cc @dagienkz @vincentrompies RT @cah_ndableg: #komiktwit RIP #sawityowit 6 Ramadhan 1432H http://twitpic.com/61qqc9
desta80s,#sawityowit adlh mainan iseng2 for fun.. Kalo brenti kan bs krn admin2nya capek & lg ngerasa garing.. Knp hrs salah2an? Jgn pd serius2 ah ;p
desta80s,Kesempatan kalian buat jadi #1000VIPBlade cuma hari ini!yuk buruan dateng ke citos!kapan lgi beli motor dapet BBM 2jt! @welovehonda
desta80s,"Sudah ah, brenti yg ngata2in & nyalahin org di bulan Ramadhan.. Ya udah, garing ga garing #sawityowit bakal segera balik lg kok.. Setujuu??"
desta80s,Indahnya adzan Subuh membelai telinga.. Yuk kita tunaikan ibadah solat Subuh.. Selamat berpuasa.. Assalamualaikum.. *coba insyaf
desta80s,"RT @dagienkz: Utk menjawab semua kebingungan2, keputusan final adalah #sawityowit dihentikan sampai batas waktu yg tdk ditentukan..Trims"
desta80s,@AbdulAdul ngikut aja luh.. Hahahahaha.. Kangeeen.. :(
desta80s, Putih2 melati Ali BUBAR.. Merah2 delima pinokio..  RT @davidbayu: @dagienkz @oomleo @desta80s jd panjang bubar gini..?
desta80s,Topi saya Bubar.. RT @davidbayu: Cukur rmbut di Bubar Shop RT @oomleo: steak cipete A Bubar RT @desta80s: Justin Bubar #sawityowit bubar?
desta80s,Justin Bubar.. RT @oomleo: lah? #sawityowit bubar? candi borobubar.. RT @davidbayu: jd tema #sawityowit ntar bubar aje ..bubar kacang ijo
desta80s,To @vincentrompies @dagienkz bilangin deh nih orang.. Capek gue jawab in nya.. Ga ngerti2 dibilangin.. --&gt; @ERSHAD hahahahahaha :D
desta80s,@ERSHAD knp gue yg umumin tema krn kebetulan dr jumlah followers terbanyak biar semua tau tema nya apa.. Yg lain tinggal RT.. Akur?
desta80s,@ERSHAD makanya jgn ambil kesimpulan ndiri bro.. Bedain yg ga tau sm pura2 ga tau.. Jgn pake emosi makanya ah.. Apalagi nuduh2.. :)
desta80s,"@ERSHAD Semua keputusan, tema, dll itu kita meeting in dulu bertiga sebelum di lempar.. Ga usah pake otot bro.. Santai aja.. Serius amat :)"
desta80s,Huakakakakaka kampret luh! :D RT @davidbayu: @desta80s pasti bnyk yg ngetwit ke elo menyangka nyokap lo adlh Christian Sugiono
desta80s,"Mama nginep di apartemen ku.. Mau nyiapin dan nemenin sahur katanya.. Pdhal mama ga puasa.. FYI, she's Christian..  my mom.. :)"
desta80s,Lg rencana beli motor? Mending bsok langsung ke citos ikut jadi #1000VIPBlade langsung dapet BBM 2jt! http://bit.ly/VIPBlade @welovehonda
desta80s,@mother_gaia iyaaaa.. Hmmmm.. Nama kamu kok familiar yaah.. Hehehehhee
desta80s,"Selain dapet BBM 2jt, byk lho hadiah menunggu tiap jamnya! cuma besok kesempatan jadi #1000VIPBlade http://bit.ly/VIPBlade @welovehonda"
desta80s,Udah!! Pamit!! Bay bay!! BAYBAY Pamungkas.. RT @Ari_lasso: Waduh dismash?!..bisa MENTAL dellaconcetta dong.. @dagienkz @Bijiganja
desta80s,Ssssstttt.. Udeh.. ntar ada yg sensi.. Susi SuSENSI.. Di SMASH mauk luh? RT @dagienkz: ye udeh deh yusuupp @davidbayu @Bijiganja @Ari_lasso
desta80s,Udahan yak.. Gue malah jadi aus nih.. AUS!! ANJING GALAK!! @dagienkz @davidbayu @Bijiganja @Ari_lasso
desta80s,eNAIF is eNAIF!! Cukuuup!! RT @davidbayu: Udah Royani RT @desta80s: Udahan.. Gw mau pemotretan dulu.. Buat iklan.. Iklan Fauzi..  @dagienkz
desta80s,Udahan.. Gw mau pemotretan dulu.. Buat iklan.. Iklan Fauzi.. RT @davidbayu: udahan ah ud Lemes istriny Adi Ms @dagienkz @desta80s @Bijiganja
desta80s,Udah ah capek.. Mau istiRahat Abbas.. RT @davidbayu: Ud mas Ari Ngasso aje RT @desta80s: Bener2 Edo KONYOL ogit luh pada! @Ari_lasso
desta80s,Sory Aquino mbak.. RT @djenarmaesaayu: Kalian Ampun deh Sasmi @dagienkz: Ya ya c noer @desta80s: Haha Miharja @davidbayu: Gak Lucu Cahyati
desta80s,Bener2 Edo KONYOL ogit luh pada! RT @Ari_lasso: Ck ck..parahh!! Azari RT @davidbayu: LOL a Amaria RT @desta80s: Haha Miharja
desta80s,#sawityowit udah bubar woi! Aming2 jabang bayi deh! RT @dagienkz: Ya ya c noer RT @desta80s: Haha Miharja RT @davidbayu: Gak Lucu Cahyati
desta80s,Haha Miharja.. RT @davidbayu: Gak Lucu Cahyati RT @desta80s: Garing nugroho luh Pit.. RT @davidbayu: Tau Norak jones #sawityowit
desta80s,Garing nugroho luh Pit.. RT @davidbayu: Tau Norak jones RT @desta80s: Setuju! #sawityowit Bubarin aja! RT @MarcellSiahaan plesetan basi
desta80s,H-1 nih buat kamu yang mau jadi satu dari #1000VIPBlade kapan lagi beli motor dapet BBM 2jt?! http://bit.ly/VIPBlade @welovehonda
desta80s,Hahahahahaha.. Kalo begitu resmi #sawityowit bubar.. Assalamualaikum.. RT @dagienkz: Asli! RT @desta80s: #sawityowit bubarin aja!
desta80s,@typonaboigraphy hah nyusu? Ora iso! Agek poso mbak.. Ora enthuk ngombe.. Opo neh susu.. Ngawor ae sampeyan.. :D
desta80s,Setuju Cel! #sawityowit garing! Bubarin aja! RT @MarcellSiahaan: Main plesetan nama saat ini sesungguhnya adl sudah sangat garing & basi :))
desta80s,Adzan Subuh pun berkumandang.. Mari kita sholat.. Tutup dulu #sawityowit nya yah.. Becok main lagii.. Assalamualaikum.. :)
desta80s,":D RT @vincentrompies: #sawityowit Band yg isinye Banci pd rame2 pergi belanja --&gt;""30 Sekong to Mall"" |*aihh...mate, akikah ikut donks cyiin"
desta80s,Band nya temen adik gue.. 'ANDRI & THE BABOON' &lt;--serius ini ada! bukan pelesetan.. *trus ngapain ikut disiniiiii??? #sawityowit
desta80s,@anandita_dita dik @ariffsuyono braninya ke DM gue dit.. Hahahahhaaha
desta80s,Band Indonesia yg suka sesama jenis? --&gt; Yanto: kamu pilih siapa Zee? | Zee: 'ZEE VILIH LIA'.. Aishiteru Lia..  #sawityowit
desta80s,Band yg janjian kopi darat sama pedangdut Ira Riswara.. 'PIYE RA?' Sido iki ora? Jam piro sing enak?.. #sawityowit
desta80s,Band yg mau jawab tp ga selesai krn keburu mencret? --&gt;Jam brapa mas? | 'JAAAM... BRUUUUTT!!' | Huaaa kecepirit vokalisnyaa!! #sawityowit
desta80s,"Band yg ahli debus lg nulis diary? ""Dear Diary.. Hr ini aku mamam BELING 182 keping.. Cekayang atit nih tenggoyokannya.. :("" #sawityowit"
desta80s,Band yg kuat dan jantan.. --&gt;'D EWE 19'.. Gileeeee cing!! 19x?? Sadiiss!! Ga pegel mass? #sawityowit
desta80s,Band 'cari jodoh' yg dibuat film animasi holiwut!! *ikut bangga #sawityowit http://lockerz.com/s/126590107
desta80s,Band yg kecemplung selokan.. --&gt; 'GOOOTTT.. BLESSSSS!!' Nyungsep kaaaann!! :( #sawityowit
desta80s,Band yg sering digrebek ormas.. 'KOEST PLUS PLUS'.. Daerah mana tuh kost2an nyaa maass?? Jam2an ya mass? #sawityowit
desta80s,Band yg kalo disebut namanya ditanya balik terus.. 'ADA BAND!' | Mana? | Ada band! | mana? &lt;--tuh kan nanya mulu!! #sawityowit
desta80s,Band yg suaranya kayak bayi yg sedang disusui.. 'SOUND NETEK group'.. &lt;--Terrrlaluuuu.. #sawityowit
desta80s,Band yg ngeyel.. --&gt;'ARMAN ADA' |Arman di Gigi bukan Ada Band mass.. | Arman Ada! | Bodo ah!! Mau dibawa kemanaa #sawityowit
desta80s,"Band yg mendatar dan menurun.. berapa kotak tuuuh? ""Teka teki SLANK"" #sawityowit"
desta80s,Band yg kalo manggung ngga pake daleman? 'BAND TUBLES' #sawityowit
desta80s,Ayuk laaah.. Dimulai #sawityowit nyaa!! Tema band lokal or internasional yaaah.. Beriiiiii!!!! Hajaaar!!!
desta80s,Tema #sawityowit sahur nanti : nama2 band lokal dan internasional.. Contoh: band yg ngeces mulu.. 'THE ILLERS'.. Sampai jumpaaa.. :D
desta80s,Cuma sabtu bsok nih beli motor bisa dapet BBM 2jt! Yuk ke citos ada #1000VIPBlade @welovehonda klik http://bit.ly/VIPBlade utk infonya!
desta80s,2 hari lagi Citos siap nunggu kamu yg mau beli motor + dapet BBM 2jt! Klik http://bit.ly/VIPBlade atau follow @welovehonda !
desta80s,Persamaan yg cukup signifikan antara diriku dan Andi: kita sama2 bersahaja :)  http://lnk.ly/0h4
desta80s,Becoming a new member of the X-Men!! Nama yg cocok apa yah? ;p http://lockerz.com/s/126426862
desta80s,Siap2 Subuh an dulu yuuk.. Besok mainan lg #sawityowit nya dgn tema berbeda.. Thx yg udah ikutan.. Pamit yah.. Assalamualaikum.. :)
desta80s,@anandita_dita @ariffsuyono hahahhahahaa.. :D
desta80s,"Artis yg terobsesi disunat? ""BETA RIA, SUNAT AH"" Eee kamu nama Ria eee wanitaa!! Eee wanita seng punya buruuung!! #sawityowit"
desta80s,Vokalis yg kalo latian bola berasa ngilu melulu.. 'GIRING BIDJI' | Pelatih: Yg digiring bola nya masss.. Kenapa biji luuhh? #sawityowit
desta80s,"Artis yg tiap sore ngingetin sholat mulu.. ---&gt; ""AYUUUK AZHAR IIHHH.."" #sawityowit"
desta80s,Kampreet!! Hahahahaha RT @davidbayu: Artis yg rajin mengajar agar lulus sekolah  Bimbo ( Bimbingan Bolajar) #sawityowit
desta80s,Artis yg abis buang air besar udah di flush tapi ga ilang2? --&gt;'SIREM SUKAR' nongol lagi nongol lg tuh eek nya.. #sawityowit
desta80s,Hahahhahaa RT @akeung_ough: Artis plin plan.. Jessica is kandar.. | jesica.. Apa kandar nih namanya ? :| #sawityowit
desta80s,Artis yg ga percaya dibilangin kalo pacarnya boong? --&gt;'DUDE.. HER LIE.. NO?? Cmon dude!! Damn dude!!' #sawityowit
desta80s,"Vokalis yg selalu dikira belum punya band? ""DONI ADA BAND?""&lt;--Ada Bang..| Apa namanya?|Ada.. | iyaa..Apa namanyaaaa? | Adaaa!!! #sawityowit"
desta80s,"Vokalis yg kaguum sama grupnya sendiri ---&gt; ""WIDIIIIIIIIIIIIIIIII.. VIERRAAA.."" #sawityowit"
desta80s,Hahahahaha RT @angga_achmad: Artis yg gak pernah salah *rianty that'sRight* #sawiyowit
desta80s,Artis yg ilang di masjid? --&gt;'SANDAL DEWI' | Yanti: Maaf ya Wi sandal yg kupinjam hilang.. Nanti kuganti.. :( | Dewi: HARUS!! #sawityowit
desta80s,"Aktor yg kalo bangun pagi kepala belakangnya berasa berat? ""Vino Basian"" &lt;--basian apa soob? Barang sugab niih.. #sawityowit"
desta80s,Artis yg kenalan nanya mulu.. --&gt;'LU NAMA YA?' |  Desta mbak.. | 'Lu nama ya?' | Destaaaa Mbaaakkk!!!!! Hadeehh!! #sawityowit
desta80s,Hajaaar!! Kita mulai #sawityowit !! Tuh buat yg udah pd ga sabar.. Temanya artis Indonesia yaah!! :)
desta80s,Biasanya buat lebaran ada yg pengen motor baru nih.. Jadilah #1000VIPBlade & langsung dapet BBM 2jt. Info: @welovehonda
desta80s,Buset udah pada colongan duluan #sawityowit .. Tunggu aba2 dong biar bareng.. Ngga susah kok buat sportif.. ;)
desta80s,"beli motor bisa dapet BBM 2jt? Seru nih, follow & tanyakan aja langsung ke @welovehonda #1000VIPBlade"
desta80s,PERHATIAN!! Tema #sawityowit sahur nanti.. Nama2 artis Indonesia.. Contoh: vokalis yg apakah nyata? 'ARE REAL?' Sampai jumpaa.. Cheriooo..
desta80s,"Buat yg lagi mau beli motor, tgl 6 agustus bakal ada #1000VIPBlade langsung dateng aja ke Citos! info lanjut ada di @welovehonda"
desta80s,Wow kereeen.. Dibahas pake bhs inggris.. ;p RT @PennOlson: How the #SaWitYoWit Twitter Hashtag Entertains During Ramadan http://t.co/18hMc1F
desta80s,@Rajatiina untung ga jadi hari ini.. Hahahhahahaa.. :D
desta80s,Hari ini dan kemaren buka puasa pake kambing mulu.. Hadeeh mana ga ada lawan nih.. Lawan main PS maksudnyaah!! Puasaaaaaaa wooii!! :D
desta80s,"Pengen ke Tanah Suci deh.. Yuuk Bu Ratna, kalo mao pergi ke Mekkah kabar2in yaaa, pergi barengan yuuk.. http://lnk.ly/0h4"
desta80s,#sawityowit itu apa sih mas? ;p RT @sigantengaduhai: @desta80s @dagienkz @vincentrompies TT Indonesia pagi ini http://twitpic.com/601enn
desta80s,Alat rumah tangga yang Terlalu Manis? --&gt;Kaka SELANG!! Piss!! Bim Bim juga Piss!! #sawityowit
desta80s,Alat buat ulek sambel yg bisa bersihin sisa buang air besar.. --&gt;'CEBOK' &lt;--itu cobeeeeekk!!!!! #sawityowit
desta80s,"Alat rumah tangga yg bikin si adik males nyupir mobil? --&gt;""Ka.. SETIR KAA.. Adik capeek.. Lemeess.. Yah yah yah?"" #sawityowit"
desta80s,"WC yg kepo pengen liat anu? ""TO'OL LIET dong boleh? Liet dikit ajee"" --&gt;liat maksudnya? | ken jekerte Beng.. Gimene seh?"" #sawityowit"
desta80s,"Alat rumah tangga yg punya 'Lidah seperti Pistol dan Kebun binatang kelelawar'?? ""GUNS TOUNGE AND BAT ZOO"" #sawityowit"
desta80s,"Alat perekat yg bisa bikin beku dan lahirnya antara 21maret-20 april? --&gt;""LEM ARIES"" #sawityowit"
desta80s,"Alat dapur gaul yg sok asik minta dikirimin anjing.. ---&gt;""SENT DOG SOB.. Plis sob.. Sa'ik ja'e.. Sabi sob.."" #sawityowit"
desta80s,Tempat cuci tangan yg ga boleh lewat kalo pake sendal.. --&gt;'WES TA' PEL!!! Sendalmu copot sik!! #sawityowit
desta80s,"Alas kaki yg dipakai biar ga kesetrum pas nyolokin strikaan bentuknya Boneka matahari berkaki mobil? ""SUN DOLL JEEP FEET"" #sawityowit"
desta80s,"Alat rumah tangga yg hip hop.. --&gt;""PISS YOW dapur yow!! Whazz up yow!! Motong bawang yow!! #sawityowit"
desta80s,Wadah jinjingan yang bikin 'Lidah Bisa Setebal Kilat'--&gt; 'CAN TOUNGE FLASH THICK..' #sawityowit
desta80s,"Alat makan yg brisik minta diangkat mulu? --&gt;""Piriiiing.. Piriiiing.. Priiing.. Halloooh capa niiih?"" #sawityowit"
desta80s,"Alat makan yg bikin tukang bakso keki ditanya mulu.. ""MANG KOK?"" --&gt;Kok apaa dik? Kurang saos? Kurang asin? Kok apa ayo jawaab!! #sawityowit"
desta80s,"Alat pemotong yg cinta damai tapi ga mau ambil pusing..--&gt; ""PISS.. AUU aaahhh terserahh deehh.."" #sawityowit"
desta80s,Yuk #sawityowit MULAIIII!!! Alat2 rumah tangga!! MARIIIII!!! SIKAAT!! HAJAARRR!!
desta80s,"ATTENTION!! Tema #sawityowit nanti alat2 rumah tangga.. Cnth: sapu, pel, piring, mesin cuci, kompor, dll.. Sampai jumpaa di sahur!! :)"
desta80s,Luar biasa yg ikutan #sawityowit hari ini!! Wooow!! Tutup dulu yah hr ini.. Bsk lanjut lg dgn tema berbeda.. Pamit.. Assalamualaikum.. :)
desta80s,Huahahahaha RT @renggototwitt: Buah yang nanya2 --&gt; Nang endi? Iku lho NANGKA tok sing blue jeans iku.. #sawityowit #edisipurwokerto
desta80s,"Buah yang alay? --&gt;""83L1m81n6' #sawityowit fOL83k pLiZz.."
desta80s,Huahahahaha RT @vincentrompies: #sawityowit Buah yg nembang Tenda Biru ---&gt; Leci Ratnasari #hancooorminaaah
desta80s,"Buah yg rasanya kyk ""semua muntah kucing""? --&gt;""ALL PUKE CAT"".. Hueek.. #sawityowit"
desta80s,"Oiya maap.. Hahahaha RT @adamsubarkah: Bukan buah..RT @desta80s: Buah yg berjasa bagi wanita2 Indonesia? --&gt;""UBI Kita Kartini"" #sawityowit"
desta80s,"Buah apa yang kebelet kencing mulu? --&gt;""Jeruk Pipis"".. Nipiiiiisssss itu mah Baaaang!!! #sawityowit"
desta80s,Buah yang bikin Melisa triping.. --&gt;'MEL ON soob!! Haceeep!!''  aringkingking  '#sawityowit
desta80s,"Buah yang jago nyundul.. ""BUAH mbang Pamungkas!!"" #sawityowit cc @bepe20"
desta80s,"Buah yang bisa mencegah kehamilan? ""PIR KB""#sawityowit"
desta80s,Huaahahahahaha RT @ericobonaparte: Apa nama buah asal Timor Leste yang bisa nyekek orang ? Raul LEMON #sawityowit
desta80s,"Buah yang nyolot mulu? ""APE Loooo haah haahh???"" Santai Bang.. Santai.. Istighfar!!#sawityowit"
desta80s,Buah yang kagum sama tai mata? --&gt;'BELEK WAAHHH!!!' #sawityowit
desta80s,Horee dapit ikutaan!! Hahahhahaa RT @davidbayu: Buah yg tajem buat nusuk belanda  Jambu runcing #sawityowit
desta80s,Buah yg nafsu mau cipok si Mark.. --&gt;'MARK KISS AAHHH!!' #sawityowit
desta80s,Buah yg nyerah sama pacar nya.. --&gt;'PISS YANG..' damai yaah..   #sawityowit
desta80s,Yuk #sawityowit tema buah2an kita mulaaai!!! Cc: @vincentrompies @dagienkz
desta80s,"Tema #sawityowit sahur nanti: BUAH2AN.. Cnth: buah yg nembang Tua2 Keladi.. ""ANGGUR C. Sasmi"".. :) sampai jumpa.. Tunggu aba2 yah.. ;p"
desta80s,"Masa rambut kok rontok,lama2 gundul loh! :p Nih pake shampo Clear doong biar rambutmu indah seperti rambutku *sibak rambut ala iklan shampo*"
desta80s,Tutup dulu yuk #sawityowit nya.. Bsk kita hadir lg dgn tema baru.. Hr ini baru awal.. Ikutin terus.. Edisi2 depan akan ada THR nya loh!! :)
desta80s,"Hidangan makan sahur yg bikin 'Saya menyuruh anjing pergi'--&gt;""ME GO DOG!! Go!!"" #sawityowit"
desta80s,"Hidangan cemilan sahur dari kakek2 yg direndem air mendidih? --&gt;""SI NGKONG REBUS"" Sadiiisss ih!! Kasian yg makan.. alot!! #sawityowit"
desta80s,Horeeee!! :D RT @Indro_Warkop: @desta80s @dagienkz @vincentrompies sukses #sawityowit nya! Aku baca terus. Hahaha.. Nanti sekali2 ikutan ah
desta80s,"Hidangan minum sahur yang lg asik malam pertama dgn wanita Sunda? --&gt;""TEH CELUP ya Teh.. Siap2 atuuh.."" #sawityowit"
desta80s,"Hidangan lauk sahur yg bikin pacar bisa ngomong jujur.. --&gt;""SAY.. U'R.. ASEM.. pake deodoran gih!! #sawityowit"
desta80s,"Hidangan minum penutup sahur yg perawatan kulit nya berhasil.. ""AIR PUTIH deh.. Dulu padahal kan item bangeeet!!"" #sawityowit"
desta80s,"Hidangan minum sahur yg memperingatkan tuan untuk brenti saat lampu merah.. --&gt;""SIR OP  MERAH sir!! Op!!"" #sawityowit"
desta80s,Hidangan lauk sahur yg mengira kita ga tau apa2.. --&gt;'Tahu Tempe?' Tahu laaaaah!!! #sawityowit
desta80s,Hidangan lauk sahur yg bikin bertanya2 kita ini kenapa sih? 'Sayur LO DEH!' Lah gue kenapaaaa? #sawityowit
desta80s,Mulai yuuk #sawityowit nya!!! Cc: @dagienkz @vincentrompies
desta80s,#sawityowit nya tunggu aba2 yah.. Jgn pd colongan ah.. Biar bareng.. Nanti jam setengah 4 an mulai nya.. Thx.. :)
desta80s,Tema #sawityowit sahur pertama nanti.. Hidangan2 saat sahur.. Termasuk minuman.. Contoh: nasi yg dicari sampe Argentina? 'Nasi Rudin'.. :)
desta80s,"Gampar ye! RT @vincentrompies: ""Trnyt lbh mudah mengurus #sawityowit drpd mengurus percintaan"" -Desta(komedian &drummer band--&gt;sblm dipecat)"
desta80s,Huahahahaha kampreet!! RT @vincentrompies: RT @Fabregas: Masa depan saya tdk tergantung Arsenal atau Barca..semua tergantung #SAWITYOWIT
desta80s,Coba dijawab: apakah ada yg menantikan #sawityowit di bulan ramadhan kali ini? Digelar atau tidak nya tergantung jumlah peminat.. ;p
desta80s,Ziarah papa.. :(
desta80s,Pemain timnas kedua yg jd korban setelah @Bustomi_19 !! Huahahahaha.. RT @bepe20: @desta80s: Affuuuuuuuu...!!! Wakakakaka.. Ajari aku dhul..
desta80s,"Makanya.. Ga boleh jealous.. Itu efek nya.. ;p RT @Frandaaa: Today, I don't feel like doing anything.."
desta80s,"Daripada follow yg ga jelas, mending follow yg pasti2 aja deh @hikmahpuasa :)  http://lnk.ly/0h4"
desta80s,Nice to meet you @nadyasiddiqa .. :)
desta80s,@latashaharahap hahhahahaa yg mana latashaaa? *jadi penasaran.. Btw i saw you loh td di GBK.. :)
desta80s,@iqbalrais gue lg di turki.. Maap.. :)
desta80s,Pfiyuuuuhhh menegangkaaaan.. 4-3!!!! Yesssss!!!!! Ayo terus berbenaah!!! Jalaan masiiih jauuuh!! Garuda di dadakuuu!!!! :)
desta80s,Puas kamu tuduh aku? *muka putih leher item perawatan gagal RT @SandraDewi88: @desta80s diam kamu pembohong!Gebrak meja terus muka merah
desta80s,Waduh.. Makin ribet nih.. Aku.. Aku.. Bayi gurita.. Loh? RT @Frandaaa: @desta80s hiyaaahhh... Dan SAYA bacaaaaa deehhh...!!!!
desta80s,"Denger penjelasan aku dulu Sandra! *close up mata menatap tajam berkaca2 RT @SandraDewi88: @desta80s halah, g liat tuh miss ama siapa subuh2"
desta80s,Eh datang jg akhirnya jodohku.. Terima kasih air terjun.. :) RT @SandraDewi88: @desta80s bukan anak Tuhan!!!!!
desta80s,Datangkan jodohku!! Sembah air terjun.. *ciri2 berhala.. pantes ga datang2!! -____-' http://lockerz.com/s/124344394
desta80s,Siapa itu td yg dateng hmm? :( RT @olla_ramlan: Eh ketemu @desta80s :) for sharp plasmacluster... :)
desta80s,See you soon @Frandaaa .. Miss you so much.. ;)
desta80s,Bagi2 1 iPad2 + 3 voucher belanja @Rp 1juta aah.. Gratiss... http://lnk.ly/0h4. Follow juga @hikmahpuasa buat live updatenya :)
desta80s,"Yeaaay!! RT @candisoeleman: Dear @sumvelo,@TH3CASH bike love vclip is ready for tonight @t_ORASUDI_ro @vincentrompies @desta80s @cyclonesia"
desta80s,"Sulit mas.. Gimana kalo ukuran yg lain? ;p RT @bepe20: Sebutkan saja ukuran sepatunya, biar jelas.. #eh RT @desta80s: Bukan.. Bukan @bepe20"
desta80s,"Bukan.. Bukan @bepe20 !! Dia sih lebih dari sekedar 'ga ramah'!! Hahahahaha.. Silakan mas bepe diumumkan, kan td udah saya kasih tau.. :D"
desta80s,"Wkwkwkwk :D RT @bepe20: @desta80s  Ah perasaan aja kali.. Satau gue pemain tersebut suaranya jelek, jd tdk mungkin dia berlagu #eh belagu"
desta80s,"Waduh @vincentrompies ,lagi sibuk ikutan kuis nya nih! Hadiahnya 1 iPad2 + 3 voucher belanja @Rp 1juta masbro! http://lnk.ly/0h4"
