droz,Happy #Movember everyone! Share my Men's Health Center with the men in your life: http://t.co/uedPvy0E http://t.co/buuAAKaS
droz,Had an amazing time at @theviewtv. Spent some time with Christine Ha and @SherriEShepherd in the green room after. http://t.co/BaR6kRyY
droz,How many of you tuned in to @theviewtv? What do you think?
droz,"I'll be hosting ""Guy Day Friday"" tomorrow on @theviewtv. Be sure to watch!"
droz,.@tigermom89 Depends on what type. We discussed HCA on the show: http://t.co/vSPTnlF8 Always consult your doctor first!
droz,".@mykinsconnor I recommend eliminating soda altogether, diet or otherwise. Try my 28-day soda challenge: http://t.co/DKfi4JXj"
droz,"See my blog for my opinion on yesterday's show. Overall, love yourself and don't try to change who you are! http://t.co/pDMW9BSa"
droz,Great info from my friends at Sharecare RT @SharecareNow: Boost some tunes while you bust your butt!  http://t.co/qOIU6eJo
droz,"The next time you're craving comfort food, give this recipe a try http://t.co/JjUaWw7Y Courtesy of @tferriss. Enjoy! #OzApproved"
droz,.@craig_wray Fruits and veggies are a great place to start. Read more here: http://t.co/Zms2R1mP
droz,.@Emilytran16 I try to get mine from yogurt that have live and active cultures. Learn more here: http://t.co/RyjC2Ei3
droz,".@Kayla_Sherman22 Unfortunately, yes. Its because most redheads lack a gene that influences the bodys pain sensitivity."
droz,.@taahirah2 Sounds like you need to declog your ears. Heres how: http://t.co/Ou8C9Xus
droz,"Getting ready for the 80th annual ""Lighting of the Tree""  outside our studio in Rockefeller Center. http://t.co/cliOXIxZ"
droz,"In case you missed it, learn how probiotics can improve your digestive health: http://t.co/gEzcbkB4"
droz,"#OzTip Add Asian mushrooms to your grocery list! Look for shitake, maitake, oyster or enoki mushrooms. They will help boost your immunity!"
droz,"What is your most unusual home remedy? If you have one that you swear by, tell me about it for an upcoming show:  http://t.co/yNpZ282X"
droz,RT @History: What do you think is the most fascinating part of tonight's #Mankind so far?
droz,The medical community is forever indebted to Dr. Joseph E. Murray. He was a pioneer and a inspiration. http://t.co/i6dQswvS
droz,"RT @TVGuide: Exclusive clip! @iamjrmartinez tells @DrOz: My mother got me out of my dark hole of depression, anger and regret http://t.c ..."
droz,"What's your version of the ""Keep Calm and Carry On"" mantra? Click here and share yours with me! http://t.co/8GWN8MEm"
droz,"If you are constantly hearing that you look great for your age, I need you for an upcoming show! http://t.co/dsCVCZKa"
droz,How stressed are you? Take this test and find out: http://t.co/nE9aJB2b
droz,"You may be feeling a little sluggish, especially after the Thanksgiving holiday. Give my 3-day cleanse a try: http://t.co/8hv8ICxc"
droz,RT @SharecareNow: Don't stress about #CyberMonday! Here's some ways to keep your cool if your computer is too slow to grab great deals:  ...
droz,"If your medicine cabinet is overflowing with supplements, click here and tell me your story: http://t.co/eclm0yXV"
droz,Tune in today as I show you the restaurant industry's dirty secrets. You won't want to miss this! http://t.co/tg4qodPF
droz,"RT @TIME: Don't miss @DrOz's segment on NBC's @TodayShow on his new TIME cover story ""What to Eat Now"" at 8:15AM ET. http://t.co/Pa291m7q"
droz,"From my family to yours, Happy Thanksgiving. Wishing you all a blessed holiday! http://t.co/lq7iHqwx"
droz,"If you need some inspiration for the big day tomorrow, take a look at my ""Oz Approved Thanksgiving"" board on @Pinterest http://t.co/K6Mqef1t"
droz,"RT @Cycle4Survival: Cycle is partnering w/ #GivingTuesday, a new national tradition to give 
back during the holidays. Learn more here:  ..."
droz,RT @HealthCorps: Click this link &amp; lend YOUR support to @HealthCorps!http://t.co/vqm84pC6
droz,@MarloThomas happy birthday!
droz,"Be sure to pick up the new @TIME Magazine on Friday for my cover story ""Give (Frozen) Peas a Chance and Carrots Too"" http://t.co/HQujyTsc"
droz,RT @History: Tune in to #Mankind The Story of All of Us Tuesdays at 9/8c on HISTORY.
droz,You can sure tell that the holidays are in the air at our NYC office! http://t.co/FV9RzSCI
droz,Follow me on @Pinterest! http://t.co/KSrQSCce
droz,.@MeliG1975 Studies do show that tea interferes with iron absorption but taking an iron pill/getting enough in your diet can negate that.
droz,".@Photolas Most teas have some form of caffeine. However, you can get a tea that is naturally decaffeineated http://t.co/FJnFSFxf"
droz,"If you have a favorite secret recipe, enter @SharecareNow's contest! http://t.co/LivxzBom"
droz,"If you have a funny video of family or friends, share it with me for an upcoming show: http://t.co/zPeUQM1Z"
droz,Take a look at this wonderful piece about @sofiavergara by @MarloThomas http://t.co/229j7N8x
droz,What #OzApproved dish are you making this Thanksgiving?
droz,#OzTip Drink black tea to protect your heart. The antioxidants in the tea will prevent hardening of the arteries.
droz,RT @thesleepdoctor: Do you consider getting a good nights rest self-nurturing  or an indulgent treat? http://t.co/LL4wcc58 #sleepdiet
droz,"This recipe is for all the sweet-tooths! These Gluten-Free ""Chewy-Gooey"" Brownies are guilt-free and #OzApproved. Enjoy http://t.co/fyueTw9k"
droz,Get in shape with my trainer @DonovanGreen. The best thing is that you only need a chair to do this workout! http://t.co/6C5ViFvn
droz,What are you eating today that is #OzApproved?
droz,RT @YoungDrMike: Are YOU choosing healthier food? Maker of food that ages (based on data) is going Out Of Business  YOU Sow http://t.co/ ...
droz,"Have you tried the latest weight loss craze Sensa? On today's show, we examine if it really works or if it's just a fad http://t.co/lo6hpsUs"
droz,I recently gave this advice to the graduating class of my alma mater. Words to live by! http://t.co/8xckHxlM
droz,What's your biggest hurdle preventing you from reaching your health and fitness goals? #OzQuestion
droz,Great info! Share with the smoker in your life! RT @SharecareNow 5 Tips That Helped Me Quit Smoking http://t.co/O5IKph0e
droz,Tune in today to see @DrWeil reveal the 5 new essentials you need now - http://t.co/jpsq5QBU
droz,I want all of you to add veggies to your diet AND learn how to prepare them so you get the most nutrition possible: http://t.co/uqbPp8c7
droz,Trying my hand at comedy. This is hard! Much harder than surgery. http://t.co/hVYwisUn
droz,"Special Guest @jimgaffigan doing an amazing set at ""Stand Up for Staten Island"". http://t.co/O59tyJB1"
droz,"Thanks to @BenVereen for doing an amazing impromptu set at our ""Stand Up for Staten Island"" benefit tonight. Amazing! http://t.co/5rXxok9O"
droz,Have you had a bad experience with gel manicures? Click here and tell me your story for an upcoming show: http://t.co/KPFJkDBe
droz,"Do you know why this ""non-Oz Approved"" meal is on the show? Tune in to find out! http://t.co/4CJwPU6o"
droz,Who watched #Mankind on @History last night? What did you think?
droz,"Who's giving my 3 day detox a try? This cleanse will eliminate toxins, restore your system, and reset your body.  http://t.co/T56UBfIC"
droz,RT @DrRoshiniRaj: Check out my tip for the Lazy Girl's Guide on today's @DrOz show!
droz,"If you're in NYC, come join me this evening. It's an amazing event for a great cause. Only a few tickets left! http://t.co/s8Xjh4FH"
droz,Tonight on #Mankind on @History at 9/8c: Well be talking about the greatest story the world has ever known. Be sure to tune in!
droz,"Join me, @HealthCorps &amp; @richiebcomedy tom night at  @GothamComedy in NYC to benefit the victims of Superstorm Sandy http://t.co/tVDQTRQ6"
droz,.@denisepgordon This depends on your blood thinner. I would talk this over with your doctor to make sure. I'm mostly concerned about Vit K.
droz,".@the_lgd Yes, the antioxidants in the peppermint tea should also work for you. Plus, its tasty, which is a plus. Enjoy!"
droz,.@nik00nik This should work. Frozen fruit should have a similar nutritional value. Avoid the sweetened frozen versions http://t.co/8hv8ICxc
droz,.@conflicted6 You can add honey to make it sweeter. You can also use coconut oil or milk as great alternatives.
droz,.@Sarahsmiles55 you can learn more about it by reading the facts on our website: http://t.co/IaZ5tPx4
droz,"If you're a fellow doctor and have used some of my topics in your practice, I need you for an upcoming show: http://t.co/mY3cq9MK"
droz,.@LifeBeyondD joins me to describe how his near-death experience showed him the afterlife. Take a look: http://t.co/E9Zc7hhw
droz,Don't miss @Tony_Horton on the show today. He's going to share some vital info to get you into shape! Take a look: http://t.co/rwZ7qII1
droz,RT @HealthCorps: .@DrOz @HealthCorps &amp; @RichieBComedy are teaming up to help those affected by #Sandy. Get tix for the 11/14 event:  ...
droz,"If your hormones are out of sync, it could be causing you to gain weight. Take this quiz and find out: http://t.co/UdEHxrB1"
droz,I'm looking for outgoing and enthusiastic families of 4 to participate in a fun segment. Click for all the details-http://t.co/dKgh8v6f
droz,See all the footage from my trip to Staten Island here: http://t.co/kKcGnBQc Please RT and get involved!
droz,Do you have a special chicken soup recipe? Send me a pic here- http://t.co/WWsZuP8v and my favorites will be featured on the show.
droz,The right colors in your diet can help you in your fight to prevent cancer! http://t.co/ecQR6LAB
droz,Tune in today as I answer your most awkward and embarrassing questions. Take a look: http://t.co/Or9qfBf7
droz,See all the photos from my visit w/ the Staten Island victims of Hurricane Sandy http://t.co/0KJiQa50 Help them rebuild http://t.co/eUxLQkXB
droz,Thank you to the people of Staten Island. I'm inspired by your spirit and passion! Together we can rebuild and recover http://t.co/eUxLQkXB
droz,People like this inspire me! Jeffrey Hansen just returned from Afghanistan and is here in Staten Island helping out. http://t.co/ZA7JttS8
droz,At one of the many shelters here on Staten Island. Trying to warm my friend up! http://t.co/JF94ZIG0
droz,The damage is catastrophic. Help these people rebuild their lives. http://t.co/eUxLQkXB http://t.co/Ileenb1H
droz,"Lending a hand with Terry, Exec. Director of Project Hospitality http://t.co/eUxLQkXB http://t.co/BuBKdr4d"
droz,#StatenIsland http://t.co/eUxLQkXB http://t.co/GAFT5xxx
droz,"We were able to get Joe to a local pharmacy so he could refill all his meds. Important, especially now! #StatenIsland http://t.co/fbVhL0jQ"
droz,"Due to the hurricane, Joe's had to go without his medicine &amp; his blood pressure is dangerously high. http://t.co/sA3RBk7a"
droz,The destruction in Staten Island is unprecedented. I'm hearing story after story that astounds me. http://t.co/jIahokXf
droz,Today I'll be visiting victims of Hurricane Sandy on Staten Island. Help them rebuild their lives! http://t.co/eUxLQkXB Please RT!
droz,"If you've lost weight with Sensa, share your story: http://t.co/LHO32pDb"
droz,"It's difficult to see, but the first snowstorm just started outside of the Zoco offices in NYC: http://t.co/jCV2yYzX"
droz,"RT @RoxannLynn: @DrOz baby spinach, strawberries, walnuts, pecans, flax seed &amp; poppy seed dressing! #OzApproved ? http://t.co/A1Y0aThi"
droz,"RT @_ashleynicolexo: @DrOz  Avocado &amp; sweet roasted pepper hummus on spelt bread, carrots &amp; apples w/ sunflower seed butter #OzA ..."
droz,I have good news for all the carb fans out there! Let @RealChrisPowell show you how carbs can be good for you: http://t.co/yPj1rtjk
droz,What are you eating today that is #OzApproved? Send me a picture and I'll RT my favorites.
droz,Aging makes you gain weight. Fact or fiction? Find out today as I tackle 5 of the biggest health myths of all-time: http://t.co/S97hcXlx
droz,I'm inspired by all those who have helped rebuild after Hurricane Sandy. Learn how to get involved: http://t.co/o1ulsAlG
droz,You could be sabotaging your weight loss by turning to the wrong foods. http://t.co/dQXcJSVO
droz,Where you store fat directly affects your metabolism. Learn what to do based on body-type: http://t.co/yVcqFife
droz,"I urge all of you in the United States
to go out and vote today! #Election2012"
droz,Join @SharecareNow's #Alzheimers chat w/ @LeezaGibbons &amp; top experts tonight at 7-8 PM EDT. http://t.co/a2DTDBAV #Alzheimers
droz,This is the last shopping list you'll ever need! http://t.co/UsMBZqTD
droz,ER doctor Phillip Blanc reveals the dollar store life savers that can help keep your family out of the hospital: http://t.co/5PGEcnwQ
droz,"When life hands you lemons, what do you make? http://t.co/j7jP0JJP Reply with #OzLemons!"
droz,A member of my team helped make this video. Those of you who remember the pre-Sandy NJ landmarks will appreciate it: http://t.co/ptd0VjaR
droz,"If the show helped you lose 100lbs or more, click here and tell me your story: http://t.co/Gsheevku"
droz,"If you can, please help with the Hurricane Sandy relief effort. Every little bit helps! http://t.co/Fhb0sMhH"
droz,Get the best health finds in every store with the only shopping list you'll ever need. http://t.co/fzfQpx82
droz,"If you could declare a national holiday to celebrate, what would it be? Reply with #OzHoliday. My favorites will be on the show!"
droz,Tickets to the show on 11/6 and 11/7 are available! Click here to attend: http://t.co/BddUYqnu
droz,"RT @RedCross: &gt;7,000 people spent Wednesday night in 115 #RedCross shelters in 9 states. Find a shelter and tips: http://t.co/xRZlhdbC"
droz,"Watch today! I'm going to show you how to turn back the clock on wrinkles, age spots &amp; cellulite - even fake a facelift http://t.co/iXAhjAV5"
droz,How do you like my Halloween costume? Judy Garland lent it to me from the land of Oz. #HappyHalloween http://t.co/UWUYETjr
droz,The effects of Hurricane Sandy are evident everywhere in my area. Thx to all those contributing to the relief effort! http://t.co/9Hyzsr30
droz,Happy Halloween! What are you/your kids dressing up as? Send me a pic with #OzCostumes!
droz,"If you are a carb-lover, don't miss today's show. @RealChrisPowell will show you how to burn fat with carbs! http://t.co/hpsg0LeB"
droz,"Apparently the most shared term on Facebook right now is ""We are ok"". Happy to hear it! I hope all of you made it through Sandy unscathed."
droz,RT @jimmyfallon: Here comes the sun! #NYC @ 30 Rockefeller Plaza http://t.co/9kBSaRDj
droz,"This recipe from @hungrygirl is made for ""comfort food"" fans. Give it a shot, especially if you're stuck inside today: http://t.co/Egp2SCgS"
droz,Great info for all those affected. RT @TIME: Health and Safety tips for looking after yourself during Sandy http://t.co/Nx8d9DR2
droz,I hope all of you who are dealing with the effects of Sandy are staying safe! Click here for important info: http://t.co/CjYrwZPv
droz,"If you're constantly fatigued, try astragalus. It is an herb used in traditional Chinese medicine that may help you: http://t.co/Kik6glTa"
droz,Learn the factors that can impact your risk of heart disease. This is important info! Take a look: http://t.co/MFhGlqe8
droz,Top experts have joined @SharecareNow to answer your health questions! Take a look: http://t.co/36dUsv0f
droz,My thoughts are with all those affected by Hurricane Sandy. Take care and stay safe!
droz,Be sure to tune in today for the latest breakthroughs to shrink your fat for good! You won't want to miss this. http://t.co/wZn7P138
droz,"Tune in today as I teach you five ways to get your energy back for a younger, smarter, faster you. http://t.co/YKvsVNbo"
droz,Great info! RT @SharecareNow Eat Yogurt for a Healthy Heart http://t.co/a8YVUQXE
droz,Weight-loss guru Dr. Joel Fuhrman says he can get you on the fast track to dropping the pounds in just one week. http://t.co/p4LpNH80
droz,#OzTip Add apples to your grocery list. They're one of the easiest &amp; best ways to prevent bad cholesterol from being absorbed in your body.
droz,Could your hormones be out of sync &amp; causing you to gain weight? Take this quiz to find out if you have an imbalance. http://t.co/HVSLohay
droz,RT @Rosie: DR OZ TODAY  http://t.co/dHwx44af
droz,"Enter for your chance to win 1 of 5,000 At Heart Emergency Aspirin Dispensers http://t.co/vcMRv808"
droz,Tune it today for vital information! Hear the story of @Rosie's heart attack &amp; the steps she took to save her life. http://t.co/vUEz0Mbc
droz,"Tune in to @todayshow! I'm here interviewing @adamlevine, whether the staff likes it or not. http://t.co/KyppCUfi"
droz,"A lot of people ask me how I ""wind down"" after a long day, and the answer is yoga! http://t.co/16VSzZqB http://t.co/dEX95rxc"
droz,What do your dreams mean? Learn more about it here: http://t.co/4qYVjvjS
droz,I recently did an interview with @BNDarticles about how to truly love what you do for a living. See the article here: http://t.co/fxYjO7pY
droz,RT @Rosie: DR OZ AND PHILLY  http://t.co/albBoWHv
droz,Tomorrow @HolidayHouseNYC will open! It's an inspirational display of creativity by breast cancer survivors &amp; advocates http://t.co/DOUkZhJz
droz,I'm very excited to be a founding member of the @HealthJoinIn @ShortyAwards #SocialFitness Jury! http://t.co/EGjehzR2
droz,I sat down with some of the most controversial experts in medicine today and examined their anti-aging secrets: http://t.co/2PCQlf0U
droz,RT @Rosie: Thursday I am on the DR OZ show - all about heart attacks - tune in n learn how to save ur life ...
droz,"If you need to make a drastic change in your life, then my 7-week plan may be for you. Click here for all the details: http://t.co/aNbhP65T"
droz,"If you haven't followed my official Pinterest account yet, click here: http://t.co/OUgtOqku What board should I make next? Reply w/ #OzBoard"
droz,"Kansas City: If you're concerned about your health &amp; would like to have a one-on-one with me, click here: http://t.co/eylJKOGh"
droz,"#OzTip To prevent UTI's naturally, take 2 teaspoons of horseradish per day. Horseradish contains oils that have anti-bacterial properties."
droz,RT @AlexCsi: @elvisduran @droz lol it's was a great kiss. http://t.co/LNZ0l8tF
droz,"I asked you to send in your cold and flu questions to Stacia, our favorite @Walgreens pharmacist. See her answers here: http://t.co/ErZmgPgU"
droz,"Kansas City: If you're concerned about your health &amp; would like to have a one-on-one with me, click here: http://t.co/n0gm45X8"
droz,Be sure to tune in today as I'm joined by Valerie Bertinelli (@Wolfiesmom). She has an amazingly inspirational story: http://t.co/BvFmrEVx
droz,BEAUTIFUL Saturday in NY. What is everyone up to today? Wishing you all a wonderful day with family and friends!
droz,"If you've seen something on the show that helped save your life, please share your story with me! http://t.co/qiizvWB1"
droz,Cure your aches and pains in 7 days: http://t.co/FBKqLymp
droz,"Especially this time of year, a healthy immune system is vital. This pumpkin recipe will help! http://t.co/9p2jDbK3"
droz,Join my friends @SharecareNow for their women-specific workouts chat 12-2PM EDT today! Use #SCFitFriday to ask questions.
droz,How good is your memory? Take this quiz and find out. http://t.co/WLprxdmu
droz,I have an important question for you: how are you feeling today? Click here and tell me: http://t.co/dH7Tmjdh
droz,"If you need some inspiration for dinner tonight, I have just the thing for you: http://t.co/t8uQOFhW"
droz,".@HungryGirl's 5 essentials she swears by, plus discover her must-have kitchen tools to create the meals you love: http://t.co/xYGVdlXO"
droz,"Don't miss today's show! We're covering several important topics, including the best way you can fight plaque and keep your mouth healthy."
droz,Going organic doesn't need to break the bank. Use this guide next time you're in the market: http://t.co/bQWNZUW9
droz,"If the show has impacted how you use the bathroom, I need you for an upcoming segment! http://t.co/rjfbZo7S"
droz,Awkward Moments Travel Edition! Have an embarrassing health related travel story? Reply with #OzTravel and my favorites will be on the show!
droz,"My wife Lisa and I had an amazing time with @Rosie at the ""Rosie's Theater Kids"" gala on Monday evening. http://t.co/93ToeDxY"
droz,Be sure to tune in today as @ehasselbeck and I discuss hidden food allergies: http://t.co/YVQnRrgg
droz,Do you have a funny picture of you or a friend sleeping? Click here to submit it for an upcoming show: http://t.co/sSK5iF5V
droz,"RT @Montel_Williams: WIth my pops at #WalterReedNationalMilitaryMedicalCenter getting ready to feed our American Heros
http://t.co/YxqiWwjk"
droz,RT @SharecareNow: Must-Know Facts About Smoking http://t.co/uAXugKtT Retweet to say #NoToSmoking
droz,Yoga is one of the best workouts you can get. This series is designed to improve your strength and balance: http://t.co/DmMkJNe9
droz,My wife @lisajaneoz &amp; I had a fantastic time at @BarbraStreisand's concert in B'Klyn this past weekend. Amazing show! http://t.co/WCg3AZ17
droz,Great info! RT @SharecareNow: Halt Weight Gain w/a Mediterranean Menu http://t.co/3zkxS4bH #diet
droz,Do you ever wonder if your quirks are normal? I need you for an upcoming show! See all the details here: http://t.co/ZX4IG0w3
droz,"If you're a smoker, giving up tobacco is the single most important thing you can do for your health. Kick the habit: http://t.co/8Sma94HI"
droz,"@DruKnott thanks for the kind words, Dru!"
droz,RT if you knew that tofu has more protein per calorie than ground beef. Click here for other foods for weight loss: http://t.co/9YHNOYIA
droz,What are you eating right now that's #OzApproved? Send me a picture!
droz,"If you're looking for the ultimate detox solution, my weekend cleanse is the answer: http://t.co/F31zxmmc"
droz,"I have a very important question to ask you: how are you feeling today? Click here now to visit ""You Feel"" and tell me: http://t.co/l8TO64Fw"
droz,"@They23 At higher doses, melatonin may harm your sleep. Read this for more info: http://t.co/ujDhPjNK"
droz,"@textrish well, I'm glad you did! The best solution for you is to do what is most comfortable. Everyone is different."
droz,@nayarit4evr They should be available in any health food store or online. See all the benefits- http://t.co/OkdAuEib &amp; http://t.co/od7Vh6GG
droz,"@zjeginovic Natural antacids like baking soda can help, but you should de-acidify your diet as well. http://t.co/G0HyBkYF"
droz,UK: Is child obesity abusive? I'll be joined by pediatricians and 2 families struggling to cope. Tonight at 7pm on Discovery Home &amp; Health.
droz,"Thank you to all of you who participated in our HPV live chat last night! If you missed it, see all the facts here: http://t.co/SP1oevyD"
droz,"Our HPV chat on @HuffingtonPost Live starts in 15 minutes! This is important, life-saving info. Click here to watch: http://t.co/yPx3D2ri"
droz,I urge all of you to take this quiz to learn why your eyes may be the window to your overall: health! http://t.co/qqYpqyfi
droz,Happy 10/11/12!
droz,What are your biggest questions about cold and flu? Ask with #OzQuestion and @Walgreens will answer their favorites on http://t.co/ePSGPQAh.
droz,Fans in the UK: Join me and expert gynecologists as we reveal all. Don't miss this one! 7pm on Discovery Home &amp; Health.
droz,Fact: HPV can live in your cervix for 10-20 years before it develops into cancer. Get the info you need LIVE tonight! http://t.co/yPx3D2ri
droz,"Going organic doesn't have to mean breaking the bank. Learn how to do it the right way with my ""Organic Grocery List"" http://t.co/WCKXzg77"
droz,"@Qgata13 great shot, Camila!"
droz,"@lynetmoenga glad you enjoyed, Lynet."
droz,@kalinagail good choices!
droz,"@tifaniruck sounds great, Tifani! Enjoy."
droz,@cabochickenhead thanks!
droz,@Teri_Corbett This could be a side effect of the surgery. Ask your doctor. A topical anesthetic may help: http://t.co/jtPUL3aD
droz,"@mntnjoey1 She should consume no more than 2 servings per day, but remember there are also natural alternatives like agave or honey."
droz,@janiebrown316 It's hard to say. Make sure this is something you discuss with your doctor!
droz,@WannaBHealthNut Great question. You may be interested in my blog on emotional eating: http://t.co/cvFV8lXD
droz,@danyabahar The key is moderation! Make sure you consume no more than 2 servings per day. Learn more here: http://t.co/hZeXbwbo
droz,UK: We'll be catching up with severely overweight Colleen to find out how her weight loss is going. 7pm on Discovery Home &amp; Health
droz,Join me @SharecareNow experts tomorrow evening as we answer your questions about HPV. RT to spread the word! http://t.co/knexGN43
droz,"If you're low on energy, you may need more magnesium! Take a look at my ""Magnesium Shopping List"" here: http://t.co/ZUm4Kkh1"
droz,"If you feel like you're dealing with information overload, take a look: http://t.co/ooDm9hpH These are 3 key supplements you should consider"
droz,"Viewers in the UK: Find out the best ways to fight cellulite &amp; how to target problem areas, tonight at 7pm on Discovery Home &amp; Health."
droz,.@JennyMcCarthy will be on the show to discuss how she overcame her bad habits. Ask her your questions now! Reply with #heyjenny
droz,Get the facts about artificial sweeteners and their impact on your health:  http://t.co/hHheDpdl
droz,"We all have our favorite foods and I want to hear yours! If you had to pick your last meal, what would be on the menu? Reply with #OzMeal."
droz,I'm ready and willing to make a house call for you! Click here to send one now: http://t.co/cOZDkMxB
