droz,Happy #Movember everyone! Share my Men's Health Center with the men in your life: http://t.co/uedPvy0E http://t.co/buuAAKaS
droz,You won't want to miss our show today with special guest @Oprah. Be sure to tune in!
droz,Take a look at this article from @SharecareNow about diabetes and physical activity. Very informative. http://t.co/5TZUiDKD
droz,"It was such a pleasure having @Oprah on today. Be sure to tune in tomorrow for her inspirational, insightful interview! http://t.co/FpvlMxFC"
droz,Today the FDA cracked down on homeopathic products http://t.co/wfQOsP5H
droz,"Congratulations to the residents of Vermont! For the 5th year in a row, they have won the title of ""Healthiest State"" http://t.co/rx0aK5nD"
droz,"Be sure to tune in today as we discuss the truth behind energy drinks. I'll also show you some of my favorite ""Oz Approved"" alternatives."
droz,RT @IAmSteveHarvey: Watch me on Dr. Oz Dec 9th !
droz,"If you're a woman over 35 who is struggling with fertility issues, please let me know. We're working on a special show http://t.co/0cLfZ4zZ"
droz,Today we have @Emeril on the show. He did a great job showing us that a delicious dish can be healthy! We had a great time together.
droz,"If you're going to be in NYC in Dec, I'd love for you to come to a show! Seats are going fast so give us a call at 212-664-3056, option 4."
droz,RT @SharecareNow: 5 Things Nurses Want You To Know  http://t.co/o8iGICyn Good #Monday Morning!
droz,A new study shows that children exposed to family violence have the same brain patterns as soldiers exposed to combat http://t.co/FFpAoCW8
droz,"From now on, take the stairs instead of the escalator. It's an easy way to burn calories and stay fit. If you're in, reply with #OzsOrders!"
droz,"I recently had a great time in London at Centre of the Cell, an educational charity. Take a look at their site http://t.co/i1stqJai"
droz,My thoughts are with all those affected by HIV/AIDS. Together we can achieve a world where this disease no longer exists #WorldAIDSday
droz,What is the biggest challenge you face as you try to reach your fitness goals?
droz,Are you doing all that you can to boost your longevity? Take my quiz and find out now http://t.co/BkUqlrPx
droz,Take a look at my four unexpected ways to get more energy from @YouBeauty http://t.co/WxDzgjoB
droz,I challenged @Paula_Deen to make her food healthier and she came up with this Mac and Cheese recipe. I'm proud of her! http://t.co/iwnujBYj
droz,"Remember today is ""Buddy Up for Weight Loss"" day! Find the meetup in your area and start reaching your goals http://t.co/oFySvts1 #OzBuddyUp"
droz,"If you'd like to come to our show on Dec. 7, we'd love to have you! Let us know if you're interested http://t.co/afRjuvB2"
droz,"Tomorrow is our first ""Buddy Up for Weight Loss"". If you haven't signed up, do it now and reach your fitness goals! http://t.co/6ad5NCXm"
droz,"Moved by the stories of hunger in America on today's show, my audience voluntarily donated over $1,700. Amazing! http://t.co/42gJRoLS"
droz,We've all had a day when we're just in a foul mood. We  put together this article to help explain why this may occur http://t.co/vJJ6qNYS
droz,"This holiday season, my family and I are donating to a local food pantry. Tell me how you're fighting hunger! Reply with #DrOzHunger"
droz,"My wife Lisa and I had an amazing time on ""Morning Joe"". Take a look at the interview here http://t.co/I4PPIHEy"
droz,"What is your biggest cooking disaster? Don't worry, we've all made some mistakes! Share your stories with me here http://t.co/DR3rbshN"
droz,Had a great time on The Lorraine Show with @ITVLorraine! Here I am demonstrating my 7 min workout. http://t.co/lVjmaYrE
droz,Happy Thanksgiving! I hope everyone is having a wonderful day with family and friends.
droz,"For all of you who are cooking for the big day tomorrow, here are some Oz Family Thanksgiving recipes. Enjoy! http://t.co/Cvpa8zMY"
droz,"@DestinysPath that's great. Adding nuts to salads provides great texture and protein. Enjoy, Jessica."
droz,@giulianahale now that sounds good. Happy Thanksgiving!
droz,@aliciaolsen24 that's a great side-dish. Very rich in potassium and vitamin C. Enjoy them!
droz,"@ozgeka wow, very impressive. Enjoy!"
droz,@pink____HAZE very nice! Can't go wrong with veggies.
droz,"Everybody excited for Thanksgiving tomorrow? I want to know, what healthy items will be on your table this year?"
droz,I worked with Nutritionist Dr. Rovenia Brock to answer some of your biggest questions about supplements http://t.co/RhwUM9G5
droz,A Yale University study details the benefits of meditation through detailed brain imaging. Such an important exercise! http://t.co/lnae75LX
droz,@elvisduran thanks for coming by. Always a great time with you guys.
droz,"RT @elvisduran: With @DrOz today (and Carolina, Danielle and TJ). http://t.co/wbQBdZad"
droz,@helyn4 take a look at http://t.co/f5BCKLW7. Good luck!
droz,Can pollution cause obesity?  @YouBeauty shows you how the environment may be messing with your metabolism http://t.co/tUuPUjcz
droz,"This Thanksgiving, watch out for the high levels of sodium found in the foods you serve. It can be easy to miss! http://t.co/ZdGRvwET"
droz,@TheRealCarolina thanks for coming by. It was a great time.
droz,@donnacarpenter1 glad you enjoyed.
droz,"@AnnieOuellette glad you enjoyed, Annie. Thanks for watching."
droz,Think you know your superfoods? Take my quiz and see if you understand the true benefits of the foods you eat http://t.co/ICjL98eZ
droz,"Who better to get cooking advice from than Rachael Ray? If you want Rachael to help with your holiday meal, let us know http://t.co/DR3rbshN"
droz,It's hard to believe that it's already been 400 shows! Thank you so much to all of you who helped make this possible. http://t.co/ol1hnnzT
droz,"With everyone's support, the #kashirealproject raised $50K for @healthcorps. This is a great cause! Take a look http://t.co/z6HE3JeP"
droz,I taught Mayor Michael Bloomberg how breathing exercises can help your health by lowering stress. I'm sure he needed it http://t.co/X8yh1Tl8
droz,To my NYC friends: come be part of our audience tomorrow AM & bring some healthy canned goods for our food drive! Email tix@zoco.com.
droz,"By 2020, 83% of men and 72% of women could be overweight or obese. We need to change our diet and exercise habits! http://t.co/X6bhr8c2"
droz,"Next time you make brownies, replace sugar with banana. Get more smart
food swaps from @YouBeauty here http://t.co/4sNDdbp2"
droz,Today we have @JoelOsteen on the show. He'll be discussing the power of prayer and where medicine ends and religion begins.
droz,I'm so excited for tomorrow! It's hard to believe that tomorrow marks 400 shows. Thank you all for all your support!
droz,A study suggests that a newborn's umbilical cord should not be cut for 3 minutes. This may help prevent iron deficiency http://t.co/LV3HHOZi
droz,I had a great time on the @rachael_ray show. We talked Thanksgiving diet tips. It was an amazing time!
droz,Tomorrow sub out chips or french fries for a serving of your favorite fruit. Who's in? Reply with #OzsOrders and start getting healthier!
droz,Join @SharecareNow for a Twitter chat tonight from 8-9pm EST. Ask your diet and nutrition questions with #AskSC. Enjoy! http://t.co/DkGX5LnP
droz,"I was honored to contribute to ""The Oprah Winfrey Show: Reflections on an American Legacy"". Congrats to @Oprah on its release today!"
droz,RT @SharecareNow: How can kids maintain a healthy smile? http://t.co/CwnqB3Ae
droz,"We have a very important show about bullying today with @TyraBanks. This is a BIG problem, especially for today's youth."
droz,@ChantelleLucie this should help you http://t.co/gv6nHWiy Feel better and congrats!
droz,You know what's better than holiday cookies? Healthy holiday cookies! Share your favorites with us http://t.co/6C6I3KPe
droz,"@megwhyte you sure can. Join Transformation Nation to enter for your chance to win. Good luck, Meg."
droz,@dancer2shoos16 amazing job! Keep up the great work.
droz,"@JohnBolaris thanks so much, John!"
droz,@jmara19 great meeting you!
droz,"Having a blast at the Philadelphia Eagles game today! I had a great ""pre-game warmup"" with @Eagles fans: http://t.co/8l0j2dBL"
droz,Lee Lipsenthal was diagnosed with esophageal cancer in 2009. We can all learn from his inspiring story http://t.co/hV3jpau9
droz,"On Nov. 30th, we're having ""Buddy Up for Weight Loss"" day all across the country. Take a look http://t.co/oFySvts1"
droz,The holidays are officially upon us: the tree just arrived at Rockefeller Center today. Looks great!
droz,"If you were inspired to get an ovarian cancer screening after seeing a segment on the show, please let us know http://t.co/U3DrMgV9"
droz,"We busted some of the biggest medical myths out there. I promise, you'll be surprised at some of these! http://t.co/ApSZ3ywE"
droz,Big congrats to Jay Warnick for losing nearly 200 pounds! I'm thrilled that some of our tips were helpful http://t.co/dXgTx77j
droz,RT @joelharperfit: Have 15 minutes?  Try this quick ab #workout from @DrOz http://t.co/H4lVFVjp
droz,So proud of my daughter @ZoeOz1! She's the spokesperson for the anti-bullying group No Bull. Great mission; take a look http://t.co/3rVuwugN
droz,"4 tips to avoid a silent epidemic that leads to over 200,000 trips to U.S. hospitals annually, from @YouBeauty. http://t.co/gOfdeaZY"
droz,We're so excited to have @DrWeil on the show tomorrow! He's going to share his amazing story about depression and how he beat it.
droz,Scientists think that there may be a link between dementia & diabetes. Proper blood sugar care could help prevent this http://t.co/tez89DrV
droz,Are you a junk food addict? Take my quick quiz to find out. I bet some people will be surprised! http://t.co/a3Bh9AEj
droz,Join Transformation Nation today! We are giving away pedometers from our friends at http://t.co/nzMFTzUL http://t.co/h3YlF0J2
droz,I had an amazing time this morning with @elvisduran! Always a blast.
droz,"I applaud the team at @nbcSNL for the skit about my show! I loved ""Don't you have a graphic for this?"". Great job! http://t.co/kQIZAvGv"
droz,"Take a look at my ""Oz Approved Essentials"". From health to diet to beauty, we've got you covered http://t.co/9caGBCIf"
droz,The FDA has approved a new device to help detect melanoma sooner. Hoping this will lead to a greater number of cures! http://t.co/Db31TWVh
droz,4 in 10 Special Needs children are obese. Take a look at this report by @AbilityPath; great info aimed at fixing this http://t.co/2OBK6wH9
droz,Did you know that fiber can help prevent breast cancer? Check out my other foods that may help prevent this disease http://t.co/ePaOnWCX
droz,Do you know the most effective way to wash chemicals and toxins off your vegetables? @YouBeauty has great tips. http://t.co/DGoA6NZ3
droz,What a powerful show today. We debated whether or not you should have the right to die. What did you think of the show?
droz,I loved having fitness guru @Tony_horton on the show. Take a look at the amazing 10 minute workout we did together http://t.co/wR2uF9Ia
droz,My experience at the CareNow clinic in Los Angeles was very moving. Proper healthcare is something we ALL need http://t.co/sCDANCrg
droz,Here is some great behind-the-scenes footage from my interview with Shape Magazine. Take a look http://t.co/YqFYfvUi
droz,"Eating certain foods can lower heart attack risk, even if it's in your genes. Raw spinach is one; get more @YouBeauty. http://t.co/zKw5eSnX"
droz,"Take a look at my Prehistoric Diet Plan http://t.co/SgmbZKE4  By getting back to our healthier roots, we may improve our health!"
droz,A new study shows that aspirin may reduce the risk of colon cancer by 60%. Very interesting read http://t.co/b0ekH7i0
droz,Gas pumps top the list of the dirtiest surfaces that you and your family touch daily. Take a peak at the rest http://t.co/jzt6wlyE
droz,This is an interesting look at the potential effects of years of fertility therapy. Take a look. http://t.co/zXtvYv6G
droz,"@BegumSlci thanks so much, Begum."
droz,@sleeprestlive my pleasure! Hope it helps you.
droz,"If you have trouble sleeping, then this is for you. Try keeping a ""sleep diary"" to see if you need to see a specialist http://t.co/lAuY4q41"
droz,"Thought the HPV vaccine was just for girls? It's now recommended for boys, too. Find out why @YouBeauty http://t.co/MDd9VZSe"
droz,"As the colder weather is settling in, I'm curious: what is your favorite ""winter workout""?"
droz,Check out this fantastic collection of patient stories that my colleagues at NY Presbyterian put together. Inspiring! http://t.co/I0TssYNl
droz,My prayers are with those affected by the tragedy in Turkey. Please help save lives and donate to the relief effort http://t.co/Z7wbrgt6
droz,"Now this is great advice! Check out one of my favorite ""spicy"" weight-loss tricks http://t.co/mTCkwla3"
droz,I did a great interview for @Shape_Magazine with my wife Lisa. Take a look at my 7-Minute Morning Workout http://t.co/DJWaHOJ8
droz,Great story about @Healthcorps expanding in CA. Read up on how we're helping young people take control of their health http://t.co/W1H8jpar
droz,"Don't miss Super Soul Sunday this Sun. on OWN, 8am & 12pm E/P. Fascinating film ""Crazy Sexy Cancer"" and my chat with filmmaker @kris_carr."
droz,Our live webchat starts in 10 minutes. Join me and 4 @SharecareNow experts at 7:30 EST to see if we answer you! http://t.co/PNe7QyQ7
droz,"Study shows that IQ can fluctuate during adolescence. Interesting stuff, especially for the parents out there http://t.co/LuGYBxzK"
droz,Don't forget to join me and a great panel of experts tomorrow at 7:30pm EST for a live webchat! http://t.co/S20D0Fng
droz,"We value self-esteem more than our sex life or a high salary. Where do
your fall? Take @YouBeautys Self-Esteem Quiz.
http://t.co/0fFsOg2S"
droz,Take a look at my recipe page for delicious & nutritious meal options http://t.co/HbUWlVUR These are great options for you and your family!
droz,Join me and 4 fantastic doctors for a live webchat Thursday at 7:30pm. Submit your questions now http://t.co/PNe7QyQ7
droz,RT @SharecareNow: Our LIVE Twitter Chat begins @ 7 pm est! Send us your family medicine and fitness questions! Use #AskSC in your tweet.
droz,Join @SharecareNow tonight from 7-8pm EST for a Twitter Q&A. Submit  your medical questions and add #AskSC to your tweets. Have fun!
droz,Take a look at this amazing story about a 100-year-old man who completed  a marathon in Toronto. Inspiring! http://t.co/r2BzyvpE
droz,"On Thursday 10/20, join me for a live Transformation Nation webchat. Submit your questions now http://t.co/XfzQwFZB"
droz,"We have a right to know if our food has been genetically modified. Take a look at ""Just Label It"" to learn more http://t.co/hnSkF12D"
droz,RT @johnjayandrich: RIGHT NOW @DROZ is on our show!! @JohnjayVanEs is asking him about his #HGH!
droz,Ladies: A study has found chocolate may lower your stroke risk. Make sure it's at least 70% cocoa http://t.co/jZf0q1H8
droz,"Which type of meat may be most dangerous to your health? Find out
if you're eating it @YouBeauty http://t.co/kVEa9kBN"
droz,"Had a great time with Paula Deen on today's show. Backstage, she shared lessons learned in and out of the kitchen: http://t.co/nyNQSh8V"
droz,Have you tried extreme measures to sleep? The Dr. Oz Show producers want to hear from you. Get in touch: http://t.co/WivbF1lx
droz,Real people making real progress w/Transformation Nation. Thanks to Fox 5's Good Day NY. Join in: http://t.co/a7bYrwYN http://t.co/BepNg1Ll
droz,LOS ANGELES: @CareNowUSA needs volunteers for the largest free clinic of its kind on Oct 20-23. Volunteer now: http://t.co/aDKXJ1v6
droz,A step in the right direction. California bans BPA in baby bottles. Hoping more states follow suit. http://t.co/Qi7N0UlF
droz,Looking forward to meeting @O_Magazine readers in Atlanta next week on Oct 15. Make sure to follow along at #OYou2011
droz,"RT @HealthCorps: In light of Steve Jobs' passing, here is some information on pancreatic cancer: http://ow.ly/6PEz0"
droz,"RT @TIMEHealthland: The pancreatic cancer that killed Steve Jobs: most people survive 5 months, Jobs made it through 7 years | http://t. ..."
droz,Hard to get any work done with Conan O'Brien around -- he surprised us on our set (and his old studio) today. http://t.co/V2Ph9my7
droz,Healthy eating does not have to be expensive. Eat nutritiously (and deliciously) for $36 per week. @YouBeauty http://t.co/eLbdaUor
droz,What's your BMI? Mine is a healthy 24. Use this calculator and share your BMI: http://t.co/BCcgPSus http://t.co/Byhnw2Bh
droz,"Would a ""fat tax"" stop you from eating unhealthy foods? http://t.co/BAJQMsC3"
droz,RT @HealthCorps: Happy Friday! Here's today's quick tip: Challenge your body & mind with a new routine workout every 6-8 weeks!
droz,Dads are always on duty. I surprised my daughter Daphne on the set of her new show. Video: http://t.co/ByOMqZyd
droz,An interesting Twitter study shows us just how human we are: http://t.co/NYoEafUS
droz,Ill be joining @Oprah and your favorite @O_magazine experts at #OYou2011 in Atlanta on Oct 15. Looking forward to the big event.
droz,Get smarter about fighting the flu. Take this iQ&A quiz & you could win a $25 Walgreens gift card http://t.co/4yiKWTQS
droz,A first of many Behind the Scenes videos. Here I am talking Transformation Nation with New York's Z100: http://t.co/NfjkXfJl
droz,RT @foxnewshealth: #E. Coli Scare Prompts Tyson To #Recall Ground Beef http://t.co/VNfxDpPY
droz,Glowing skin isnt only genetic. Healthy choices count just as much. Take the Healthy Skin Quiz @YouBeauty http://t.co/pDLXXrHo
droz,Amazing strides in the fight against cervical cancer http://t.co/z3RplC9Z
droz,Get the facts about health care in your community: http://t.co/jk5lVzGv #yourcare
droz,NYC area: Are you 39? Scared of turning 40? Be a part of our studio audience THIS Wed p.m. Email tix@zoco.com with your info!
droz,An amazing first day for Transformation Nation! Keep it going. Enter for your chance to win $1 million! Join now: http://t.co/BMpzdu00
droz,"Join my Transformation Nation. Tune in TODAY & learn how to sign up, lose weight & enter to win $1 million! http://t.co/BMpzdu00"
droz,Want to win a Zumba Total Fitness Transformation Package? Like @SharecareNow for your chance to win: http://t.co/KkxBomAp
droz,"RT @RealAge: In times of stress and high anxiety, be sure to put some omega 3 foods on your menu every day. http://t.co/mlwGeaJ3"
droz,RT @HealthCorps: Thinking of becoming a vegetarian? Check out this article on getting all the proper nutrients. Thanks @teen_DS! http:// ...
droz,There are a lot of exercise myths out there. This will help you sort through them: http://t.co/j7HDEXYG
droz,Pop Quiz: How much money is spent on care services that don't improve your health? #yourcare http://t.co/b42CNzRY
droz,"NY Tri-state Area: Ladies, nervous about approaching your 40th birthday? Be a part of our audience next Wed. Email ASAP: tix@zoco.com"
droz,"In this exclusive video, my friends Dr. Andrew Weil and Dr. Deepak Chopra share their 3 rules to live by: http://t.co/eDMeI9jZ"
droz,Help those in need get free flu shot vouchers this season. All you have to do is check-in to Walgreens. Learn more: http://t.co/qCw9RzGZ
droz,Belly fat is the #1 complaint of women over 40. Take this quiz to see where you store your fat: http://t.co/ZqEcE5Ws
droz,Wonder why your food cravings are not-so-healthy when you're starving? Your brain is to blame: http://t.co/1dUxgAqD
droz,September is Pain Awareness Month. Pain affects 116 Million Americans. Lean more at http://t.co/cHW3e7jn
droz,RT @YoungDrMike: @DrOz & I are helping those in need. Check-in to Walgreens & they'll donate one Flu Shot voucher for your check-in http ...
droz,"Graphic & gross, but gets the message across about sugary drinks  & obesity. Think twice about taking a sip: http://t.co/Vl6kIgOm"
droz,We're giving away great prizes on today's Best of the Best show. Tune in to learn how you can win! http://t.co/gs46z1Gz
droz,Care About Your Care: 10 Things You Need to Know About the Quality of Health Care in America http://t.co/Hci5wgCH #yourcare
droz,The importance of hand-washing and disease prevention (via @Teen_DS) #Contagion http://t.co/9Ix2w3hj
droz,"Our show on arsenic in apple juice has a lot of people talking. In case you missed it, here's the latest: http://t.co/yvAcqPsf"
droz,In the NYC area tomorrow? Want to help the show with a fun social experiment? Respond to this link today: http://t.co/wMBeW07p
droz,You may be exercising more than you think. Find your hidden fitness sources with this quiz from @YouBeauty  http://t.co/xo0KuLx
droz,Tigers (but thankfully no lions or bears) in the land of Oz. Backstage at Good Morning America. http://t.co/LGQniFw
droz,Got an embarrassing health question? Leave your Qs & I might answer them on an upcoming show http://t.co/RiqsL3s
droz,"While you tune in for the premiere week of the show, check-in on @GetGlue to earn exclusive stickers: http://t.co/Q4swKJJ"
droz,Today is the first day of my new season. Were tackling belly fat. Learn to lose weight & keep it off. TUNE IN! http://t.co/H6cTOrM
droz,A full night of sleep = energy for the weekend. RT & share your Feeling Good Is Contagious moment. http://t.co/ZKAdXZS
droz,"Love your hair? Youll perceive yourself as younger, which, in studies, lowers blood pressure. Quiz @YouBeauty: http://t.co/sJfJ6yY"
droz,Need energy? Fuel up on fiber. Its how I start my day. RT & share your Feeling Good Is Contagious moment. http://t.co/S256Z49
droz,"@kandyta In general, carbonation is not bad for your body, but the gas may aggravate some medical conditions like heart burn."
droz,@themoseley Soda vs beer: Moderate alcohol consumption has protective effects. I'd pick one dark beer over sugary soda
droz,"@KitKatchee  For insomnia: no alcohol/coffee before bed, no work in bed. If still not sleeping try calcium+magnesium, or melatonin."
droz,Yoga. Its what I do to get my head on straight. Retweet & share your Feeling Good Is Contagious moment. http://t.co/qo6Btfg
droz,"Pop quiz: 70% of Americans have never heard of this skin condition, but 5% have it: http://t.co/icU153R"
droz,Contact keeps us healthy. Call a friend & make their day. RT & share your Feeling Good Is Contagious moment. http://t.co/k040VhJ
droz,RT @lisajaneoz: How do you stay motivated to work towards your fitness goals when fall hits?
droz,A 30-min workout = a days worth of feeling good. Retweet & share your Feeling Good Is Contagious moment http://t.co/T1oef5H
droz,Happy Labor Day. Did you accomplish your summer goals? Is anyone celebrating a health or fitness milestone today?
droz,RT @TIMEHealthland: The four behaviors that will make you live longer | http://t.co/kI6jIMv
droz,@CrystaStocco Get connected with a PCOS support groups. Lots of information at @SharecareNow http://t.co/hcCpZP4
droz,"@cdphilanthropia You crave sugar because it activates the brain's reward centers. In the a.m., after being deprived, your body craves more."
droz,"@dcullaz Take a multivitamin that contains A,B,C, D and E and add omega-3s for brain, heart and eye health."
droz,RT @RealAge: Can you tell the difference between allergies and a cold? Use this tool to tell their symptoms apart. http://t.co/S3javo2
droz,What's really true about our food? It was important for me to clear things up for you in the new issue of @TIME http://t.co/uZSko0n
droz,A right step against antibiotic resistance. MDs are ordering fewer prescriptions. http://t.co/WAUckVL
droz,On the cover of the new @YourTeenMag issue with my daughter Zoe. http://t.co/uLSQ1c0
droz,Fastest growing category in supermarkets is one of the fastest ways to harm your health (via @SharecareNow) http://t.co/xDkgN7N
droz,Sleep deprivation can lead to a 20% deficit in your memory. Preserve your mind -- try this sleep quiz. http://t.co/b15Qdwx
droz,Steak -- straight from the lab? Hope for the planet or your worst nightmare? http://t.co/Cjat8cO
droz,"For those of you bracing for Hurricane Irene, stay safe and prepare. Food, water, flashlights, batteries. More info: www.ready.gov"
droz,Had a great time speaking my mind to @preventionmag for the cover story. The new issue is on newsstands now. http://t.co/TS2tSWp
droz,Borrow my trainer @joelharperfit & strengthen your core muscles with our newest workout: Fit in Five: Core http://t.co/fHNRRjC
droz,"Women tend to gain weight after marriage, men after divorce. Is your relationship affecting your weight? http://t.co/GBXKxEC"
droz,Grateful East Coast & VA are okay after the earthquake. Felt the building shake at 30 Rock. Good to be prepared: http://t.co/pFRPZhP
droz,More great cancer-fighting news - a livesaving breakthrough in leukemia treatment: http://t.co/CDDeMiX
droz,"DALLAS Area - AUG 20, 11am-5pm - Break the Silence: Ovarian Cancer @ Grapevine Mills Mall, Grapevine, TX. Register: http://t.co/6H8XJl3"
droz,The deadliest form of skin cancer may have met its foil -- a new drug can stop cancer growth for months: http://t.co/yL6qyWP
droz,Got a health question? Eager to see what's on your mind.
droz,@YoungDrMike : Prenatal vitamins w/DHA may decrease autism & increase IQ. A winner for women of reproductive age: http://t.co/xog3u1r
droz,"NY Tri-State Area: Ladies, if you arent afraid to show your belly on TV, we have seats left for our 8/24 show. Email tix@zoco.com"
droz,I'm walking Billy Bush through my Men's Fitness workout on Access Hollywood LIVE in a few minutes. Where to watch: http://t.co/Qspe5IZ
droz,My workout routine in Men's Fitness this month (http://t.co/9malNdc). Cover story: http://t.co/vSsFhIW
