droz,Happy #Movember everyone! Share my Men's Health Center with the men in your life: http://t.co/uedPvy0E http://t.co/buuAAKaS
droz,My thoughts and prayers go out to the family of Andy Griffith. He was an amazing person.
droz,Want to live longer? These 10 habits will help you fight aging and feel great! http://t.co/ezY6WVHU
droz,"If you need some inspiration for your BBQ tomorrow, take a look at my ""Oz Approved Cookout"" board on my @Pinterest page http://t.co/56R7burn"
droz,"#OzTip Avoid coffee before a mammogram. Caffeine is linked to breast sensitivity, so it's best to do without it before your appointment."
droz,"If you have high cholesterol, learn the best way to manage it naturally. Take a look: http://t.co/fm4lHI8A"
droz,"RT @SharecareNow: Win #PRIZES &amp; get #FIREWORKSAFETY tips! Twitter Party with @GetEyeSmart &amp; @5minutesformom, TODAY 8PM ET http:/ ..."
droz,I want you and a friend to come spend some time with me in NYC! Click to enter now: http://t.co/yMFp239R Good luck!
droz,RT @nyphospital: What is this an MRI of? Find out at http://t.co/8BtOdRE1 and learn how NYP physicians and surgeons are treating it. htt ...
droz,"#Sleep is vital for good health. On average, how many hours do you get per night?"
droz,Great safety info! RT @SharecareNow: Kids account for more than half of fireworks injuries in the U.S. http://t.co/09oZShyW #fireworksafety
droz,Not happy with your body type? Make a change! These breakthroughs will help you achieve your goal: http://t.co/rzpyNTCc
droz,"Be sure to stay hydrated this weekend, especially if your area is experiencing high temperatures: http://t.co/Wp5ji2F8"
droz,#OzTip Add chia seeds to your yogurt or cereal. They are rich in omega-3s &amp; have more antioxidants than blueberries http://t.co/3kKbalQr
droz,"RT @healthygirltip: @DrOz Steel cut oats with banana, raspberries and cinnamon http://t.co/h5NEZWqG"
droz,RT @momkenzo: @DrOz: Almond cashew sttawberry raw vegan smoothies #OzApproved? http://t.co/HqfFIc8u
droz,What are you eating today that's #OzApproved? Send me a picture and I'll RT my favorites.
droz,"@goconstance thanks, Constance. Hope all is well with you."
droz,Do you know the right foods to get a flat belly? Click here and put your knowledge to the test: http://t.co/U7OmEKFU
droz,"How many of you have suffered from Plantar Fasciitis? @DonovanGreen and Karl Romain show you how
Tai Chi can help! http://t.co/ieuLQkkp"
droz,An estimated 116 million Americans suffer from chronic pain. This plan can help you get relief in 7 days: http://t.co/cynPpcaq
droz,What junkfood do you reach for when you have a #craving? These tips will help you when your discipline is challenged: http://t.co/8gz5ZOHM
droz,Historic news in the world of healthcare today. Click to learn how this will impact you: http://t.co/jYHh4svd
droz,"If you struggle with fatigue, take a look at these tips from @RealAge. Great info about natural solutions! http://t.co/9OhZZ9wP"
droz,"If you need some inspiration for dinner tonight, this side dish is one of my favorites. http://t.co/K7BGQ28Y Enjoy!"
droz,Add me to your circles on Google+! Here is the official Dr. Oz page: http://t.co/HBJzd4qs
droz,Accidents happen! Be prepared to save a life. Download my SOS app for Android: http://t.co/JakbZi94
droz,RT @SharecareNow: What People Ask Someone Who's Won $1 Million http://t.co/j5e1fLC7
droz,My prayers go out to everyone in the Colorado Springs area. Stay safe!
droz,#OzTip Add miso soup to your grocery list for a healthy dose of soy. Just make sure it is low in sodium and contains no MSG
droz,"As you continually choose your path in life, this is the most important advice I can give you: http://t.co/lG49E362"
droz,"What's your favorite ""super"" ingredient to add to your salad?"
droz,"If you're like me, you wonder what your dreams mean. See the roots here: http://t.co/3SaJzh6h"
droz,Want to come to NYC to spend some time with me at the show? Click here and enter to win now: http://t.co/yMFp239R
droz,RT @SharecareNow: Clean your cupboards out and get rid of the junk food. #Ididit http://t.co/HAOH9bVR
droz,I loved reading through all of your recipe submissions! Here are a few of my favorites: http://t.co/elMPikIZ
droz,RT @DaytimeEmmys: And the Emmy for Outstanding Talk Show - Informative goes to... @DrOz! Congratulations!
droz,I'm so honored to have won at the @DaytimeEmmys! Congrats to my staff and crew. None of this would be possible without you!
droz,It's an honor to be nominated at the @DaytimeEmmys! Watch tonight from the @BeverlyHilton at 8pm ET/5pm PT on @HLNtv!
droz,"What's your biggest health, fitness or weight loss goal over the next 6 months?"
droz,Keep a food journal. Writing down what you ate and how hungry you were will help you understand your cravings. #OzTip
droz,Have you tried Transcendental Meditation? Make it part of your daily routine to harness the amazing benefits: http://t.co/iPGBvElD
droz,RT @SharecareNow: We have experts @kristyleewilson @annprokenpek @sanfordhealth here ready to take your questions. Include #SCFFheat in  ...
droz,Be sure to tune in on 7/10 for a look inside @nyphospital on @nymedabc. See the preview here: http://t.co/7AeROWw0
droz,"Sleep is a crucial part of a healthy lifestyle. If you're not getting proper rest, try these all-natural solutions http://t.co/Ag0YGREt"
droz,Stay calm! Anger is bad for your ticker: http://t.co/uFvChMuk
droz,RT @ktarvs: Greek yogurt strawberry banana smoothie :) yum yum! @DrOz http://t.co/RJn3ShZT
droz,"RT @CaseyDolezal: @DrOz quinoa, English peas, celery, cilantro with my own homemade cumin vinaigrette! Yum!  http://t.co/mRLvZVBE"
droz,RT @MissCooleen: @DrOz Salmon fillet with dill and brussel sprouts :) #OzApproved http://t.co/2zTfsBV1
droz,What are you eating today that is #OzApproved? Send me a picture and I'll RT my favorites.
droz,There are only a few days left to get involved with my charity water campaign. Pledge what you can and help save lives! http://t.co/T2vd3QL9
droz,Too many lives are lost because the warning signs of ovarian cancer are missed or misdiagnosed. Let's stop this now! http://t.co/Q1ssjEjo
droz,Are you following my official @Pinterest page? http://t.co/OUgtOqku What board should I make next? Reply with #OzPins
droz,Are you exhausted? The culprit may be on your shopping list. @ehasselbeck and I show you how to avoid this pitfall http://t.co/1vQVIVdj
droz,RT @CDC_DrKhan: Getting ready for our @twitter chat with @ShareCareNow get your preparedness questions ready we start at noon! #RUPrepared
droz,#OzTip Add chia seeds to your yogurt/cereal in the morning. They're a great source of omega-3s &amp; contain more antioxidants than blueberries.
droz,RT @nyphospital: 80+ patients received celeb treatment and danced the night away on #PromNight at our Morgan Stanley Children's Hospital ...
droz,Accidents happen. Be prepared! Get your questions answered by @CDCgov experts and @SharecareNow tomorrow 12-2pm est w/ #RUprepared
droz,Want to come to NYC to spend some time with me? Click here for details on how to enter: http://t.co/dYmkwAOA
droz,There are only 12 days left to get involved with my campaign with @charitywater. Help us reach our goal and save lives: http://t.co/T2vd3QL9
droz,To all the brownie fans out there: this recipe is delicious and its healthy ingredients make it #OzApproved: http://t.co/QmW2lt65
droz,Congratulations @TheRealCarolina on your move to television! Best of luck in your new career.
droz,Inspirational mantras are a great way to stay motivated. @SharecareNow shared some of their favorites on Pinterest: http://t.co/qiOO0SNO
droz,Fitness guru @shaunTfitness stopped by and put me through one of his famous workouts. Take a look: http://t.co/pj8l0NW0
droz,My family and I would like to wish everyone who is celebrating a very Happy Father's Day!
droz,"What ""Oz Approved"" dish is on your Father's Day menu this weekend?"
droz,RT @SharecareNow: Treadmill Talks: Are Germs Lurking in Your Reusable Grocery Bags? http://t.co/yBpACpMk
droz,"#OzTip If you have trouble managing your cholesterol, try adding raw ginger to your diet."
droz,I know it can be difficult to stick to your diet while eating out. Use this healthy restaurant options guide next time: http://t.co/zTpLmMmE
droz,Learn how to re-train your brain to avoid cravings with this 28 day plan: http://t.co/fYhVW6VC
droz,RT @SharecareNow: How COPD Effects Your Lungs http://t.co/byUZ9thZ
droz,#OzTip Try a damp green tea bag to heal split or chapped lips. Tannins in the tea will calm the burning sensation to keep you smiling pretty
droz,Our campaign to save lives with @charitywater continues. Together we can make a massive difference: http://t.co/T2vd3QL9
droz,RT @HealthCorps: Kick Your Workout Routine Up a Notch  Break out of a fitness rut with these easy and effective exerc http://t.co/lFdqeQdE
droz,"Take a look inside the pro-ana movement, an extreme underground cyberworld full of thinspiration"" http://t.co/a61lt5wW"
droz,.@YouBeauty tells you the 5 ways to stay young forever: http://t.co/PhspU4if
droz,Great time having some olives with @Official_YandR today. Take a look: http://t.co/557LRMGX
droz,"Every day, feel productive and challenged in a way that is tailor-made to your unique desires and strengths. Please RT http://t.co/j9jmIxfm"
droz,RT @SharecareNow: Your Summer Safety HQ http://t.co/2FmhfjFd
droz,Which #OzApproved dish looks better to you? Bisque (http://t.co/GgbsItti) or Chili (http://t.co/9KPcO62Z) http://t.co/PJUP8Mq6
droz,RT @SharecareNow: Your #Summer Survival Guide http://t.co/ywtZxNv5
droz,.@GregTtheFratBoy I heard you became an organ donor over the weekend. Congrats! I hope you inspire others to save lives by doing the same.
droz,My thoughts and prayers are with @RobinRoberts and her family during her fight with MDS. http://t.co/LlOVcydQ
droz,"Please give what you can to my @CharityWater campaign! It may seem small, but together we can make a huge impact! https://t.co/whAi8FDD"
droz,Thank you so much for all the birthday wishes!
droz,"If you haven't yet, get involved with my birthday @charitywater campaign. I want us to all make a meaningful change! http://t.co/lwFEXVL5"
droz,Support is key! Share your fitness and weight loss goals with your friends and family. They'll help you stay accountable. #OzTip
droz,All I want for my birthday on Mon is for us to team together with @charitywater to save lives: http://t.co/T2vd3QL9 Please spread the word!
droz,"Olive oil is rich in health benefits, but the calories can add up quickly. The key to this recipe is an oil mister: http://t.co/1ov8V6Xa"
droz,"Monday is my 52nd birthday. Instead of presents, I want us all to team up with @CharityWater to save lives: http://t.co/qINMjmjP Please RT."
droz,RT @SharecareNow: 7 Odd Poop Colors and What They Mean http://t.co/cG1Ehge7 @RealAge
droz,I love looking through all your #OzApproved meals. I put my favorites on Facebook. Take a look: http://t.co/cmHw26Nq
droz,"If this doesnt make you wear your sunscreen, I dont know what will. @YouBeauty shows us the compelling evidence: http://t.co/xwJG60a0"
droz,"I'm available and happy to make a ""house call"" for someone that you care about! Personalize a video now: http://t.co/l77GARYP"
droz,Catch the drama of life inside @nyphospital on @nymedabc. This is a hugely powerful series. See the preview here: http://t.co/ACeOfgnG
droz,What are you eating that is #OzApproved? Take a picture and email it to facebook @zoco.com. I'll post my favorites in a Facebook album.
droz,Get anti-aging advice from @SharecareNow @MountSinaiNYC @HopkinsMedicine. Join the conversation with #SCWHW today 12-2PM ET
droz,Kudos to @Disney for taking action: http://t.co/cc2lI1XC This is an important step in the fight against childhood obesity.
droz,"If you're a fan of Mexican food, check this out. Delicious and Oz Approved: http://t.co/r3I3fAXn http://t.co/U9Rnug6F"
droz,RT @SharecareNow: 5 Healthful Reasons to Enjoy Chocolate! http://t.co/agfk3IqN
droz,"Most of you take precautions to make sure you are prepared for the summer, but what are you doing to prep your dog? http://t.co/whO3B2pG"
droz,This Asian Veggie Stir-Fry has a secret ingredient that has 10 times more calcium per calorie than milk: sesame seeds! http://t.co/CO6Ge2Nt
droz,If you're a pizza fan take a look at this recipe. Delicious: http://t.co/lAXjhfsE
droz,Understand the connection between fatty foods and dementia. @YoungDrMike has all the info on this: http://t.co/IBgPv8mw
droz,"If you're looking to get in shape for the summer, be sure to stop by my fitness center. These can all be done at home! http://t.co/DLG5LtR0"
droz,"If #NationalDonutDay has you craving some sweets, take a look at my #OzApproved desserts board on @Pinterest http://t.co/SNzPVgCX"
droz,Use an edible toothbrush to keep your dogs teeth healthy. You can find it in pet stores for about $20. #OzTip
droz,.@IAMJHUD recently stopped by to share some of the exercises she does at home to stay in shape. Take a look. http://t.co/rjg4WeQL
droz,Love this. Cute video with a strong message: http://t.co/LBRJPRAl
droz,"If you'll be in NYC on Sunday, I want to see you at the ""Food for Your Whole Life Health Symposium"". Register now: http://t.co/vtXP5iWP"
droz,One of the most valuable lessons I've learned is that the driving force in life should always be love. RT and share! http://t.co/AcdMD7T8
droz,Prevent Alzheimer's; stop forgetfulness in its tracks and literally grow your brain so its stronger than ever: http://t.co/3hQfMkZY
droz,"RT @CherryBomb_323: @DrOz brown rice, fresh (not canned) garbonzo beans in a tomato&amp;red pepper stew with green beans #imvegetarian h ..."
droz,"RT @TembreJ: @DrOz dried cranberries, salt-free almonds and sunflower seeds on my 10.5 hr trip to the beach! http://t.co/pN8NbgV7"
droz,"RT @AlaiaBbbaldwin: @DrOz a raw smoothie made with SunWarrior vanilla protein, chia, raspberries, blueberries &amp; raw almonds :) (orga ..."
droz,What're you eating today that is #OzApproved? Send me a picture and I'll retweet my favorites.
droz,"Visit my pharmacy center for tips, videos, articles and quizzes: http://t.co/itNRykhb"
droz,Tune in to @piersmorgan at 9pm tonight to see me give @Donny_Deutsch the results of his 15 minute physical.
droz,"Are you an active ""pinner""? If you haven't yet, follow my official Pinterest page for recipes, top tips and more: http://t.co/OUgtOqku"
droz,Tea can be a big stress buster. Learn the best ones you should be using to relax: http://t.co/nrvO8f3Y
droz,RT @SharecareNow: Happy Hump Day! If you've worked out and feel great today retweet this! http://t.co/VKpOTCtY
droz,Your diet can impact more than just your weight. These foods will help you fight to prevent cancer: http://t.co/1jRwckZ7
droz,Thank you to all the folks at @Facebook for welcoming me today. I had a wonderful time and was inspired by your talent http://t.co/KkawfsRp
droz,RT @SharecareNow: Prevent #Cancer with Diet http://t.co/QjmMlYGI
droz,The secret healthy ingredient in these brownies is apple sauce! It cuts out the butter and still gives a great flavor http://t.co/W4LVfndi
droz,"@robdelaney good question, Rob. Safe to say they aren't a staple of his diet! Good hearing from you. Take care."
droz,Happy Memorial Day everyone! Thank you to all the men and women of our armed forces who fought for our freedom.  #MemorialDay
droz,"Who's having a cookout this weekend? Take a look at some of my ""Oz Approved"" #MemorialDay foods on my Pinterest page: http://t.co/Y57kRC39"
droz,Take a look at my summer survival guide: http://t.co/Yw0Y7fAT What's your favorite #OzTip?
droz,RT @YoungDrMike: Last weeks Top Med Stories  --Dr Mike R's Treadmill talk on when u should get a second opinion: http://t.co/0lLjJhDX
droz,"If an emergency happens, I want you to be able to protect your family and friends. Download the SOS app for Android now http://t.co/YS8YvfrX"
droz,"RT @airwynnglass: Spinach, heirloom carrots in cucumber, w/ pomegranate seeds, parmesan,  raspberry vinaigrette!  @DrOz #OzApproved http ..."
droz,"What #OzApproved meal are you having tonight? Take a picture, tweet it to me and I'll retweet my favorite."
droz,Eat these foods recommended by @YouBeauty to look better in just 6 weeks: http://t.co/2N6v7GJJ
droz,Celebrate National Vegetarian Week with some of my favorite vegetarian recipes: http://t.co/rbveFLp7
droz,RT @MensHealthMag: #FACT: 1 pound of fat takes up 18% more space than 1 pound of muscle.
droz,Congrats to Michael Lamb for winning the $1 million Transformation Nation grand prize. His story is inspiring: http://t.co/LvImJrcD
droz,All 10 of the finalists shared their favorite recipes that helped keep them on track. Take a look: http://t.co/2dLdMRcJ
droz,So who are you rooting for to win the $1 mil Transformation Nation prize? Reply with #OzTNWinner
droz,"RT @DaphneOz: @BravoAndy so impressed you held your own in @droz's ""oz family olympics""-style 30 pushup showdown!! look at that form!! # ..."
droz,We're giving away $1 million on the show today! Tune in to see who will win the Transformation Nation grand prize http://t.co/xtL1TLSI
droz,Kudos to @genesimmons and KISS for employing Iraq war veterans on their upcoming tour. Great work! #SupportOurTroops http://t.co/2vZEx4U5
droz,Had a great time with @BravoAndy and @HeatherDubrow last night. Take a look at the segment here: http://t.co/UNNa0IZW http://t.co/6QjAqzsb
droz,What motivates you to live a healthy lifestyle and reach your fitness goals? #DrOz
droz,"Prevent a hangover this weekend with this ""Prickly Pear Cocktail"". Enjoy! http://t.co/1weW2Kn4"
droz,I partnered with @redcross to ensure you can take action if your family/friends need you. Get the SOS Android app now: http://t.co/A2lp65DM
droz,"Tune in to see @PaulaAbdul's touching interview on the show today. As a bonus, enter to win lunch with her in L.A.: http://t.co/P2PSGxoz"
droz,RT @HealthCorps: Who would win in an arm wrestling showdown? @DrOz or @bodyADDICTS ? http://t.co/vXZmRHsb
droz,#OzTip Track your calories. Research shows that people who track their calories daily lose twice as much weight as those who do not.
droz,Thoughts and prayers to the family of Robin Gibb of the Bee Gees. I am a big fan of his music and he will be missed.
droz,"If you're suffering through allergy season, then this is for you. These tips will help you get some relief: http://t.co/YkqHNILC"
droz,Great time with @ElvisDuranShow! Thanks everyone. RT @David_Brody: Here's @DrOz in studio with us. He's the best!  http://t.co/ppgPkaxA
droz,Looking forward to spending some time with @elvisduran and the morning show. Tune in now!
droz,"If you are in Philly today, I'm giving 15 minute physicals at 3500 North Broad St. at the Temple Health Sciences building. Come see me!"
droz,"Be sure to watch me on @piersmorgan tonight! We're discussing several topics, including the #1 predictor of your life span."
droz,#OzTip Eat spinach to feel young. The nutrients it contains will help reduce joint pain.
droz,Tune in today as we makeover some of your favorite foods. You won't want to miss it: http://t.co/frFuwNur
droz,I sat down with @eharmony to discuss what I've learned about love through my relationship with my wife @lisajaneoz http://t.co/AOJSn3yR
droz,RT @SharecareNow: Got weight lifting questions? Start sending them to us NOW! Include #scffweights. Let's chat for Fit Fridays!
droz,"At @nyphospital, I discussed some of the amazing things we are doing to treat heart valves. Take a look: http://t.co/DU4RjH9Q"
droz,"For many of you, grilled cheese is the ultimate comfort food. Try one of these three healthier alternatives next time http://t.co/6BWltR25"
droz,I'm deeply saddened to learn of the death of Donna Summer. It is my hope that her passing inspires the continued fight against cancer.
droz,"If you're going to be in Philadelphia this weekend, register now for my ""15 Minute Physical"". See you Saturday! http://t.co/eNXcKw2K"
droz,"RT @SharecareNow: From vitamins to eating tips, our experts tackle your family #health questions! Watch the video http://t.co/lH1pGBx2"
droz,"#OzTip Almost half of your daily calories should come from complex carbohydrates, so fill up on vegetables, fruits and whole grains."
droz,Tune in tonight to see me on @jeopardy Power Players.
droz,".@YouBeauty gives us skin solutions to stretch marks, acne, cellulite: http://t.co/yDnQ8Z9Y"
droz,RT @thesleepdoctor: Enforce an electronic curfew 1 hour before bedtime to reduce electronic exposure before sleep. #sleepdiet
droz,There are 4 BIG mistakes that many people make when they are on a diet. Learn what they are and avoid them: http://t.co/y832adO0
droz,"RT @DrRoshiniRaj: Hey girls! Watch me on @DrOz at 4pm discussing the Girls' Guide to Health, drawing from my book @WhatTheYuck #health # ..."
droz,Congratulations to my daughter Arabella for graduating from @Columbia! http://t.co/i8BuiJSK
droz,Loved being part of this cartoon from @NewYorker. Funny stuff; keep up the great work! http://t.co/fJGTpGTo
droz,Very interesting article from @WSJ about the fight against Alzheimer's. Take a look: http://t.co/EJiky274
droz,"RT @wharton: Highlights from the Wharton MBA graduation keynote by Dr. Mehmet Oz (@DrOz): ""Top Ten Tips for Success and Happiness"" http: ..."
droz,"Happy National Peace Officer's Day! Especially today, we should be thankful for the men and women who work to keep us safe. Thank you all!"
droz,"Next time you're in the mood for Mexican food, try these recipes to avoid the fat. There's even a ""skinny"" margarita! http://t.co/ctFC6DfO"
droz,RT @SharecareNow: Celebrate #NWHW with a physical exam! #checkupday http://t.co/PsLeRiH8
droz,Were you part of Transformation Nation? Come to the finale on 5/18! Email ASAP to DrOzAudience@zoco.com w/ pounds lost &amp; contact info.
droz,Boost your metabolism in 2 minutes per day. Learn how: http://t.co/cDlTLjRd
droz,"RT @MIX1051: Get Bikini Body Ready With @DrOz , http://t.co/7L5ZGlC2"
droz,Do you dread swimsuit season? That ends today. These tips will guarantee that you're feeling comfortable at the beach http://t.co/lZdE1Y5L
droz,RT @rodroudi: Comfortable being uncomfortable. That is the role of a mentor. Find one. - Dr. Mehmet Oz keynote #wharton
droz,RT @_monika_j: Great speech by Dr. Oz @wharton Graduation Ceremony. http://t.co/T8LscJ93
droz,"Speaking at graduation at my alma mater, Wharton Business School. So proud of all the graduates! Go get em! http://t.co/bHU4a96x"
droz,"Happy Mother's Day to my mom, Suna, my wife, Lisa, my mother-in-law, Emily Jane, and all who are celebrating today. http://t.co/iRNXhFti"
droz,RT @SharecareNow: #Yoga for Weight Loss http://t.co/Y8v1SDxM
droz,@realgranthill33 glad they inspired you! I feel the same way.
droz,Who should win the $1 million grand prize? You decide! Go vote now: http://t.co/CpO5iMXz
droz,#OzTip Check active ingredients in over-the-counter drugs. Ask your pharmacist how an active ingredient might affect you.
droz,"During rehearsal this morning, I got a surprise vist from my friend and #TheVoice winner, @JermainePaul. Take a look: http://t.co/Sm0DaiA1"
droz,"When making these Oatmeal Peanut Butter Cookies, replace half the sugar with banana puree. Adds a nice boost of fiber! http://t.co/lb9QxzQs"
droz,"Stress is the biggest contributor to rapid aging. When you get overwhelmed, I want you to use these tips to relax: http://t.co/wyWKbRY3"
droz,You decide: who should win $1 million: http://t.co/CpO5iMXz I need you to vote now!
droz,.@YouBeauty gives you the secret to a better orgasm. (Hint: It starts with changing how you breathe.) http://t.co/wJTNjTOo
droz,RT @thesleepdoctor: Looking forward to the healthy family webcast with @SharecareNow @Walgreens. Ask questions NOW! Use #healthyfamily h ...
droz,What is your biggest question about how to improve your family's health? Reply with #HealthyFamily now.
droz,The set looks great and we're about to bring the audience in. Getting ready for a great show today! Who's tuning in? http://t.co/iBhqMVQi
droz,"My wife @lisajaneoz will be speaking at Girls Night Out for @WPHospital on May 22 in White Plains, NY: http://t.co/aKujjs4L"
droz,Congrats to @JermainePaul for winning #TheVoice last night. A few years ago we spent some time together at my house: http://t.co/SpBWuJTj
droz,RT @SharecareNow: Build a stronger healthier family! Ask us ur #healthyfamily questions. LIVE webcast 2night! http://t.co/ASDt3XWA http: ...
droz,What's your biggest question about how to keep your family healthy? I urge you to ask now and include #healthyfamily http://t.co/qjQ3HSKF
droz,"I'm thrilled to hear about the various Emmy nominations for ""The Dr. Oz Show""! Thanks to all of you who made this possible! #thankyou"
droz,"#OzTip If you have trouble managing your cholesterol, you might want to add raw ginger to your diet. Try a quarter of an inch slice per day."
droz,The Transformation Nation finalists are in! I need all of you to go vote and tell me who should win $1 million http://t.co/CpO5iMXz
droz,Had a great time on the @todayshow. They caught a candid shot of me getting ready to go on: http://t.co/emPkHVE6
droz,"To help you reach your weight loss goals, I busted the 4 biggest dieting myths. Take a look: http://t.co/4PhlBXHZ"
droz,Data from the @AADskin shows that 1 in 5 Americans will get skin cancer. Find out what you can do to help prevent it: http://t.co/lbxApN8H
droz,RT @SharecareNow: Warm ur fam up to health benefits of regular exercise. Get expert tips in live webcast 5/9 7-8PM ET #FamHealth http:// ...
droz,"I'm so inspired by our 10 Transformation Nation finalists. The polls are open, so cast your vote now! http://t.co/CpO5iMXz"
droz,"Happy Cinco de Mayo! If you're celebrating, try this delicious ""Oz Approved"" guacamole: http://t.co/ybfXohZT"
