droz,Happy #Movember everyone! Share my Men's Health Center with the men in your life: http://t.co/uedPvy0E http://t.co/buuAAKaS
droz,Did you/someone you know lose 10 lbs or more on my Just 10 Challenge? The producers want to hear from you: http://bit.ly/cabGwh
droz,"Tomorrow is National Memory Screening Day. If you're worried about Alzheimer's, find a free screening in your area: http://bit.ly/84cku"
droz,My YOU books contributor @ProfSpiker recaps his first marathon and makes me remember my first time http://bit.ly/aKVIDc
droz,RT @MensHealthMag: The 5 accessories you must have in your car: http://ow.ly/39fPe
droz,RT @RealAge: Is your mind older than you are? Use this quick exercise to measure your mental acuity: http://bit.ly/a7XzR8
droz,RT @HealthCorps: #TIP: Drink water. How much? Half of your weight divided in half in ounces! e.g. 150lbs/2 = 75oz. More if you're workin ...
droz,RT @HealthCorps: #HealthTIP: Slow it down! Take some time between each bite to ensure youre not overeating. #portioncontrol
droz,@calypso0922 Olive oil vs EVOO: regular olive oil is good for you + best for cooking/extra virgin has the most healthy polyphenols
droz,"@angelarivas002 Lower bad cholesterol naturally: exercise, eliminate simple carbs, restrict saturated fats, and eliminate trans fats"
droz,@StephenPutler Protect your singing voice: Dont yell. Sleep w/ a humidifier. Dont eat right before bed (avoid acid reflux).
droz,"@luv_luvlii  For diet, follow the Just 10 rules: no soda, small meals, dont eat late, move + weigh yourself http://bit.ly/93HKFi"
droz,"To all those who serve and have served our country, thank you for all you've done and Happy Veterans Day."
droz,"Parents: RSVP + submit your questions for my live webchat on Thursday, Nov 18 at 6 p.m. EST/3 p.m. PST. http://on.fb.me/cPHaEh"
droz,Will images of corpses and cancer patients on cigarette packaging finally convince people to quit? http://bit.ly/drndwv
droz,"Submit your questions to Dr. Phil, Suze Orman and me for the first-ever Oprah's All-Stars on OWN on 1/2/11: http://bit.ly/cW2RlB"
droz,The Twinkie diet? I wouldn't recommend it: http://bit.ly/bwpMkV
droz,@DiFidanza  My favorite winter snack: warm oatmeal for breakfast or as a snack.  Soluble fiber helps irritability and crankiness.
droz,@juicysoliman  A stiff jaw may be due to joint damage. Consult your dentist to determine the cause and to design a treatment.
droz,"@CambreyTea If you have a cold, sugar can interfere with white blood cells response. Consume 4 tsp sugar/day - max. http://bit.ly/dvY8kq"
droz,"@pugloverof3 There are many kinds of molds, some worse than others. An expert can help ID the type you have @ home. http://bit.ly/cOkLea"
droz,@Summit_Steam Fortified iron in meat is well absorbed unlike non-heme iron in vegetables. Keep in mind if vegetarian. http://bit.ly/9NSpKa
droz,@mellylcb Try spicy foods - the capsaicin speeds up metabolism http://bit.ly/2iZWlm
droz,Pictures from today's Health Expo in Chicago: http://on.fb.me/buE9uN
droz,"Thank you all for making today's Health Expo a success -- and more importantly, choosing to take charge of your health."
droz,"More than 10,000 of you came out to today's Health Expo in Chicago -- and over 1000 received Know Your 5 screenings."
droz,"Expect show experts, chefs, the Truth Tube and prizes all day long. For more info on my Health Expo: http://bit.ly/bMjSQg"
droz,Chicago: Come down to Millennium Park tomorrow for my Health Expo. It's going to be a great event! http://bit.ly/bMjSQg
droz,"Celebrate ""Movember"" -- grow a mustache and raise awareness for prostate cancer : http://us.movember.com/?home"
droz,San Francisco has banned the happy meal - requiring meals w/toys to meet certain nutritional standards. http://huff.to/94WcHk
droz,"Families are losing $2,275/year on uneaten food  and   -   of all food produced in the US goes to waste. http://nyti.ms/dyfEPh"
droz,RT @everythingro: Hey Tweeps! Join me & @DrOz in #TheChi (Chicago) Millennium Pk this Sat 11/6 for his 1st ever Health Expo! #Just10 on  ...
droz,Are you following my Just 10 challenge? How are you doing? I want to hear about your progress. http://bit.ly/9xhwKU
droz,Congrats: @HealthCorps team @ Clevelands John Marshall High + thanks to @WEWSnews Alicia Booth for the spotlight http://bit.ly/dhTs6F
droz,Go to www.doctoroz.com today at 3 p.m. EST/12 p.m. PT for your chance to get the giveaways seen on our Watch and Win show.
droz,Happy Halloween - a Harvard study found that those who occasionally indulge live longer than those who don't. http://bit.ly/bvX0Ss
droz,"RT @RealAge: No matter how you like 'em -- fresh, frozen, or dried -- blueberries are one berry healthy snack: http://bit.ly/bRPFFW"
droz,Enter to win 2 tickets to the show. Runners-up will win a copy of my new book YOU: Raising Your Child. http://bit.ly/do1CvM
droz,"A fast-food worker sued their employer for the weight they gained on the job and won - $17, 500. http://yhoo.it/9jtGtT"
droz,"Pumpkins are loaded with vitamin A and C. Bonus: Toast the seeds for a dose of magnesium, iron and zinc. http://usat.ly/bck7mu"
droz,"RT @everythingro: Join me & @DrOz 4 First-Ever Oz Health expo Sat 11/6 Chicago Millennium Park! Come 2 #Just10 Booth, get  nutrition inf ..."
droz,Paying cash at the supermarket leads to healthier food choices says a new study. http://bit.ly/bmz23h
droz,Do you Know Your 5? http://bit.ly/bJeD76
droz,"Tonight, Im giving @JimmyKimmel a Know Your 5 screening. Tune in to ABC @ 12:05 am EST to see if he passes the test"
droz,Were doing a sex survey to bring you the info you want most. All answers are private and anonymous: http://bit.ly/bdL2Uy
droz,My wife Lisa and I are speaking @ the Womens Conference. @thewomensconf empowers women to make + change: http://bit.ly/dbFAWP
droz,RT @HealthCorps: A brilliant piece on strategies that help students make btr choices in the cafeteria! (via @nytimes) http://fb.me/IlNDs1oT
droz,Im up for a #PeoplesChoice Award for #FavoriteTVDoctor. Thanks for making the show a success. VOTE: http://bit.ly/k17j0
droz,"RT @RealAge: For natural pain relief, try some ginger - here's how it helps: http://bit.ly/biMQwu"
droz,Today is Spirit Day. I'm wearing purple to support LGBT youth. Stop the bullying. http://www.glaad.org/ http://twitpic.com/2zc4x3
droz,Want to live to 100? Learn a few things from these amazing centenarians whove made it there and beyond: http://nyti.ms/cO9xm3
droz,"Study: sitting is the new smoking  increasing your risk of diabetes, obesity and heart disease. http://bit.ly/bgZqO8"
droz,"RT @RealAge: To be your youngest, do 3 short weekly sessions of intense exercise that *really* make you sweat: http://bit.ly/aj1Vvk"
droz,"RT @HealthCorps: Take note, America! Canada just banned products w/ toxic BPA in thm. Should we do the same 4 ourselves? http://nyti.ms/ ..."
droz,Will you have fries with that? This slide show of the fattiest fries may convince you otherwise: http://bit.ly/bWUliF
droz,I'm doing my first Viewers' Choice Show -- and I want to hear from you. Start voting: http://bit.ly/c0tfG5
droz,Today is World Arthritis Day. Moving = medicine. Join to walk the circumference of the world by Oct 31: http://bit.ly/cOnpEY
droz,Theres been a lot of talk on chicken/nuggets  heres a segment we did so you can stay supermarket smart: http://bit.ly/be1TU6
droz,Im thrilled to announce the launch of www.Sharecare.com  where Ill be helping to answer the worlds health questions.
droz,Here's the info for my first-ever Health Expo coming up on November 6 in Chicago: http://bit.ly/bMjSQg
droz,"Oprah, my special Assistant of the Day, and Mayor Daley toasted to the 1st Dr. Oz Health Expo: Nov 6 in Chicago http://twitpic.com/2v91yi"
droz,Its my favorite snack for a reason  researchers are now saying walnuts help relieve stress. http://bit.ly/9CAQ7R
droz,"Im proud to announce my new book, YOU: Raising Your Child, out today. (Your kids will thank you later.) http://cot.ag/aXcOu8"
droz,Protect your legs from toasted skin syndrome by keeping hot laptops a few layers away from your skin. http://fxn.ws/cmpC1i
droz,"@mrtz09 Sciatic nerve pain: Try ice for 20 minutes, 3x a day. Stretching can help relieve nerve compression and reduce pain."
droz,@tanyagene Eating a big meal before exercise can lead to bloating afterward. Stick to a small snack 1 hr before training
droz,@Ms_Lettie Get up and walk around every hour to decrease swelling and lower your risk of blood clots when flying
droz,"@masmandaa  Excessive caffeine consumption can be stressful to your kidneys, but a cup of coffee every morning isnt dangerous"
droz,RT @HealthCorps: October is National Dental Hygiene Month - change your toothbrush this month! (via @RealAge)
droz,Feel-good Friday: Steve from our Houston Free Clinic is doing fine 1 yr. after lifesaving cancer surgery. http://bit.ly/bmGnav
droz,Stress may cause the emotional center of the male brain to shut down  for women its the opposite. http://bit.ly/cHZcwK
droz,"RT @RealAge: Parents: Our new ""YOU: Raising Your Child"" center has just launched! http://bit.ly/cUAdRU"
droz,Good news for overworked first-year doctors. A new ruling means less hours + more patient safety. http://yhoo.it/cdQrC4
droz,Swine flu may no longer pose a threat to most Americans. Why? Because weve become immune. http://usat.ly/cRUBRo
droz,@HealthCorps words of wisdom: Check out Dr. Oz's 7-minute workout w/trainer Joel Harper + stay in shape http://fb.me/BmzkiC9W
droz,"Pledge to see Waiting for Superman, a doc about our schools. Each ticket = $15 to a classroom in need. http://bit.ly/9gOf2A"
droz,"If you didn't catch my @ElvisDuran Z-100 Morning Show interview, you can listen to it here: http://bit.ly/dcJpBQ"
droz,http://twitvid.com/UTW4N - I challenged @ElvisDuran of the Z-100 Morning Show to take my Just 10 Challenge. Watch the video.
droz,"My friend @Marlo_Thomas just launched http://marlothomas.aol.com, an online community for women. Plenty of health and humor #FF"
droz,RT @RealAge: Have unwanted/expired meds? Drop them off at a collection site tomorrow. Find a location: http://go.usa.gov/xQq (via @USAgov)
droz,Addicted to soda? Take my 28-day challenge to kick your soda habit: http://bit.ly/9OgG3q
droz,Eating spicy foods could be a sign of greater intelligence. Who agrees? http://nyti.ms/ciubEv
droz,Would you exercise more if you could look younger in 20 years? These faces might motivate you to get moving: http://bit.ly/9a56Qg
droz,"RT @HealthCorps: ""The PM Workout"" w/ @DrOz & his trainer Joel Harper. Give it a shot this evening. http://fb.me/Icxo89pF"
droz,RT @HealthCorps: Are you in #NYC area? Join us this Sunday from 11-4pm for a Fall Festival in the #Bronx! http://fb.me/KecLVUi5
droz,"RT @HealthCorps: @DrOz visits Kipp HS in Houston, TX! Here's a short clip of some of the action. Thnks @DrOz 4 the visit! http://fb.me/H ..."
droz,"RT @RealAge: Get moving w/ this 20-minute, no-equipment-needed ""YOU: On a Diet"" Beginner Workout: http://bit.ly/bbspwG"
droz,Doing live radio on the Mondays With Mehmet segment of the @johnjayandrich morning show http://bit.ly/b2TVJc
droz,I launched my Dinner Club. Learn to make the perfect 500-calorie dinner + submit your recipes to join. http://bit.ly/cq6sLI
droz,Thanks to @RealAge and @HealthCorps for their support on the Just 10 Challenge http://bit.ly/93HKFi
droz,"RT @HealthCorps: TIP: Try blotting your pizza slice w/ a napkin. Wiping off just 1 tsp of oil can save you 4.5 grams of fat, abt 40 calo ..."
droz,High fructose corn syrup wants to change its name to corn sugar to improve its image. Think it will work? http://nyti.ms/a14C2R
droz,"RT @katiecouric: By the way, we are streaming #StandUp2Cancer pre-show, broadcast & post-show session @CBSNews. Begins @ 7:30PM EST! htt ..."
droz,RT @SU2C: @ElizabethBanks Marcia Cross Gabrielle Union @DrOz @1capplegate - so many supportive celebs are here to #StandUp2Cancer !
droz,"TONIGHT: Stand Up to Cancer, 8 p.m. EST&PST/7 p.m. CT. Ill be there and you can help, too. Donate to @SU2C: http://bit.ly/aeZAdF"
droz,"Support @HealthCorps this Sat at the @FitnessMagazine Mind, Body, Spirit Games http://bit.ly/cNk2s"
droz,"The perfect salary for happiness is $75K, says a new study. Making more than that doesnt = more happiness. http://bit.ly/bTP1fu"
droz,"RT @HealthCorps: Poll: What is a more critical factor in the obesity crisis, physical activity or food?"
droz,"Genetically modified salmon, if approved, may become the 1st available altered meat. Would you eat it? http://bit.ly/acmDau"
droz,"RT @theviewtv: All new show today! @DrOz joins to discuss the details of Barbara's surgery and his new show. Plus, Jerry Lee Lewis performs."
droz,I let the cameras follow me through my colonoscopy. Watch and get the message: colonoscopy saves lives. http://bit.ly/9CAJUP
droz,Becoming the patient  its something I never thought would happen to me. Ill be sharing my story on tomorrows all new show.
droz,Enjoy the long Labor Day weekend -- we'll have an all new show for you on Tuesday.
droz,Tell your boss I told you so: Vacations aren't a luxury; they're a health necessity: http://bit.ly/blSXB1  (via @RealAge)
droz,@GlutenFreeAZ Here's the information on Celiac disease from our show: http://bit.ly/5G6EGs
droz,@NLSNCX Colonoscopy is recommended for men and women once they turn 50. Learn more here: http://bit.ly/6l8vC
droz,I recently turned 50 and a routine colonoscopy may have saved my life. I shared my story with People mag: http://bit.ly/cQOQQI
droz,"Get more zzzzs or its lights out for your health. Sleep-deprived teens eat more fat, says a new study. http://bit.ly/bsTr4F"
droz,Good news for migraine sufferers: Researchers have IDed the 1st genetic link = better future treatments. http://yhoo.it/cCPyWw
droz,Do opposites attract? New research says people choose a future spouse based on similar personality traits: http://bit.ly/cIuGcB
droz,RT @O_Magazine: . @DrOz: Why fresh veggies will help you get your work done this week http://bit.ly/9IJcUc
droz,RT @SU2C: Don't miss updates on #StandUp2Cancer 's groundbreaking research as well as the wonderful @DrOz on our September 10 show!
droz,Food news: Black rice has more cancer-fighting antioxidants than blueberries + its cheaper. Whos tried it? http://bit.ly/bWlQHY
droz,"I had a great time shooting this week's TV Guide cover with my friends Oprah, Nate Berkus and Dr. Phil. http://twitpic.com/2ifhsr"
droz,Think twice before you dig in. Researchers say overindulging for a few DAYS can increase body fat for YEARS. http://bit.ly/9w2L16
droz,"Bedbugs: NYC, Philly - and most of Ohio  top the list of most-infested places. Where does your city rank? http://bit.ly/abyyDO"
droz,Weight loss help: try two 8 oz. glasses of water before meals. Dieters who did lost 5lbs. more in 12 wks. http://bit.ly/c9bNgE
droz,"Too much weekend basketball = back spasms. Lucky for me, @lisajaneoz cured me with: arnica gel, magnesium pill/bath, and bromelain."
droz,@tonirus71 Congrats on being smoke-free for 5 days. My Kick the Habit Challenge could be a good resource: http://bit.ly/3EKCXD
droz,RT @RealAge: How long will your favorite food or drink stay safe & tasty? Check it here: http://www.stilltasty.com
droz,"RT @HealthCorps: We're on a roll here, we would love for our Twitter-family to check out our Back-2-School store! http://is.gd/epgI5 #no ..."
droz,With 380 million eggs and counting affected by the salmonella outbreak recall  heres what you need to know. http://bit.ly/9Y8Mx1
droz,RT @HealthCorps: 6 reasons to love an avocado! (via @RealAge) http://fb.me/CmP6ktDL
droz,"Hollywood is finally getting the message. Smoking scenes are down, especially in films aimed at kids/teens. http://yhoo.it/9zFLq3"
droz,Turn that music down! 1 in 5 US teenagers now suffers from hearing loss. http://yhoo.it/9rvh0U
droz,This is  interesting. Half of women polled said they would rather give up sex than gain 10 lbs. http://bit.ly/ck7t2d
droz,RT @RealAge: Safeguard your memory with this tiny snack: http://bit.ly/aInLHq
droz,RT @HealthCorps: #HEALTHTIP: Trade heavy sauces for fresh salsas. These empty calories add up! #HMTweet
droz,"Ladies: We cant live without you. Men in areas w/too few women = shorter life expectancy, say researchers. http://bit.ly/9aIsJs"
droz,Fried butter? Doughnut burgers? Not what I call delicious. Would you ever try something like this? http://bit.ly/cdECR2
droz,How well do you know your hearts health? Take my quiz. I promise youll learn something. http://bit.ly/9tcKiL
droz,RT @Pregmagazine: Still searching for baby's doc? @DROZ & Dr. Roizen give tips for picking the right ped on our site: http://bit.ly/9OwK ...
droz,Talk to your pharmacist. Researchers say drug info leaflets fail to meet requirements. Qs you should ask: http://bit.ly/by1Z7P
droz,@diannebee Colonoscopy is recommended for anyone 50 and up. Glad your mom finally got around to it. Better late than never!
droz,"Miracle Monday: Heart, lungs, liver and kidney transplants didnt stop a U.K. woman from becoming a doctor. http://bit.ly/aWqowW"
droz,Calcium supplements and heart attacks in women? Researchers are now linking the two. http://bit.ly/deqygw
droz,RT @HealthCorps: Have people seen our coverage in the NY Daily News?? Check it out... http://fb.me/xyhoR7JE
droz,"Thank your sister. She may have made you a nicer person, says a new study. http://bit.ly/aS6lLL"
droz,"Another reason to kick the high fructose corn syrup: Cancer cells feed on it, says a new study. http://bit.ly/bngTG2"
droz,Lunch ladies are going to boot camp as part of state-backed battles against childhood obesity. http://bit.ly/bMgsPN
droz,RT @RealAge: RT @CDCgov Diabetes doesn't take a vacation. Take care of yourself while traveling w/ this info from @NDEP: http://is.gd/dRcU0
droz,Having a rough Monday? New research points to a solution: sleeping in *more* on the weekends. http://bit.ly/agtpMB
droz,RT @RealAge: Living the vida GF? Try some of our great gluten-free recipes: http://bit.ly/b1JwlZ #GF
droz,Moms-to-Be: My new iPhone app You Having a Baby is out now http://bit.ly/bl5Tt7
droz,"Los Angeles: Ill be on Good Day LA this a.m. to talk about my new iPhone app, You: Having a Baby http://bit.ly/bl5Tt7"
droz,Warming up my arm to throw out the opening pitch at the Padres vs. Dodgers game in San Diego tonight.
droz,"RT @RealAge: To help keep weight off, turn to the Web: http://bit.ly/9Ekm03"
droz,"RT @HealthCorps: New study: Social relationships just as important as quitting smoking, losing weight or taking certain meds. http://fb. ..."
droz,"NYCs 24K+ restaurants will start displaying A, B and C-level cleanliness ratings. Should this go nationwide? http://nyti.ms/ap581w"
droz,"The smoking, the drinking and 9 other ways living like Mad Men could kill you: http://bit.ly/d6xNUK"
droz,RT @RealAge: Think you know your good fats from your not-so-good fats? Check the list here: http://bit.ly/b5hep6
droz,Plus-size clothing for toddlers  does anybody else see something wrong with this? http://bit.ly/chBcPO
droz,RT @HealthCorps: Beautiful day here in #NYC. Great day to go on a walk! Remember 10K steps a day helps keep you #healthy wherever you are!
droz,My daughter Daphne stole the show with a segment on healthy eating  I better watch out for my job. Video: http://bit.ly/cU3kR4
droz,"Lawmakers call for Safe Cosmetics Act to eliminate neurotoxins, carcinogens found in shampoos, lotions, makeup. http://bit.ly/dqrnWY"
droz,@ms_ioane Check out local CPR classes in your area and get certified.
droz,@Modern_Dinosaur Taking a multivitamin is a good idea at any age. Don't forget Vitamin D and Omega-3s.
droz,@iamwill4real  A healthy waist size - for a man or woman - is less than half your height in inches.
droz,@calypso0922 Kale and acai are both cancer-fighting foods. No need to choose -- eat both.
droz,"A 1 in 5 million chance: Utah woman is pregnant w/2 babies  not twins. She has didelphys, or two uteruses. http://bit.ly/9njMgy"
droz,"RT @RealAge: Our eyes change over time; here's when to get your eyes checked, from baby to senior: http://bit.ly/aUFvVe"
droz,Breakthrough: new anti-AIDS gel may give women the power to protect themselves and save millions of lives. http://yhoo.it/bOHgXC
droz,RT @HealthCorps: Today!! Tune in to the @DrOz show for the grand finale of the School Challenge! See the progress Jake's students... htt ...
droz,Today: the finale of my School Challenge w/@HealthCorps. Help them fight teen obesity; text HEALTH to 20222 to make a $10 donation.
droz,"Smile: its contagious. Happiness  and sadness  spread like disease, say researchers at Harvard and MIT. http://bit.ly/aLelS5"
droz,"The female cougar may be the result of evolution, says new research. Read on: http://bit.ly/dvdahq"
droz,"Quit now: 1/3 of teen smokers are expected to die prematurely of tobacco-related disease, says the CDC. http://nyti.ms/aqJ4mw"
droz,Count more than calories: Women dieters w/vitamin deficiencies may be at risk for diseases like osteoporosis. http://yhoo.it/dCA6u0
droz,"Lady Gagas Bad Romance contacts can cause ulcers in the eye, infections  and even blindness. http://bit.ly/cMIAJl"
droz,World Cup Fact: the vuvuzela sounds off at 131 decibels; firearms go off at 140. Read more from Dr. Roizen: http://bit.ly/9hzt1k
droz,"See a few good friends this weekend. The feel-good effects may help fight cancer, says a new study. http://bit.ly/9KZ2Ru"
droz,Fight teen obesity: #FF @HealthCorps
droz,Unmade beds may help get rid of dustmites that cause asthma and allergies. Dirty dishes are still a no-go. http://bit.ly/9c5oCk
droz,"RT @RealAge: Certain lots of Tylenol, Motrin, Benadryl products recalled - see @McNeilRecall list at http://bit.ly/bjVmjp"
droz,"RT @RealAge: Boost your energy in under 15 mins w/ this all-over workout from @DrOz's trainer, Joel Harper: http://bit.ly/91liOl"
droz,My colleague and his heart patient take on the July 18 NYC Triathlon for the Babies Heart Fund: http://triyourheartout.org/
droz,@jenniesue62 Relieve chapped lips by scrubbing with a mixture of sugar and baking soda. Follow with olive oil. http://bit.ly/9tuece
droz,@BMynroe keep an eye on acid reflux; check out these heartburn helpers hthttp://bit.ly/cGT3zI
droz,@RodTheHod The monounsaturated fatty acids in olive oil help to protect your hair and make it softer and more manageable.
droz,Mammography saves 12K lives a year; the CDC says thousands more could be saved with the proper screenings. http://yhoo.it/aLeoiG
droz,RT @HealthCorps: Feeling hungry after a salad? Chk this link! RT @RealAge Power up your summer salads to make them seriously satisfying: ...
droz,Whats on the menu for your *healthy* 4th of July BBQ? Try grilling up these half-fat mini burgers: http://bit.ly/cdOb9M
droz,"Thanks for the Emmy support. Im so sorry I missed the event;I was in Italy celebrating my greatest achievement: 25 yrs with my wife, Lisa."
droz,Dodgeball finally has its rewards: Exercise in your teen years may help keep your mind sharp later in life. http://bit.ly/9mKAE1
droz,"More reason to fear airline food: FDA reports point to dirty facilities, crawling with mice and roaches. http://bit.ly/a5Yi2z"
droz,Im officially an Emmy-winning talk show host. Congrats to all the winners! And thanks to all of you for making Season 1 a success.
droz,Botox may actually freeze your emotions. Try anti-aging foods like blueberries or dark chocolate instead. http://bit.ly/cYxOMj
droz,@kailamel There is no easy solution for stretchmarks -- but vitamin C and zinc may help heal the skin from the inside out
droz,@LeanaAngkham Here's a little help with your cleanup plan: a de-clutter checklist http://bit.ly/asHia9
droz,RT @RealAge: Did you know a red bell pepper has more vitamin C than an orange? Learn more about vitamin C: http://bit.ly/cUOdvr
droz,@TIERRA226 No more midnight snacks. Don't eat after 7:30 p.m.
droz,"Only 8 months after a double-lung transplant, opera singer belts out big thanks to doctors that saved her life http://bit.ly/9Nx7Fz"
droz,Ozzy Osbourne gets his own health column: Ask Dr. Ozzy. Would you take his advice? http://bit.ly/cMuSlq
droz,"RT @RealAge: Today (6/21) is Nat'l ASK Day. Protect kids from gun violence: parents, ASK if guns are in homes where your kids play. http ..."
droz,"Men: 30% more likely to be hospitalized for preventable conditions. This Fathers Day, promise to change that. http://bit.ly/aNEzZw"
droz,RT @RealAge: Think you don't have time to exercise? Here are 5 common excuses & their fixes: http://bit.ly/d05tAT
droz,World Cup fitness fact: referees run 12 miles per game  thats 5 more than the actual players. http://bit.ly/bGUXem
droz,Another reason to eat more whole grains: brown rice may help reduce your diabetes risk. http://bit.ly/9sUK8a
droz,"RT @HealthCorps: TIP: Lighten up your side dishes and condiments! Use nonfat yogurt, fresh herbs & lemon juice as substitutes for mayo,  ..."
droz,A 4-year-old sets a record:1500 pushups in 40 minutes. Maybe he could teach the 2-year-old smoker a few things. http://bit.ly/aeGICe
droz,RT @RealAge: Has something you've seen on the @DrOz Show changed your life? Share your story: http://bit.ly/9n8Ct1
droz,Its my 50th birthday  and things are looking great. A new study suggests happiness comes with age. http://nyti.ms/a50HP0
droz,Wake-up call: American cigarettes contain 3 times more cancer-causing chemicals than foreign brands. http://bit.ly/awQhAV
droz,"Could being a grump actually be good for you? Im not sure I agree, but researchers say yes. http://bit.ly/a7XovQ"
droz,Good news for peanut-allergy sufferers. Scientists are on their way to creating a non-GM low-allergy variety. http://bit.ly/905oc6
droz,"Emmy update! Congrats to Seattles @KOMONews for producing this winning spot, which I costarred in: http://bit.ly/bqVZxE"
