felipeneto,RT @Vih_BM: O RICO POBRE hauhsuahushaushuashuahsuahsuahs muiiiito bom!! =P @felipeneto http://t.co/eLm15SXE
felipeneto,"RT @_SwagDoNiall: KKKKKKKKKKKKKKKKKKKKKKKKKKKKKKKKKKKKKKKKKKKKKKK' ""Vamos a falncia"" @felipeneto http://t.co/tPvH22c1"
felipeneto,E o prmio de pior pai do mundo vai para - http://t.co/5fhpF6Aa
felipeneto,O pai que ningum gostaria de ter - http://t.co/5fhpF6Aa
felipeneto,"@marcoscastro @parafernalha HAuhauha 133,33333%"
felipeneto,Por sinal vale a pena assistir o vdeo novo! O RICO POBRE - http://t.co/5fhpF6Aa (RT pela cura da Aids)
felipeneto,A @Parafernalha teve um crescimento de 133% de outubro para novembro de 2012! Equipe foda!
felipeneto,Adicionei um vdeo a uma lista de reproduo @YouTube http://t.co/eZU9F7jI RICO POBRE
felipeneto,"Cidados, parem de fazer o que esto fazendo, porque tem vdeo novo da @Parafernalha e t MUITO FODA - http://t.co/5fhpF6Aa"
felipeneto,E o nico cara q conseguiu achar o vdeo certo foi o @AlisonRDark - Muito obrigado cara.
felipeneto,@gaveta @AlisonRDark AEEEEEEEE!
felipeneto,"@AlisonRDark @gaveta Ae cara, acho que ele achou hein? Era esse? http://t.co/LT6K8snO"
felipeneto,@gaveta pqp se essa task force no achou eu s posso te desejar boa sorte =/ huahauhauha
felipeneto,@gaveta Se algum mandar o certo me avisa quem foi =)
felipeneto,Se algum conseguir achar e mandar pro @Gaveta o vdeo do Alborgheti gritando NO NO NO NO eu divulgarei aqui a arroba do cidado.
felipeneto,Ok vou sair tchau foda-se
felipeneto,Gente  q eu sou contratado da Globo ento tenho q contar essas piadas boas
felipeneto,1 2 3 4 5 6 7 8 9 10 11 12 13 14 15 16 17 18 19 20...
felipeneto,"T, agora eu vou contar de verdade, prometo."
felipeneto,@emersonanomia @NickEllis Tb!!!
felipeneto,Mentira se fudero
felipeneto,Vou contar uma piada.
felipeneto,O Twitter  um excelente exerccio de piada rpida no qual eu sou perito em falhar miseravelmente.
felipeneto,@emersonanomia =) S2
felipeneto,@emersonanomia Foi mal cara eu to longe do cel e o Skype desligado =( t ligado l na Para. Eu to pooooodre.
felipeneto,Tem que fazer que nem eu e escrever uma bio do Twitter 100% legtima e honesta.
felipeneto,"A bio da Valesca Popozuda pede pra usarem camisinha. Qnd vc precisa botar isso na sua BIO, tem alguma coisa errada."
felipeneto,Acho que exagerei na carga de trabalho hoje... To to cansado q to me sentindo meio febril. Foda  ficar cansado mas sem sono.
felipeneto,Gostei de um vdeo @YouTube http://t.co/0NNblgCF a Ask da Parafernalha 4 - 30/11/2012
felipeneto,"RT @gigiduarte1234: http://t.co/CkElnrfj
Raxei de riirrr @felipeneto"
felipeneto,"O Rico Pobre - http://t.co/u5i9il6g  - V a, j que voc no t beijando na boca nessa sexta mesmo..."
felipeneto,"Chegando agora de uma gravao da @Parafernalha, foi sensacional! Tera o vdeo t no ar e acho q vai ficar incrvel."
felipeneto,Respondendo a Ask da Parafernalha 4 - http://t.co/FJ397ybY
felipeneto,"Saindo pra atuar em um dos prximos vdeos da Parafernalha. Alis, vejam o q acabou de sair do forno: RICO POBRE - http://t.co/5fhpF6Aa"
felipeneto,RT @Niickchan: conheo pessoas assim KKKKKKKKKKKKKKKKKKKKKKKKKKKKKKKKK o rico e o pobre http://t.co/W1Cn5UwL @felipeneto
felipeneto,RT @EllenSuzanoo: KKKKKKKKKKKKKKKKKKKKKKKKKKKKKKKKKKKKKKKKKKKKKKKKK mt bom o rico pobre http://t.co/6EgQoCBo @felipeneto
felipeneto,RT @brendoncss: At eu fico pobre desse jeito. POBRE E RICO http://t.co/509eviuO @felipeneto
felipeneto,RT @laborda_gabriel: O RICO POBRE http://t.co/OU82p6jb @felipeneto
felipeneto,Gostei de um vdeo @YouTube http://t.co/eZU9F7jI RICO POBRE
felipeneto,"Amigos, parem de fazer o q esto fazendo, pois saiu o novo vdeo da Parafernalha! O RICO POBRE - http://t.co/5fhpF6Aa (RT se curtir - e vai)"
felipeneto,Cena excluda do vdeo: A entrega do boy - http://t.co/fB94baW2
felipeneto,Siga o @fellipe2ls - Ele  o mximo!
felipeneto,"J subindo o vdeo de sexta da Parafernalha, j j aqui h -&gt; http://t.co/r2PQ2GU1"
felipeneto,"J j vai ao ar o vdeo de sexta da Parafernalha, enquanto isso vejam esse q t FODAAAA - http://t.co/Qj3aPjKn"
felipeneto,Me flagaram cantando funk com o @fellipe2ls - http://t.co/OJZuoj4P
felipeneto,Cuidado com os elogios - http://t.co/LtkW9S1K
felipeneto,RT @ErickLosada: @felipeneto esse video fico foda ! http://t.co/VgZ3H7xM
felipeneto,"Ento j sabe.Prxima vez q internet cair ou ligao  completar,  pode reclamar, s se tiver passando fome e sendo enrabado p um somaliano"
felipeneto,"Ento se vamos usar essa regra, vamos todos somente reclamar da fome, nada mais, nunca mais."
felipeneto,Eu reclamei que os pen-drives so pequenos e uma mulher me xingou falando q eu tenho q falar dos problemas de saneamento do Brasil.
felipeneto,Alis sabe pq o rob q foi pra marte no postou foto no Orkut? Pq l no tinha espelho e ele no podia ficar sem camisa. HAHAHAHA PIADONA HA
felipeneto,"Os caras j mandaram um rob pra Marte que postou foto no instagram, q q custa fazer um pen drive potente?"
felipeneto,Alou empresas das tecnologia por favor faam um pen drive de 1TB obrigado valeu mesmo ae
felipeneto,@vyktorb no cara to nem a  da luka
felipeneto,"Podem salvar esse tweet p/ ler no futuro. Quando o Roberto Carlos morrer aquele seu tio ""engraado"" vai ficar cantando: ""esse cara morreu"""
felipeneto,"Eu gosto do Roberto Carlos, de verdade, mas putaquepariujencheuaporradosaco."
felipeneto,"S eu j to comeando a sentir vontade de socar minha prpria cara quando ouo ""esse cara sou eu"" de 5 em 5 minutos?"
felipeneto,@bobagento @rslonik MySpace e Orkut tambm
felipeneto,"@TiagoLeifert Amigo, produtores de qualquer espcie (tirando os executivos) esto na Terra p/ pagar pecados."
felipeneto,"Amanh vou atuar num vdeo da Parafernalha, que vai ao ar na tera =) O roteiro t bem legal, mas fui eu q escrevi ento t legal s pra mim"
felipeneto,"O aplicativo pra iPhone da Parafernalha t quase pronto, a vcs sero avisados qnd tiver vdeo novo da Para e do No Faz Sentido =)"
felipeneto,S tem viado na Parafernalha. Menos eu - http://t.co/W6PyiAko
felipeneto,"Eis a piada q ele mandou: ""uma menina era pobre e pediu para o pai um iphone, mas como  tinha dinheiro ele deu um ipim"" - @fellipe2ls"
felipeneto,"""Caralho Fellipe me manda logo a porra da planilha!"" - ""Calma cara, eu to escrevendo uma piada no email pra voc""."
felipeneto,O que toda empresa deveria ter - http://t.co/Qj3aPjKn
felipeneto,"Gostei de um vdeo @YouTube de @tgs_brasil http://t.co/XFfoPMwn TGS NA YOUPIX, PREMIAO DOS CANAIS E DIA DE ""PRINCESO"""
felipeneto,"Primeiro tacou fogo na mo, agora isso... - http://t.co/wiJsm2ud (O sangue foi censurado para evitar problemas com Youtube)"
felipeneto,Adicionei um vdeo a uma lista de reproduo @YouTube http://t.co/ClpIf9k2 ENTREGA DO BOY
felipeneto,J assistiu ao ltimo vdeo da Parafernalha? Ento assista que t muito bom! A ENTREGA DO BOY - http://t.co/Qj3aPjKn
felipeneto,@cauemoura Se eu vejo um desgraado com 20 anos na fua andando com chaveiro de minecraft eu choro.
felipeneto,"RT @cauemoura: acabei de ver um abridor de garrafas em forma de ferramenta do minecraft. pff, fail. toddynho no tem tampa."
felipeneto,2 milhes de views em 5 dias: NO FAZ SENTIDO - AMANHECER -&gt; http://t.co/TgIhezMt
felipeneto,Muito cuidado ao assistir - http://t.co/r2PQ2GU1
felipeneto,Pare de fazer o que estiver fazendo e veja o vdeo novo da Parafernalha! A ENTREGA DO BOY - http://t.co/Qj3aPjKn (RT ou morra)
felipeneto,Adicionei um vdeo a uma lista de reproduo @YouTube http://t.co/ClpIf9k2 ENTREGA DO BOY
felipeneto,RT @parafernalha: Vejam com @damianigui como  legal cagar na @parafernalha! - http://t.co/zdAMlIcs
felipeneto,"Galera do RJ, hoje estarei no FORA DA REDE com @cauemoura @marcoscastro e grande elenco, no Teatro Dulcina, olha ae - http://t.co/eX8jSX0U"
felipeneto,Imaginem ter esse emprego: https://t.co/PseLPvBi
felipeneto,Gostei de um vdeo @YouTube de @leninjablog http://t.co/ZYsay8Op Especial 100 vdeos LeNinja Mode
felipeneto,O cara parece mais comigo do que eu mesmo!
felipeneto,@danielbovolento Se fudeu. Hahahahaha.
felipeneto,"PQP!!! Um cara foi fantasiado de ""mim"" numa festa e OLHA ISSO MANO! https://t.co/rY9Izzmb / https://t.co/YStNtmWY / https://t.co/hk0LHWT4"
felipeneto,@henriquewicz No
felipeneto," to engraado qnd uma pessoa diz: ""po cara isso ficou muito ruim, mas essa crtica  construtiva"" - No, no , amigo."
felipeneto,@henriquewicz No..
felipeneto,RT @nerdestroyer: @felipeneto Morri de ri com esse video.http://t.co/exRKr42M de Rosas !kkk
felipeneto,@henriquewicz No.
felipeneto,RT @twantedourpride: @felipeneto vai chupa uma pica
felipeneto,E como sempre eu tenho q dar uma risada de canto de boca como se aquela fosse a primeira vez q eu ouvi tamanha criatividade.
felipeneto,"O pior  qnd eu falo algo normal no dia a dia e a pessoa responde: ""isso no faz sentido, hein? hein?"" fazendo o sinal do trocadilho. Foda."
felipeneto,"RT @Mombaque: @felipeneto troquei o termo por ""no ter lgica"" pq no aguento mais isso"
felipeneto,"Alguma vez algum de vcs falou ""no faz sentido"" pra alguma coisa e em seguida pensou em mim? (L)"
felipeneto,"Qnd eu disse ""no faz sentido balo"" quis dizer q sugerem q eu faa um vdeo sobre QUALQUER COISA. E eu tenho q rir e falar q vou fazer sim."
felipeneto,"A pior parte d ter canal chamado No Faz Sentido  q todo tio em festa vem falar: ""ae felipe, ae, faz ae um no faz sentido balo hahahaha"""
felipeneto,@anderssauro Faz sentido.
felipeneto,@anderssauro Cacete cara essa pizza t com uma cara horrvel!
felipeneto,"Parafernalha batendo 750 mil inscritos! Isso pq ainda nem comeamos oficialmente td de novo q estamos criando, VEJAM - http://t.co/uY8qmAvE"
felipeneto,"Os fs de Crepsculo criaram um meme no Facebook pra me zoar. O meme troca ""mas"" pelo ""mais"". Sem mais, meretssimo."
felipeneto,"Vejam antes que acabe: A ENTREGA DO BOY - @felipeneto eu nunca vou esquecer, pode ter ctz. Rs."
felipeneto,RT @IbanhesLays: To precisando ir nesse ''Departamento de autoestima'' hahahah http://t.co/TNAzs58F @felipeneto
felipeneto,"RT @thompsoncost: ""Departamento de Autoestima"" http://t.co/zXaGLZIo  kkkkkkk, muito bom @felipeneto"
felipeneto,"RT @amigoGordo: ""Qual a marca do seu perfume ? - Leite de rosa"" http://t.co/kWVU6W8V  | Via @felipeneto HAHAHAHAHHAHHAHAH"
felipeneto,"Rufem os tambores, o vdeo de tera da Parafernalha est no ar!!! A ENTREGA DO BOY - http://t.co/Qj3aPjKn (RT se vc  veloz e furioso)"
felipeneto,Gostei de um vdeo @YouTube http://t.co/ClpIf9k2 Entrega do Boy
felipeneto,Video novo no ar!! A Entrega do Boy!! - http://t.co/LtkW9S1K
felipeneto,O que acontece quando se coloca um ateu ignorante e um cristo fantico para debater - http://t.co/zrZh1niI
felipeneto,Aproveita enquanto o vdeo novo no t no ar e segue: @parafernalha - Ou o Edward vai te pegar atrs do armrio.
felipeneto,O @chatodemais responde as perguntas mais.. pertinentes na Ask da @parafernalha - http://t.co/HolSlCF4
felipeneto,Flagrante de sem-vergonhice na Toca Parafernalha! http://t.co/XWE3UAlT
felipeneto,RT @parafernalha: J j tem vdeo novo do Canal Parafernalha!!
felipeneto,"To twittando da cama s pra avisar q so 3:00 em ponto. Se voc viu Exorcismo de Emily Rose, cague-se. Boa noite bjs."
felipeneto,"Ok galera, agora eu vou mesmo, amanh eu pego cedo na Parafernalha e to de saco cheio de dormir menos q um ser humano deveria."
felipeneto,@CaiqueNogueira HAUHAUHAUHAUHAUHA foi mal cara... Mas pensa pelo lado positivo: vc agora  um homem feito e pode rir disso tudo =p
felipeneto,RT @CaiqueNogueira: @felipeneto voc tb. Fez a minha adolescncia ser a mais bullynada da hist. No podia sair na rua sem me chamarem de ...
felipeneto,"@CaiqueNogueira Valeu meu velho, vcs foram parte da minha vida no final das contas hehehehehe."
felipeneto,"HAHAHAHAHAHAHAHAHA quase 3 anos atrs eu zoava os Colrios da Capricho e agora - RT @CaiqueNogueira eu nunca vou esquecer, pode ter ctz. Rs."
felipeneto,"RT @CaiqueNogueira: @felipeneto eu nunca vou esquecer, pode ter ctz. Rs."
felipeneto,"Enfim gente, vou dormir. Quero agradecer imensamente a vocs, mas principalmente a quem tornou isso tudo possvel: os illuminati. Obrigado!"
felipeneto,@ahnao Po cara eu no sou o Mr Catra huahauhauhauh
felipeneto,@insoonia Saudades do Controle Remoto =(
felipeneto,@anadecesaro Brigado Ana! Vc tb  foda! S no fica insuportvel agora q t gostosa t? huahuahauhuah
felipeneto,@catupiry Verdade!
felipeneto,E l se vo quase 3 anos =) Que venham os prximos 3!
felipeneto,"@diegoquinteiro Hauhauhauhau j so quase 3 anos, j to no lucro!"
felipeneto,"@IsabelaaFreitas J comprei o livro, vou ler essa semana."
felipeneto,"E pensar que quando comecei, 3 anos atrs, ouvi MUITO: ""em 6 meses ningum lembrar""."
felipeneto,@jovemnerd Vcs sempre foram inspirao e referncia em todo esse processo... E continuam sendo.
felipeneto,"E dos 45 vdeos do No Faz Sentido, 30 tem mais de 2 milhes de views, os outros 15 mais de 1 milho. Cs so do caralho!"
felipeneto," impressionante como, td vez q tem vdeo novo, o No Faz Sentido vira o canal q + cresce no BR. Msm dps de todo esse tempo. Mto orgulho."
felipeneto,@jovemnerd Cara mas a fora do No Faz Sentido ainda  incrvel. Sempre q tem vdeo novo vira o canal q + cresce no Brasil. Mto foda.
felipeneto,Nos ltimos 3 dias o No Faz Sentido recebeu 18 mil novos inscritos. Sejam bem-vindos =) os vdeos continuaro.
felipeneto,RT @IsabelaaFreitas: CHORANDO COM O VDEO DO @felipeneto SOBRE AMANHECER http://t.co/v4R47qI7
felipeneto,RT @MaatheeusCosta_: http://t.co/meYVhegE EU ESTOU SAUDAVEL COMO UM CAVALO (8:10) @felipeneto HAHAHAHAHAHAHA
felipeneto,"RT @MyLittleManuGRK: Robsten  vida,twilight  vida,meu f clube  vida,e foda-se a opnio do @felipeneto"
felipeneto," srio que esse ""50 Tons de Cinza"" comeou como uma FanFic de Crepsculo? Puta merda, eu tenho que ler isso."
felipeneto,"@pecesiqueira E do jeito que eu te conheo tu t preocupado com isso, falae!"
felipeneto,"Sei q o @pecesiqueira j falou de 50 Tons de Cinza, mas at onde sei  existe uma regra onde no se pode ter 2 opinies sobre o msm assunto."
felipeneto,Estou comprando 50 Tons de Cinza pra ver qual que  a desse livro q todo mundo t falando. Vamos ver se vai parar no No Faz Sentido.
felipeneto,Para quem ainda no viu: o que acontece quando se coloca um ateu ignorante e um cristo fantico para debater - http://t.co/zrZh1niI
felipeneto,"Um livro que tem influncia de cultura pop como Matrix e D&amp;D, merece uma conferida. A Liga de Urntia. Compre aqui: http://t.co/RblruWF8"
felipeneto,"Al voc que usa sistema pra remover as propagandas do Youtube. Saiba q se todos fizerem isso, no haver mais Youtube. Pense nessa porra."
felipeneto,Google fora do ar no Brasil... E toda empresa que gira em torno dele (como a Parafernalha) tendo prejuzo a cada segundo que passa.
felipeneto,O que acontece quando voc coloca um ateu ignorante e um cristo ignorante no mesmo ambiente - http://t.co/zrZh1niI
felipeneto,"timo, nenhum cliente da fantstica empresa NET est conseguindo abrir qualquer servio do Google. Net, voc se supera."
felipeneto,"RT @FefeAguiar_: o @felipeneto conseguiu se superar, melhor que o 1 video de crepsculo s o novo &gt; http://t.co/DM7WOpH2"
felipeneto,Gostei de um vdeo @YouTube http://t.co/QNfMhWft na Toca Parafernalha!!
felipeneto,HAHAHAHAHAHAHAHAHAHAHHA (REESPIRA) HAHAHAHAHAHAHAHAHAHHAHA - http://t.co/IPlnXSy5 (um dia comum na Parafernalha)
felipeneto,"Alis, aproveitem e se inscrevam nos 2 canais da @parafernalha - http://t.co/r2PQ2GU1 e http://t.co/jPuD6r5X - VEM!!"
felipeneto,"A @parafernalha tem uma Ask, e... e... vejam o vdeo - http://t.co/HolSlCF4"
felipeneto,Novo vdeo da Parafernalha est FANTSTICO: um debate entre um cristo e um ateu - http://t.co/zrZh1niI
felipeneto,RT @youpix: Vai rolar um encontro de tits do Youtube no youPIX RIO: @Kefera @FelipeNeto @Moluscontos e @CaueMoura. Se inscreva: http:// ...
felipeneto,Gostei de um vdeo @YouTube de @leninjablog http://t.co/C4Juzegf WAR Z #2 - ADRENALINA
felipeneto,Eu me sinto orgulhoso e feliz demais em provar que o No Faz Sentido continua com toda essa fora mesmo depois de quase 3 anos.
felipeneto,O vdeo No Faz Sentido - Amanhecer j  o maior fenmeno de views da histria do No Faz Sentido. 1.5 milho em 2 dias. Mto obrigado!
felipeneto,"RT @perolafaria: Embora eu tenha gostado e acompanhado a Saga Crepsculo, devo admitir que ADORO os videos do @felipeneto e reconheo as ..."
felipeneto,"@Cardoso sim, mas ele no tinha bigode :("
felipeneto,Resolvi andar a cavalo pra ver se ficava saudvel como um cavalo (s os fortes entendero).
felipeneto,"Passei o fim de semana andando a cavalo no mato e agora to cheio de dor na bunda. Piadas, por favor?"
felipeneto,No Faz Sentido - Amanhecer. Veja agora e fique saudvel como um cavalo: http://t.co/nCcMSupr (RT pelo recorde de views!)
felipeneto,Wow!!! 1 milho de views em menos de 40 horas! No Faz Sentido - Amanhecer. http://t.co/TgIhezMt
felipeneto,Mais de meio milho de views em 1 dia! No Faz Sentido - Amanhecer! http://t.co/TgIhezMt (RT pelo recorde!)
felipeneto,Sou frustrado por no ser capaz de fazer vdeos mais engraados que os comentrios de quem se incomoda com eles =(
felipeneto,RT @justkrisbian: felipe neto  um kengo fdp q fala mal de twi mas assistiu bd cARALHO VAI DA O CU
felipeneto,RT @UnitedForKJStew: Sabe qual  o problema do Felipe Neto? F A L T A D E P I C A
felipeneto,RT @AmorRobsten: No irei ver  o vdeo dessa bicha do  Felipe Neto porque no me interessa nada do que vem dele...Ele  sem graa s os  ...
felipeneto,"RT @UnitedForKJStew: Vocs no entenderam ainda????? O FELIPE NETO QUERIA SER A KRISTEN, PORQUE SABE QUE JAMAIS VAI TER CHANCES COM O RO ..."
felipeneto,Respondendo a Ask.fm da @parafernalha - Por @chatodemais - http://t.co/HolSlCF4
felipeneto,"Se voc t saudvel como um cavalo, d like no vdeo novo ;) No Faz Sentido - Amanhecer! http://t.co/TgIhezMt (RT ou morra)"
felipeneto,"Amigos e amigas, j est no ar o vdeo NO FAZ SENTIDO - AMANHECER, veja antes q o mundo acabe - http://t.co/TgIhezMt"
felipeneto,@Cardoso HAUHUAHAUHAUHAUHUAHUAHUAHUAH
felipeneto,Qualquer pessoa q coloque a saga de Harry Potter em p de comparao com Crepsculo no tem inteligncia e/ou cultura literria. E acabou.
felipeneto,@Cardoso Como um grupo de pessoas consegue ser to coletivamente burro?
felipeneto,"Os comentrios dos fs de Crepsculo so engraados, mas esse falando q vampiros mais novos so mais fortes so IMBECIS!"
felipeneto,RT @LuMendes_2: Felipe Neto tem que saber que os recm criados so mais fortes.
felipeneto,"AHuHAuhAUhUAHuhauhUHA ""cutucou os fans agora aguenta"" - pode deixar, to aguentando."
felipeneto,"RT @JoyceFariia: o Felipe Neto cutucou os fans, agr ele aguenta, nao saber respeitar eh nisso que da (;"
felipeneto,@mionzinho_ AAAEEEEEE
felipeneto,"RT @Twilightersever: Felipe neto , v se fuder sua aberrao , no gosta ? respeita caralho u_u"
felipeneto,"RT @MajuJurkovich: Felipe Neto  o caralho, viadinho arrombado, vai pra puta que pariuuuuu. Sei l, n gostar de crepsculo blz, mas resp ..."
felipeneto,"RT @DiariodaEmily: Talento,coisa que o felipe neto no tem e pra chamar atenao tem que ficar falando mal dos que possuem talento"
felipeneto,RT @ComVoceManu: felipe neto deveria ir procurar os machos dele e deixar de falar bosta
felipeneto,"As fs de Crepsculo me chamando de burro pq ""vampiros recm nascidos so mais fortes mesmo"" - HAUHAUHAUHAUHAUHAUHAUHAUHAUHAUAHUAH"
felipeneto,"Sim,  isso mesmo, saiu vdeo novo do No Faz Sentido sobre o filme Amanhecer, o fim de Crepsculo - http://t.co/TgIhezMt"
felipeneto,"Controlem-se na viadagem, rapazes - http://t.co/W6PyiAko"
felipeneto,Estou sendo to xingado pelas fs de Crepsculo que parece que voltei pra 2010.
felipeneto,RT @Maggot02_: MUITO FODA O NOVO VIDEO NO FAZ SENTIDO DO @felipeneto AMANHECER (FIM DE CREPSCULO) http://t.co/cMklb0uo
felipeneto,Gostei de um vdeo @YouTube http://t.co/eOuEIIio VS. CRISTO - LIBERDADE E EXPRESSO
felipeneto,"Se voc  saudvel como um cavalo, no esquea de dar like e adicionar aos favoritos - http://t.co/TgIhezMt NO FAZ SENTIDO - AMANHECER"
felipeneto,RT @mfzaroni: MANO http://t.co/erpMkK9U! O MELHOR VIDEO DO @felipeneto FAVORITEI PQ SOU SAUDVEL COMO UM CAVALO!!!!
felipeneto,"RT @LuanaCabralS: No vou nem xingar o felipe neto ele no merece nem issBABACA ,MAL AMADO DO INFERNO !!! bjs"
felipeneto,"RT @RobstenEternida: SERIO SE UM DIA EU ENCONTRAR O FELIPE NETO, LEVO UMA FACA E ESTRANGULO AQUELE FILHO DA PUTA, TENHO D DA EXISTENCIA ..."
felipeneto,Todo mundo se sentindo saudvel como um cavalo depois de ver No Faz Sentido - Amanhecer: http://t.co/eeaByAip!
felipeneto,RT @samucasjp: http://t.co/0l0RPxj0 depois de ver me sinto saudvel como um cavalo !! @felipeneto
felipeneto,"RT @Deeercy: Obrigada, @felipeneto. agora me sinto saudvel como um cavalo."
felipeneto,"RT @_Bebetinha: Felipe Neto vai fazer com um cavalo pq mulher nenhuma te quer,seu filho de uma boa me que no merece o filho que tem.VA ..."
felipeneto,RT @S_SPattz: vamos fazer um vdeo de resposta pro Felipe Neto? pfvr
felipeneto,"RT @movelikelautner: ACHO Q FELIPE NETO PRECISA DE UM PAU NAQUELE C,  J VIRAM O VIDEO Q O MERDA FEZ? FALANDO MAL DA SAGA TODA. M O R R E ."
felipeneto,RT @pedrafilosofal_: MELHOR VDEO DO FELIPE NETO (@felipeneto) PARABNS KKKKKKKKKKKKKKKKKKKKKKKKKKKKKKKKKKKKKKKK http://t.co/gRNL7RmO!
felipeneto,"RT @Hani_Stew: Vocs ainda esto ligando para o que o Felipe Neto diz ?  so ignora,agente ja tem experincia nisso"
felipeneto,"No sei vocs, mas eu estou saudvel como um cavalo - http://t.co/eeaByAip"
felipeneto,RT @magic4everHP: graas ao felipe neto todos esto saudveis como um cavalo. AHAHAH
felipeneto,"RT @GiuliaCordeiro_: http://t.co/Kesgnwwu
Esse video diz tudo o que eu senti assistindo amanhecer, @felipeneto o MELHOR,ri demais :)"
felipeneto,RT @fucking_robsten: parem de falar daquele demonio chamado felipe neto porra
felipeneto,RT @HereforKristen: nem ligo pro que felipe neto fala e voces deveriam fazer o mesmo
felipeneto,"Amigos e amigas, est no ar! NO FAZ SENTIDO - AMANHECE (O FIM DE CREPSCULO) - http://t.co/TgIhezMt (RT se voc t feliz)"
felipeneto,"RT @FC_Parafernalha: Muito bom o vdeo novo do @felipeneto, t morrendo aqui de tanto rir!! http://t.co/VY5k5suE"
felipeneto,Enviei um vdeo @YouTube http://t.co/nCcMSupr AMANHECER (FIM DE CREPSCULO) - NO FAZ SENTIDO
felipeneto,NOVEEEENTA porcento!!! Agora  contagem regressiva!
felipeneto,Quem a t dando F5 no canal do No Faz Sentido pra ver se o vdeo do Amanhecer t pronto? =p 83%!!
felipeneto,AEEE a orao dos fs do No Faz Sentido foi mais forte! 75% e subindo!
felipeneto,"Galera, acho que a orao das fs de Crepsculo deu certo... O upload t parado em 72%... Pqp..."
felipeneto,60%!!!
felipeneto,"Enquanto no sai o No Faz Sentido - Amanhecer, vejam o ltimo vdeo da Para que t sensacional - http://t.co/7juDiQfv"
felipeneto,Os fs de Crepsculo esto mandando mensagens torcendo para minha Internet cair e o vdeo no ir ao ar. Hauhauhauhauhauh.
felipeneto,Falta pouco... http://t.co/V08keL71
felipeneto,Tinha tanta coisa pra falar sobre o fim de Crepsculo que o vdeo ficou com 17 minutos...
felipeneto,17% upado... No Faz Sentido - Amanhecer est a caminho... Faam as oraes para o Deus do Youtube no dar pau.
felipeneto,"Amigos e amigas... J estou subindo o vdeo No Faz Sentido - Amanhecer. Avisem aos amigos, est chegando... Tan tan tan."
felipeneto,Gostei de um vdeo @YouTube de @diariodocurioso http://t.co/yrPWMkuV Leis e Costumes Malucos Espalhados por Ai - Dirio do
felipeneto,Pronto... Parei de trabalhar. Vdeo do No Faz Sentido - Amanhecer t pronto! Amanh por volta das 14h estar no ar!
felipeneto,As fs de Crepsculo j esto me xingando e eu ainda nem lancei o vdeo... Porra...
felipeneto,23:30 e eu aqui no escritrio da Parafernalha editando o No Faz Sentido sobre Amanhecer. Se vcs no gostarem eu vou mat-los.
felipeneto,Acabei de gravar o No Faz Sentido -Amanhecer. Indo agora pra Parafernalha editar. Amanh estar no ar!
felipeneto,Preparando pra gravar No Faz Sentido - Amanhecer... Neste exato momento. Amanh o vdeo estar no ar.
felipeneto,@xjulianaaa to no cinema :/
felipeneto,"RT @AnnaLauraPAbreu: Viciada nesse vdeo, no consigo parar de ver! VEM NI MIM, ALZHEIMER QUE EU TO FCIL PRA VOC! @felipeneto MUITO bo ..."
felipeneto,"Gostei de um vdeo @YouTube de @tgs_brasil http://t.co/ZSAH4nyT Lanamentos da Semana (19/11/12) - Wii U, Playstation All-Star"
felipeneto,J viram o ltimo vdeo da Parafernalha? T imperdvel (principalmente pros homens) - FAO TUDO... http://t.co/7juDiQfv
felipeneto,"RT @gabrielbaarbosa: RT @guifreitas_96 : @felipeneto AE SEU VACILAUM RESPEITA O DEUS DA ZAGA FILHA DA PUTA RECALCADO, VOU METE A PEIXEIR ..."
felipeneto,Durval t comemorando ou t em fase terminal de cncer?
felipeneto,Aeeee porraaaa parabns Fluminense campeo das Amricas!
felipeneto,AJUDA NEYMAR!!!
felipeneto,Cacete o goleiro da Argentina bateu um tiro de meta no ngulo.
felipeneto,No vo deixar o Neymar bater hahahahahahhaa. AGORA VAI!
felipeneto,Cacete Argentina... T sabendo bem hein...
felipeneto,"Disputa de pnaltis. Se Neymar estiver na lista, o Cavalieri tem que defender 2."
felipeneto,GGOOOOOLLLLLL FREEEEDDD!!! Porra finalmente o jogo comeou!
felipeneto,Hahahahah que pnalti inventado absurdo! Hauahauahauah
felipeneto,Acho que o Thiago Neves ficou cagando no vestirio e no voltou pro segundo tempo. Algum o viu em campo?
felipeneto,MANO TROCOU UM VOLANTE POR OUTRO AGORA SEGURA QUE EU QUERO VER!
felipeneto,O Mano decidiu botar o Fluminense inteiro em campo. S que o Fluminense ganhava sem jogar com 3 volantes.
felipeneto,Ah o Mano trocou um lateral por outro. AGORA VAI HEIN!
felipeneto,To quase enfiando a caneta no olho pra sentir alguma emoo vendo esse jogo.
felipeneto,Cacete que joguinho RUIM! Maior clssico do futebol mundial t mais pra Ponte Preta e Guarani.
felipeneto,Algum me explica DURVAL como titular da seleo?
felipeneto,Torcendo muito pelo Fred na seleo. Centro-avante que o Brasil precisa!
