felipeneto,@rafa_gaglianone Isso se chama jornalista com dinheiro no bolso para escrever algo.
felipeneto,Robert Pattinson comenta suas cenas de sexo no Crepsculo - http://t.co/r7rczLeY
felipeneto,Ele veio pra exterminar o futuro do Brasil - http://t.co/UV8wulKc
felipeneto,"J tem aqui o vdeo com um pedao da minha participao no programa Encontro, olhae - http://t.co/OtsJB3Na"
felipeneto,O segredo pra um namoro bem-sucedido  ser muito ciumento/a - http://t.co/8whMscrH
felipeneto,RT @Paulazedo:  um orgulho para as pessoas que acompanharam o @felipeneto ver seu trabalho sendo reconhecido
felipeneto,Foi um prazer participar do Encontro com Ftima Bernardes. Adorei. Espero q tenham curtido.
felipeneto,"J j vai comear! Encontro com Ftima Bernardes, to l!"
felipeneto,"Pra galera q t me pedindo pra mandar abrao durante o programa, podem deixar, to anotando o nome de todos. Vou mandar sim, vo vendo."
felipeneto,Wow a menina acordou cedo na BLGICA pra me ver no Encontro.
felipeneto,RT @LaraDaniela_98: @felipeneto No cai no sono caraii! Levantei 8:45 pra ver aqui na Belgica pra ver voc! ^^
felipeneto,"To no camarim do Encontro, junto com a Luiza que no t mais no Canad. J j comea o programa e estaremos l, se eu  cair de tanto sono."
felipeneto,"Esperando para ir pro Projac participar do Encontro com Ftima Bernardes...  s 10h40, assistam =) eu vou ser o zumbi ali..."
felipeneto,"@MarcioDornelles Cara, hilrio. Valeu."
felipeneto,Vou ter q acordar 7h amanh pra ir p Projac participar do prog da Ftima Bernardes. Espero q tenham cimento bege p/ esconder minhas olheiras
felipeneto,"Enfim, o bom disso tudo : quando voc  atacado por um jornalista,  sinal de que est fazendo certo."
felipeneto,@MarcioDornelles Acho q no... 222 milhes de visualizaes no  tanto assim... =/
felipeneto,"1 coisa: jornalista me criticar  mais q bem-vindo, mas falar q meu prog. ""no deu certo"" baseado em opinio  foda. Diz q  ruim q td bem!"
felipeneto,"@KcenreWSinneD Ele disse q o programa NO DEU CERTO, no disse que era ruim."
felipeneto,"Mas vc percebe q o jornalista realmente no vai c minha cara com a lista do q ""bomba no youtube do brasil"". No colocou nada meu. Acontece."
felipeneto,"jornalista da Folha disse q meu prog no multishow  deu certo. Detalhe: ele  se baseou na audincia, mas na opinio. Jornalismo brasileiro!"
felipeneto,"Pra quem tem colgio amanh e  vai poder ver o pgma da Ftima comigo, lembre-se: s vezes  bom ficar gripado."
felipeneto,Amanh acordem cedo pra ver Encontro com Ftima Bernardes. Estarei l :)
felipeneto,"RT @taloko_henrique: Vo mostra pro meu pai uns vdeos da ""A Toca"" @felipeneto !!! Muito bom!"
felipeneto,Novos amigos... http://t.co/3SWdEwCB
felipeneto,"Aonde quer que eu v, te levo comigo - http://t.co/JBBjA6ju"
felipeneto,Adicionei como favorito um vdeo @YouTube de @pulgazero http://t.co/3ZfzmE0d Pulga Zero  TGS Brasil!
felipeneto,Bruno Mendes  um jogador incrvel!!! 5 gols em 4 jogos! Fogooooo!!! 4x0!!!
felipeneto,"Botafogo em campo para enfrentar o Atltico-GO, que escalou um meia chamado Mahatma Ghandi. Fudeu amigo."
felipeneto,@luismoreiratid BOO HOO!
felipeneto,Tem nego por a que  mais histrico com assuntos relacionados a maconha que adolescentes femininas com One Direction.
felipeneto," entendo quem fica putinho qnd dizem q maconha faz mal. Eu adoro ovo, mas  dou ataque qnd falam q ovo faz mal. Continuo comendo e foda-se."
felipeneto,Olha o Barcos achando que  Maradona....... T mais pra Z Ramalho amigo.
felipeneto,"RT @emersonanomia: Acho que o cara de mdias sociais que mais rala hoje em dia  o @felipeneto. Ele  top3 com certeza. Projetos novos,  ..."
felipeneto,Ainda estamos aqui! http://t.co/W6PyiAko
felipeneto,Hoje  dia de festa aqui na Parafernalha... Bebida t chegando e mais tarde ligaremos a webcam ao vivo pra vcs verem a zona.
felipeneto,RT @_killerstylish: o pe lanza mandou um ciborg cara uehhuehuehuehue http://t.co/1rjbSTBB @parafernalha @felipeneto
felipeneto,"RT @CanalDoOtario_: Presidente (Lanza), apocalipse nuclear, Tiririca Senador? #ExterminadordoFuturodoBrasil,Via @parafernalha @felipenet ..."
felipeneto,"RT @AlanaRafaela: @felipeneto  A crtica embutida na piada  muito BOA ! http://t.co/B9S1WJvu
O exterminador do futuro do Brasil. HAHAHA ..."
felipeneto,I added a video to a @YouTube playlist http://t.co/O6MwPWMz O Exterminador do Futuro do Brasil
felipeneto,Voc  uma pessoa ciumenta e possessiva? Parabns! Voc est fazendo isso certo!! - http://t.co/WVhodrxo
felipeneto,O Exterminador....... Do Brasil - http://t.co/JBBjA6ju
felipeneto,"I favorited a @YouTube video from @marcoscastro http://t.co/dbzmbpqF Um Joystick, Um Violo - 13"
felipeneto,I liked a @YouTube video http://t.co/O6MwPWMz O Exterminador do Futuro do Brasil
felipeneto,"@coelhodb A pauta  ""sucesso na Internet"", como sempre, mas tentarei falar sobre empreendedorismo."
felipeneto,Gente! Robert Pattinson disse que era ridculo fazer as cenas de sexo no novo filme Amanhecer. Vish! - http://t.co/TXtOWghW
felipeneto,"2 dos maiores Youtubers do Brasil agora so PARAMAKER, veja quem so: http://t.co/r76qiFFX"
felipeneto,Segunda-feira eu estarei de manh no programa Encontro com Ftimas Bernardes =) ASSISTAM OU MORRAM!!!
felipeneto,Se esse a for o futuro do Brasil....- O Exterminador do Futuro do Brasil - http://t.co/I4GOBg8L
felipeneto,"Ou seja, s sigam a @parafernalha se vocs quiserem se divertir e interagir com essa galerinha muito louca que apronta as maiores confuses."
felipeneto,E quem segue a @parafernalha tambm fica por dentro do que rola na Toca e se diverte com o material dos bastidores.
felipeneto,"Quem segue a @parafernalha sabe que toda semana tem uma trollagem, (interna ou no), e perguntas imbecis respondidas de forma ""carinhosa""..."
felipeneto,"Sabe quando voc se pergunta: ""Porque estou estudando essa merda?"" - http://t.co/SCYEEXKJ"
felipeneto,RT @chatodemais: Hoje  sexta-feira! Mas no comemora muito porque voc  pobre.
felipeneto,@Mederi Exatamente a mesma coisa com a gente... Tem vdeo nosso com mais de 500 mil views que t mostrando 247.
felipeneto,O Youtube t com algum bug srio. Os ltimos vdeos da Parafernalha travaram os views e no sobem h 5 dias o.O mas no Analytics t subindo.
felipeneto,@rafaportugalc @parafernalha hHAHUAHAUHUAH
felipeneto,@crisvallory Cara manda l na TIP q  melhor: http://t.co/HP3ZTTXu
felipeneto,A @Parafernalha : no momento tem um ator idoso passando texto na outra sala e o Maracuj berrando p/ ele: SENTA AQUI AGORA FILHO DA PUTA!
felipeneto,O Exterminador do Futuro do Brasil - http://t.co/JBBjA6ju
felipeneto,"RT @patrickyuri4: hahahahahahaha muito bom http://t.co/IvqZ3o6g  tem que ter continuao ,eu me acabo de tanto ri bom trabalho @felipene ..."
felipeneto,"RT @Ander_DuarteMS: Kkkkkkkkkkkkkkkk... Eu racho com esses videos do canal Parafernalha,
do Felipe Neto ( @felipeneto ) http://t.co/7lr2JI6x"
felipeneto,Adicionei como favorito um vdeo @YouTube de @tgs_brasil http://t.co/9avKZSea Lanamentos da Semana (25/10/12) - Medal of Honor:
felipeneto,HAUHAUHAUHAUAHUAHUAHAUHAUHAUHAUHAUHAUHA AAAAA HAHAHAHAHAHAHAHAHAHAHAHA - http://t.co/JBBjA6ju (RT RT RT RT)
felipeneto,Indo para a faculdade Estcio de S do Rio Comprido (Campus Rebouas) para palestrar com a galera da @Parafernalha.
felipeneto,RT @aparamaker: Notcia exclusiva - Entenda todas as mudanas da interface do Youtube: http://t.co/7GMp0Fc4 (somente para youtubers da P ...
felipeneto,Voc lembra das coisas que voc estudou? http://t.co/RkRNKJq9
felipeneto,Prxima segunda-feira estarei no programa Encontro com Ftimas Bernardes. Anote na agenda: nada de ver desenho segunda de manh!
felipeneto,"3.000 likes em 1 hora, acho que a galera t curtindo o vdeo do EXTERMINADOR DO FUTURO DO BRASIL: https://t.co/O0mD0VrM"
felipeneto,RT @parafernalha: Lo Tchan? http://t.co/PzLIZdD5 - @leoluz
felipeneto,Gusttavo Lima x Luan Santana lutando MMA? http://t.co/9mGyDo5G
felipeneto,Momentos em que voc fica invisvel: http://t.co/oeUGYydP
felipeneto,Amigo @PelanzaRestart - Esse vdeo  pra voc: https://t.co/O0mD0VrM
felipeneto,I favorited a @YouTube video http://t.co/O6MwPWMz O Exterminador do Futuro do Brasil
felipeneto,O EXTERMINADOR DO FUTURO DO BRASIL-SIL-SIL!!! - http://t.co/JBBjA6ju
felipeneto,@FeCastanhari j est acontecendo...
felipeneto,As pessoas reclamam de 15 segundos de comercial na Internet. A Globo acabou de exibir 8 (OITO) minutos de propaganda. Tds se calam.
felipeneto,@henriquewicz at pq se no for ele no  ningum.
felipeneto,Vamo Botafogo!!!
felipeneto,E agora @CaueMoura e @MarcosCastro so PARAMAKER! Se liga na notcia: http://t.co/dHafHafz
felipeneto,I liked a @YouTube video from @ahnao http://t.co/WwwmXoDT TUTORIAL DE MANICURE
felipeneto,"Tem horas que voc fica invisvel, mesmo no querendo - http://t.co/zKNk6Dcz"
felipeneto,Qu4tro Coisas - Especial James Bond! Vale a pena conferir! - http://t.co/AQfbDJYS
felipeneto,Luan Santana x Gusttavo Lima - Quem ganha? - http://t.co/UsIlvBIl
felipeneto,O cara l vai pagar 1.5 milho pra tirar a virgindade da menina. Sendo que masturbao  de graa e d mais onda.
felipeneto,"No entendo essa tara masculina por mulheres virgens. Quem j fez, sabe a merda que ."
felipeneto,Quem  o melhor heri de quadrinhos pra voc? http://t.co/ztMBOrK7
felipeneto,Essa humanidade... onde vai parar? http://t.co/ls3R3O7P
felipeneto,Cutuque o seu cu - http://t.co/gcs4u7DH
felipeneto,"No use o banheiro da escola, saiba porque - http://t.co/fdfu7uib"
felipeneto,RT @tgs_brasil: Tem vdeo novo galera!! A Misso &amp; O Caderno dos Youtubers (BGS 2012) - http://t.co/4cCLcg7K - #VemComigo
felipeneto,RT @aparamaker: Em breve lanaremos uma novidade mto bacana p os Youtubers da Paramaker. Seu Natal ter mais JOGOS!
felipeneto,"T ventando tanto no RJ q minha persiana t quase quebrando pelo vento q entra nas frestas do topo da janela, com ela FECHADA!"
felipeneto,RT @rubinho_felipe: ''Tu deve cagar pela cara pra ter esse rosto de bunda q tu tem'' - @felipeneto   http://t.co/3XdPfAcQ (muito booom v ...
felipeneto,"RT @laisruschell_: http://t.co/pcHDQmj5 ficou MUITO bom @felipeneto e maracuja, hahahaha!"
felipeneto,Esse superfaturamento das obras da copa s pode ser explicado de uma forma. To alimentando os funcionrios com Kinder Ovo.
felipeneto,"Queria entender como gastaram ""s"" 300 milhes p construir o Engenho (q eh foda!) e pra REFORMAR o Mineiro precisa de quase 2 BILHES!!!"
felipeneto,Hahaha o governo de Londres conseguiu gastar MENOS q o oramento das obras olmpicas. J o Brasil precisa de 1 BILHO p/ reformar o Mineiro
felipeneto,RT @mariirosendo: kkkkkkkkkkk mto boom! @felipeneto  http://t.co/ugjBt3e5 faz seu c* de touch screen kkkkkkk
felipeneto,Porque voc no deve usar o banheiro da escola - http://t.co/ytDsa3Un - AHUAUHAHUAHUAHU
felipeneto,"Um dos melhores canais de games do BRASIL, a 4 Player agora  TGS  Brasil e mudou o canal, INSCREVAM-SE L Q  FODA! - http://t.co/fhTx2jIr"
felipeneto,Viva a humanidade! http://t.co/454yFfS7
felipeneto,"Galera, gostaria de desabafar: eu nunca recebi 3 estatuetas do Youpix que venci =( me ajudem, twittem: @biagranja D OS PRMIOS DO FELIPE!!!"
felipeneto,I favorited a @YouTube video from @tgs_brasil http://t.co/izMwgP93 A Misso &amp; O Caderno dos Youtubers (BGS 2012)
felipeneto,I liked a @YouTube video from @tgs_brasil http://t.co/izMwgP93 A Misso &amp; O Caderno dos Youtubers (BGS 2012)
felipeneto,[NOVIDADE FODA] - Vejam os dois youtubers que acabaram de entrar na Paramaker!!! - http://t.co/nkIv20gg
felipeneto,Est armando uma tempestade milenar aqui no RJ... J to vendo que vou ficar ilhado no escritrio da Parafernalha at amanh.
felipeneto,"Esse vdeo  pra voc (, pra voc mesmo) - http://t.co/2NfW1iMe"
felipeneto,I liked a @YouTube video from @pgmde1caraso http://t.co/Rfa1ET0C Chamada PGM Felipe Neto
felipeneto,RT @Joao_Antonio__: @felipeneto Faz o teu cu de touchscreen ahahahahahahhahah puta que pariu morri ahahahaha http://t.co/HbnfBkcD  ahah ...
felipeneto,Ser ansioso  o que h! - http://t.co/MsjxkUgu
felipeneto,Bem que vocs podiam seguir a @parafernalha ein?
felipeneto,Faz teu cu de touchscreen!! - http://t.co/Y1sM7t18
felipeneto,RT @diazera: O prximo entrevistado do @pgmde1caraso  ele @felipeneto Falta menos de 1 semana! http://t.co/9GLFZUJx
felipeneto,"RT @Xpock: Assinei com a Paramaker do camarada @FelipeNeto, vou ficar rico!"
felipeneto,"No gosto de funk, mas esse aqui ficou foda! http://t.co/Riho5blu - HAUHUAHUAUHAAUH"
felipeneto,Promiscuidade  um estilo de vida e deve ser incentivado - http://t.co/iVMWbQVc - HAHUAHUAHUAHAHAHAHUHAUA
felipeneto,"@Eoutrascoisas Sugiro que envie de novo e fique de olho no seu email, na caixa de Spam e lixeira tambm."
felipeneto,"Galera, pode responder essa enquete? http://t.co/qMfecoAX"
felipeneto,"A todos os Youtubers que querem fazer parte dessa revoluo chamada ParaMaker, inscrevam seus canais aqui -&gt; http://t.co/XaJJqugJ"
felipeneto,I liked a @YouTube video http://t.co/bswemrzH NO CUTUCA - FUNK
felipeneto,CUTUCA-O-CU! - http://t.co/2NfW1iMe
felipeneto,"RT @parafernalha: Galera, cs podem dar uma ajuda? S nos dizer qual o melhor vdeo da Parafernalha pra voc! Vote  nessa enquete! - htt ..."
felipeneto,Encher o saco numa segunda-feira devia ser considerado crime hediondo.
felipeneto,E voc esperando seu prncipe encantado.... - http://t.co/vW0eQwLP
felipeneto,A Parafernalha tem um setor de Inconvenincia. PQP - http://t.co/nhhtO32f
felipeneto,Essaq internet aproximando as pessoas... - http://t.co/GqWcbJI6
felipeneto,Quem  o melhor heri pra voc? http://t.co/VNC1xfkR
felipeneto,Ansiedade  uma coisa boa! Saiba por que - http://t.co/W17ir6Hx
felipeneto,E se a ligao mais importante da sua vida casse por engano num tele-sexo? - http://t.co/wXD1xS5L
felipeneto,CUTUCA O CU! Novo vdeo - http://t.co/2NfW1iMe
felipeneto,Adicionei um vdeo a uma lista de reproduo @YouTube http://t.co/pcdMd4Jh que Gostaramos de Dizer - GENTE QUE CUTUCA!
felipeneto,"Detalhe: o Fred era pra ter sido expulso, mas o rbitro, como sempre..........."
felipeneto,"Hauahauahaua Fred: ""Cuca  meu amigo mas t um fanfarro do caralho porra"" - HAUAHAUHAUAHAUA"
felipeneto,GOOOOOLLLL DO ATLTICOOOO!!! Puta merda que jogo!!!!!
felipeneto,Gol do Fluminense... Provando q na vida real o vilo vence no final sim.
felipeneto,"Esse grito da torcida do Atltico no  meio incentivador das rinhas no? ""Galo forte brigador""..."
felipeneto,GOOOLLL DO ATLTICO!!!  A VIRADA JEDI!!!
felipeneto,"Al Rede Globo, cad o replay da possvel falta no J na entrada da rea??? Vcs no tem do q ter medo po, os espritos so os msms."
felipeneto,Mais algum com a impresso de que o Fluminense  o imprio e o Atltico o ltimo Jedi?
felipeneto,GOL DO ATLTICO!!! SARAV MAHUBA EL DEMO NO TENS PODER!!!
felipeneto,"Agora tudo faz sentido. O Flu no comprou os rbitros, eles s esto com medo do piru cair com uma macumba se prejudicarem os caras."
felipeneto,"RT @pwailla: @felipeneto Comprar os rbitros  facil, quero saber como compraram a Lei de Murphy"
felipeneto,Quem for da Unimed procurem o Celso Barros que at cncer ele t curando com a fora dos espritos.
felipeneto,HAHAHAHAHHAA OUTRA BOLA NA TRAVE!!! Fluminense Illuminati!!!
felipeneto,Inacreditvel... Gol do fluminense... O pacto com o diabo t impossvel.
felipeneto,RT @RenatoBacon: Ladro  o Galo q quer roubar o ttulo que o Fluminense comprou.
felipeneto,@treta @castrezana @leoluz vale lembrar q se tirar todos os pontos q o Flu ganhou com apito ele perde o ttulo.
felipeneto,"Os tricolores to ofendendo meu time como se isso fosse uma ofensa a mim, hauahauah. Meu time t uma merda msm, todo fudido,  muda nada."
felipeneto,@leoluz @treta trave  competncia? S se for do espritos.
felipeneto,"Primeiro chute a gol do Fluminense, aos 48 do primeiro tempo, contra 15 (QUINZE!!!) do Atltico, sendo 2 na trave e 3 milagres do goleiro."
felipeneto,"Poucas vezes vi um massacre to grande qto o Atltico t metendo no Fluminense, q fez pacto com o demo e a bola NO ENTRA!"
felipeneto,E o Wellington Nem j ia fazer o gol impedido... Cacete arbitragem!!!
felipeneto,"Primeira vez na minha vida q vejo um juiz marcar FALTA NA BARREIRA! No acho q tenha compra de juiz, mas com o Fluminense t difcil..."
felipeneto,Video novo! O que todos ns gostaramos de dizer pra gente chata pra caralho! http://t.co/2NfW1iMe
felipeneto,Adicionei como favorito um vdeo @YouTube http://t.co/WF22SEUG Coisas que Gostaramos de Dizer - GENTE QUE CUTUCA!
felipeneto,@fellipe2ls seu dia j  hoje! Enjoy!
felipeneto,Estou literalmente danando no meio da sala ao som de Linkin Park comemorando a sequncia de coisas incrveis na minha vida!
felipeneto,BOMBA!! VAZOU FINAL DE AVENIDA BRASIL - http://t.co/pEYR05I8 - NO CLIQUE SE NO FOR CURIOSA/O!
felipeneto,RT @MichellyLais: Enfia o iphone no cu e faz essa bunda de touch screen - http://t.co/UCH97Bqp  @felipeneto ...
felipeneto,"""enfia o iphone no cu e faz essa bunda de touch screen"" - http://t.co/2NfW1iMe"
felipeneto,@taviao Pode mandar DM!
felipeneto,"RT @aparamaker: [NOTCIA] Maker Studios, com a ParaMaker, acaba de se tornar a MAIOR NETWORK DE YOUTUBE DO MUNDO! Leia - http://t.co/5Vd ..."
felipeneto,Inscrevam-se no canal da The Game Station Brasil: http://t.co/vv4DTxqt
felipeneto,"RT @itsmarialuizaa: http://t.co/y1SaBkrH '' ta achando que meu brao  iPhone?"" @felipeneto hahaha, esse ficou perfeito!"
felipeneto,@PauloEroSennin Ns mandamos um email para TODOS mostrando onde ter suporte: http://t.co/HP3ZTTXu - v l e pea ajuda!
felipeneto,"RT @tobemtogordo: @felipeneto a galera da paramaker esta de parabns, esto respondendo e ajudando muito rpido o/"
felipeneto,TEM VDEO NOVO! Coisas que Gostaramos de Dizer - http://t.co/2NfW1iMe
felipeneto,Voc  uma pessoa ansiosa? Sim? Ento est fazendo tudo certo!!!! - http://t.co/4PJQccMW AUHAUHAHU calmos gonna hate HAUUHAUHA
felipeneto,"Viva a internet que aproxima as pessoas...oh, wait - http://t.co/Gr2DRH0Q"
felipeneto,I liked a @YouTube video from @tgs_brasil http://t.co/FaKt5zVn Sony - Entrevista com Pedro Caramuru e novidades sobre God of War
felipeneto,RT @valesafatle: fica cutucando teu cu pra ve se gosta hahahah @felipeneto http://t.co/Wcmude00
felipeneto,Essa  pra mulherada que espera um prncipe encantado: http://t.co/o1CZcpVu
felipeneto,"RT @aparamaker: NOTCIA SENSACIONAL! Maker Studios, junto com a ParaMaker, acaba de se tornar A MAIOR NETWORK DO MUNDO! Leia - http://t. ..."
felipeneto,Aquele momento em que voc sente uma felicidade to incrvel que comea a cantar. Que coisa incrvel t acontecendo!!!
felipeneto,@JulianoBFR Leia a notcia amiguinho...
felipeneto,"Servidor da ParaMaker voltou, pra quem quiser ler a notcia que publiquei,  s olhar minha penltima twittada! ParaMaker e Maker no topo!"
felipeneto,@bobagento (L)
felipeneto,@pevidebr Deixa o servidor voltar pro ar que voc vai poder ler a notcia l.
felipeneto,A notcia da Maker assumir posio de maior Network do mundo foi to foda q vcs derrubaram o servidor. Aguardem uns minutos e tentem d novo
felipeneto,NOTCIA BOMBSTICA! Maker Studios se torna a maior Network do mundo no Youtube! E a ParaMaker t junto! Leia - http://t.co/B6TSGGLP
felipeneto,"Por gentileza, no me cutuques - http://t.co/MpNWMPPV"
felipeneto,Quem  o melhor super-heri? http://t.co/MA93IBZ9
felipeneto,"Ah, essa Nicole... http://t.co/wt1mGO2a"
felipeneto,Vdeo novo! Coisas que Gostaramos de Dizer - Gente que Cutuca: http://t.co/2NfW1iMe
felipeneto,No gosto de destros. So muito comuns. Sou hipster. E se canhoto entrar na moda s vou gostar de gente sem mo.
felipeneto,Bom dia s pra quem  canhoto.
felipeneto,RT @rafaelweel: RT pela lgrima no final HAHAHA http://t.co/tqvx9B4T via @felipeneto
felipeneto,@sedentario_org  se vale...
felipeneto,"Pra galera da madrugada, tem vdeo novo do COISAS QUE GOSTARAMOS DE DIZER!!! - http://t.co/2NfW1iMe"
felipeneto,"Bruno Mendes com 18 anos fez 3 gols em 100 minutos de futebol. Rafael Marques (xod do tcnico), zero gols em 18 jogos."
felipeneto,"E o Oswaldo Oliveira no botava o Bruno Mendes pq ele ""no tava pronto"". Isso  o tcnico do Botafogo! Pqp..."
felipeneto,Anotem o nome desse garoto!! BRUNO MENDES! BOTAFOGOOOOOOO
felipeneto,Pqp... 23 minutos de futebol SOFRVEL entre BOT e VAS... 34 passes errados!!!
felipeneto,"Esse Botafogo x Vasco t com cara de disputa pra ver quem joga ""menos pior""."
felipeneto,RT @parafernalha: Em BH tem um comercial com o Vlog do Fernando. S que nesse link voc v a verso sem-censura! http://t.co/GGq34Jtf
felipeneto,"""CUTUCA O CU!"" - Novo vdeo: http://t.co/2NfW1iMe"
felipeneto,A Parafernalha tem um Setor de Inconvenincia. Conhea: http://t.co/7megPsgA - At eu me fudi.
felipeneto,"RT @reh_mm: http://t.co/ZFpB7rTH  euheuehuehueheu @felipeneto VAI CUTUCAR O CU CARALHO"""
felipeneto,"RT @Gudtest_: Hahah Vdeo mais foda do @felipeneto   http://t.co/JvnAidd3    ""Voc deve cagar pela cara pra ter essa cara de bunda.."""
felipeneto,"Vdeo novo! ""enfia o iphone no cu e faz a bunda de touch screen"" - http://t.co/2NfW1iMe"
felipeneto,I liked a @YouTube video from @leninjablog http://t.co/23ZqxskX Minecraft - SkyBlock Ninja #4
felipeneto,"Porque as mulheres levam chifre, by Nicole Bahls - http://t.co/pQgsHJl2"
felipeneto,O que no dizer num assalto? http://t.co/pLRFumF0
felipeneto,Vdeo novo! Coisas que Gostaramos de Dizer - GENTE QUE CUTUCA: http://t.co/2NfW1iMe
felipeneto,PSY e Wolverine danando Gangnam Style!!! HAHUAUHAUHAUHA - http://t.co/IGAqhG2p
felipeneto,Quem  o melhor super-heri? Douglas e Osris tentam descobrir - http://t.co/pgeXKz0A
felipeneto,O que gente que cutuca merece - http://t.co/ysZYXxWz
felipeneto,VDEO NOVO! Fazia tempo que eu no xingava tanto algum - http://t.co/2NfW1iMe
felipeneto,"Tem vdeo novo!!! ""enfia o iphone no cu e faz a bunda de touch screen"" -&gt; http://t.co/2NfW1iMe"
felipeneto,"RT @_isabelapontes: ""c t me cutucando aqui cara, fica na moral, senta l"" @felipeneto http://t.co/GujYY8oX"
felipeneto,"RT @IsabellaRMN: ""Cutuca teu c"" AUSHAUSHAUHSUASH @felipeneto  http://t.co/k1QQFwlk"
felipeneto,"Jogadores de futebol e suas entrevistas: ""acho que gol  importante"" - Rafael Sbis."
felipeneto,RT @_juumg: Pelo amor de Deus diabo HAHAHAHA @felipeneto http://t.co/Ebq7LFV0
felipeneto,"@MuriloDOliveira Como assim? No temos nada marcado hoje, certo? S amanh..."
felipeneto,As lindas produtoras da @Parafernalha transformando uma dala de reunio numa de interrogatrio http://t.co/K9yhDUXh
felipeneto,SPOILER: ltimo captulo de novela Avenida Brasil. - http://t.co/h6IecOut - No me xinguem.
felipeneto,RT @karisebacca: Cutuca o teu cu hauahuahauahauahua @felipeneto http://t.co/Y762JzLu
felipeneto,"Tem vdeo novo pra quem gostou do ""funk no celular""! COISAS QUE GOSTARAMOS DE DIZER - GENTE QUE CUCUTA: http://t.co/2NfW1iMe"
felipeneto,Quem gostou do novo vdeo do Coisas que Gostaramos de Dizer d joinha e favorita o vdeo!!! -&gt; http://t.co/2NfW1iMe
felipeneto,I liked a @YouTube video http://t.co/WF22SEUG Coisas que Gostaramos de Dizer - GENTE QUE CUTUCA!
felipeneto,VDEO NOVO!!! Coisas que Gostaramos de Dizer - GENTE QUE CUTUCA: http://t.co/2NfW1iMe (mostre pro seu amigo inconveniente!)
felipeneto,"S pra avisar, dentro de poucos instantes estar no ar um novo vdeo do COISAS QUE GOSTARAMOS DE DIZER!!! Aqui h -&gt; http://t.co/r2PQ2GU1"
felipeneto,"Pra quem gosta da srie Osris e Douglas, aqui vai um especial com todos os episdios e ainda um INDITO! - http://t.co/ftf8Cxru"
felipeneto,I liked a @YouTube video http://t.co/gwv3Dul2 O&amp;D Herois 2 Compressao Youtube
felipeneto,"Esse artigo ... infame. PSY e Wolverine juntos! http://t.co/YHsuB8SU - Se no gostarem, xinguem o @chatodemais"
felipeneto,@fermosca VOC EST TIRANDO A MAIOR E MAIS IMPORTANTE IDENTIDADE DO DENIS NO FAA ISSO POR FAVOOOOOOR
felipeneto,T virando moda fazer salincias na praia - http://t.co/513lp1sw
felipeneto,E se a vontade de mijar for gigante? http://t.co/FRAimyZN
felipeneto,J pensou se a ligao mais importante da sua vida cai no nmero errado? http://t.co/BxHZ89dn
felipeneto,Douglas e Osris - A Dvida: http://t.co/vbqDkCZp
felipeneto,I liked a @YouTube video from @tgs_brasil http://t.co/yKkrFzGh Microsoft - Entrevista com Guilherme Camargo e Impresses sobre
felipeneto,Tchim!
felipeneto,AAAAAAAAAAAAAAAAAHHHHHHHHHHHHHHHHHHH!!!!!!!!!
felipeneto,@anadecesaro com Rolling Stones...
felipeneto,Eu hein
felipeneto,"RT @mariajulia_gio: @olarkinn @felipeneto viado, filha da puta do caraio, babaca, lazarento, chupador de rola, arrombado dos inferno.. M ..."
felipeneto,Infelizmente no vai sair hoje o vdeo do Coisas que Gostaramos de Dizer... Mas amanh estar aqui  -&gt; http://t.co/r2PQ2GU1 (inscrevam-se)
felipeneto,Compramos equipamentos novos pra Parafernalha e ParaMaker... Resultado? http://t.co/5u7Vr6fa
felipeneto,Truques da produo da Parafernalha: como transformar uma mesa de vidro numa de ferro. http://t.co/VGJ53QGJ
felipeneto,I liked a @YouTube video from @obrunocorrea http://t.co/E6lePhXL Filmagens Randoom na BGS c/
felipeneto,"Quando digo animal, digo bicho, sem raciocnio."
felipeneto,"Quem j ficou apertado pra mijar, mas no tinha onde e no era animal o suficiente pra fazer na rua? Salve-se aqui - http://t.co/badGamUN"
felipeneto,"Se vocs querem que o vdeo novo do Coisas que Gostaramos de Dizer saia ainda hoje, xinguem o @odanielcuri e o @olarkinn"
felipeneto,Acabamos de gravar mais um COISAS QUE GOSTARAMOS DE DIZER... Aguardem............
felipeneto,Casal fazendo salincia na praia. Virou moda essa porra? http://t.co/EGhyYezJ
felipeneto,Deu varizes na gostosa!!! http://t.co/u9yNnzlr
felipeneto,RT @ArthurCaceres: Hahahaha... muito bom! http://t.co/xGKPHraT (via @felipeneto )
felipeneto,J pensou que merda daria se ao ligar pra um lugar pedindo ajuda pra sair da depresso casse num disk-sexo? http://t.co/W0RkrMCJ
felipeneto,Cuidado com os emprstimos que voc faz e no gaste todo seu salrio em gibis - http://t.co/OeDxM9DX
felipeneto,Coisas que fazem todo professor sofrer - http://t.co/4skjhh1T
