felipeneto,Ficou a semana toda pedindo pra sexta-feira chegar s pra isso: http://t.co/ik1N0QUg
felipeneto,RT @chatodemais: O grande problema no  uma pessoa no ter nenhum senso de humor.  ela ficar perto de mim.
felipeneto, s voc desejar silncio que o planeta conspira pelo contrrio.
felipeneto,"Usando o CU pra protestar. Planeta, j pode explodir: http://t.co/1S6ykkoC"
felipeneto,Trabalhando como nunca com os gringos aqui em Los Angeles. Preparao a mil por hora. http://t.co/hFWidQct
felipeneto,Gostei de um vdeo do @YouTube http://t.co/yNWDqP8y O Culto
felipeneto,Adicionei um vdeo do @YouTube como favorito http://t.co/yNWDqP8y O Culto
felipeneto,"Gosta da Parafernalha mas no segue no twitter?? Tem pau pequeno, ou mamilos feios (ser for menina): @parafernalha"
felipeneto,O protesto mais ESCROTO desse planeta. At gorfei: http://t.co/4w2gKWuR
felipeneto,Trabalhando que nem um condenado aqui em Los Angeles para voltar com INCRVEIS notcias pro Brasil ;) quinta estou de volta...
felipeneto,"RT @odanielcuri: @felipeneto Seu filho da puta arrombado, escroto e viadinho!  Te amo!  ;)"
felipeneto,"RT @parafernalha: Aaaah, sexta-feira, o dia que voc mais espera pra poder aprontar todas e termina em casa na internet falando mal do G ..."
felipeneto,"Quando seu amigo te chamar de filho da puta arrombado, no se ofenda, pode ser carinho - http://t.co/HcbgylxU"
felipeneto,Illuminatis gonna hate - http://t.co/4tHQg0QL
felipeneto,Moral da histria? No invoque demnios - http://t.co/M7Q2mTnV
felipeneto,"Sabe esse namoro xexelento que voc tem? Que no sabe se termina ou no? Ento, d pra salvar, veja essas dicas; http://t.co/ya0OuUeh"
felipeneto,Dia 7 de setembro estreia Totalmente Inocentes! RT @_wereborntodie Ansiosa para a estreia do filme com o @felipeneto ;)
felipeneto,Tenha medo do Culto - http://t.co/OA30t85E
felipeneto,"AT VOC, CARLOS NASCIMENTO?? http://t.co/ASkoNXFW"
felipeneto,Yogscast
felipeneto,"RT @TeatroBonecos: Eu fao parte de um CULTO. Por favor, no fiquem com medo. http://t.co/r4K5hGDi @parafernalha #juca"
felipeneto,"Quando dois amigos se xingam, eles no esto se xingando, na verdade.  tudo amor. Confira aqui: http://t.co/twfDUe7Z"
felipeneto,"Se voc est lendo este tute num engarrafamento, parabns, voc t na merda."
felipeneto,"Pra quem gosta dos nossos vdeos da Toca, tem esse vdeo Fora da Toca: http://t.co/fWhwsoqc"
felipeneto,Mais um vdeo FODA do Canal Nostalgia: http://t.co/GMijz7n6
felipeneto,RT @parafernalha: BOMBA! Apresentador Carlos Nascimento foi assaltado por travestis! Confira: http://t.co/6AMD1ZOO
felipeneto,"Mais sorrisos que o lanamento White Strip da Oral B, s a festa, com a presena da Gisele Bundchen. Vai ser pica. #3dwhiteparty"
felipeneto,"O charme da mulher brasileira, s que no - http://t.co/NUj05UWV"
felipeneto,Sono nvel: Podem trocar meu sangue por cafena que no vai adiantar.
felipeneto,"Imagem infame do dia, PQP - http://t.co/DSlOTokg"
felipeneto,Seria assim um culto dos illuminatis?? http://t.co/6hhM0fi8
felipeneto,"RT @parafernalha: Ah, o charme da mulher brasileira... insuperv..Oh, wait! http://t.co/clxJVlCt"
felipeneto,"RT @chatodemais: Se proibissem usar o crebro como probem a maconha, teramos mais pensadores."
felipeneto,AEEEE Vdeo novo da Parafernalha! O Culto: Muito cuidado ao invocar entidades - http://t.co/eVH5c8QX
felipeneto,Voc devia parar de mexer no seu smartphone e prestar ateno no professor explicando a matria. Twitter e Facebook no caem na prova.
felipeneto,Faz voz grossa: Desce a letraaaa (fundo de porradaria de rock) - Humor Negro: http://t.co/3awlXc4j
felipeneto,"Bom dia, j pensou em ser uma piriguete profissional? J? Ento esse curso  pra voc - http://t.co/ftbm8Jz5"
felipeneto,"Essas dicas vo salvar seu namoro. De nada, no tem por onde. http://t.co/Wcw122XN"
felipeneto,Entre no site da Parafernalha!  to legal quanto ir pra Baleia! http://t.co/5ZjUgrM3 - aproveitem e sigam - @parafernalha
felipeneto,"PQP, era s o que faltava, curso pra formao de piriguetes. Porraaaaaaaaaaaa!!! http://t.co/P0gkoJ6M"
felipeneto,O que o Joel Santana e a Gretchen tem em comum? Isso - http://t.co/lD4eRqJb
felipeneto,Como seria um filme produzido por homofbicos - http://t.co/6UalZb5C
felipeneto,Robert Pattinson agora sim vai conseguir superar a traio - http://t.co/T5yaPmxx
felipeneto,@alinalyra Eu percebi... Isso pq eu falei p/ te ligarem.
felipeneto,"AEEEE Parafernalha e ""Novela Brasil"" acabou de sair n'O Globo!! http://t.co/0KToESuv"
felipeneto,FODAAAA!!! Cavaleiros do Zodiacooooo!!! - http://t.co/ycegR9xJ (via @Pablo_Peixoto )
felipeneto,As dicas mais imbecis para salvar um relacionamento (mas que podem funcionar) - http://t.co/eMgpkDhh
felipeneto,"@Mombaque @rslonik Bem isso mesmo, minha me nem fala mais comigo dps de uma resposta a um ""bom dia""."
felipeneto,@rslonik Ah t =)
felipeneto,"@rslonik s no compreendo uma coisa, o q tem de errado em processar o Google? Processamos bancos, telefonias, faculdades, mas o Google nao?"
felipeneto,"@PedroMendigo Cacete mano, memria de elefante, adorei tu ter lembrado disso, valeu mesmo!"
felipeneto,"RT @PedroMendigo: @felipeneto @felipeneto Voc deu uma entrevista uma vez para a Extra (: - http://t.co/VFXl9W2l Achei at o link, kkkkk ..."
felipeneto,@DuDanilo Voc faz ideia de quanto tempo precisa para fechar grandes negcios cara? Estamos fazendo td em tempo recorde.
felipeneto,CARAIO COMO TU SABE DISSO?!?!?!?! - RT @PedroMendigo Corrigindo. Caderno velho do botafogo.
felipeneto, to bizarro pensar q tudo isso comeou com um caderno velho e uma caneta numa quitinete de 20m quadrados e um ar condicionado ruim.
felipeneto,"Amanh  dia de embarcar pra Los Angeles para dar incio ao fechamento de algo muito bacana, em breve notcias..."
felipeneto,"RT @UniaoDaTalula: Esse @felipeneto  um escroto, n? Fica falando mal dos FCs de ex-BBBs e ex-Pees. Vai procurar uma bucetinha pra comer!"
felipeneto,@odanielcuri @olarkinn @fellipe2ls Caralho Daniel isso aqui  pblico.
felipeneto,"Tipo, literalmente. Chimpanzs so irados e jogam coc nas pessoas, no criam f clubes pra Nicole Bahls."
felipeneto,"Tipo, a pessoa no consegue juntar palavras que faam sentido,  s ""blablublable nicoleteamo"". Chimpanzs so mto mais inteligentes."
felipeneto,RT @sergiolucasjr: Aposto q a maioria dos views do video do @felipeneto so pra comprovar sua demencia #nicoleS2
felipeneto,"Droga, estou sendo xingado em peso pelos fs da Nicole Bahls.  muito QI junto me ofendendo, q q eu fao?"
felipeneto,"E olhem o que est nos trending topics: #NsSomosATuaForaNicoleBahls -Por favor, vejam esse vdeo - http://t.co/M4gHCZ8p"
felipeneto,@NandoSang Inclusive quando voc ficou na zaga e deixou todos os atacantes receberem livres.
felipeneto,As 6 formas que voc nunca imaginou para salvar seu relacionamento - http://t.co/LiU00Pvi
felipeneto,"Revelado pster de SE EU FOSSE VOC 3, um filme de SILAS MALAFAIA! - http://t.co/QhV068RG"
felipeneto,"Srio, esse cara caminha para ser um dos melhores msicos e diretores do Brasil - http://t.co/HKRmK1R6  (Twitter: @desgramatico )"
felipeneto,HUAHAUHAUHAUHAUH como fazer gua em p! - http://t.co/F9yd5oFG
felipeneto,"RT @psazon: ""um dia ainda vou ser processado"" @felipeneto se vc for por isso: TAMO JUNTO!!! http://t.co/T2g3Sgnk"
felipeneto,"Amigos, parem td q esto fazendo... Leiam esse post e depois divirtam-se lendo os comentrios (srio, inacreditvel) - http://t.co/ug4eiE68"
felipeneto,Amanh embarco para Los Angeles para uma definio histrica. Em breve vocs sabero ;)
felipeneto,@izzynobre No vale s pros grandes ;)
felipeneto,"Anncio a todos os Youtubers: no assinem com nenhuma Network, aguardem... Falta muito pouco agora."
felipeneto,"Matria sobre a Parafernalha e ""Novela Brasil"" na VEJA! - http://t.co/MYgzV8sY"
felipeneto,Por trs de toda fofoca envolvendo uma pseudo-celebridade (ex-BBB) - http://t.co/T1z0aw4J
felipeneto,"Bomba! Estudo aponta que o jogo Sonic estimula a ejaculao precoce, confira - http://t.co/cf3z8Rn6"
felipeneto,Meio milho em menos de 4 dias \o/ No Faz Sentido - A FAZENDA E BBB: http://t.co/M4gHCZ8p
felipeneto,Adicionei um vdeo a uma lista de reproduo do @YouTube http://t.co/JeP90sJv Novela Brasil - Captulo 2
felipeneto,"RT @TeamTiaNick: Como vc se sente @felipeneto em ver que a Nicole que vc tanto fala mal, tem mais fs, e faz mais sucesso do que voc??  ..."
felipeneto,"Aos amigos q sigo, eu perdi meu celular, ento no to recebendo notificao qnd ces me mandam reply. Amanh tudo voltar ao normal."
felipeneto,"@fredericoelboni No, sobre?"
felipeneto,@MauricioRicardo MA-OE! Hahahahahah
felipeneto,Os f clubes da Nicole Bahls esto me xingando como se no houvesse amanh. Acho que vou entrar em depresso =(
felipeneto,J batemos 400 mil views em 3 dias! No Faz Sentido - A Fazenda e BBB (TV aberta) - http://t.co/M4gHCZ8p
felipeneto,Oi Oi Oi - http://t.co/eA0tYAVd
felipeneto,RT @Patriciavazquez: Com muito orgulho!!!  Vale  a pena assistir esse video!!! http://t.co/icTLJaSF
felipeneto,RT @maddumagalhaes_: Pra quem ainda nao viu ;) Video novo http://t.co/fNYCMkys
felipeneto,@Pablo_Peixoto Vou pedir demisso =(
felipeneto,RT @parafernalha: ALERTA! Os videogames esto destruindo nossa sociedade! (RT para salvar vidas) http://t.co/6Rk1IzWb
felipeneto,"Como seria se a Gretchen posasse nua HOJE? (sim, ela quer) - http://t.co/wcKfGxxJ"
felipeneto,Como os video-games acabam com as mentes dos jovens - http://t.co/BMpWX5Ww (s para quem entende sarcasmo)
felipeneto,Senhoras e Senhores.... Gretchen querendo posar nua deu nisso - http://t.co/jyP1dH7S
felipeneto,"Wow hahahaha Igreja Universal condenada por AGREDIR fiel que teve ataque de epilepsia, dizendo q estava com o demnio - http://t.co/ovYSslXj"
felipeneto,"E saiu o segundo captulo de NOVELA BRASIL, a pardia que at a Adriana Esteves deu risada - http://t.co/XZrZmbK0"
felipeneto,Tem vdeo novo! Vejam antes que eu seja processado - http://t.co/sk0swbhm
felipeneto,I liked a @YouTube video http://t.co/JeP90sJv Novela Brasil - Captulo 2
felipeneto,RT @parafernalha: http://t.co/VJgRIF0N - J deu sua entradinha hoje?
felipeneto,Muuuito fodaaaaa (pra todo mundo que odeia a fase da gua no videogame) - http://t.co/7pBkxXfV (via @marcoscastro )
felipeneto,"Nerd Rio, o evento mais fodstico da histria dos eventos fodsticos, t chegando!!! E eu vou! Bora? Clica ae - http://t.co/ZSFMyoro"
felipeneto,Novo No Faz Sentido!! Sobre TV aberta e seus Reality Shows! - http://t.co/M4gHCZ8p
felipeneto,Quem j viu o vdeo novo do No Faz Sentido?? Sobre TV Aberta e seus reality shows - http://t.co/8IKMkIc4
felipeneto,"Nada contra assistir novela,  um entretenimento, mas assistir demais pode deixar voc com merda na cabea: http://t.co/Fcq2tCtU"
felipeneto,"Como deixar uma novela divertida, Novela Brasil, captulo 2: http://t.co/RDfXGBCJ"
felipeneto,"PQP, Valesca Popozuda CANTANDO nas Olimpadas 2016? CANTANDO! CANTANDOOOOO!!!! - http://t.co/eQZ8lKzG"
felipeneto,"RT @IasminSoS: @felipeneto Vc  muito lindo ahusahsua, Vc  mora aonde ?"
felipeneto,RT @parafernalha: A galera carioca sungue sangue bom tem que prestigiar a gente no NerdRio: http://t.co/hPpm9SHa
felipeneto,No faz sentido: A Fazenda e BBB: http://t.co/LLJUNNif
felipeneto,"Reclama do domingo mas no faz nada pra mud-lo, n?"
felipeneto,Porque toda mulher gosta disso?? http://t.co/nRD90I0Y
felipeneto,"Putaria, bebidas, drogas, consumismo... A msica sertaneja universitria e suas mensagens subliminares, veja aqui: http://t.co/9B8z3jNR"
felipeneto,POLMICA: Deviam proibir a exibio de desenhos animados para crianas. Eis aqui o motivo - http://t.co/sVfgatIL
felipeneto,O motivo pra ser o cara mais odiado da fazenda. E do BBB: http://t.co/WLR08S2N
felipeneto,Pensa na preguia. Pensou no domingo.
felipeneto,RT @parafernalha: Para o que estiver fazendo para cantar com os irmos Castro! http://t.co/99YUOBrz
felipeneto,Siga a @parafernalha l tem gente limpinha. Pelo menos a maioria.
felipeneto,Recordar  viver: Como seria um mundo sem internet? http://t.co/nYIbTFaN
felipeneto,As vezes no sei a diferena entre trabalhar na Parafernalha e no sanatrio:  http://t.co/24sV8qaE
felipeneto,Aproveite esse sbado pra descobrir se seu namorado  infiel ou no: http://t.co/TlO7e3hM
felipeneto,"A regra mais babaca da etiqueta, deve ter taa at pra lgrimas... http://t.co/C6RGjQHg"
felipeneto,RT @worldBAHLS: @felipeneto filho da puta
felipeneto,"RT @chatodemais: Se o @felipeneto continuar fazendo vdeos assim, j j vai preso e vira panicat na cadeia: http://t.co/JKmHYbIv"
felipeneto,Novela demais mexe com a cabea das mulheres: http://t.co/1kL4wLKk
felipeneto,"RT @parafernalha: Diz que  do #poderparafernalha, que ama nosso contedo, e no vai no NerdRio ver a gente?  fake - http://t.co/sjs2Zsym"
felipeneto,"PQP, passou dos 30 e ainda almoa biscoito (aqui no Rio  biscoito, porra!) e hambrguer: http://t.co/Y5Pp2Rb8"
felipeneto,RT @parafernalha: A gente perguntou pro #poderparafernalha - O que escrever numa tatuagem anal? E eles responderam isso: http://t.co/nuX ...
felipeneto,"E se a novela Avenida Brasil fosse feita pela Parafernalha? Foi feita, e j tem 2 captulos!  http://t.co/KKYDeBHG e http://t.co/1XBDkHgh"
felipeneto,"Voc fica a ouvindo msica sertaneja, e nem sabe o quanto ela t cheia de mensagens subliminares. Descubra a verdade: http://t.co/pq38619v"
felipeneto,Ele ficou falando que o voo ia pra Recife s pra deixar a galera nervosa ( pra Porto Alegre). Piloto trollador.
felipeneto,Gente do cu estou no avio esperando decolar e o piloto decidiu vir falar com a gente e t fazendo stand-up. Que experincia increditvel!
felipeneto,RT @parafernalha: Quem vai ver a Parafernalha no NerdRio? http://t.co/CCdkIkFA
felipeneto,RT @parafernalha: Pra comear bem o sbado - http://t.co/VJgRIF0N
felipeneto,"Quem j viu o No Faz Sentido novo sabe completar a frase: ""guerreiro ....."" - http://t.co/M4gHCZ8p"
felipeneto,@Castrezana @dr_marcelo Eu no consegui assistir at o final...
felipeneto,"Eu sinceramente no consegui achar o vdeo do menino engraado, fiquei com uma puta pena do bullying q o mlq vai sofrer."
felipeneto,"Vcs zoando da cara desse menino Nissim Ourfali, mas a real  q nitidamente ele no queria fazer e foi forado pelos pais. Feio, mto feio..."
felipeneto,Vdeo novo do No Faz Sentido!! Favoritem e cliquem no joinha se forem capazes -  http://t.co/M4gHCZ8p
felipeneto,"Pra galera da madrugada q t ativa agora, saiu vdeo novo do No Faz Sentido - http://t.co/8IKMkIc4"
felipeneto,"RT @jessyaka: Pessoal olha o novo vdeo do @felipeneto
http://t.co/HIPEHWfH"
felipeneto,Bora aproveitar pra ver o segundo captulo de Novela Brasil xD - http://t.co/FMOWugFd (adicionem aos favoritos e deem joinha se puderem)
felipeneto,HAUHAUHAUHAUHA as meninas gravando vdeo me xingando VOLTARAM! H anos isso no acontecia HAHAHAHAHHA - http://t.co/JYR5fLHz
felipeneto,RT @Eddyzin_: O @felipeneto foi preso j? por causa desse video http://t.co/FSmPhKIW
felipeneto,"Ah, se vcs quiserem comentar o vdeo, comentem nesse link aqui pq l no Youtube no consigo ler - http://t.co/8IKMkIc4"
felipeneto,RT @RealFilesinho: A @felipeneto quase 10 mil Likes em menos de uma hora o.O - http://t.co/mPeVEZv2
felipeneto,"Se puderem dar aquela fora, adicionem o vdeo aos favoritos ;) - http://t.co/M4gHCZ8p"
felipeneto,"RT @larissambrgs: nossa, dessa vez, o @felipeneto falou tuudo! s cuidado, pode dar processo k http://t.co/1caXpBIe"
felipeneto,Se eu for processado vcs vo pra porta do tribunal mandar todo mundo tomar no cu?
felipeneto,"No sei pq, mas to achando q vai dar merda..."
felipeneto,Wow! 5.000 likes em meia hora o.O - http://t.co/M4gHCZ8p
felipeneto,RT @Juleana_: Dedicado a todos os FCS de ex-bbb e ex-fazendeiro!   http://t.co/B9BaGVcp @felipeneto
felipeneto,Enviei um vdeo do @YouTube http://t.co/ovb1gXJX A FAZENDA E BIG BROTHER - No Faz Sentido
felipeneto,SAIU!!! Novo vdeo do No Faz Sentido!!! Sobre TV aberta e reality shows - http://t.co/aR9OKIQI (quem gostou d RT!)
felipeneto,Oi Oi Oi - http://t.co/FMOWugFd
felipeneto,Dentro de instantes o novo vdeo do No Faz Sentido...
felipeneto,Bora matar o tdio e gastar o tempo enquanto isso... http://t.co/7Si1cm2C
felipeneto,Upload do vdeo novo do No Faz Sentido... 16%
felipeneto,WOW!!!!! A verdade por trs da msica SERTANEJA!!! - http://t.co/uUnSSgQX
felipeneto,RT @BlynkReys: @parafernalha @felipeneto Muito foda o 2 capitulo de Novela Brasil. hahaha http://t.co/OFGQ7zDT
felipeneto,Estudo comprova: Pokemon gera vagabundagem e rebeldia contra os pais - http://t.co/j8mjwvoJ
felipeneto,"O vdeo novo do No Faz Sentido vai sair aqui ,  s ficar entrando pra ver quando vai sair - http://t.co/5ZjUgrM3"
felipeneto,"E enquanto no sai o novo No Faz Sentido, saiu o CAPTULO 2 de ""NOVELA BRASIL""!!! BORA L!!! http://t.co/XZrZmbK0"
felipeneto,Terminei a edio do No Faz Sentido!!! Ainda hoje no ar!
felipeneto,Calaram minha boca... http://t.co/7nssL97I
felipeneto,I favorited a @YouTube video http://t.co/JeP90sJv Novela Brasil - Captulo 2
felipeneto,NO AR!!! NOVELA BRASIL - CAPTULO 2: http://t.co/QmSvi7U1
felipeneto,"@jovemnerd ;) tentei de tudo, achei que no daria, fiquei feliz agora!"
felipeneto,"Ainda hoje, duas novidades: captulo 2 de ""Novela Brasil"" e No Faz Sentido - Reallity Shows!"
felipeneto,RT @parafernalha: Adriana Esteves e Dbora Falabella curtiram o primeiro captulo de Novela Brasil. E hoje tem mais!
felipeneto,"Quem viu a matria do Video Show sobre ""Novela Brasil""??  da @Parafernalha \0/ vejam inteiro no site: http://t.co/5ZjUgrM3 (o 2 sai hoje!)"
felipeneto,"I liked a @YouTube video from @qu4trocoisas http://t.co/vwqv0mXt MAIS UMA COISA #3 PERGUNTAS E LUKE, EU SOU SEU"
felipeneto,@FeCastanhari @marcoscastro amanha eu twitto!
felipeneto,"@marcoscastro @fecastanhari mas nao faz diferenca, o importante eh ir pro feed dos inscritos no yt"
felipeneto,Gostei de um vdeo do @YouTubede @marcoscastro http://t.co/OfmElxyB NERD RIO
felipeneto,Brincando de madrugada... http://t.co/SIdAaCaZ
felipeneto,Terminando o roteiro do No Faz Sentido que vou gravar amanh... Be prepared...
felipeneto,"O filme ""Totalmente Inocentes"" estreia dia 07 de setembro! Eu estou nele! E de cabelo roxo! (calma, j voltei pra cor normal h mto tempo)."
felipeneto,RT @Braungustavo: RT @TopWebMixTv: Nossa homenagem ao @parafernalha do @felipeneto e do @leoluz ! Liguem na MIXTV agora!
felipeneto,Os desenhos animados e o que causam nas crianas (s pra quem entende sarcasmo) - http://t.co/J4sZOz3h
felipeneto,RT @cayannechelsea: At o @felipeneto j sacou as Empreguetes...kkkkk....olha s...http://t.co/CLzwTIoz
felipeneto,"Pras CENTENAS de mensagens q estamos recebendo, aviso: o captulo 2 da Novela Brasil ir ao ar amanh aqui - http://t.co/5ZjUgrM3"
felipeneto,"Amanh ter matria especial no Vdeo Show sobre a pardia ""Novela Brasil"", da Parafernalha e O Surto. P/ quem  viu - http://t.co/bXyeSBOi"
felipeneto,WOW!!! Aliens so vistos e mensagem  identificada - http://t.co/oyOxFRav
felipeneto,"@FeCastanhari Sim, olha nos comentrios huahuahuahuha"
felipeneto,@FeCastanhari A parte do Bob Esponja .
felipeneto,Puta merda! Tem gente levando a srio - http://t.co/FLABwQPq
felipeneto,BOMBA! Estudo revela que Bob Esponja  gay e drogado... E outros desenhos tambm - http://t.co/FLABwQPq
felipeneto,"RT @calabresadani: AHAHAHA nao vejo a novela + AMEI =) @alinalyra: Ei vc ja viu? A Adriana Esteves viu e A-M-O-U!! V a, vai http://t. ..."
felipeneto,HUAHAUHAUHAUHA as melhores frases pra quebrar o gelo - http://t.co/OJekvQXT
felipeneto,"Senhoras e Senhores, com vocs... A MODELETE - http://t.co/UmFs2uI3"
felipeneto,"Mulheres, uma regra - http://t.co/RDpzTTa2"
felipeneto,@Xpock hauhauhau mas encontrar uma boa empregada est cada vez mais difcil!
felipeneto,@Xpock  o #poderparafernalha
felipeneto,Adicionei um vdeo a uma lista de reproduo do @YouTube http://t.co/ltH6JKQ0 A Modelete
felipeneto,A Modelete - http://t.co/iNofrhUP
felipeneto,@izzynobre Po e o melhor  que o Novela Brasil no teve qualquer divulgao de famosos ou imprensa... E olha l =)
felipeneto,AEEEE primeiro captulo de Novela Brasil chegou a meio milho de views - http://t.co/bXyeSBOi - E amanh sai o Captulo 2!
felipeneto,EU PREFIRO NO COMENTAR HAHAHAHAHAHHAHAHAHAHAHA (@naosalvo live on http://t.co/I9SdaMnS)
felipeneto,PORRA CES QUEREM MESMO ME MATAR HEIN HAHAHAHAHHAHA (@naosalvo live on http://t.co/I9SdaMnS)
felipeneto,HAUHAUHAUHAUH PUTA QUE PARIU!!! Eu no paro de rir!!! (@naosalvo live on http://t.co/I9SdaMnS)
felipeneto,HAHAHAHAHAHAHAHAHAHAHAHAAH (@naosalvo live on http://t.co/I9SdaMnS)
felipeneto,"Felipe Neto, o que voc acha do PC Siqueira? (@naosalvo live on http://t.co/I9SdaMnS)"
felipeneto,Caralho eu to rindo de doer a barriga com essa porra! (@naosalvo live on http://t.co/I9SdaMnS)
felipeneto,HAUHAUHAUHAUHAUHAUHA (@naosalvo live on http://t.co/I9SdaMnS)
felipeneto,TETAS!!! (@naosalvo live on http://t.co/I9SdaMnS)
felipeneto,"@marcoscastro At onde eu me lembre, foi o cara que me serviu caf na cama hoje... Nu."
felipeneto,@IsabelaaFreitas Um dia quem sabe a gente consiga conciliar disposio mtua ao mesmo tempo?
felipeneto,"@IsabelaaFreitas Digo, literalmente, eu no respondo e deixo a pessoa no vcuo por pura preguia."
felipeneto,@IsabelaaFreitas vc  monossilbica... e eu q no tenho saco de responder ningum?
felipeneto,Crpulas RT @pecesiqueira Malditos
felipeneto,@cardoso Vc viu o vdeo da parafernalha de hoje? Uma mulher comentou xingando a Madu dizendo q ela era uma escrota por falar aquilo.
felipeneto,@adriano91b Exatamente isso.
felipeneto,@vyktorb JNIU
felipeneto,HAHAUHAUHAUHAUHAUAHUAHUAHUAHUAHUHAUHAUHAUHAUHAUAH
felipeneto,"RT @Douglasterto: @felipeneto Cala a boca velho, voc quis dizer ento que somente negros, do cabelo ruim, sabem de futebol? Voc mereci ..."
felipeneto,"@Cardoso N? Sem contar os de hoje em dia: Kak, Messi e Cristiano Ronaldo..."
felipeneto,@bobagento E vc  gordo e feio shiu
felipeneto,"Uma vez um cara veio falar q eu no entendia porra nenhuma de futebol e isso era ntido por eu ser ""branco de cabelo lisinho""."
felipeneto,"Toda vez q falo sobre futebol sempre tem um merda com foto sem camisa (e que no sabe escrever), pra falar q no entendo de futebol, ahaahha"
felipeneto,RT @loofonseca: @felipeneto  e @parafernalha A Modelete #putaquepariu http://t.co/4lvTScF8
felipeneto,"RT @fredericoelboni: Mulheres que acham idiota o cara se masturbar mesmo tendo uma namorada entendam que: ""Jogo  jogo, treino  treino."""
felipeneto,Renato e Seedorf  que nem Juninho e Felipe no Vasco... No d pra jogar junto.
felipeneto,"O q  uma pena, pq o Renato  um dos melhores volantes do Brasil, mas ningum mandou trazer o Seedorf, q por sinal t jogando MUITO!"
felipeneto,"Finalmente Botafogo jogou direito, foi s tirar o Renato. Falo isso aqui h anos! Seedorf com Renato no d!"
felipeneto,@NickEllis e com flego de garoto!
felipeneto,GOOOOOLLLLL SEEEDOOOORF!!!!!
felipeneto,E ainda leva uns 5 minutos pra reiniciar essa merda de NET Digital HD... LIXO DE EMPRESA!!! J teria mudado ha mto tempo se tivesse opo
felipeneto,"Srio, como pode existir uma empresa to incompetente quanto a NET? Sinal cai toda hora e agora ate minha TV a cabo cai TODA HORA!!!"
felipeneto," srio isso? O grito de guerra dos jogadores do Sport  ""Jesus t comigo"". Pqp! Q Jesus vacilo seria esse de escolher time..."
felipeneto,Adicionei um vdeo do @YouTube como favorito http://t.co/ltH6JKQ0 A Modelete
felipeneto,"No  a toa q os americanos falam q no gostam de futebol porque ""no acontece nada"", essa emoo dos narradores  ridcula!"
felipeneto,Americano narrando gol no futebol  uma coisa pattica. Padre em velrio consegue ser mais animado.
felipeneto,RT @parafernalha: Mulher de verdade vai concordar e espalhar esse link: http://t.co/JZ01dhoX
felipeneto,Para todos os solteiros - http://t.co/g2EWmVpX
felipeneto,"Tem gente que assiste aos vdeos da @Parafernalha e comenta como se o vdeo fosse REAL, tipo de verdade, ao invs de ""roteiro + atores""."
felipeneto,Como seriam as melhores tatuagens anais da histria - http://t.co/HejQj7zv
felipeneto,RT @danisvidal17: HAHAHAHAHAHAHAHHAHAHAHA http://t.co/Rro26NHC @felipeneto TA MUITO BOM ESSE VIDEO
felipeneto,I liked a @YouTube video http://t.co/ltH6JKQ0 A Modelete
felipeneto,Vdeo novo!!! A MODELETE - http://t.co/4jUhStC5
felipeneto,RT @parafernalha:  amigos... O Youtube hoje t pior que funcionarismo pblico... No subiu nosso vdeo e comeamos td de novo. Veremos  ...
felipeneto,"Mais algum est tendo problemas com o envio de vdeo pro Youtube? O vdeo novo da @Parafernalha t ""processando"" h 1 hora!"
felipeneto,"RT @parafernalha: E enquanto o vdeo novo no sai, assistam ao ltimo: Fora da Toca - Douglas  uma criana! http://t.co/9tQan97T"
felipeneto,A minha senhora  a protagonista do vdeo novo da @Parafernalha que vai ao ar daqui a pouco =) fiquem atentos no site: http://t.co/5ZjUgrM3
felipeneto,"RT @parafernalha: Estamos subindo vdeo novo pro nosso canal! Dentro de instantes estar no ar: ""A Modelete""..."
felipeneto,Assistiram ao Novela Brasil? (http://t.co/bXyeSBOi) Essa sexta sair o Captulo 2! E com uma surpresa SHOW!
felipeneto,Estaria o beb de Claudia Leitte correndo perigo? - http://t.co/nvAoRMn9
felipeneto,As melhores tatuagens anais - http://t.co/hkRnehlY
felipeneto,#poderparafernalha e o dia em que a @Kefera foi o alvo - http://t.co/Kc4USADZ
felipeneto,RT @parafernalha: Ento respondam: Que frase seria perfeita pra uma tatuagem anal? - As melhores respostas vo pro artigo e com crditos!
felipeneto,"RT @parafernalha: Galera do #poderparafernalha vamos fazer um post pro site juntos? Daremos um tema e vocs respondem, a melhor resposta ..."
felipeneto,Como continuar sendo criana depois de velho - http://t.co/u2FQMFdp
felipeneto,"@jovemnerd eu nem ligo no final das contas, acho q j vi o filme umas 35 vezes."
felipeneto,Isso sem falar que eles destroem os aliens com um vrus! Ahn? Os Aliens usavam servidor windows?
felipeneto,@morroida HAHAHAHAHAHA n???
felipeneto,@morroida hahahahahhaha
felipeneto,Mas  to foda que foda-se!
