luischataing,"Buenos das! Un caf caliente y mi artculo ""As lo veo"" publicado el viernes por El Nacional http://t.co/Dea1pl7i"
luischataing,Nuestra invitada el lunes medianoche en #ChataingTV Mariaca Semprun. Buenas noches!  http://t.co/uLXTI8pg
luischataing,"VIDEOS diarios del programa de radio ""De nuevo en la maana"" ----&gt; http://t.co/Yyx12y5l"
luischataing,Bella @cynthialander
luischataing,Excelente RT @potroalvarez: Yo hago una pequea apuesta contigo luis  HUGO CHAVEZ dura mas como presidente d Venezuela q tu con ese programa
luischataing,Grande! RT @joelarcia: Te dije q lo hara @LuisChataing... Viste. Todos en Cmara. @amarispaez @Bellatrix29 @AndreutiG
luischataing,Al regreso de comerciales Cynthia Lander en #ChataingTV http://t.co/oG0ObIA2
luischataing,"RT @JeanMary_: #MAMIYPAPI  @JoseRGuzman: Y en breve estaremos la bella @JeanMary_  y yo hablando sobre ""Maternidad"" #MasRico #UsaCondon ..."
luischataing,#MAMIYPAPI
luischataing,RT @luigifc: Hahahaahahahaha clm con mami y papi #Oscarcito @LuisChataing
luischataing,RT @AnaPinango: Ajajajajajajajaaj dimelo a mi RT@ElvymarRamirez: @LuisChataing Es inevitable no gritar TELEVEN!! jajajajajaja
luischataing,COMENZAMOS! #ChataingTV
luischataing,RT @amarispaez: En un par de minutos comienza #ChataingTV
luischataing,En breve nuestra invitada en #ChataingTV es Cynthia Lander por @TelevenTV  http://t.co/QcxpSmto
luischataing,"RT @JulioCapi: Excelente ""El Debate"" @luischataing  http://t.co/5wjhVioQ"
luischataing,Cynthia Lander hoy MEDIANOCHE en #ChataingTV por @TelevenTV  http://t.co/VuHYC8Zq
luischataing,"DATO Horas antes de atrapar al Loco Barrera oficiales cantaban ""al loco, al loco, al loco le queda poco""... ah no era con el Loco Barrera?"
luischataing,"Una preocupacin menos -----&gt; Seguros La Vitalicia, vital para ti @lavitaliciaca"
luischataing,Hoy MEDIANOCHE Cynthia Lander en #ChataingTV por @TelevenTV  http://t.co/Ugy7IDTw
luischataing,"Increble que en pleno siglo XXI sigan celebrando inauguraciones cortando una cinta, cundo lo harn de manera digital?"
luischataing,Muy pronto podrs conocer las molculas inteligentes de Castrol que protegern de forma segura el motor de tu carro.
luischataing,"El presidente inaugur la carretera Mamera-El Junquito, encendi el carro y cay en el primer hueco, todos aplaudieron."
luischataing,Hoy MEDIANOCHE nuestro invitado en #ChataingTV es Cunthia  @TelevenTV http://t.co/jmVCHhaf
luischataing,"Beso! excelente iniciativa, maravillosa cancin! ---&gt; RT @karinalavoz: Retweet por la paz,t mando un beso @LuisChataing http://t.co/NIrfQqjE"
luischataing,Hoy MEDIANOCHE nuestra invitada en #ChataingTV es Cynthia Lander por @TelevenTV  http://t.co/QcxpSmto
luischataing,ESTA NOCHE! CARACAS - EL DEBATE Final!  TEATRO DEL COLEGIO SANTA ROSA DE LIMA - VENTA: http://t.co/PakHwWJd @VayaAlTeatro
luischataing,Cd_Bolvar #SiMePermiten 22/09 Centro Sirio + info @owenpro Entradas en @lebongoutcafe @Subwaybolivar (c.c. Las Banderas) (0414)4323503
luischataing,"VALEN 23 SEP ""Si me permiten"" Ttro Alfredo Celis Venta http://t.co/UEsLbKVe, AkCentro de Compras, KaiSushi, JeansRoy http://t.co/8mwpoOgZ"
luischataing,"Cmo no pensar en billetes cuando nos hablan de un ""sardinero""?, el dinero recibido de la venta de sardinas ""sardinero""."
luischataing,"Angustia, incertidumbre, control de canas ----&gt; Seguros La Vitalicia, vital paea ti @lavitaliciaca"
luischataing,"La presentacin anoche en Cuman fue fantstica sal al escenario y aplaudieron 10 minutos de pie, aplaudan porque no se haba ido la luz"
luischataing,Muy pronto podrs conocer las molculas inteligentes de Castrol que protegern de forma segura el motor de tu carro.
luischataing,"RT @victoraless07: #cumana Si me permiten, el llamado de @luischataing a votar el 7O  http://t.co/aGkoG3Km"
luischataing,Lleg el fin de semana! lo s porque Jorge Rodrguez intercept un mail de Julio Borges que deca eso.
luischataing,"Esta noche ""El Debate"" se despide de Caracas , Teatro Santa Rosa de Lima @ticketmundo http://t.co/K2bCnZGk"
luischataing,"Anoche Cuman, hoy Caracas ""El Debate"", maana Ciudad Bolvar ""Si me permiten"", domingo ""Si me permiten"" Valencia."
luischataing,"Buenos das! escucha ""De nuevo en la maana"" EN VIVO de 6am-9am en http://t.co/yqhEaR5I http://t.co/bM6imWtD"
luischataing,En breve nuestra invitada en #ChataingTV es la actriz colombiana Alejandra Sandoval @TelevenTV  http://t.co/mgIktm04
luischataing,Esta noche en Cuman! http://t.co/Iy7P4FoJ
luischataing,Esta noche Cuman! http://t.co/JuSlhunj
luischataing,CUMAN gracias! RT @Roxycarol: @LuisChataing. Gracias por regalarnos estos 90min de pura risa y diversin! Excelente
luischataing,CUMAN muchas gracias x asistir! RT @Morza_Sk8: Excelentisimooooooo! De principio a fin! #SiMePermiten con @LuisChataing!
luischataing,"Yoel Acosta Chirinos retir su candidatura presidencial, buena noticia, eso reducir el nmero de votantes indecisos."
luischataing,"CUMAN gracias!! RT @GeorgetteMSer: @LuisChataing si me Permiten ... Te Amooooooo, me reiii demas."
luischataing,Alejandra Sandoval hoy MEDIANOCHE en #ChataingTV por @TelevenTV http://t.co/NIU78mmT
luischataing,"Santos y Capriles conversaron sobre la relacin bilateral, sobre la integracin regional, y sobre Yoel Acosta, as es, todos hablan de l."
luischataing,"Toros coleados, tomando clases?, ah caramba -----&gt; Seguros La Vitalicia, vital para ti @lavitaliciaca"
luischataing,Maana CARACAS - EL DEBATE Final!  TEATRO DEL COLEGIO SANTA ROSA DE LIMA - VENTA: http://t.co/PakHwWJd @VayaAlTeatro
luischataing,VIDEO 2012/09/20 Entrevista al actor Felix Loreto http://t.co/98cznvuz
luischataing,"VIDEO 2012/09/20 Comentarios Carlos Mauricio Ramrez, me voy a Cumannnn, 6am http://t.co/gv8PgKXS"
luischataing,VIDEO 2012/09/20 Tres matrimonios dos casos de hemorroides http://t.co/FP9JzE1R
luischataing,Hoy MEDIANOCHE nuestra invitada en #ChataingTV es la actriz colombiana Alejandra Sandoval @TelevenTV  http://t.co/mgIktm04
luischataing,CUMAN casi listos! RT @AlterioMaria: Esperando a Chataing @LuisChataing y viendo el video de Giga Puddin JAJAJJAJAJA
luischataing,"Santos y Capriles se reunieron en Bogot, Wilmer Ruperti ofreci su casa en Caracas y la respuesta fue gracias, pero no gracias."
luischataing,"Tranquilos, Castrol ha creado un lubricante con tecnologa sinttica que les brindar proteccin desde el encendido."
luischataing,Hoy MEDIANOCHE analizaremos mensajes ocultos en afiches de la cartelera cinematogrfica en #ChataingTV por @TelevenTV  http://t.co/6n9GlmRf
luischataing,RT @elalexgoncalves: Del team #chataingtv somos 3 los nominados en los #TwitterAwards @LuisChataing como Celebrity @ledvarela como Hater ...
luischataing,CUMAN nos vemos en breve! RT @Geny_oronoz: Camino a Ver @LuisChataing Si me Permiten #Cuman *.*
luischataing,"Ya en el Club rabe Sirio de Cuman, esta noche ""Si me permiten"""
luischataing,"Capriles se reuni con el presidente Juan Manuel Santos, la reunin fue cordial, amena, y el video lo transmitir VTV en 5, 4, 3, 2, "
luischataing,"Pos claro! RT @MarwanHassani: Ya en Cuman esperando la Hora para ver a @LuisChataing, y que me pueda firmar los 2 libros asi lo veo 1 y 2!"
luischataing,"Hace calor en Cuman, estoy sudando casi tanto como el que le presenta las encuestas a Chvez."
luischataing,------&gt; RT @ChataingTV: Hoy MEDIANOCHE nuestra invitada en #ChataingTV es la actriz colombiana Alejandra Sandoval http://t.co/IPubyrok
luischataing,YA EN CUMAN!
luischataing,"Roger Federer dice Estoy agotado, necesito vacaciones, claro para dormir hasta tarde, ir a la playa, jugar tenis."
luischataing,CARACAS - EL DEBATE Final!  TEATRO DEL COLEGIO SANTA ROSA DE LIMA - Viernes 21 de Septiembre VENTA: http://t.co/PakHwWJd @VayaAlTeatro
luischataing,"VALEN 23 SEP ""Si me permiten"" Ttro Alfredo Celis Venta http://t.co/UEsLbKVe, AkCentro de Compras, KaiSushi, JeansRoy http://t.co/8mwpoOgZ"
luischataing,"HOY! ""SI ME PERMITEN""en #Cumana este JUEVES 20 Septiembre +Info 04248062059 y @LaTorredePiedra @VayaAlTeatro"
luischataing,"VIDEO 2012/09/20 Comentarios Carlos Mauricio Ramrez, me voy a Cumannnn, 6am http://t.co/gv8PgKXS"
luischataing,VIDEO 2012/09/20 Tres matrimonios dos casos de hemorroides http://t.co/FP9JzE1R
luischataing,VIDEO 2012/09/20 Entrevista al actor Felix Loreto http://t.co/98cznvuz
luischataing,El Loco Barrera es un peligrosos narcotraficante que durante aos se hizo pasar por creador del recordado programa Video Loco.
luischataing,"Tranquilos, Castrol ha creado un lubricante con tecnologa sinttica que les brindar proteccin desde el encendido."
luischataing,"Capturaron al narcotraficante apodado Loco Barrera no les suena?, claro en VTV lo apodaban distinto pajo pitiyankee oligarca etc."
luischataing,"Va y viene la luz, va y viene la luz, y los artefactos elctricos? ----&gt; Seguros La Vitalicia, vital para ti @lavitaliciaca"
luischataing,Nos vemos esta noche! CUMAN RT @Marijota79: Hoy si me permiten con @LuisChataing  en Cn Biennvenidoooooo
luischataing,RT @Arelys_Perez: Porque sera que siempre que veo un cono de seguridad o de trafico me acuerdo de uds @ErikaDLV y @LuisChataing con el c ...
luischataing,"Capturaron al narcotraficante Loco Barrera, a las elecciones se les puede pedir de todo, como que le pongan color al video de J.C. Caldera"
luischataing,"En cabina conversamos AL AIRE con @Felixloretor ""La jaula de las plumas"""
luischataing,"VALENCIA! RT @beta_hdz: Yupi ya tengo mi entrada para este Domingo 23,ver a @LuisChataing en su obra ""Si me permiten"" aca en valencia"
luischataing,Gracias! nos vemos esta noche RT @norys94: @LuisChataing Llego el esperado dia! CHATAING en CUMANA! Bienvenidooooooo!!
luischataing,RT @alfredleanivis: @LuisChataing gracias por darme la oportunidad de tener que explicarle a mi hijo de 7 aos a esta hora que es una he ...
luischataing,"RT @agle12: ""@LuisChataing: ""SI ME PERMITEN""en #Cumana este JUEVES 20 Septiembre esssssspeeeeraaannnddoooooteeee quiero una foooooottttoooo"
luischataing,RT @ArlexCampos: REAMIX DE BLABLA EN @LuisChataing MEJOR QUE EL ORIGINAL...
luischataing,Nos vemos el sbado!RT @edlennysmato: Chataaaing Si me lo permites aqui t estamos esperando ansiosos en Ciudad Bolivar! Besoss..
luischataing,"Viernes Caracas, sbado Cdad Bolvar! RT @ibi_m: Y despues de estar en cumananananananananananana el domingo en valencia @LuisChataing"
luischataing,"Suena en DNELM ------&gt; ""With or without you"" 2 Cellos"
luischataing,RT @MeliEv_: Me voy a cumannanananananananananana BATMAN @LuisChataing
luischataing,"Buenos das! escucha ""De nuevo en la maana"" EN VIVO de 6am-9am en http://t.co/yqhEaR5I http://t.co/bM6imWtD"
luischataing,"VIDEOS diarios del programa de radio ""De nuevo en la maana"" ----&gt; http://t.co/Yyx12y5l"
luischataing,Nuestra invitada maana en #ChataingTV es la actriz colombiana Alejandra Sandoval. Buenas noches!  http://t.co/IPubyrok
luischataing,En breve nuestros invitados en #ChataingTV el grupo Famasloop @TelevenTV http://t.co/tOocafzI
luischataing,"42 millones de dlares en comisin por vender 8 buques parece mucho pero no lo es, con eso no compras ni dos castillos en Espaa."
luischataing,"Tambin hoy MEDIANOCHE el Encargado de Negocios de la Embajada de Mxico, Eduardo Martnez #ChataingTV @TelevenTV  http://t.co/RyJgiHlX"
luischataing,"Denuncian presunto pago de comisin por 42 millones de dlares en negocio entre Espaa y Venezuela, guao!, eso si un sobre manila!"
luischataing,"Bien por los que duermen tranquilos!, a los que no el secreto para poder hacerlo ---&gt; Seguros La Vitalicia, vital para ti @lavitaliciaca"
luischataing,"La gente siempre recordar dnde estaba cuando muri Lady Di, y dnde estaba cuando renunci Acosta Chirinos."
luischataing,VIDEO 2012/09/19 Comentarios Video-Foro en la AN caso Juan Carlos Caldera http://t.co/enS8QhdY
luischataing,"Hoy MEDIANOCHE estrenamos el ""latfono 5"" #ChataingTV @TelevenTV  http://t.co/VxsZaBvP"
luischataing,VIDEO 2012/09/19 Entrevista a Astrid Carolina Herrera http://t.co/YN9PPCE9
luischataing,VIDEO 2012/09/19 Trino Mora canta a Pastor Maldonado http://t.co/nJXSHF70
luischataing,Famasloop hoy MEDIANOCHE en #ChataingTV @TelevenTV  http://t.co/Q5kYYoiA
luischataing,"Yoel Acosta Chirinos renunci a la candidatura, claro, comenzaron las clases, hay que llevar a los nios al colegio, todo se complica."
luischataing,"Gracias a Castrol, muy pronto les dir cmo prevenir el 75% de desgaste que sufre el motor al encenderlo."
luischataing,Cd_Bolvar #SiMePermiten 22/09 Centro Sirio + info @owenpro Entradas en @lebongoutcafe @Subwaybolivar (c.c. Las Banderas) (0414)4323503
luischataing,Hoy MEDIANOCHE nuestros invitados en #ChataingTV el grupo Famasloop @TelevenTV http://t.co/tOocafzI
luischataing,Jefa del Distrito Capital trabaja para lograr los 10 millones de votos si los consigue tan rpido como sane las aguas del Guaire vamos bien
luischataing,"Trabajan para lograr los 10 millones de votos , no es que no quieran resolver los problemas de Caracas es que estn ocupados en otra cosa."
luischataing,"RT @cmrondon: Esta noche, a las 7pm, presento ""La venganza de la momia azteca"", el libro ms reciente de Ivn Loscher. En la librera El ..."
luischataing,Nos vemos maana! RT @milarrieta: Ya con las entradas para ver @LuisChataing  #SiMePermiten en Cuman http://t.co/9uwTqcOJ
luischataing,-----&gt; RT @chataingtv: Hoy MEDIANOCHE nuestros invitados en #ChataingTV el grupo Famasloop por @TelevenTV http://t.co/ymppLTb4
luischataing,"""SI ME PERMITEN""en #Cumana este JUEVES 20 Septiembre +Info 04248062059 y @LaTorredePiedra @VayaAlTeatro"
luischataing,"VALEN 23 SEP ""Si me permiten"" Ttro Alfredo Celis Venta http://t.co/UEsLbKVe, AkCentro de Compras, KaiSushi, JeansRoy http://t.co/8mwpoOgZ"
luischataing,"Juan Carlos Caldera se despoj de su inmunidad parlamentaria, Makled le envi un mensaje de texto que deca me la prestas?."
luischataing,VIDEO 2012/09/19 Trino Mora canta a Pastor Maldonado http://t.co/nJXSHF70
luischataing,VIDEO 2012/09/19 Comentarios Video-Foro en la AN caso Juan Carlos Caldera http://t.co/enS8QhdY
luischataing,VIDEO 2012/09/19 Entrevista a Astrid Carolina Herrera http://t.co/YN9PPCE9
luischataing,Si algo nos queda claro tras la discusin sobre el video de J. C. Caldera es que William Ojeda necesita ser alcalde de Sucre sea como sea!
luischataing,"Si algo le pasa a este tweet puedo estar tranquilo sus caracteres estn asegurados con Seguros La Vitalicia, vital para ti @lavitaliciaca"
luischataing,"Vieron el Video-Foro de la AN sobre el caso de Juan Carlos Caldera?, yo lo llamo la novela perfecta."
luischataing,"Sabas que el 75% del desgaste del motor ocurre cuando enciendes tu vehculo?
Pronto te dir cmo evitarlo."
luischataing,Led Varela y Jos Rafael Guzmn #ChataingTV http://t.co/vbpV1lyQ
luischataing,"RT @VayaAlTeatro: #Cuman ""Si me permiten"" CLUB ARABE SIRIO #20Sep/8pm @LuisChataing. Venta: FORASTIERO SHOP. Info: http://t.co/sBKJ2WyF ..."
luischataing,"Sucedi algo curioso en la AN, hablaban de crear una comisin e inmediatamente a lo lejos se escuch un grito ""de cunto?""."
luischataing,En cabina conversamos AL AIRE con @AstridHerrera84
luischataing,"All nos vemos! RT @dunavargas: @LuisChataing y este sabado 22 ""Si Me Permiten"" en Ciudad Bolivar. ;)"
luischataing,"""SI ME PERMITEN""en #Cumana este JUEVES 20 Septiembre +Info 04248062059 y @LaTorredePiedra @VayaAlTeatro"
luischataing,Este domingo 23 sept Auditorio Alfredo Celis Prez RT @cammarata19: @LuisChataing cuando vienes a valencia?
luischataing,CARACAS - EL DEBATE  Final!  TEATRO DEL COLEGIO SANTA ROSA DE LIMA - Viernes 21 de Septiembre VENTA: http://t.co/3EdxyBJD @vayaalteatro
luischataing,RT @lisdanyc: @LuisChataing Bangevita jajajajajajaja me muero de la risa con el credilolas jajajaja
luischataing,"RT @Marievt26: @LuisChataing q excelente q estars en Cuman, lamentablemente yo no estar, pero de seguro mis padres, si se permiten ir ..."
luischataing,Nos vemos maana! CUMAN! RT @geny_oronoz: Un Dia para verte @LuisChataing #Cumana Si te lo Permite *.* Apurate!
luischataing,RT @aguayurubi: @LuisChataing besos desde las tierras mas dulces de nuestro pas....Yaracuy
luischataing,"Buenos das! escucha ""De nuevo en la maana"" EN VIVO de 6am-9am en http://t.co/yqhEaR5I http://t.co/bM6imWtD"
luischataing,En breve nuestra invitada es Mara Elena Lavaud #ChataingTV @TelevenTV http://t.co/euTHYsdC
luischataing,#GUERRASUCIA Dicen que Capriles es checoslovaco y el Comando Venezuela gasta miles de dlares en clases para ensearle a hablar espaol.
luischataing,Nos rompieron los huevos hoy MEDIANOCHE en #ChataingTV por @TelevenTV  http://t.co/A5CVXT8n
luischataing,#GUERRASUCIA Dicen que para ahorrarse unos reales el presidente prefiere comprar la otra marca de lavaplatos.
luischataing,"Reparaciones en el PH la conserje llama y no quieres mover el carro ------&gt; Seguros La Vitalicia, vital para ti @lavitaliciaca"
luischataing,Mara Elena Lavaud hoy MEDIANOCHE en #ChataingTV por @TelevenTV  http://t.co/29Ld0h5D
luischataing,Sali una nueva edicin del video de Juan Carlos Caldera con bloopers y  comentarios del Director.
luischataing,"VALEN 23 SEP ""Si me permiten"" Ttro Alfredo Celis Venta http://t.co/UEsLbKVe, AkCentro de Compras, KaiSushi, JeansRoy http://t.co/8mwpoOgZ"
luischataing,VIDEO 2012/09/18 Entrevista a Malanga http://t.co/1o8qAa3D
luischataing,VIDEO 2012/09/18 Vuelve a la cabina la seora que lleva gente al banco http://t.co/fua1hR8A
luischataing,VIDEO 2012/09/18 Comentarios renuncia Yoel Acosta Chirinos http://t.co/uU9Oer7m
luischataing,El video de Juan Carlos ha sido tan comentado que Willmer y su empleado lo estn convenciendo para filmar la pelcula.
luischataing,Hoy MEDIANOCHE nuestra invitada es Mara Elena Lavaud #ChataingTV @TelevenTV http://t.co/euTHYsdC
luischataing,"Algunos planteles escolares comenzaron el ao con quiz sorpresa, la pregunta fue ""Dnde se consigue Euthyrox?"""
luischataing,"Atrapado en una cola que puede daar el motor de mi vehculo. Pero yo tranquilo con eso, ya les dir porqu."
luischataing,"RT @LedVarela: Hoy #ChataingTV como siempre, rompiendo los huevos  http://t.co/c7DGHxeS"
luischataing,"Nios pasaron el primer da de clases escribiendo planas ""No debo decir jalabolas, no debo decir pajuo, no debo decir majunche""."
luischataing,#CAPRILESLOSTIENELOCOS
luischataing,------&gt; RT @chataingtv: Hoy MEDIANOCHE nuestra invitada en #ChataingTV es Mara Elena Lavaud @TelevenTV http://t.co/qumlhF2m
luischataing,CARACAS - EL DEBATE  Final!  TEATRO DEL COLEGIO SANTA ROSA DE LIMA - Viernes 21 de Septiembre VENTA: http://t.co/3EdxyBJD @vayaalteatro
luischataing,Los requisitos para abrir cuenta en dlares son los mismos que para abrir una en bolvares: pilas con los choros al entrar y salir del banco
luischataing,"""SI ME PERMITEN""en #Cumana este JUEVES 20 Septiembre +Info 04248062059 y @LaTorreDePiedra  @vayaalteatro"
luischataing,Cd_Bolvar #SiMePermiten 22/09 Centro Sirio + info @owenpro Entradas en @lebongoutcafe @SubwayBolivar (c.c. Las Banderas) (0414)4323503
luischataing,VIDEO 2012/09/18 Entrevista a Malanga http://t.co/1o8qAa3D
luischataing,VIDEO 2012/09/18 Vuelve a la cabina la seora que lleva gente al banco http://t.co/fua1hR8A
luischataing,"Desde ayer se pueden abrir cuentas en dlares en bancos venezolanos, lo digo en caso que ""el jefe"" quiera enviar otro sobre manila."
luischataing,"Atrapado en una cola que puede daar el motor de mi vehculo. Pero yo tranquilo con eso, ya les dir porqu."
luischataing,"Yoel Acosta Chirinos renunci a la candidatura presidencial para apoyar al presidente Chvez, caramba, esa no la vea venir."
luischataing,"Reparaciones en el PH la conserje llama y no quieres mover el carro ------&gt; Seguros La Vitalicia, vital para ti @lavitaliciaca"
luischataing,"RT @OrienteTuyo: ""Si me permiten"", el monologo de @LuisChataing, llega a #Cumana este jueves 20 de septiembre +Info 04248062059 y @LaTor ..."
luischataing,"Yoel Acosta Chirinos renunci a la candidatura presidencial para apoyar al presidente Chvez, ah?, no saban que era candidato?, yo tampoco."
luischataing,En cabina conversamos AL AIRE con @malangaoficial @aribarbella @jluciow
luischataing,"En cabina conversamos AL AIRE con @Veroruizdelvizo @fede7 ""El futuro promete"""
luischataing,RT @pataypedal: Saludos desde @LaMega889pzo a Nuestros Colegas @LuisChataing @MiguelAriasS y @GuilleDiaz de #DeNuevoEnLaMaana&gt; Donde ...
luischataing,Cd_Bolvar #SiMePermiten 22/09 Centro Sirio + info @owenpro Entradas en @lebongoutcafe @SubwayBolivar (c.c. Las Banderas) (0414)4323503
luischataing,RT @KElneser: VIA AL AEROPUERTO ESCUCHANDO @LuisChataing te escuchare desde el libano #COMOSEA!!
luischataing,RT @FMPinilla: #CARICATURA. (Primera parte) El salto de talanquera de Escarr  http://t.co/Ky1eJPIq @la_patilla @LuisChataing @ChavezOff ...
luischataing,RT @karolansz: Con la corneta cerca de mi pancita estimulando a mi bebe con @LuisChataing y #Denuevoenlamaana
luischataing,"RT @Oriannada: ""Mi hijo se va a llamar Granizo Alberto"" JAJAJAJAJAJA @LuisChataing"
luischataing,VIDEO 2012/09/18 Comentarios renuncia Yoel Acosta Chirinos http://t.co/uU9Oer7m
luischataing,Ese -------&gt; RT @luisagelvis: @LuisChataing pastormaldonado
luischataing,"Buenos das! escucha ""De nuevo en la maana"" EN VIVO de 6am-9am en http://t.co/yqhEaR5I http://t.co/bM6imWtD"
luischataing,"VIDEOS diarios del programa de radio ""De nuevo en la maana"" ----&gt; http://t.co/Yyx12y5l"
luischataing,Nuestra invitada maana en #ChataingTV es Mara Elena Lavaud. Buenas noches!  http://t.co/qumlhF2m
luischataing,RT @marielvisavila: Maickel Melamed orgullo nacional!!! @LuisChataing
luischataing,"RT @LedVarela: #ELPULCINOPIO es Trending Topic, cortesa de #ChataingTV"
luischataing,RT @JeanMary_: Para los que necesitan su dosis extra de Pulcino Po &lt;3 http://t.co/8USUcv6o
luischataing,La foto mas cool del da http://t.co/Sx7HZZVq
luischataing,RT @JeanMary_: Que bello es el Pulcino Po!
luischataing,#ELPULCINOPIO
luischataing,COMENZAMOS! #ChataingTV
luischataing,En breve Melamed en #ChataingTV http://t.co/wPAde8xs
luischataing,En breve nuestra invitada en #ChataingTV es Carla Angola @TelevenTV http://t.co/vu8NP1MS
luischataing,RT @olgadager: My friend @LuisChataing te presento mi weblog http://t.co/oyD7c3Y4 #salud
luischataing,"La guerra sucia ha sido ampliamente abordada en Hollywood recuerdan ""La guerra sucia de las galaxias""? Chewaca hablando pestes de C3PO"
luischataing,Maickel Melamed tambin nos acompaa hoy MEDIANOCHE #ChataingTV por @TelevenTV  http://t.co/tQxhe5pX
luischataing,#GUERRASUCIA De resultar electo presidente Capriles el precio del Zamora se devaluara al cambio de 5.3 Zamoras = 1 Sucre.
luischataing,"El techo de tu casa rechina y no es de madera? ----&gt; Seguros La Vitalicia, vital para ti @lavitaliciaca"
luischataing,Carla Angola hoy MEDIANOCHE en #ChataingTV por @TelevenTV  http://t.co/nqw0VTaZ
luischataing,RT @mdticket: A solo 1 semana de Las Elecciones EL DEBATE #29SEP 9Pm @Leonardo_Padron @LuisChataing @Lacelis @profesorbriceno @ClaudioNa ...
luischataing,#GUERRASUCIA De resultar electo presidente Capriles obligar a Jaime Surez a que se afeite la barba.
luischataing,"VIDEO 2012/09/17 Comentarios Barquisimeto-Capriles, fin de semana, etc. 6am http://t.co/OdN3dwXi"
luischataing,VIDEO 2012/09/17 Entrevista a Rodrigo de Vinilo Versus http://t.co/LMEe6sFy
luischataing,VIDEO 2012/09/17 A Ivn Loscher le gusta la gasoliiinaaa http://t.co/QKWHsQGq
luischataing,#GUERRASUCIA Dicen que cuando Capriles saca un paquetico de chiclets no ofrece.
luischataing,Desde que giran la llave el motor sufre desgaste por friccin. Pronto les dar una solucin para protegerlo.
luischataing,Hoy MEDIANOCHE nuestra invitada en #ChataingTV es Carla Angola @TelevenTV http://t.co/vu8NP1MS
luischataing,#GUERRASUCIA Dicen que Chvez aprendi a llorar con Sean Penn
luischataing,"La campaa se ha tornado sucia, buscan embarrarlo todo,  Capriles se vio obligado a cambiar el autobs por una 4x4"
luischataing,-----&gt; RT @chataingtv: Hoy MEDIANOCHE nuestra invitada en #ChataingTV es Carla Angola por @TelevenTV http://t.co/KT2fGaak
luischataing,"Temprano devolvieron a un estudiante para su casa, se acerc al profesor con un sobre manila amarillo y dijo ""esto te lo manda el jefe""."
luischataing,"#Caracas ""EL DEBATE"" #21Sep Santa Rosa de Lima. Entradas a la venta: @TICKETMUNDO. Info: http://t.co/ao31D3AW"
luischataing,CIUDAD BOLVAR #SiMePermiten 22/09 Centro Sirio CBL 7pm. Presentado por @Vmodeles. Entradas en Le Bon Gout Cafe (c.c. Lul).
luischataing,"#Cuman ""Si me permiten"" CLUB ARABE SIRIO #20Sep/8pm @LuisChataing. Venta: Venta: FORASTIERO http://t.co/zViGWesn: http://t.co/ao31D3AW"
luischataing,"VALEN 23 SEP ""Si me permiten"" Ttro Alfredo Celis Venta http://t.co/UEsLbKVe, AkCentro de Compras, KaiSushi, JeansRoy http://t.co/8mwpoOgZ"
luischataing,"Es temprano, en los laboratorios de guerra sucia huele a barro recin colao."
luischataing,VIDEO 2012/09/17 Entrevista a Rodrigo de Vinilo Versus http://t.co/LMEe6sFy
luischataing,"VIDEO 2012/09/17 Comentarios Barquisimeto-Capriles, fin de semana, etc. 6am http://t.co/OdN3dwXi"
luischataing,VIDEO 2012/09/17 A Ivn Loscher le gusta la gasoliiinaaa http://t.co/QKWHsQGq
luischataing,"Comienza una nueva semana o como la llama Juan Carlos Caldera ""Ya?, ya puedo salir?"""
luischataing,Desde que giran la llave el motor sufre desgaste por friccin. Pronto les dar una solucin para protegerlo.
luischataing,"Premio Alma celebra logros de comunidad latina en EU, premio Calma celebra logros de comunidad electoral venezolana en el mismo pas."
luischataing,"El techo de tu casa rechina y no es de madera? ----&gt; Seguros La Vitalicia, vital para ti @lavitaliciaca"
luischataing,"Comienzan las clases, parase temprano, corregir exmenes, los profesores entre lgrimas aseguran que preferiran irse a recorrer la Sabana."
luischataing,"Edgar Ramrez gan el premio Alma por su papel en Furia de Titanes 2, en mi opinin lo hizo mucho mejor en Rpido y furioso de Titanes"
luischataing,Conversamos AL AIRE con @Rodgonsalves @Viniloversus
