luischataing,"Buenos das! Un caf caliente y mi artculo ""Luke ... Carlos Baute es tu padre"" publicado por El Nacional http://t.co/Dea1pl7i"
luischataing,Los puentes en el autopista Francisco Fajardo deberan dejar las gandolas tranquilas y dedicarse a atrapar malandros.
luischataing,RT @CesarPerezVivas: Gracias al amigo @LuisChataing por la cancin y sus comentarios. Vamos a Ganar!
luischataing,Una bola de jamn planchado! ----&gt; RT @ElNacionalWeb: La NASA habla sobre rumores de un hallazgo importante en Marte.
luischataing,"Buenos das! Un caf caliente y mi artculo ""Luke ... Carlos Baute es tu padre"" publicado por El Nacional http://t.co/Dea1pl7i"
luischataing,"VIDEOS diarios del programa de radio ""De nuevo en la maana"" ----&gt; http://t.co/Yyx12y5l"
luischataing,En breve nuestro invitado en #ChatsingTV es el golfista Jhonattan Vegas @TelevenTV http://t.co/A5toD4WR
luischataing,"Mazinger Z no celebra el cumpleaos, se rasca y acaba destruyendo la torta, desintegrando a la mitad de los invitados, etc."
luischataing,Hoy MEDIANOCHE tambin invitada a #ChataingTV la cantante colombiana Rakel @TelevenTV  http://t.co/wfO7ybwM
luischataing,SEALES DE QUE NO TENDRS BUENA NAVIDAD San Nicols te bloque de su cuenta en Twitter.
luischataing,"Saliste a escalar y por error llevaste zapatos de bowling -----&gt; Seguros L Vitalicia, vital para ti @LaVitaliciaCA"
luischataing,Jhonattan Vegas hoy MEDIANOCHE en #ChataingTV por @TelevenTV  http://t.co/oy8b4mWT
luischataing,"Mazinger Z cumple 40 aos, est mayor, solo permite que lo llamen ""Seor Z""."
luischataing,"FINAL DE ""MI EX ME TIENE GANAS"" La historia sigue como va y el pblico le pierde las ganas."
luischataing,La ms reciente maravilla de la tecnologa moderna en lubricantes para vehculos que slo Castrol pudo crear  http://t.co/ibRsNTR2
luischataing,"HOUSTON FEBRERO 2013 ""Si me permiten"" detalles muy pronto."
luischataing,Hoy MEDIANOCHE nuestro invitado en #ChatsingTV es el golfista Jhonattan Vegas televentv http://t.co/A5toD4WR
luischataing,ENCUESTAS Si Navidad fuera este domingo 65% creera que los regalos los trae San Nicols y el 35%restante creera que los trae el Nio Jess
luischataing,"Con este cupn ""zapatos20"" hoy y maana te dan 20% de Descuento en TODOS los Zapatos de http://t.co/SzHBRXVR, CORREEEE http://t.co/hQ3WnjIh"
luischataing,"Mazinger Z cumple 40 aos y comienza a sentir los achaques, ahora solo persigue a los muchachos de la cuadra que ponen la msica alta."
luischataing,"Ah bueno, si la cosa es as entonces yo tampoco asisto a la Cumbre de UNASUR."
luischataing,RT -----&gt; #AmanecerconVictorDrija
luischataing,"Que vergenza con el seor de aduana que me estaba cazando y me pidi que abriera la maleta, no traje nada para l."
luischataing,"Que arrogancia la del equipaje cuando uno llega a Maiqueta, como le gusta que esperemos por l."
luischataing,Hoy MEDIANOCHE nuestro invitado en #ChataingTV es el golfista Jhonattan Vegas @TelevenTV  http://t.co/ip1LbIJx
luischataing,"La UNASUR se rene en Lima sin Rousseff, Fernndez, ni Chvez, es es como ir a un concierto de Guaco sin Gustavo Aguado."
luischataing,Todas las encuestas coinciden en que lleg el fin de semana!
luischataing,"Tu hija quiere un Ipod de Navidad pero estn carsimos! En http://t.co/SzHBRXVR lo consegu en BsF. 1500, que tal? http://t.co/AXs1L3Mc"
luischataing,RT @desordenpublico: @LuisChataing Hoy Maracaibo @UlisesHadjis y Banda @CaplisDesorden @DanelDesorden @AlgodonEgipcio #AlexHung en #Teat ...
luischataing,"Lindsay Lohan fue detenida, no, no hizo nada, la detuvieron para no perder la costumbre."
luischataing,Para ser claro al hablar de lubricantes y de la nueva tecnologa de Castrol Magnatec ingresa en http://t.co/iG41Q1vh
luischataing,"Prohibido comercializar musgo, decoren el Nacimiento con esa cosita verde que le sale a la gente mientras llena la planilla de CADIVI."
luischataing,"Te molesta horriblemente que te griten ""CUIDAOOOO"" ----&gt; Seguros La Vitalicia, vital para ti @LaVitaliciaCA"
luischataing,"Buenos das! escucha ""De nuevo en la maana"" EN VIVO de 6am-9am en http://t.co/yqhEaR5I http://t.co/bM6imWtD"
luischataing,En breve #ChataingSinChataing por @TelevenTV
luischataing,"Carlos Baute reconoci que tiene un hijo de 23 aos, el muchacho se llama ""Jos Daniel"" o como lo llama Carlos ""Shhhhh!""."
luischataing,"Ahora me di por trotar, me met en http://t.co/SzHBRXVR y me compr un Reloj Polar en BsF. 600 as o ms fcil? http://t.co/6F5gCsCd"
luischataing,RT @losmolero: #directv#dlbgroup Lanzamiento NEXUS Pto. Rico con @luischataing http://t.co/yoeFKuXl
luischataing,"Se enteraron? el nuevo disco de Carlos Baute trae un ""bonus track"" as es, un hijo de 23 aos."
luischataing,"VIDEO 2012/11/29 Definiendo la frase ""Esa muchacha est comiendo arroz"" http://t.co/8e3x7yRW"
luischataing,"VIDEO 2012/11/29 Comentarios ""Pacheco"", eslogan Televen, etc. 6am http://t.co/ZeZ7r2bQ"
luischataing,VIDEO 2012/11/29 Entrevista a Gigi Zanchetta http://t.co/jECYrbCc
luischataing,"MIRANDA Con cul nos quedamos, con un gobernador que llora como nio rico o con uno que suena raro cuando inaugura eventos deportivos?"
luischataing,"Buscando a @DayanaMendoza en la fiesta de navidad de Seguros La Vitalicia, vital para ti @LaVitaliciaCA MNDAME UNA FOTO!"
luischataing,"CIUDAD OJEDA 7DIC ""Si me permiten"" Auditorio Simn Bolvar Entradas: Gran Muralla, Farmapueblo y Boulevard Caf. Inf: 0414.6642661"
luischataing,"SAN ANTONIO DE LOS ALTOS 1DIC ""Si me permiten"" Colegio Mater Dei - Entradas e informacin en el Colegio Mater Dei."
luischataing,"Jaua dice que ""Miranda necesita un gobernador que no ande llorando como un nio rico"" quin lo entiende?, entonces para qu se postula?"
luischataing,Las reconoces? Son las Molculas Inteligentes de Castrol Magnatec http://t.co/RLfS5023
luischataing,Ya en La Isla del Encanto ... Esta noche con los amigos de DIRECTV PUERTO RICO!
luischataing,-----&gt; RT @chataingtv: Hoy MEDIANOCHE #ChataingSinChataing por @TelevenTV http://t.co/BbCUqAwd
luischataing,Tetero + helados + chocolates + tequeos = RT @ElUniversal: Una ecuacin predice la obesidad infantil.
luischataing,"HOUSTON FEBRERO 2013 ""Si me permiten"" detalles muy pronto."
luischataing,"VIDEO 2012/11/29 Definiendo la frase ""Esa muchacha est comiendo arroz"" http://t.co/8e3x7yRW"
luischataing,"VIDEO 2012/11/29 Comentarios ""Pacheco"", eslogan Televen, etc. 6am http://t.co/ZeZ7r2bQ"
luischataing,VIDEO 2012/11/29 Entrevista a Gigi Zanchetta http://t.co/jECYrbCc
luischataing,"El arroz est tan caro que viene en dos presentaciones ""Prcticamente imposible de pagar"" e ""Imposible de pagar""."
luischataing,"Esta noche FIESTA DE NAVIDAD + @DayanaMendoza = Seguros La Vitalicia, vital para ti @LaVitaliciaCA"
luischataing,El arroz est tan caro que  los recin casados lo atajan y lo entregan en el banco como cuota inicial para comprar un apartamento.
luischataing,Tremenda tienda en lnea tiene http://t.co/SzHBRXVR compra con tu cupo Cadivi http://t.co/uUWAlwdG
luischataing,"VAL 7 de Dic Mi Pais Tu Pais, Teatro Alefredo Celis. Vtas http://t.co/PakHwWJd, Palau El Vinedo, CC la Granja y taq teatro inf 04241078082"
luischataing,"El arroz est tan caro que la en lugar de utilizar la expresin ""como arroz"" la gente prefiere decir ""burda""."
luischataing,"Molculas inteligentes? Qu hacen? Cmo lo hacen?... Quieres saber?
Ingresa en http://t.co/iG41Q1vh"
luischataing,"Aument el precio del arroz, el arroz est tan caro que las paellas solo se venden en concesionarios de carros."
luischataing,RT @FidelCermeno: Hoy en Venezuela se celebra el da del escritor!! Saludos a @GuilleDiaz @LuisChataing y full sintona con #DeNuevoEnLa ...
luischataing,RT @YeniMalave: Jajajaj!! Sr. Ten piedad.. @LuisChataing #DeNuevoEnLaMaana
luischataing,"RT @Drluisrendon: @LuisChataing buen dia desde el exilio vacacional, desde Buenos Aires jajajaja. Gracias a Internet... Saludos"
luischataing,Grrrrr! -----&gt; RT @yeilove90: @LuisChataing seduceme con el arroz ...
luischataing,Bueeenos das Dj ----&gt; RT @djagniezka: Saludos a @MiguelAriasS @LuisChataing y @GuilleDiaz en De Nuevo en la Maana!
luischataing,"RT @Eliza_Cristi: Ir tarde al trabajo, escuchando a @LuisChataing para olvidar que firmaras una amonestacin.. #NoTienePrecio"
luischataing,RT @JolybettMendes: Llegando a Valencia y para no perder la costumbre escuchando a @LuisChataing :-* Besoooossss!!!
luischataing,RT @Pedro_filo: Hace frio @luischataing http://t.co/t5jXheze
luischataing,RT @_holacocacola: Les cuento que en mi casa hay un radio en el bao para poder escuchar a @LuisChataing mientras nos baamos. http://t. ...
luischataing,"Buenos das! escucha ""De nuevo en la maana"" EN VIVO de 6am-9am en http://t.co/yqhEaR5I http://t.co/bM6imWtD"
luischataing,"VIDEOS diarios del programa de radio ""De nuevo en la maana"" ----&gt; http://t.co/Yyx12y5l"
luischataing,"En breve nuestros invitados en #ChataingTV el duo ""Los Aviadores"" por @TelevenTV http://t.co/O0pRpgWI"
luischataing,Paola Cipriani entrega cartas hoy MEDIANOCHE en #ChataingTV por @TelevenTV  http://t.co/qEvJFGBV
luischataing,El caf est tan caro que el presupuesto de la Nacin para el 2013 fue calculado en granos.
luischataing,"Lleg la Navidad! Tremendo Iphone en BsF 4480 con tu Cupo Cadivi, slo en http://t.co/SzHBRXVR http://t.co/zuIYq6JN"
luischataing,Los Aviadores hoy MEDIANOCHE en #ChataingTV por @TelevenTV  http://t.co/4cTAFUrj
luischataing,VIDEO 2012/11/28 Comentarios AN en Maracay http://t.co/zS2N0Xk7
luischataing,VIDEO 2012/11/28 Carta de Miguel Arias a Kim Kardashian http://t.co/p4RxIk10
luischataing,"El caf est tan caro que Gucci bautiz su nueva lnea de carteras con el nombre  ""GUAYOYO""."
luischataing,"@DayanaMendoza bailamos la noche de la fiesta de navidad de Seguros La Vitalcia, vital para ti @LaVitaliciaCA"
luischataing,"Hoy MEDIANOCHE nuestros invitados en #ChataingTV el duo ""Los Aviadores"" por televentv http://t.co/O0pRpgWI"
luischataing,"El caf est tan caro que esta navidad Guaco solo canta ""Un cigarrito""."
luischataing,chale un vistazo a la ms reciente tecnologa moderna en lubricantes para vehculos que slo Castrol pudo crear http://t.co/Bnc22Lw1
luischataing,RT @SomosTeatro: #Maracay SI ME PERMITEN con @LuisChataing este 09/12 en Casa Italia @VayaAlTeatro @talentofemenino #CierreDeTemporada2012
luischataing,"----&gt; RT @chataingtv: Hoy MEDIANOCHE nuestros invitados en #ChataingTV son ""Los Aviadores"" @TelevenTV http://t.co/hwm6iNm1"
luischataing,"CIUDAD OJEDA 7DIC ""Si me permiten"" Auditorio Simn Bolvar Entradas: Gran Muralla, Farmapueblo y Boulevard Caf. Inf: 0414.6642661"
luischataing,"SAN ANTONIO DE LOS ALTOS 1DIC ""Si me permiten"" Colegio Mater Dei - Entradas e informacin en el Colegio Mater Dei."
luischataing,VIDEO 2012/11/28 Comentarios AN en Maracay http://t.co/zS2N0Xk7
luischataing,VIDEO 2012/11/28 Carta de Miguel Arias a Kim Kardashian http://t.co/p4RxIk10
luischataing,MIAMI RT @TrailTeatro: Tickets for @LuisChataing en SI ME PERMITEN On Sale now! http://t.co/ulQ9mdut
luischataing,"Aumento del precio del caf, el caf se puso tan caro que la gente acude a las panaderas y pide dos cachetadas para mantenerse despiertos."
luischataing,"Yo no pel mi Ipad 3 con mi Cupo Cadivi en http://t.co/SzHBRXVR, y adems me lo trajeron a mi casa, todo por BsF. 3160 http://t.co/9eOmsnKb"
luischataing,"La AN record el segundo alzamiento militar de 1992 para esa poca la consigna era ""Uh! Ah! Uh! Ah! Uh! Uh! Uh! ok me rindo, me rindo""."
luischataing,"Para conocer al detalle la nueva tecnologa en lubricantes de Castrol Magnatec, 
ingresa a http://t.co/iG41Q1vh"
luischataing,Cuando los diputados sesionan fuera de la AN coleccionistas entran al hemiciclo y aprovechan para buscar objetos de oro perdidos en el piso.
luischataing,"Mejor que el botox para combatir las arrugas producto de la angustia ----&gt; Seguros La Vitalcia, vital para ti @LaVitaliciaCA"
luischataing,"La AN sesion al aire libre desde Maracay, fue interesante aunque me distrajeron las seoras que vendan mangos."
luischataing,"No es cierto, apenas me lleva 20 RT @noticias24: Enamorada? Demi Moore estrena novio 24 aos ms joven que ella"
luischataing,"RT @ClauCovSc3: Pooor eeesooo y muuchaaas coosaas maas, ven a mi caasaa estaa naaviidaa wepa j jajajajajajajajajajajajaja Emo-HEmos @Lu ..."
luischataing,RT @Im_MuchBetter: Guepa ' he! #gaitazoEmo @luischataing
luischataing,RT @desyvivas: @LuisChataing Buenos das Luis un Saludo desde las ciudades gemelas acrigua araure
luischataing,"RT @meoch: @LuisChataing Luis en sintona de los 3chiflados desde uno de los activo fijo de caracas "" La cola en la Fajardo"" ; Saludos y ..."
luischataing,RT @axlorens: Lo mejor que se puede escuchar en la cola @LuisChataing es tu programa! De Bachelona hacia GiYork. Saludos!
luischataing,RT @DaVinciMB: @LuisChataing Buenos das! En sintona desde Los Valles del Tuy. Un abrazo a todos!!
luischataing,"RT @arasmeyohana: @LuisChataing tu q eres experto en trasnochos, psame el dato d como lidiar cn ellos xq estoy despierta dsd las 2:am v ..."
luischataing,"Buenos das! escucha ""De nuevo en la maana"" EN VIVO de 6am-9am en http://t.co/yqhEaR5I http://t.co/bM6imWtD"
luischataing,En breve nuestro invitado en #ChataingTV es Joey Montana @TelevenTV http://t.co/R6I8A1Fn
luischataing,Promesas de Arias Crdenas para ganar las elecciones en el Zulia: en dos meses pondremos gordo a Gustavo Aguado de nuevo.
luischataing,Esta Navidad no hay nada ms barato q comprar con tu Cupo Cadivi en http://t.co/SzHBRXVR! Un Blackberry Torch en 1900Bs http://t.co/zuIYq6JN
luischataing,"Dale ""Me gusta"" o ""No me gusta"" a #ChataingTV hoy MEDIANOCHE por @TelevenTV  http://t.co/OOTuIRUt"
luischataing,"Promesas de Arias Crdenas: ser un gobierno oscuro, de muchas sombras, as bajar la temperatura un par de grados."
luischataing,Joey Montana hoy MEDIANOCHE en #ChataingTV por @TelevenTV  http://t.co/7FydFjoL
luischataing,"Promesas de Arias Crdenas: basta del Festival de la Orqudea ahora en adelante entregaremos mojitos cubanos de bronce, de plata y uranio."
luischataing,VIDEO 2012/11/27 Mega Amigo Secreto http://t.co/jElPBuA9
luischataing,"VIDEO 2012/11/27 Comentarios comienzo del programa, ""Fuleco"" etc. 6am http://t.co/UVyrIsfk"
luischataing,VIDEO 2012/11/27 Entrevista Anas Vivas http://t.co/3Cb6hYvA
luischataing,Arias Crdenas sugiere cruzar el puente as se les nubla la mente lo suficiente como para olvidar la peste que habl de su Comandante.
luischataing,"""No vale! vamos a darle, las olas no se ven taaaan grandes"" ----&gt; Seguros La Vitalicia, vital para ti @LaVitaliciaCA"
luischataing,"CIUDAD OJEDA 7DIC ""Si me permiten"" Auditorio Simn Bolvar Entradas: Gran Muralla, Farmapueblo y Boulevard Caf. Inf: 0414.6642661"
luischataing,"SAN ANTONIO DE LOS ALTOS 1DIC ""Si me permiten"" Colegio Mater Dei - Entradas e informacin en el Colegio Mater Dei."
luischataing,Hoy MEDIANOCHE nuestro invitado en #ChataingTV es Joey Montana televentv http://t.co/R6I8A1Fn
luischataing,Promesas de Arias Crdenas para ganar las elecciones en el Zulia: por ser la culpable de todo llevar a juicio a Mara la Bollera.
luischataing,Las reconoces? Son las Molculas Inteligentes de Castrol Magnatec http://t.co/Z1NUgCWs
luischataing,----&gt; RT @chataingtv: Hoy MEDIANOCHE nuestro invitado en #ChataingTV es Joey Montana por @TelevenTV http://t.co/L71xpuEE
luischataing,"RT @lagarracreativa: Toda la info de ""Si me permiten"" CIUDAD OJEDA con @LuisChataing Aqui ----&gt; http://t.co/0bRaJHL9 ! #VIERNES07DIC"
luischataing,Cordialmente invitado Carlos! RT @monterocnn: @MarialeG06 @luischataing @erikadlv me encantara!
luischataing,VIDEO 2012/11/27 Mega Amigo Secreto http://t.co/jElPBuA9
luischataing,VIDEO 2012/11/27 Entrevista Anas Vivas http://t.co/3Cb6hYvA
luischataing,"VIDEO 2012/11/27 Comentarios comienzo del programa, ""Fuleco"" etc. 6am http://t.co/UVyrIsfk"
luischataing,"El nombre de la mascota del Mundial Brasil 2014 fue elegido entre 3 opciones: Fuleco, Zuzeco, y Unai-Amenabar."
luischataing,"Dos das para la fiesta de navidad ------&gt; Seguros La Vitalicia, vital para ti @LaVitaliciaCA"
luischataing,"Qu otra cosa que no fuera mascota de un Mundial poda ser con un nombre como ""Fuleco""?, aja reguetonero, qu ms?"
luischataing,Esta Navidad no hay nada ms barato q comprar con tu Cupo Cadivi en http://t.co/SzHBRXVR! Un Blackberry Torch en 1900Bs http://t.co/zuIYq6JN
luischataing,"La mascota de Mundial Brasil 2014 se llamar ""Fuleco"". Presiento que ms adelante, cuando Fuleco crezca se la cobrar a sus creadores."
luischataing,"Molculas inteligentes? Qu hacen? Cmo lo hacen?... Quieres saber?
Ingresa en http://t.co/iG41Q1vh"
luischataing,En cabina conversamos AL AIRE @AnaisVivas
luischataing,RT @koriella: @LuisChataing Hahahahahahahaha sirenita voladora.. Alegras mis maanas!! #DeNuevoEnLaMaana maanas sin ustedes no existe!!
luischataing,"RT @jesuslandaeta: Queeee!!!! @AnaisVivas en ""De Nuevo en la maaana"" con @LuisChataing? Que exito que manera tan Genial de empezar el d ..."
luischataing,"RT @reyrodtwitt: Jajaja! Aplicar el proceso de ""esmechacin"" de @LuisChataing para la cena de esta noche!"
luischataing,"RT @DanyGoncalvez: Y escuchar a @LuisChataing cantar ""t tienes un amigo que te ama"" empeora mis horas d trfico!! Jajaja #DeNuevoEnLaMaana"
luischataing,RT @tacconi_marioWS: Los Fantasma Del Caribe se separaron por la jugadera de Domino hahahahahahaha @LuisChataing @MiguelAriasS
luischataing,RT @wuarissma: @LuisChataing en sintonia desde El Tigre!!!
luischataing,"RT @Samirayordi: @LuisChataing buenos, despierta y con tu buen humor, saludos desde Anzotegui"
luischataing,RT @LilianPerez30: @LuisChataing buenisimos das desde Valencia
luischataing,Bueeeenos das! RT @emilisavila: Por los menos que me respodas los buenos dias @LuisChataing. 
luischataing,Buenos das! RT @fabiolajfg: Hola aprecio mucho.. @LuisChataing Saludos desde Barquisimeto!
luischataing,"RT @paola1203: A escuchar ""De Nuevo en laMaana"" camino a la uni para empezar mi dia como se debe @LuisChataing"
luischataing,"RT @Luis94m: ""El padre de hello kitty"" @LuisChataing Si inventa mariqueras jajajajaja."
luischataing,"Buenos das! escucha ""De nuevo en la maana"" EN VIVO de 6am-9am en http://t.co/yqhEaR5I http://t.co/bM6imWtD"
luischataing,"VIDEOS diarios del programa de radio ""De nuevo en la maana"" ----&gt; http://t.co/Yyx12y5l"
luischataing,En breve nuestro invitado en #ChataingTV es Fonseca televentv http://t.co/56lOFzSq
luischataing,"Francia y Venezuela firmaron acuerdos de integracin: Venezuela se compromete en modernizar el ""Oh La La"" francs con el divertido ""Uh! Ah!"""
luischataing,"Lleg la Navidad! Tremendo Iphone en BsF 4480 con tu Cupo Cadivi, slo en http://t.co/SzHBRXVR! http://t.co/zuIYq6JN"
luischataing,"Hoy MEDIANOCHE la campaa ""No te engoriles"" llega a #ChataingTV por @TelevenTV  http://t.co/i57qNKbR"
luischataing,Acuerdo Francia-Venezuela firma: Zidane brindar terapia post-electoral a Francisco Arias Crdenas tras el cabezazo que le espera el 16D
luischataing,Francia y Venezuela firmaron acuerdos de integracin: Francia reabrir La Bastilla para recibir en intercambio a una delegacin de Pranes
luischataing,Fonseca hoy MEDIANOCHE en #ChataingTV por @TelevenTV  http://t.co/I4SPnYUa
luischataing,"@DayanaMendoza se acerca la fecha, te veo el jueves en la fiesta de navidad de Seguros La Vitalicia, vital para ti @LaVitaliciaCA"
luischataing,Yoga hoy MEDIANOCHE en #ChataingTV por televentv http://t.co/0mdv3EOY
luischataing,Hoy MEDIANOCHE nuestro invitado en #ChataingTV es Fonseca televentv http://t.co/56lOFzSq
luischataing,Francia y Venezuela firmaron acuerdos de integracin: nuestro pas se comprometi con Francia en agregar un croissant al Escudo Nacional.
luischataing,"Rubn Limardo gan el Miss Intercontinental y Daniela Chalbaud gan la Copa Satlite de Noruega, perdn, me cambiaron las chuletas."
luischataing,La ms reciente maravilla de la tecnologa moderna en lubricantes para vehculos que slo Castrol pudo crear http://t.co/YtuwOT18
luischataing,----&gt; RT @chataingtv: Hoy MEDIANOCHE nuestro invitado en #ChataingTV es Fonseca @TelevenTV http://t.co/RbLkUSuV
luischataing,"Se freg Henrique Salas Feo, William Ojeda decidi apoyar pblicamente a Francisco Ameliach."
luischataing,"Quiero una Tablet y no me decido entre Android y el Ipad, en http://t.co/SzHBRXVR estn baratsimas! cul me compro? http://t.co/hLYX7FZC"
luischataing,"VIDEO 2012/11/26 Comentarios ""Chiti Chiti Bang Bang"" 6amhttp://bit.ly/XUM1NP"
luischataing,"VIDEO 2012/11/26 Trailer ""En el hoyo"" http://t.co/sz8A5GTY"
luischataing,VIDEO 2012/11/26 Entrevista a Jonathan Molly http://t.co/xQCb47aH
luischataing,Cuando la gobernacin otorgue el permiso para presentarme RT @RosendoToro:  buenas tardes amigo cuando va estar si me permiten en Barinas ?
luischataing,"SAN ANTONIO DE LOS ALTOS 1DIC ""Si me permiten"" Colegio Mater Dei - Entradas e informacin en el Colegio Mater Dei."
luischataing,"CIUDAD OJEDA 7DIC ""Si me permiten"" Auditorio Simn Bolvar Entradas: Gran Muralla, Farmapueblo y Boulevard Caf. Inf: 0414.6642661"
luischataing,"Vicente Fernndez dice que entr al quirfano cantando, la operacin se retras 2 horas los mdicos siempre le pedan ""otra! otra! otra!""."
luischataing,"Casco en el codo?, seguro?, no prefieres llevarlo en la cabeza? -----&gt; Seguros La Vitalicia, vital para ti @LaVitaliciaCA"
luischataing,RT @PubliPinSJM: #SiMePermiten el nuevo monologo de @LuisChataing - jueves 13 de diciembre - tasca la fuente +Info-&gt; http://t.co/EsCDGqdb
luischataing,"RT @lagarracreativa: Toda la info de ""Si me permiten"" CIUDAD OJEDA con @LuisChataing Aqui ----&gt; http://t.co/W5LMD3cO ! #VIERNES07DIC"
luischataing,RT @elimpulsocom: Noche de humor y reflexin con Chataing http://t.co/7A0gw7W5
luischataing,"Los venezolanos somos tan buenos en karate que algunos llaneros visten ""likimonos-liqui"" una elegante mezcla de kimonos con liquiliquis."
luischataing,Francia y Venezuela firmaron acuerdos de integracin: Los bebs vienen de Paris y el petrleo desde Venezuela.
luischataing,"Los venezolanos somos buenos en karate, el otro da vi a una seora quebrando 6 bloques de patacones de queso y pernil con la cabeza."
luischataing,Entrate de todo lo que hacen las Molculas Inteligentes de Castrol Magnatec para proteger tu motor en http://t.co/iG41Q1vh
luischataing,En cabina conversamos AL AIRE con @JonathanMoly
luischataing,"RT @Sierra_259: ""ALBA Area Libre de Barrigones de las Americas"" @LuisChataing HAHAHAHAHA"
luischataing,RT @GuillermoARuiz: 7am en Ciudad de Panam. Al trabajo sin mas dilacin! Escuchando De Nuevo En la Maana por @lamega107 @luischataing  ...
luischataing,RT @carlobarrios21: @LuisChataing Se requiere con urgencia donantes de sangre banco d sangre Hosp Enrique tejera valencia pac.Isabel Bolaos
luischataing,Bueeenos das! RT @solecitox17: Sera que hoy @LuisChataing me da los buenos dias? Si? Si? 
luischataing,RT @karla_civil: Buenosss  Daaass  @LuisChataing feliz comienzo de Semana :D saludos desde la bella Ciudad de Mrida.!!! . un gran a ...
luischataing,RT @Infiltrada: @LuisChataing escuchando y disfrutando desde Texas! Saludos
luischataing,RT @lunaamores: Buen dia guapos.. @LuisChataing @GuilleDiaz @MiguelAriasS saludos enorme desde Margarita
luischataing,"RT @osisukyn: @GuilleDiaz @MiguelAriasS @LuisChataing ""...garrote tocuyano suena a nombre de actor porno..."" xD jajaja #cdsm"
luischataing,"RT @lady_lion: para muchos una maana no seria igual sin su caf, para mi no lo seria sin escuchar a @LuisChataing , escuchndote va a  ..."
luischataing,RT @OcantoKarla: Chirichiribangbang ... @LuisChataing buenos diasss dsd bqto! jajajaja que bueno comenzar as la semana 
luischataing,"Buenos das! escucha ""De nuevo en la maana"" EN VIVO de 6am-9am en http://t.co/yqhEaR5I http://t.co/bM6imWtD"
luischataing,"CARACAS Jean Mary abriendo el show ""Si me permiten"" GENIAL! http://t.co/hfcbg0Py"
luischataing,"CARACAS gracias! RT @DJCANGRI19: Muy bueno el monlogo @LuisChataing #siMePermiten , excelentes final con @Ilan_Chester http://t.co/7YjKGwQV"
luischataing,"CARACAS gracias x asistir RT @GaboCarneiro: @LuisChataing primera vez que te veo en vivo, tremendo show !!"
luischataing,CARACAS gracias x asistir RT @OTA_gaby: @LuisChataing estuvo simplemente excelente esta noche
luischataing,CARACAS gracias x asistir! RT @BrendKatt: Excelente @LuisChataing #siMePermiten !!!!!
luischataing,CARACAS bienvenida RT @erikasl: Domingo de Teatroooo con @cmessuti   a reir un rato con @LuisChataing
luischataing,"CARACAS Bienvenida RT @sabribruj: Hoy #SiMePermiten con @LuisChataing en Caracas, q emocin!!!"
luischataing,CARACAS Bienvenidos RT @piquita79: Domingo en familia y con @LuisChataing! Por fin vamos a verte! Si me permiteeeen!
luischataing,CARACAS all nos vemos 6pm RT @oricoro03: @LuisChataing Hoy veremos #siMePermiten en Sta Rosa de Lima en la mejor compaia @yilalesrai13
luischataing,CARACAS all los veo RT @jorgelbc79: @LuisChataing hoy al teatro sta rosa se lima. Si me permiten. Por finnnn consegui entradas!!!
luischataing,"HOY 6pm CARACAS ""Si me permiten"" Teatro Colegio Santa Rosa De Lima. Entradas a la venta http://t.co/PakHwWJd INFO @VayaAlTeatro"
luischataing,"Buenos das! Un caf caliente y mi artculo ""Aqu la chuleta"" publicado el viernes por El Nacional http://t.co/Dea1pl7i"
luischataing,RT @Cori_Gonzalita: @LuisChataing se necesita con URGENCIA Vancomicina 1 mg Metrovax 500 mg Ceftriaxona 1mg para bacteria estomacal
luischataing,"VALENCIA ""Si me permiten"" Colegio Nuestra Seora de Lourdes http://t.co/Olbe5QvV"
luischataing,VALENCIA Colegio Nuestra Seora de Lourdes http://t.co/ENwDHYxl
luischataing,VALENCIA Colegio Nuestra Seora de Lourdes http://t.co/4N3YNNeY
luischataing,RT @Yulecarol: Puedo morir feliz porque vi de cerca demasiado cerca a @LuisChataing y su monologo espectacular!
luischataing,VALENCIA gracias! RT @yic_75: @LuisChataing queee xito! Te disfrute en 1era fila. Eres Grandioso!!! 
luischataing,VALENCIA gracias x asistir RT @JoserynE: Esta Noche no duermo ms bello @LuisChataing te vi BELLO http://t.co/eWLBxD79
