mrdannyglover,Hi Toronto! Joslyn &amp; I will be @TIFF_Net on Dec 1st talking about socially conscious cinema. Tickets are sale today! http://t.co/qJO2kWxT
mrdannyglover,Thanks @EbonyMag for the 100 Power List nod. I'll keep celebrity in my back pocket &amp; continue using it for good :)
mrdannyglover,Congrats President Obama on another 4 years. We need your leadership now more than ever! @BarackObama
mrdannyglover,All men are NOT equal when racism persists in US prison law. PASS #Prop36 in CA! See @DrugWarMovie. Get smart. http://t.co/RlJuemhL
mrdannyglover,"I don't have an ipad, I read Link TV World News online,but just heard they have a new app. Download free: http://t.co/0aoNmFBo @linktvnews"
mrdannyglover,"On location shooting my next film. Link TV World News has kept me informed with their in depth, global coverage on Sandy @linktvnews"
mrdannyglover,"SF &amp; East Bay 'ers, THE HOUSE I LIVE IN opens today in #SF &amp; #Berkeley! See how we can #Endthedrugwar http://t.co/DAO2IXDi"
mrdannyglover,"If you do one thing for America this weekend, See @DrugWarMovie, The House I Live In. In NYC @AngelikaNewYork http://t.co/QhNn9Ge1 RT!"
mrdannyglover,In SF? Head over to Delores Park from 3-5 for a @HeyCookieSF &amp; be GLAD you did! #WorldSmileDay #GetGlad
mrdannyglover,SF: Here's something to smile about. #free cookies for #WorldSmileDay thx to @GladtoGive Follow @HeyCookieSF to track ur treat #GetGlad
mrdannyglover,"Eugene Jarecki's drug war film THE HOUSE I LIVE IN opens NYC on Oct 5
at Angelika and Lincoln Plaza cinemas @DrugWarMovie"
mrdannyglover,Join me Oct 1 in #Harlem at #AaronDavisHall for #HarlemArtsAlliance @haainfo #HarlemArtsSummit 9:30 AM!
mrdannyglover,"I'm speaking @Cornell University's today at 5pm est about Race, Activism &amp; Art. You can watch the live conversation at http://t.co/PHWiTKwH"
mrdannyglover,"If you haven't already, please tune into Real Time with Bill Maher tonight to watch ""The House I Live In"" director Eugene Jarecke."
mrdannyglover,I believe in miracles. Your support can help the Los Angeles Women's Theatre Festival 20th Anniversary!  http://t.co/xsMnebU1 #theatre #LA
mrdannyglover,"CONCERT in San Francisco this Thursday with Vicente Feli, from the Cuban Nueva Trova Movement http://t.co/h7i8bFGr #cuba #concert #sf"
mrdannyglover,THE HOUSE I LIVE IN is the most important film you'll watch this year. #THISistheDrugWar http://t.co/3cBCgWz3 See it on Oct 5.
mrdannyglover,Just heard good news from @UNICEF: Child deaths are down from 12m in 1990 to 6.9m in 2011. But more must be done http://t.co/3ug8UvQj
mrdannyglover,Solidarity: Its the most important word in our vocabulary http://t.co/vG4YjubA #cuba #cuban5 #justice
mrdannyglover,"I'm so very proud to be an Exec Producer on ""The House I Live In"" @DrugWarMovie . This is one every American MUST see. #drugwar #justice"
mrdannyglover,Also here's the trailer: http://t.co/IgGu1u6H
mrdannyglover,When I Saw You will premiere at TIFF and was selected to be the Palestinian Oscar entry. See you in Toronto! http://t.co/HT0VxMWi
mrdannyglover,Progressives &amp; Independents uncertain about voting in November? This is the best argument I've heard on why you need to http://t.co/A2Z5wuEc
mrdannyglover,I support Richmond's Soda Tax. Here's why http://t.co/9eWHEZ09
mrdannyglover,Will be at @TIFF_NET to remember the legacy of casting legend Marion Dougherty. Join me on Sept 10th! http://t.co/wU5PfAVy
mrdannyglover,World Humanitarian Day is coming up. See what you can do: http://t.co/cnxpel8Z #WHD2012 @UNICEF
mrdannyglover,Just learned about this follow Friday stuff. Follow my good friend @repkarenbass #ff
mrdannyglover,Speaking in DC tonight with Joe Madison @BlackEaglePower about the importance of the black vote &amp; how to fight these voter suppression laws
mrdannyglover,"Join me in supporting a new project on the world's food crisis, by @_RajPatel &amp; Steve James (Hoop Dreams): http://t.co/ghMj12K4 RT!"
mrdannyglover,Become a citizen reporter at the 2012 #DNC &amp; #RNC for @linktv ALL EXPENSES PAID! Report on money in politics. Details: http://t.co/KHnDu0Jb
mrdannyglover,"Madiba, dear brother. Happy 94th birthday!"
mrdannyglover,New video I did with fellow actor Peter Coyote on the Cuban 5. http://t.co/NntT4XaA Also visit http://t.co/j8aL2d1l
mrdannyglover,"I'll be on CNN's ""Starting Point"" with Soledad O'brien and SHENANDOAH director David Turnley @DTurnley this Wed July 11th, 7am-9am"
mrdannyglover,Check out the new website for Shenandoah film! http://t.co/9ZVZc7tq
mrdannyglover,"Met with janitors on strike in #Houston yesterday, members of @SEIU Local 1. They can't support a family on $9,000/year http://t.co/Rf0UfGff"
mrdannyglover,"The next frontier is in sharing, evolving &amp; growing! #unions #community"
mrdannyglover,Last April I spoke @UAW Conference in Nashville.  Here's the video from my speech http://t.co/QAHsouNf
mrdannyglover,This great doc film @findingMabel needs your help with finishing funds! Please support &amp; RT! http://t.co/2qiBEjOj
mrdannyglover,"Some Govs are helping their poorest children much better, without having more to spend. Which ones? Find out 29 May #ReportCard10"
mrdannyglover,Thank you all for your nice comments and likes on my new facebook page!
mrdannyglover,I'm finally on Facebook! The first fan to like my page gets a pair of movie tickets!  http://t.co/f3DSo9Fe
mrdannyglover,"SPECIAL SHOUT OUT TO BILL HORBERG FOR SUPPORTING @HIGHWAYfilm
BY NEPALI FILMMAKER DEEPAK RAUNIYAR!"
mrdannyglover,SPECIAL SHOUT OUT TO JOAN PARKER FOR SUPPORTING @HIGHWAYfilm BY NEPALI FILMMAKER DEEPAK RAUNIYAR !
mrdannyglover,VERY SPECIAL SHOUT OUT TO SUSAN JOHN FOR SUPPORTING @HIGHWAYfilm BY NEPALI FILMMAKER DEEPAK RAUNIYAR !
mrdannyglover,SPECIAL SHOUT OUT TO HAKIM DYER FOR SUPPORTING @HIGHWAYfilm BY NEPALI FILMMAKER DEEPAK RAUNIYAR !
mrdannyglover,"SPECIAL SHOUT OUT TO CAROLINE SENGUPTA FOR SUPPORTING @HIGHWAYfilm
BY NEPALI FILMMAKER DEEPAK RAUNIYAR !"
mrdannyglover,SPECIAL SHOUT OUT TO AMRIT ADHIKARI FOR SUPPORTING @HIGHWAYfilm BY NEPALI FILMMAKER DEEPAK RAUNIYAR !
mrdannyglover,"SPECIAL SHOUT OUT TO DUBBY BHAGAT FOR SUPPORTING @HIGHWAYfilm
BY NEPALI FILMMAKER DEEPAK RAUNIYAR !"
mrdannyglover,SPECIAL SHOUT OUT TO GENEVIEVE BEGKOYIAN FOR SUPPORTING #HIGHWAY BY NEPALI FILMMAKER DEEPAK RAUNIYAR !
mrdannyglover,"SPECIAL SHOUT OUT TO CHRISTINA THORSEN FOR SUPPORTING @HIGHWAYfilm
BY NEPALI FILMMAKER DEEPAK RAUNIYAR !"
mrdannyglover,What's your best #Highway story? Tweet a pic or video
mrdannyglover,"#HIGHWAY film, coming soon! Check out the new teaser, let me know what you think http://t.co/i4o9wp8p"
mrdannyglover,"SPECIAL SHOUT OUT TO SAGUN RAYAMAJHI FOR SUPPORTING #HIGHWAY
BY NEPALI FILMMAKER DEEPAK RAUNIYAR!"
mrdannyglover,"SPECIAL SHOUT OUT TO NALINI NARAYAN FOR SUPPORTING #HIGHWAY
BY NEPALI FILMMAKER DEEPAK RAUNIYAR !"
mrdannyglover,"SPECIAL SHOUT OUT TO PAWAN DULAL FOR SUPPORTING #HIGHWAY
BY NEPALI FILMMAKER DEEPAK RAUNIYAR !"
mrdannyglover,"SPECIAL SHOUT OUT TO TSERING SHERPA FOR SUPPORTING #HIGHWAY
BY NEPALI FILMMAKER DEEPAK RAUNIYAR!"
mrdannyglover,"SPECIAL SHOUT OUT TO SERGIO NAVARETTA FOR SUPPORTING #HIGHWAY
BY NEPALI FILMMAKER DEEPAK RAUNIYAR !"
mrdannyglover,Engagement of the international community regarding the Afro-Brazilian struggle for equality is more necessary than ever! #CotasSim
mrdannyglover,The historical debt of the Brazilian state towards the Afro-Brazilian community should be addressed. #CotasSim!
mrdannyglover,Mobilize to defend racial quotas in Brazil universities. Use ur voice in today's Twitter-action btwn 10am and 3pm w/ the hashtag #CotasSim
mrdannyglover,Today Apr 25 Brazilian Supreme Court determines constitutionality of #AffirmativeAction Access to Higher Education.We cant accept a reversal
mrdannyglover,"@MumiaAbuJamal: Happy Birthday brother, we will continue the fight for you. Thank you @democracynow for connecting us this morning!"
mrdannyglover,On Democracy Now! today. Watch my live interview @democracynow http://t.co/n3S7btOO  RT!
mrdannyglover,Passionate #documentary #filmmakers apply now! @C4BRITDOC http://t.co/KaQ2qitO
mrdannyglover,Did you hear the news? I'll be on this year's jury for the PUMA.Creative Impact Award http://t.co/f2l9tPRZ
mrdannyglover,"SPECIAL SHOUT OUT TO JUSTIN LIPMAN FOR SUPPORTING #HIGHWAY
BY NEPALI FILMMAKER DEEPAK RAUNIYAR!"
mrdannyglover,"SPECIAL SHOUT OUT TO JITENDRA RAUT FOR SUPPORTING #HIGHWAY
BY NEPALI FILMMAKER DEEPAK RAUNIYAR!"
mrdannyglover,"SPECIAL SHOUT OUT TO CHANDRA KHATIWADA FOR SUPPORTING #HIGHWAY
BY NEPALI FILMMAKER DEEPAK RAUNIYAR!"
mrdannyglover,VERY SPECIAL SHOUT OUT TO CRAIG ALLEN CONOLEY FOR SUPPORTING #HIGHWAY BY NEPALI FILMMAKER DEEPAK RAUNIYAR !
mrdannyglover,@freethefive_us Obama...Give me five! Join us in DC Friday.  Here's a fun video I did on the case http://t.co/SH1Q6KwQ
mrdannyglover,VERY SPECIAL SHOUT OUT TO SUSAN JOHN FOR SUPPORTING #HIGHWAY BY NEPALI FILMMAKER DEEPAK RAUNIYAR !
mrdannyglover,Here with #Walmart associates and warehouse workers. They deserve respect! @changewalmart @ForRespect http://t.co/HbfzfRTl
mrdannyglover,"Just touched down in LA, on my way to support #Walmart #union workers http://t.co/O3luAfzo"
mrdannyglover,VERY SPECIAL SHOUT OUT TO BRAD DRURY FOR SUPPORTING #HIGHWAY BY NEPALI FILMMAKER DEEPAK RAUNIYAR !
mrdannyglover,VERY SPECIAL SHOUT OUT TO INJI ISLAM FOR SUPPORTING #HIGHWAY BY NEPALI FILMMAKER DEEPAK RAUNIYAR !
mrdannyglover,I'll be on Africa Now! tmrw morning 4/18 at 11am EST w/ @TransAfrica 's Mwiza Munthali.  Listen live at http://t.co/kFvpLZui
mrdannyglover,VERY SPECIAL SHOUT OUT TO MAAIKE VAN LEIJEN FOR SUPPORTING #HIGHWAY BY NEPALI FILMMAKER DEEPAK RAUNIYAR !
mrdannyglover,"Popular literature and culture used to reflect peoples aspirations, pain, and passion. That's why I have #IndieFilmLove"
mrdannyglover,VERY SPECIAL SHOUT OUT TO DEBORAH BURTON FOR SUPPORTING #HIGHWAY BY NEPALI FILMMAKER DEEPAK RAUNIYAR !
mrdannyglover,VERY SPECIAL THANKS TO SUDEEP PANDEY FOR GENEROUS SUPPORT TO #HIGHWAY BY NEPALI FILMMAKER DEEPAK RAUNIYAR !
mrdannyglover,VERY SPECIAL THANKS TO FEDERICO BAUDER FOR GENEROUS SUPPORT TO #HIGHWAY BY NEPALI FILMMAKER DEEPAK RAUNIYAR !
mrdannyglover,"With @harrybelafonte, Yasin Bey + more. We'll be discussing new ideas about criminal justice reform http://t.co/obPYcEI1"
mrdannyglover,Speaking tonight at Center for Nu Leadership on Urban Solutions Fundraiser in NYC
mrdannyglover,VERY SPECIAL THANKS TO MICHELLE GERWIN CARLSON FOR GENEROUS SUPPORT TO #HIGHWAY BY NEPALI FILMMAKER DEEPAK RAUNIYAR !
mrdannyglover,VERY SPECIAL THANKS TO SARMILA FOR GENEROUS SUPPORT TO #HIGHWAY BY NEPALI FILMMAKER DEEPAK RAUNIYAR !
mrdannyglover,VERY SPECIAL THANKS TO GEARY MCLEOD FOR GENEROUS SUPPORT TO #HIGHWAY BY NEPALI FILMMAKER DEEPAK RAUNIYAR !
mrdannyglover,VERY SPECIAL THANKS TO CHARLES HAVILAND FOR GENEROUS SUPPORT TO #HIGHWAY BY NEPALI FILMMAKER DEEPAK RAUNIYAR !
mrdannyglover,VERY SPECIAL THANKS TO JULIA MORGAN FOR GENEROUS SUPPORT TO #HIGHWAY BY NEPALI FILMMAKER DEEPAK RAUNIYAR !
mrdannyglover,First day on the bench for #HBO's Muhammad Ali film. Excited to work with fellow acting vets & director Stephen Frears http://t.co/AYKvTPB2
mrdannyglover,"Many natural #disasters strike instantly & without warning. The #Sahel crisis is different, its predictable & preventable. #SahelNOW RT!"
mrdannyglover,It costs around $100 to save a child from chronic #malnutrition. Want to learn about ways to help? http://t.co/03cvwP1W #SahelNOW
mrdannyglover,In Toronto this weekend? Check out @McKinleyMovie - playing at Bloor Cinema! http://t.co/lHjzyUEm
mrdannyglover,Don't forget to tune in tonight for the world premiere of TOUCH at 9/8c on FOX
mrdannyglover,They were protesting #Sudan blocking food and aid to half a million people.  Please Follow her!! #ff
mrdannyglover,President @nicoleclee of @Transafrica was arrested w/ George Clooney &amp; others.
mrdannyglover,"Until then, here's a little behind the scenes clip.   http://t.co/GRMQZJXB"
mrdannyglover,Thanks for all the wonderful messages regarding @TOUCHonTV.  Please tune in for the series premiere on March 22nd.
mrdannyglover,Happy Intl Womens Day! Women are the pillars of our communities & societies. How will you celebrate with @TransAfrica? http://t.co/EikfNanM
mrdannyglover,"Mother-to-child HIV transmission falling. Yet 1,000 babies infected daily in 2010. See my essay for #SOWC2012 @UNICEF http://t.co/Wxfzeqxn"
mrdannyglover,"Awesome video @RadaFilmGroup made for their Kickstarter campaign. Check it out, learn more & lend your support Americanpromise"
mrdannyglover,My new film #DonovansEcho opens today across Canada.  Find the theatre closest to you at: http://t.co/EZGu763a
mrdannyglover,@techn9ne It was great meeting you as well. I look forward to hearing your work with #The Doors. Saw them back in the day in Haight-Ashbury.
mrdannyglover,Senate is moving to approve Keystone XL. We have 24 Hours to stop them. Sign on here:http://t.co/Jr9ycZJD
mrdannyglover,"Join our mailing list @TransAfrica today at http://t.co/YxqE1NTP to stay informed of news, activism and events in #Africa and the #Diaspora!"
mrdannyglover,"Tim Kring, Creator of the new Fox series ""Touch"" http://t.co/LCjTvizq"
mrdannyglover,Obama I'm asking you for a real humanitarian gesture http://t.co/pPUXfcLW
mrdannyglover,More Pix http://t.co/FJQSVUva
mrdannyglover,"On the set of ""Touch"", with Kiefer Sutherland, Gugu Mabatha-Raw, Tim Kring. http://t.co/L6sgB8RB"
mrdannyglover,Tomorrow marks the first observation Carter G. Woodsons Negro History Week in 1926. Its more than a week or a month.
mrdannyglover,The well-being of millions of children is at stake. Check out UNICEF's Humanitarian Action for Children 2012 Report http://t.co/ZTY9XQCY
mrdannyglover,Happy Black History Month. Support @TransAfrica all year as we build bridges between #Africa and her #Diaspora! http://t.co/EikfNanM
mrdannyglover,"Sundance Grand Prize-winning Filmmakers of ""The House I Live In"" Respond...: http://t.co/BjDsCXM0 via @youtube"
mrdannyglover,Thought I would share....http://www.youtube.com/watch?v=p4eMZhubWFM
mrdannyglover,"""The House I Live In"" won documentary Grand Jury at Sundance.  Very proud producer and proud of director Eugene Jarecki and his film team."
mrdannyglover,"http://t.co/w1puOeym - Charles Dutton, Sheldon Candis, me and Sammi Rotibi"
mrdannyglover,"RT @LittleElana: @mrdannyglover Hey Danny, how about a Happy Birthday retweet for my 21st birthday today?!? I'm a big fan, it'd mean the ..."
mrdannyglover,@MrLipsey Thank you.
mrdannyglover,http://t.co/w1puOeym
mrdannyglover,http://t.co/62jVdGRL
mrdannyglover,http://t.co/Px6DYlCJ
mrdannyglover,Sundance 2012 with cast of LUV http://t.co/fYWS3IS7
mrdannyglover,"Had a great time at Sundance with my amazing co-stars of LUV, director Sheldon Candis and our crew.""  Thanks to everyone that came to watch."
mrdannyglover,"Two years later, help TransAfrica help Haiti http://t.co/RFqEHmoV @transafrica"
mrdannyglover,Hope to see you all @the8Factors Cash & People event in Berkeley on Jan 12th Ill be there!! http://t.co/DtmtfjKS
mrdannyglover,"Happy New year 2012 to all my friends and fans.   Let's make 2012 the best, by getting out and making a difference."
mrdannyglover,@johnl218 How is 2012 treating you so far.
mrdannyglover,"Please RT: @TransAfrica is a megaphone for the world's 99% & they need your support, please consider donating $10/month http://t.co/rvZjYosJ"
mrdannyglover,Giving thanks for another year of activism and #TransAfrican leadership with @TransAfrica. Support us today http://t.co/NaQJDJpT
mrdannyglover,Make a difference before the end of 2011! I need 9900 followers to make a pledge of $10/month to @TransAfrica in 2012! http://t.co/rvZjYosJ
mrdannyglover,Commemorate your holidays and support #dignity and #humanrights: donate to @TransAfrica todayhttp://transafrica.org/donate
mrdannyglover,"Would you give up two lattes a month for #justice for the #African World? Make a $10 monthly pledge to @TransAfrica!http://bit.ly/ueo0rr """
mrdannyglover,"RT @angleesoup: Favorite CD 2011.  @diegogarcianyc Laura, @elbowoffical Build a Rocket Boys, @jessiejoffical Who You Are and @littledrag ..."
mrdannyglover,and adding work for the community.  To donate go to http://t.co/xrKat1kP
mrdannyglover,"Great job to UNCEF and Lawrence O'Donnell of MSNBC, for their work with the KIND Fund, providing desk to kids in Malawi..."
mrdannyglover,"No more sharing. You know who you are! Buy your own. http://t.co/vtiHzZbt
  http://t.co/wXl4LSiZ"
mrdannyglover,RT @bigferno: @mrdannyglover 39 weeks pregnant and my do those cookies sound fantastic. Can you ship them to Scotland?!
mrdannyglover,RT @daniela_ziri: how did i not know @mrdannyglover was on twitter until 2 minutes ago? i LOVE him
mrdannyglover,Sitting on set with Kiefer Sutherland eating butter pecan chocolate chip cookies from Karen's Country Cakes & Pies. Addictive!
mrdannyglover,Looking for a good #Christmas gift? The #BlackPowerMixtape 1967 - 1975 New On DVD today! Buy for your loved ones: http://t.co/AR0ZRYc6
mrdannyglover,"I'm speaking this Sat 12/3 2pm at Everett&Jones #Oakland w/ @BootsRiley Free event, come help us raise $$ for the #HaitiEmergencyReliefFund!"
mrdannyglover,Video of my recent visit to #Colombia with @UNICEF http://t.co/vw6LHWGK met extraordinary folks helping to stop sex exploitation of kids
mrdannyglover,3 more days to contribute to #GraceLeeBoggs film!  http://t.co/CCU41OAa
mrdannyglover,"I support this to-be-made film by @15Feb2003, crowdfunding via Kickstarter http://t.co/PbHCEBIX. Pledge $1, together we can do it. Pls RT"
mrdannyglover,http://t.co/Nqn1Bixw
mrdannyglover,http://t.co/mPOZjIj3
mrdannyglover,Travelled to Colombia with @UNICEF to meet exceptional children trying to break the cycle of violence + promote pe http://t.co/iKpwALvf
mrdannyglover,"5 days left &amp; $6,000 short to meet our Kickstarter goal for HIGHWAY. Please pledge now at http://t.co/hbEN9yiG Thnk u new supporters!"
mrdannyglover,"7 days left to raise $9,000! Donate to our Kickstarter campgn for HIGHWAY by @deepakrauniyar http://t.co/hbEN9yiG 139 backers, we need more!"
mrdannyglover,"Did you know #BlackPowerMixtape is still in theaters?? See it for motivation, then go down to your local #ows !"
mrdannyglover,I ask 4 ur help! Let ur friends&family know about HIGHWAY. We don't get funded if we dont make our goal! 12daysleft http://t.co/hbEN9yiG
mrdannyglover,"I love @LinkTV&#39;s new #ows info hub at http://t.co/6t3DRJd6 diverse voices, the latest news, and my speech from #OccupyOakland"
mrdannyglover,I Am #TransAfrican is about bridging the gap and building power of #Afro-Descendants and our allies. join us today at http://t.co/jBFcYxDP!
mrdannyglover,@TransAfrica is launching our PSA Celebrate with @CENTRICTV & @BET tell us why you are #TransAfrican and join us! http://t.co/QDlB0KyF
mrdannyglover,"18 Days left to reach our $30,000 goal! Help us complete our new film HIGHWAY by Deepak Rauniyar. It's all or nothing! http://t.co/hbEN9yiG"
mrdannyglover,@AcksonM No one is too old to learn something new.
mrdannyglover,Listening to the guys at Microsoft talking about making products that put people first. I am all for that!
mrdannyglover,Wonderful time last night. After an early interview w/ Tony B. I am headed to Microsoft to learn about some of their newest ideas.
mrdannyglover,"Today was a great day.  Learned lots, meet great people and enjoyed wonderful food at Amore Infused, Thanks Sean. http://t.co/7Lmfd25D"
mrdannyglover,@mama_giggles Remember it all starts with dialogue and exchange.
mrdannyglover,@mama_giggles Thank you for engaging!
mrdannyglover,Thanks to the NW African American Museum and Black Past. Org.  For the great job hosting the screening of BPM. http://t.co/hmhCctXI
mrdannyglover,Wonderful experience with the students and staff of The Technology access Foundation and Wa. STEM.  imagination and creativity in education.
mrdannyglover,"In Seattle Oct 11 Visiting, Tech. Access Foundation and WA. STEM.   Learning how Technology can improve education and social justice."
mrdannyglover,"@RezinaH As a young person and college student, your generation has the charge of  moving the agenda forward.  See you Tuesday 6:30 @ NAAM."
mrdannyglover,"@mama_giggles Well put, thanks for sharing your thoughts.  I will see you Tuesday night at the N.W. African American Museum.  Thank You"
mrdannyglover,"Thanks to the University of Wash. Black Student Union for the getting the word out for ""The Black Power Mixtape"" Opens at the Varsity Oct 14"
mrdannyglover,"In Seattle Oct 11-12. Will pre-screen Black Power Mixtape, Visit Microsoft, NW AA Museum, WA Stem, Intellectual Ventures.  More info to fllw"
mrdannyglover,"RT @tavissmiley: Actor/producer @MrDannyGlover discusses new documentary ""The Black Power Mixtape 1967-1975,"" tonight @PBS. http://ow.ly ..."
mrdannyglover,Can't wait to be inspired when I host @Elfenworks In Harmony with Hope Awards on 9/20. Preview the winners here http://t.co/lvcrBfBO
mrdannyglover,"Please come join me and the filmmakers of ""The Black Power Mixtape 1967-1975"" this evening in NYC.  Tickets are available at ifccenter.com."
mrdannyglover,"Be a part of the new doc ""American Revolutionary""! Check out the new IndieGoGo campaign!
www.indiegogo.com/American-Revolutionary"
mrdannyglover,Check out the new trailer for THE BLACK POWER MIXTAPE 1967-1975 & become a fan on Facebook! http://t.co/ldxMa8z In theaters starting 9.9!
mrdannyglover,@UNICEF The #HornofAfrica: A full blown catastrophe...this is what it looks like - http://t.co/YyakpF3 #Kenya #Somalia
mrdannyglover,"Please tune into TNT tonight for the episode of ""Leverage"" that I guest star in.  And let me know what you think after the show."
mrdannyglover,"RT @leverageTNT: @mrdannyglover, WWII & a missing Van Gogh painting add up to #Leverage romance! Photos: http://tw.tnt.tv/LiC"
mrdannyglover,"If you are a musician, please follow my former assistant @angleesoup.  She now places songs in movies and looks for composers for films."
mrdannyglover,Over 2 million children in drought-stricken Horn of Africa are starving.  To help visit - http://t.co/v8ItkL2 #drought #foodcrisis @UNICEF
mrdannyglover,Leonard Peltier in the hole at USP-Lewisburg Demand his return! Call/E Thomas Kane info@bop.gov (202) 307-3198 ref Leonard Peltier 89637-132
mrdannyglover,Filmmakers investigate what it takes #ToEducateAGirl in the world. Watch premiere this week at #ViewChange and @LinkTV http://t.co/7fJK6sP
mrdannyglover,ViewChange.org and @LinkTV premier a new @SaveTheChildren documentary on global mothers -- watch online. #momsindex201 http://bit.ly/cZiHT1
mrdannyglover,"Go see my latest production @dummaarodum in theaters today! http://dummaarodum.com/ for USA, INDIA, & UK theater listings"
mrdannyglover,"Vote for finalist ""Anya R"" 2b spokesperson for Seventeen Magazines Got Milk campaign! Voting ends today http://www.myyearbook.com/powerof9"
mrdannyglover,"Support the new documentary ""American Revolutionary"" on Detroit-based activist Grace Lee Boggs! www.indiegogo.com/americanrevolutionary"
mrdannyglover,It's been an honor to help return #Aristide home to #Haiti. Special thanks to @transafrica & Amy Goodman for all your hard work. Viv Ayiti!
mrdannyglover,"For the latest updates from the Middle East watch @LinkTV's special coverage on DIRECTV 375, DISH 9410 and online at http://linktv.org"
mrdannyglover,"RT @martinejoelle: RT @democracynow ""The Black Power Mixtape"" @MrDannyGlover on new doc w/ rare archival footage of Black Power movement ..."
mrdannyglover,"@UNICEF supported care center, Haitian youths use hip-hop to inspire the process of rebuilding their country http://t.co/iR1rtut"
mrdannyglover,UNICEF Executive Director Anthony Lake and Desmond Tutu discuss how a generation born free of HIV Aids is within reach http://bit.ly/el0D79
mrdannyglover,"http://ViewChange.org awards $25,000 Grand Prize to film about a Kenyan woman opening the first primary school for girls in her village."
mrdannyglover,"TONITE: @Jason_Pollock's film, THE YOUNGEST CANDIDATE is on @Doc_Channel 8pm ET/PT - SET YOUR DVR's! http://bit.ly/9IfE3q"
mrdannyglover,Great visit to @unicef peru to learn about the situation of children & to support the Buena Onda campaign. Left with many many good vibes
mrdannyglover,"Just had potato, wheat + OJ power drink. A full meal in a cup kids under 4 enjoy @UNICEF supported daycare in Peru-delicious+nutritious"
mrdannyglover,Just back from the amazon. 3 hr boat ride @unicef peru educating hard to reach children in their native shipibo language.  Impressive
mrdannyglover,Footage from my Tallahassee empowerment seminar.  http://twurl.nl/2f2vwn
mrdannyglover,"SALT OF THIS SEA playing to sell-out crowds at Quad Cinema in NY... Come see Tony winning actress Suheir Hammad tonight for Q&A!"""
mrdannyglover,RT @angleesoup: Small city diner helps out a long time customer with cancer. http://www.5050diner.com/charity_calendar.html
mrdannyglover,"I will be at 1750 Scenicview Ct, San Leandro, CA  94577 tomorrow (thurs) from 7:30-9pm for another business opportunity.  Please come join."
mrdannyglover,"7pm tonight at the Ramada Inn, 3310 Troup Hwy, Tyler, Tx"
mrdannyglover,"I will be doing a business opportunity meeting tonight with Rochelle Saulsbury. Ramada Inn, 3310 Troup Hwy, Tyler Tx.  75701.  Come join us."
mrdannyglover,Please come support SALT OF THIS SEA! Screenings are going great!  Suheir Hammad will appear for Q&A Thursday evening at Quad cinema in NY!!
mrdannyglover,SALT OF THIS SEA playing to sell-out crowds at Quad Cinema in NY... Please come see Tony winning actress Suheir Hammad at Wed Q&A this week.
