notebook,"Studies show most women lie about this to men, do you? http://t.co/VRnZyenK"
notebook,These celebrities posed nude when they were pregnant! What do you think of the photos? http://t.co/qxBwjADc
notebook,"Sometimes, when the phone rings and its from you... I still get butterflies."
notebook,I wanna be the girl he can tell anything to.
notebook,"RT @FemaleEnglish: ""It's so cute when you write on your boyfriend's wall and tell him how much you love him,"" - said nobody ever."
notebook,RT @FemaleEnglish: Baseball pants to girls is like yoga pants to guys.
notebook,RT @FemaleEnglish: Hate being fat. Love eating food.
notebook,I love that we have so much in common :) http://t.co/bDwOqqEh
notebook,Lust is two hearts with one thing in mind; love is two minds with each other's best interest at heart.
notebook,Lust is just to get; Love is all we give.
notebook,"Feel free to argue as long as you will kiss and make up, but remind me as often as needed that you LOVE this."
notebook,"When I don't answer for a long time, reassure me that everything is okay."
notebook,"When I say that I like you, I really do more than you could understand."
notebook,"When I bump into you, bump into me back and make me laugh."
notebook,"When I look at you in your eyes, don't look away until I do."
notebook,Love &amp; Basketball is one of my favorite movies! Almost as much as The Notebook ;)
notebook,The positive energy from these tweets are amazing!!! ~~ @PsychicsUnivers ~~ is friggin awesome and helps you understand your purpose!
notebook,RT @PsychicsUnivers: Give the world the best you have and the best will come back to you. - Madeline Bridges
notebook,RT @PsychicsUnivers: Let our faith be bigger than your fear.
notebook,RT @PsychicsUnivers: You are enough. You do enough. You have enough.
notebook,I can't imagine living a happy life without you being a part of it.
notebook,I love how our hands fit perfectly together. http://t.co/030RpUTt
notebook,"When you smile at me, i can't help but feel loved."
notebook,"Nobody ever should feel inferior! We are all beautiful and unique, we are all  special and equal. Follow @bullyville if you support this!"
notebook,"RT @bullyville: ""Promise me you'll always remember that you're braver than you believe, stronger than you seem, &amp; smarter than you t ..."
notebook,I am in love with you.
notebook,Why would you put this bumper sticker on your car -sp- http://t.co/7Y0kCcRN
notebook,He's the guy who I'm falling in love with and he's the guy who I know is going to catch me.
notebook,"A relationship is like a house. When a lightbulb burns out you do not go and buy a new house, you fix the light bulb."
notebook,"Don't cry because it's over, smile because it happened."
notebook,"Women come in all shapes and sizes and are ALL beautiful! Lots of respect for the women in these pics, beautiful! http://t.co/VFH78iPk"
notebook,#God. [follow me on Instagram: NotebookLove] http://t.co/tVSx6JeH
notebook,I love rainy days with you. http://t.co/lpbh5yF2
notebook,"I can't promise that you'll fall in love with me, but I can promise you that its not going to be a waste of your time."
notebook,"Trials in life are not meant to make us fail, but to see how far we can fly."
notebook,You know that one dream you keep having? Here's what it means http://t.co/50pC39oi
notebook,I want to be the only hand you ever need to hold.
notebook,"Truth, love, and being real. [FOLLOW on Instagram! NotebookLove] http://t.co/SKj5YxoA"
notebook,In love with the tweets from @sogirlslove! You should def follow them for some inspiring words on relationships and love! &lt;3
notebook,"RT @sogirlslove: #Love is like two #people pulling a rubber band. If one let it go, it hurts so much on who held on."
notebook,"RT @sogirlslove: Realize, #appreciate and be #grateful for the very #essence of your existence!"
notebook,I bet that you have NO IDEA that all my quotes are created while thinking about you.
notebook,Home could be anywhere when I am holding you.
notebook,Sex + men http://t.co/1uHqipQV
notebook,Love is only a word until someone comes around and gives it a meaning.
notebook,"I want to go to sleep at night, wake up every day, and breathe knowing you are truly mine."
notebook,"Your hair color says a LOT about you as a woman, see what your hair color means http://t.co/IBJ4jyTM"
notebook,"No matter what I do, I always forget to forget you."
notebook,"You make me smile, for now... that's more than enough."
notebook,RT @FlTNESS: Getting the ideal abs... complete with photos to get you pumped http://t.co/JvbXKr6w
notebook,Any woman would flirt with you as long as she perceives you as harmless.
notebook,Men and great sex http://t.co/30ouU1sc
notebook,Having a broken heart is a good sign. It means you've tried for something.
notebook,Your zodiac sign can determine what type of sex you prefer! See what your sign means: http://t.co/RBKBqEjg
notebook,Someone who truly loves you will chase after you no matter what.
notebook,'I love you' means that I will love you and stand by you even through the worst of times.
notebook,These celebs have some SEXY instagram pics! http://t.co/FUpeYYdF
notebook,A relationship of sharing is the heart of loving.
notebook,Love is the only option that is always available to you.
notebook,Your zodiac sign can determine what type of sex you prefer! See what your sign means http://t.co/RBKBqEjg
notebook,I'll never be able to end my explanation. There are far more things that I love about you than you think.
notebook,"Even though I see you all the time, I still get butterflies every time you look my way."
notebook,I'd rather have someone who shows they care than someone who just says it.
notebook,This is how attraction works http://t.co/flI4Vw4O
notebook,"RT @FemaleEnglish: ""Wanna do me a favor?"" = You are going to do me this favor. #femaletranslations"
notebook,"RT @FemaleEnglish: ""Who is she?"" = I'm going to hunt her down. #femaletranslations"
notebook,"RT @FemaleEnglish: ""Why do you hate me"" = Tell me you love me #femaletranslations"
notebook,Soulmate is that one person that knows you better than anyone else.
notebook,"When you think you're not happy with your life, always think that someone is happy simply because you exist."
notebook,"Fight bullying, fight suicide. Everyone should be equal, follow @bullyville to grow recognition! Nobody should ever feel inferior."
notebook,RT @bullyville: To anyone who has dealt with suicidal thoughts this past year; I'm glad you're still here.  #bullyville #stopteensuicide
notebook,Making someone laugh when they're feeling down is one of the best feelings in the world.
notebook,You never know how much you really love someone until you watch them love someone else.
notebook,These cars on @Automotive are beautiful! Want!
notebook,RT @Automotive: Rolls Royce Phantom in beautiful burgundy http://t.co/xL7RMsGi
notebook,RT @Automotive: Ferrari 458 Italia http://t.co/4LTNNpMY
notebook,Don't give up just because of what people said. Use that as your motivation to push harder.
notebook,You shouldn't be afraid of losing the one you love if you know you are treating them right.
notebook,Here's what causes people to be attractive to others http://t.co/flI4Vw4O
notebook,Im still and always in love with the person you used to be.
notebook,"Love me or leave me alone, ain't no in between."
notebook,RT @FlTNESS: Healthy males and sexual performance http://t.co/dLBOrQkG
notebook,Your eye color actually affects your personality. Here's what each color means http://t.co/q4EFX2vN
notebook,"Trust me when I say I love you, because I will always mean it."
notebook,Be nice. It makes things so much easier most of the time.
notebook,"You know you're in love when that person keeps hurting you, but you keep forgiving them and hoping they will change."
notebook,"Two people are connected at heart, it doesn't matter what you do, there are no boundaries or barriers if they are destined to be together."
notebook,"There comes a point when you just love someone, not because they're good, bad, or anything really. You just love them the way they are.."
notebook,You love someone. It doesn't mean you'll be together forever. It doesn't mean you won't hurt each other. It just mean you love them.
notebook,"Your smile is contagious, no matter how angry or sad I am, all I need is to take one look at your smile and everything seem a little better."
notebook,"A relationship with no trust is like a car with no gas. You can stay in it, but it won't go anywhere."
notebook,"As long as we can see the same sky, breathe the same air, step on the same planet, then you and I are not impossible."
notebook,Anniversary weekend  http://t.co/sc2CoYCY
notebook,"Fall in love with someone that deserves your heart, not someone who plays with it."
notebook,"Everytime I think of you, I get the biggest smile on my face and you still don't understand how much you mean to me."
notebook,How can you not notice me when my heart is so obviously screaming your name?
notebook,My youngest and I going to dinner last night :) http://t.co/c79g6EmQ
notebook,Men &amp; sex http://t.co/f5jtDGLr
notebook,"RT @Life_Fountain: ""No #man is a #failure who is enjoying life."" - William Feather"
notebook,Love is why I came here in the first place.
notebook,"When a girl says that she can't live without you, she has made up her mind that you are her future."
notebook,"There are only two times that I want to be with you, now and forever."
notebook,"I want a boyfriend that loves me as I am, but somehow still inspires me to be a better person."
notebook,A little info about MEN and SEX http://t.co/f5jtDGLr
notebook,I'm lucky to have fallen in love with you. You've changed my life more than i could have asked for.
notebook,Love &amp; Peace (Instagram: NotebookLove) http://t.co/Hi2rmMxd
notebook,"Very true words from @Life_Fountain :) they are one of my favorite follows! If you like positive and uplifting words, follow them!"
notebook,"RT @Life_Fountain: ""Beware the fury of a patient man."" - John Dryden"
notebook,"Love the blessings from God, especially if it's raining on someone else."
notebook,Everyone that wants resources on dealing with cheaters and how to avoid them should follow @CheaterVille now. #CheatingIsWrong
notebook,"RT @CheaterVille: When your ex says, ""You will never find anyone like me"", you say ""Well isn't that the point?"""
notebook,"If you want to be trusted, be honest. If you want to be honest, be true. If you want be true, be yourself."
notebook,Follow me on Instagram: NotebookLove
notebook,I don't think you realize how easily you make me smile.
notebook,I promise to stay if you promise to never leave.
notebook,The best relationships usually begin unexpectedly.
notebook,"When two people are meant for each other, nothing can keep them apart."
notebook,"A woman's heart is not a toy. Anyone who treats it as such is not a man, but a boy."
notebook,"Be yourself, there's no one better at it in the entire world."
notebook,"The last thing I want to be is ""just friends"" because I don't wanna look into your eyes everyday and see a miracle I can't have."
notebook,Love waits for one thing... the right moment.
notebook,Lets get creative and help #HurricaneSandy victims! Please R-T ;) http://t.co/eQSeSUcj
notebook,"When you accept somebody, you accept their past too. Don't hold it against them later."
notebook,There will always that one person in your life who is an exception to all your rules no matter what they do.
notebook,"I don't need a perfect relationship, I just need someone who won't give up on me."
notebook,"In a long lasting relationship, honesty and trust must exist."
notebook,"Believe, hope, and pray for love, but don't put your life on hold waiting for love."
notebook,"RT @FemaleEnglish: Fine, Ill just do it myself = You better get off your ass and do this before I do it or else you're in big troubl ..."
notebook,"RT @FemaleEnglish: ""Maybe"" = No. #femaletranslations"
notebook,"RT @FemaleEnglish: ""Oh my god those shoes are gorgeous"" = Buy me those shoes. #femaletranslations"
notebook,"The beginning of a relationship is always the best, when they are all into you."
notebook,"'You're mine forever' is one of the most selfish phrases, but is also one of the most loving things that someone can say."
notebook,"Every relationship has ups and downs, you should never expect perfection from somebody."
notebook,Love is like the sun coming out of the clouds and warming your soul.
notebook,"Relaxing at @RivieraPS for my anniversary. Awesome resort in Palm Springs, CA! http://t.co/eQl6x5gL"
notebook,Every girl deserves a guy who looks at her every day like its the first time he saw her.
notebook,"Stand up and follow @bullyville to help us fight bullying! It's wrong and nobody should feel inferior, join us!"
notebook,"RT @bullyville: ""True confidence leaves no room for jealousy.  When you know you are great, you have no need to hate."" -@NICKIMINAJ"
notebook,"If you're single, make the best of it. It's not because you're not good enough for anyone, but it means no one is good enough for you yet."
notebook,"Being someones first love is great, but being someones last love is beyond perfect."
notebook,Every girl deserves a guy who can make her forget that her heart was ever broken.
notebook,"You can't build a relationship on promises, you build it with love, determination, and trust."
notebook,"A simple ""Good morning beautiful"" text could make any girl smile for the whole day."
notebook,Create a #GlowShow story and win a WalMart gift card! Sounds good to me! http://t.co/LhFxCUZs #ad
notebook,"There are 3 things i like about myself: I don't play, I give my all, and I love deeply."
notebook,"Do it yourself, household remedies, neat projects and more! @BusyHousehold has thee cutest ideas!"
notebook,"RT @BusyHousehold: Simmer water, orange peels, cloves and cinnamon on stove for a fresh smell. [Instagram: BusyHousehold] http://t.co/Tn ..."
notebook,"RT @BusyHousehold: Whether you are planning a picnic, a hike, or just a quick trip to the mall, plan ahead with a to-do list to avoid th ..."
notebook,RT @BusyHousehold: Eliminate the lingering smell in the oven by turning it on to 350 and placing a baking sheet lined with orange peels ...
notebook,"RT @BusyHousehold: Never crowd a pan with food. It prevents heat distribution, which causes uneven cooking."
notebook,I play the same song over and over just because it reminds me of you.
notebook,"If he loves you, he will make sure you know... not just by words, but by action too."
notebook,When love is real... it finds a way.
notebook,The best feeling in the world is knowing that you actually mean something to someone.
notebook,"A heartbreak is a blessing from God, its just His way of letting you realize that He saved you from the wrong one."
notebook,"They say love can be blind, but until you are, you have no choice but to love me."
notebook,"I am going to bed early, so i can have more time to dream about you."
notebook,"I love the way you kiss me on my cheek yet so softly, so I want you to know, I want you to be the last boy I kiss."
notebook,"If you love someone, tell him or her. Forget about the rules or the fear of looking ridiculous."
notebook,Dont force yourself to fall in love just because you think its your turn.
notebook,"Stand up and follow @bullyville to help us fight bullying! It's wrong and nobody should feel inferior, join us!"
notebook,RT @bullyville: Smile &amp; let everyone know that today you're a lot stronger than you were yesterday.  #bullyville #stronger
notebook,All the best love stories have one thing in common... you have to go against odds to get there.
notebook,Love is when youll stop at nothing to start being someones everything.
notebook,"Most relationships fail not because the absence of love, but because girls love too much and boys care too less."
notebook,&lt;3 tweets from @MrKendrickLamar so sweet and inspiring! Followwww ;)
notebook,RT @MrKendrickLamar: If someone brings more problems to your life.. it's time to let them go..
notebook,RT @MrKendrickLamar: Being nice to someone you hate isn't being two-faced. It's called growing up..
notebook,"When I say I love you, it's not because I want you or that I can't have you. I love you for who you are."
notebook,omg I want EVERY car on @Automotive they are so nice!!!!
notebook,RT @Automotive: Audi R8 looking mighty sexy http://t.co/4HO3gmdW
notebook,"RT @Automotive: Ferarri FF - 660 hp, 0-60 mph: 3.7 seconds! http://t.co/FzJjyIwI"
notebook,RT @Automotive: Lamborghini Mercy! http://t.co/HH92jfgb
notebook,"I love that no matter what happen, you'll always be there for me."
notebook,These jokes are so corny but they're hilarious! @omgthatspunny &lt;3
notebook,RT @omgthatspunny: I'm friends with 25 letters of the alphabet. I don't know Y.
notebook,RT @omgthatspunny: It's going to be drizzy outside. Expect a lil wayne.
notebook,"Dont ever leave the one you love for the one you like, because the one you like will leave you for the one they love."
notebook,Wait for the guy who will let his arm fall asleep just because you look too cute to move.
notebook,"I don't care that I don't have you right now, because I have whole a lot of faith that we are meant to be together."
notebook,Maybe sometimes love needs a second chance because it wasn't ready the first time around.
notebook,I can't let go because you've given me SO MUCH to hold on to.
notebook,"I promise I will never forget the day we kissed or met. The sky may fall and the stars may too, but in the end I will still love you."
notebook,You are my everything. I will choose you and only you over anything and anyone from now until forever.
notebook,How drinking water can help you lose weight! http://t.co/zPOPp8BI
notebook,I don't want to kiss others guys and i don't have the longing to. I want to kiss you and only you from now until forever.
notebook,You're the only person that I can say I love you to and mean it with all my heart.
notebook,"RT @MrKendrickLamar: Don't apologize, and then do it again."
notebook,"RT @MrKendrickLamar: ""Ride or die"" type of relationship. You got my back &amp; I have yours. &gt;&gt;"
notebook,True love is when your heart and your minds are saying the same thing.
notebook,Obstacles are put in your way to see if what you want is really worth fighting for.
notebook,True love is the ability so see something in a person that no one else does.
notebook,"Happy Halloween from my son, Ben.  http://t.co/5rAxdtmP"
notebook,No one is going to love you if you don't love yourself.
notebook,If you're faithful follow @CheaterVille and stay up to date on resources to spot unfaithfulness and put an end to cheating!
notebook,RT @CheaterVille: Real men stay faithful.  They don't have time to look for another woman because they're too busy looking for new ways  ...
notebook,"When you think you're not happy with your life, always think that someone is happy simply because you exist."
notebook,"In celebration of Halloween, click through these images without getting spooked! I can feel them all over me! http://t.co/OqRfv2q2"
notebook,You never know how much you really love someone until you watch them love someone else.
notebook,"I'm not single, I'm not taken, I'm simply on reserve for the one who deserves my heart."
notebook,"RT @MemorableMovie: Happy Halloween!
http://t.co/4hq0zwOh"
notebook,Check out my skin care and beauty page at @Beautifulskin for all the best tips on being and staying beautiful!
notebook,"RT @Beautifulskin: Neutral makeup works with any outfit. You can never go wrong with golds, browns and nudes."
notebook,RT @Beautifulskin: DIY Candy Cane Sugar Scrub http://t.co/MOJ7dkTc
notebook,RT @Beautifulskin: Green tea is an anti-inflammatory that reduces redness and calms irritated skin. Soak cloth in cooled tea and apply t ...
notebook,R-T if you hope someone is passing these candies out tonight! My faves http://t.co/j9b1o46k
notebook,"Love me or leave me alone, ain't no in between."
notebook,Just made these for the kid's classes! #HalloweenTreats http://t.co/3REGMSMm
notebook,"The mystery of life is not a problem to solve, but a reality to experience."
notebook,"Just remember, I was there when no one else was."
notebook,The reason we all love Halloween http://t.co/94oT8WeQ
notebook,I'm a nerd! Happy Halloween! http://t.co/ZJS3meYl
notebook,"#TalkLikeYourBestfriend ::picks up food, puts near mouth::  Can I have some?"
notebook,"Goodbye October. Hi November. Goodbye heartbreak, hello love."
notebook,Happy Halloween everyone. Enjoy a good laugh. (NotebookLove on Instagram) http://t.co/YBVcCenb
notebook,"Happy Halloween everyone! Have a safe and blessed time, enjoy the company of only the ones you love. "
notebook,Are you falling for me like I'm falling for you?
notebook,A really good relationship starts with good communication.
notebook,Missing someone is your heart's way of reminding you that you love them.
notebook,"Ladies, never go for the guy who catches your eye, but go for the guy that captures your heart."
notebook,"When i care about someone, I really care."
notebook,"Ladies, close your legs and open your heart."
notebook,"In a long lasting relationship, honesty and trust must exist."
notebook,"I often asked myself: ""Why I suddenly fall in love with the person I never expected to fall in love with?"""
notebook,"A true relationship is having someone who accepts your past, supports your present, loves you and encourages your future."
notebook,Follow @UnansweredSongs it's a friggin hilarious page about music! Can't stop laughing!
notebook,"Everytime I look into your eyes, it's like its just you and me and I can't help my self to smile even if I am upset at you."
notebook,You make my heart glow.
notebook,Save your heart for someone who really cares.
notebook,"Hurricane, storm, whatever, make sure you have these apps to stay safe! http://t.co/7F6H2jjk"
notebook,RT @TheeFoodPorn: Peanut Butter Cup Brownies (recipe: http://t.co/xZ475BDB) http://t.co/dUK27i0o
notebook,RT @TheeFoodPorn: Snickers dip with pretzels (recipe: http://t.co/4R0pPksb) http://t.co/t1JR1jQl
notebook,RT @TheeFoodPorn: Copy-Cat In-N-Out Burger! (recipe: http://t.co/zvWRs4wB) http://t.co/ytMUB0u1
notebook,"Without pain and sacrifice, we would have nothing."
notebook,"If you are against bullying then join us and take a stand. Follow @bullyville now for tips, resources, and help."
notebook,"RT @bullyville: The tongue has no bones, but is strong enough to break a heart.  So be careful with your words. #bullyville"
notebook,"Sometimes, you have to stop thinking so much and just go where your heart takes you."
notebook,Studies show these are the most stolen items from students in school! http://t.co/4x8SsEZ0 be careful!
notebook,"Never chase love, affection, or attention. If it isn't given freely by another person, it isnt worth having."
notebook,True love is only seen when you grow old with one lover.
notebook,Everybody wants to be in a relationship but nobody wants to give up their single ways.
notebook,"""I love you"" means that I will love you and stand by you even through the worst of times."
notebook,The feeling we get when we think we're starting to fall in love.
notebook,If you're a Disney fan go follow - @DisneyMemory for amazing Quotes + Pictures + Facts of Disney!
notebook,"RT @DisneyMemory: Never say goodbye, because saying goodbye means going away. And going away means forgetting. Peter Pan"
notebook,RT @DisneyMemory: Who else misses this show?:) http://t.co/O2iCj63U
notebook,You're the best I have ever have. I can't tell you how much you have change the way I view about life.
notebook,"Being someones first love is great, but being someones last love is beyond perfect."
notebook,"Letting go of someone you love is hard, but holding on to someone who doesn't even feel the same is much harder."
notebook,Follow @StudentHabits now if you're in school... the tweets will make you say OMG ME TOO! lol
notebook,"RT @StudentHabits: Twitter Taught me how to use ""&gt;"" and ""&lt;"" better than Math did."
notebook,"RT @StudentHabits: Giving your best friend ""the look"" when someone is being annoying as hell."
notebook,RT @StudentHabits: When I was younger I used to draw the sun in the corner of the paper. ALWAYS.
notebook,RT @StudentHabits: That person in your class you just want to throw a brick at..
notebook,RT @StudentHabits: Homework: Because 7 hours of school wasn't enough.
notebook,"If you're single, make the best of it. It's not because you're not good enough for anyone, but it means no one is good enough for you yet."
notebook,Every girl deserves a guy who looks at her every day like its the first time he saw her.
notebook,Every girl deserves a guy who can make her forget that her heart was ever broken.
notebook,"You can't build a relationship on promises, you build it with love, determination, and trust."
notebook,"My mind said I was over you, but my heart didn't want to listen."
notebook,"RT @FemaleEnglish: ""Leave me alone"" = Don't leave me alone"
notebook,"RT @FemaleEnglish: ""I can't stand him!"" = I really love him and I hope I hear from him soon."
notebook,"RT @FemaleEnglish: ""You're a great guy but..."" = You're not good enough to date me"
notebook,"Hey girl, top signs your man is cheating http://t.co/ZeDwQ9F4 -- sound familiar? Uh oh."
notebook,I play the same song over and over just because it reminds me of you.
notebook,"People get into relationships too quickly, that's why it never works out."
notebook,"If he loves you, he will make sure you know... not just by words, but by action too."
notebook,Here's the top signs a guy is cheating http://t.co/ZeDwQ9F4
notebook,When love is real... it finds a way.
