notebook,"When you truly love someone, you would do anything to make him happy even if it means to say goodbye."
notebook,I think men talk to women so they can sleep with them and women sleep with men so they can talk to them.
notebook,"RT @GoodGuyGuide: Letting go has never been easy, but holding on can be as difficult. Yet strength is measured not by holding on, but by ..."
notebook,RT @GoodGuyGuide: #YouKnowYoureInLoveWhen you realize life without her would be unimaginable.
notebook,"RT @GoodGuyGuide: Let your girlfriend know how important she is to you. Let her know that without her, life wouldn't be the same."
notebook,"He loves you, he loves you not http://t.co/DffyVZjO"
notebook,"Some people, are meant to fall in love with each other; but not meant to be together."
notebook,The prettiest smiles hide the deepest secrets. The prettiest eyes have cried the most tears and the kindest hearts have felt the most pain.
notebook,"Sorry guys, us ladies lie about this often http://t.co/VRnZyenK"
notebook,"I'm not sure what scares me more, that you will never start loving me or that I will never stop loving you."
notebook,My dream is to hear rocks hitting the window and see you standing in the rain...
notebook,"""And in the end, the love you take is equal to the love you make..."""
notebook,The people that really love you are the people who will never hurt you.
notebook,"If you are a student or remember being one as a kid, follow @StudentHabits right now. So many memories... ahhhh"
notebook,RT @StudentHabits: Teachers that start teaching before class and always hold everybody after class &lt;
notebook,RT @StudentHabits: Pretending to care about a teacher's personal life to waste time in class.
notebook,RT @StudentHabits: So many trees have died to make books that I used for a total of 45 minutes throughout the entire school year.
notebook,"You can never really get over some one because after you fall in love with them, they will always be a part of you, the best part."
notebook,Sometimes the person you fall for isn't ready to catch you.
notebook,"I'd rather spend one minute holding you,than to live the rest of my life knowing I missed my chance."
notebook,You will never realize how much you care about a guy until the thought of him being with someone else is enough to break your heart.
notebook,"When I text you, that means I miss you. When I dont text, that just means Im waiting for you to miss me."
notebook,"You dont realize how hard the road to letting go is, until you are the one traveling it."
notebook,RT @FlTNESS: Sexy. ABS. 1...2...3... go: http://t.co/YqJN31Z5
notebook,In your dreams! http://t.co/FY28mqif
notebook,I bet you'll never remember what I'll never forget.
notebook,"If I had to choose between you and everything in the world, I would choose you cause then I'd have more then everything in the world"
notebook,The hardest part of dreaming about someone you love...is waking up
notebook,Omg @drunk = the most hilarious ever. We have all been there on the giving or receiving end of messages like those.
notebook,"RT @drunk: COME OVE R. I have, to show. You somethnig"
notebook,"RT @drunk: 3:53am: HEy WAHT ARE U DOING???,"
notebook,"Maybe you're just scared, because for once in your life someone actually wants to be with you."
notebook,"Sometimes I wish I was a little girl again--because bruised knees heal faster than broken hearts."""
notebook,They say love hides in every corner--then I must be walking in circles.
notebook,Everyone has their own reason for waking up in the morning...Mine is you
notebook,They keep saying there is a perfect person for everyone out there but I seriously think that mine got hit by a truck.
notebook,The second best thing to do with your lips is smile.
notebook,Tears are words the heart cant say.
notebook,"I can conquer the world with one hand, as long as you're holding the other."
notebook,"Why is it every time I talk to you the words don't come easily, but when you walk away I know exactly what to say?"
notebook,RT @StudentHabits: RT if you took Kindergarten nap time for granted.
notebook,RT @StudentHabits: I'll spend the next 4 hours procrastinating instead of doing the homework that will take less than an hour to finish.
notebook,RT @StudentHabits: In the best moods on Fridays. Hate life on Mondays.
notebook,"Eventually, one of two things will happen. He will realize you're worth it, or you'll realize that he isn't."
notebook,"I'm scared of looking at you because the more I do, the more I fall in love with you.."
notebook,"I cried today, not because I miss you or even wanted you, but because I finally realized I'm gonna be alright without you."
notebook,"Just the thought of being with you tomorrow, is enough to get me through today."
notebook,"I miss you a little, I guess you could say, a little too much, a little too often, and a little more each day."
notebook,Relationships are like glass. Sometimes it's better to leave them broken than try to hurt yourself putting it back together.
notebook,Cutest friggin animals ever! @RawrCuteRawr follow if you love pets &amp; animals!
notebook,"RT @RawrCuteRawr: ""What even is this thing?"" http://t.co/Ups1AmUV"
notebook,RT @RawrCuteRawr: THERE'S TOO MANY TO COUNT! http://t.co/WnmNiUx5
notebook,He's the kind of guy who makes you love your name just because he says it.
notebook,Here's why you can't land a good man! http://t.co/0iwCPtMZ
notebook,"They say time heals all, but without you by my side, time stands still"
notebook,"#WouldntItBeCool if we had this awesome friendship, that morphed into a relationship, that ended in love  #sp"
notebook,If you remember school days or are even in school now then follow @StudentHabits and read all the facts and true stuff about school!
notebook,RT @StudentHabits: Walking to class and seeing tons of attractive people. Walking inside your class and everybody is ugly.
notebook,RT @StudentHabits: Checking to see what time it is every 2 minutes and wondering why class is dragging on. #StudentHabits
notebook,RT @StudentHabits: Twitter &gt; Paying attention during class
notebook,"If you want to know where your heart is, look where your mind goes when it wanders."
notebook,"If I could change anything about you, it would be the way you feel about me."
notebook,Greatest movie kiss EVER! Love it http://t.co/O62Hs73v
notebook,To truly love and trust someone is to give them your heart knowing that they can break it.
notebook,"If he doesn't love you at your worst, he doesn't deserve you at your best..."
notebook,Jeweler to the Stars @BENBALLER reality show came out! Does jewelry for @justinbieber @robkardashian &amp; more! Watch&gt;&gt; http://t.co/CnVzM25B
notebook,"Our love is like the wind. I can't see it, but I can feel it."
notebook,"He loves you, he loves you not. He loves you, he loves you not http://t.co/DffyVZjO"
notebook,One of the saddest things in life is loving someone who used to love you.
notebook,You know you really love someone when you dont hate them for breaking your heart.
notebook,"Pregnancy is a beautiful thing, but wait.. it does WHAT to my feet?! Crazy&gt;&gt; http://t.co/tFCXREvy"
notebook,"The first time you fall in love, it changes your life forever, and no matter how hard you try that feelin' never goes away."
notebook,The worst feeling isn't being lonely. It's being forgotten by someone you would never forget.
notebook,"After I fell in love with you, I fell in love with my life."
notebook,Have you told this lie to a guy before? Be honest! http://t.co/MHB02wrq
notebook,"The reason I know you don't love me, is because the day I walked out your door, you didn't stop me."
notebook,I would have given you the world if you had given me the chance.
notebook,#MentionYourTwitterCrushes YOU know who you are ;)
notebook,#MentionYourTwitterCrushes @rihanna every time she posts a pic on Instagram. duhh 
notebook,"Girl, he doesn't like you that much, maybe it's time to move on!!! =&gt;&gt; http://t.co/aJ215wcW"
notebook,"Simply amazing words from @LifeTools all the time! If you love to be motivated, follow them now and they'll bless you with wise words!"
notebook,"RT @LifeTools: Sometimes we just have to accept whats gone, appreciate what still remains, and look forward to whats coming next."
notebook,"RT @LifeTools: Know who you are, and be it. Know what you want, and go out and get it."
notebook,RT @LifeTools: Optimism is the faith that leads to achievement. Nothing can be done without hope and confidence.
notebook,"I love you not because I need you, I need you because I love you."
notebook,One day someone will walk into your life and make you see why it never worked out with anyone else..
notebook,It's not that I can't live without you. It's that I don't even want to try.
notebook,The worst thing a guy can do is make a girl fall for him when he has no intention of catching her.
notebook,"There are only two times when I want to be with you.... Now, and forever."
notebook,"Yes you want to be more positive, yes you want to have a better life. Follow @PsychicsUnivers and they'll help motivate you to do so! :))"
notebook,RT @PsychicsUnivers: The most important thing is to enjoy your life  to be happy  its all that matters. - Audrey Hepburn
notebook,"To let a fool kiss you is stupid, to let a kiss fool you is worse."
notebook,"He said ""I'm afraid of falling..."" and she whispered ""I have wings"""
notebook,"One day he's going to look back and say, Damn that girl really did love me..."
notebook,"Love cannot be found where it doesn't exist, nor can it be hidden where it truly does."
notebook,"If youre single, in a relationship or deeply in love, I suggest you follow @FreddyAmazin for relatable quotes about love and relationships"
notebook,"RT @FreddyAmazin: ""I trust you"" is better than ""I love you"" because you may not always trust the person you love but you can always love ..."
notebook,"Sometimes I wonder if love is worth fighting for, but then I remember your face and I'm ready for war."
notebook,You never lose by loving. You always lose by holding back.
notebook,Things worth having are worth waiting for.
notebook,If a star fell each time I thought about you then the moon would truly realize what loneliness is really like.
notebook,"Must follow, now! &gt;&gt; @LifeTools so many great words you'll love it!"
notebook,RT @LifeTools: You can learn a lot from people who view the world differently than you do.
notebook,"RT @LifeTools: When someone walks out of your life, let them. They are just making more room for someone better to walk in."
notebook,RT @LifeTools: Hurting someone with the truth is better than killing them with a lie.
notebook,Don't waste your time on someone who isn't willing to waste their time on you...
notebook,The hardest thing to do is watch the one you love love someone else.
notebook,"To love someone is nothing, to be loved by someone is something, to love someone who loves you is everything."
notebook,This is where @ParisHilton likes to party!! http://t.co/izbJGVEP
notebook,If you believe bullying is wrong please join the movement and follow @bullyville for positive messages and anti-bullying info. Thank you!
notebook,"RT @bullyville: Learn from your past, but live for your future.  The best has yet to come. #bullyville"
notebook,"RT @bullyville: As we grow up, we realize it becomes LESS important to have more friends and MORE important to have REAL ones.  #bullyvi ..."
notebook,Torn between two. Who would you chose? The one that you love...or the one that loves you?
notebook,"Ugh, does this mean he likes you or he doesnt? http://t.co/aJ215wcW"
notebook,Love is when you sit on the internet all day and look for love quotes.
notebook,"I can't promise to solve all your problems, but I can promise you won't have to face them alone..."
notebook,I want to be his favorite hello and his hardest goodbye....
notebook,RT @AcneSkinSite: 5 Natural Acne Solutions To Make The Pimples Go Away: http://t.co/gDxVPQT2
notebook,I wanna be remembered as the girl who always smiled. The one who could always brighten your day. Even if she couldnt brighten her own.
notebook,"You will always be the answer, when somebody asks me what I'm thinking about."
notebook,"I can't make you love me, want me, or understand me.. All I can do Is hope that someday you will."
notebook,"A guy and a girl can be friends. But sooner or later one will fall for the other. Maybe too early, maybe too late, but maybe, maybe forever."
notebook,Just because someone doesn't love you the way you want them to doesn't mean they don't love you with all they have.
notebook,If you love someone tell them... because hearts are often broken by words left unspoken.
notebook,A man wants to be a woman's first love; a woman wants to be his last.
notebook,If you asked me how many times you have crossed my mind I would say once because you never really left...
notebook,Don't keep running back to the one person that you need to walk away from.
notebook,"Loving someone doesnt need a reason. If you can explain why you love someone, its not called ""Love""... its called ""Like"""
notebook,It's only after someone is gone do you realize how much you miss them...
notebook,"Everyone in life is gonna hurt you, you just have to figure out which people are worth the pain."
notebook,Sometimes you need to run away just to see who will come after you.
notebook,"If you truly love someone, then the only thing you want for them is to be happy....even if its not with you."
notebook,Inspiring tweets and positive motivation from @DreamsMatic so follow now! You'll love it!
notebook,RT @DreamsMatic: I found that getting lost was better than any directions I could have taken.
notebook,"Sitting next to you doing absolutely nothing, means absolutely everything to me."
notebook,"I love you not because of who you are, but because of who I am when I am with you."
notebook,"To the world you may be but one, but to one you might be the world."
notebook,You never really stop loving someone. You just learn to try to live without them.
notebook,People will forget what you said. People will forget what you did. But people will never forget how you made them feel.
notebook,"Nobody is worth your tears, and the one who is won't make you cry."
notebook,You know you're in love when you don't wanna go to sleep at night because your life is better than a dream.
notebook,Love is giving someone the power to destroy you...but trusting them not to.
notebook,"Follow the BEST skin care site in the world! @AcneSkinSite has the best facial masks, cleaning and care tips! Follow now!"
notebook,RT @AcneSkinSite: Keep Calm and Carry On
notebook,RT @AcneSkinSite: Do not worry too much. Stress behaviors only contribute to bad skin.
notebook,"It's amazing how someone can break your heart, but you still love them with all the little pieces."
notebook,RT @FlTNESS: These foods will boost your mood AND your sex drive. Sounds like win win to me! http://t.co/Uw17EiRX yay for #aphrodisiacs
notebook,"Don't say you love me unless you really mean it, because I might do something crazy like believe it."
notebook,"RT @FlTNESS: Not only are these delicious, but you will have BEAUTIFUL skin afterwards! Yum! http://t.co/8hmhFuqK"
notebook,"Sometimes people put up walls, not to keep others out, but to see who cares enough to break them down."
notebook,Today I caught myself smiling for no reason... then I realized I was thinking about you.
notebook,"Meeting you was fate, becoming your friend was a choice, but falling in love with you was beyond my control."
notebook,"We come to love not by finding a perfect person, but by learning to see an imperfect person perfectly."
notebook,"If you were thinking about someone while reading this, you're definitely in love."
notebook,"Trials in life are not meant to make us fail, but to see how far we can fly."
notebook,Don't be the smelly friend! If you care about your health and cleanliness follow @HYGlENE for awesome tips and info.
notebook,RT @HYGlENE: Food bacteria doubles every 20mins! Make sure to put food sitting at room temp in the fridge. Cold temps help keep bacteria ...
notebook,RT @HYGlENE: Passing by free food samples at the grocery store? Avoid sampling from a communal bowl or platter where people are using th ...
notebook,RT @HYGlENE: Good Sleep Hygiene: Your bedroom is your sanctuary! Use your bedroom for #sleep &amp; #sex only. #Noworkallowed
notebook,I want to be the only hand you ever need to hold.
notebook,"Have you ever looked at a guy and thought that he was perfect in every way, but then you realize that he wasn't, but you still love him."
notebook,You know your in love when the smile on his face makes you forget the tears in your eyes.
notebook,Do you know that you're the only one who makes my heart beat just a little bit faster?
notebook,I bet that you have NO IDEA that all my quotes are created while thinking about you.
notebook,"Before I go to sleep, I start imagining stuff that I would like to happen."
notebook,"You can have friendship and you can have love, but it's only when you have both together that it will be a great love."
notebook,Isn't it weird the person who you're going to spend your whole life with is walking the earth right now?
notebook,"Amazing tweets from @LifeTools are so useful and inspiring. Follow them, creative and motivating!"
notebook,RT @LifeTools: Live with it or die from it.
notebook,RT @LifeTools: Choose your words carefully. They may come back to destroy you.
notebook,RT @LifeTools: The Six W's: Work will win when wishing won't.
notebook,There's alot of things science can not explain... like why we fall in love with a certain person.
notebook,"In the dawn, we'll walk through eternal miles."
notebook,RT @FlTNESS: Doing this burns the MOST calories http://t.co/XSgjTlMP
notebook,"RT @FlTNESS: If this doesn't scare you out of eating fast food, nothing will http://t.co/xrBk42df"
notebook,"RT @FlTNESS: Don't eat this, it will cause acne! http://t.co/YCLFNGHp"
notebook,What I choose is you. You're who I want to wake up with and go to bed with.
notebook,"Love is not how you let go, but how you hold on."
notebook,"Love is not what you see, but how you feel."
notebook,"Love is not how you listen, but how you understand."
notebook,"Love is not how you forget, but how you forgive."
notebook,You know that you are in love when you feel lonely even though you have family and friends.
notebook,I vow to live within the warmth of your heart and always call it home.
notebook,"If you are an alcohol drinker, you should know this for yourself and for your friends http://t.co/9oW8eCsu"
notebook,So hilarious @SkepticaI_Kid
notebook,"I chased after love for what seemed like forever, but it was when I stopped to take a rest that it found me."
notebook,"As each day ends, I'm glad because it's another one day closer till I see you again."
notebook,I could fill up a thousand pages telling you how I feel and you still wouldn't understand.
notebook,"If you're single, going through a breakup, or deeply in love.. I suggest you follow @FreddyAmazin -his tweets are Inspiring &amp; honest! ;) "
notebook,RT @FreddyAmazin: Dont trust too much. Dont love too much. Dont hope too much. Because that too much can hurt you so much.
notebook,"It's true that we don't know what we've got until we lose it, but its also true that we don't know what we've been missing until it arrives."
notebook,The decision to kiss for the first time is the most crucial in any love story.
notebook,I just want you to know that I'm the one girl who took one look at you and fell harder than I ever have in my entire life.
notebook,RT @CheaterVille: Wait for the person that would do anything to be your everything.
notebook,"RT @CheaterVille: Happy Wife, Happy Life, it's really that easy."
notebook,"Love"" is when you know that worst side of someone and still love the person with everything you have in your heart."
notebook,"If a kiss were a raindrop, I'd send you showers."
notebook,I wanna be the girl he can be goofy around.
notebook,"When I grab at your hands, hold mine and play with my fingers."
notebook,"When I say that I like you, I really do more than you could understand."
notebook,"When you smile at me, I can't help but feel loved."
notebook,I can't imagine living a happy life without you being a part of it.
notebook,"A relationship is like a house. When a lightbulb burns out you do not go and buy a new house, you fix the light bulb."
notebook,If you drink ever alcohol http://t.co/hISnCnSl
notebook,Let's find love in hopeless places.
notebook,"Sometimes, you just need to be with the person who makes you smile, even if it means waiting."
notebook,"It's when you expect a knight in shining armor, you limit the possibilities of love."
notebook,Love love love @Life_Fountain's tweets! Follow them for awesome tweets that will keep you positive &amp; motivated!
notebook,"RT @Life_Fountain: ""In times of rapid change, experience could be your worst enemy."" - J. Paul Getty"
notebook,"RT @Life_Fountain: ""A woman's #heart is like a campfire; if you don't tend it often the flame will go out."" - Willie M. Lawrence"
notebook,"RT @Life_Fountain: ""In #faith there is enough light for those who want to believe and enough shadows to blind those who don't."" - Blaise ..."
notebook,"Trials in life are not meant to make us fail, but to see how far we can fly."
notebook,Change your life and follow @PsychicsUnivers! You'll get a whole new outlook on life and bring positivity to your day! #PositiveEnergy
notebook,"RT @PsychicsUnivers: Never regret. If its good, its wonderful. If its bad, its experience. - Victoria Holt"
notebook,"Today is Int'l Peace Day, all we are saying, is give Peace a chance by going here: http://t.co/ao6R6zkl Da Internacional de la Paz"
notebook,"A relationship is like a couple holding hands. Although the hands are different and imperfect, they still fit together perfectly."
notebook,"If I can stop one heart from breaking, I shall not live in vain."
notebook,"When someone loves you, the way they say your name is different. You know that your name is safe in their mouth."
notebook,"I fell in love the way you fall asleep: slowly, then all at once."
notebook,Love is an irresistible desire to be irresistibly desired.
notebook,"You know, when it works, love is pretty amazing. It's not overrated. There's a reason for all those songs."
notebook,I love you like a fat kid loves cake!
notebook,Sometimes it's a form of love just to talk to somebody that you have nothing in common with and still be fascinated by their presence.
notebook,I love you more than there are stars in the sky and fish in the sea.
notebook,"Nobody has ever measured, not even poets, how much the heart can hold."
notebook,I would always rather be happy than dignified.
notebook,"So, I love you because the entire universe conspired to help me find you."
notebook,What's meant to be will always find a way.
notebook,I carry your heart (I carry it in my heart).
notebook,A book without words is like love without a kiss; it's empty.
notebook,"Once upon a time there was a boy who loved a girl, and her laughter was a question he wanted to spend his whole life answering."
notebook,One is loved because one is loved. No reason is needed for loving.
notebook,"Two people in love, alone, isolated from the world, that's beautiful."
notebook,Where there is love there is life.
notebook,"You are, and always have been, my dream."
notebook,You're gonna be forever alone! http://t.co/sPTPDlyu
notebook,We love the things we love for what they are.
notebook,Love is needing someone. Love is putting up with someone's bad qualities because they somehow complete you.
notebook,"Just when you think it can't get any worse, it can. And just when you think it can't get any better, it can."
notebook,"Speak with a live person about your problems. $1/min, money back guarantee. Everyone needs to talk sometimes &gt;&gt; http://t.co/0ULvdnrn"
notebook,"There is nothing I would not do for those who are really my friends. I have no notion of loving people by halves, it is not my nature."
notebook,If I had a flower for every time I thought of you...I could walk through my garden forever.
notebook,"You don't love someone because they're perfect, you love them in spite of the fact that they're not."
notebook,"Tis better to have loved and lost, than never to have loved at all."
notebook,"Love is like the wind, you can't see it but you can feel it."
notebook,The real lover is the man who can thrill you by kissing your forehead or smiling into your eyes or just staring into space.
notebook,"If you can make a girl laugh, you can make her do anything."
notebook,"Love looks not with the eyes, but with the mind."
notebook,Learn a ton about history and some cool facts by following @years. So cool!
notebook,"I am good, but not an angel. I do sin, but I am not the devil. I am just a small girl in a big world trying to find someone to love."
notebook,Not all of us can do great things. But we can do small things with great love.
notebook,Love is that condition in which the happiness of another person is essential to your own.
notebook,"Being deeply loved by someone gives you strength, while loving someone deeply gives you courage."
notebook,"There is never a time or place for true love. It happens accidentally, in a heartbeat, in a single flashing, throbbing moment."
notebook,"If you judge people, you have no time to love them."
notebook,"It is not a lack of love, but a lack of friendship that makes unhappy relationships."
notebook,Darkness cannot drive out darkness: only light can do that. Hate cannot drive out hate: only love can do that
notebook,"If he does this, he doesn't really like you! http://t.co/3sIjvcpN"
