tomhanks,"CHI's Kevin Turk and Int'l Hanx day!  PBR/food. Donate 2 @lifelineenergy for
renewable energy lights 4 slum kids -cheers!  Hanx"
tomhanks,"RadioMan delivers msg from T.Fey. Result?  I'm on 30 Rock!  Thanks, RMan  Hanx"
tomhanks,A glamorous day in the movie biz.  Hanx  http://say.ly/Ifyc9Q
tomhanks,The Lennon/McCartney of Mythbusters.  http://say.ly/eMEbpk
tomhanks,The Kimmel staff came up with this:  Hilarious.  Hanx - http://say.ly/TWkabx
tomhanks,Walking from Oscars to Jimmy Kimmel Live. Hanx http://say.ly/KtMa6q
tomhanks,Who's @jimmykimmel and what is he like?  Find out after the Oscars. Hanx.
tomhanks,"At Sat. Oscar rehearsal, a look at times passed. Hanx  http://say.ly/REy9YS"
tomhanks,(shameless plug) 3-Minute Talk Show with Barry Sobel and Fred Willard makes me proud/makes me laugh.  Hanx
tomhanks,Hanx Longoria Goodwin Wilson @ Tom Ford. Some lineup!  Hanx http://say.ly/Wox9Sc
tomhanks,1 Chicago Sized breakfast!  Hanx http://say.ly/sIq9xB
tomhanks,My grand daughter's feet.  She looks like ME!  Hanx  http://say.ly/BQG8NK
tomhanks,"The Groundlings have a great show: SINGLES CRUISE.  If in LA, go!  Hanx  - http://say.ly/gHV8cv"
tomhanks,Thanx for the good wishes on our Grand daughter.  In the year 2011...Hanx
tomhanks,"3 directors boss ""Woody"" around for Toy Story shorts. Come on, guys!  Hanx  - http://say.ly/BgT7Pe"
tomhanks,"The actress in this plays 'Sal' in LARRY CROWNE.  Hanx.
http://www.youtube.com/watch?v=Hu0ryzTFLIE"
tomhanks,RW (@ritawilson) loves this blog. Help @slimpaley be Number 1 on The Homies (http://bit.ly/edrykK).  Check and vote...RW Husband Hanx
tomhanks,HERE'S why I didnt get cupcakes today. Hanx - http://say.ly/tJu7N3
tomhanks,"I am flattered. I think. Hanx  ""Tom Hanks is a lot of Animals""  - http://say.ly/MmS7GG"
tomhanks,"New logo! It will move, too. Hanx http://say.ly/KCD7Gg"
tomhanks,1 more day in Post on a thing called Larry Crowne. Hanx - http://say.ly/tnf7Gc
tomhanks,"Now on ""the"" Facebook!  - http://say.ly/JuU7An"
tomhanks,Found a reflection of camera in scooter mirror in DI for Larry Crowne!  Missed it till now?  Hanx
tomhanks,"In the year 2011 personal jewelry will be replaced by gem-studded tags that say ""Hello!  My name is..."". Life will be simpler!  Hanx"
tomhanks,"Goodbye, Dick Winters.  Leader of a company of heroes. Hanx"
tomhanks,"In the year 2011 foods from all over Asia will be available in the USA, anytime, anywhere.  Incredible! Hanx"
tomhanks,"In the year 2011... Newspapers will be replaced by electric Fact-o-Tablet
reading devices.  Won't that be AMAZING? Hanx"
tomhanks,"In the year 2011...TV will have over 30 Channels!  Some, in other languages!  How amazing will THAT be! Hanx"
tomhanks,In the year 2011 telegrams will be replaced by a device called the twit-o-gram and cost only pennies. Amazing!  Hanx
tomhanks,"In 2011... I predict we will watch TV on small, hand-help screens called
'Tele-bits'.  What a wonder that will be!  Hanx"
tomhanks,RT @RitaWilson: The article I wrote for Harpers Bazaar on Tom Ford is up! Take a look.http://ow.ly/3mu3u @laurabrown99 this was fun to w ...
tomhanks,RT @RitaWilson: Playing dance central with kinect. Awesome!!! http://twitpic.com/2ze9me
tomhanks,On the @ComedyCentral telethon for autism. Hey Vinnie!
tomhanks,What to do between reels? Post comments on the NYTimes article WILL ELECTRIC CARS FINALLY SUCCEED. Think I'm on page 76 of comments...Hanx
tomhanks,"Going through Temp Mix reel by reel, every line, every sound fx, every note of music. Sounds tedious, but time flies. It still friday? Hanx"
tomhanks,My turn to loop. It's called ADR. Hanx  http://twitpic.com/2vh8ma
tomhanks,Looping on LARRY CROWNE today?  Just Rita Wilson AND Pam Grier!  Foxes!  Hanx
tomhanks,This is a looping session on Larry Crowne. Hanx  http://twitpic.com/2tekji
tomhanks,First ADR session with Taraji Henson and Rob Riggle. Post production advances!  Hanx
tomhanks,Pablo Ferro did titles for Dr. Strangelove and... Larry Crowne. A genius. Hanx
tomhanks,Guess where I am. For hours and hours.  Hanx  http://twitpic.com/2qe25s
tomhanks,How cool the solar powered MPS/RADIO/RECORDER fr @Lifelineenergy? Educational tool for poor countries! RT/support http://tiny.cc/rlhnl
tomhanks,"Took the summer off from Tweets.  In the LARRY CROWNE cutting room, looking for a temp score.  Hanx"
tomhanks,"Nice props from JR on Dave last night.  Bless you, ""Mercy"". Hanx"
tomhanks,Editing room 8/2.  Big changes. Still at 1:43ish length. My summer job on Larry CROWNE. Hanx  http://twitpic.com/2b3c1t
tomhanks,"Putting scenes back into Larry Crowne. If not now, when ? Hanx"
tomhanks,"Putting in temp music and loop lines for a 1:43 rough cut. Go, Larry CROWNE!  Hanx"
tomhanks,Wanna buy my old Prius  hacked for MAX mpg?  $ go to Welcome Back Veterans.  Auction.@ http://tinyurl.com/3ahnu2d
tomhanks,Editing continues. Latest cut is 1:51 long.  No credits.  More to be done. Hanx  http://twitpic.com/24rfn4
tomhanks,Am example. Hanx  http://twitpic.com/21jxik
tomhanks,Larry Crowne. The movie. Every scene. In order. Hanx  http://twitpic.com/21jx5s
tomhanks,About to see very 1st assemblage of Larry Crowne in this room. Hanx  http://twitpic.com/20s5lu
tomhanks,Huge turnout @ wrap party. So hip in H'Wood Larry Crowne would fit in. Hanx
tomhanks,Youtube channel up and running! Check it out... Hanx http://www.youtube.com/tomhankschannel
tomhanks,Last day. Last shot. Last scene. Last slate.  Still more tweets to come. Hanx  http://twitpic.com/1zdscj
tomhanks,As seen on the PCH @ 6 am. Hanx  http://twitpic.com/1zc61n
tomhanks,Here's how we mark Larry Crowne's final day of shooting.  Hanx  http://www.twitvid.com/16QQA
tomhanks,And Future as Larry Crowne. Hanx  http://twitpic.com/1z4idx
tomhanks,Present...  http://www.twitvid.com/WNUKB
tomhanks,At UMart you see your professional past ...  http://twitpic.com/1z2gu8
tomhanks,Barry Sobel?  And me. At work where U make the difference. Hanx  http://twitpic.com/1yt24d
tomhanks,UMart has all your Toy Story 3 merchandise. Ask for Larry Crowne. Hanx  http://twitpic.com/1xvgla
tomhanks,Friday. Morning. Ext. Parking lot. Checking playback on Larry Crowne.  http://twitpic.com/1xupzz
tomhanks,2 days off for Grad Day.  See behind scenes from my crack driver (@FiestaBo) @ http://www.facebook.com/fiestaBo  Hanx
tomhanks,What a dish!  Hanx  http://twitpic.com/1x20rr
tomhanks,"Stray dog. Adopted by crew member of Larry Crowne. ""Scooter"". Hanx  http://twitpic.com/1x1vwu"
tomhanks,The Street Patrol rolls for justice and beauty one last time. Final scene?  Already??? Hanx  http://twitpic.com/1vwdyl
tomhanks,Journalists!  On the Larry Crowne set!  A Mild Bunch and welcome. Hanx  http://twitpic.com/1vw93v
tomhanks,"JR's last day. Goodbye, Angel!  Hanx  http://twitpic.com/1vkri3"
tomhanks,"As Prof. Ed Matsutani PhD? George ""Take 1"" Takei! Larry Crowne is learning lots and lots. Hanx  http://twitpic.com/1vb2ak"
tomhanks,Film. School. Larry Crowne. Hanx  http://twitpic.com/1v465t
tomhanks,Econ Prime!  What a class. Eager EVCC Beavers. Hanx  http://twitpic.com/1v45vu
tomhanks,Actual college students while we shoot Larry Crowne. Hanx  http://twitpic.com/1uxg0r
tomhanks,I'll say!  Hanx  http://twitpic.com/1uvavf
tomhanks,After lunch Still Life on Larry Crowne. George Takei worked today!  Hanx  http://twitpic.com/1uv6ch
tomhanks,College graffiti. No argument here.  Cue music: Larry Crowne's Theme. Hanx  http://twitpic.com/1ut089
tomhanks,We have a winner. Hanx  http://twitpic.com/1usah7
tomhanks,"The Mens Room at Pixar. Woody, not Buzz. Hanx  http://twitpic.com/1u9bc7"
tomhanks,Brand Extra Hollywood again. ForToy Story 3.  Hanx  http://twitpic.com/1u9a6y
tomhanks,"Pastrami day on Larry Crowne. When in Alta Dena, try a sandwich from The Hat on Lake.  Hanx"
tomhanks,On set still life. Light worthy of the Dutch Masters. Hanx  http://twitpic.com/1tv277
tomhanks,How I get to Larry Crowne. Every day. Good car. Goofy color. Hanx  http://twitpic.com/1tv13l
tomhanks,"Back of Pam Grier's ""office"". Behind the scenes @ Larry Crowne. Hanx  http://twitpic.com/1tddhl"
tomhanks,Can you see Larry Crowne?  Look close!  Hanx  http://twitpic.com/1t4kwm
tomhanks,"The first shot of June. Welcome back, Larry Crowne. Hanx  http://twitpic.com/1t18a2"
tomhanks,Saturday. 1:30 am. Night shoots continue. Have a good weekend. Hanx  http://twitpic.com/1s5qyo
tomhanks,"With Douglas, our Doorman. Nice man. Hanx  http://twitpic.com/1ruvrx"
tomhanks,Larry Crowne shoots at Hollywood Landmarks. Hanx  http://twitpic.com/1rugks
tomhanks,It's goofy but it's how we do it. Hanx  http://www.twitvid.com/NRO9N
tomhanks,Hair stylists busted. Book 'em!  Hanx  http://twitpic.com/1rtsr2
tomhanks,"Larry Crowne's crack video operation team. ""Play it back!"".  Hanx  http://twitpic.com/1rq4v0"
tomhanks,The location is perfect!  Hanx  http://twitpic.com/1rpv0p
tomhanks,Night shoots. Ugh. See you for breakfast. Hanx  http://twitpic.com/1rppgk
tomhanks,"Yee hah, cowboy! You got a friend in me!  Hanx  http://www.twitvid.com/J0GGD"
tomhanks,Movie magic from Stage 16. Hanx  http://www.twitvid.com/NJSVD
tomhanks,Me taking a pic of fake rain cloud for fake rain. Hanx  http://twitpic.com/1raz9h
tomhanks,Behind the scenes. Hanx  http://www.twitvid.com/YU8NH
tomhanks,"Did someone say ""donuts?"" And there is the Proprietress. Hanx  http://twitpic.com/1r9wtz"
tomhanks,Larry Crowne production still. Rain and donuts. Hanx  http://twitpic.com/1r9w03
tomhanks,Kat's Birthday!  Every meal is a party on Larry Crowne. Hanx  http://twitpic.com/1r0u3s
tomhanks,Movie Magic with Johnny Westside and Madia as Larry Crowne and Talia. Looks real!  Hanx  http://twitpic.com/1qzut4
tomhanks,Authenticity at any price on Larry Crowne! Spin! Hanx  http://twitpic.com/1qr736
tomhanks,One Paramount. 2 movies?  Hanx  http://www.twitvid.com/1WUAW
tomhanks,See more on my near-defunct MySpace page http://www.myspace.com/tomhanks - Hanx
tomhanks,60K miles! No GAS! All electric from my EV. http://twitpic.com/1qk645
tomhanks,Night shoots and baseball. Life on Larry Crowne. Hanx  http://twitpic.com/1pvxuy
tomhanks,I TOLD you we ate in The Lunch Box.  The whole crew.  Hanx  http://twitpic.com/1puoyb
tomhanks,Larry Crowne bids you a fine weekend. Hanx  http://twitpic.com/1psac3
tomhanks,Spacious. Clean. Comfortable. A happy Crew uses The Lunchbox. Speck-tack-alar!
tomhanks,How does the crew eat on location on Larry Crowne?  In The Lunchbox expanding trailer. Hanx  http://twitpic.com/1pqk1r
tomhanks,Does Larry Crowne have enough product in his hair? More goop to Stage 17!  Hanx  http://twitpic.com/1pgb8d
tomhanks,Big Stork Pizza. He delivers. On Larry Crowne. Hanx  http://twitpic.com/1p9d8n
tomhanks,The Larry Crowne Cheesecake Test!  I call it a success. Hanx  http://www.twitvid.com/6KFUX
tomhanks,I THINK we shot the Bosom Buddies Pilot on Stage 4 in March 1980. I love Paramount! Hanx  http://twitpic.com/1oyjib
tomhanks,A wide view of Paramount's historic Stage 17. Hanx  http://twitpic.com/1oy4jn
tomhanks,See the new addition?  Those cats are FAST. Hanx  http://twitpic.com/1oy494
tomhanks,A fake backyard @ Paramount Stage17. Hanx  http://twitpic.com/1op6b8
tomhanks,Not Janx.
tomhanks,"""Bonfire...""? Don't think so. That was @ WBros. Add Larry Crowne to this ASAP. Hanx  http://twitpic.com/1on9k7"
tomhanks,Big tweet day. All of Speech 217!  Hanx  http://twitpic.com/1nsdeo
tomhanks,"Last day?  Sob!  So long, Speech 217!  Hanx  http://twitpic.com/1nrzrm"
tomhanks,"Backlot Kettlecorn at lunch. Must be Larry Crowne!  Thanx,  Chef Robert. Hanx  http://twitpic.com/1nrwj4"
tomhanks,"After a day of work, a night at the theater. Hanx  http://twitpic.com/1nluwb"
tomhanks,"""Larry Crowne"" breaks for lunch. Backlot @ Paramount. Hanx  http://twitpic.com/1n8x1a"
tomhanks,"""Wear and Tell"" day in Speech 217 on Larry Crowne. Hanx  http://twitpic.com/1n168d"
tomhanks,Monday's work. Speech 217. Love the teacher!  Hanx  http://twitpic.com/1msj7t
tomhanks,How we shoot Scooter Patrol - via Pursuit Vehicle.  Hanx  http://twitpic.com/1lwlye
tomhanks,Viva Scooter Patrol!  Larry Crowne's Friday.  Hanx  http://twitpic.com/1lwld4
tomhanks,Guess who is Tweetin'. Gary Sinise!  Lt. Dan!  Follow him @GarySinise -  Hanx
tomhanks,Lunch. Backlot. Every day is a picnic on Larry Crowne. Hanx  http://twitpic.com/1llkmp
tomhanks,Show Biz trailer on Paramount Backlot. My HQ for Larry Crowne. Hanx  http://twitpic.com/1lizyr
tomhanks,Prop food for Larry Crowne. 3 days old. Hanx  http://twitpic.com/1l5un6
tomhanks,On the set ten minutes early. Hanx  http://twitpic.com/1kz549
tomhanks,Special Guest Star in Larry Crowne. Hanx  http://twitpic.com/1jqdis
tomhanks,"http://twitvid.com/EBAXS - Larry Crowne's neighbor, @CedEntertainer ...Hanx"
tomhanks,How you direct yourself. With a monitor like this. Hanx  http://twitpic.com/1jgwdb
tomhanks,What an actor sees in a Driving Shot. Glamor. Hanx  http://twitpic.com/1j7kq2
tomhanks,http://twitvid.com/DL0OD - Straight from the set... Hanx
tomhanks,"Shot this line today: 'We're being invaded!"". Sound familiar? Who? What film? Hanx"
tomhanks,UFO? No. Nite shoots on L. Crowne. Hanx  http://twitpic.com/1hycqz
tomhanks,Action on the set of Larry Crowne!!!  Hanx  http://twitpic.com/1hudot
tomhanks,"If you look,  Larry is everywhere! Day 2 of shooting.  Hanx  http://twitpic.com/1hmsy0"
tomhanks,Questions directors must answer: which color for JR's car?  I say the gray. Hanx http://twitpic.com/1hdxsi
tomhanks,LARRY CROWNE - 1st day - 1st shot. Too late to quit. Hanx http://twitpic.com/1hb0nm
tomhanks,"Sinus Virus.  Horrible Cold.  Start Larry Crowne in the AM!  ""The timing on
this is always a bitch.""  Hanx"
tomhanks,Only that Hairstylist knows for sure.  Hanx http://twitpic.com/1gwd3c
tomhanks,"From TVLand, T. Hopkins, H. Taylor, me,  Scolari, ""Red"" and D. Dixon.  B.Buds 4ever + 30 years.  Hanx http://twitpic.com/1gmaqj"
tomhanks,@RitaWilson  Your husband is now 'following' you...
tomhanks,Larry Crowne meets Culture Clash. Actors. Advocates. Co-stars!  Hanx http://twitpic.com/1g1tq1
tomhanks,The decision has been made. Hanx http://twitpic.com/1fucc2
tomhanks,"B. Buds reunion on TVLand but not in LCrowne?  See P. Scolari in 
WHITE'S LIE in NYC!  Hanx"
tomhanks,Camera tests for hair/ MU/Costumes. I am in a costume! Hanx http://twitpic.com/1flqh4
tomhanks,From a morning of work to Play Ball! hanx http://twitpic.com/1fdosn
tomhanks,Hey!  We have a mascot thanks to Twitter. See movie for winner. Hanx
tomhanks,http://twitpic.com/1f72ci - Backstage @ Shakespeare Fest  L/A. Much Ado 1 nite only. Hanx
tomhanks,http://twitpic.com/1ected - Friday lunchtime in the LCPO. Hanx
tomhanks,http://twitpic.com/1e5ttf - How do we shoot this schedule? Hanx
tomhanks,http://twitpic.com/1dwvhp - Who is this actress?  Hanx
tomhanks,http://twitpic.com/1dvnux - Wednesday means Larry Crowne revisions.  Hanx
tomhanks,http://twitpic.com/1do6tc - I pick costumes today. Hanx
tomhanks,http://twitpic.com/1dji76 - Location scouts at night?? The work never stops. Hanx
tomhanks,Cool job. Evidence: phone call from PAM GRIER!  Hanx
tomhanks,Need a mascot for our fake East Valley Comm College.  Ideas?  Pg-13!  Hanx
tomhanks,http://twitpic.com/1c7v62 - Revisions from Mondays Read Thru. Hanx
tomhanks,http://twitpic.com/1c1bcf - Location Scout all day means Hanx@Franks. Hanx
tomhanks,http://twitpic.com/1bssjt - We begin. Hanx
tomhanks,http://twitpic.com/1bsor8 - The Stage 18 is set for the Larry Crowne cast read-thru. Hanx
tomhanks,http://twitpic.com/1b5ae9 - The Larry Crowne Casting Wall (incomplete). Hanx
tomhanks,LCrowne casting update: Wilmer Valderrama!  Wotta coup!  Hanx
tomhanks,@mdh Fabulous! Pass that love on to your students. Hanx; Skyline '74
tomhanks,"@RamblingBelle Great story. Working with his hands, producing something new. Way to go dad. Hanx"
tomhanks,"@chuckcoy Chuck, I'm rooting for you. Where were you the first 47 years? Hanx"
tomhanks,@flimflamkitty Fond memories of college film studies class: Kurosawa. Un Chien Andalu. The Golden Coach. Hanx
tomhanks,@DrJayPatelJr What kind of medicine? Hanx
tomhanks,@shelmajor Did they take it to steal identities online? Joke! Hanx
tomhanks,@Superglrl Rock & Roll? Horseback Riding? Sign me up! Hanx
tomhanks,@thebrotemarkles I had older folks in Jr. college classes ('74-'76) and they were all HILARIOUS. Hanx
tomhanks,"@SNAPOLO I bet she comes home, argues with you and wins every time. Hanx"
tomhanks,"@tonywhiteshoes If Gramps is just sitting around the house watching TV, he's a lazybones! Hanx"
tomhanks,@Redhairgirl510 No way I could take algebra at 55. Can you bring a calculator to class? Hanx
tomhanks,@mineemowse Every organization needs a leader. Good luck! Hanx
tomhanks,"@chazferrari That sounds like a provocative class, yes? Hanx"
tomhanks,L. Crowne goes back to Jr. College @ age 50.  Anyone do that?  What did you take?  Favorite class?  Hanx
tomhanks,http://twitpic.com/1ab0dm - My lunch at the LCPO. Hanx
tomhanks,http://twitpic.com/1aae6p - The question of the day.Hanx.
tomhanks,"Thinking to shoot Larry Crowne not in 3-D, but 6-D. May go all the way 
to 7- or 8-D. Stand by.  Hanx"
tomhanks,"http://twitpic.com/19ew9w - Larry's house on Stage 16,once home to Charlie Wilson. Hanx"
tomhanks,http://twitpic.com/197dg9 - Larry Crowne is getting ready to roll!  Hanx
tomhanks,"http://twitpic.com/19036y - Who had my cold?  5 days down! Back on ""Larry Crowne"" scouts. Hanx"
tomhanks,Veterans. Heroes. Boys in Old Men clothes. Honored on the Mall in DC. http://twitpic.com/17y5s6
tomhanks,"On the road for a location scout, thanks to my Hipstamatic app http://twitpic.com/17m3bg  Hanx"
tomhanks,What I see from my glamorous office at the LCPO... http://twitpic.com/17eb69  Hanx
tomhanks,"OscarShow Flash --  Nope, I didn't hurry the Best Pic bit:  That's how it
was planned and rehearsed from the get go.  Hanx"
tomhanks,Snacks ala MSNBC and the Morning Joe. They nailed it http://twitpic.com/16qygn  Hanx
tomhanks,"Colbert's snack array. Now those are snacks! http://twitpic.com/16mo9i  Thanks, Steve. Hanx"
tomhanks,Dave's Dressing room snacks! http://twitpic.com/16m8un  Hanx
tomhanks,Backstage at guess what show http://twitpic.com/16kme7  Hanx
tomhanks,"The model for ""American Idiot"" on B'Way http://twitpic.com/16klzq  Hanx"
tomhanks,Why we are in NYC http://twitpic.com/16ki0y  Hanx
tomhanks,GMA's dazzling array of Good Morning America snack foods http://twitpic.com/16k9jt  Hanx
tomhanks,"On the road for Pacific. New Orleans. Boston. Dave! Regis! Colbert!  
It's a full time job. I'm tired already. Hanx"
tomhanks,Help a kid out and find a cure for neuroblastoma! 5yo Will Lacey needs your help - RT/donate http://bit.ly/dmhDDz
tomhanks,Pacific premiere at the Chinese. Extra last?  No . Best. Hanx
tomhanks,Offices for a certain film are open!  See you on the Location Scout!  http://twitpic.com/14you8   Hanx
tomhanks,Shout out to Solano Community College (Fairfield CA)! Put on a nice party over the weekend. Thanks and buy TIX for the Theater season. Hanx
tomhanks,"ART DEPARTMENT added to Location Scouts makes for longer caravans.  Guys, lets car pool.  Look for us in ANYTONE USA.  Hanx"
tomhanks,Have earned my Scooter License from DMV.  Why?  LARRY C.  Drive safe.  Hanx
tomhanks,Location scout for what movie? http://twitpic.com/107rv3 And: thanks @taylorswift13! You made the WCRFund fun last night. Hanx
tomhanks,Larry Crowne opens Prod. Offices TODAY.  A major moment for any motion picture.  Hanx
tomhanks,Thanx to Sharon and Mel. LAPD Capt's who got me from Good-bye Conan (sniff) to Hope for Haiti without handcuffs or cherry tops!
tomhanks,Link To Donate: www.hopeforhaitinow.org
tomhanks,Looking to help raise $ for Haiti with G. Clooney on Friday.  Pledge a few bucks with us. Hanx
tomhanks,A session on Toy Story 3 today. That gem is almost done and comes out in June. Btw: Woody is the tallest of all the toys. By far. Hanx.
tomhanks,Flag on me with CoCo tonight!  Going on Fridays Big Show.  What WILL happen? Tune in.  Hanx
tomhanks,"Look out!  Going on CoCo on Tuesday.  Thats the plan, anyway.  Hanx"
tomhanks,A LOCATIONS meeting on Larry Crowne. What glamour!!! Location TBD. It's the job at hand. Hanx
tomhanks,"Copy 5 by 5 on those Back Tweets.  Ill try to keep these snappy.  2010 is KOOKS so far, no?  Hanx"
tomhanks,"Hey. My 2nd tweet! @NIKKIFINKE is right - http://bit.ly/4sx12Z. LARRY CROWNE  w/ J Roberts and me, shooting 2010.  More to come."
tomhanks,Testing... testing... Is this thing on??
