whennboys,"RT @EMOTlONS: I fall, I rise, I make mistakes, I live, I learn, I've been hurt but I'm alive. I'm human, I'm not perfect but I'm thankful."
whennboys,RT @EMOTlONS: Forgive? Yes. Forget? No.
whennboys,When boys hold your hands when kissing you. 
whennboys,When boys can talk to you all day without getting boring. 
whennboys,"RT @ReaIMilaKunis: And by ""K"" I mean fuck you."
whennboys,RT @ReaIMilaKunis: When memories hit you. It hurts like fuck.
whennboys,Be crazy. Be stupid. Be silly. Be weird. Be whatever. Because life is too short to be anything but happy.
whennboys,"Actually no, my status/tweet wasn't aimed at you, but hey, if the shoe fits, feel free to wear it."
whennboys,When boys make you smile like an idiot.  http://t.co/FgIPIZG8
whennboys,When boys don't schedule. 
whennboys,@fentydeIrey I laughed in real life
whennboys,I'm done getting my hopes up when it comes to you.
whennboys,@TeamLadyGayGay im to sad to typ
whennboys,When boys r nice to u. 
whennboys,When boys love making you smile. 
whennboys,rt if u wish u had friends
whennboys,Skinny sexy girls + Fat boyfriend = Insecure boyfriend. So he decided to do this fast! o.o &gt;&gt; http://t.co/puZB95lW - sp
whennboys,When boys want to spend time with you. 
whennboys,"You're everything i want, but everything i can't have "
whennboys,"When boys smile, right before kissing you. "
whennboys,When boys can make you the happiest girl. 
whennboys,RT @reIationships: I wonder what goes through your head when you hear my name?
whennboys,RT @reIationships: You know I'm comfortable with you when: I'm weird with you I sing what ever song comes into my mind I say what's on m ...
whennboys,"RT @reIationships: She gets jealous, she gets mad,she gets worried, she gets curious. But that's only because she loves you so much and  ..."
whennboys,Appreciate me now or I'll be gone soon.
whennboys,Waiting for them to text you first.
whennboys,"I still think about ""us""."
whennboys,Maybe one day I'll be what you need.
whennboys,When boys walk you home. 
whennboys,When boys send you pictures of themselves when they miss you. 
whennboys,When boys look cute in glasses. 
whennboys,When boys talk to you first. 
whennboys,"Dear boys with muscles and a '6'pack, we will always love you! Sincerely , girls loving guys with abs like THIS: http://t.co/M30zszO2 - sp"
whennboys,"The couples that are meant to be, are the ones who go through everything that is meant to tear them apart, and come out even stronger."
whennboys,You don't even know how bad I want you.
whennboys,When boys cook for you. 
whennboys,When boys are sweet + sensitive. 
whennboys,That feeling you get when they tell you they miss you.
whennboys,When boys surprise you with gifts. 
whennboys,When boys flirt with you around their friends. 
whennboys,When boys bite their lips. 
whennboys,When boys look cute with their ears pierced. 
whennboys,When boys hug you from behind tight. 
whennboys,"When boys hold your hands and kiss you, while smiling. "
whennboys,When boys love your eyes. 
whennboys,When boys love your laugh. 
whennboys,RT @ReaIMilaKunis: One loyal girlfriend is worth more than one hundred hoes.
whennboys,RT @ReaIMilaKunis: Be crazy. Be stupid. Be silly. Be weird. Be whatever. Because life is too short to be anything but happy.
whennboys,RT @ReaIMilaKunis: Smiling on the outside. Dying inside.
whennboys,When boys are always sweet to you. 
whennboys,When boys sing to you. 
whennboys,When boys dance with you. 
whennboys,When boys walk with you. 
whennboys,When boys laugh with you. 
whennboys,When boys text you. 
whennboys,When boys kiss you good night. 
whennboys,"I tried my best for you, and even that wasn't enough."
whennboys,Do I love you? Yes. Do I miss you? Yes. Do I want you back? No.
whennboys,Zzzz I'm so tired why do I bother leaving my house
whennboys,"When boys rather stay in with you, than go out. "
whennboys,When boys are protective. 
whennboys,Walk away or try harder? I can't seem to decide.
whennboys,"@biebersdaley Bruno mars, doo-wop &amp; hooligans album"
whennboys,"He doesn't care, never did, never will."
whennboys,When boys have a perfect smile. 
whennboys,"Dear boys if you look like THIS, we will always love you! Sincerely , girls loving guys with abs. (Photos): http://t.co/g1JhxKVg - sp"
whennboys,When boys are good with kids. 
whennboys,I hate you for what you did to me.
whennboys,When boys carry you on their back. 
whennboys,I never stopped missing you.
whennboys,"A B C D E F G H I J K L M N O P Q R S T V W X Y Z. Did I miss something? Oh, I miss U."
whennboys,When boys wrap their arms around you and kiss you. 
whennboys,"When boys smile, when they're with you. "
whennboys,When boys have nice arms.  &gt;
whennboys,Sexy Girlfriend + Fat Boyfriend = Insecure Boyfriend. So he decided to do this! o.o &gt;&gt; http://t.co/CFl0HTlA - sp
whennboys,"I won't lie, when you left, I felt lost."
whennboys,When boys kiss you on the cheek playfully. 
whennboys,When boys hold your hands when kissing you. 
whennboys,"I don't like texting people first. It makes me feel unwanted, awkward, and annoying."
whennboys,"I miss that hug, I miss being with you, I miss our talk, I miss laughing with you. Shortly, I miss you."
whennboys,When boys love making you smile. 
whennboys,RT @roseaIyna: I love what I can't have
whennboys,When boys talk to you in their sleepy voice. 
whennboys,When boys have a cute laugh. 
whennboys,"If he loves you he will make sure you know. Not just by words, but by action too."
whennboys,"RT @MINDBLOWlNG: Scientists suggest, the key to happiness is spending your money on experiences instead of possessions. #MB"
whennboys,"RT @MINDBLOWlNG: Getting upset at people just by hearing them breathing or eating is called ""Misophonia"", which is an actual brain-disor ..."
whennboys,"I cried when you left me, but I laughed when i saw what you left me for."
whennboys,A relationship is a matter of give and take. If you give more than you take then your relationship will last.
whennboys,"The sad thing is, I actually thought you were different."
whennboys,Im still in love with the person you used to be.
whennboys,"Sometimes I hate you, sometimes I love you, sometimes I miss you but there isn't a time where I don't think about you "
whennboys,Girls' dictionary: NO = YES. Maybe = No. We need = I want. We need to talk = You're in deep trouble.
whennboys,Real girls stay. Hoes come and go. Little boys play around. Real men settle down.
whennboys,"I wanna be the reason behind your smile, cause surely, youre the reason behind mine."
whennboys,A guy is only insecure about losing his girl when he knows someone else can treat her better;
whennboys,I wish I could call you mine.
whennboys,You hurt me...so why do I still love you?
whennboys,"God has no phone, but I still talk to him, has no Facebook, but he's still my friend, has no Twitter, but I still follow him."
whennboys,When boys send you a goodnight text. 
whennboys,"I'm done making all the effort, your turn."
whennboys,@roseaIyna NICKI MINAJ
whennboys,@roseaIyna lesbihonest
whennboys,"Dear boys if you look like THIS, we will always love you! Sincerely , girls loving guys with abs. (see pics): http://t.co/QaSKayI6 - sp"
whennboys,"You forget me? I understand. You stop replying my texts? I understand. When I'm over you, you better understand."
whennboys,The best feeling in the world is waking up knowing someone is waiting to talk to you.
whennboys,I love you. *erases* I miss you. *erases* Can we talk? *erases* What's up? *sends*
whennboys,When boys can talk to you all day without getting boring. 
whennboys,Of course I miss you too. I miss everything we had.
whennboys,You make me smile like an idiot.
whennboys,Sexy Girlfriend + Fat Boyfriend = Insecure Boyfriend. So he decided to do this! o.o: &gt;&gt; http://t.co/zFZMyqnn - sp
whennboys,"Morning texts, I like that shit."
whennboys,Loving you was the only thing I'm best at. 
whennboys,When boys are faithful. 
whennboys,Texting the same person all day and night and never getting bored because you like them that much. 
whennboys,When boys have a good personality. 
whennboys,"@biebersdaley You said Niall Horan is ugly? Come! ( '-')  ( '-')  BITCH Do not run, do not run away. ( '-')  ( '-')  ( '-') ."
whennboys,Right person. Wrong timing.
whennboys,When boys call you babe. 
whennboys,The happiest couples never have the same character. They have the best understanding of their differences.
whennboys,The boys who can pull off that messy hair look. 
whennboys,Catching your crush staring at you.
whennboys,When boys kiss you playfully. 
whennboys,"Dont judge me by my past, im not in the past anymore... Accept me for who i am because this is me today. "
whennboys,When boys always know what to say to make you smile. 
whennboys,:(((((((((((((((
whennboys,When boys call you because they miss you. 
whennboys,When boys kiss you goodnight and good morning. 
whennboys,"Baby, Let's cuddle... let's Hug... let's kiss, &amp; let's not let other people ruin our relationship..."
whennboys,Remember old messages and remembering how it used to be.
whennboys,"When boys text you all day, cause they can actually keep a conversation going.  &gt;&gt;"
whennboys,Kissing a girl on the forehead is one of the sweetest things in the world.
whennboys,The moment when all you want is just to be wanted.
whennboys,Just remember I was there when no one else was.
whennboys,When boys ask if they can kiss you. 
whennboys,When boys tell you that you're a good kisser. 
whennboys,When boys know when something is wrong. 
whennboys,When boys are your best friend. 
whennboys,People get jealous when they care.
whennboys,When boys open up to you. 
whennboys, http://t.co/WkkYqCUN
whennboys,@karminmusic you guys were AMAZING TONIGHT in PHOENIX! Lost my voice singing along but it was worth it!! 
whennboys,"Don't lie, don't cheat, and don't make promises you can't keep"
whennboys,Always smile when you can.
whennboys,I get so damn jealous when it comes to you.
whennboys,wanting someone you can't have? That shit hurts
whennboys,When boys love you for who you are. 
whennboys,"I want a cute, long relationship where everyone is like ""damn, they're still together?"""
whennboys,You and I used to talk a lot.
whennboys,When boys let you wear their sweater/hoodie. 
whennboys,I hate missing someone knowing they don't give a fuck.
whennboys,"Dear boys if you look like THIS, we will always love you! Sincerely , girls loving guys with abs. &gt;&gt; http://t.co/XJTZgLcD - sp"
whennboys,"Calls are cool, texts are alright, tweets are chill, a Facebook message is okay, but nothing beats seeing someone in person."
whennboys,"Catching the heart of a man is easy, keeping him faithful is the real challenge."
whennboys,I just want to go back to the days where we'd talk for hours.
whennboys,"We fight, we kiss, we hug, we text, we talk, we argue, we laugh, we smile, we love... Thats us "
whennboys,"I'm done making all the effort, your turn."
whennboys,"True love comes once in a lifetime. When you find it, you'll know."
whennboys,Girl gets so fat her boyfriend dumps her. So she decides to lose weight by doin THIS. Shocking before/after pics!: http://t.co/EC5JkExu - sp
whennboys,Unexpected texts &gt;
whennboys,"Things girls appreciate: Cute texts, tight hugs, holding hands, remembering the little things, soft kisses."
whennboys,"I wish more guys thought with their heads on their shoulders, more than the head in their pants."
whennboys,@carlyraejepsen #Jepsies &lt;3 #CRJFans
whennboys,When boys are your best friend and boyfriend; 
whennboys,When boys can keep a conversation going.  &gt;
whennboys,When boys lift you up and kiss you. 
whennboys,When boys hold your hand. 
whennboys,Sometimes it's so hard and I just want to unmeet you.
whennboys,I like naps and you.
whennboys,"RT @MINDBLOWlNG: If you lick someone's elbow while they're not paying attention, they won't feel it. #MB"
whennboys,"RT @MINDBLOWlNG: The more attracted you are to someone, the easier it is for them to make you laugh! #MB"
whennboys,"The worst feeling is when someone makes you feel special, then suddenly leaves you hanging, and you have to act like you don't care at all;"
whennboys,I'm here if you need me.
whennboys,"I dont trust words, I trust actions."
whennboys,The best feeling in the world is knowing that you actually mean something to someone.
whennboys,Someone will always be prettier. Someone will always be smarter. Someone will always be younger. But they will never be you.
whennboys,#ThingsWomenWant: Someone they can trust. Without trust there is no relationship. Trust is the foundation.
whennboys,#ThingsIwannaTellYouButCant: I miss you. I love you. I need you. I'm sorry.
whennboys,#Nothingfeelsbetterthan when your phone vibrates and it's a text message from that ONE person you've been dying to hear from!
whennboys,"#GirlsLoveWhen you text them, ""good morning beautiful."" You have no idea how much that one little message will brighten their entire day."
whennboys,"#myweakness is always forgiving people who don't deserve it, just because I miss having them in my life."
whennboys,This.  http://t.co/EzZrYWta
whennboys,"I just want you, no one else."
whennboys,Love is friendship set on fire.
whennboys,69% of high school teen girls admit they are jealous of other girls who look like this: &gt;&gt; http://t.co/FZL541I3 - sp
whennboys,When boys stay up late just to talk to you. 
whennboys,"A boyfriend will put a lock on his phone. A REAL boyfriend will say, ""Hey baby, can you read that text for me."""
whennboys,"If you thought I would wait for you, you thought wrong."
whennboys,When boys love you just the way you are. 
whennboys,Sexy Girlfriend + Fat Boyfriend = Insecure Boyfriend. So he decided to do this! o.o &gt;&gt; http://t.co/nBxBjnye - sp
whennboys,"I wish I could see you. Literally, right now, at this very second. I want to be with you."
whennboys,"I miss seeing your smile, and hearing the sound of your voice calling my name."
whennboys,I hate being second to those I put first.
whennboys,I like having someone that can make me smile and laugh so easily.
whennboys,When boys wrap you around their arms. 
whennboys,"A real relationship. Has fights. Has trust. Has faith. Has tears. Has hurt. Has laughter. Has weird, stupid, unnecessary arguments."
whennboys, o .
whennboys,"I promise to stay, if you promise to never leave."
whennboys,I miss you. I need you. I love you. #IAdmitThat.
whennboys,"A girl who truly loves you will be angry at you for so many things, but will never leave you. "
whennboys,When boys cook for you. 
whennboys,#WhatILoveTheMost is being with you.
whennboys,"A simple ""I miss you"" can change everything."
whennboys,When boys can play the guitar. 
whennboys,"Wanted by many, taken by none. Looking at some, waiting for one."
whennboys,"With you, I can forget all my problems. With you, time stands still. With you, theres no one else."
whennboys,"When boys are confident, not cocky.  "
whennboys,The moment when all you want is just to be wanted.
whennboys,"RT @MINDBLOWlNG: Chuck Norris was born May 6,1945. The Nazis surrendered May 7, 1945. Coincidence? #MB"
whennboys,"RT @MINDBLOWlNG: Hugs that last over 20 seconds, release a chemical in your body called ''Oxytocin'' that makes you trust someone more. #mB"
whennboys,RT @MINDBLOWlNG: Smoking one cigarette takes around 11 minutes off of your life span. #MB
whennboys,"A morning text doesn't only mean ""good morning"" It also means ""I think about you when I wake up"""
whennboys,She's a keeper. Too bad you didn't keep her.
whennboys,Every girl deserves a guy who looks at her everyday like its the first time he saw her.
whennboys,"Even though we don't talk anymore, I will never forget our memories."
whennboys,Your hugs are my favorite.
whennboys,"Girlfriend : Babe , Whats Your Fav Position? ;) Boyfriend : When I Get On One Knee and Make You My Wife;"
whennboys,"She comes off as strong, but maybe she fell asleep crying. She acts like nothing is wrong, but maybe she's just really good at lying;"
whennboys,"He's cute. He's tall. He's got gorgeous eyes. And a stunning smile. I didn't say a name, but he popped in your head, didn't he?;"
whennboys,"My problem is I can't stay mad. I always end up forgiving people, even when they don't deserve it.;"
whennboys,"A jealous girlfriend is a faithful girlfriend. If she doesnt get jealous when someone has your attention, it's because someone has hers;;"
whennboys,@LGMonsterFacts Good night doll
whennboys,Cuddling &gt; Everything.
whennboys,@bieberdelrey i love to sub tweet u :c
whennboys,I always wonder if you smile at my texts like I smile at yours.
whennboys,A gentleman never breaks a promise.
whennboys,Jealousy = I actually care about you.
whennboys,Girl gets so fat her boyfriend dumps her. So she decides to lose weight by doin THIS. Shocking before/after pics!: http://t.co/wqYajlb0 - sp
whennboys,"My ex? Were not friends, were not enemies. Were just strangers with some memories."
whennboys,When boys surprise you with flowers. 
whennboys,I hate the idea of anyone else having you.
whennboys,RT @Respectforboys: Hate when you stop talking to the person you always talked to everyday.
whennboys,"RT @Respectforboys: No texts, no calls, nothing. But I'm still here thinking about you like crazy."
whennboys,I love it when I catch you looking at me then you smile and look away.
whennboys,That feeling you get when they tell you they miss you.
whennboys,"Girl leaves boy cause he was too FAT. 2-weeks later, has a 6 pack! Now she wants him back. Before/after pics!: http://t.co/miag149S - sp"
whennboys,"A girl is like a book: don't judge her by her cover, but read her carefully, page by page, and you'll discover her whole story."
whennboys,3 things you should never break: 1) Trust. 2) Promises. 3) Hearts.
whennboys,"Yes I still think about you, yes, I still do miss you, yes, I still visit your profile."
whennboys,"Girls want a guy that can openly say, ""Yes that's my girlfriend and yes I do love her."" "
whennboys,Sexy Boyfriend + Fat Girlfriend = Insecure Girlfriend. So she decided to do this! o.o &gt;&gt;&gt; http://t.co/dt15YNW1 - sp
whennboys,"When the boy you secretly like, hugs you. "
whennboys,"I'm tired of waiting, I want you now."
whennboys,When boys wrap their arms around you. 
whennboys,You are beautiful. And nobody has the right to make you feel like you're not.
whennboys,I don't think you realize how easily you make me smile.
whennboys,69% of people do not know this about peeing. #scary: http://t.co/tG73c3uv - sp
whennboys,"The beginning of a relationship is always the best, when they are all into you."
whennboys,"Calling her baby, will make her melt every time. Promise."
whennboys,Are you falling for me like I'm falling for you?
whennboys,When boys don't rush sex into the relationship. 
whennboys,I was stupid for falling for you.
whennboys,We met  We talked  We liked  We called  We texted  We dated  We committed  I loved  You cheated  We're done.
whennboys,"Dear guys, when a girl says 'I'm Fine' talk to her until the real truth comes out."
whennboys,"I don't want to be your first, I want to be your last."
whennboys,When boys give you their sweater/hoodie.  &gt;
whennboys,"Dear God, thank you for all my blessings, my wonderful family, my healthy life, and thank you for what you have in store for my future."
whennboys,When boys make you laugh. 
whennboys,When boys kiss and smile while looking into your eyes. 
whennboys,When boys are best friend before boyfriend. 
whennboys,When boys love spending their free time with you. 
whennboys,When boys go on road trips with you. 
whennboys,"When boys cheer you up, when you're done. "
whennboys,"RT @ReaIMilaKunis: My haters are my motivation. So keep going, you're only making me stronger."
whennboys,"RT @ReaIMilaKunis: If they cheated on someone to be with you, chances are they'll cheat on you too."
whennboys,When boys can text you all day.
whennboys,When boys are good kissers. 
whennboys,When boys love kissing you. 
whennboys,The boys who wrestle with you. 
whennboys,"you text him, he doesn't back. he was obviously so excited that you texted him that he fainted."
whennboys,@FIirting YAY DAVE!!!! CONGRATS!!!!!
whennboys,Being lonely isn't the worst feeling. The worst feeling is being forgotten by someone you will never forget.
whennboys,"Love shouldn't be planned, it should happen naturally."
whennboys,When boys love the same music as you. 
whennboys,I hate hearing something that absolutely kills you inside and having to act like you don't care...
whennboys,"Skinny = anorexic, thick = obese, virgin = too good, non-virgin = slut, friendly = fake, quiet = rude. You can never please society."
whennboys,When boys make time for you. 
whennboys,Me and you together? I like that shit.
whennboys,I always wonder if you smile at my texts like I smile at yours
whennboys,"Girls, do you agree with my last tweet?!"
whennboys,69% of high school teen girls admit they are jealous of other girls who look like this: &gt;&gt; http://t.co/l0QIBDds - sp
whennboys,Girls just want a guy who cares about her and puts in the effort to show her.
whennboys,I'm not perfect. You're not perfect. But we're perfect together and that's all that matters.
whennboys,#MistakesBoysMake Giving another guy the opportunity to make his girl smile.
whennboys,Emotionally: I'm done. Mentally: I'm drained. Spiritually: I feel dead. Physically: I smile.
whennboys,I love how you smile when you talk to me.
whennboys,"When boys are about to leave and ask ""No hug?"" "
whennboys,Missing you hurts.
whennboys,"Be with someone who wont stay mad at you, who cant stand not talking to you, and whos afraid of losing you. -Drake"
whennboys,Girl gets so fat her boyfriend dumps her. So she decides to lose weight by doin THIS. Shocking before/after pics!: http://t.co/3ca1W1vY - sp
whennboys,"All of my friends are like, ""I love him. He gave me his hoodie, and we kissed in the rain."" And I'm just sitting here like; ""I love food."""
whennboys,A boy's sleepy voice is seriously the sexiest thing ever.
whennboys,"#BestTextMessages those random ""I miss you"" messages, waking up to a ""good morning beautiful"" text, and always an ""I love you"" text."
whennboys,I love it when you text me first. 
whennboys,"I don't have a type. If I like you, I like you."
whennboys,"Your girlfriend should be your bestfriend, so dont treat her like a friend with benefits."
whennboys,Missing you is becoming a habit.
whennboys,A kiss on the forehead is one of the sweetest thing in the world 
whennboys,Our small and stupid conversations mean so much more to me than youll ever know. 
whennboys,"Relationships include: Fights, Jealousy, Arguments, Faith, Tears, Disagreements, But a REAL relationship fight through all that with love."
whennboys,"RT @EMOTlONS: A relationship where you can act like complete idiots together, is the sweetest thing ever."
whennboys,"RT @EMOTlONS: You forget me? I understand. You stop replying my texts? I understand. When I'm over you, you better understand."
whennboys,"I'd rather hear a guy say, ""I've made plans for us,"" instead of the usual, ""I don't know; whatever you wanna do."""
whennboys,A girl doesn't need anyone who doesn't need her - Marilyn Monroe.
whennboys,Girls want a guy who says I love you every night and proves it every day. That simple.
whennboys,"It doesn't matter how long you've known her.
if she's kept you smiling since *day one, don't lose her. "
whennboys,RT @ReaIMilaKunis: I'm only a bitch when bitches give me a reason to be one.
whennboys,RT @ReaIMilaKunis: Life's better after you cut the bullshit people out of it.
whennboys,He saw you. He met you. He wanted you. He liked you. He chased you. He got you. He had you. He got bored of you. He left you. He broke you.;
whennboys,Girls want a guy who says I love you every night and proves it every day. That simple;
whennboys,"When a girl is silent, shes either over-thinking, tired of waiting, falling apart, crying inside, or all of the above."
whennboys,"Dear girls with a broken heart,
There are guys out there with glue guns.
Sincerely, Me. "
whennboys,When boys have dimples. 
whennboys,"No matter how many times a girl denies it, she'll always remember every detail, moment and piece of the memories you've left her."
whennboys,"I still like you, but I'm done chasing you."
whennboys,"She says she doesn't care, but her eyes tell a different story."
whennboys,Where is @biebersdaley DM me when u get online a$ap
whennboys,"Worst feelings: Crying yourself to sleep, being ignored, discovering that the person you love, loves someone else, not being loved back."
whennboys,When you get ignored by the one person you really want to talk to. &lt;
whennboys,@AlexConstancio7 I miss you too
whennboys,When boys hold you in their arms. 
whennboys,"Dear girls, imagine wearing these ""JustFab"" shoes for prom or graduations? Sincerely, on Sale!: http://t.co/DQkQQ4zE - sp"
whennboys,"I play the same song, over &amp; over cause it reminds me of you. "
whennboys,"We fight  , we curse  , we kiss , we hug  , we text  , we talk  , we argue , we laugh  , we smile  , we love  , thats us "
whennboys,When boys have a good sense of humor. 
whennboys,You are insecure. I do not know what for. 
whennboys,When boys drive you around. 
whennboys,69% of high school teenage girls admit they are jealous of other girls who look like this &gt;&gt; http://t.co/HsSIKidG - sp
whennboys,I'll be okay someday... but not now.
whennboys,It's not always easy to fake a smile.
whennboys,"Screw what they say, you're worth it to me."
