whennboys,"I don't want a perfect relationship. I just want someone who I can act silly with, someone who treats me well and loves being with me."
whennboys,I want to meet someone who is afraid to lose me.
whennboys,"Silence is a girl's loudest cry. If she is speechless, her heart is too tired for words."
whennboys,When boys let you know that you were on their mind. 
whennboys,RT @EMOTlONS: I hate opening a text that I know is going to make my heart drop
whennboys,"RT @EMOTlONS: I love everybody. Some I love to be around, some I love to avoid, and others I would love to punch in the face."
whennboys,I love you... Can you please love me too?
whennboys,"Care too little, you'll lose them. Care too much, you'll get hurt."
whennboys,"Sometimes I love you, sometimes I hate you, but there isn't a day that goes by that I don't miss you."
whennboys,Playful Relationship  &gt;
whennboys,When boys fight for you. 
whennboys,RT @AlISheWants: Boys who have the perfect smile. 
whennboys,"RT @AlISheWants: If you can be yourself around them, keep them."
whennboys,"Giving your friend ""the look"" when you see someone attractive. "
whennboys,"Everyone is beautiful, but sometimes it just takes the right person to see it."
whennboys,"You have to give a little respect, if you want a little respect."
whennboys,When boys give you all their love &amp; affection. 
whennboys,Every girl deserves to be someone's everything.
whennboys,"The first person you think of in the morning is either the cause
of your happiness or the cause of your pain."
whennboys,"The less you care, the happier you'll be."
whennboys,Cute boy + Playing with little kids = Cutest thing ever.
whennboys,"For you, she was a chapter. For her, you were the book."
whennboys,Girls love a boy who's a good kisser. Here's ways to find out if he's a good kisser: http://t.co/4N6F4W0N - sp
whennboys,I wish you could see the stupid smile I get when we're texting.
whennboys,When boys want to take care of you. 
whennboys,I'm sick of these mixed signals. I'm only human. I can't read your mind.
whennboys,"You are everything I think about, you are everything I want. "
whennboys,"I want a relationship where we can act like idiots, talk about the most random stuff, share music, and never get tired of each other. "
whennboys,Never thought I'd get over you.
whennboys,Pikachu
whennboys,"I think about you a lot, but I try not to, because I know you aren't thinking about me."
whennboys,Boyfriend left girl cause she's too fat. She decided to lose weight fast. Her before/after pictures are shocking!: http://t.co/grUXZLDR - sp
whennboys,"I dont hate you, I never will. I just act like I do, because its easier than admitting that I miss you."
whennboys,A relationship where you can act like complete idiots together &gt;
whennboys,Confidence is a woman's sexiest trait.
whennboys,It's always a good time
whennboys,"Dont rush anything. When the time is right, itll happen."
whennboys,"Can we just like, lay down and look at the star's together?"
whennboys,When boys love holding your hand in your public. 
whennboys,Emotionally: I'm done. Mentally: I'm drained. Spiritually: I feel dead. Physically: I smile.;
whennboys,#BuyLWWYoniTunes
whennboys,When boys hold you when you're cold. 
whennboys,When boys text you good morning. 
whennboys,"RT @CrazyHoneyBooBo: I GOT 99 DONUTS, CUZ A BITCH ATE ONE."
whennboys,"Girls are difficult, sometimes they want attention, sometimes they want to be left alone.. No one will ever understand the female species."
whennboys,It's so easy to fall in love but hard to find someone who will catch you.
whennboys,"If you really care for me, you won't hurt me this badly."
whennboys,Love is when I see you smile.
whennboys,When guys get jealous it's kinda cute. When girls get jealous World War III is about to start!
whennboys,"In a girls life there are three things you don't mess with- Her family, her bestfriends and her crush."
whennboys,"Cuddling, snuggling, smiling, laughing, kissing: all the things I want to do when I think of you!"
whennboys,"Yes, I'm a girl. I get jealous sometimes, I push doors that say pull, I wish for love at 11:11 and when I say I love you, I'm not lying."
whennboys,"""It may seem as the hardest thing to do, but you have to forget the guy who forgot about you."" - The Notebook "
whennboys,"If you're single, going through a breakup, or deeply in love... Then follow - @AlISheWants his tweets are inspiring, funny &amp; honest. "
whennboys,RT @AlISheWants: All she wants is someone to muck around with. 
whennboys,RT @AlISheWants: Hugs and cuddles. &gt;
whennboys,RT @AlISheWants: AlI she wants is respect.
whennboys,"From a girls point of view, the guy always chooses the slut. From a guys point of view, the girl always chooses the jerk."
whennboys,Guys who stick up for you. 
whennboys,I still think about you....every day.
whennboys,"I didn't give up on our relationship because I stopped loving you, but because I was the only one doing everything to show you I love you."
whennboys,@fentydeIrey @zaymmaIlik i heart u whit what
whennboys,My relationship is like an iPhone5. I dont have an iPhone 5.
whennboys,"Sexy Boyfriend + Fat Girlfriend = Insecure Girlfriend. So, she decided to diet + get skinny fast &amp; did THIS.  http://t.co/QVJcvFC9 - sp"
whennboys,"If you're not willing to risk it all, You don't want it bad enough."
whennboys,"Never expect. Never assume. Never ask. And never demand. Just let it be. If it's meant to be, it will happen."
whennboys,"Just because I don't start the conversation, doesn't mean I'm not dying to speak to you."
whennboys,"I'm scared of getting too close to anyone, because those who said that they'll always be there for me, left."
whennboys,Never let a boy define who or what you are worth.
whennboys,When boys take you out on a special date. 
whennboys,Guys who smell good. 
whennboys,80% of people do not know this about peeing. #scary: http://t.co/i5gFsnXB - sp
whennboys,When your girlfriend has Taylor Swift lyrics as her status. Either you've done something very right or very wrong.
whennboys,When boys sneak out to see you. 
whennboys,Right from the start I knew I had to make you mine.
whennboys,I could hug you for hours.
whennboys,"#DontTouchMy food, clothes, make up, or hair."
whennboys,When boys love making you laugh. 
whennboys,Texting the same person all day and night and never getting bored because you like them that much. 
whennboys,"I might not text you first, but that doesnt mean I'm not dying to talk to you."
whennboys,"I cared, you didn't. I cried, you laughed. I was hurt, you smiled. I moved on, you realized. Too late."
whennboys,Love happens when you least expect it.
whennboys,When boys have a cute laugh; 
whennboys,Waiting for a text that you'll probably never get &lt;&lt;&lt;
whennboys,@w1ngsee shes the queen of pop :(
whennboys,"When boys sing with you, even if they're horrible singers. "
whennboys,i wish i was carly rae jepsen :(
whennboys,When boys stare into your eyes before kissing you. 
whennboys,When boys care about your feelings. 
whennboys,"A million feelings, a thousand thoughts, hundreds of memories, all for one person."
whennboys,"RT @EMOTlONS: Learn to give more, and expect less. You'll be happier that way."
whennboys,"Someone who really loves you sees what a mess you can be, how moody you can get, how hard u are to handle, but still wants u in their life."
whennboys,"My problem is I can't stay mad. I always end up forgiving people, even when they don't deserve it."
whennboys,"I don't care. I don't care. I don't care. I don't care. I don't care. I don't care... Who am I kidding, I do care, I care too much;"
whennboys,RT @AlISheWants: All she wants is to be swept off her feet. 
whennboys,RT @AlISheWants: Is it really that hard to just tell the truth?
whennboys,Cuddling &gt;
whennboys,"Fuck texting, I want you here;"
whennboys,"You ever see like couples all in love and think ""damn I want that."""
whennboys,"Sometimes a simple ""I miss you"" changes everything....."
whennboys,Remember when you cared? I miss that.
whennboys,You don't even realize how much I love talking to you..
whennboys,I miss waking up to texts from you..
whennboys,I will cuddle the fuck out of you.
whennboys,"You can't delete feelings, just like you can't erase memories."
whennboys,"I still think about you, even though I know things will never change."
whennboys,When boys have a cute smile. 
whennboys,I still think about you.
whennboys,"I want to kiss you really, really bad."
whennboys,When boys can sing. 
whennboys,"Sexy Girlfriend + Fat Boyfriend = Insecure Boyfriend. So, he decided to get these HOT ABS &amp; did THIS.  http://t.co/mvigWrXw - sp"
whennboys,"Maybe I hope too much. Maybe I dream too much. But at least I won't give up until I've tried, and I won't regret anything. "
whennboys,When boys send you random pictures of themselves when they miss you. 
whennboys,When boys cuddle with you for no reason. 
whennboys,Cuddling in bed &amp; falling asleep is probably the best feeling in a relationship..
whennboys,"I want to run, but only far enough to make you miss me."
whennboys,"A girl just wants to feel beautiful, be loved, and to be treated with respect."
whennboys, The boys who http://t.co/Z1pGFO3Q
whennboys,"When boys text you ""I miss you"", first. "
whennboys,"She gets jealous, she gets mad,she gets worried, she gets curious. But thats only because she loves you so much and doesnt wanna lose you."
whennboys,Grandma left Grandpa because he was too FAT. Grandpa decided to get ABS. Before/after pictures are shocking!: http://t.co/OEdjdVAj - sp
whennboys,When boys love being around you. 
whennboys,"Sitting next to you doing nothing, means everything."
whennboys,"When you're around, nothing else seems to matter."
whennboys,When boys know how to make you smile. 
whennboys,When boys love your smile. 
whennboys,When boys are afraid to lose you. 
whennboys, o ;
whennboys,"Boy: ""Falling in love with you is the second best thing that's ever happened to me."" Girl: ""What's the first?"" Boy: ""Finding you"" "
whennboys,"All girls want is to feel beautiful, be loved, and to be treated with respect."
whennboys,I miss how close we used to be..
whennboys,I may not be too expressive to tell you how much I wanted to simply have you. But one thing I know for sure that I never want to lose you 
whennboys,This.  http://t.co/z6iGVDKW
whennboys,I cried a lot because of you. I laughed alot because of you. I believed in love because of you.
whennboys,"I wish it was me you were doing all those thing with, me you were sharing your love with &amp;amp; me you were spending time with, not her"
whennboys,"If every word I said made you smile, I would talk forever. "
whennboys,"Just for once, I want someone to be afraid of losing me."
whennboys,When boys are crazy about you. 
whennboys,"Sometimes, a hug is all you need to make you feel better. "
whennboys,I still think about you..
whennboys,Love was only a word until I met you.
whennboys,You're just not worth the fight anymore.
whennboys,If only you knew what we could be.
whennboys,"""Keep smiling, life is beautiful and there is so much to smile about."" -Marilyn Monroe"
whennboys,http://t.co/D9zH4MYW
whennboys,"I may not be the girl that everyone wants, but at least Im not the girl that everyone had."
whennboys,When boys love to hear your laugh. 
whennboys,Being with you &gt; anything.
whennboys,"Girl dumps guy because he's fat, guy gets a six pack! 2 Weeks later, girl see's guy looking this HOT with his abs: http://t.co/FgqfcZuQ - sp"
whennboys,I miss how happy I was with you.
whennboys,"You're the one of those people that I need in my life. I can't stand not talking to you, I think about you all the time."
whennboys,http://t.co/i007VgDu
whennboys,"A love like ours isn't common, we treat each other with respect and we remain loyal because we only want to be with eachother."
whennboys,"I'm done. I'm done texting you first, I'm done hoping you'll call, and I'm done crying myself to sleep. You're just not worth it anymore."
whennboys,Seeing boys play with little kids is probably the most attractive thing ever. 
whennboys,"If a girl is silent, it's dangerous. They're either: about to blow up, need a hug, falling apart, crying inside or all of the above"
whennboys,"Dear tummy, please push some fat up to the boobs. Sincerely, these before and after pictures are shocking!: http://t.co/hsLxFH5E - sp"
whennboys, http://t.co/tgtLVrij
whennboys,"I miss the long talks, and long laughs, and the long kisses. "
whennboys,When boys kiss the back of your hand. 
whennboys,"Worst feelings: crying yourself to sleep, being ignored, discover the person you love loves someone else, someone falls outta love with you"
whennboys,Care too little .. You'll lose them. Care too much .. you'll get hurt.
whennboys,"Once a female has been played, it's hard for her to trust again."
whennboys,I still think about you.
whennboys,"Treat her right, or watch some other guy do it for you."
whennboys,"Im not jealous, i just dont want you to forget about me"
whennboys,Lip biting while kissing &gt;&gt;&gt;
whennboys,"If you hold on too long, you end up getting hurt."
whennboys,"I'm not ignoring you, I'm just waiting to see if you'll make an effort."
whennboys,"If you still carry her bags, open the door for her, tell her that shes beautiful, and show her respect...you're a real man."
whennboys,"If you really care for me, you won't hurt me this badly."
whennboys,RT @EMOTlONS: 3 main rules in a relationship: Dont lie. Dont cheat. Dont make promises you cant keep.
whennboys,"RT @EMOTlONS: A morning text doesn't only mean ""good morning."" It also means ""I think about you when I wake up"". "
whennboys,"When guys lie, they say they love you. When girls lie, they say they don't."
whennboys,Should I smile because we are friends? Or cry because we'll never be anything more?
whennboys,"Those late night text conversations, where everything comes out, and you admit everything."
whennboys,I wonder if I've already met the person I'm going to marry.
whennboys,"I'm afraid if someone else catches your attention, you'll ignore me, maybe even worse.. replace me."
whennboys,"Dear anyone considering suicide, please don't give up. You're needed. You're wanted. You're important. You're loved. You're beautiful."
whennboys,It's scary how easily people seem to move on so fast. How what once meant so much can be forgotten like it meant nothing.
whennboys,"When I got attached, you left."
whennboys,"Your smile, your hugs, your laugh, your texts I truly miss everything that makes my day perfect, it's you."
whennboys,I miss you but you seem just fine without me.
whennboys,Never ignore a person who loves you and cares for you.
whennboys,"For a girl, every relationship starts with ""He's different"" and ends with ""He's just like the rest."""
whennboys,All a girl really wants is for one guy to prove to her that they are not all the same. -Marilyn Monroe
whennboys,"I don't want anyone else to have your heart, kiss your lips, be in your arms, be the one you love. I don't want anyone to take my place."
whennboys,I just want someone who won't give up on me.
whennboys,I wish you could see the stupid smile I get when we're texting.
whennboys,"Have you noticed that when you do something good, no one seems to remember, but when you mess up, no one seems to forget?"
whennboys,"Everyone is beautiful, but sometimes it just takes the right person to see it."
whennboys,#2ThingsILove: Your smile. Your laugh.
whennboys,"The two hardest things to say in life are, ""hello"" for the first time, and ""goodbye"" for the last time."
whennboys,It hurts being ignored by the one who means most to you.
whennboys,When boys are honest about their feelings. 
whennboys,When boys tell you they love you 
whennboys, When boys http://t.co/fvvYS7f6
whennboys,A true relationship is when you can tell each other anything and everything. No secrets and no lies.
whennboys, When boys http://t.co/iFp2SPdf
whennboys,I wish you could see the stupid smile I get when we're texting.
whennboys,You should be mine. 
whennboys,You have no idea how worthless you made me feel. Thanks.
whennboys,I'm so fucking scared of getting hurt again.
whennboys, The boys who http://t.co/a9aWEPCF
whennboys,I need you more than I'll ever admit. 
whennboys,The worst part of it all.. is I actually believed I had a chance with you.
whennboys,"Distance shouldn't stop you. If you really want someone, you'll make it work."
whennboys,#ILoveWhenBoys look out for you and care for you; 
whennboys,#iLoveWhenBoys play with your hair. 
whennboys,I'll always have feelings for you.
whennboys,Can we date now? 
whennboys,Getting attached to the wrong person &lt;
whennboys,I miss when I used to mean something to you..
whennboys,Shut up and kiss me. I hate fighting with you.
whennboys,The biggest mistake you can make is holding onto someone who has already let you go.
whennboys,"Stop chasing after them, let them come chase you."
whennboys,I miss the way we used to be when we were together.
whennboys,It's hard to forget someone that gave you so much to remember.
whennboys,Always respect other people's feelings.
whennboys,"We come to love not by finding the perfect person, but by seeing the imperfect person perfectly. "
whennboys,I forgive you but I will never forget what you did.
whennboys,Late night texting &amp; phone calls are the best ever.
whennboys,  http://t.co/Z6kJkMxJ
whennboys,When boys http://t.co/e70oScnT
whennboys,http://t.co/LIRbbQH7
whennboys, When boys http://t.co/jj14eM8A
whennboys,When boys have abs like the guy in my last tweet 
whennboys,"Girl dumps Guy 'cause he's fat, Guy gets a six pack! 2Weeks later, he looks like THIS. Shocking before/after pics: http://t.co/UBsSKNDX - sp"
whennboys,When boys are cute with you in public. 
whennboys,"In a girls life there are three things you don't mess with- Her family, her bestfriends and her crush."
whennboys,When boys surprise you with flowers.
whennboys,When boys call you when they wanna hear your voice.
whennboys,Go away = Show me you care enough to stay.
whennboys,"The longer you hide your feelings for someone, the more you fall for them."
whennboys,I'm so fucking scared of getting hurt again.
whennboys,"Just because the relationship ended, doesn't mean the feelings did."
whennboys,"Touch her heart, not her body. Steal her attention, not her virginity. Make her smile, not cry."
whennboys, When boys http://t.co/f4JLmrly
whennboys,When boys are afraid to lose you'
whennboys,"I want you. All of you. Your flaws. Your mistakes. Your imperfections. I want you, and only you."
whennboys,When boys tickle you. ;
whennboys,When boys appreciate you and don't take you for granted.
whennboys,"Love doesn't need to be perfect, it needs to be true;"
whennboys,"I guess when you said forever, you meant until you found someone better."
whennboys,"The fact is, I love him. He's the boy I want and one day he'll be MINE."
whennboys,"I wanna wrap you up, wanna kiss your lips."
whennboys,"I guess it's just one of those ""I miss you so fucking much' kind of nights."
whennboys,Speechless. That's how you make me feel.
whennboys,A pretty face doesn't mean a pretty heart.
whennboys,"That's great, but when I needed you to stand by me, you blew me off. So, I don't need you here now."
whennboys,You were the greatest thing that ever happened to me. 
whennboys,That feeling you get when their name shows up on your phone;
whennboys,"I act like I don't care, but deep inside, it hurts."
whennboys,"The right way to kiss a girl: Push her up against a wall, hold her arms above her head and kiss her like you mean it."
whennboys,When boys http://t.co/k7qg3tia
whennboys,Stop being so attractive.. it's distracting.
whennboys,4 main reasons a girl will stop texting you: 1. You got her mad 2. You got boring 3. She fell asleep 4. You said the letter 'K'.
whennboys,The awkward moment when your parents get you THESE iPhone cases. o_o: http://t.co/xqnpOrv3 - sp
whennboys, When boys http://t.co/skBpxqsu
whennboys,"She smiles all day long, and then cries herself to sleep at night."
whennboys,When boys play sports. 
whennboys,When boys http://t.co/Bmlz62oj
whennboys,Don't bother apologizing if you're just going to continue doing the things you said sorry for.
whennboys,"I didn't mean to fall in love, but you made it so easy."
whennboys,"When I grow up, I want a son first, then a daughter; So my son would beat up any boy that makes my little girl cry."
whennboys,"A person's heart isn't a toy, so don't play with it."
whennboys,"Girl dumps Guy 'cause he's fat, Guy gets a six pack! 2Weeks later, he looks like THIS. Shocking before/after pics: http://t.co/dBZHy00o - sp"
whennboys,I miss you but you seem just fine without me.
whennboys,You're cute. Too bad you're a jerk.
whennboys,I miss you so badly.....
whennboys,"You'll get bored of me. U'll get annoyed of me. U'll hate me. U'll stop talking to me. You'll leave me. Eventually, just like everyone else."
whennboys,"I want a guy who will see me wearing sweats, hair messy, and no makeup and the first thing he says is, ""damn you look beautiful."""
whennboys, When boys http://t.co/H3Hjw4Nh
whennboys,Not talking to you kills me inside.
whennboys,The nice guys and girls are always the ones that get hurt the most.
whennboys,"I love making you laugh because for those few seconds, I made you happy and seeing you happy, it makes me happy too."
whennboys, When boys http://t.co/p6RUCjEm
whennboys,"If you love someone, be brave enough to tell them, otherwise, be brave enough to watch them be loved by someone else."
whennboys,Ignoring the world when your crush is texting you.
whennboys,"Remember when I said I'm fine? Yeah, I lied."
whennboys,"""Us"" I like the sound of that."
whennboys,I say I don't care about you but every time my phone vibrates a part of me hopes it's you.
whennboys,"Dear Cancer, I hope one day youre just a zodiac sign."
whennboys,"Im not perfect, but Im loyal."
whennboys,"Skinny = anorexic , thick = obese , virgin = too good , non-virgin = slut , friendly = fake , quiet = rude. You can never please society;"
whennboys,"You dont miss me, youre just bored"
whennboys,"Sometimes I stay up at night, and wonder what it would be like to be with you."
whennboys,"If you miss them, then tell them. Don't let your ego get in the way of expressing how you feel;"
whennboys,"Eventually you'll realize what you had, but by then it will be too late."
whennboys,You're so easy to love.
whennboys,"The worst thing you can do in a relationship, is start ignoring your friends and family."
whennboys,"Don't frown, you never know who's falling in love with your smile."
whennboys,Reading old text messages and realizing how much you actually miss that person.
whennboys,"I'm ready for cool weather, hoodies, bonfires, cuddling, and the beautiful colors of fall. "
whennboys,When boys love making you smile. 
whennboys,I hate texting people who don't use smileys. I feel like I'm texting an emotionless robot.
whennboys,She left him because he was too FAT. So he decided to get ABS. Here are his shocking before/after pictures e_o: http://t.co/F1dtElLx - sp
whennboys,When boys http://t.co/Bl1wwEd0
whennboys,I wanna make you feel wanted.
whennboys,You said you'd never change. But then you became who you said you'd never become.
whennboys,"Some people want it to happen, some wish it would happen, and others make it happen. "
whennboys,A relationship with no TRUST is like a pencil with no lead...POINTLESS.
whennboys,Send her a morning text. Let her know she was on your mind..... 
whennboys,The best relationship is when you two can act like lovers and best friends altogether;
whennboys,"Dear iPhone 5, this is why people hate you and love Samsung Galaxy Note 10.1. Sincerely, Tristan Eaton: http://t.co/FwwOhafj - sp"
whennboys,When boys http://t.co/s1RcDaWt
whennboys,"Smile like you've never cried, fight like you've never lost, love like you've never been hurt, and live like you'll die tomorrow."
whennboys,When boys play with your hair. 
whennboys,"I still have feelings for you, nothing, nobody, and not even time will ever change that."
whennboys,When boys http://t.co/1jmUY769
whennboys,I don't care if we talk about absolutely nothing ...I just want to talk to you.
whennboys,The nice guys and girls are always the ones that get hurt the most.
whennboys,When boys http://t.co/6Vyn3GFk
whennboys,I love the way you make me feel.
whennboys,You miss me? But you're not doing anything about it. Sounds convincing.
whennboys, When boys http://t.co/WKjsLVI1
whennboys,"#WeLiveInAGenerationWhere the words ""I love you"" get thrown around like it means nothing."
whennboys,I can't wait any longer.
whennboys,"I want to text you, but I'm waiting for you to text me first."
whennboys,Screw your insecurities. I love them all.
whennboys,"Honey, don't cry. Say ""f*ck you"" and smile."
whennboys,"If two people are meant to be together, eventually they'll find their way back."
whennboys,Relationships nowadays = First week: I love you baby.. Second week: Together forever.. Third week: Single..
whennboys,The boys who can always make time for you;  &gt;
whennboys,Never say goodbye when you still want to try. Never give up when you can still take it. Never say you don't love them when you can't let go.
whennboys,The worst way to miss someone is to be sitting right beside them knowing things will never be the same.
whennboys,I want to be in a relationship... a long term one this time.
whennboys,The boys who can make you laugh + smile just from a text.  &gt;
whennboys,My weakness is that... I care too much.
whennboys,Missing you is becoming a habit.
