wsj,"RT @NKingofDC: Our last WSJ/NBC poll gives Obama the leanest edge, 48-47 among likely voters. But an incumbent at 48% has no cause for c ..."
wsj,"RT @WSJusnews: Obama and Romney Deadlocked, Poll Shows http://t.co/KMzo0Lfy"
wsj,"""Mr. Baramee did what many Thais do when faced with a patch of bad luck: He changed his name."" http://t.co/XRv7DJdU"
wsj,Good news: Wildlife populations in the U.S. have seen a resurgence. Bad news: Those animals are now our neighbors. http://t.co/qLWKEYEH
wsj,Volunteers mobilize to confront a less visible crisis post-Sandy -- the elderly and disabled stuck in their apartments. http://t.co/qSa5lbvg
wsj,Thinking of getting a new tablet? See how some of the more popular tablets stack up: http://t.co/BuPDkV5h
wsj,"Looking to help the victims of #Sandy this weekend? Volunteer efforts, donations sites: http://t.co/mAIULLV0"
wsj,WSJ reporters continue to capture scenes from Sandy recovery:  http://t.co/TYWMY4zM #Worldstream
wsj,"GOP trails Dems in most battleground states in early-voting, but the gap is narrower than in 2008, state data show. http://t.co/9hT9IvRn"
wsj,The election could set in motion a tax-code overhaul that threatens many cherished perks. What you need to know: http://t.co/KjsL9fd6
wsj,"""We've made real progress. But we're not done yet."" Barack Obama op-ed in @WSJ: http://t.co/dbef9smn"
wsj,"Car, car, car. Obama and Romney have been crisscrossing the U.S. via motorcade, trying to win over voters. http://t.co/R4kJvuAa PHOTOS"
wsj,"RT @WSJweather: NWS in Philly: ""We wish it was different,"" but #noreaster still on track for Wed/Thu in NJ-NYC-LI-CT."
wsj,"""The choice Americans make will shape great things, historic things."" Mitt Romney op-ed in @WSJ: http://t.co/i1cGVYxP"
wsj,"""It's better to be right than to be first."" Behind the calls news orgs will make on Election Day: http://t.co/JOWcDyod"
wsj,"Gay-marriage backers are employing a door-to-door strategy in Maine, one of several states to vote on ballot measures. http://t.co/teooMPUY"
wsj,RT @jimchair: It was supposed to be a hometown party at the @BreedersCup but the Dude didn't abide http://t.co/UsCB4X9r via @WSJ #bigleb ...
wsj,Gay-marriage proponents believe that American attitudes towards gays and lesbians are changing. A look at the data: http://t.co/qttObLt4
wsj,"Steve Jobs was never thought to be a fan of a 7-inch tablet, so why did Apple release the iPad Mini? http://t.co/ElG6HWws"
wsj,How late can you vote on Election Day? Check here: http://t.co/9fGgo5Lu
wsj,RT @WSJNY: NJ Transit Restores Limited Service on More Lines: A bit of good news for the Monday morning commute. http://t.co/tAxPyyqb vi ...
wsj,RT @Pervaizistan: Upper West Side Nanny Facing Murder Charges in Deaths of Two Children  http://t.co/d6YYp6BY @WSJ
wsj,Think you know how the presidential vote will go? Build your own election map and share your prediction: http://t.co/36TVDqgn
wsj,"WSJ polls: Obama holds an edge over Romney in Florida and Ohio, the two largest battlegrounds for the presidency. http://t.co/0TSGVHWc"
wsj,"See the latest status updates on buses, rail, tunnels, airports with our NY Region Transit Tracker. http://t.co/IiRQnjLb #Sandy"
wsj,Obama and Romney enter the campaign homestretch as they make their final pleas to voters. http://t.co/oAdoUyp3
wsj,"More than 2.5 million utility customers in New York, New Jersey and other states remained without electricity Saturday. http://t.co/ZH9QEuf3"
wsj,RT @lisafleisher: More info on NJ voting options: http://t.co/3ptKtaeg #2012 #sandy Paper ballot! Fax! Email! Early &amp; in person!
wsj,RT @TamerELG: NYPD: The storm-related death count now stands at 41. NYC crime dropped by 32%compared w/ same week last year. Except burg ...
wsj,The Crimson Tide pays a visit to Death Valley. Alabama-LSU live blog coverage:   http://t.co/bXJRRHdG
wsj,"""We're going to rebuild."" Waves of hope arrive in the flattened ocean front town of Union Beach, N.J. http://t.co/ZVdTKgKY"
wsj,RT @lisafleisher: Students at 8 large NYC HSs used as shelters will have another day off Monday after the chancellor visited 3 http://t. ...
wsj,"RT @MikeBloomberg: 80% of the subway system is back online. @MTAInsider expects that to be
90% tomorrow #SandyNYC #Recovery"
wsj,Track storm recovery efforts wherever you go by adding @WSJ's #Sandy stream onto your mobile phone home screen: http://t.co/6XGYTaBo
wsj,Obama and Romney get-out-the-vote efforts in Ohio both have some shortcomings. http://t.co/SOArtFbR
wsj,RT @NKingofDC: Obama camp not giving up on NC--sending Clinton and the First Lady there Sun/Mon. Cites recent polls showing the race the ...
wsj,Wireless networks were showing improved service as power returned to Manhattan and other areas hit hard by Sandy. http://t.co/7YPS7HxX
wsj,"RT @WSJNY: Check out this photo of the line for free gas at mobile-distribution center set up in Jamaica, Queens: http://t.co/GLPxmBBY v ..."
wsj,RT @demetria_g: National Guard troops direct traffic as cars lined up for gas at Union and Franklin in Brooklyn. #Sandy http://t.co/1ot6QjGj
wsj,".@waltmossberg reviews iPad Mini: thinnest, lightest small tablet, but also priciest with lowest resolution. http://t.co/3zzCjBWr"
wsj,"RT @WSJNY: Among the storm's lingering effects, 57 schools remain so badly damaged that 34,000 students could be sent elsewhere: http:// ..."
wsj,Baghdad luxury at $300 a night: http://t.co/D2qcJObq
wsj,RT @WSJusnews: Millions in Northeast Remain in the Dark http://t.co/5zV99MOY
wsj,"Follow WSJ reporter @DanaMattioli, a Staten Island native who is reporting (and tweeting) from there today."
wsj,RT @WSJVideo: #SandyRelief New Yorkers mobilize and volunteer to help elderly residents stuck without electricity. http://t.co/arVuH6uY
wsj,"RT @DanaMattioli: My neighbor Charlie swam out of his backyard against a current to escape. ""I thought I was going to die"""
wsj,RT @WSJNY: Progress Made on Dangling Crane: Rescue of storm-damaged crane hanging over Midtown is going faster than expected. http://t.c ...
wsj,"What's in a name? In Thailand, people are changing their names-for good luck. http://t.co/rdhPoSMH"
wsj,"RT @gwendolynbounds: ""Hurricane Sandy: As it Happened"" - an @wsj mini-documentary on week one of the super storm. http://t.co/i3nCqXk7 @ ..."
wsj,"RT @WSJNY: Cuomo said 28 million gallons gas will come into NYC in next 2 days, and free gas will be distributed inside city: http://t.c ..."
wsj,"RT @jacobgershman: NYC is doing better, but a third of Westchester is still dark. County accounts for 10% of Con Ed users, but 39% of re ..."
wsj,NYC officials say some 38k students to need relocation because of damage to schools. The city's battered school system: http://t.co/K04GIbz1
wsj,"RT @WSJNY: In the post-storm recovery, how did mom-and-pop bodegas compare to corporate chains like 7-Eleven? http://t.co/jJzbrxKQ via @WSJ"
wsj,"RT @WSJweather: To clarify: vast majority of #noreaster snowfall would be inland. (i.e., *not* in NYC)"
wsj,"RT @WSJweather: Recapping: Model trends show increasing #noreaster threat next Wed-Thu, with biggest impacts for coastal NJ/CT/LI/NYC. S ..."
wsj,Obama and Romney slug it out in Ohio: http://t.co/bBlj0QQY
wsj,RT @bsquinn: Volunteers in Brooklyn and LES mobilize to assist trapped elderly/disabled high-rise residents: http://t.co/xDEUYP7I  #sand ...
wsj,"Over 47,000 runners were expected to run in NY on Sunday. A mix of reactions following NY Marathon cancelation: http://t.co/XooO1aLZ VIDEO"
wsj,RT @femaregion2: Residents in #NJ &amp; #NY can register for @fema assistance at http://t.co/KfkFH7o4 or by calling 1-800-621-FEMA. #Sandy
wsj,"RT @WSJNY: Most subway lines are set to come back over the weekend, but the under-river tube for the L train remains inundated: http://t ..."
wsj,"RT @MTAInsider: To everyone asking about the L: Chairman said it was a ""particular concern"" b/c of extent of flooding. He's hopeful for  ..."
wsj,"In @WSJ today, dueling OpEds by Barack Obama: http://t.co/d30QCwgx and Mitt Romney: http://t.co/zl03LUXf"
wsj,"RT @heatherhaddon: . @PSEGdelivers hopes to restore 85% of Jersey City and Bayonne today, and most of Union City &amp; West New York."
wsj,RT @WSJNY: Most Subway Service Resumes: 80% of the New York City subway system is now up and running. http://t.co/lXtUC28q via @WSJ
wsj,"Door-to-door wellness checks, donating via cellphone: how you can help the victims of superstorm Sandy: http://t.co/tYTjLK3v"
wsj,Was your house flooded by #Sandy? How flood insurance works: http://t.co/ToCTxOf3
wsj,"Want to help the victims of Hurricane #Sandy? Volunteer efforts, donations sites: http://t.co/5seAiFx5"
wsj,So your employee is a social media celebrity. Now what do you do? Handling the co-branded worker: http://t.co/947BTWxv
wsj,Where does perfectionism come from? Pushy parents have been blamed but new research suggests genetic link. http://t.co/9jb6M07Q
wsj,"Interactive: Sort the House of Representatives by each member's electoral success, district's political tilt. http://t.co/bkMiHcoq"
wsj,ICYMI: Interactive slider allows you to compare NYC's usual skyline with outage during worst of #Sandy http://t.co/HIHHq1vi
wsj,It's almost time for 2012 grads to start paying off their student loans. A look at your repayment options: http://t.co/Y1LAOyfA
wsj,What did the NYC Marathon course look like post-Sandy? Our @germanotes got on her bike to photo-document it. http://t.co/kL1HkNJ3
wsj,"Next stop for NYC marathoners: Richmond, Va.? Runners are already scouring the calendar for upcoming races. http://t.co/9vSylEFw"
wsj,"According to one estimate, the cost of wildlife damage to crops, landscaping, infrastructure now $28B/yr in the U.S. http://t.co/lLyPc18W"
wsj,"In the wake of #Sandy, the biggest hit to the fuel market may come from a drop in demand, not from loss of supplies. http://t.co/7I4zknTD"
wsj,"Hyundai and Kia overstated the fuel economy for about 900,000 vehicles sold in the U.S. since late 2010. http://t.co/KPjBHWM4"
wsj,Sixteen states now allow overseas U.S. residents and military personnel to vote by email. http://t.co/pLX3npGQ
wsj,Latest WSJ/NBC/Marist poll: Obama holds edge over Mitt Romney in Florida and Ohio. http://t.co/kg6ohXV3
wsj,NYC's storm-tossed schools are preparing to welcome back 1.1 million students Monday. http://t.co/ncfgYfgv
wsj,A wine cellar doubles as an underground bunker. A rooftop helipad. Homes built to withstand disasters: http://t.co/dPOS7FtQ
wsj,"What's the best thing government can do to boost small-business creation? Your votes, comments sought: http://t.co/gwPIj9Yl"
wsj,How many iPad Minis will Apple sell in its first weekend? Analysts weigh in: http://t.co/Z22ng1tD $AAPL
wsj,"The Staten Island Ferry chugged to life Friday, a milestone for commuters slammed by #Sandy. http://t.co/rjzpuw1x"
wsj,Campaigning to be First Lady: a look at the candidates' wives on the trail. http://t.co/iDw0w5qZ PHOTOS
wsj,"Dozens of private islands are for sale off North American coast, with prices down 25% from peak: http://t.co/jN2yD5Pn PHOTOS"
wsj,The Lenny Kravitz living room: Developers call in celebrity designers to attract high-end buyers. http://t.co/zj3m9TcF
wsj,"After days of darkness, thousands of New Yorkers saw their lights flicker back to life on Friday afternoon. http://t.co/nfwVBj0n"
wsj,"In Haiti, where #Sandy killed 54, the president has declared a month-long state of emergency.
http://t.co/i91Da4nw"
wsj,RT @jasonWSJ: WSJ Column: On the Cancellation: The NYC Marathon (Finally) Takes the Right Road: http://t.co/jZnSAz0k
wsj,Wondering how late you can vote on Election Day? Check here: http://t.co/9fGgo5Lu
wsj,"The current jobless rate, at 7.9%, is the highest ahead of any presidential election since at least the 1940s. http://t.co/8RbAG2sP"
wsj,RT @Pervaizistan: The kitchen in this demolished Belle Harbor home remains eerily intact. Photo by @maloneyfiles #sandy http://t.co/2806cHe3
wsj,"RT @germanotes: To those wondering what the NYC Marathon course actually looks like post-Sandy, I took a ride on my bike:  http://t.co/S ..."
wsj,"In an already crowded market, will the iPad Mini actually end up being a holiday blockbuster? http://t.co/lRq7m0p2 $AAPL"
wsj,RT @demetria_g: Subway sardines on the 1 train at 50th &amp; Broadway. 3 trains passed before I could board. http://t.co/OjNG1loL #Sandy ...
wsj,"If money talks, then Sarah Palin has finally endorsed Mitt Romney - with a $5,000 check. http://t.co/McwSiDTE"
wsj,"RT @lisafleisher: 255 of 589 school districts in New Jersey will definitely open on Monday, NJDOE spox @BarbaraKMorgan says"
wsj,"RT @Pervaizistan: On #Sandy ravaged Broad Channel, residents have become their own help from siphoning gas to fixing boilers http://t.co ..."
wsj,"RT @jacobgershman: Update: Con Ed says Chinatown is back up; power restored to about 9,000 customers between Canal and Wall St./ Broadwa ..."
wsj,RT @aaronwolfe: @WSJ I feel for people that prepped &amp; travelled to our city. But those resources need to go to people that are barel ...
wsj,RT @BostonTriPop: @WSJ #rightcall or #wrongcall glad resources are not being used for the race sad athletes who have trained so hard for ...
wsj,RT @parva_x: @WSJ #rightcall the city needs those resources to deal with the aftermath of the storm
wsj,"The New York Marathon has been canceled, the mayor's office said. The #rightcall or #wrongcall? Tell us on Twitter. http://t.co/2X2I7rPO"
wsj,RT @NYCMayorsOffice: The New York Road Runners will donate food and supplies from the marathon to #Sandy relief efforts.
wsj,RT @WSJweather: Recapping next week's #noreaster: 1.Cold weather (certain) 2.Rain (1-3in) 3.Wind (40mph gusts) 4.Coastal Flooding (psbl) ...
wsj,"RT @WSJweather: Latest from HPC: ""Potential for slow-moving nor'easter along the atlantic coast
next week."""
wsj,"Despite signs that the job market is improving, only 18.8% of unemployed workers found jobs last month. http://t.co/VnJmMYQm"
wsj,"RT @smithjenBK: ""Its been rough, but it could be worse. For many here on Staten Island, it still is."" Staten Islands Storm Goes On htt ..."
wsj,RT @WSJVideo: Hurricane Sandy: As It Happened - Watch @WSjVideo's retrospective of #Sandy's unfolding and aftermath. http://t.co/qrHcMEs1
wsj,"""We would not want a cloud to hang over the race or its participants, and so we have decided to cancel it."" http://t.co/T1n0irZS"
wsj,RT @lheron: Power back on in the East Village! #sandy http://t.co/eK3Jm1wO
wsj,"From outlets in bank vestibules and restaurants to kind neighbors, #Sandy victims find ways to to recharge: http://t.co/SSZLB1us"
wsj,"RT @lheron: Overheard bellowed in the East Village: ""We have power!!"" Lots of answering ""woohoo!""s. #sandy"
wsj,"Breaking: The New York Marathon has been canceled, the mayor's office said.  http://t.co/tIz3SiF9"
wsj,"On Thursday, cable outages remained at around 12% to 14% of households in #Sandy's footprint. http://t.co/w40T6fzs"
wsj,"RT @WSJNY: Food, clothing, shelter  and chargers. The many ways #Sandy victims have stayed connected. http://t.co/c9Ev3zVc via @WSJ"
wsj,Weather models show a possible nor'easter developing off the East Coast by next Tuesday or Wednesday. http://t.co/355Zr1ZM
wsj,"#Sandy's impact, state by state, including power outages and recorded deaths: http://t.co/Lt4qC3d0"
wsj,"RT @WSJNY: Even With Harbor Open, Gas Woes Will Persist: A look at how supplies go from barges to gas-station pumps. http://t.co/wLgNhSN ..."
wsj,"While waiting for aid, residents in Staten Island have been helping each other, sharing food and resources. http://t.co/P9uZXfAh #Sandy"
wsj,RT @GabbyStern1: Inside the Mind of a New Jersey School Superintendent coping with Sandy's aftermath: http://t.co/HS5GmJs6 @WSJ (By me)
wsj,RT @jolshan: How tragedies and disasters have impacted sporting events: From Pearl Harbor to Sandy. http://t.co/8sgUp12v
wsj,Figuring out how to get home? Check our Transit Tracker for Greater New York: http://t.co/V67t3vUa #Sandy
wsj,RT @WSJLife: Storm-Tossed Schools Prepare for Students http://t.co/ivgZw663
wsj,23 of 30 Americans evacuated from Benghazi embassy after attack worked for CIA under diplomatic cover: http://t.co/ZJF9WK0c
wsj,RT @WSJNY: Many Running on Empty in Newark http://t.co/dnl2GAUx via @WSJ #Sandy
wsj,Hess said that gasoline sales doubled or tripled in some areas hit by #Sandy. http://t.co/CFbbGtjV
wsj,"RT @davidmwessel: DC Bureau, the WSJ weekly video politics show,  is up    http://t.co/ilor3eMr  @GeraldFSeib  @NKingofDC  Janet Hook &a ..."
wsj,"RT @MichaelHwrdSaul: ""There will be no diversion of resources,"" Mayor Michael Bloomberg said, referring to his controversial decision to ..."
wsj,"RT @tomgara: With the NYC subway system crippled, the market is thrashing toward equilibrium before our very eyes:  http://t.co/cjPvnUIU"
wsj,RT @MatthewHeimer: The avg. 401(k) balance is up 25%+ since 2008. But who's saving more: red states or blue states? @MarketWatchPF http: ...
wsj,Track the U.S. unemployment rate going back to 1948 with our interactive graphic: http://t.co/LFsGG3A3
wsj,RT @WSJLife: Does #Sandy change the way men juggle work &amp; family? One dad says: It just makes the juggle bigger. http://t.co/HP72qhkJ
wsj,"RT @lisafleisher: Wow - HOV restrictions for passenger cars into NYC will end at 5 p.m. today, likely won't be reinstated Monday #Sandy"
wsj,"RT @MichaelHwrdSaul: Mayor Michael Bloomberg, defending his decision on marathon, said Rudy Giuliani made right decision to allow marath ..."
wsj,"RT @MichaelHwrdSaul: Death toll in NYC climbed to 41, Mayor Michael Bloomberg said. #Sandy"
wsj,RT @demetria_g: The need is considerable and is going to grow. The call continues for volunteers to help #Sandy's victims. http://t.co ...
wsj,"Do you have storm damage from #Sandy? Our guide to filing insurance claims, getting FEMA aid and more: http://t.co/7ZkViPD2"
wsj,RT @WSJecon: Tallying President Obamas Jobs Record http://t.co/GBD7yFw5 See chart http://t.co/wRqttp1n
wsj,RT @WSJNY: UPDATE: Two million barrels of gas have been delivered since New York Harbor reopened to tankers. http://t.co/6I3ICB4K #sandy
wsj,"Only a fraction of big FEMA generators are providing power, despite millions still without electricity. http://t.co/YCu54Lkt"
wsj,"RT @MarketWatchPF: The White House is worth $284.9 million -- 1.5% more than it was four years ago, according to ZIllow. http://t.co/W9n ..."
wsj,RT @iansherr: Launch lines at #Apple stores in SF Friday morning were smaller than normal for the #iPad Mini launch. #worldstream http:/ ...
wsj,"RT @WSJweather: My weekend forecast: Cold weather intensifies, #noreaster could bring wind/rain/snow/coastal flooding Wed/Thurs. http:// ..."
wsj,RT @julianbarnes: You can predict some nail-biting scenarios with the @wsj Election mapmaker. Fun for all ages in the closing days. http ...
wsj,Satellite images taken before and after #Sandy show impact on three seaside towns: http://t.co/fB70C5Fh.
wsj,RT @WSJGraphics: Power outages across Greater New York http://t.co/Mv6ZTH2L
wsj,"RT @Reddy: With job growth near the 2011-2012 trend, it'll take two years to see 7% unemployment (one threshold for QE3) http://t.co/TJ3 ..."
wsj,"RT @WSJNY: BREAKING: New York Gov. Cuomo says fuel tankers are entering New York Harbor and he expects gas shortages to begin easing ""qu ..."
wsj,Stuck at home? Ten tips for working productively: http://t.co/rjMJypWY #Sandy
wsj,"RT @A_Grossman: Cuomo: NY putting $100 mil in state funds toward #sandy victims and home repairs, amount could be increased if it's not  ..."
wsj,"RT @CleggJon: The #NYG face their most fearsome opponent Sunday, but it's not Big Ben or the Steelers. It's November: http://t.co/hyFxjS ..."
wsj,RT @johnjurg: Which comic book superhero inspired the new racing suits of a U.S. athletic team?   http://t.co/k5rkJw5k
wsj,Former housing projects in London are selling fast - at million-dollar prices: http://t.co/62u7d5wh
wsj,"RT @DamatoK: A ""Buffetology"" mutual fund and a new stock-picking method are the latest efforts to invest like #Buffett  http://t.co/0URn67za"
wsj,"RT @CharlesPassy: How about a beer? A $190 bottle of beer, that is... http://t.co/n17OhKvF"
wsj,Vote: Is decision to hold NYC Marathon as scheduled inspiring: http://t.co/ZfcA19qa or inappropriate: http://t.co/nelNATgt #Sandy #nycm
wsj,Is Microsoft getting ready to launch a new smartphone into an already crowded market? http://t.co/tGuzHjYs VIDEO
wsj,"RT @kellibgrant: New online clothing marketplaces take 9-20% of a sale, versus up to 60% at a bricks-and-mortar consignment shop: http:/ ..."
wsj,Kremlin denies reports Russian President Putin is ill and sidelined. http://t.co/mToT5kef
wsj,RT @WSJThisMorning: POLL: With the relief effort well underway we want your opinion. Have officials been doing enough with #Sandy aid wo ...
wsj,"RT @LillyVitorovich: #Apple staff cheer customers who have come to buy the #iPad Mini and new #iPad in Covent Garden, #London. http://t. ..."
wsj,U.S. Navy gets ready for #Sandy relief: http://t.co/aNQU5Xam VIDEO
wsj,RT @jasonWSJ: WSJ Column: On the NYC Marathon: Are We Really Going to Run this Race? http://t.co/QnSWWlRC
wsj,"RT @Reddy: Average monthly job growth in 2012: +157,000. 2011: +153k. 2010: +86. 2009: -422. 2008: -300. 2007: +92. 2006: +172. 2005: +2 ..."
wsj,RT @GeraldFSeib: What really was going on in Benghazi? This morning's WSJ gives the most complete answer yet. http://t.co/7MELH1OZ via @WSJ
wsj,Find out what is running in the New York region with our transit tracker: http://t.co/yNBdW2Qu #Sandy
wsj,"Why October's higher unemployment rate is seen as good news, as underlying measures improve on jobs: http://t.co/wJRWtCMF"
wsj,"As temperatures fall, millions are still without power following Superstorm #Sandy. http://t.co/AgcGVAu8"
wsj,"Breaking: U.S. economy added 171,000 jobs in October, the unemployment rate rose to 7.9%.  http://t.co/dV6UlgVz"
wsj,"Flares, torches and candles: New York City in the dark. http://t.co/tUhlKzYl PHOTOS"
wsj,RT @wisnefski: Live From New York! It's Jobs Friday! - MarketBeat -WSJ http://t.co/jbwuIKwJ via @WSJ Follow this for inisghts on the #jo ...
wsj,Euro-zone manufacturing shrank for the 15th straight month as exports weakened. http://t.co/FuOUJJ36
wsj,RT @charlesforelle: This is the story to read about CIA &amp; Benghazi. http://t.co/E789Yn66
wsj,RBS posts loss as restructuring continues: http://t.co/5Ty1tZPb
wsj,RT @davidenrich: Struggling European companies are dumping their Latin American businesses to drum up scarce cash http://t.co/BcU1ojUm
wsj,Apple kicks off sales of its iPad Mini in New Zealand: http://t.co/8qgcevTK
wsj,"RT @jgginlondon: To keep away outsiders, an English town tries to disguise its Guy Fawkes bonfire as the most miserable way to celebrate ..."
wsj,"RT @BruceOrwall: No matter what happens in next round of Greece talks, debt will continue to slowly suffocate its fortunes     http://t. ..."
wsj,The iPad has been a tech phenomenon. How about the iPad Mini? @waltmossberg sizes it up. http://t.co/hx7YLknl
wsj,"""All the dot-com ideas were correct. They were all too early."" Marc Andreessen on the dot-com bust: http://t.co/CU0G5LX3"
wsj,A Los Angeles house built to withstand everything from earthquakes to fires to terrorist attacks. http://t.co/jG0Hcqua VIDEO
wsj,#Sandy prompts colleges to push back early-admission deadlines from Nov. 1 to Nov. 4 or later. http://t.co/n2371u3y
wsj,"On some campuses, it's hailed as a Bible -- the guide every M.B.A. needs to ace some of the toughest job interviews: http://t.co/IO7WxtOd"
wsj,RT @ScottThurm: US Benghazi consulate was CIA operation http://t.co/JBlklJu7
wsj,WSJ reporters continue to capture scenes from around the East Coast affected by Sandy. Our #Worldstream: http://t.co/RY1xYSQf
wsj,"Before/after #Sandy: Satellite photos show difference carved by storm surge in Seaside Heights, NJ. http://t.co/ZW8ZZjmG"
wsj,Mitt Romney and Barack Obama kissed a lot of babies - and not all the kids were happy about it. Photos: http://t.co/yCL3kLvq
wsj,For the latest on the aftermath of superstorm #Sandy follow our livestream: http://t.co/Q1ROr3xB
wsj,The cardboard cutouts of Mitt Romney and Barack Obama have been busy on the campaign trail. Photos: http://t.co/7p955YEV
wsj,Has #Sandy left your car waterlogged? Tips on dealing with flooded cars: http://t.co/KrThRuCm
wsj,Banks hustled to make cash available via temporary ATMs as they worked to get branches reopened. http://t.co/mxLFSGaO #Sandy
wsj,Stocks kicked off November with their biggest single-day rally in weeks. http://t.co/aUmClHdv
wsj,RT @dkberman: Can you imagine blimps that act like floating mobile-phone towers in an emergency? http://t.co/WZFUZX9n $VZ $T
wsj,34% of investors surveyed think stocks will do better if Mitt Romney is elected president. http://t.co/j3NXFhkC
wsj,RT @cjfarley: CMA Awards 2012: Live Blogging the Show http://t.co/0sLZQ67A via @WSJ #CMAs
wsj,RT @DanaMattioli: Found: my dad's boat swept from the sea infront of someone's home http://t.co/HvnHS8Nv
wsj,"In Lower Manhattan, would-be robbers posed as utility-repair workers. Security concerns are rising after #Sandy: http://t.co/D4mdLMcH"
wsj,"RT @WSJweather: My latest full forecast post: Cold Weather Lingers, Another Storm Possible Next Week http://t.co/AnO7FfoG #noreaster #Sandy"
wsj,"RT @andreacoombes: About 18% of private-sector workers have access to retiree health coverage, down from 29% 15 years ago http://t.co/P0 ..."
wsj,Did #Sandy affect your commute? @WSJ readers weigh in with #mycommute: http://t.co/BTsREBFJ
wsj,One problem Connecticut doesn't have: getting gas. It hasn't had to deal with the gas shortages seen in NY/NJ. http://t.co/FAZQj4FS
wsj,Utilities have restored power to about 1.4m customers but more than 4.6m are still without electricity. http://t.co/4Opc9gMT
