wsj,Breaking: Hamas officials: Israeli airstrike killed the commander of its military wing.  http://t.co/MshCFwsm
wsj,Breaking: House Democratic Leader Nancy Pelosi to run again as minority leader. http://t.co/CJYb4XHu
wsj,Did Hurricane Sandy cause Romney's loss of momentum in final week before election? @GeraldFSeib's take: http://t.co/7IqxIbLh
wsj,Free to read: The Microsoft shake-up leaves the future of Windows in the hands of two women. http://t.co/skffQ6Ce
wsj,"RT @joe_palazzolo: Norton Rose mergers with Fulbright &amp; Jaworski to create 3,800-lawyer firm http://t.co/1ft31Euj"
wsj,"RT @CharlesPassy: More than 18,000 brew buffs have the ""MBA of beer."" Could you pass the #Cicerone test? http://t.co/m3w3FE4D"
wsj,"RT @fieldproducer: Strikes to protest government austerity plans sweep Spain, Portugal and Greece http://t.co/3YLeNKYt"
wsj,.@davidmwessel and @GeraldFSeib answer reader questions about the fiscal cliff: http://t.co/Iy2ebK51
wsj,"As more states approve marijuana for medical (and recreational) use, here's how to invest in legalized pot: http://t.co/eNBidje4"
wsj,More mobile devices mean more people are working from bed. Why you shouldn't work where you sleep: http://t.co/pMLM0mPy VIDEO
wsj,"Who exactly qualifies as ""high net worth""? The fuzzy definitions of wealth: http://t.co/VmhX6mb4"
wsj,"""We want to enable consumers to pay with whatever they want to pay,"" says PayPal president David Marcus. http://t.co/gVyGp0wL"
wsj,Free to read: The number of companies offering personal use of corporate jets has declined in recent years: http://t.co/up73ityC
wsj,Free to read: France recognized Syria's opposition coalition as the country's only legitimate authority: http://t.co/hCLwdRfS
wsj,"Free to read: North Dakota, an epicenter of the nation's oil rush, is grappling with a housing boom. http://t.co/wjQdc9RW"
wsj,Free to read: Jill Kelley's social role has put her at the center of a scandal involving David Petraeus: http://t.co/FQ9olJqK
wsj,"Free to read: Japan has officially identified 6,852 islands within its boundaries, of which 421 are inhabited: http://t.co/6XlQeqfP"
wsj,"""This is a solvable problem,"" says Treasury Secretary Timothy Geithner of the ""fiscal cliff.  http://t.co/gFhicXXw VIDEO"
wsj,"Report: In 2009, 20.3% of nursing homes billed Medicare for a more expensive treatment than was provided. http://t.co/ob5LZj1r"
wsj,"Nascar's sponsors and fans are growing scarce. ""We're just sort of keeping our head above water."" http://t.co/kvzZgKxA"
wsj,"To keep employees happy, Apple appears to be taking its cues from Google by offering generous perks. http://t.co/tHcfbwMz"
wsj,Free to read: Obama put on hold the nomination of Marine Gen. John Allen for NATO's top military post: http://t.co/smDOcUoI
wsj,"11 years after the U.S. ousted Taliban regime, the Afghan government imprisons raped girls and wives escaping abuse. http://t.co/80G82eHK"
wsj,Who's who in the Petraeus scandal? The circle is widening: http://t.co/UCeMeDrC
wsj,Congressional Republicans elect their leaders on Wednesday.  How the mix might change: http://t.co/iMhNuIPJ
wsj,Aetna chief: companies are prepping backup plans including layoffs as fiscal cliff approaches. http://t.co/TQ70w5TX
wsj,"Former Secretary of State Kissinger said he would favor ""some"" U.S. efforts to arm opposition groups in Syria. http://t.co/rz5thETR"
wsj,"Californian dairy farmers are battling drought, sky-rocketing feed costs and cheese makers. http://t.co/Rp42Twbn"
wsj,France becomes first Western country to formally recognize new Syrian opposition coalition. http://t.co/0wSOJori
wsj,"Visa continues its fight for a larger share of the digital wallet, enlisting dozens of banks to help. http://t.co/Os70T7e7"
wsj,Are Twinkies headed for extinction? http://t.co/FMZwCQmY VIDEO
wsj,"Dropbox announced it has more than 100 million users. How it can avoid getting boxed in by Apple, Google: http://t.co/jRjPyy2Q"
wsj,"RT @ScottMAustin: Long Islanders: LIPA chief resigns over Sandy complaints, and Gov. Cuomo calls for investigation. http://t.co/7a7HirYp"
wsj,"The U.S. will overtake Saudi Arabia as world's largest oil producer by 2020, according to International Energy Agency. http://t.co/efRxRxZD"
wsj,"RT @kabster728: The new Nook HD has a stunning screen, but are its 10K apps enough? My review http://t.co/QVGWi0IG via @WSJ"
wsj,"Is Goldman Sachs becoming the Wal-Mart of Wall Street? CEO Lloyd Blankfein emphasized being a ""low-cost provider."" http://t.co/k9YtCKEI $GS"
wsj,RT @WSJweather: My latest full forecast update: Early Signs of Thanksgiving Storms http://t.co/CQnciBDB
wsj,RT @GregBensinger: In which I chat with PayPal boss David Marcus | http://t.co/GwwoJOlp via @WSJ
wsj,"Sex, Lies and Gmail: William McGurn weighs in on the Petraeus scandal http://t.co/wtuxn2mh"
wsj,Happy Diwali! Photos from India's festival of lights: http://t.co/8hwYOJhd
wsj,"RT @GabbyStern1: You'd better know the competitive landscape if you have #startup ambitions, says @thegothamgirl on #Accelerators blog h ..."
wsj,"McDonald's stock has fallen 17% since January. CEO Don Thompson says tough economy is ""the new normal."" http://t.co/6kAjwF8p"
wsj,RT @MarketWatch: Ohio Sen. Rob Portman says Todd Akin's comments about rape contributed to Mitt Romney's defeat http://t.co/57FmawFF
wsj,RT @grainnemcc: France first Western country to recognize Syrian opposition coalition http://t.co/dmPqzfk6 #ConfPR
wsj,Can the fiscal cliff be avoided? Here's what three of the top economic professors in the U.S. think: http://t.co/EpIJmjMW VIDEO
wsj,RT @cjfarley: Accuser Recants Sex Allegation Against Elmo Puppeteer http://t.co/oVc6gXRI via @WSJ
wsj,"RT @EmilyGlazerWSJ: When should you change your toothbrush? http://t.co/IIUKU0Ci (and boiling a brush to clean it is a no-no, strictly FYI)"
wsj,What the departure of the head of its Windows division means for Microsoft: http://t.co/oIRAiKCt VIDEO
wsj,"RT @MatthewHeimer: Were pensions really a life-saver? In '80, they made up just 8% of retirement income. @SalisburyIan @MarketWatchPF ht ..."
wsj,How sick is too sick to go to the gym? Find out when to call that session off: http://t.co/ZKoInxNd
wsj,RT @WSJFiscalCliff: IRS warns of big AMT mess that could await 33 million U.S. taxpayers for 2012. http://t.co/AC3NZkVp via @johndmckinnon
wsj,"RT @yarotrof: And now, Gen. #Allen's side of the story: No sex, no affair, not even once in a room alone with Kelley. http://t.co/9IVj6X2J"
wsj,RT @chungjoanna: Google Lawyer Finds a New Perch at Twitter http://t.co/Jf5g4VqV via @WSJ
wsj,RT @Reddy: Follow all the @WSJ coverage of the fiscal cliff: http://t.co/anTXgPXE
wsj,"RT @EvelynRusli: our story on zynga's shake-up, ko (ex yahoo mobile exec) emphasizes the rising importance of mobile at zynga http://t.c ..."
wsj,The new rules of flirting: the science behind the wink and the smile. http://t.co/rrvU1Xtx
wsj,RT @LeslieKwoh: More than 70 large firms publicly supported same-sex marriage or opposed gay-marriage bans over the last 18 months http: ...
wsj,"RT @WSJwashington: Meet the 15 winners of the @WSJ election-map contest -- out of more than 1,000 email and Twitter submissions http://t ..."
wsj,RT @WSJspeakeasy: Activision Explains Petraeuss Role in Call of Duty: Black Ops 2 http://t.co/BZAq2NKl
wsj,"Live now: Watch Tim Geithner discuss the ""fiscal cliff"" on CEO Council http://t.co/u45TfhIV"
wsj,RT @sarahneedleman: What does it take to attempt a #startup? @bgurley says it requires a life commitment ... http://t.co/D3SSNYHh #accel ...
wsj,They don't like it - short sellers turn cold on Facebook as lockup looms: http://t.co/qEBjpWJu $FB
wsj,"'What are you hiding?' British MPs condemn Amazon over tax payments: 
http://t.co/LjCQ0N3F VIDEO"
wsj,RT @vbauerlein: My latest story is on Nascar-- Sprint Cup: Nascar's Leaky Fuel Tank - http://t.co/xot1uEKV http://t.co/g3UCN97P via @WSJ ...
wsj,RT @MarketWatchPF: Study: Many items are cheaper at Whole Foods than Safeway. CEO says they can slash prices without butchering the bran ...
wsj,RT @barbarachai: Petraeus Makes Poorly-Timed Cameo in Call of Duty: Black Ops 2 http://t.co/oQAXpoe9 via @WSJ
wsj,"Live now: the CEO Council discussion of the showdown over the ""fiscal cliff."" Watch: http://t.co/BgBYNJYx"
wsj,"How must the Republican party change? With Trent Lott, Joseph Lieberman and James Sasser: http://t.co/VqLuc1aD VIDEO"
wsj,RT @cjfarley: Photos From the Twilight Saga: Breaking Dawn Part 2 Premiere http://t.co/PEFy8JtM via @WSJ
wsj,"RT @VanessaOConnell: What does it take to attempt a #startup? Research, a Road Map and the Right Team http://t.co/kK83eD89 via @WSJ"
wsj,What Steven Sinofsky's departure means for Microsoft: http://t.co/sDoPqQRe VIDEO
wsj,RT @markscheffler: Is #Nascar hitting the skids? WSJ's @vbauerlein rides shotgun. #worldstream http://t.co/1AlA97qg
wsj,Bank of New York Mellon unit to pay $210 million to settle Madoff fraud cases. http://t.co/tlxXkYz4
wsj,The 9-month affair that ended a stellar career - follow the timeline of the Petraeus scandal: http://t.co/jlbeaDzE
wsj,"Quick, to the Cakemobile, Batman! Sculpting in buttercream becomes performance art. http://t.co/J28ZxQlG http://t.co/6jv4Rx1U"
wsj,RT @MarketWatch: About 800 million Facebook shares will become available for sale on Wednesday. @MWDanGallagher reports: http://t.co/kLf ...
wsj,"Former Windows head Steven Sinofsky: blessings at Microsoft ""impossible to count:""  
http://t.co/CxHXjppo"
wsj,RT @demetria_g: General Petraeus makes an appearance as a case study in live chat underway right now about perils of flirting. Join us:  ...
wsj,Security software mogul John McAfee wanted for questioning by Belize police after neighbor is killed: http://t.co/YQQOoe5N
wsj,"Live streaming video from CEO Council in DC all afternoon, with Rob Portman, Christopher Van Hollen and Tim Geithner: http://t.co/B2vkTugs"
wsj,RT @rubinafillion: News of the Petraeus scandal broke on Paula Broadwell's 40th birthday - and 2 days after his 60th birthday. http://t. ...
wsj,"RT @WSJNY: For the first time since the 70s fiscal crisis, every New York City public-employee union is without a contract. http://t.co/ ..."
wsj,"Top commander in Afghanistan, Gen. John Allen, now linked to Petraeus scandal: http://t.co/T3dGob1A VIDEO"
wsj,RT @sarahneedleman: What should you ask yourself before attempting a #startup? AngelList's @naval says ... http://t.co/9d5PKcPF  The #Ac ...
wsj,"NJ Gov. Christie calls for federal aid: ""We expect to be treated in exactly the same way as victims of Katrina."" http://t.co/AQAegL48"
wsj,RT @jolshan: Marijuana futures won't be traded like coffee or orange juice anytime soon. Here's how investors can bet on pot now: http:/ ...
wsj,"RT @paulvigna: Forty-Five Seconds Over Wall Street, Nov. 13, 2012 http://t.co/Nj0Q3wY6 via @WSJ #WorldStream #stocks $$"
wsj,RT @WSJspeakeasy: Jon Stewart Takes on Paula Broadwell-David Petraeus Conspiracy Theorists http://t.co/1U40rx7M
wsj,"The new Bentley Mulsanne can cost up to $400,000. But it comes with an iPad. @leehawkins takes a look: http://t.co/YujEq98a"
wsj,"Pleasures, perils of flirting: what crosses the line if you're in a relationship? Live chat at 11:30a ET. http://t.co/MHPtHcUT"
wsj,"RT @rajunarisetti: Check out new @wsj Fiscal Cliff page--Latest Stories, Analysis, Video and Stream--your one-stop before the precipice: ..."
wsj,Do you have what it takes to launch a startup? The Journal's new #Accelerators blog: http://t.co/LCerD3vH
wsj,RT @davidmwessel: Check out the new http://t.co/CVVL5QlU page my colleague @GeraldFSeib and I are launching today.
wsj,"RT @GabbyStern1: @NJ_TRANSIT Ooh, you tweeted at me! Hi! While I have your attention: Why're you running single-deckers today? It's crow ..."
wsj,RT @itsvishaldutta: On my way to NWK Penn and praying this #njrush commute is ok. Thanks for the play by play  @WSJ
wsj,"Do you favor fashion from the 1930s, '60s or '90s? You're in luck - retro fashion is making a comeback. http://t.co/VuZP1HDk"
wsj,"RT @paulvigna: Getting into NY Port Authority now, about 25 minutes later than usual. Better than yesterday. Good luck, everybody. #njrush"
wsj,"RT @BryFitz: Ugliness, frustration escalates: A man sternly tells woman in her face ""that's right I will push you down."" Missed what spa ..."
wsj,RT @djgeoffe: @WSJ right on. The commute is so bad I'm ready to move back to Brooklyn.
wsj,"RT @GabbyStern1: Overflowing train ceases taking on more passengers, keeps making stops in case someone gets off-problematic planning by ..."
wsj,RT @BryFitz: Long wait in NWK Penn to get a transfer to NY. Platform 1 filled with people. Will be a crush to board a likely filled trai ...
wsj,.@WSJ staffers are live tweeting their post-#Sandy NJ commute. Follow the live stream: http://t.co/4DwYWkYR #njrush
wsj,U.S. airlines are facing what could be their most serious pilot shortage since the 1960s. http://t.co/mol5fhNE
wsj,Apple is taking new steps to keep employees from leaving the company. http://t.co/TGT3ti0p VIDEO
wsj,Free to read: Afghan women fear their rights will erode as the U.S.-led coalition withdraws its troops: http://t.co/qz7XDRAM
wsj,Which cars do owners keep the longest?  What's the longest you've kept one of yours? http://t.co/LUrMB3Oi VIDEO
wsj,Free to read: Goldman will tap the smallest number of executives in more than a decade to join its partnership ranks: http://t.co/jfzj4zXo
wsj,"Free to read: The cellphone and Internet outages that followed Sandy have raised concerns about the nation's networks:
http://t.co/7XePNUPB"
wsj,Have back or knee pain? The ancient art of cupping could help relieve the pain. http://t.co/SNzAMxnq
wsj,"Beyond the ""fiscal cliff"": how to revamp the U.S. tax system for the 21st century. http://t.co/Ms0D32CI"
wsj,Free to read: An early signal on where the GOP's long-term strategy is headed in the aftermath of election losses: http://t.co/CikCT32G
wsj,Free to read: Apple CEO Tim Cook is pushing employee-friendly benefits that were long shunned by Steve Jobs: http://t.co/ls8ffqNy
wsj,Chicago judge jettisons two more consumer-fraud lawsuits filed by debt-laden law school grads. http://t.co/gLwW9iTV
wsj,Starting a business? One vital step for entrepreneurs entering a market: research your rivals. http://t.co/ZAmZMcuw
wsj,"Free to read: Belize police are seeking John McAfee, the security software pioneer, over a murder probe: http://t.co/ekx9YK7E"
wsj,Free to read: The CIA disputes a theory advanced by Paula Broadwell about the Beghazi attacks: http://t.co/GMhxnRXu
wsj,Most small businesses stay small. New research shows 75% of owners aren't aiming for growth at all. http://t.co/i2iG7ONW
wsj,"""Most kids my age bristle at the word 'conservative,' and I don't blame them."" Advice from a college Republican: http://t.co/UeCQHIdo"
wsj,Less than a quarter of America's 27 million small businesses have employees. http://t.co/TBoUT1Tj
wsj,Improving housing market has more than doubled the price of some home-builder stocks this year. http://t.co/A4hhzk0J
wsj,"When does flirting cross the line, especially if you're in a relationship? Live chat at 11:30 a.m. ET Tues. http://t.co/n39lsYxh"
wsj,"Builders are on track to sell 389,000 new homes this year. 2009 - 375,000. 2005 - 1.3 million (peak). http://t.co/X38p2pqC"
wsj,"Are Twinkies headed for extinction? Labor strikes force Hostess to close plants, mull liquidation. http://t.co/StTcWWZE"
wsj,Breaking: Microsoft Says Manager Who Led Windows 8 Effort Is Leaving  http://t.co/lJktDNie
wsj,"A dilemma for investors: even as China's economy shows signs of speeding up, corporate profits remain flat. http://t.co/NXgpRJZs"
wsj,Lance Armstrong resigns from the board of cancer charity Livestrong: http://t.co/wNXOn6e0
wsj,Breaking: FBI agent in Petraeus case under scrutiny for alleged questionable conduct  http://t.co/qHeuYcWO
wsj,"Despite its pact with Apple, once dominant HTC remains under pressure. http://t.co/0Vn2fwER"
wsj,"The politics of the Petraeus scandal: who knew what, when? http://t.co/JqW7j030"
wsj,RT @ScottMAustin: Here's one way Tim Cook is different than Steve Jobs: He's rolling out perks for Apple employees. http://t.co/wOLdGv6j ...
wsj,"With ascension of new CEO at Lockheed Martin, 3 of the 6 big Pentagon contractors will have female leaders. http://t.co/AtGaz3pd"
wsj,A need for for better bread to serve with meals leads to the founding of bakery with 182 shops. http://t.co/5VoqwrOJ
wsj,RT @WSJVideo: How much do you love a good cigar? WSJ's cigar aficionado @LeeHawkins explores tips for proper cigar enjoyment: http://t.c ...
wsj,The U.S. is set to overtake Saudi Arabia as the world's largest oil producer. But don't expect lower oil prices. http://t.co/V4U0Cq46
wsj,"RT @jolshan: If there's a lesson from the Petraeus affair, maybe it's this: Never email anything you wouldn't want shared on TMZ. http:/ ..."
wsj,RT @MarketWatch: Aetna's CEO threatens to freeze hiring if Obama and the White House don't reach a deal on the fiscal cliff http://t.co/ ...
wsj,Paul Ryan is back in the hunt. Literally. He tweeted about hunting with his brothers: http://t.co/qpPFwhEv
wsj,RT @sarahneedleman: What should you ask yourself before attempting a #startup? Answers from @naval @alexahirschfeld @sgblank &amp; more  ...
wsj,RT @JuliaGulia24: @WSJNY @WSJ Embarking on commute to Hoboken - hope it's under 2.5 hrs. They're ready though #njrush #Hoboken #bus126 h ...
wsj,"RIM is staking its future on the BlackBerry 10, set to launch Jan. 30. http://t.co/ARt0Y08K"
wsj,RT @WBPetersen: #njrush 90 minutes out of Port Authority and not in Lincoln tunnel yet
wsj,Are you commuting from New York City to New Jersey? Share your experience w/ #njrush. http://t.co/CFIk8bTm
wsj,RT @anushaDowJones: Most fellow-commuters looking exhausted and ready for bed! I would be too if morning commute had been horrific. #njrush
wsj,"RT @WSJNY: Nearly two weeks after superstorm Sandy, about a third of the city's financial district remains crippled. http://t.co/OGHIA9qU"
wsj,Fancy a new watch? One of these will set you back nearly $2 million: http://t.co/eLJ8ReXF VIDEO
wsj,RT @WSJspeakeasy: Elmo Puppeteer Kevin Clash Accused Of Affair With Minor http://t.co/Jg3lmY9N
wsj,After #Sandy officials are developing a plan to protect the 9/11 Museum from future floods. http://t.co/J1aW6Kgy
wsj,RT @joe_palazzolo: Obama won't get a reception at the Supreme Court for winning a second term http://t.co/dYNAMrBg
wsj,6.3% of companies in the U.S. - most of them small firms - created all net jobs between 1994 and 2008. http://t.co/f2QR65YB
wsj,"RT @WSJNY: On Social Media, a nightmare commute from New Jersey. http://t.co/rlH7NN47 #njrush"
wsj,"RT @elanazak: RIM is staking its future on the BlackBerry 10,  set to launch Jan. 30. Will it be enough to save the company? http://t.co ..."
wsj,"Bond blows up: 'Skyfall' tops the U.S. box office, earning $87.8 million on its opening weekend. http://t.co/J0cKnCyE"
wsj,"Breaking: In clearing the Bents in the civil case, the jury dealt a high-profile defeat to the SEC. Full article:  http://t.co/OgCVe9J1"
wsj,"Breaking: Bruce Bent and his son, who co-managed Reserve Primary that ""broke the buck"" in 2008, cleared of fraud. http://t.co/CJYb4XHu"
wsj,RT @GabbyStern1: Do you have what it takes to launch a startup? @WSJ launches The Accelerators blog today: http://t.co/C6kPA1IO
wsj,"RT @WSJVideo: This 'Movember,' learn to maintain your moustache with a perfect straight razor shave. Easier than it looks: http://t.co/c ..."
wsj,RT @WSJGraphics: What's ahead in health benefits for 2013 http://t.co/rfO0JPOp
wsj,Correction: Complaints by a female social planner led to the email trail that undid former Gen. Petraeus: http://t.co/g7p1V632
wsj,"Despite lackluster academics, how being polite led to multiple job offers, publishing empire: http://t.co/rHJYhlgJ"
wsj,"RT @garyrosenWSJ: Do veterans of the Cold War deserve the same tributes as vets of our ""hot"" wars? The American Legion says no. http://t ..."
wsj,Lance Armstrong's provocative Twitter picture puzzles the sports world. http://t.co/oU4JHmpq VIDEO
wsj,"Best coffee, taxis in Asia? Travel tips from Adobe's communications director: http://t.co/YCAf5O7J"
wsj,"RT @WSJVideo: Did you see ""Skyfall?""Did you drool over the Aston Martin? WSJ's Dan Neil has 7 more cars perfect for channeling Bond: htt ..."
wsj,International Energy Agency: U.S. will overtake Saudi Arabia as world's largest oil producer by 2020. http://t.co/TmNeGFKf
wsj,RT @WSJVideo: Lance Armstrong Tweets provocative pic of his Tour de France jerseys. What is he trying to say? http://t.co/kmCKaNmb #wsjlive
wsj,"Pilot shortage: major airlines will need to hire 60,000 pilots by 2025 due to departures and expansion: http://t.co/PdH3RB6o"
wsj,RT @MarketWatch: Lance Armstrong has resigned from Livestrong Foundation. Armstrong had co-founded the group in 1997 http://t.co/pi6AbZXP
wsj,"RT @WSJVideo: Nearly 15,000 People Turn Out for 'Gangnam Style' Flash Mob
http://t.co/Al0uSTjA"
wsj,"Justice Department rule kept attorney general Eric Holder, others, from disclosing Petraeus affair: http://t.co/Gy0xx8m3"
wsj,"RT @ChinaRealTime: Take that, Hallmark: Chinese shoppers spend billions on a made-up holiday celebrating singleness http://t.co/fysKTAYy"
wsj,"White House plans public appeal to build support for deficit-fighting tax increases, spending cuts. http://t.co/Deg4L0gs"
wsj,Firms flock to newly opened Myanmar even though newcomers there must carry a lot of cash. http://t.co/XAY2bEv5
wsj,More details emerge on the email trail that undid David Petraeus: http://t.co/uhmPfbYE
wsj,RT @WSJNY: Protecting 9/11 Artifacts From Floods - http://t.co/maKOdJI2 http://t.co/XbB96Pon via @WSJ
wsj,"Free to read: Complaints by a female military adviser led to the email trail that undid former Gen. Petraeus:
http://t.co/LWJbGuyH"
wsj,"Free to read: Syria's opposition formed a coalition that most members say better represents local activists: 
http://t.co/9TYb7va7"
wsj,"RT @GabbyStern1: Elated conductor announces, spiritedly: 'New Yawk New Yawk!' That was approx 85 minutes of fun. See ya tonight, folks.  ..."
wsj,RT @GabbyStern1: First post-Sandy M&amp;E train creeping toward NY: view from window. 1 hour and counting. #njrush http://t.co/Gzxz4Efu
wsj,Free to read: The EPA was unable to say how many Superfund toxic-waste sites were flooded because of Sandy: http://t.co/x4najzX9
wsj,"RT @LaurenGoode: RIM, late to the holiday party, sets Jan. 30 date for BlackBerry 10 launch event http://t.co/G6d3GIVY"
wsj,Free to read: Here are some prosecutions of former bank executives that resulted in prison time: http://t.co/x8sMyozJ
wsj,"Free to read: The Chairman of the BBC Trust, which supervises the BBC, called for an overhaul of the broadcaster: http://t.co/r6rnYQKF"
wsj,.@WSJ staffers are live tweeting their post-#Sandy NJ commute. Follow the live stream: http://t.co/4DwYWkYR #njrush
wsj,"Free to read: Senators say key details of a deal to avoid the ""fiscal cliff"" remain unsolved: http://t.co/g1bPAnEl"
wsj,The home where Michael Jackson lived for about six months until his death sold for $18.1 million. http://t.co/TD6GBsmH
wsj,Free to read: Rising chaos on Israel's borders raised fears that the relative stability there could unravel: http://t.co/gJwpKbVj
wsj,Free to read: Disruptions to Google services in China over the weekend show business risks in the country: http://t.co/dJwSZ7Un
wsj,46% of employers now let workers use their personal smartphones on the job - up from 31% in 2011. http://t.co/m4bQ2v7p
wsj,The rush is on to give away assets before the $5.12 million gift-tax exemption expires at year-end. http://t.co/QJFejPgl
wsj,Starting a new job? A tip from career experts: don't stop networking. http://t.co/060SiF8l
wsj,"Polaroid or iPhone? The Polaroid SX-70, introduced in the 1970s, folded down to the size of a cigar case. http://t.co/szajTooo"
wsj,Two key senators have resumed talks on a bipartisan plan to overhaul U.S. immigration laws. http://t.co/itlKa0J6
wsj,"One year after implementation, Danish lawmakers scrap controversial ""fat tax.""  http://t.co/yLKgDOEe"
wsj,Cloud services let you play state-of-the-art videogames without the shame of stealing your kids' Xbox. http://t.co/toeoIXCq
wsj,"Everything you need to know about the ""fiscal cliff"" - but were afraid to ask: http://t.co/D1XWhGKm VIDEO"
wsj,"Between 2000 and 2010, the Hispanic population in the Midwest grew 49%. http://t.co/JGmpl64J"
wsj,Want to help victims of #Sandy? Donate your unused vacation days: http://t.co/iWIdHH0m
wsj,RT @DevlinBarrett: Sources: FBI found classified docs on mistress's computer; both she and #Petraeus denied he gave them to her: http:// ...
wsj,"RT @WSJweather: My answer to the question: ""Did climate change factor into recent storms?"" http://t.co/jHdyMS7v #Sandy #noreaster"
wsj,The BBC was plunged into disarray as its top executive resigned over the mishandling of 2 sex-abuse reports. http://t.co/dLLnb9pu
wsj,"""Skyfall,"" the newest James Bond movie, had the biggest opening of any film in the franchise's history. http://t.co/RSASrRRA"
wsj,"RT @MarketWatch: S&amp;P 500 has gained 76% since Obama's inauguration in January 2009, while the Nasdaq 100 is up 128% http://t.co/hVpK9laa"
wsj,"Senate Budget Committee Chairman: There is ""absolutely"" the basis for a deal to avoid the ""fiscal cliff."" http://t.co/0WHw3d3D"
wsj,"An explosion in an Indianapolis neighborhood set off a huge fire Saturday night, killing two people. http://t.co/SDkIPmza"
wsj,"RT @garyrosenWSJ: In 1970, Edwin Land saw today's smartphone world with amazing prescience. We just had to wait for the techology. http: ..."
wsj,"Almost two weeks after #Sandy, one vital commuting network has failed to bounce back: New Jersey. http://t.co/0DCANRI7"
