azizansari,Crazy video of all the fans that came out to support the grand opening of Dolly's store!  Check it out at http://su.pr/7oCQ7G
azizansari,Yesterday's Grand Opening was a great success! Check out the meet & greet photos under news here: http://su.pr/1vzFHw
azizansari,"If you want the rainbow, you gotta put up with the rain... even during your own Grand Opening!"
azizansari,"We cannot direct the wind, but we can adjust the sails"
azizansari,Dolly filmed a commercial for her new downtown store and it is so Dolly! Check it out on her website at http://su.pr/7oCQ7G
azizansari,"Check out the first in a series of videos from 2007!  Part 1 is available now in the ""On the Road"" section of Media at http://su.pr/1WmPhA"
azizansari,"Don't have ""Dolly: Live From London"" yet? You can grab it right now for $5 on Amazon.com at http://su.pr/AXUGYu"
azizansari,Congrats MySpace Top Friends Contest Winners! check 'em out at www.myspace.com/dollyparton
azizansari,How can you meet Dolly in Nashville on March 12th?  Get the lowdown at http://su.pr/1WmPhA
azizansari,O'Dolly! Don't get pinched on March 17. Check out the NEW St. Patrick's Day Bundle: http://su.pr/24EI2y
azizansari,"Official press release for the store grand opening and new fan art in the gallery at http://su.pr/1WmPhA, did yours get posted yet?"
azizansari,"I refuse to settle for something less than great. And if it takes a lifetime, then thats how long Ill wait."""
azizansari,New MySpace Top Friends contest!  Get the details on Dolly's MySpace page at http://su.pr/1f46wJ
azizansari,RT @mobileroadie: Exciting! @Dolly_Parton joins the @MobileRoadie family. Check out her app! http://bit.ly/au0ndj (for Android & iPhone)
azizansari,"Dolly not only has an iPhone app, thx to @mobileroadie, she also has an app for android! check both out at  http://su.pr/78P1lo"
azizansari,What is your favorite Dolly quote?  use the hashtag #Dollyism so that others can easily search for the results!
azizansari,Get your Dolly App from iTunes and keep up with Dolly everywhere!  Get the link at http://www.dollypartonmusic.net
azizansari,"We've added a new benefit to being a Dollyite!  Whether you are one, or not one yet... you're gonna wanna check this out http://su.pr/1WmPhA"
azizansari,Dollyites... keep an eye out tomorrow for a special treat for all members!
azizansari,What's your favorite Dolly song?
azizansari,Dolly wishes everyone a Happy Valentine's Day in her latest video diary! http://su.pr/7L2zYq
azizansari,"Get your People Magazine Country playlist featuring ""Jolene"" from ""Live From London"" for free at http://su.pr/1wkTHM"
azizansari,"See the last video of the making of the ""Guitar of Many Colors"" @ http://su.pr/1WmPhA"
azizansari,"check out the latest video in the making of the ""Guitar of Many Colors"" series at http://www.dollypartonmusic.net"
azizansari,"Congrats to all Twitter Meet & Greet Contest Winners! @jessicakatie and @morgand2012, please chk your direct message & respond soon."
azizansari,"Check out part 2 of the making of the ""Guitar of Many Colors"" at http://www.dollypartonmusic.net"
azizansari,"""For every drop of rain a flower grows"" - Dolly"
azizansari,"For serious Dolly collectors only!  Get your hands on a ""Coat of Many Colors"" guitar! http://su.pr/1g7yGr"
azizansari,"For serious Dolly collectors only!  Get your hands on a ""Coat of Many Colors"" guitar! http://su.pr/2O9FJi"
azizansari,"Check out how a ""Coat of Many Colors"" guitar is made at http://su.pr/1WmPhA"
azizansari,"Above the storm, the smallest prayer will still be heard. -Dolly"
azizansari,Win a Meet & Greet with Dolly at the Grand Opening of her store using twitter!  Get full details at http://su.pr/6dm8FL
azizansari,"Dollyite members and Big Wigs, check out the NEW meet & greet contests posted under news here: http://su.pr/1vzFHw"
azizansari,@kasarr try the link in the news section of www.dollypartonmusic.net.  that should work
azizansari,"You can buy ""Live from London"" in HD from iTunes! Also in SD and for rent on many Apple devices. Get the link at http://su.pr/1WmPhA"
azizansari,"does Dolly really sign all those autographs? find out at http://su.pr/1WmPhA in the misc. videos section under media, or on your webslice!"
azizansari,Want to see the winning cakes in the Dolly Cake Contest? Check 'em out under news here: http://su.pr/1vzFHw
azizansari,Dont let these false eyelashes lead you to believe that Im as shallow as I look cause I run true and deep. Dolly in Backwoods Barbie
azizansari,"""If you see someone without a smile, give 'em yours"" - Dolly"
azizansari,Want to see your Dolly art featured on the official website? Find out how under the news section here: http://su.pr/1vzFHw
azizansari,Hope for Haiti Now telethon is on CMT + others now. Watch and donate. We need your help! http://su.pr/27XkOk #igave PLEASE RT
azizansari,We need your help! Hope for Haiti Now telethon airs tonight at 8/7c on CMT/others. Watch and donate. http://www.cmt.com #igave
azizansari,The way I look is just a country girls idea of glam! Dolly in Backwoods Barbie
azizansari,"Hey Dolly Fans in the UK! Check out Dolly's commercial for you and locally order your copy of ""Live From London"" at http://su.pr/1WmPhA"
azizansari,"""I look just like the girls next door...if you happen to live next door to an amusement park!"" -Dolly :)"
azizansari,"Dollyites -  we have fixed the audio in your video blog section for ""Ask Dolly.""  The other locations are being fixed now."
azizansari,our present to you for dolly's bday: a special video where dolly answers some of your questions. watch it at http://su.pr/1WmPhA
azizansari,Happy Birthday Dolly!
azizansari,"Bake a ""Dolly Cake"" & win some great prizes! Find out how under the news section @ http://su.pr/1vzFHw"
azizansari,New pictures posted in the public and Dollyite media sections!  Check them out at http://su.pr/1WmPhA
azizansari,"""I'm kinda like a little cartoon character & cartoon characters dont get old. I'm animated, over-exaggerated & I will never change."" -Dol"
azizansari,Valentines is just around the corner!  Be sure and pick up your Dolly Valentines pkg early.  Check it out at http://su.pr/81nic9
azizansari,"The ""Live from London"" movie is now available as a digital purchase on Amazon.com.  Get the link in the news at http://su.pr/1WmPhA"
azizansari,CMT interviews Dolly about her past performances & experiences along with Live from London. Get the link in the news at http://su.pr/1WmPhA
azizansari,"Congratulations to Rose Zadik, our Dollyite Wallpaper Design Winner! Check out her Vintage Dolly wallpaper here: http://su.pr/1vzFHw"
azizansari,"""The thing that's always worked for me is the fact that I look so totally artificial, but am so totally real."" - Dolly"
azizansari,Be sure and catch Dolly on GAC Master Jan. 5 at 10pm EST and Jan. 10 at 6pm EST!
azizansari,Dolly wishes everyone a Happy New Year in her latest video diary at www.dollypartonmusic.net!
azizansari,Dolly wishes everyone a Merry Christmas in her new video diary at http://su.pr/1WmPhA
azizansari,Keep a look out this week for a special Christmas message from DOLLY!
azizansari,Catch Dolly this weekend on Entertaiment Tonight's Weekend show!  Check local listings for channel and showtimes.
azizansari,"""Come any closer and you're going to get your Christmas punch early!"" -Dolly ~ Lorna Davis in A Smoky Mtn Christmas :)"
azizansari,"""I'm comin' home for Christmas, you can count on that"" - Dolly http://su.pr/2D3Ehk"
azizansari,Dolly on TV twice tonight!  Check her out on ET and on Fox.  Find out more at http://su.pr/1WmPhA
azizansari,Catch this sneak-peek of Dolly on Entertainment Tonight tomorrow!  Get the link at http://su.pr/1WmPhA
azizansari,"Dolly loves her Big Wigs! Not her hair...her street team, the Big Wigs! Check out a new video from Dolly: http://su.pr/7L2zYq"
azizansari,Winner announced for the London Tee worn by Dolly. Details under news: http://su.pr/1vzFHw
azizansari,"Want to watch the designing, building and completion of Dolly's new store in Nashville? Take your own tour here: http://su.pr/7oCQ7G"
azizansari,Want your artwork featured on Dolly's website? Details here: http://su.pr/1vzFHw
azizansari,"""9 to 5: The Musical"" Cast Album is nominated for a Grammy Award!"
azizansari,"Get Dolly's latest single, ""Comin' Home for Christmas"" now!  Available at Amazon or iTunes.  Get the links at http://su.pr/1WmPhA"
azizansari,"""Where is Jolene when I need her?"" - Dolly (from ""Dolly: Live From London"")"
azizansari,Dolly will guest-star on Carrie Underwood television Christmas Special. Details: http://su.pr/1vzFHw
azizansari,Dolly wants to wish everyone a safe and happy Thanksgiving in her latest video diary! http://su.pr/2ELTu8
azizansari,"If you live in Nashville, head down to 2nd Ave to check out Dolly's new store today! Check back next week for a video! http://su.pr/1WmPhA"
azizansari,ET has been rescheduled to this coming Tuesday. She will be interviewed by the lovely Kellie Pickler. Check tv listings for times
azizansari,Hey Everyone! Don't forget to tune in and catch Dolly's television interview tonight: http://su.pr/1vzFHw
azizansari,"""My weaknesses have always been food and men - in that order."" -Dolly"
azizansari,Have you seen Dolly's new MySpace page yet? It really is a work of art - http://su.pr/1f46wJ
azizansari,Catch Kellie Pickler's interview with Dolly Parton on Entertainment Tonight Thursday evening! It's a must see :)
azizansari,Catch Dolly again tonight on the Joy Behar show at 9pm EST on HLN!
azizansari,Watch the clip of Dolly on the Joy Behar show at http://joybehar.blogs.cnn.com/ and catch the re-airing Monday Night!
azizansari,Dolly News Roundup! Check the latest interviews with Dolly and learn more about your favorite country icon! Get links at http://su.pr/1WmPhA
azizansari,Congratulations to Deanna Mendoza for winning our London Tweet Trivia contest. Want to see the answers? http://su.pr/1vzFHw
azizansari,"Check out a pic of our ""2nd Annual Dress Like Dolly Contest"" Winner here: http://su.pr/1vzFHw"
azizansari,"Get your free mp3 download of Dolly's well-known song ""Jolene"" as performed Live From London here: http://su.pr/2a35LH! :)"
azizansari,"Want to win the ""Wild Thing"" outfit worn in the ""Shinola"" video?  Find out how and where at http://su.pr/1WmPhA!"
azizansari,Dolly adds a webslice to her website!  Check out the video in the news section of http://su.pr/1WmPhA and get the slice!
azizansari,Dolly's bringing London to you TODAY!! Dolly: Live From London! DVD/Live CD combo in stores NOW! For more info: http://su.pr/1vzFHw
azizansari,Dolly!! Live From London DVD/CD combo! Coming 11-10-09! Get READY!
azizansari,London Tweet Trivia #10 (last question!): Where was I Will Always Love You 1st recorded? Final contest instructions: http://su.pr/1vzFHw.
azizansari,"RT @followcmt Need a boost this Christmas? How about a $2,500 SHOP.COM shopping spree and call from Dolly Parton !? http://bit.ly/kBV9o"
azizansari,Please take a minute to vote for Dolly's Backwoods Barbie video! All it takes is the push of a button:) http://su.pr/1iNwzy. Thanks!
azizansari,London Tweet Trivia #9: What singing trio of brothers wrote the hit song Islands in the Stream for Dolly and Kenny?
azizansari,DollySHOP! Dolly is rocking shop.com as their artist of the month. Hear a word from Dolly and check out the store here: http://su.pr/2D0pNv
azizansari,Congratulations to Solomon Willis for receiving the most member votes on his Dolly Collection photo! http://su.pr/1WmPhA
azizansari,London Tweet Trivia #8: Where did Dolly write the lyrics for Only Dreamin? Hint: check out her CMT 330 sessions. news: http://su.pr/1vzFHw
azizansari,London Tweet Trivia #7: What American Idol contestant covered Do I Ever Cross Your Mind during the competition? Info&gt; http://su.pr/1vzFHw.
azizansari,Aahhh chiropractor... Hurts so good :-) you lug these around and see if your back don't hurt!
azizansari,London Tweet Trivia #6: What is the first and last name of the character Dolly played in the hit film 9 to 5? Contest=&gt; http://su.pr/1vzFHw.
azizansari,London Tweet Trivia #5: Who performed The Grass is Blue with Dolly on the 2003 CMA Awards? Contest details here: http://su.pr/1vzFHw.
azizansari,London Tweet Trivia #4:What city and state was Better Get to Livin music video filmed in? Details under news here: http://su.pr/1vzFHw.
azizansari,"London Tweet Trivia #3: What is Dolly's heart wrapped around in ""Here You Come Again?"" Contest details under news here: http://su.pr/1vzFHw."
azizansari,London Tweets Trivia #2: What record label released Dollys latest album Backwoods Barbie? Get contest details here: http://su.pr/1vzFHw :)
azizansari,London Tweets Trivia RT Question 1: What did Dolly first pen the lyrics for Coat of Many Colors on? Details here: http://su.pr/1vzFHw.
azizansari,London Tweet Trivia Question 1: What did Dolly 1st pen the lyrics for Coat of Many Colors on? contest details here: http://su.pr/1vzFH
azizansari,London Tweets Trivia 10-day contest starts TODAY! Get details from the news section @ http://su.pr/1vzFHw. How well do you know Dolly? :)
azizansari,"CMT and shop.com host the Holly Dolly Christmas Sweeps! Enter to win a phone call from Dolly, $2,500 shopping spree @ http://su.pr/2kFwTA."
azizansari,"@therealpickler mine is ""the little engine that could"" ;-)"
azizansari,What album release features Dolly on a carousel as the cover art?  Send your answer via the @ reply function :-)
azizansari,"Dolly's heart is 'wrapped around your little finger' in this live recording of ""Here You Come Again"" http://su.pr/1vzFHw."
azizansari,We are running out fast of this popular presale package that includes an autographed hatch print poster! Order soon! http://su.pr/2fksPo
azizansari,just watched Miley's youtube rap http://su.pr/30Am0j cracked me up! love you miley
azizansari,"watch ""Jolene"" live from London!!! Find out where this exclusive clip is in the ""news"" section at http://su.pr/1WmPhA"
azizansari,New items! For a limited time you can grab a $24.99 Dollyite membership plus $27.99 tee for only $34.99! Check it out at http://su.pr/1g7yGr
azizansari,"Support the Cure. My friends are bowling for boobs tonight in atlanta, strike!"
azizansari,"Autographed Dolly Hatch, VIP Fan Laminates & more available with her new DVD/CD combo in some great pre-order packages: http://su.pr/24EI2y!"
azizansari,Top Pre-Order package sold out within minutes! Thanks Dolly Fans!
azizansari,Check out the pre-order packages now available in the store. Only 2 left of the top tier package! http://su.pr/1WmPhA
azizansari,Want your own personal Dolly holiday greeting on DVD? Check out the pre-order packages now available in the store at http://su.pr/1WmPhA
azizansari,"Want to dress like Dolly? Here's your chance! Send your best ""DOLLY"" photo to info@dollypartonmusic.net by Nov. 7 for a chance to WIN BIG!"
azizansari,"""the only one stopping you from living your dreams is you"" - Dolly"
azizansari,"We posted new video content on Dolly's website!  Get all the details in the ""News"" section following the link ---&gt; http://su.pr/1WmPhA"
azizansari,We searched Dolly's warehouse and found some discontinued items!  You'll want to grab these before they're gone forever http://su.pr/5MQZWj
azizansari,Want to be kissed by Dolly? Check out the featured Glitter Lips Tee @ http://su.pr/31xBf6 in the new Trinkets & Treasures store! :)
azizansari,NEW webstore launched! All new designed merch! http://www.dollypartonmusic.net
azizansari,"http://www.dollypartonmusic.net is having their 2nd Annual ""Dress Like Dolly"" Halloween contest!  Head there to see what you can win :-)"
azizansari,"Big things are coming soon on the website!  Keep a sharp lookout, you won't want to miss this... http://www.dollypartonmusic.net"
azizansari,Be sure and check out the new behind-the-scenes interview with Amy Sedaris from Better Get to Livin on Dolly's site under Media/Videos/Misc
azizansari,"""I'll never harden my heart, but I've toughened the muscles around it."" -Dolly"
azizansari,Win NEW Dolly Merchandise! Head to http://su.pr/1vzFHw for details :)
azizansari,"new webpages added to http://www.dollypartonmusic.net! Hit up the ""News"" section for all the details."
azizansari,"Hey Dolly Fans! If you're a Dollyite, head to http://su.pr/1vzFHw for a NEW behind the scenes video."
azizansari,"Hey Dolly Fans! Take a minute to vote for Dolly's video ""Change It"" @ http://su.pr/5BBcQ0. Let's slingshot her back to #1!"
azizansari,"""If you don't like the road you're walking, start paving another one."""
azizansari,Everyone have a safe and happy Labor Day Weekend!
azizansari,"Congrats to Shelley Landers from Waynesboro, VA for winning the personalized autographed Dolly vintage vinyl photo contest!"
azizansari,"""Storms make trees take deeper roots"" - Dolly"
azizansari,"A clip of Dolly ""Live From London"" during the 44th Annual Jerry Lewis MDA Telethon this Labor Day weekend! http://www.mda.org"
azizansari,"""It's a good thing I was born a girl.  Otherwise I'd be a drag queen."" - Dolly"
azizansari,"Hey Dolly Fans! Take a minute and vote for Dolly's ""Change It"" video on CMT's Pure 12 Pack. http://su.pr/5BBcQ0. Let's take Dolly to #1!"
azizansari,Win personalized autographed Dolly vinyl! Go to the news section at  http://su.pr/1vzFHw for details!
azizansari,"""The thing that's always worked for me is the fact that I look so totally artificial, but am so totally real."" - Dolly"
azizansari,"""You'll never do a whole lot unless you're brave enough to try"" - Dolly"
azizansari,"""Change It"" MySpace Top 8 Friends Contest, details at myspace.com/dollyparton. ""Nothing's gonna change if you don't change it!"" -Dolly"
azizansari,"""Change It"" debutes today in the ""video"" tab of http://www.myspace.com! Check it out Dolly fans :-) It was a blast to do"
azizansari,"""The magic is inside you... there ain't no crystal ball!"" - Dolly"
azizansari,"Ch-ch-ch-change IT! Call your local AC & Country radio station to request ""Change It"". Radio download on AirPlay Direct: http://su.pr/AsvVfU"
azizansari,"""Change It"" now available for streaming at http://www.myspace.com/dollyparton add it to your profile!"
azizansari,"Radio needs change...call your local Adult Contemporary and Country radio stations and request ""Change It""! http://www.dollypartonmusic.net"
azizansari,Dolly's Imagination Library Video On-Demand is available now at http://www.thesmokies.tv
azizansari,look out for the Dolly Dispatch...monthly newsletter in your inbox SOON!
azizansari,"@mileycyrus noticed my ""rainbow"" quote on your twitter feed.  They have been affectionately called ""Dollyisms by fans. thanks niece hannah"
azizansari,"""Leave something good in every day!"""
azizansari,"Dolly responds to ""9 to 5"" departing from Broadway.  Read what she has to say at http://su.pr/1WmPhA"
azizansari,"""Nothin's gonna change if you don't change it"" - Dolly (""Change It"" single at iTunes now!) iTunes link - http://su.pr/1vNqFU"
azizansari,"Can't wait to see ""Live from London?"" New APTV schedule is posted at http://su.pr/1WmPhA. Watch it on your local Public Television station!"
azizansari,Dolly is getting her photo taken...a lot! Photo shoot today!
azizansari,"""Find out who you are and do it on purpose."""
azizansari,"""If you want the rainbow, you've got to put up with the rain"" - Dolly"
azizansari,"Dolly thanks her UK fans for helping her achieve recent Platinum sales status.  Watch the video in the ""news"" section at http://su.pr/1WmPhA"
azizansari,"Want the ""9 to 5"" Cast Album digitally from Dolly? Head on over to http://su.pr/1f46wJ to download directly from Dolly's Bandbox instantly!"
azizansari,"""9 to 5: The Musical"" Cast Album now available at http://su.pr/A2zhNH"
azizansari,Hello to @gacnightsradio!
azizansari,"About to go live on WMAD in Madison, WI"
azizansari,"Dolly taping radio show for air monday on WGNE in Jacksonville, FL"
azizansari,"Kansas City, KBEQ right now!"
azizansari,"Coming up for dolly's radio day: wncy-green bay, kbeq-kansas city, kscs-dallas, wksj-mobile, wdaf-kansas city and more all morning long!"
azizansari,@JimDebKevin looking foward to it as well :-)
azizansari,Now on WLXX in Lexington! Look for the b-roll footage to appear on http://www.dollypartonmusic.net soon!
azizansari,On KBWF San Fran now!
azizansari,Listen for dolly in a few minutes on KBWF-FM in San Francisco!
azizansari,Dolly is in the studio right now doing radio interviews!
azizansari,Hey Dollyites! Check your exclusive pix sections for some new photos! Also look for a special video blog from Dolly tomorrow just for you!!!
azizansari,Dolly is featured on the front page of Youtube today.  You can check out the screenshot at www.dollypartonmusic.net.
azizansari,check http://www.dollypartonmusic.net for your information regarding how to get a FREE 3 Month Dollyite Membership trial!
azizansari,New Dolly Video Diary on her website.  Rest in Peace Michael Jackson.  http://su.pr/1WmPhA
azizansari,many are having some trouble with their Dollyite accounts. We are working to get this fixed as soon as possible.
azizansari,Dolly's new website is now launched!!! Thanks for sticking with us for this incredible redesign!  See it now at http://su.pr/1WmPhA
azizansari,"""The Very Best of Dolly Parton"" has gone PLATINUM in the UK! Thanks fans for your love and support of Dolly Parton!"
azizansari,"Hey Dolly Fans!  ""Backwoods Barbie"" is now #3 on the CMC Australia Countdown!  Let's make her #1!"
azizansari,we're back and updated with pics of the winners of the raffle prizes from CMA Music Fest!  Check out the rockers and iPod pics!
azizansari,Hold tight Dollyites! Dolly's site is down for just a bit while some stuff for the new site is being tested out. We should be back soon
azizansari,"Check out the latest ""Dolly's Video Diary"" only at www.dollypartonmusic.net!  Dolly talks about releasing the cast album for 9 to 5!"
azizansari,Dolly is #5 on the Country Music Channel Australia Top 50 Countdown!  Everyone in Australia vote for Backwoods Barbie and let's make her #1
azizansari,"Dolly broke 1 million plays on MySpace with the singles from her latest album, Backwoods Barbie!  http://www.myspace.com/dollyparton"
azizansari,Buy Dolly's used guitar strings made into a bracelet for Imagination Library at http://tinyurl.com/lzy6bp and check out @wearyourmusic
azizansari,Dolly's website is back up and running.  News updates will start back again soon :-)
azizansari,DollyPartonMusic.net has been temporarily down.  The problem is being resolved as quickly as possible. Sorry for the invconvenience.
azizansari,Are any Dollyites in Australia checking out the Dolly iPod contest at CMC Australia's website? You can also win a CD you can't buy there!
azizansari,"Dolly's video, ""Backwoods Barbie,"" is #7 at Country Music Channel Australia! Thanks to all the fans ""down under"" :-)"
azizansari,Watch Dolly's interview from today's episode of The Early Show @ http://www.dollyon-line.com/news/
azizansari,"News, News, News at www.dollypartonmusic.net!  what could it be about?  hint... website and Dolly on CBS!"
azizansari,Happy Friday!Please take a minute and vote for Dolly on GAC. Click http://tinyurl.com/232dnp. She dropped to #17 last week.Help keep her in!
azizansari,More Tony Awards news at www.dollypartonmusic.net!  You won't want to miss this!
azizansari,New MySpace Top Friend's contest... see www.dollypartonmusic.net for details and look for the new website in t-minus ~25 days
azizansari,Everyone have a safe and happy Memorial Day weekend from Dolly Parton Management/Dolly Records
azizansari,Dolly Live in London trailer?  Better check out www.dollypartonmusic.net to find out
azizansari,Vote for 9 to 5 in fan choice awards at http://tinyurl.com/q4936x and http://tinyurl.com/peugoj and check out @9to5themusical
azizansari,More information available about Live in London @ www.dollypartonmusic.net!
azizansari,Dolly has a new facebook address!  www.facebook.com/dollyparton
azizansari,Happy Monday! Dolly is #3 on GAC for this week!! Awesome work everyone...let's keep it up. Vote when you can at http://tinyurl.com/232dnp.
azizansari,Watch Dolly RIGHT NOW sing during UT's Graduations at http://tinyurl.com/pymo2m
azizansari,Watch Dolly get her Honorary Doctorate LIVE!  www.dollypartonmusic.net has the link!
azizansari,Dolly will be getting her Doctorate tomorrow from the University of Tennessee! Congratulations Dolly!
azizansari,"""9 to 5"" has been nominated for 4 Tony Awards!  Head over to www.dollypartonmusic.net to see the her video blog about this event!"
azizansari,watch Dolly's interview from The View @ http://www.dollyon-line.com/news/
azizansari,"Want more ""9 to 5"" news, reviews, and photos?  Hit up the links over in the ""news"" section of www.dollypartonmusic.net"
azizansari,"Don't forget to watch Dolly and the cast from ""9 to 5"" on ""The View"" tomorrow!  Check local listings for showtimes :-)"
azizansari,CMT Power Picks today @ 10am CT. Dolly's BWB video will come up for voting before 11am. Click http://tinyurl.com/cyuhms and vote for Dolly.
azizansari,Don't forget to watch Dolly on Letterman tomorrow night!
azizansari,9 to 5: The Musical broke the record for single season nominations for the Drama Desk Awards! more at www.dollypartonmusic.net
azizansari,Check out http://www.dollypartonmusic.net for important information concerning Dollyite memberships.
azizansari,Watch Dolly's full interview on the Today Show @ http://www.dollyon-line.com/news/
azizansari,Don't miss Dolly on the Today Show this morning on NBC!
azizansari,"Dolly on ""Today"" tomorrow and more TV appearances! Check www.dollypartonmusic.net for details on TV and more recent news r.e. ""9 to 5"""
