azizansari,VOTE NOW at http://tinyurl.com/cyuhms now! You can click repeatedly! THANKS! Tune in to CMT for results!
azizansari,"CMT Power Picks starts @ 10am.  Dolly's BWB will come up for voting before 11am. Go to http://tinyurl.com/jakjy, click vote now & get ready!"
azizansari,Morning all! Happy Wednesday. Take a minute to VOTE for Dolly on GAC's Top 20 Country Countdown. Click http://tinyurl.com/232dnp to vote!
azizansari,"CMT Power Picks is starting now!! Click http://tinyurl.com/jakjy and vote for Dolly's ""Backwoods Barbie"" video. Scroll down and click vote!"
azizansari,"Click http://tinyurl.com/aegrvq and vote for Dolly's ""Backwoods Barbie"" video on CMT's Top 20 Countdown. Vote often!"
azizansari,Dolly's Big Wigs have a twitter feed now!  Sign up to receive updates and activities or mission updates at http://twitter.com/dollysbigwigs
azizansari,"Dolly Parton will deliver a rare Nashville performance on Feb. 2 at the Wildhorse Saloon, as part of the 2nd annual Gift of Music concert."
azizansari,is among this year's inductees into the Gospel Music Hall of Fame. The ceremony will take place in Nashville on Feb. 2!
azizansari,"was named #1 on Glamour Magazine's 9 Best One-Liners of All Time with the quote, ""It takes a lot of money to look this cheap."" Jan 09 issue"
azizansari,Congrats to the GAC Top 50 contest winners! Check back to the street team site for the next contest coming soon!
azizansari,There's a great review of Dolly from Des Moines from her tour. You can read it on her site now!
azizansari,gift certificates now available for the Dolly online store! The perfect gift for any Dolly fan at dollypartonmusic.net!
azizansari,Rolling Stone names Dolly on their 100 Greatest Singers of All Time List!
azizansari,Dolly ranked #4 on AOL's most played video list in any genre during October!
azizansari,"October 31 show in Newark, NJ cancelled. See dollypartonmusic.net for more details."
azizansari,Dolly-Ites exclusive October contest. Visit Dollypartonmusic.net for all the details.  Join or renew today for only $19.99!
azizansari,"Check out the October issue of Acoustic Guitar Magazine for a transcription of ""Jolene!"" For more details go to dollypartonmusic.net."
azizansari,"Never shy of her poor upbringing, Dolly is the driving force behind a child literacy program that runs across the United States and the UK."
azizansari,Dolly Partons unveiled her Imagination Library program Tuesday. The program aims to instill a love of reading in youngsters up to age 5.
azizansari,Dolly-ite members can get a glimpse of Dolly rehearsing for her 2008 Backwoods Barbie Tour. Members can view the pics on her site!
azizansari,Dolly Parton is back from the most successful European tour of her career and is ready to take on America with a new leg of shows in August!
azizansari,"Dolly Parton is a ""feminist icon... a role model to us all"" check out the article: http://www.guardian.co.uk/commentisfree/2008/jul/09/1"
azizansari,"George Jones will be releasing a new album on August 19th, ""Unreleased Duets"", which features a song with Dolly! Find out more on her site."
azizansari,"Dolly wrote a song for Jessica Simpson's new country album and sang on the record titled ""Do You Know""! Check out the story on GACTV.com!"
azizansari,Dolly has lined up additional US dates for her Backwoods Barbie tour. Go to www.dollypartonmusic.net and grab tickets before they sell out!
azizansari,"Dolly Parton will be in Fairfax, VA tomorrow. Buy or win your tickets before they sell out! www.dollypartonmusic.net"
azizansari,Welcome to Dolly Parton's official Twitter page!
