CBSNews,"Check out the October issue of Acoustic Guitar Magazine for a transcription of ""Jolene!"" For more details go to dollypartonmusic.net."
CBSNews,"Never shy of her poor upbringing, Dolly is the driving force behind a child literacy program that runs across the United States and the UK."
CBSNews,Dolly Partons unveiled her Imagination Library program Tuesday. The program aims to instill a love of reading in youngsters up to age 5.
CBSNews,Dolly-ite members can get a glimpse of Dolly rehearsing for her 2008 Backwoods Barbie Tour. Members can view the pics on her site!
CBSNews,Dolly Parton is back from the most successful European tour of her career and is ready to take on America with a new leg of shows in August!
CBSNews,"Dolly Parton is a ""feminist icon... a role model to us all"" check out the article: http://www.guardian.co.uk/commentisfree/2008/jul/09/1"
CBSNews,"George Jones will be releasing a new album on August 19th, ""Unreleased Duets"", which features a song with Dolly! Find out more on her site."
CBSNews,"Dolly wrote a song for Jessica Simpson's new country album and sang on the record titled ""Do You Know""! Check out the story on GACTV.com!"
CBSNews,Dolly has lined up additional US dates for her Backwoods Barbie tour. Go to www.dollypartonmusic.net and grab tickets before they sell out!
CBSNews,"Dolly Parton will be in Fairfax, VA tomorrow. Buy or win your tickets before they sell out! www.dollypartonmusic.net"
CBSNews,Welcome to Dolly Parton's official Twitter page!
CBSNews,all i need now is a seesmic invite and i'll be **very web 2.0** - or is the 2.0 expression dated already?
CBSNews,"so people actually use this to communicate, do they?"
CBSNews,i am still alive
