Dolly_Parton,"""9 to 5"" has been nominated for 4 Tony Awards!  Head over to www.dollypartonmusic.net to see the her video blog about this event!"
Dolly_Parton,watch Dolly's interview from The View @ http://www.dollyon-line.com/news/
Dolly_Parton,"Want more ""9 to 5"" news, reviews, and photos?  Hit up the links over in the ""news"" section of www.dollypartonmusic.net"
Dolly_Parton,"Don't forget to watch Dolly and the cast from ""9 to 5"" on ""The View"" tomorrow!  Check local listings for showtimes :-)"
Dolly_Parton,CMT Power Picks today @ 10am CT. Dolly's BWB video will come up for voting before 11am. Click http://tinyurl.com/cyuhms and vote for Dolly.
Dolly_Parton,Don't forget to watch Dolly on Letterman tomorrow night!
Dolly_Parton,9 to 5: The Musical broke the record for single season nominations for the Drama Desk Awards! more at www.dollypartonmusic.net
Dolly_Parton,Check out http://www.dollypartonmusic.net for important information concerning Dollyite memberships.
Dolly_Parton,Watch Dolly's full interview on the Today Show @ http://www.dollyon-line.com/news/
Dolly_Parton,Don't miss Dolly on the Today Show this morning on NBC!
Dolly_Parton,"Dolly on ""Today"" tomorrow and more TV appearances! Check www.dollypartonmusic.net for details on TV and more recent news r.e. ""9 to 5"""
Dolly_Parton,VOTE NOW at http://tinyurl.com/cyuhms now! You can click repeatedly! THANKS! Tune in to CMT for results!
Dolly_Parton,"CMT Power Picks starts @ 10am.  Dolly's BWB will come up for voting before 11am. Go to http://tinyurl.com/jakjy, click vote now & get ready!"
Dolly_Parton,Morning all! Happy Wednesday. Take a minute to VOTE for Dolly on GAC's Top 20 Country Countdown. Click http://tinyurl.com/232dnp to vote!
Dolly_Parton,"CMT Power Picks is starting now!! Click http://tinyurl.com/jakjy and vote for Dolly's ""Backwoods Barbie"" video. Scroll down and click vote!"
Dolly_Parton,"Click http://tinyurl.com/aegrvq and vote for Dolly's ""Backwoods Barbie"" video on CMT's Top 20 Countdown. Vote often!"
Dolly_Parton,Dolly's Big Wigs have a twitter feed now!  Sign up to receive updates and activities or mission updates at http://twitter.com/dollysbigwigs
Dolly_Parton,"Dolly Parton will deliver a rare Nashville performance on Feb. 2 at the Wildhorse Saloon, as part of the 2nd annual Gift of Music concert."
Dolly_Parton,is among this year's inductees into the Gospel Music Hall of Fame. The ceremony will take place in Nashville on Feb. 2!
Dolly_Parton,"was named #1 on Glamour Magazine's 9 Best One-Liners of All Time with the quote, ""It takes a lot of money to look this cheap."" Jan 09 issue"
Dolly_Parton,Congrats to the GAC Top 50 contest winners! Check back to the street team site for the next contest coming soon!
Dolly_Parton,There's a great review of Dolly from Des Moines from her tour. You can read it on her site now!
Dolly_Parton,gift certificates now available for the Dolly online store! The perfect gift for any Dolly fan at dollypartonmusic.net!
Dolly_Parton,Rolling Stone names Dolly on their 100 Greatest Singers of All Time List!
Dolly_Parton,Dolly ranked #4 on AOL's most played video list in any genre during October!
Dolly_Parton,"October 31 show in Newark, NJ cancelled. See dollypartonmusic.net for more details."
Dolly_Parton,Dolly-Ites exclusive October contest. Visit Dollypartonmusic.net for all the details.  Join or renew today for only $19.99!
Dolly_Parton,"Check out the October issue of Acoustic Guitar Magazine for a transcription of ""Jolene!"" For more details go to dollypartonmusic.net."
Dolly_Parton,"Never shy of her poor upbringing, Dolly is the driving force behind a child literacy program that runs across the United States and the UK."
Dolly_Parton,Dolly Partons unveiled her Imagination Library program Tuesday. The program aims to instill a love of reading in youngsters up to age 5.
Dolly_Parton,Dolly-ite members can get a glimpse of Dolly rehearsing for her 2008 Backwoods Barbie Tour. Members can view the pics on her site!
Dolly_Parton,Dolly Parton is back from the most successful European tour of her career and is ready to take on America with a new leg of shows in August!
Dolly_Parton,"Dolly Parton is a ""feminist icon... a role model to us all"" check out the article: http://www.guardian.co.uk/commentisfree/2008/jul/09/1"
Dolly_Parton,"George Jones will be releasing a new album on August 19th, ""Unreleased Duets"", which features a song with Dolly! Find out more on her site."
Dolly_Parton,"Dolly wrote a song for Jessica Simpson's new country album and sang on the record titled ""Do You Know""! Check out the story on GACTV.com!"
Dolly_Parton,Dolly has lined up additional US dates for her Backwoods Barbie tour. Go to www.dollypartonmusic.net and grab tickets before they sell out!
Dolly_Parton,"Dolly Parton will be in Fairfax, VA tomorrow. Buy or win your tickets before they sell out! www.dollypartonmusic.net"
Dolly_Parton,Welcome to Dolly Parton's official Twitter page!
