Dolly_Parton,"I refuse to settle for something less than great. And if it takes a lifetime, then thats how long Ill wait."
Dolly_Parton,Dolly is going to take a little time off.  Find out why in her latest video diary at http://su.pr/1WmPhA
Dolly_Parton,"""If there's one thing this blonde has learned, blondes have more fun!"" -Dolly"
Dolly_Parton,"Dolly wanted to thank her fans for their support in a special video diary! Head over to the website, iPhone/Andoid app or slice to check it!"
Dolly_Parton,"""I've got all I need! I've got Jesus & gravity."" -Dolly"
Dolly_Parton,Dolly Fans! Check out the ribbon cutting and press conference from the grand opening at http://su.pr/7oCQ7G
Dolly_Parton,RT @FollowCMT: Dolly Parton Opens Shop on Nashville's Main Drag. Read about it and see photos! http://bit.ly/aKHZ1d
Dolly_Parton,Crazy video of all the fans that came out to support the grand opening of Dolly's store!  Check it out at http://su.pr/7oCQ7G
Dolly_Parton,Yesterday's Grand Opening was a great success! Check out the meet & greet photos under news here: http://su.pr/1vzFHw
Dolly_Parton,"If you want the rainbow, you gotta put up with the rain... even during your own Grand Opening!"
Dolly_Parton,"We cannot direct the wind, but we can adjust the sails"
Dolly_Parton,Dolly filmed a commercial for her new downtown store and it is so Dolly! Check it out on her website at http://su.pr/7oCQ7G
Dolly_Parton,"Check out the first in a series of videos from 2007!  Part 1 is available now in the ""On the Road"" section of Media at http://su.pr/1WmPhA"
Dolly_Parton,"Don't have ""Dolly: Live From London"" yet? You can grab it right now for $5 on Amazon.com at http://su.pr/AXUGYu"
Dolly_Parton,Congrats MySpace Top Friends Contest Winners! check 'em out at www.myspace.com/dollyparton
Dolly_Parton,How can you meet Dolly in Nashville on March 12th?  Get the lowdown at http://su.pr/1WmPhA
Dolly_Parton,O'Dolly! Don't get pinched on March 17. Check out the NEW St. Patrick's Day Bundle: http://su.pr/24EI2y
Dolly_Parton,"Official press release for the store grand opening and new fan art in the gallery at http://su.pr/1WmPhA, did yours get posted yet?"
Dolly_Parton,"I refuse to settle for something less than great. And if it takes a lifetime, then thats how long Ill wait."""
Dolly_Parton,New MySpace Top Friends contest!  Get the details on Dolly's MySpace page at http://su.pr/1f46wJ
Dolly_Parton,RT @mobileroadie: Exciting! @Dolly_Parton joins the @MobileRoadie family. Check out her app! http://bit.ly/au0ndj (for Android & iPhone)
Dolly_Parton,"Dolly not only has an iPhone app, thx to @mobileroadie, she also has an app for android! check both out at  http://su.pr/78P1lo"
Dolly_Parton,What is your favorite Dolly quote?  use the hashtag #Dollyism so that others can easily search for the results!
Dolly_Parton,Get your Dolly App from iTunes and keep up with Dolly everywhere!  Get the link at http://www.dollypartonmusic.net
Dolly_Parton,"We've added a new benefit to being a Dollyite!  Whether you are one, or not one yet... you're gonna wanna check this out http://su.pr/1WmPhA"
Dolly_Parton,Dollyites... keep an eye out tomorrow for a special treat for all members!
Dolly_Parton,What's your favorite Dolly song?
Dolly_Parton,Dolly wishes everyone a Happy Valentine's Day in her latest video diary! http://su.pr/7L2zYq
Dolly_Parton,"Get your People Magazine Country playlist featuring ""Jolene"" from ""Live From London"" for free at http://su.pr/1wkTHM"
Dolly_Parton,"See the last video of the making of the ""Guitar of Many Colors"" @ http://su.pr/1WmPhA"
Dolly_Parton,"check out the latest video in the making of the ""Guitar of Many Colors"" series at http://www.dollypartonmusic.net"
Dolly_Parton,"Congrats to all Twitter Meet & Greet Contest Winners! @jessicakatie and @morgand2012, please chk your direct message & respond soon."
Dolly_Parton,"Check out part 2 of the making of the ""Guitar of Many Colors"" at http://www.dollypartonmusic.net"
Dolly_Parton,"""For every drop of rain a flower grows"" - Dolly"
Dolly_Parton,"For serious Dolly collectors only!  Get your hands on a ""Coat of Many Colors"" guitar! http://su.pr/1g7yGr"
Dolly_Parton,"For serious Dolly collectors only!  Get your hands on a ""Coat of Many Colors"" guitar! http://su.pr/2O9FJi"
Dolly_Parton,"Check out how a ""Coat of Many Colors"" guitar is made at http://su.pr/1WmPhA"
Dolly_Parton,"Above the storm, the smallest prayer will still be heard. -Dolly"
Dolly_Parton,Win a Meet & Greet with Dolly at the Grand Opening of her store using twitter!  Get full details at http://su.pr/6dm8FL
Dolly_Parton,"Dollyite members and Big Wigs, check out the NEW meet & greet contests posted under news here: http://su.pr/1vzFHw"
Dolly_Parton,@kasarr try the link in the news section of www.dollypartonmusic.net.  that should work
Dolly_Parton,"You can buy ""Live from London"" in HD from iTunes! Also in SD and for rent on many Apple devices. Get the link at http://su.pr/1WmPhA"
Dolly_Parton,"does Dolly really sign all those autographs? find out at http://su.pr/1WmPhA in the misc. videos section under media, or on your webslice!"
Dolly_Parton,Want to see the winning cakes in the Dolly Cake Contest? Check 'em out under news here: http://su.pr/1vzFHw
Dolly_Parton,Dont let these false eyelashes lead you to believe that Im as shallow as I look cause I run true and deep. Dolly in Backwoods Barbie
Dolly_Parton,"""If you see someone without a smile, give 'em yours"" - Dolly"
Dolly_Parton,Want to see your Dolly art featured on the official website? Find out how under the news section here: http://su.pr/1vzFHw
Dolly_Parton,Hope for Haiti Now telethon is on CMT + others now. Watch and donate. We need your help! http://su.pr/27XkOk #igave PLEASE RT
Dolly_Parton,We need your help! Hope for Haiti Now telethon airs tonight at 8/7c on CMT/others. Watch and donate. http://www.cmt.com #igave
Dolly_Parton,The way I look is just a country girls idea of glam! Dolly in Backwoods Barbie
Dolly_Parton,"Hey Dolly Fans in the UK! Check out Dolly's commercial for you and locally order your copy of ""Live From London"" at http://su.pr/1WmPhA"
Dolly_Parton,"""I look just like the girls next door...if you happen to live next door to an amusement park!"" -Dolly :)"
Dolly_Parton,"Dollyites -  we have fixed the audio in your video blog section for ""Ask Dolly.""  The other locations are being fixed now."
Dolly_Parton,our present to you for dolly's bday: a special video where dolly answers some of your questions. watch it at http://su.pr/1WmPhA
Dolly_Parton,Happy Birthday Dolly!
Dolly_Parton,"Bake a ""Dolly Cake"" & win some great prizes! Find out how under the news section @ http://su.pr/1vzFHw"
Dolly_Parton,New pictures posted in the public and Dollyite media sections!  Check them out at http://su.pr/1WmPhA
Dolly_Parton,"""I'm kinda like a little cartoon character & cartoon characters dont get old. I'm animated, over-exaggerated & I will never change."" -Dol"
Dolly_Parton,Valentines is just around the corner!  Be sure and pick up your Dolly Valentines pkg early.  Check it out at http://su.pr/81nic9
Dolly_Parton,"The ""Live from London"" movie is now available as a digital purchase on Amazon.com.  Get the link in the news at http://su.pr/1WmPhA"
Dolly_Parton,CMT interviews Dolly about her past performances & experiences along with Live from London. Get the link in the news at http://su.pr/1WmPhA
Dolly_Parton,"Congratulations to Rose Zadik, our Dollyite Wallpaper Design Winner! Check out her Vintage Dolly wallpaper here: http://su.pr/1vzFHw"
Dolly_Parton,"""The thing that's always worked for me is the fact that I look so totally artificial, but am so totally real."" - Dolly"
Dolly_Parton,Be sure and catch Dolly on GAC Master Jan. 5 at 10pm EST and Jan. 10 at 6pm EST!
Dolly_Parton,Dolly wishes everyone a Happy New Year in her latest video diary at www.dollypartonmusic.net!
Dolly_Parton,Dolly wishes everyone a Merry Christmas in her new video diary at http://su.pr/1WmPhA
Dolly_Parton,Keep a look out this week for a special Christmas message from DOLLY!
Dolly_Parton,Catch Dolly this weekend on Entertaiment Tonight's Weekend show!  Check local listings for channel and showtimes.
Dolly_Parton,"""Come any closer and you're going to get your Christmas punch early!"" -Dolly ~ Lorna Davis in A Smoky Mtn Christmas :)"
Dolly_Parton,"""I'm comin' home for Christmas, you can count on that"" - Dolly http://su.pr/2D3Ehk"
Dolly_Parton,Dolly on TV twice tonight!  Check her out on ET and on Fox.  Find out more at http://su.pr/1WmPhA
Dolly_Parton,Catch this sneak-peek of Dolly on Entertainment Tonight tomorrow!  Get the link at http://su.pr/1WmPhA
Dolly_Parton,"Dolly loves her Big Wigs! Not her hair...her street team, the Big Wigs! Check out a new video from Dolly: http://su.pr/7L2zYq"
Dolly_Parton,Winner announced for the London Tee worn by Dolly. Details under news: http://su.pr/1vzFHw
Dolly_Parton,"Want to watch the designing, building and completion of Dolly's new store in Nashville? Take your own tour here: http://su.pr/7oCQ7G"
Dolly_Parton,Want your artwork featured on Dolly's website? Details here: http://su.pr/1vzFHw
Dolly_Parton,"""9 to 5: The Musical"" Cast Album is nominated for a Grammy Award!"
Dolly_Parton,"Get Dolly's latest single, ""Comin' Home for Christmas"" now!  Available at Amazon or iTunes.  Get the links at http://su.pr/1WmPhA"
Dolly_Parton,"""Where is Jolene when I need her?"" - Dolly (from ""Dolly: Live From London"")"
Dolly_Parton,Dolly will guest-star on Carrie Underwood television Christmas Special. Details: http://su.pr/1vzFHw
Dolly_Parton,Dolly wants to wish everyone a safe and happy Thanksgiving in her latest video diary! http://su.pr/2ELTu8
Dolly_Parton,"If you live in Nashville, head down to 2nd Ave to check out Dolly's new store today! Check back next week for a video! http://su.pr/1WmPhA"
Dolly_Parton,ET has been rescheduled to this coming Tuesday. She will be interviewed by the lovely Kellie Pickler. Check tv listings for times
Dolly_Parton,Hey Everyone! Don't forget to tune in and catch Dolly's television interview tonight: http://su.pr/1vzFHw
Dolly_Parton,"""My weaknesses have always been food and men - in that order."" -Dolly"
Dolly_Parton,Have you seen Dolly's new MySpace page yet? It really is a work of art - http://su.pr/1f46wJ
Dolly_Parton,Catch Kellie Pickler's interview with Dolly Parton on Entertainment Tonight Thursday evening! It's a must see :)
Dolly_Parton,Catch Dolly again tonight on the Joy Behar show at 9pm EST on HLN!
Dolly_Parton,Watch the clip of Dolly on the Joy Behar show at http://joybehar.blogs.cnn.com/ and catch the re-airing Monday Night!
Dolly_Parton,Dolly News Roundup! Check the latest interviews with Dolly and learn more about your favorite country icon! Get links at http://su.pr/1WmPhA
Dolly_Parton,Congratulations to Deanna Mendoza for winning our London Tweet Trivia contest. Want to see the answers? http://su.pr/1vzFHw
Dolly_Parton,"Check out a pic of our ""2nd Annual Dress Like Dolly Contest"" Winner here: http://su.pr/1vzFHw"
Dolly_Parton,"Get your free mp3 download of Dolly's well-known song ""Jolene"" as performed Live From London here: http://su.pr/2a35LH! :)"
Dolly_Parton,"Want to win the ""Wild Thing"" outfit worn in the ""Shinola"" video?  Find out how and where at http://su.pr/1WmPhA!"
Dolly_Parton,Dolly adds a webslice to her website!  Check out the video in the news section of http://su.pr/1WmPhA and get the slice!
Dolly_Parton,Dolly's bringing London to you TODAY!! Dolly: Live From London! DVD/Live CD combo in stores NOW! For more info: http://su.pr/1vzFHw
Dolly_Parton,Dolly!! Live From London DVD/CD combo! Coming 11-10-09! Get READY!
Dolly_Parton,London Tweet Trivia #10 (last question!): Where was I Will Always Love You 1st recorded? Final contest instructions: http://su.pr/1vzFHw.
Dolly_Parton,"RT @followcmt Need a boost this Christmas? How about a $2,500 SHOP.COM shopping spree and call from Dolly Parton !? http://bit.ly/kBV9o"
Dolly_Parton,Please take a minute to vote for Dolly's Backwoods Barbie video! All it takes is the push of a button:) http://su.pr/1iNwzy. Thanks!
Dolly_Parton,London Tweet Trivia #9: What singing trio of brothers wrote the hit song Islands in the Stream for Dolly and Kenny?
Dolly_Parton,DollySHOP! Dolly is rocking shop.com as their artist of the month. Hear a word from Dolly and check out the store here: http://su.pr/2D0pNv
Dolly_Parton,Congratulations to Solomon Willis for receiving the most member votes on his Dolly Collection photo! http://su.pr/1WmPhA
Dolly_Parton,London Tweet Trivia #8: Where did Dolly write the lyrics for Only Dreamin? Hint: check out her CMT 330 sessions. news: http://su.pr/1vzFHw
Dolly_Parton,London Tweet Trivia #7: What American Idol contestant covered Do I Ever Cross Your Mind during the competition? Info&gt; http://su.pr/1vzFHw.
Dolly_Parton,Aahhh chiropractor... Hurts so good :-) you lug these around and see if your back don't hurt!
Dolly_Parton,London Tweet Trivia #6: What is the first and last name of the character Dolly played in the hit film 9 to 5? Contest=&gt; http://su.pr/1vzFHw.
Dolly_Parton,London Tweet Trivia #5: Who performed The Grass is Blue with Dolly on the 2003 CMA Awards? Contest details here: http://su.pr/1vzFHw.
Dolly_Parton,London Tweet Trivia #4:What city and state was Better Get to Livin music video filmed in? Details under news here: http://su.pr/1vzFHw.
Dolly_Parton,"London Tweet Trivia #3: What is Dolly's heart wrapped around in ""Here You Come Again?"" Contest details under news here: http://su.pr/1vzFHw."
Dolly_Parton,London Tweets Trivia #2: What record label released Dollys latest album Backwoods Barbie? Get contest details here: http://su.pr/1vzFHw :)
Dolly_Parton,London Tweets Trivia RT Question 1: What did Dolly first pen the lyrics for Coat of Many Colors on? Details here: http://su.pr/1vzFHw.
Dolly_Parton,London Tweet Trivia Question 1: What did Dolly 1st pen the lyrics for Coat of Many Colors on? contest details here: http://su.pr/1vzFH
Dolly_Parton,London Tweets Trivia 10-day contest starts TODAY! Get details from the news section @ http://su.pr/1vzFHw. How well do you know Dolly? :)
Dolly_Parton,"CMT and shop.com host the Holly Dolly Christmas Sweeps! Enter to win a phone call from Dolly, $2,500 shopping spree @ http://su.pr/2kFwTA."
Dolly_Parton,"@therealpickler mine is ""the little engine that could"" ;-)"
Dolly_Parton,What album release features Dolly on a carousel as the cover art?  Send your answer via the @ reply function :-)
Dolly_Parton,"Dolly's heart is 'wrapped around your little finger' in this live recording of ""Here You Come Again"" http://su.pr/1vzFHw."
Dolly_Parton,We are running out fast of this popular presale package that includes an autographed hatch print poster! Order soon! http://su.pr/2fksPo
Dolly_Parton,just watched Miley's youtube rap http://su.pr/30Am0j cracked me up! love you miley
Dolly_Parton,"watch ""Jolene"" live from London!!! Find out where this exclusive clip is in the ""news"" section at http://su.pr/1WmPhA"
Dolly_Parton,New items! For a limited time you can grab a $24.99 Dollyite membership plus $27.99 tee for only $34.99! Check it out at http://su.pr/1g7yGr
Dolly_Parton,"Support the Cure. My friends are bowling for boobs tonight in atlanta, strike!"
Dolly_Parton,"Autographed Dolly Hatch, VIP Fan Laminates & more available with her new DVD/CD combo in some great pre-order packages: http://su.pr/24EI2y!"
Dolly_Parton,Top Pre-Order package sold out within minutes! Thanks Dolly Fans!
Dolly_Parton,Check out the pre-order packages now available in the store. Only 2 left of the top tier package! http://su.pr/1WmPhA
Dolly_Parton,Want your own personal Dolly holiday greeting on DVD? Check out the pre-order packages now available in the store at http://su.pr/1WmPhA
Dolly_Parton,"Want to dress like Dolly? Here's your chance! Send your best ""DOLLY"" photo to info@dollypartonmusic.net by Nov. 7 for a chance to WIN BIG!"
Dolly_Parton,"""the only one stopping you from living your dreams is you"" - Dolly"
Dolly_Parton,"We posted new video content on Dolly's website!  Get all the details in the ""News"" section following the link ---&gt; http://su.pr/1WmPhA"
Dolly_Parton,We searched Dolly's warehouse and found some discontinued items!  You'll want to grab these before they're gone forever http://su.pr/5MQZWj
Dolly_Parton,Want to be kissed by Dolly? Check out the featured Glitter Lips Tee @ http://su.pr/31xBf6 in the new Trinkets & Treasures store! :)
Dolly_Parton,NEW webstore launched! All new designed merch! http://www.dollypartonmusic.net
Dolly_Parton,"http://www.dollypartonmusic.net is having their 2nd Annual ""Dress Like Dolly"" Halloween contest!  Head there to see what you can win :-)"
Dolly_Parton,"Big things are coming soon on the website!  Keep a sharp lookout, you won't want to miss this... http://www.dollypartonmusic.net"
Dolly_Parton,Be sure and check out the new behind-the-scenes interview with Amy Sedaris from Better Get to Livin on Dolly's site under Media/Videos/Misc
Dolly_Parton,"""I'll never harden my heart, but I've toughened the muscles around it."" -Dolly"
Dolly_Parton,Win NEW Dolly Merchandise! Head to http://su.pr/1vzFHw for details :)
Dolly_Parton,"new webpages added to http://www.dollypartonmusic.net! Hit up the ""News"" section for all the details."
Dolly_Parton,"Hey Dolly Fans! If you're a Dollyite, head to http://su.pr/1vzFHw for a NEW behind the scenes video."
Dolly_Parton,"Hey Dolly Fans! Take a minute to vote for Dolly's video ""Change It"" @ http://su.pr/5BBcQ0. Let's slingshot her back to #1!"
Dolly_Parton,"""If you don't like the road you're walking, start paving another one."""
Dolly_Parton,Everyone have a safe and happy Labor Day Weekend!
Dolly_Parton,"Congrats to Shelley Landers from Waynesboro, VA for winning the personalized autographed Dolly vintage vinyl photo contest!"
Dolly_Parton,"""Storms make trees take deeper roots"" - Dolly"
Dolly_Parton,"A clip of Dolly ""Live From London"" during the 44th Annual Jerry Lewis MDA Telethon this Labor Day weekend! http://www.mda.org"
Dolly_Parton,"""It's a good thing I was born a girl.  Otherwise I'd be a drag queen."" - Dolly"
Dolly_Parton,"Hey Dolly Fans! Take a minute and vote for Dolly's ""Change It"" video on CMT's Pure 12 Pack. http://su.pr/5BBcQ0. Let's take Dolly to #1!"
Dolly_Parton,Win personalized autographed Dolly vinyl! Go to the news section at  http://su.pr/1vzFHw for details!
Dolly_Parton,"""The thing that's always worked for me is the fact that I look so totally artificial, but am so totally real."" - Dolly"
Dolly_Parton,"""You'll never do a whole lot unless you're brave enough to try"" - Dolly"
Dolly_Parton,"""Change It"" MySpace Top 8 Friends Contest, details at myspace.com/dollyparton. ""Nothing's gonna change if you don't change it!"" -Dolly"
Dolly_Parton,"""Change It"" debutes today in the ""video"" tab of http://www.myspace.com! Check it out Dolly fans :-) It was a blast to do"
Dolly_Parton,"""The magic is inside you... there ain't no crystal ball!"" - Dolly"
Dolly_Parton,"Ch-ch-ch-change IT! Call your local AC & Country radio station to request ""Change It"". Radio download on AirPlay Direct: http://su.pr/AsvVfU"
Dolly_Parton,"""Change It"" now available for streaming at http://www.myspace.com/dollyparton add it to your profile!"
Dolly_Parton,"Radio needs change...call your local Adult Contemporary and Country radio stations and request ""Change It""! http://www.dollypartonmusic.net"
Dolly_Parton,Dolly's Imagination Library Video On-Demand is available now at http://www.thesmokies.tv
Dolly_Parton,look out for the Dolly Dispatch...monthly newsletter in your inbox SOON!
Dolly_Parton,"@mileycyrus noticed my ""rainbow"" quote on your twitter feed.  They have been affectionately called ""Dollyisms by fans. thanks niece hannah"
Dolly_Parton,"""Leave something good in every day!"""
Dolly_Parton,"Dolly responds to ""9 to 5"" departing from Broadway.  Read what she has to say at http://su.pr/1WmPhA"
Dolly_Parton,"""Nothin's gonna change if you don't change it"" - Dolly (""Change It"" single at iTunes now!) iTunes link - http://su.pr/1vNqFU"
Dolly_Parton,"Can't wait to see ""Live from London?"" New APTV schedule is posted at http://su.pr/1WmPhA. Watch it on your local Public Television station!"
Dolly_Parton,Dolly is getting her photo taken...a lot! Photo shoot today!
Dolly_Parton,"""Find out who you are and do it on purpose."""
Dolly_Parton,"""If you want the rainbow, you've got to put up with the rain"" - Dolly"
Dolly_Parton,"Dolly thanks her UK fans for helping her achieve recent Platinum sales status.  Watch the video in the ""news"" section at http://su.pr/1WmPhA"
Dolly_Parton,"Want the ""9 to 5"" Cast Album digitally from Dolly? Head on over to http://su.pr/1f46wJ to download directly from Dolly's Bandbox instantly!"
Dolly_Parton,"""9 to 5: The Musical"" Cast Album now available at http://su.pr/A2zhNH"
Dolly_Parton,Hello to @gacnightsradio!
Dolly_Parton,"About to go live on WMAD in Madison, WI"
Dolly_Parton,"Dolly taping radio show for air monday on WGNE in Jacksonville, FL"
Dolly_Parton,"Kansas City, KBEQ right now!"
Dolly_Parton,"Coming up for dolly's radio day: wncy-green bay, kbeq-kansas city, kscs-dallas, wksj-mobile, wdaf-kansas city and more all morning long!"
Dolly_Parton,@JimDebKevin looking foward to it as well :-)
Dolly_Parton,Now on WLXX in Lexington! Look for the b-roll footage to appear on http://www.dollypartonmusic.net soon!
Dolly_Parton,On KBWF San Fran now!
Dolly_Parton,Listen for dolly in a few minutes on KBWF-FM in San Francisco!
Dolly_Parton,Dolly is in the studio right now doing radio interviews!
Dolly_Parton,Hey Dollyites! Check your exclusive pix sections for some new photos! Also look for a special video blog from Dolly tomorrow just for you!!!
Dolly_Parton,Dolly is featured on the front page of Youtube today.  You can check out the screenshot at www.dollypartonmusic.net.
Dolly_Parton,check http://www.dollypartonmusic.net for your information regarding how to get a FREE 3 Month Dollyite Membership trial!
Dolly_Parton,New Dolly Video Diary on her website.  Rest in Peace Michael Jackson.  http://su.pr/1WmPhA
Dolly_Parton,many are having some trouble with their Dollyite accounts. We are working to get this fixed as soon as possible.
Dolly_Parton,Dolly's new website is now launched!!! Thanks for sticking with us for this incredible redesign!  See it now at http://su.pr/1WmPhA
Dolly_Parton,"""The Very Best of Dolly Parton"" has gone PLATINUM in the UK! Thanks fans for your love and support of Dolly Parton!"
Dolly_Parton,"Hey Dolly Fans!  ""Backwoods Barbie"" is now #3 on the CMC Australia Countdown!  Let's make her #1!"
Dolly_Parton,we're back and updated with pics of the winners of the raffle prizes from CMA Music Fest!  Check out the rockers and iPod pics!
Dolly_Parton,Hold tight Dollyites! Dolly's site is down for just a bit while some stuff for the new site is being tested out. We should be back soon
Dolly_Parton,"Check out the latest ""Dolly's Video Diary"" only at www.dollypartonmusic.net!  Dolly talks about releasing the cast album for 9 to 5!"
Dolly_Parton,Dolly is #5 on the Country Music Channel Australia Top 50 Countdown!  Everyone in Australia vote for Backwoods Barbie and let's make her #1
Dolly_Parton,"Dolly broke 1 million plays on MySpace with the singles from her latest album, Backwoods Barbie!  http://www.myspace.com/dollyparton"
Dolly_Parton,Buy Dolly's used guitar strings made into a bracelet for Imagination Library at http://tinyurl.com/lzy6bp and check out @wearyourmusic
Dolly_Parton,Dolly's website is back up and running.  News updates will start back again soon :-)
Dolly_Parton,DollyPartonMusic.net has been temporarily down.  The problem is being resolved as quickly as possible. Sorry for the invconvenience.
Dolly_Parton,Are any Dollyites in Australia checking out the Dolly iPod contest at CMC Australia's website? You can also win a CD you can't buy there!
Dolly_Parton,"Dolly's video, ""Backwoods Barbie,"" is #7 at Country Music Channel Australia! Thanks to all the fans ""down under"" :-)"
Dolly_Parton,Watch Dolly's interview from today's episode of The Early Show @ http://www.dollyon-line.com/news/
Dolly_Parton,"News, News, News at www.dollypartonmusic.net!  what could it be about?  hint... website and Dolly on CBS!"
Dolly_Parton,Happy Friday!Please take a minute and vote for Dolly on GAC. Click http://tinyurl.com/232dnp. She dropped to #17 last week.Help keep her in!
Dolly_Parton,More Tony Awards news at www.dollypartonmusic.net!  You won't want to miss this!
Dolly_Parton,New MySpace Top Friend's contest... see www.dollypartonmusic.net for details and look for the new website in t-minus ~25 days
Dolly_Parton,Everyone have a safe and happy Memorial Day weekend from Dolly Parton Management/Dolly Records
Dolly_Parton,Dolly Live in London trailer?  Better check out www.dollypartonmusic.net to find out
Dolly_Parton,Vote for 9 to 5 in fan choice awards at http://tinyurl.com/q4936x and http://tinyurl.com/peugoj and check out @9to5themusical
Dolly_Parton,More information available about Live in London @ www.dollypartonmusic.net!
Dolly_Parton,Dolly has a new facebook address!  www.facebook.com/dollyparton
Dolly_Parton,Happy Monday! Dolly is #3 on GAC for this week!! Awesome work everyone...let's keep it up. Vote when you can at http://tinyurl.com/232dnp.
Dolly_Parton,Watch Dolly RIGHT NOW sing during UT's Graduations at http://tinyurl.com/pymo2m
Dolly_Parton,Watch Dolly get her Honorary Doctorate LIVE!  www.dollypartonmusic.net has the link!
Dolly_Parton,Dolly will be getting her Doctorate tomorrow from the University of Tennessee! Congratulations Dolly!
