Dolly_Parton,"""Men are no different than women as far as their hearts go. Its just that women love to tell everything!"" :)"
Dolly_Parton,"To celebrate 1 MILLION, we're choosing 100 followers to receive the new BETTER DAY album! We'll mail 'em out the week of release in July :)"
Dolly_Parton,Hey Everyone! We've reached 1 MILLION FOLLOWERS!!! Thank you!!
Dolly_Parton,"""If you talk bad about country music, it's like saying bad things about my momma. Them's fightin' words."""
Dolly_Parton,"Dolly is promoting the UK leg of the #BDWT this week! Tune in to ""The ONE Show"" tonight on BBC1. More appearances @ http://ow.ly/4yzqj."
Dolly_Parton,"""You'll never do a whole lot unless you're brave enough to try."" -Dolly"
Dolly_Parton,"""When someone shows you their true colors, believe them."" -Dolly"
Dolly_Parton,Last day to purchase #betterdayworldtour presale packages & tkts. Find out how @ http://ow.ly/4qAlW. Public on sale tomorrow!!
Dolly_Parton,"#BetterDayWorldTour US Presale tickets available to subscribers, social networks & online comm NOW @ http://ow.ly/4p3eD. Limited # avail!!"
Dolly_Parton,Dollyites: Check your email or head to the Dollyite Contest page for an important #BetterDayWorldTour Presale announcement!
Dolly_Parton,"Knoxville, TN presale tickets & VIP packages NOW available for July 17 show! NEW US tour dates posted! Get details @ http://ow.ly/4kQww."
Dolly_Parton,Happy Tuesday! Dolly is up for 'The Greatest' on @FollowCMT. VOTE now & find out how to WIN a copy of the new album @ http://ow.ly/4jNvc.
Dolly_Parton,Dollyites: Please check your email or go to the website Dollyite contest page for an important presale announcement! :) http://ow.ly/4juiD
Dolly_Parton,"Hey Everyone! Spring Sale on select Dolly items! 25% OFF, NEW 2011 Dolly Calendar, ALL posters, Contemporary T's & more @ http://ow.ly/4j8yX"
Dolly_Parton,"Morning everyone, Happy Monday. ""Leave something good in every day."" -Dolly"
Dolly_Parton,Did any Dolly fans wear their O'Dolly t-shirts today? :) Post a picture and tag @dolly_parton so we can see it! :)
Dolly_Parton,"""Home is anywhere I hang my hair."" -Dolly"
Dolly_Parton,"Dolly's July 31 show @ the Wolf Trap Filene Center in Vienna, VA is now on sale to the general public. Tickets. http://ow.ly/4d55I"
Dolly_Parton,"Dolly @ Wolf Trap in Vienna, VA July 31, pre-sale tkts and VIP bundles available NOW @ http://ow.ly/4cJst. User: dolly, Pass: parton"
Dolly_Parton,Rock on Dolly! http://t.co/k6f3ubA #iTunes
Dolly_Parton,"Pre-sale tix/VIP packages available to Dollyites for Wolf Trap July 31 Vienna, VA show TODAY 5PM ET. Head to http://ow.ly/4bXAf for details."
Dolly_Parton,Dolly & Friends gather to celebrate Kenny Rogers: The First 50 Years tonight @ 8:30pm ET on @gactv. More details @ http://ow.ly/4aa9E.
Dolly_Parton,"""I never let a rhinestone go unturned."" -Dolly"
Dolly_Parton,"Thanks to @TheBootGirls for asking Dolly to ""put on her boots"" for this great campaign! Read more @ http://ow.ly/421e5."
Dolly_Parton,Dollyites! 2nd O2 London show announced for Sept. 8. Dollyite Pre-Sale tickets are available now. Get details @ http://ow.ly/41R9a.
Dolly_Parton,Dolly will be doing a Q&A with British publication Q Magazine for the upcoming tour. Submit your question? Details @ http://ow.ly/41ikM.
Dolly_Parton,Enjoy a little blast from the past...Dolly guests on the Simpsons: http://ow.ly/41ezc
Dolly_Parton,"""I have little feet because nothing grows in the shade."" -Dolly"
Dolly_Parton,"Dolly's 2011 Grammy Acceptance Video @ http://ow.ly/3WXs4. ""Just because I got the Lifetime Achievement Award doesn't mean I'm done."" -Dolly"
Dolly_Parton,"Dollyite pre-sale ticket link for Aug. 25 Copenhagen, Denmark show has been posted in the Dollyite forum & email sent to fan club members."
Dolly_Parton,Dolly is 2011 Grammy Lifetime Achievement Award recipient! Ireland dates announced for Better Day Tour. Get details @ http://ow.ly/3W2cY.
Dolly_Parton,"Dollyite Members planning to attend the @dolly_parton Sweden shows in Aug., please check your email for pre-sale ticket information."
Dolly_Parton,More dates announced for Dolly's 2011 Better Day Tour @ http://ow.ly/3SNZU! Here we come Scandinavia!!
Dolly_Parton,Dolly announces new UK dates for her 2011 World Tour! Tickets on presale to all @LiveNationUK subscribers 9am Thursday http://bit.ly/ezh5CJ.
Dolly_Parton,"We're celebrating Valentine's Day early! Feb. 7-14, 50% OFF in the online store! Check it out @ http://ow.ly/3RDYQ."
Dolly_Parton,"""If you see someone without a smile, give 'em yours."" -Dolly"
Dolly_Parton,"""I hope people realize there is a brain underneath the hair and a heart underneath the boobs."" -Dolly (http://ow.ly/3KFgh)"
Dolly_Parton,"Thank you for all of the #birthdaywishes. See our 'Birthday Wishes' Contest winners @ http://ow.ly/3GNhY.  ""I Will Always Love You."" -Dolly"
Dolly_Parton,"""Find out who you are and do it on purpose."" -Dolly"
Dolly_Parton,"Dolly's birthday is only 1 week away! Check out Dolly's 2011 ""Birthday Wishes"" Contest @ http://ow.ly/3CGWg for your chance to win!"
Dolly_Parton,Happy New Year everybody! :) Dolly has announced the title of her upcoming 2011 album. Check it out @ http://ow.ly/3zApv.
Dolly_Parton,"""This next song is for people who are too bad to be good, and too good to be bad."" :) -Dolly"
Dolly_Parton,Merry Christmas!
Dolly_Parton,Dolly wishes everyone a Merry Christmas! Listen to her tell a touching Christmas story from her childhood at http://ow.ly/3qT5X
Dolly_Parton,Get your 2011 Dolly Calendar now! This unique calendar features all new Dolly photos taken just last October! http://ow.ly/3pIev
Dolly_Parton,Get 50% off in the Dolly store thru Wednesday! http://ow.ly/3oDky
Dolly_Parton,Check out some festive Dolly photos at http://ow.ly/3jBnf
Dolly_Parton,RT @mamoosie: And for a long drive do u use a DollyWood? ;) RT @OMGFactsSports: A putt on a hilly green is called a Dolly Parton
Dolly_Parton,New features in the Dolly app for Android and iPhone! Grab it at http://ow.ly/3igIJ and read about the new features at http://ow.ly/3igKh
Dolly_Parton,HUGE SALE TODAY & THROUGH THE WEEKEND! 30% off all Dolly Parton merch! Check it out at http://ow.ly/3fWzY
Dolly_Parton,"Dolly wishes everyone a Happy Thanksgiving! Though mostly an American tradition, everyone will love what she has to say! http://ow.ly/3f1FL"
Dolly_Parton,don't forget to catch Dolly on @LarryKing tomorrow! Check your local listings for showtimes
Dolly_Parton,Hey everyone! The #travelindolly video is posted @ http://ow.ly/3dS5s. Congratulations Damien on winning the grand prize! Happy Travelin'!
Dolly_Parton,My weaknesses have always been food and men - in that order.
Dolly_Parton,Dolly Parton to release new album/tour next year!!! Get the whole scoop at http://ow.ly/3aFMC
Dolly_Parton,I have a strict policy that nobody cries alone in my presence.
Dolly_Parton,The '3rd Annual Dress Like Dolly Contest' winning photos have been posted! Check them out @ http://ow.ly/36QEy. Awesome job!!
Dolly_Parton,We've made some new changes to Dolly's @facebook page! We've added a band page from @rootmusic. Check it out at http://ow.ly/34r4t
Dolly_Parton,Last #travelindolly Trivia winner and answer of the year posted @ http://ow.ly/33SRv ! Thank you everyone!
Dolly_Parton,I'm not going to limit myself just because people won't accept the fact that I can do something else.
Dolly_Parton,I look just like the girls next door... if you happen to live next door to an amusement park.
Dolly_Parton,Hey Everyone! It's time to enter the #travelindolly grand prize contest! Go to http://ow.ly/31Eb1 for details on how to enter! Happy Friday!
Dolly_Parton,"We've brought back 2 past shirt designs for $12.99 each! Check out ""flourish"" & ""studio shot"" at http://ow.ly/30Xcq"
Dolly_Parton,RT @jillwhit05: @Dolly_Parton I'm dressed as Dolly 4 Halloween & a top 10 finalist in Billboard's costume contest! Pls vote JILL:...
Dolly_Parton,"If you don't like the road you're walking, start paving another one."
Dolly_Parton,#travelindolly is making her last stop :( See where she is & enter to win a sweet Dolly t-shirt and signed vinyl album @ http://ow.ly/30n1r.
Dolly_Parton,See if you're this week's #travelindolly trivia winner & Dolly history expert @ http://ow.ly/2ZIzA. :)
Dolly_Parton,Tour Books added to our discounted merch and now $5.99! http://ow.ly/2YXYE
Dolly_Parton,"New popular shirts added to our ""sale"" section! Get 3 shirts for the price of 1 in one special package! Check it out at http://ow.ly/2XefR"
Dolly_Parton,"#travelindolly trivia tests you with a bit of Dolly history @ http://ow.ly/2Xdlq. Enter to win a SWEET framed, personalized signed vinyl LP."
Dolly_Parton,"#travelindolly trivia tests you with a bit of Dolly history @ http://ow.ly/2XcMy. Enter to win a SWEET framed, personalized signed vinyl LP."
Dolly_Parton,Did you answer this week's #travelindolly trivia correctly? Get the answer & take a break to watch the music video @ http://ow.ly/2VYCN.
Dolly_Parton,RT @daraobriain: Dolly and I have gone our separate ways. Our wildlife detective agency was closed a decade ago. I was getting more gigs ...
Dolly_Parton,"After momma gave birth to twelve of us kids, we put her up on a pedestal. It was mostly to keep Daddy away from her."
Dolly_Parton,Last of the new merch is up! Check out 2 new shirts & 1 new mug... and be ready for a few surprises with some old favs soon....
Dolly_Parton,"Have you added ""Live From London"" to your netflix queue yet? Log in to your account and check it out at http://ow.ly/2TJ85"
Dolly_Parton,#travelindolly is in HOLLYWOOD!! Check out this week's TD Trivia @ http://ow.ly/2T1yU for your chance to win some cool prizes! :)
Dolly_Parton,Dolly's got a new video diary or you! She what she has to say on YouTube http://ow.ly/2SlM6 or on her website http://ow.ly/2SlJC
Dolly_Parton,Get the answer to this week's #travelindolly trivia @ http://ow.ly/2SiTn. Did you win?! Look for another TD sighting tomorrow!
Dolly_Parton,The magic is inside you.  There aint no crystal ball.
Dolly_Parton,"Want to win some Dolly merch! Check out this years ""Dress Like Dolly"" contest for halloween! http://ow.ly/2QjgE"
Dolly_Parton,What are all of those things?! Check out this week's #travelindolly trivia @ http://ow.ly/2PwEz. Don't be a boob. :) Enter to win!!
Dolly_Parton,"Check out some new Dolly merch, including a pair of crystal etched pint glasses! You've got to see these! http://ow.ly/2PqPY"
Dolly_Parton,See if you won this week's #travelindolly trivia @ http://ow.ly/2OQkb! Congratulations! Look for another TD visit tomorrow!
Dolly_Parton,I can relate to people who are struggling and trying to find their true identity
Dolly_Parton,"If kids can read, you can stir their imaginations. They can educate themselves, even if they dont have the best opportunities."" -Dolly"
Dolly_Parton,Enter to win this week's #travelindolly trivia prize @ http://ow.ly/2LNKm. This is an easy one. :)
Dolly_Parton,My weaknesses have always been food and men - in that order.
Dolly_Parton,Do you know this week's #travelindolly trivia answer? Enter to win this week's prize @ http://ow.ly/2IpUi ! Hint: Doralee would know it...
Dolly_Parton,New Dolly fan art posted! Did yours make it up yet? http://ow.ly/2Ie54
Dolly_Parton,See 9 to 5: The Musical in Ft. Worth at Bass Performance Hall July 26-31. Tickets ONSALE Now at http://bit.ly/97o2VW  or call 817-212-4280!
Dolly_Parton,Hey Everyone! Find out if you're this week's #travelindolly Trivia winner @ http://ow.ly/2HFcv! Look for another chance to win tomorrow!
Dolly_Parton,"9 to 5 is workin its way to St. Louis and tickets are on sale. Tickets available by phone, 314-534-1111 or by visiting http://bit.ly/czCGcS"
Dolly_Parton,#travelindolly is in Australia this week! Answer this week's trivia @ http://ow.ly/2Fohi and be entered to win some great Dolly prizes!
Dolly_Parton,Hey Tampa! Are you workin 9 to 5? Tickets on-sale now at the Straz Center by calling 813.229.STAR or visiting http://bit.ly/strazctr
Dolly_Parton,See if you won this week's #travelindolly trivia & get the answer here: http://ow.ly/2EUav. Look for another TD appearance tomorrow!
Dolly_Parton,Dolly will be making an appearance on The @Nate_Berkus Show today! Be sure and check your local channel listings for showtimes
Dolly_Parton,"Save ""Live From London"" to your @Netflix queue! Read more at http://ow.ly/2E1rb or go straight to Netflix and and check it out!"
Dolly_Parton,"""A peacock who sits on its tail feathers is just another turkey."" -Dolly"
Dolly_Parton,#travelindolly has landed again. See where she is and enter to win a personalized autographed CD @ http://ow.ly/2BTAP.
Dolly_Parton,See if you won this week's #travelindolly trivia @ http://ow.ly/2Bhb7. There will be another chance to win a great Dolly prize tomorrow!
Dolly_Parton,"Dolly To Play This Year's ""We're All For The Hall"" Benefit in Nashville! Read the full story at http://ow.ly/2AIH8"
Dolly_Parton,"Don't have ""Live From London"" yet? Grab the MP3 album now for $5 at Amazon.com! http://ow.ly/2zgNT"
Dolly_Parton,New Dolly merch available! Previously only available at her downtown Nashville store! http://ow.ly/2yGb5
Dolly_Parton,#travelindolly toured our nation's capital! Check out the photo & enter to win a personalized autographed Dolly poster @ http://ow.ly/2y7tc.
Dolly_Parton,I hope people realize that there is a brain underneath the hair and a heart underneath the boobs.
Dolly_Parton,Find out if you won #travelindolly trivia this week @ http://ow.ly/2wW12. Look for another TD Trivia question & great prize later this week.
Dolly_Parton,"Sometimes I just want to copy someone elses status, word for word, and see if they notice."
Dolly_Parton,Be entered to win a personalized autographed poster of Dolly if you can answer this week's #travelindolly trivia @ http://ow.ly/2vhqn.
Dolly_Parton,"Find out who you are, and do it on purpose"
Dolly_Parton,Find out if you're this week's #travelindolly trivia winner and get the answer here: http://ow.ly/2uxTR. :)
Dolly_Parton,Dolly has a new video diary out! See what she has to say about @9to5themusical at http://ow.ly/2u74x
Dolly_Parton,RT @MusicRow: @EDirections Just Added @Dolly_Parton to the @musicrow country twitter chart. Wow! She's already No. 2
Dolly_Parton,"Dolly is returning to the silver screen alongside @IAMQUEENLATIFAH in ""Joyful Noise."" Read a statement from Dolly at http://ow.ly/2tpUp"
Dolly_Parton,#travelindolly is visiting a beautiful castle in England. Find out where she went and get this week's trivia question @ http://ow.ly/2rnry.
Dolly_Parton,"The secret word is ""Dolly."" See what it's for at http://ow.ly/2qcrp"
Dolly_Parton,"National Tour of 9 to 5: The Musical opens in Charlotte, NC - Tuesday, October 5th!  Tickets On Sale this TODAY! http://bit.ly/charncon"
Dolly_Parton,"""Some of my dreams are so big they would scare you!"" :)"
Dolly_Parton,Congratulations to this week's #travelindolly trivia winner! Is it you?: http://ow.ly/2oVDH. Look for TD to appear soon in a city near you!
Dolly_Parton,"9 to 5: The Musical Premiering in Nashville, TN @tpac!  Tickets onsale 8/13 at 10AM! http://bit.ly/9to5tpac"
Dolly_Parton,Motorcycle signed by Dolly and others for charity STOLEN! Read more at http://ow.ly/2obBH and hope they can get it back!
Dolly_Parton,Big Dolly news coming tomorrow! What could it be? You'll just have to wait and see ;-) only at dollypartonmusic.net
Dolly_Parton,New Dolly fan art posted! Did yours make it up yet? http://ow.ly/2nHfH
Dolly_Parton,"""Don't get so busy making a living that you forget to make a life."""
Dolly_Parton,#travelindolly is in NEW YORK CITY!!! See the sights and get this week's trivia question @ http://ow.ly/2m4bC.
Dolly_Parton,Happy Thursday! We have (even) more new Dolly merch today! 2 shirts and a new mug! Check it out at http://ow.ly/2lv1z
Dolly_Parton,Get the answer to last week's #travelindolly trivia and see if you're the big winner @ http://ow.ly/2l8Gu !!
Dolly_Parton,"Dolly takes time to answer your questions in the second episode of ""Ask Dolly"" http://ow.ly/2k0Ja"
Dolly_Parton,"""Smile, it enhances your face value."" :)"
Dolly_Parton,#travelindolly is taking in the mountain scenery today! Find out where she is and get this week's trivia question @ http://ow.ly/2ir3G.
Dolly_Parton,Did you win this week's #travelindolly trivia? Find out here: http://ow.ly/2hOJw.
Dolly_Parton,Ha! Dolly makes @billboarddotcom Top 20 tweets of last week! http://ow.ly/2hdn8
Dolly_Parton,"""Love is something sent from HEAVEN to worry the HELL out of you!"" :) - Dolly"
Dolly_Parton,We've made some changes to our online store! A little less cluttered... and check back soon for some great items on sale! http://ow.ly/2fGk5
Dolly_Parton,I think that all creative people are a little bit nuts.
Dolly_Parton,"#travelindolly is in Orange, CT this week! Find out where she went and answer this week's ""cluster"" trivia question @ http://ow.ly/2fkMm."
Dolly_Parton,Find out who won this week's #travelindolly trivia and see if your answer was correct @ http://ow.ly/2ebJW !!
Dolly_Parton,Have fun showing off your country trivia knowledge & help #nashvillefloodrelief. There's even some Dolly questions at http://ow.ly/2e0Rl
Dolly_Parton,"When I'm inspired, I get excited because I can't wait to see what I'll come up with next!"
Dolly_Parton,New (some) never-before-seen photos in the Dolly #iPhone and #Android app. Grab the app for FREE at http://road.ie/dolly-parton
Dolly_Parton,want to submit your Dolly inspired art for her website? Read how to submit in the news section at http://ow.ly/2c0VK
Dolly_Parton,New Dolly fan art! Did yours make it into the gallery yet? http://ow.ly/2bqtq
Dolly_Parton,#travelindolly in sunny Las Vegas this week. See where she went and get this week's quiz question @ http://ow.ly/2boF8.
Dolly_Parton,I hope people realize that there is a brain underneath the hair and a heart underneath the boobs.
Dolly_Parton,Find out who won this weeks #travelindolly quiz prize and check to see if your answer was correct @ http://ow.ly/2aoK6! Look for TD#3...
Dolly_Parton,European Tour 2007 - Part 2 video is now available for everyone to check out at http://ow.ly/2ainV
Dolly_Parton,"It's a good thing I was born a girl, otherwise I'd be a drag queen"
Dolly_Parton,"for those that are curious, we are working on an @GelaSkins iPhone skin. What types do fans have?"
Dolly_Parton,"In keeping up with giving you more merch choices, Dolly introduces 2 new shirts and ballcap today. http://ow.ly/28I4Z"
Dolly_Parton,"#travelindolly is in Anaheim, CA this week visiting some ""angels"". Get more details and enter this weeks contest here: http://ow.ly/28kat"
Dolly_Parton,"After momma gave birth to twelve of us kids, we put her up on a pedestal. It was mostly to keep Daddy away from her."
Dolly_Parton,"Dolly has a new Video Diary! Check it out on the site, slice or youtube link at http://ow.ly/26nqv"
Dolly_Parton,"Dolly has a new Video Diary! Check it out on the site, slice or youtube link at http://ow.ly/26np0"
Dolly_Parton,Don't forget to catch the 25 Years of Dollywood Special on @hallmarkchannel this Saturday!
Dolly_Parton,#travelindolly in Florida this week! Find out where on @dolly_parton official website here: http://ow.ly/25YGL.  Send in the answer to...
Dolly_Parton,"Miss Dolly on ""Good Day New York""? Catch it in our news section at http://ow.ly/25WJq"
Dolly_Parton,@aullberg please follow the account so I can send you a direct message
Dolly_Parton,Miss Dolly on @late_show last night? Check it out at http://ow.ly/25ulN
Dolly_Parton,don't forget to catch Dolly on @late_show tonight! You can also see her tomorrow on @regis_and_kelly and more! http://ow.ly/24KGe
Dolly_Parton,New Dolly USA bundles! Just in time for the 4th of July! Get yours today at http://ow.ly/24mxR
Dolly_Parton,"Happy Birthday @KelliePickler, petite blondes unite! Love you Pickler - Dolly P."
Dolly_Parton,"you can catch Dolly on many television appearances tomorrow! @GMA, @accesshollywood, @late_show and more. Check it out at http://ow.ly/24fgL"
Dolly_Parton,"Due to overwhelming popularity, we have made Dolly's #iPhone #Android App free! You can grab the app at http://ow.ly/23if1"
Dolly_Parton,Win some great prizes with #travelindolly this summer! Get contest details here: http://ow.ly/22rac
Dolly_Parton,My weaknesses have always been food and men - in that order...
Dolly_Parton,"LIMITED QUANTITY! 2008 All Access passes and stickys! Very collectible, only 11 All Access passes available. http://ow.ly/20nPi"
Dolly_Parton,@dollyslibrary has just given away it's 25 millionth book! Congrats to everyone involved! http://ow.ly/1Zha8  #win
Dolly_Parton,Congrats to our winners from CMA Music Fest! See what they won at http://ow.ly/1YZ84
Dolly_Parton,"Are you coming to CMA Music Fest this year? Be sure and check out Dolly's booth, number 701, inside the Convention Center for cool giveaways"
Dolly_Parton,"RT @invoker: Just got news that we had our 100,000,000th tweet on HootSuite!!! Surprisingly, it came from @Dolly_Parton. Yah team."
Dolly_Parton,Watch Dolly's entire press conference on her donation efforts for the Nashville flood anytime on her website or youtube http://ow.ly/1UjwN
Dolly_Parton,A @Facebook page petitions for Dolly to be on the cover of @vogueparislive. worked for betty white & SNL! check it out at http://ow.ly/1U6DM
Dolly_Parton,"Dolly announces flood relief total of $250,000! Check out the full release at http://ow.ly/1T5dx"
Dolly_Parton,LIVE BROADCAST TODAY @ 12 Noon / EDT on TheSmokies.TV - thesmokies live on http://ow.ly/1T5EX
Dolly_Parton,A peacock who rests on its feathers is just another turkey.
Dolly_Parton,Dolly has a special video diary reflecting on Memorial Day.  See what she has to say at http://ow.ly/1Rbnj
Dolly_Parton,I can relate to people who are struggling and trying to find their true identity
Dolly_Parton,we've heard some folks want Dolly @gelaskins for their iPhones.  Should we add that to the product list?
Dolly_Parton,A special thanks to all who donated or visited Dolly's attractions over the weekend to help Nashville!
Dolly_Parton,"Winner announced for ""Watch Dolly on Oprah"" Big Wig Mission: http://ow.ly/1OmYG Congratulations!!"
Dolly_Parton,Two new tees! Big Butterfly and Dolly Racing! Check them out at http://ow.ly/1Obqj
Dolly_Parton,Don't forget to catch Dolly on @Oprah today!
Dolly_Parton,Big Wigs! Find out how you can win a signed Dolly vinyl! Check the latest news on the homepage http://ow.ly/1N9oz
Dolly_Parton,Catch Dolly on @Oprah this Friday!!! Check your local listings for channel and showtimes!
Dolly_Parton,@dolly_parton to receive the Applause Award from @tpac in August
Dolly_Parton,Dolly is helping Nashville flood victims as only Dolly can! See how you can help her at http://ow.ly/1M76l
Dolly_Parton,Catch Dolly on the @WendyShow today! Check local listings for showtimes.
Dolly_Parton,Tote Bags are in and featured! Gear up for summer now http://ow.ly/1La3H
Dolly_Parton,New Dolly Fan Art posted at http://ow.ly/1KHtn check it out! Submit your fan art at info@dollypartonmusic.net
Dolly_Parton,Blast from the (recent) past! See the commercial for Dolly's 2007 Tour on our site at http://ow.ly/1Kb79
Dolly_Parton,"We cannot direct the wind, but we can adjust the sails"
Dolly_Parton,It's Thursday! New merch for sale online! Save with the bundle package at http://ow.ly/1HMoD
Dolly_Parton,Dolly to appear on Oprah and more! Check out the news on http://ow.ly/1Hnyr to also see how you may be able to be in the audience!
Dolly_Parton,Summer Adventures of Travelin' Dolly (#TravelinDolly): Are you ready for an adventure?? http://ow.ly/1H0zJ
Dolly_Parton,Thoughts and prayers go out to all affected by the flooding in Nashville and the surrounding areas
Dolly_Parton,"I was the first woman to burn my bra, it took the fire department four days to put it out."
Dolly_Parton,We got new accessories up in Dolly's store. Previously only available in the Nashville location. Check it out at http://ow.ly/1ENs5
Dolly_Parton,What is your favorite Dolly duet?
Dolly_Parton,New Behind the Scenes video of Dolly's 2007 European Tour! See her rise from below the stage and sing a classic song! http://ow.ly/1DQlK
Dolly_Parton,What is your favorite @dolly_parton quote/Dollyism?
Dolly_Parton,"To me, dreaming is just a part of being alive, inspired and curious about the world."
Dolly_Parton,New shirt and even two front license plates previously only available @ nashville store now online at http://ow.ly/1BMPh
Dolly_Parton,Live From London Available Online and in HD! See where in the news section at http://ow.ly/1Bo9b
Dolly_Parton,"Stand up, grab a hold, give everything you got. When the road is dark and cold, walk on fearing not."
Dolly_Parton,You'll never do a whole lot unless you're brave enough to try
Dolly_Parton,Winter Blowout Packages available! One fleece/shawl package and another for juinors! http://su.pr/1g7yGr
Dolly_Parton,"New items in the store, including prints in accessories and the infamous dumb blonde tee! check it all out at http://su.pr/1g7yGr"
Dolly_Parton,Dolly loves spring and has a new video diary to show it!  Check it out at http://su.pr/1WmPhA
Dolly_Parton,Dolly's store will have a booth at the Southern Women's Show! Are you going to be there? More info at http://su.pr/1WmPhA
Dolly_Parton,"I got the music in my soul and the rhythm in my feet. When I hear the music, you wont catch me standing still. -Dolly"
Dolly_Parton,"If you talk bad about country music, it's like saying bad things about my momma. Them's fightin' words."
Dolly_Parton,Check out Dolly's recent interview with Access Hollywood under news here: http://su.pr/1vzFHw
