ElUniversal,This gogo inflight connection feels more like dial up from the 90s. http://t.co/907b1qej
ElUniversal,"Here is @bubbawatson telling me ""#mruniverse was better than winning Masters"" $5 http://t.co/fykVzWuY http://t.co/VlMolgFy"
ElUniversal,About to start press for #MrUniverse which is avail NOW only $5 at http://t.co/UHFmAmYx first up @morning_joe
ElUniversal,Thanks @ReggieWatts for the great music on #MrUniverse only at http://t.co/UHFmAmYx. $5 Available NOW Worldwide. No DRM.
ElUniversal,Here's a special late night infomercial for us late night folks #MrUniverse $5 avail NOW at http://t.co/t8KgI6nN http://t.co/DfnIaRU8
ElUniversal,Thanks to everyone who has bought #MrUniverse at http://t.co/UHFmAmYx for $5. I really appreciate the support and all the tweets!
ElUniversal,Here we go. #MrUniverse is available NOW for $5 at http://t.co/fykVzWuY  $1 from every DL will go to @ReMIND RT PLS
ElUniversal,"RT @SpitTakeComedy: New @JimGaffigan available tomorrow, but check out @johntwenzel 's advance review of the self-released special NOW a ..."
ElUniversal,"@bubbawatson I hope you plug #MrUniverse tonight.  Us white trash have to look out for each other.  Congrats on winning, really."
ElUniversal,Congrats to @bubbawatson for winning Masters & bumping me off of Letterman 2night to announce the onsale of #MrUniverse http://t.co/t8KgI6nN
ElUniversal,Easter came at a perfect time.  I had just finished eating all my kids Valentine's Day candy.
ElUniversal,"Wow, look at all these people waiting to download #MrUniverse. They should just go  to http://t.co/56Wn0Wme Wednesday. http://t.co/zQHeDDcm"
ElUniversal,The good news is I just ate a jellybean I found on the ground of our apartment.  The bad news is it was a tiny ball of Play Doh.
ElUniversal,"You know how on Halloween kids have to dress up, walk around and ask for candy, well at Easter lets just give them a  http://t.co/wVZxy2lP"
ElUniversal,A man from the North Pole that brings presents seems so much more believable than a bunny that hides eggs.
ElUniversal,"You know how the idea of losing a hard-boiled egg in your home is horrifying?  Well, what if we hid a bunch & had toddlers try to find them?"
ElUniversal,"Nothing says Happy Easter, Happy Passover or Happy Sunday in April like getting a loved one tkts to one of my shows. http://t.co/2E19ymk9"
ElUniversal,How about a holiday that doesnt involve 8 pounds of candy coming into my home?
ElUniversal,"Thanks Louie.  Hope you are well. ""RT @LouieAnderson very funny Whale stuff, can't wait to see special!!!"""
ElUniversal,"Just made egg salad.  Well, initially I was dying eggs with my kids."
ElUniversal,@shitgirlssay I cant find my phone. Can you call it? @jeanniegaffigan
ElUniversal,"RT @jeanniegaffigan: Check out this vid I did behind the scenes of  #MrUniverse Avail 4/11 only $5 http://t.co/BzQrz8Ot (w/ @toddglass)
 ..."
ElUniversal,Portland is now on sale.  Shows in over 30 cities now on sale. http://t.co/RyXnyiUD
ElUniversal,My 7 year old already has better handwriting than me.
ElUniversal,"Portland, my show at the Keller goes on sale tomorrow at 10am.  All other shows on sale.   http://t.co/qL4vnP3D"
ElUniversal,"@robertdall ""Mr Universe"" will be available through a new website but same address http://t.co/fykVzWuY"
ElUniversal,"I dont think I will ever say, Well, I like this photo of myself."
ElUniversal,"If there is one every ten feet, is it really a ""grand"" opening? http://t.co/HeDRbgcy"
ElUniversal,"Sat 4/7 10pm Gramercy Thtr NYC ""You Made It Weird Live"" @peteholmez @michaelianblack @jessirklein @mccarthyredhead & m http://t.co/dhAPRbhT"
ElUniversal,The gentrification of Harlem is complete.  Just told Ill be performing at the @ApolloTheater in NYCs Harlem. Honored http://t.co/AvGFdm7n
ElUniversal,RT @moshekasher: I dont know if you know this about @JimGaffigan but he has powerful friends in very strange places http://t.co/3PnOxPvg
ElUniversal,The quietest room in my apartment is the hallway to my apartment. #4kids
ElUniversal,Tonight Ill be watching @joshmalina on #scandal then @andylevy on redeye and then @jeanniegaffigan disappointment at me eating at 3am.
ElUniversal,Im probably too dirty to be on @SesameStreet anyway.  I wouldnt want them to censor me.
ElUniversal,"Some think of @SesameStreet as great preschool educational television, I just view it as another show Im not popular enough to be on."
ElUniversal,Atlantic City Borgata 2nd show NOW on sale. Denver 10am MTN.  MIlwuakee at noon. http://t.co/Tq15hixD
ElUniversal,Remember when people needed a holiday to get embarrassingly drunk?
ElUniversal,"RT @denisleary: I had no idea @JimGaffigan has such a global reach.  Fuckin hot pockets.  Who knew?
http://t.co/rmsjjxHR"
ElUniversal,"Tomorrow shows on sale in Atlantic City (#2), Milwaukee and Denver!  All other shows on sale now.  I love you. http://t.co/zZVCGnOn"
ElUniversal,"""i have something really important to tell u but I'm not going to get to the point for the next 10 minutes."" - Every 5 year old boy"
ElUniversal,I don't even want this guy's support! http://t.co/048vVYMI
ElUniversal,RT @HuffPostComedy: Watch a sneak preview of @JimGaffigan's upcoming special http://t.co/gWNeW5vg #MrUniverse
ElUniversal,"If you missed it here is ""Whales"" from #MrUniverse which will be available exclusively at http://t.co/t8KgI6nN on Apri http://t.co/5DAgFNyp"
ElUniversal,Seems criticizing hipsters is the hipster thing to do. How ironic.
ElUniversal,"Its spring break for my 6 year old, which means I have to act like I dont sit around the apartment all week."
ElUniversal,A sneak peek at #MrUniverse my new 75 min special avail for $5 only at http://t.co/t8KgI6nN April 11th.   http://t.co/Qh2AgMRA
ElUniversal,"If my spell-check could talk, how it would mock me."
ElUniversal,@Hello_Crazy_Fox: @JimGaffigan I'm pretty sure your children are going to murder you in your sleep. They don't let me sleep.
ElUniversal,If you are nerd or are in the nerdist culture check this out! http://t.co/sHSweYLx
ElUniversal,Id like to welcome back the stomach flu to our home.  I wish I could say I missed it for the past week.
ElUniversal,"Im buying Jim Gaffigans new special for $5 on 4/11 cause I signed up for the reminder & hes hot!""  @shitgirlssay  http://t.co/MT1NrkMZ"
ElUniversal,I don't even know what this is supposed to mean. http://t.co/w5kBpT6j
ElUniversal,Go watch the new @jokoy special on @comedycentral tonight.  Hes Filipino like me!
ElUniversal,OK here's a pic of what I wrote on the forehead of my 9 month old . http://t.co/oRFYRyLd
ElUniversal,Its so cute.  Our 9 month old just fell asleep in his highchair.  So I wrote Jerk in Sharpie on his forehead.
ElUniversal,How about everyone follow me and then Ill go back to watching television.
ElUniversal,I love April Fools! Just kidding.  It's boring. Gotcha! April Fools.  See I told it was boring.
ElUniversal,I wish this was an April Fool's.  Here's my room service bill for one coffee. http://t.co/7o7IcCm8
ElUniversal,"Thx Loyola University Chicago.  San Francisco, Cleveland and Atlantic City are next.  Sorry arteries for this. http://t.co/tn2CGxPg"
ElUniversal,Before our Loyola-Chicago show @JudahWorldChamp in the locker room  http://t.co/mdCUM1Z3
ElUniversal,"Wait, if someone sends you an email, youre supposed to respond.  When did that start?"
ElUniversal,Im starting to think that @TheMarkTwian account is not even Mark Twain.
ElUniversal,I didnt win the Mega Million Lottery thing and all the news is talking about is some health care bill for 50 million uninsured Americans?
ElUniversal,"I cant believe I didnt win the Mega Million thing.  Granted I didnt buy a ticket, but Im still disappointed."
ElUniversal,Thanks http://t.co/PPwGmciy sorry u had to look at my face for two hours. http://t.co/VfgPiAZr
ElUniversal,When is that mega-million jackpot going to get high enough for me to risk a dollar?
ElUniversal,The worst candy has to be those bouillon cube cubes.
ElUniversal,"Great I was fired again!  I was actually fired from being fired!  Well, at least I got my job back."
ElUniversal,"I wasnt talking about the rich Donald Trump. I was talking about this buddy of mine, Donald Trump.  I guess I never c http://t.co/M0VhtVUb"
ElUniversal,I  was just contacted by Donald Trump's lawyers.  But I'll never backing down!  Never!  Free Speech!
ElUniversal,"Great, I just got fired from Twitter."
ElUniversal,I wonder what Donald Trump thinks about that.  Nobody
ElUniversal,I've become amazingly good at using the bathroom while a kid bangs in the door.
ElUniversal,Trying to explain to my 2 & 1/2 yr old why there are no zombies in the graveyard.  She must watch too much walking dead.
ElUniversal,I hope no Canadians are upset aboot my last post.
ElUniversal,I hope not. I've had four kids with her. RT: @jdc4chitown is @jeanniegaffigan your sister?
ElUniversal,"For the last time, I dont think I sound Canadian, eh?"
ElUniversal,These vegetables taste like candy. http://t.co/jPtmLJmE
ElUniversal,"See you in Waukegan this Friday.  SF, Cleve, Foxwoods & AC coming up.  Complete tour list. http://t.co/G8hBNG20"
ElUniversal,"Boy, I guess I look like an idiot falling for that all-u-can-eat donut diet. Again."
ElUniversal,"Well, Im going back to self-loathing.  I mean watching television."
ElUniversal,Sometimes blocking someone on Twitter is a little too much of a Christian thing to do.
ElUniversal,"@jeanniegaffigan Aw, baby's first Cheetos! Goes great with the Mountain Dew formula."
ElUniversal,The guy who lives below me just called and asked if I got my kid a dancing elephant.  How rude.  It was just me jumping rope.
ElUniversal,Youd think babies would be more embarrassed they cant even hold their own bottle. Pathetic.
ElUniversal,I still have the post-National Puppy Day blues.  Yay puppies?
ElUniversal,After being cramped into a bus with my family for 11 days we are finally now cramped back into our 2-bedroom apartment.
ElUniversal,Thx Williamsport CAC.  This should come with Lipitor. http://t.co/JJBAsVsX
ElUniversal,The coolest gift ever.  @conanobrien  @paulnoth by @sockmonkeyfarm http://t.co/epnfQCog
ElUniversal,Thx Ft. Wayne.  Should I be nervous that our bus driver is drinking this? http://t.co/wUKxJheT
ElUniversal,Second course in Ft Wayne. Slightly in honor of @SamTrammell or the character he plays. http://t.co/ErlskeD6
ElUniversal,Were the Chinese soldiers armed? RT: @theapiary Just SPOTTED Mike Daisey at Mamoun's falafel shack on St. Mark's.
ElUniversal,"You're supposed to eat 40 of these, right? http://t.co/gfd10B7Q"
ElUniversal,A little of Ft Wayne tradition  oldest hot dog stand in the country http://t.co/D6W9rHLn
ElUniversal,Back in Indiana.  Ft Wayne tonight! http://t.co/sRB8NqEN
ElUniversal,I like taking my kids to IHOP.  They eat like 5 dollars worth of food and do like 40 dollars worth of damage to the restaurant.
ElUniversal,"Was just notified National Puppy Day does not involve eating a puppy.  Wow, I was way off. Now I feel like @kirkfox"
ElUniversal,"@OttoAndGeorge i dream that one day it will INTERnational Puppy Day.  Hey @rickygervais ur foreign, can u help?  Yay puppies!"
ElUniversal,Thanks @robdelaney @alecbaldwin @andylevy &amp; @JoshMalina for making this the best National Puppy Day ever!  U guys rock! Yay puppies!
ElUniversal,Thx for the gift.  I'm only going to eat this whole  bag to support KU. http://t.co/UXOSwf9A
ElUniversal,Thx Heidi.  This is also the packaging for bacon sunscreen and bacon toothpaste. http://t.co/FeCPSVYN
ElUniversal,"Hey Peoria &amp; FT. Wayne,  The food bar has been set pretty high.  Suggestions?"
ElUniversal,Oklahoma Joe's = best meals I've ever eaten at one time. http://t.co/2AQN7Mfv
ElUniversal,This is what @jeanniegaffigan dreams about. http://t.co/O6k4QfCE
ElUniversal,Bringing the family to eat at gas station. http://t.co/aI41tpRw
ElUniversal,Either a lot of Northern Missouri looks like this or we keep driving by this same house. http://t.co/c9MuIsdw
ElUniversal,Thx Sullivan's amazing steaks .  KC pressure is on.  http://t.co/oqT3IOik
ElUniversal,Thanks Omaha for show and this. KC Thurs night . http://t.co/TQDFDEGA
ElUniversal,"Hey Peoria &amp; FT. Wayne,  Early shows sold out.  Tickets available for late shows.  Complete tour list here. http://t.co/0f2rLmxx"
ElUniversal,"So excited to be in Omaha.  Ok, Im excited to eat a steak.  I think Nebraska is the greatest steak in the union."
ElUniversal,Omaha tonight!  Here is the proposed redesign to Mr. Rushmore. http://t.co/hQIjd2FS
ElUniversal,If so-n-so can lose tons of weight and feel really good about themselves and then gain it all back so can I! Maybe.
ElUniversal,Really the best soap opera is the @nfl .
ElUniversal,Why do my kids think me answering an important phone call is code for start screaming?
ElUniversal,Here's me and @rickygervais at Mt. Rushmore. http://t.co/bTV1J8zC
ElUniversal,I had no idea Thomas Jefferson was this tall. http://t.co/qMBhMc5L
ElUniversal,Here's something I did over breakfast.  http://t.co/xcK9TweD
ElUniversal,Me and @AndyKindler  http://t.co/c3rHFhrY
ElUniversal,"Go buy Aziz's! RT @ditzkoff I talk to @louisck @azizansari, @JimGaffigan &amp; @pattonoswalt on how online specials are al http://t.co/rrtnjRb4"
ElUniversal,"Ciudad de Rapido here we come.  Day 5 on the tour bus.  Amazingly I still have 4 kids. Wait, where is"
ElUniversal,Thx Fargo.  Here's a picture of me on a t-shirt without a shirt on. Ironic. Rapid City Tues. http://t.co/gQwgKpi8
ElUniversal,"It's called being a fugitive ""RT: @MrJoshCharles I sometimes wonder if Jim Gaffigan will be on tour forever."""
ElUniversal,Thx ladies.  Here's proof people want me dead. http://t.co/4O42OPu5
ElUniversal,This is just nuts! http://t.co/EHy2KYn4
ElUniversal,Heading to Fargo.  I hope Im not the only blond Scandinavian-looking person there.
ElUniversal,Thx Des Moines.  Had so much fun.  Gave @tomshillue this bonus after the show. Fargo Monday. http://t.co/FAbwOBB4
ElUniversal,What a lovely delicious gift.  Thx @healthcoachtess &amp; @annashley21  http://t.co/824MEILH
ElUniversal,Me &amp; @robdelaney at the Iowa State Capital.  http://t.co/VU0m2eVe
ElUniversal,Me &amp; @michaelianblack at  @zombieburger http://t.co/l2ynYo9l
ElUniversal,Peanut butter on a burger? I knew I would love u Des Moines. http://t.co/8IrvJQZO
ElUniversal,You call it maze.  We call it the only vegetable our kids will eat.
ElUniversal,Thx Joliet.  Illinois I'll see u next Friday in Peoria. http://t.co/AqTcAwQ1
ElUniversal,What are they doing? I didnt even drink.  St. Patrick looking down from heaven  #rerun
ElUniversal,Proof I'm Midwestern Irish-American. http://t.co/ceE9f9na
ElUniversal,"Thx Grand Rapids,  Can't wait to get my Rudy postcard in Joliet tonight. DM Sunday  http://t.co/J42QXGEQ"
ElUniversal,"Yeah, but has that iPad 3 ever taken four young kids skiing?"
ElUniversal,These early morning tweets are made possible by the generous noise of my 6-year-old son.
ElUniversal,Happy Alcoholic Awareness Day!
ElUniversal,Here's me with my fans. @laughfest http://t.co/F0dIsHiK
ElUniversal,Brought kids to Gerald Ford Museum and here.  Exposing them to GR culture. http://t.co/qEwmeUnK
ElUniversal,I'm much less hungry when I'm asleep.
ElUniversal,San Francisco #3 and Detroit on sale NOW!  Complete tour dates http://t.co/QFzsmVjJ
ElUniversal,"A hunger strike can be as short as a minute, right?"
ElUniversal,Working on the artwork for Mr. Universe $5 avail only at http://t.co/t8KgI6nN 4/11.  Ur Thoughts? http://t.co/ZnJN0Siv
ElUniversal,"Thx Erie!  So fun. GR, Joliet, DM &amp; Fargo next. http://t.co/v4WnU30J"
ElUniversal,Here's the tour bus!   http://t.co/2tohfg9C
ElUniversal,Here's where I'm living for the next 11 days. Erie tonight!  http://t.co/5nnQaZ45
ElUniversal,I havent gotten my nails done in forever.  Im not exaggerating. Ive literally never gotten my nails done.
ElUniversal,"Dear Grand Rapids, Due to my own stupidity I will not be at the @WTFpod on Saturday.  I will still see you Friday night at my show."
ElUniversal,"Given that I haven't won a state or even received a single vote, I'm debating suspending my race for President of the United States."
ElUniversal,Backstage video:  Getting settled into the green room with @ToddGlass  http://t.co/JLsD4fKf
ElUniversal,"Dear Babies,
If you want your diaper changed, stop moving!"
ElUniversal,"I just walked an entire city block that did not have a Subway restaurant. Wait, theres one."
ElUniversal,I dont want to brag but Ive been told I look like Johnny Depp in Rango.
ElUniversal,April 11 my new comedy special will b avail 4 download exclusively @ http://t.co/fykVzWuY. $5. If u want a reminder  http://t.co/dbn6zXmQ
ElUniversal,Is marshmallow a vegetable or a fruit?
ElUniversal,"Really whenever  I get up is ""too early."""
ElUniversal,"Underrated genius  RT @DougStanhope New release out on itunes, amazon etc http://t.co/5vMXWW2H"
ElUniversal,"""That went over like a fart in church."" - Guy who just farted in church"
ElUniversal,@michaelbunin I would but I just ate.
ElUniversal,It's like chewing tobacco with a really gross name. http://t.co/8h9Oqmnm
ElUniversal,"Sadly, I don't think everyone ever wang-chunged on any night."
ElUniversal,"""Por un bagel, yo no soy."" Jose Marti if he saw this bagel http://t.co/9JcwiHNQ"
ElUniversal,Is there a button to make me like myself? http://t.co/K2IORVFG
ElUniversal,"Part 3 Before the taping of my new special, Mr Universe, with @ToddGlass and @Jeanniegaffigan http://t.co/BMF0fBeR"
ElUniversal,Thanks for having me RT @joerogan Powerful @JimGaffigan hilarious as always on the podcast today! It should be up on iTunes tonight.
ElUniversal,"First we'll tell them how much we're charging then we'll tell them ""keep your cool"". http://t.co/qdR6TC3F"
ElUniversal,"Well, Im heading to the gym.  I mean Im going to watch TV standing up while I slowly move my legs."
ElUniversal,@tompapa I hope have a valid license.  (Yes I had to google how to spell license.)
ElUniversal,"Bus Tour starts Thursday in Erie, PA. The brilliant @tomshillue will open all shows. http://t.co/z9ReFLV4"
ElUniversal,Part 2: Before taping of Mr. Universe w/ @Toddglass & @jeanniegaffigan  http://t.co/h5lIXYbx
ElUniversal,Even when Im out of town there are screaming teething babies in my dreams.
ElUniversal,Daylight Savings makes us lose an hour.  Its just like checking Twitter.
ElUniversal,Here's another reason to love Denmark. This stuff is amazing. http://t.co/pmpHQe2j
ElUniversal,"So weird, this is the third city Ive been in that had a restaurant named The Olive Garden.  What are the odds?"
ElUniversal,I thought @toddbarry  was opening  http://t.co/GH9K2eFr
ElUniversal,I know its 3 meals a day but how many are you supposed to have at night?
ElUniversal,"Wait, how many meals are you allowed to eat after midnight?"
ElUniversal,"Its 11pm and all my kids(7,5,2 & 8mos) are still awake. That means Im good at parenting, right?"
ElUniversal,"It looks like its always ""Casual Friday"" for Mahmoud Ahmadinejad.
 http://t.co/JsTGl8Ei"
ElUniversal,"The night of the taping of ""Mr. Universe"".  A visit from @ToddGlass  http://t.co/agTXvf3A"
ElUniversal,"Hey NH, my Hampton Beach Casino show is on sale now.  Complete ""America"" tour list.. http://t.co/tj9m4naU"
ElUniversal,Unless you are French or absolutely insane please dont do the double kiss greeting. Its awkward.
ElUniversal,"Thanks Peyton Manning. You are total class.  You made Indiana cool.  Well, football from Indiana cool."
ElUniversal,Why can't everywhere be like this? http://t.co/F4Vj69Z6
ElUniversal,This morning I felt like my iPhoto opening.
ElUniversal,"Nxt wk on bus w/ whole family: Erie, GR, Joliet, DM, Fargo, Rap City, Omaha, KC, Peoria, FT,Wayne & Wlmsprt. = Chaos  http://t.co/z7XD93gl"
ElUniversal,"Given the success of The Help, Im pitching this movie about domestic workers in China.  Its called Maid in China. #Hereallweek"
ElUniversal,I cast a much bigger shadow. RT @jeanniegaffigan I did not know @JimGaffigan did a Calvin Klein ad!   http://t.co/x2LUXTVP
ElUniversal,Dont repeat this but Im starting think Michelle Bachman might not win the Republican nomination.
ElUniversal,"There is something so adorable and depressing about my 2-year old telling me, You eat like Shaggy from Scooby-Doo."
ElUniversal,"Creative and scary! RT @WBNQ Dear @jimgaffigan, watch what Griffin created to win tix to your Peoria show. Love @WBNQ. http://t.co/SnJ37Aa5"
ElUniversal,"My 6-year old:  What does this say?
Me:  Learn how to read."
ElUniversal,"Editing my new comedy special, ""Mr. Universe"".  Forced to look at myself for 8 hours a day.  This harder than therapy. http://t.co/N2diq8CZ"
ElUniversal,What is the difference between Zombie Chris Hardwick and regular Chris Hardwick? @nerdist  http://t.co/Tx0WthGR
ElUniversal,"Hey NYC, go see the brilliant @ToddBarry at @Carolinesonbroadway on March 23rd.  I'd go but Ill be on this bus tour. http://t.co/ojrt3XxY"
ElUniversal,Exposing my 7-year old to our Dominican roots. http://t.co/e1xKw0Gq
ElUniversal,"Now I can wear slippers, clean and not have sex. http://t.co/AqLKsoAH"
ElUniversal,Thx to everyone who buys tkts today. As a reward here's a piece of my 2 & 1/2 yr olds art work. http://t.co/DEFd38KM
ElUniversal,Our baby now can clap which I believe qualifies him to be a member of an infomercial audience.
ElUniversal,"New Shows On Sale Friday & Mr. Universe $5 April 11th

My Dearest Internet User,

First, thanks for reading this.  And http://t.co/3slpDkUN"
ElUniversal,Finally the cupcake technology has created a frosting shot. http://t.co/OMU4sqRT
ElUniversal,Quick how do you say If you go to sleep Ill give you a $100 in babytalk?
ElUniversal,"Todd is brilliant! ""RT: @ToddGlass Doin shows @VancouverComedy Fri/Sat 7pm Very intimate venue get tkts now! If u love me, please RT this!"""
ElUniversal,"You know how cute it is when a baby is asleep, whats that like?"
ElUniversal,If only my goals were to be lazy and out of shape.
ElUniversal,"Hey Canada, Shows added and ON SALE NOW for Hamilton and London.  20 other US shows added and on sale Friday. http://t.co/kbrZi9Qm"
ElUniversal,"When I die, bury me with an everything bagel.  Lots of cream cheese please.  Thanks."
ElUniversal,"""I could make you edible."" - Mayonnaise to Cabbage http://t.co/JspVePHt"
ElUniversal,I have tons of new shows go on sale this Friday. Check it out. http://t.co/PmvhAclT
ElUniversal,My 2 year old doesnt really grasp the hide or the seek of hide and seek.
ElUniversal,"I bet they weren't even Kim Jong-Ill's ashes RT @iamcolinquinn When Sasha dropped those ashes on Ryan Seacrest I thought ""Oh no,here we go!"""
ElUniversal,Im watching Sesame Street with my 2 year old and pretending like I know the meaning of the word of the day.
ElUniversal,Oscar night is the shortest Fashion Week ever.
ElUniversal,"More waiting. ""RT @JoshMalina Now what?"""
ElUniversal,It turns out our baby doesnt speak French either.
ElUniversal,This is what I've been doing for last two hours. #oscars #amtrak http://t.co/ZqTywVAJ
ElUniversal,That's Mr. Manchild to you @jeanniegaffigan: Raising 4 young children while married to a man-child is really interfering with my tweeting.
ElUniversal,Hey look it's Star Wars Jesus. http://t.co/yEiVIA3d
ElUniversal,Gift from my agent after taping of my special.  Not usual wine or fruit basket.  Perfect. http://t.co/DgAaIoqM
ElUniversal,Thx DC. Here is @jeanniegaffigan introducing me.   http://t.co/uSQqBGJp
ElUniversal,@DougBenson that is Mr. Wally Wanka to you. For u http://t.co/41CifDAv
ElUniversal,Hey DC there is 50 stand by tickets available for each tapings of my special Saturday (7 & 10).  Only available at Warner Box office.
ElUniversal,At least they know who they are marketing to. http://t.co/U0UaBDzw
ElUniversal,Suddenly Dominos got better tasting. http://t.co/SePYR2BD
ElUniversal,Click + Give = Good Karma http://t.co/5Mzc0XV1
ElUniversal,We have a date!  My new 1 hr special Mr. Universe will be available for download April 18th for $5.  http://t.co/0IAdpZSi
ElUniversal,Those late night commercials for ab machines make me glad I dont have abs.
ElUniversal,"Aw, they have my Dad's favorite soup. http://t.co/A3AYNZKi"
ElUniversal,I don't dress like Nicki Minaj!  She dresses like me.
ElUniversal,Per advice of smarter people: If youd like to be alerted of my new hr special being avail for $5 download  http://t.co/30KnHQ5v
ElUniversal,"Something you dont want to say to yourself after holding a baby, God, I hope thats chocolate."
ElUniversal,"""Organic"" means diet, right? http://t.co/KAEsDc4w"
ElUniversal,My problem is I dont like working out in front of people or when Im alone.
ElUniversal,Eating hummus is the closest I will ever come to a fasting.
ElUniversal,Hey DC if youre not going to one of my shows at the Warner Theater this Thurs-Sat go see @AndyKindler at Arlington Drafthouse.
ElUniversal,Last night I had a dream that everyone stopped lying about what they dreamed about.
ElUniversal,A restaurant that doesnt have a hamburger on the menu is like a USA Today without a Sports section.
ElUniversal,Finally a bite size McNugget. Now I don't have to waste energy chewing. http://t.co/TUKOKPlb
ElUniversal,"Thx Boston.  Such fun shows!  Washington, DC next.  Tkts only avail for Thurs show. http://t.co/75Wmf8kd"
ElUniversal,Excited to see the new @rickygervais show #lifestooshort this Sunday on @hbo
ElUniversal,Just a reminder that there is an important email you havent responded to.  Enjoy the anxiety.
ElUniversal,Thanks so much @partoons. This is so cool. http://t.co/uPXIKIYn
ElUniversal,More tickets released for the taping of my special in DC at the Warner Theater next weekend.  All dates & tkts.  http://t.co/tw0VGf6c
ElUniversal,"Women like bald spots, right?"
