FrasesVersos,"RT @nerdist: We have a winner for the @JimGaffigan poster challenge on the @node!!! Also, see all entries: http://afx.cc/j92"
FrasesVersos,Just saw Radio City Christmas Spectacular.  The Rockettes were great but I was jealous because I auditioned to be 1 & didn't make the cut.
FrasesVersos,Great to have @ConanOBrien on television.  TBS 11pm/10c  @teamcoco
FrasesVersos,"Shoot, forgot to do the New York City Marathon.  Again."
FrasesVersos,"Sorry, can't have my holiday toy & gift guide b diapers.com.""You know I got u something good cause I got it from http://plixi.com/p/55224194"
FrasesVersos,God Bless America! @dbgb's http://plixi.com/p/55223305
FrasesVersos,"Duchovny and entire cast were amazing in ""The Break of Noon"" at Lucille Lortel theater."
FrasesVersos,Is the Playbill the diploma or the trophy for attending a Broadway play?
FrasesVersos,"Ooo! Didn't know there'd be a flight attendant! @Support ""Actions on Twitter are experiencing delays. We're working to fix difficulties..."""
FrasesVersos,"When a four year old says ""Ew. I dont like mashed potatoes"" you realize how truly dumb children are."
FrasesVersos,Thanks Colin.  Can't wait to see your show.@cqonbroadway Welcome to #Broadway @JimGaffigan. It's a tough street. http://ow.ly/34HKU
FrasesVersos,And i thought I was excited about the McRib being back.  Check this out http://tinyurl.com/36ox2p9 #disbelief
FrasesVersos,"Today EVERYONE is supposed to vote?  Boy, this ""Dancing with the Stars"" thing is getting out of control."
FrasesVersos,"Best costume from last night @mrhoratiosanz ""Che Guevara T-Shirt"" http://yfrog.com/2fkv1j"
FrasesVersos,White Castle.  It's not encouraging that their initials are W.C.
FrasesVersos,"When is that show ""Boardwalk Empire"" going to discuss how nasty people must have smelled back then?"
FrasesVersos,RT @nerdist: Less than a week left for the @jimgaffigan Poster Design Contest! $500 1st prize + show tix! rules & stuff: http://afx.cc/jxp
FrasesVersos,Just at a parent teacher conference. For some reason my daughter has a problem paying attention & a bunch of other stuff I can't remember.
FrasesVersos,Sorry wasn't ready for those that RTed my tweet telling people NOT to RT the Tweet that some RT of my tweet requesting NOT to be RT. PL RT!
FrasesVersos,I noticed some of RTed my tweet where I told u NOT to RT it. How dare u? Just TRY to RT this 1 and see what happens. (scary music)
FrasesVersos,"Please, Please! Whatever you do, Do Not RT this!"
FrasesVersos,"Halloween is only 4 days away. I'll start practicing the lying now.  Great costume!  No, I get! U made that urself? Very creative!"
FrasesVersos,"Uploaded some vids to my Youtube http://tinyurl.com/ddfxls  For new hour come see me live in Boston, PHX & NYC http://tinyurl.com/6lnykv Thx"
FrasesVersos,"""I'm writing a book all about the life and times of Jesus.  I'm gonna name it ""Mark"".  Because my name is Mark."""
FrasesVersos,"When a friend tells you they love ""Dancing with the Stars"",  don't you resent it when they don't apologize immediately?"
FrasesVersos,Um  I dont understand how my location is posted when i didn't post it and i'm not in that location.  Me scared.
FrasesVersos,@Jeanniegaffigan was just on subway. She said our 1yr old pointed at a homeless man and said Daddy. Hopefully my kid cant see the future.
FrasesVersos,Just found out this wasn't organic mustard.  Had to throw my hot dog away.  Better safe than sorry.
FrasesVersos,RT @TheDailyShow: Support #Autism education by bidding on this Jon Stewart-signed @Rally4Sanity poster. http://bit.ly/ctCgSB Night of #2 ...
FrasesVersos,"Three ways to donate tonight: 1-888-TOO-MANY, ComedyCentral.com, or Text STARS to 90999 (donate $10) #2manystars"
FrasesVersos,"Reminder: Watch me on the autism benefit ""Night of Too Many Stars"" with Jon Stewart  LIVE on Com Central Thursday 10/21 @ 9pmE. #2manystars"
FrasesVersos,"Never heard of Crowd Sourcing. I never viewed it as spec or comp work.  Idea was pitched to me, not by (cont) http://tl.gd/6jb1rc"
FrasesVersos,"Take that Al Quida!   Well, dont take it.  I want a bite. @sterlingtoth http://bzfd.it/bl0Kpm"
FrasesVersos,"Watch me do some of my new material on ""Night of Too Many Stars"" Thursday, Oct 21 @ 9pmE on Comedy Central. #2manystars  RT = Good Karma"
FrasesVersos,Why doesn't @jeanniegaffigan like my new winter coat? http://yfrog.com/0pw0kj
FrasesVersos,How can you bid on empty box and actually fight Autism? http://bit.ly/arykTY  #2manystars Thursday on Comedy Central.
FrasesVersos,How do I explain to my 4 year old son that Im not a stand up chameleon?
FrasesVersos,ABC Kitchen is the best restaurant in a carpet store basement I've ever been to.
FrasesVersos,Date night with @Jeanniegaffigan a play and now dinner.  Where do I take her after?  She looks too hot for Bowery Poetry Club tonight
FrasesVersos,http://yfrog.com/0tai8hj No kidding.  Wine in a sippy cup at a Broadway show.
FrasesVersos,Chris Columbus gets his own holiday? I mean Home Alone 2.was good but a parade for the guy?
FrasesVersos,I bet Canada's 4th of July is not even in the summer.
FrasesVersos,Happy Thanksgiving Canada.  Hey when do you guys celebrate Christmas?
FrasesVersos,Columbus Day.  As if I don't have enough guilt already.
FrasesVersos,"Hey @Jeanniegaffigan Are you ignoring me? By the way, can u ask the taxi driver to turn down the AC in here?"
FrasesVersos,"Look @Jeanniegaffigan, the KitKat bar does not come with instructions. Besides, I enjoy eating it like a pan flute."
FrasesVersos,Thank you Seattle.  And thank you Bacon Vodka for the booze http://yfrog.com/na2g6j
FrasesVersos,I've referenced Mormons in 3 tweets and spelled it wrong 3 times.  I never said I was smart. Sorry
FrasesVersos,Jellyfish: nature's lava lamp http://yfrog.com/eqyjwnj
FrasesVersos,The octopus lays 40000 eggs.  What are they the Morman of the sea? http://yfrog.com/n5eq5dj
FrasesVersos,"Just found out what the ""G"" in G-Spot stands for.  Hint:  Gaffigan"
FrasesVersos,Victoria's Secret now has Halloween costumes.  I hope they have an Iron Man for my son.
FrasesVersos,"Sneak peak of poster 4 my Seattle Shows
Tkts still avail for Friday show http://tinyurl.com/6lnykv http://yfrog.com/n8jpup"
FrasesVersos,http://twitvid.com/HNQ0J - I am great and handsome.
FrasesVersos,Greg Giraldo and I started stand up together. Here's an interview of Greg from the early 90s.  http://tinyurl.com/2bz5tc4  Thx @jessicamoz
FrasesVersos,Help Support the 3 boys Greg left behind.  The Giraldo Children's Fund http://tinyurl.com/277pkg4
FrasesVersos,"Tina fey @joelmchale, Tracy Morgan, steve carell and I can't spell I know.  How I got on this show, I have no idea."
FrasesVersos,"@sarahksilverman @stephenathome Robin Wiiliams,  Chris Rock,  jon stewart,  Paul simon, Ricky Gervais, jon Oliver,"
FrasesVersos,"""Night of too many stars"" show might have been the coolest show @Jeanniegaffigan and I have ever been part of.  Wow"
FrasesVersos,RT @Patrick_Noth: You know you're getting old when you start sexting like your dad.
FrasesVersos,@jackiekashian http://t.co/l3lrBAL Funny! And great animation.
FrasesVersos,If you want to help support Gregs wife Maryann and his boys - http://tinyurl.com/25j2yem    #GregGiraldo PL RT
FrasesVersos,"Dear Addiction,  Fuck you.  Goodbye Greg.  I love you."
FrasesVersos,"Southwest Airlines to buy AirTran for $1.4 billion.  Hey Southwest, I think youre over paying by like 1.4 billion."
FrasesVersos,@Jeanniegaffigan  http://yfrog.com/jncx6mj The mother of  my children?  Going to Vanity at Hard Rock
FrasesVersos,"I get it.  The Biggest Loser is a show about stories of inspiration masked in an enormous insult, right?"
FrasesVersos,When is that guy from the Men's Wearhouse commercials gonna clear his throat?
FrasesVersos,My hotel room has a bidet.  Those Australians with their crazy greetings. Bidet from down undah!
FrasesVersos,"@jeanniegaffigan: Kristen Bell: ""it's so difficult to be gorgeous and funny""...and apparently (cont) http://tl.gd/66buc5"
FrasesVersos,The baseball cap is the official hat of the unshowered.
FrasesVersos,Is it just me or has Angela Lansbury been the same age for like 50 years?
FrasesVersos,Im tired of cable news.  Its like watching 4 year olds play soccer.
FrasesVersos,"""Things haven't been this divisive since the Civil War"" Or as hyperbolic."
FrasesVersos,"Is it really necessary to specify it was Dante's Inferno?  ""Now which Inferno are we talking here?  Dante's or Dave Barry's?"""
FrasesVersos,"Wait,  who wrote ""Dante's Inferno"" again?"
FrasesVersos,http://yfrog.com/0q9notj .. At Bored to Death season 2 party @Jeanniegaffigan               @avigilbert @thezaz @discoannie @Hannibalburess
FrasesVersos,RT @jeanniegaffigan: @jimgaffigan @toddbarry @tompapa @prettylaura 'Bored to Death' seas 2 premiere http://yfrog.com/m9jnizj
FrasesVersos,I have a knish every 10 years and then I remember why I waited 10 years. #GoToYonahShimmelsKnishes
FrasesVersos,The recession is over? Does that mean I get to keep the rest of my hair?
FrasesVersos,Why does my 4-year-old son only want to tell me a secret when I'm wearing a white shirt and he's eating chocolate?
FrasesVersos,"I struggle with how indecisive I am.  Wait, is it ""indecisive"" or ""lazy""?"
FrasesVersos,Watching the NFL makes me really want to be part of the game.  Do you think Id make a good cheerleader?
FrasesVersos,"RT @jeanniegaffigan: I've decided @jimgaffigan thinks the NFL is the best thing to happen to Sunday in the past 2,000 years."
FrasesVersos,Why is the complimentary breakfast at a hotel never complimentary of the hotel?
FrasesVersos,NYC 1:10am.  Why I love this city. http://yfrog.com/jb87460315j
FrasesVersos,My wife is the sexiest creature on this planet.  #braggy
FrasesVersos,Do you think Ring of Fire was written the morning after eating a lot of Jalapeos?
FrasesVersos,"""Gym, tan, laundry"".  Wow.  I'm like the opposite of that."
FrasesVersos,@iambendavis
FrasesVersos,Happy Yom Kippur! #pandering
FrasesVersos,"Dear Master Card,  Those ""priceless"" commercials make me want to cut up my master card.  Please stop."
FrasesVersos,Still regret the gyro I had at Newark airport in February.
FrasesVersos,Is it possible to hold the USA TODAY and not look like your reading a coloring book? http://yfrog.com/f16dkgj
FrasesVersos,Is this the airline where the plane dresses like a woman? http://yfrog.com/5yr0kbj
FrasesVersos,I get it.  A casual traveler is someone who...rides a motorcycle in the airport? http://yfrog.com/nc6q3zj
FrasesVersos,"""In here, it's always Friday."" Yeah, but unfortunately ur spending your Friday in crappy restaurant. http://yfrog.com/n5gocj"
FrasesVersos,"http://twitpic.com/2onrqr - ""Its Kind of a Funny Story"" After Party with @morgan_murphy @galifianakisz and @jimgaffigan"
FrasesVersos,"At screening for ""it's kind of funny story"" w @morgan_Murphy @galifanAkisz @Jeanniegaffigan"
FrasesVersos,"Why do they call it a 'Happy Meal' when it turns children into monsters?  ""Can we go to McDonalds? Can we?  Well, after that can we?"""
FrasesVersos,RT @jeanniegaffigan: Facebook is like a big high school yearbook that never stops being signed. #twitterisbetter
FrasesVersos,"""It's alright! It's ok! There's something to live for!  Jesus told me so!"" Name the movie."
FrasesVersos,RT @jeanniegaffigan: Landed at JFK trying 2 avoid being forced into a 3-way w @jimgaffigan & a fast food item. #nomeansno
FrasesVersos,I wish Oswald would have assassinated JFK Airport instead.  #TooSoon? http://yfrog.com/jczlpj
FrasesVersos,Is there one that comes with a nap? http://yfrog.com/myzcqaj
FrasesVersos,"Just watched 6 seasons of ""Lost"" in two weeks.  That's normal right? By the way what year is it?"
FrasesVersos,http://yfrog.com/7ef6xmj That's not the only thing that comes up after eating one of these.
FrasesVersos,Nothing says Halloween is over a month and half away like orange frosting at the Dunkin Donuts at JFK. http://yfrog.com/netkzgj
FrasesVersos,Is Fashion's Night Out followed by National Walk of Shame's Morning?
FrasesVersos,Fashion's Night Out.  At least it's not a night glorifying superficial materialism.
FrasesVersos,Fashion's Night Out is like a Premiere....of how whorish women will be dressing this Halloween.  #whyRUcomplaining
FrasesVersos,"Fashion's NIght Out is an excuse for women to dress even more whorish than they normal do, right? #whyareUcomplaining?"
FrasesVersos,"I wish the Outback Steakhouse commercials would stop acting like the Aussie Outback is some culinary destination.  ""Our cows only eat dirt!"""
FrasesVersos,"Before we start burning, is it ""Koran"" or ""Quran""?  Oh, we should also bail on that whole freedom of religion stuff while were at it, right?"
FrasesVersos,"Protesting the building of mosques and a Burn-a-Quran Day? Gee, anything else we can do to prove to Al-Qaeda we ARE infidels?"
FrasesVersos,People that use the word erudite are bit too erudite for me.
FrasesVersos,You know who I think I'm more important than?  Pretentious people.
FrasesVersos,"Next stop WENDOVER, NV.  Good thing it doesnt rhyme with anything dirty. Peppermill Casino 9/11. http://tinyurl.com/6lnykv Vegas Sep 24&25"
FrasesVersos,"Whenever I find out someone has a waterbed I always think, Thats probably not the only thing you have."
FrasesVersos,I got my handwriting analyzed.  Im either a doctor or a serial killer.
FrasesVersos,"Do you think the Corinthians were like, We got ANOTHER letter from Paul?  I didnt even finish the first one yet."
FrasesVersos,"If you are too young to make breakfast, you should not be allowed to get up before 7am."
FrasesVersos,If the children are the future then why do they wake up at such an ungodly hour?
FrasesVersos,Good Morning is kind of like Fun Yard Work.
FrasesVersos,RIP Robert Schimmel.  Really funny.  Really nice.  Really will be missed.
FrasesVersos,"Topical Storm Earl?  Now what am I supposed to do with all these ""Hurricane Earl Blew Me"" t-shirts?"
FrasesVersos,Hurricane Earl has been downgraded to a Tropical Storm.  Ouch! That's gonna be embarrassing for him on Monday around the watercooler.
FrasesVersos,"Hey Hurricane Earl,  James Jones called.  He wants his middle name back."
FrasesVersos,Im a little disappointed by Hurricane Earl.  Not that Ive ever had high expectations from anything named Earl.
FrasesVersos,http://twitpic.com/2l0drm - ON Cape Cod waiting for Hurricane Earl. #bringiton
FrasesVersos,"Labor Day is all about eating so much you look like you are about to give birth, right?"
FrasesVersos,Thank you Apple for inventing the software to fix the software you invented that broke my phone.
FrasesVersos,"Dear Poopie Pants' Responders, I'M not the one holding them hostage. Save your pseudo-moral judgments for every late night talk show."
FrasesVersos,You'd think there'd be a hostage situation at the Mystery Channel building.
FrasesVersos,"""Hostage Situation at the Discovery Channel Building.""  I'm shocked! The Discovery Channel has its' own building?!"
FrasesVersos,"THANKS! RT @twtceleb 
Amazon MP3 Downloads #1: Jim Gaffigan: Jim Gaffigan 1,041% Sales Rank in: 24 (was 274 yesterday) http://amzn.to/aE8KMY"
FrasesVersos,Jet skis are fun but you always look like someone who doesnt have enough friends to fill a boat.
FrasesVersos,"""Doing My Time"", my first Comedy Central album is only $5 on Amazon for a short time http://tinyurl.com/2uw4crb"
FrasesVersos,You know what I think is awkward?  The spelling of awkward.
FrasesVersos,Lou Gehrig didnt have Lou Gehrigs disease.  Whats next?  We find out Hugh Downs doesnt have Downs syndrome?
FrasesVersos,"""Intern"" is a fancy word for if you have rich parents, you can work here for free."
FrasesVersos,Id do more morning radio if they had it in the afternoon.
FrasesVersos,Would you answer a yes or no question that was posed just to prompt you to respond on Twitter?
FrasesVersos,"Ive been informed Im not IN Cape Cod, Im ON Cape Cod.  How about this:  Im IN a house ON Cape Cod freezing my ass OFF. #oncapecold"
FrasesVersos,I'm in Cape Cod but it feels more like I'm in November.
FrasesVersos,"http://tweetphoto.com/40995544 I was gonna get the Kool-Aid flavored, but I'm an adult."
FrasesVersos,Do you think Darth Vader wore black because it made him look thinner?
FrasesVersos,"Goat Cheese:  ""Hey you know that disgusting animal you'd never eat? Check out what we did with some of it's breast milk!"""
FrasesVersos,"Hey TSA employees, just a reminder you are supposed to stop terrorism, not all air travel."
FrasesVersos,"In five years Ill probably be thinking, I cant believe five years ago I cared what Id be thinking in five years."
FrasesVersos,http://tweetphoto.com/40348281 @bigalgoodwin is actually trying  to convince me bartenders wear name tags with fake names.
FrasesVersos,"Just drove by a highway sign ""Big Beaver Rd.  Exit 69"".   Really Detroit?"
FrasesVersos,"Goodbye Dr Laura. I hardly knew you. Well, I didn't know you...at all. Who are you? Why are you in the news?  Why dont you have a last name?"
FrasesVersos,I dont like to think of myself overweight.  I more gutilicious.
FrasesVersos,"The ""I'm a Manatee"" joke is on my 1st CC CD ""Doing My Time"" http://tinyurl.com/2vn8tnz"
FrasesVersos,When you read Self magazine arent you always a little disappointed that theres nothing about you in there?
FrasesVersos,Anyone know where I can get a Jared Christmas ornament? Want to surprise my wife?  #teamjared
FrasesVersos,"I don't feel sorry for Jared.  You know who I feel sorry for? Anyone else in the world named Jared? ""My name is pronounced je-ROD!"""
FrasesVersos,"Do you think Jared, Ronald Mcdonald & The Burger King hang out together? Wouldn't it b great to see a pic of them all in a hot tub together?"
FrasesVersos,Is anyone else suspicious that Jared hasn't aged in 15 years?  Do you think there's more than one Jared? Do you think Jared thinks about me?
FrasesVersos,Secretly don't we all want Jared to gain that weight back?
FrasesVersos,"5 dollar footlong. Hey Subway, can you keep the word foot out of my food?"
FrasesVersos,Is there a reason why they don't put laces in shoes?  What is this Ikea?
FrasesVersos,Watching Care Bears Movie.  I dont think those bears are even singing the songs. I bet it's dubbed.  What a rip off!  Damn you Hollywood!
FrasesVersos,Still watching the Care Bears Movie.  I'm starting to think this is just for kids or something.
FrasesVersos,Watching the Care Bears Movie with my kids.  Surprisingly not very realistic. http://tweetphoto.com/39479592
FrasesVersos,I hereby blame all future procrastination and weight gain on @Netflix Watch Instantly.
FrasesVersos,I may be slow but at least I'm faster than my iphone.
FrasesVersos,"Dear North Korea, Look we get it.  Youre evil and have a small penis. Jeez.  Get a hobby or an economy please.  Its boring."
FrasesVersos,"""North Korea threatens South Korea.""  Gee,  that doesn't sound like the North Korea I know."
FrasesVersos,"FYI if a tkt to 1 of my shows is $270, its a scalper or a time traveler from the impending economic disaster. Use http://tinyurl.com/6lnykv"
FrasesVersos,"How many fights have been avoided b/c of air conditiong?  ""You always...ooh it's nice in here."""
FrasesVersos,Im tired of obligations.  Please RT
FrasesVersos,Sorry.  Even the giant snowman pen does not make paying $13 for an order of  kids chicken strips fun. http://tweetphoto.com/38071656
FrasesVersos,When I dont twitter for a couple days a strange feeling comes over me.  I think its indifference.
FrasesVersos,http://tweetphoto.com/37244779 is it possible to walk by one of these and not hear a Jimmy Buffet song?
FrasesVersos,Pirates are really the bikers of the ocean. http://tweetphoto.com/37243300
FrasesVersos,"The term Family reunion kind of implies you normally dont have to keep in touch with these people, right?"
FrasesVersos,Im on vacation now.  This relaxing is exhausting.
FrasesVersos,"Dear Mormons,  I may be a horrible speller but at least I don't pander.  I like Sprite too."
FrasesVersos,"Dear Atlantic Ocean,  I had so much fun today.  Um...can I have my sunglasses back?"
FrasesVersos,"""Mary Hart to leave 'ET': TV News""  Oh my God!!!  Wait.  Who's Mary Hart?"
FrasesVersos,Alcoholics are the easiest to buy a gift for.
FrasesVersos,I know some people actually support their families by working for Spirit Airlines.  I'd like to apologize to both of them.
FrasesVersos,I like to think of guacamole as the Mexican peanut butter. http://tweetphoto.com/36704204
FrasesVersos,Spirit flight was fine even though I had to share my seatbelt and Pitot asked before take off if anyone had jumper cables.
FrasesVersos,Is it strange that the meal on Spirit airlines is food stamps.
FrasesVersos,They overbooked the flight and are offering a free Spirit flight to anyone who will give up their seat.  I don't support torture.
FrasesVersos,Wish me luck.  The flight attendant is now auctioning off usage of the armrests.  I need to save money in case I have to use the bathroom.
FrasesVersos,Should i be concerned that Spirit Airlines is now having us push start the plane?
FrasesVersos,Spirit airlines is actually charging for carry on bags.  I hope they're wearing a condom.
FrasesVersos,If the DMV started an airline it would be Spirit Airlines.  No it would be better than Spirit Airlines. Sorry DMV.
FrasesVersos,"Hey Spirit Airlines, I'm going to S. Carolina not jail.  You've made your  point.  I'll drive next time."
FrasesVersos,I didn't know Spirit Airlines meant evil spirit.
FrasesVersos,"Why do we make eating a sushi an activity? We are going out for sushi""!  Well, good luck. I hope you catch some. No one really cares."
FrasesVersos,http://favstar.fm/users/JimGaffigan  Greatest hits.
FrasesVersos,RT @FocusFeatures: Get to know the cast Its Kind of a #FunnyStory & Like it on Facebook! @JimGaffigan is featured today http://bit. ...
FrasesVersos,Just a heads up.  Coughing in someone's mouth while you kiss is apparently not a turn on.
FrasesVersos,You know who's really shallow? This pond in my back yard.  It cares nothing about the environment. #thatssilly
FrasesVersos,"You ever accidentally catch someone in their underwear?  That's awkward.  Especially, if youre holding a knife."
FrasesVersos,"I just finished a marathon! Sure, it was a marathon nap but Im still proud of myself."
FrasesVersos,"(cough, cough)  What happened? I...I had the wildest dream.  You were there...and you....and YOU!"
FrasesVersos,#tweetingfromheaven  And the meaning of life is...wait someone is resuscitating me! Nooooo
FrasesVersos,#tweetingfromheaven  Colonel Sanders just put his hand on my knee.  What should I do?
FrasesVersos,#tweetingfromheaven My fake neighbor from suicide joke LOVED the suicide joke.
FrasesVersos,"#tweetingfromheaven  Up here there are SIX seasons of ""The Wire""! #OmarBack"
FrasesVersos,#tweetingfromheaven  C.S. Lewis just told me that the spelling and grammar police on twitter work for Satan.
FrasesVersos,#tweetingfromheaven  Saint Anthony just asked if i had seen his keys.
FrasesVersos,"#tweetingfromheaven  Gandhi just yelled ""Hooot pockets!"" from across the room .  What a dick."
FrasesVersos,#tweetingfromheaven Playing backgammon with Lincoln (he's got the WORST breath).
FrasesVersos,"#tweetingfromheaven It's amazing up here. 68 degrees and breezy, free burgers and no reality shows!"
FrasesVersos,I read so many negative responses about my last joke that I actually killed myself. I hope you're happy now.
FrasesVersos,My neighbor just committed suicide. So weird. I was just talking to him yesterday. I told him no one loved him.
FrasesVersos,"Quick question:  It's ok to give babies Red Bull, right?"
FrasesVersos,Mobile phones are the carbon dating of television shows.
FrasesVersos,Can we make it federal offense to pass gas on an airplane? http://yfrog.com/9geqpj
FrasesVersos,Fajitas are like the Ikea of Mexican food. http://yfrog.com/my7ynj
FrasesVersos,Waiting for my fajitas. I feel like I'm in a Beckett play.
FrasesVersos,Is it insulting that my favorite part of Southern California is the food from the neighboring country?
FrasesVersos,At this point am I the last person in America who doesn't have a tatoo?
FrasesVersos,"Kudos to the parents of the 8 yr old who yelled ""yankees suck"" as I rode by on a tandem bike with my daughter in my NY cap."
FrasesVersos,"Sunscreen may be an expensive goo that makes you look paler, but it is an effective way to get sand to stick to your body,"
FrasesVersos,I wonder if they are gonna go younger with Larry King's replacement.
FrasesVersos,Im so excited to find out who will replace Larry King.  No wait.   Im not interested at all.
FrasesVersos,Obnoxious. http://yfrog.com/5unygj
FrasesVersos,@prohibitionsd with @Jordanrubin http://yfrog.com/5m9mkgj
FrasesVersos,And I thought Richard was a rough name to have. http://yfrog.com/03teohj
FrasesVersos,What a show off! http://yfrog.com/jtcinj
FrasesVersos,I ran into your mom today. http://yfrog.com/jk35yfj
FrasesVersos,Why do I spend most of my day dealing with technical breakdowns on devices that are supposed to make my life easier?
FrasesVersos,"Why does ""family friendly"" always equal horrible food?"
FrasesVersos,Why is the kids menu the same as the bar menu?
FrasesVersos,3rd show added in SEATTLE. 4 shows in NYC.  Don't know about U but i'm going to all of them. http://tinyurl.com/ca2cxa
FrasesVersos,Maybe I'm not that out of shape. http://yfrog.com/0uobwoj
FrasesVersos,Dad? http://yfrog.com/j557kij
FrasesVersos,Great we are now drinking out of old diapers. http://yfrog.com/0an45zj
FrasesVersos,"I have this bag that my wife calls a purse. Its not a purse!  It's  4 my notes, wallet, lipstick & a back up tampon. it's not a purse!"
