gtdguy,RT @Eden_Brower @jeanniegaffigan I taste better than water! #sadsadlettuce #SuckItLettuce
gtdguy,"I suck it!  Lettuce 

#SuckItLettuce!"
gtdguy,"RT @dreadmedia: Oh Snap guys! The Gaffigans are fucking ripping lettuce a new one, tonight! @JimGaffigan @jeanniegaffigan #SuckItLettuce"
gtdguy,RT @jeanniegaffigan: You can't melt cheese on a piece of Lettuce. #SuckItLettuce!
gtdguy,Lettuce on a cheeseburger is like a fat guy in shorts. #SuckItLettuce!
gtdguy,"A soggy, cold french fry tastes a 100 times better than any piece of lettuce ever did. #SuckItLettuce!"
gtdguy,Is there an anti-depressant for taking a city bus?
gtdguy,My dad.  Always with the chicken. http://t.co/ZobN6G1L
gtdguy,I'm starting to think it's probably not that hard out there for a pimp.
gtdguy,Vitamins are expensive but at least there is no proof they work.
gtdguy,Thanks Salt Lake City. Second show added!  Fri & Sat. On Sale now! New hour + classics.   http://t.co/dtKcxwin
gtdguy,I found the perfect gift for Santa.  I hope it inspires you. http://t.co/RUyxGDy7
gtdguy,Just found out Im Santas Secret Santa.  How intimidating.
gtdguy,Wouldn't it be great if we could identify who will be the drunk obnoxious people? http://t.co/6kU9E5Zz
gtdguy,"Only place where women dressed as reindeer pulling an old guy in a sleigh is family fun. Thx @Rockettes Great show.
 http://t.co/SUCOKWys"
gtdguy,Thanks Kansas City.   Second show added! On sale now! New hour + classics. Cant wait to try my first BBQ shake. http://t.co/71nQMV4C
gtdguy,We interrupt this murder mystweetry to promote The America Tour 30 cities. New hour. http://t.co/cvKonxkA
gtdguy,"By the way, anyone want to buy some used womens dresses and handbags?"
gtdguy,Anyone know how to get blood off a Christmas tree?
gtdguy,"If you killed a woman roughly the size of @jeanniegaffigan , where would you hide the body?"
gtdguy,@robdelaney: You guys like music? What about food/snacks? Anyone got Holiday tips?
gtdguy,"""How about a month of obligations, overspending, difficult travel and horrible weather?"" - The pitch for the month of December."
gtdguy,"""December"" From the people that brought you finals week."
gtdguy,@thedailybeast: Playboy to Drop Lohan Spread Early: After photos leak online. Isn't it redundant to call a Playboy shoot a spread?
gtdguy,Second show added in San Francisco! On sale 10amPST.   30-city America tour on sale now. http://t.co/66GkOzU0
gtdguy,I guess Jesus was the first kid that got to celebrate Hanukkah and Christmas.
gtdguy,I bet you Jesus must rake in the presents having his birthday the same day as Christmas.
gtdguy,Trying to sound awake as I call into radio stations to talk about my 30-city America tour. http://t.co/3pzYrQEM
gtdguy,Why doesn't Donald Trump just debate himself? I'd watch that.
gtdguy,You know how people are too busy in December? What if we added the obligation of sending a Holiday card to everyone they know?
gtdguy,"Sometimes when I put on workout clothes and dont work out, I just pretend Im a character from the Sopranos."
gtdguy,Sometimes I think Ill never master fast forwarding through commercials.
gtdguy,It's ugly out there.  By that I mean the people.  When I say people I mean me. http://t.co/mxXQYXXY
gtdguy,Boston show 3 and 4 on sale in one minute.  All 30 cities of America tour available  http://t.co/7bKIcI96
gtdguy,I would be horrible at a hunger strike.
gtdguy,Any truth to the rumor Im starting that the Twitter bird is pregnant?
gtdguy,"If there was a Mr. Twitter, I bet hed look a lot like Mr. Peanut."
gtdguy,Ive been on this Twitter thing forever.  Still havent gotten a check.  Anyone else?
gtdguy,"Hey, any you guys on Twitter?"
gtdguy,Thx Boston.  Due to demand 2 more shows go on sale tomorrow (Dec 7) at noon.  No password.  All 30 cities on sale n... http://t.co/DRCKzIq1
gtdguy,My kids are going to be surprised when they find out Im charging for all these pick-ups and drop-offs.
gtdguy,When our 5-month-old coughs he doesnt cover his mouth.  Rude.
gtdguy,"Oh crap, its December.  When did that happen?"
gtdguy,If the Broncos play the Saints in the Super Bowl I wonder which team Jesus will root for?
gtdguy,Red Bank NJ shows next up.  All shows in 30-city America tour on sale now. http://t.co/VGTfLnYS
gtdguy,Posting photos of what you are eating is the vacation slideshow of today. #IAMGuilty
gtdguy,Kid birthday parties should just be called get your child sick gatherings.
gtdguy,Donald Trump is going to moderate the next GOP debate.  I wonder who the musical guest will be?
gtdguy,Thx Atlanta for coming to my shows at the Cobb. Thx to Outback for cool poster. http://t.co/l0EbQXoy
gtdguy,Thx Jon & Kali.  What are the chances this is filled with poison? http://t.co/oxKF1qUn
gtdguy,"2 shows 2night In ATL, which means 2morrow Ill get comments asking, Why don't u ever come to ATL? http://t.co/34VfxHIy"
gtdguy,I know what Jenny Craig should give that Santa guy for Christmas.
gtdguy,Baby smiles are the most effective anti-depressant.
gtdguy,What is the ingredient in Dominos that makes me so depressed after I eat it?
gtdguy,Heres an interview I did wot the awesome @GeekChicDaily  http://t.co/lZitdNmS
gtdguy,Another show (4th show) added and on sale in DC!  Check all the cities Im going to on America Tour.   http://t.co/EQ81vqwI
gtdguy,I wish it was gain weight for the holidays instead of during the holidays.
gtdguy,New shows now on sale for DC and Boston.  30 cities now on sale.  http://t.co/QoMFZFUf
gtdguy,"I love high heels in a business setting, ""I want to be treated like an equal, that's why I""m wearing a my hooker shoes."""
gtdguy,Check out the very funny @michaelianblack In Durham and Richmond this weekend! http://t.co/ltdZtcJV
gtdguy,Women in high heels look sexy.  Women walking in high heels look drunk. http://t.co/hZeC3WVL
gtdguy,"One advantage of having 4 little kids is there is always one screaming.  Wait, thats not an advantage."
gtdguy,"Thanks Boston.  First show SOLD OUT!  2nd show just added and on sale.  Complete  ""America Tour"" list. http://t.co/2kO2Vn1L"
gtdguy,Friday Show just added in DC! On sale now! Complete tour list.  http://t.co/DEV1AV6o
gtdguy,"Chrlotte, Erie, Bos, DC(SoldOut),Joliet, DesMoins,Fargo,RapCity,Omaha,KC,Peoria, FT.Wyne, Willmsprt, Waukgn, SFonsale! http://t.co/8AVzr8MV"
gtdguy,Thanks everyone! DC Shows SOLD OUT!  Hoping to add a show on Friday soon.   http://t.co/QSdXHLi5
gtdguy,REMINDER: Tickets for my America Tour on sale now.  30 Cities.  No password.  SF on sale at 10am. http://t.co/EHVUO2Yz
gtdguy,Lack of knowledge is my Achilles knee.
gtdguy,At 10am get tickets to my America Tour.  30 Cities. No password. I'm filming a new comedy special in DC on Feb 25th http://t.co/4PIK3sxl
gtdguy,I would read more often to my children if my 7-year-old would stop correcting the words I misread.
gtdguy,"Tkts on sale Thursday 9 or 10am for rest of America Tour dates! Boston, DC, Erie, Omaha, KC, Il, In, SF, Cleve & ... http://t.co/VshIWRpq"
gtdguy,I bet @jeanniegaffigan wouldn't think I sleep too much if she found out I was a newborn.
gtdguy,Wow! Was just notified I'm the back-up quarterback for the Colts this Sunday.  #GoColts
gtdguy,"When are they going to air the commercial where the recipient of a car in a giant ribbon says, A LEXUS! We cant afford this, you idiot.?"
gtdguy,I guess Im different.  That jingle from the Lexus commercial just makes me want to change the channel not give a car with a giant ribbon.
gtdguy,RIP Patrice ONeil.  Undeniably brilliant.
gtdguy,See u in ATLANTA Saturday. First show SOLD OUT. Tkts to 2nd show avail. Where should I take @jeanniegaffigan to eat?   http://t.co/j4Ec3s0O
gtdguy,"Sometimes after I use the bathroom, I feel sorry for the toilet.  #Sensitive"
gtdguy,"When you think about it, Mariah Carey and Drew Carey don't even look like sister and brother."
gtdguy,I think Ive been to the gym fewer times than Herman Cain has sexually harassed women.
gtdguy,Can I get someone to NOT help me at the Apple Store? http://t.co/AtqhHxiC
gtdguy,Dont spend all your money today.  My America tour goes on sale Thursday! New hr + classics. Complete tour list. http://t.co/WqYAqsnx
gtdguy,I hope popcorn appreciates what the microwave did for its career.
gtdguy,Thx to everyone who came shows @TheMirageLV (Atlanta next weekend!)  Heres one of my favorite moments. http://t.co/Uyo2sWx6
gtdguy,Here is me with my kids. http://t.co/baR0wsdA
gtdguy,"Hey, insurance companies instead of having a commercial on TV every 10 minutes can you just cover some of my medical bills?"
gtdguy,"The drips and drabs of a madman (AKA my 5-year-old son before I sold him)
 http://t.co/O5NN3bNr"
gtdguy,My 7-year-old's unfair review of the fabulous pumpkin soup. http://t.co/euRRjX3A
gtdguy,About to have  a traditional Thanksgiving dinner with my kids in a Vegas casino as the pilgrims would have wanted.   http://t.co/eJ6g9gMO
gtdguy,My 5-month-old has not mentioned hes thankful once today.  Rude.
gtdguy,"Mission Impossible:  Getting me to see the new ""Mission Impossible"" movie."
gtdguy,Im thankful Im only mandated to be thankful one day a year.
gtdguy,"Boy, my 5-month old passes gas loudly.  At least thats what I told the people in church."
gtdguy,I dont think Ill ever forgive the media for covering Dancing with the Stars like its news.
gtdguy,"Dear Big Corporations,

Since you own all the politicians, can you get them to do their job?

Thx Jim"
gtdguy,Taking family to Vegas this week.  Any suggestions for kid activities besides gambling or sex trafficking?   http://t.co/XhqPPMYo
gtdguy,I want to thank Gustav Vigeland for doing this for me.  It's spot on but really underplays one part. http://t.co/5iX91T71
gtdguy,"I bet ya 200 years ago, ""Antique Roadshow"" was even more boring."
gtdguy,That guy's voice from The Men's Wearhouse gives me nightmares.
gtdguy,Thanks St Louis for coming to Fabulous Fox Theater.  Youre looking good tonight. http://t.co/3pguQKQW
gtdguy,RT @jeanniegaffigan: Backstage @jimgaffigan show in St. Louis! Hitting the bottle pretty hard! http://t.co/z5T7eJUo
gtdguy,Remember when flight attendants used to at least  act like they liked their jobs?
gtdguy,My 5-year-old son just asked who Justin Beaver is?
gtdguy,I take back all the horrible things I said about hot weather.
gtdguy,"Just added San Francisco, Cleveland and Waukeegan dates to my 2012 America"" Tour.  Tkts on sale soon. http://t.co/UOiK1KwM"
gtdguy,"My next comedy special will be filmed in Washington,DC @ Warner Theater on  Saturday February 25th. Tkts onsale soon. http://t.co/YyAqfYkf"
gtdguy,Im not procrastinating; its just that I havent finished doing nothing yet.
gtdguy,"I want to eat a bunch of blue cheese and bacon, but I also want to appear to be healthy. - Inventor of wedge salad"
gtdguy,Wow.  I can't believe this is the new European currency. http://t.co/ZkzdYiTR
gtdguy,3 Musketers always make me sad.  They mean I'm almost done with my kids Halloween candy.
gtdguy,Our refrigerator is broken.  And I thought no Wifi made me anxious.
gtdguy,"Just told my 5-year-old son, Dont lie, Santa doesnt like that."
gtdguy,I guess the Salt Lake City password is bacon.  Just try America and bacon.  http://t.co/qN8p670J
gtdguy,"TODAY Special presale in Salt Lake, Easton, Hershey and Schenectady!  Password is AMERICA .   New hr + classics  http://t.co/evqTZceh"
gtdguy,My baby announces my presale for Jan dates http://t.co/qQmPB12t http://t.co/Pn6O2brN
gtdguy,"#GarryMarshallMovies. ""Lead Actress Falling Down Then Laughing Day"" @AndyKindler"
gtdguy,"Hey LOUISVILLE just found out my Horseshoe Casino(Elizabeth,In) show is on sale NOW.  All Jan dates pre-sale tomorrow! http://t.co/LUBhZVQr"
gtdguy,Only on Twitter do you return something you really like. - Confucius
gtdguy,"I look like Im working hard, but actually Im doing nothing!  Everyone on Twitter"
gtdguy,"If there was no NFL, would anyone ever see commercials?"
gtdguy,"Youre supposed to over eat when you watch the Packers play, right?"
gtdguy,Is there a time when Nick@nite is not playing The George Lopez show?
gtdguy,Our 4-month old boy is constantly moving now.  It makes it really hard to put lipstick on him.
gtdguy,Just notified the TORONTO pre-sale starts TODAY!   Password is Bacon.  New hour + classics!  Get ur tkts! http://t.co/IqQMz1Ex
gtdguy,"In email they should change Save As New to Ugh, Ill Deal With That Later."
gtdguy,"There should be an award for changing a diaper at 5am.  Especially, if its your own diaper."
gtdguy,RT @HuffPostComedy: We asked @JimGaffigan what he would be like in the military. His response http://t.co/O6gWExgd #NYCF
gtdguy,"When people find out I have 4 little kids, they always treat me like I have cancer.  Four kids! You are so brave.  Ill pray for you."
gtdguy,RT @stevekjames: @JimGaffigan Remember Veterans Day and text WWP to 90999 and reply with yes to donate $10 to the wounded warriors proje ...
gtdguy,I didn't even know I was entering a competition.   Watch me stumble through a joke i haven't done on stage in 7 months. http://t.co/nLQ8oN4U
gtdguy,"Laura Dern in ""Enlightened"" might be the best thing ever."
gtdguy,NEW 2012 TOUR DATES!  Check them out.  Im probably swinging by you.  Join mailing list for special pre-sale. http://t.co/ViR4BRb9
gtdguy,I finally confront my son. http://t.co/uOVzKIQQ
gtdguy,Doesn't it sometimes seem like Dr Phil is doing an impression of Dr Phil?
gtdguy,"Sorry @sanjaygupta I meant @sanjayguptaCNN (By the way, Sanja Gupta meet Dr. Sanja Gupta)"
gtdguy,Hey @DrOz take another look @rickygervais He may be ready to do 5 min on your show. (Hes Canadian & @sanjagupta is HUGE in Canada.)
gtdguy,Hey @jimmyfallon take another look @rickygervais He may be ready to do 5 min on your show. (Hes Canadian & @conanobrien is HUGE in Canada.)
gtdguy,Please follow @rickygervais  Im trying to help him with his career.  I think hes from Canada.
gtdguy,I agree.  Support our troops should no longer be a slogan.  Its should be an action. @ReMind   PL RT http://t.co/QXTqWvjN
gtdguy,What are you guys doing tonight? http://t.co/XlqQM4Uj
gtdguy,"Excited about my shows Nov 25 & 26 @TheMirageLV VEGAS baby! Thanksgiving weekend, baby!  Oh Yeah! http://t.co/dbOLg9CB"
gtdguy,"Hey, how about something more boring than a cucumber?  Inventor of celery"
gtdguy,Finally some innovation in desserts. http://t.co/wp1oJIhD
gtdguy,Thanks to everyone who came to my LA shows and thx to @goldenvoice for the cool poster. http://t.co/aBwk60mX
gtdguy,The audacity of Burger King selling tater-tots for breakfast! The audacity of me for buying them! http://t.co/AHSkhF2V
gtdguy,"I wonder how much @DrOz hates that daily question, Are you related to the Wizard of Oz?"
gtdguy,"This makes me homesick.  Well, just sick. http://t.co/4DoIO7kO"
gtdguy,Is it too early to start complaining about Christmas?
gtdguy,"Boy, being exhausted is really draining, right?"
gtdguy,Flying on @JetBlue makes you realize how important DVRs are.
gtdguy,"RT @CMYKaren: **ABSURD OVERHEARD** illustrated tweet from @jimgaffigan The California roll is just the pig-n-the-blanket of..."" http:// ..."
gtdguy,"The California roll is just the pig-n-the-blanket of sushi, right?"
gtdguy,"RT @LAWeeklyStreet: #Win tickets to see comedian @JimGaffigan @ClubNokia Sat 11/5! Follow @LAWeeklyStreet, #Retweet NOW and check your m ..."
gtdguy,"If love is a battlefield, then it makes sense that getting a toddler to bed takes longer than the Vietnam conflict."
gtdguy,Now that Kim Kardashian is getting divorced maybe now she'll finally get some media attention.
gtdguy,Halloween: a time for children to learn there are no handouts in life. http://t.co/yYWXBqVi
gtdguy,I'm thinking of protesting the price of milk.  They are the 2%!  No wonder I'm lactose intolerant.  #occupyMilk
gtdguy,Today my Halloween costume says How many days is this slogfest through commercialism nightmare going to be? #daythree
gtdguy,So gluten-free is code for tastes horrible?
gtdguy," On the second day of Halloween my true love gave to me: 
A blizzard mixed with rain and sleet. "
gtdguy,Nothing say Halloween liking checking out these videos I did for @HTC http://t.co/MZ3qauOU
gtdguy,Just told my 5 year old that it is bad luck to go outside on the first day it snows.
gtdguy,Congrats St. Louis!  That was so fun to watch.  See you November 19th at the Fox Theater.  (Sorry Texas) http://t.co/53ydvOCp
gtdguy,Halloween is just finals week for parents.
gtdguy,"Instead of ordering a Guinness I'm just gonna say ""I'd like to wait an hour for my beer."""
gtdguy,"RT @DougBenson: DOUG LOVES MOVIES: N.Y.C. III is available now in the Comedy Albums section of iTunes! W/ @patkiernan, @keithpowell, @Ji ..."
gtdguy,This year for Halloween I'm going as someone who's too cool to do a tweet about Halloween.
gtdguy,That Dove Chocolate tastes way better than that Dove beauty bar.
gtdguy,How does Donald Trump remain so humble?
gtdguy,Ever notice that all your friends that make fun of you for tweeting sound like your Dad?
gtdguy,Just another romantic evening with @jeanniegaffigan http://t.co/QO3yAW7u
gtdguy,Any truth to the rumor Im starting that the girl from the Progressive Insurance commercials is a Conservative?
gtdguy,I think its cute vitamins have an expiration date.  That implies they worked at one point.
gtdguy,RT @NikkiFinke: NBC Buys Family Comedy Created By & Starring Actor-Comedian Jim Gaffigan http://t.co/AQf3hDFi
gtdguy,Available at my @pabsttheater shows Dec 30th and NYE in Milwaukee.  (thanks @pointbrewery) http://t.co/W8GVvVuz
gtdguy,The rumors of Playboy paying me a million dollars to not pose nude are false.
gtdguy,Ill never be mature enough to hear the term natural gas and not giggle a little.
gtdguy,I heard its all the rage to give these to trick-or-treaters this year http://t.co/POuDQIrX
gtdguy,Hey you know those people that are always outside and never watch TV? How about a channel just for them.  Pitch for The Outdoor Channel
gtdguy,Its sad that @ESPN has more channels than The Outdoor Channel has viewers.
gtdguy,Am I the only that thinks their TV is broken when they watch Boise State football highlights?
gtdguy,So the Childrens Menu in a restaurant is essentially a sports bar menu but more expensive.
gtdguy,i love this.  Thanks to whoever did it. http://t.co/2MrHY255
gtdguy,On Sundays @WholeFoods should have a traffic report.
gtdguy,"Dear hotels,  how about curtains that actually block the sunlight from entering your room?"
gtdguy,When in Rome...Thanks Buffalo! Next up Los Angeles November 5th http://t.co/3B5MXHMv
gtdguy,"My stomach has an abusive relationship with McD. ""I want you but you always end up making me feel horrible."". Figure it out stomach! Jeez."
gtdguy,What? Do u think i ask to many? When? What should i do? Do u know? RT @Andy_Richter @JimGaffigan You spoil everything with your questions!
gtdguy,I have this really cool key locator thing.  If only I could find it.
gtdguy,What exactly is the difference between changing a diarrhea diaper and rubbing feces on your hands?
gtdguy,"The show Im touring with right now is all NEW material.  Nxt up  Buffalo, LA, NYC, STL, Vegas, Atlanta.  http://t.co/pFPA40RI"
gtdguy,Can we just have one debate where all participants are drunk?
gtdguy,Am I the only one against jobs?  #ImLazy
gtdguy,"Everyone thought the last line of the National Anthem was Play ball, right?"
gtdguy,At this point is it possible to stand at a podium and not look like you are a contestant on Jeopardy?
gtdguy,Since when is it not ok to audit a hot yoga class dressed as Batman?
gtdguy,It is now cheaper to make a movie than to rent one in a hotel room.
gtdguy,Wanted: A proofreader for my tweets. Must be able to type 140 characters a minute with their thumb while driving. No pay.
gtdguy,"RT @jeanniegaffigan: I wonder if the people who correct the grammar on Twitter do the same when their friends text them. ""U is actually  ..."
gtdguy,Autocorrect is like that person who just graduated college and think they know everything.
gtdguy,Why is it when I'm in a TSA line I'm always behind the person that has never left their house?
gtdguy,Finally another Twilight movie to be annoyed by.
gtdguy,If only opening a Vitamin Water could be classified as working out.
gtdguy,Congrats @BorowitzReport on the new book!  Cant wait to read it or at least appear smart by having it on my bookshelf. http://t.co/HFkSpe7y
gtdguy,One of the reasons why my 5 year old son may not see his 6th birthday. http://t.co/2bFgo2P1
gtdguy,I dont feel guilty eating my kids afterschool snacks.  I feel guilty telling them their mom did.
gtdguy,I bet you'd really feel guilty eating elephant in a peanut sauce.
gtdguy,About to watch Dexter. I hope no one dies in this episode.
gtdguy,Spelling something wrong in a tweet is like finding out you have your zipper open in public.  And not on purpose.
gtdguy,It would be really ironic if elephant burgers were not fatening.
gtdguy,Its sad people kill elephants just for their tusks.  Youd think at least theyd get a few elephant burgers out of it.  #babar
gtdguy,RT @jeanniegaffigan: Thank you Columbus for discovering this day off!
gtdguy,"If the objective of every infomercial were to get me to say What a piece of junk, theyd be killing it."
gtdguy,At this point is there anything we dont know about the Kardashians?
gtdguy,How come the term over-tired is only used to describe the behavior of babies or sitcom storylines?
gtdguy,"Sometimes when Im carrying one of my sleeping children Im tempted to wake them up & say Youre gonna do this for me in 20 years, right?"
gtdguy,What exactly is the difference between coconut  water and spoiled water?
gtdguy,Thanks to @yoyodonuts for this lovely backstage gift. http://t.co/DUplT4GZ
gtdguy,"Hey people that sit on planes not reading, listening to or watching anything: you look like serial killers."
gtdguy,"RT @jeanniegaffigan: Great news! Our apartment is going to be featured in next month's issue of ""In Sty"" magazine!"
gtdguy,Is it a coincidence that Ranch is a style of house and a horrible salad dressing?
gtdguy,At this point I view every photo of myself as a before photo.
gtdguy,"Just curious, how many weeks can you wear the same pair of jeans before its gross?"
gtdguy,Most of my life feels like i'm down a touchdown and there's 48 seconds on the clock.
gtdguy,We should just rename television viewing watching Geico commercials.
gtdguy,I like those black leggings the Baltimore Ravens are wearing tonight but I way prefer them on women.
gtdguy,Being a parent may be thankless but at least the pay is terrible.
gtdguy,I usually remember Im trying to eat healthy when I finish eating a cheeseburger.
gtdguy,RT @TheJoeMatarese: Here's the link to Ep 40 of Fixing Joe with my guest Jim Gaffigan. My wife even makes an appearance on this podcast. ...
gtdguy,"Heres something youll never hear, Look at that cool guy in the long-sleeved sun shirt."
gtdguy,I always confuse National Coffee Day with National Coughing Day or National Give Anything A National Day Day.
gtdguy,The cannoli is the pastrami sandwich of dessert. http://t.co/LOvprIaB
gtdguy,How old is your baby? is the How about this weather? of parenting.
gtdguy,"This being awake stuff is hard, right?"
gtdguy,Sometimes I feel like Im being bullied by all these anti-bullying campaigns.
gtdguy,It would take me 7 years to show someone all the photos I have of my 7 year old.  Anyone interested?
gtdguy,"Microwaves are like winter coats.  They warm quick,  people never clean them and they look ugly after a year."
gtdguy,They should have a flight to the airport.  This is taking forever.
gtdguy,"I sincerely don't know how to spell sincerely without spell check. Sincerely, Jim"
gtdguy,"Whats that feeling called when you finally agree on what to order, then you call and the place is closed?"
gtdguy,"This debate is confusing.  Republicans are for MORE government, right?"
gtdguy,"Recently I started Weight Watchers. No, thats not it. Recently I started eating a lot & dont care if I get fat. Sometimes I confuse the 2."
gtdguy,"Just ate ox tail.  ""Hey you know how you would never eat an ox? How bout some ox tail?"""
gtdguy,Im starting to think Rick Perry and Tyler Perry arent even related.
gtdguy,"I'm thinking of pitching a tv show called ""Tyler Perry's Tyler Perry"".  Think he'll mind?"
gtdguy,Why is there more dignity in stripping than auditioning?
gtdguy,Ever notice that any photo youre not in is really not that interesting?
gtdguy,"Tickets for Stand Up for Heroes w/ Jon Stewart, Ricky Gervais, Bruce Springsteen and Me.  + Complete tour list http://t.co/NyWXLutu"
gtdguy,You know what would help sell these fashionable clothes?  Bales of hay. http://t.co/YLvFexTb
gtdguy,What exactly are the ingredients of Ranch dressing? Mayo and disappointment?
gtdguy,"If you ever find yourself drinking more than one shot, you are either celebrating your birthday or trying to forget you were born."
gtdguy,"If I didnt have all these photos that Ill never look at, I dont know how I would make my computer run so slow."
gtdguy,Fashion Week is just another opportunity to prove to Al-Qaeda we are not superficial and materialistic.
gtdguy,Dick Cheney was on The View.  Looks like the Cubs are going to win The World Series.
gtdguy,"""We have to eat this before it goes bad."" - every single person who has ever eaten guacamole."
gtdguy,Just had pizza with my 7 and 5 year old. Would it be too much for them to at least offer to pay once? Jeez.
gtdguy,"Taking a survey.  How many of you have heard of this thing ""the Internet""?  Don't cheat by Googling it."
gtdguy,When are they going to come out with diet biscuits & gravy?
gtdguy,Fancy hotels always have great bonuses like the chocolate on the pillow and the hair in the bathroom.
