gtdguy,"Ive been informed Im not IN Cape Cod, Im ON Cape Cod.  How about this:  Im IN a house ON Cape Cod freezing my ass OFF. #oncapecold"
gtdguy,I'm in Cape Cod but it feels more like I'm in November.
gtdguy,"http://tweetphoto.com/40995544 I was gonna get the Kool-Aid flavored, but I'm an adult."
gtdguy,Do you think Darth Vader wore black because it made him look thinner?
gtdguy,"Goat Cheese:  ""Hey you know that disgusting animal you'd never eat? Check out what we did with some of it's breast milk!"""
gtdguy,"Hey TSA employees, just a reminder you are supposed to stop terrorism, not all air travel."
gtdguy,"In five years Ill probably be thinking, I cant believe five years ago I cared what Id be thinking in five years."
gtdguy,http://tweetphoto.com/40348281 @bigalgoodwin is actually trying  to convince me bartenders wear name tags with fake names.
gtdguy,"Just drove by a highway sign ""Big Beaver Rd.  Exit 69"".   Really Detroit?"
gtdguy,"Goodbye Dr Laura. I hardly knew you. Well, I didn't know you...at all. Who are you? Why are you in the news?  Why dont you have a last name?"
gtdguy,I dont like to think of myself overweight.  I more gutilicious.
gtdguy,"The ""I'm a Manatee"" joke is on my 1st CC CD ""Doing My Time"" http://tinyurl.com/2vn8tnz"
gtdguy,When you read Self magazine arent you always a little disappointed that theres nothing about you in there?
gtdguy,Anyone know where I can get a Jared Christmas ornament? Want to surprise my wife?  #teamjared
gtdguy,"I don't feel sorry for Jared.  You know who I feel sorry for? Anyone else in the world named Jared? ""My name is pronounced je-ROD!"""
gtdguy,"Do you think Jared, Ronald Mcdonald & The Burger King hang out together? Wouldn't it b great to see a pic of them all in a hot tub together?"
gtdguy,Is anyone else suspicious that Jared hasn't aged in 15 years?  Do you think there's more than one Jared? Do you think Jared thinks about me?
gtdguy,Secretly don't we all want Jared to gain that weight back?
gtdguy,"5 dollar footlong. Hey Subway, can you keep the word foot out of my food?"
gtdguy,Is there a reason why they don't put laces in shoes?  What is this Ikea?
gtdguy,Watching Care Bears Movie.  I dont think those bears are even singing the songs. I bet it's dubbed.  What a rip off!  Damn you Hollywood!
gtdguy,Still watching the Care Bears Movie.  I'm starting to think this is just for kids or something.
gtdguy,Watching the Care Bears Movie with my kids.  Surprisingly not very realistic. http://tweetphoto.com/39479592
gtdguy,I hereby blame all future procrastination and weight gain on @Netflix Watch Instantly.
gtdguy,I may be slow but at least I'm faster than my iphone.
gtdguy,"Dear North Korea, Look we get it.  Youre evil and have a small penis. Jeez.  Get a hobby or an economy please.  Its boring."
gtdguy,"""North Korea threatens South Korea.""  Gee,  that doesn't sound like the North Korea I know."
gtdguy,"FYI if a tkt to 1 of my shows is $270, its a scalper or a time traveler from the impending economic disaster. Use http://tinyurl.com/6lnykv"
gtdguy,"How many fights have been avoided b/c of air conditiong?  ""You always...ooh it's nice in here."""
gtdguy,Im tired of obligations.  Please RT
gtdguy,Sorry.  Even the giant snowman pen does not make paying $13 for an order of  kids chicken strips fun. http://tweetphoto.com/38071656
gtdguy,When I dont twitter for a couple days a strange feeling comes over me.  I think its indifference.
gtdguy,http://tweetphoto.com/37244779 is it possible to walk by one of these and not hear a Jimmy Buffet song?
gtdguy,Pirates are really the bikers of the ocean. http://tweetphoto.com/37243300
gtdguy,"The term Family reunion kind of implies you normally dont have to keep in touch with these people, right?"
gtdguy,Im on vacation now.  This relaxing is exhausting.
gtdguy,"Dear Mormons,  I may be a horrible speller but at least I don't pander.  I like Sprite too."
gtdguy,"Dear Atlantic Ocean,  I had so much fun today.  Um...can I have my sunglasses back?"
gtdguy,"""Mary Hart to leave 'ET': TV News""  Oh my God!!!  Wait.  Who's Mary Hart?"
gtdguy,Alcoholics are the easiest to buy a gift for.
gtdguy,I know some people actually support their families by working for Spirit Airlines.  I'd like to apologize to both of them.
gtdguy,I like to think of guacamole as the Mexican peanut butter. http://tweetphoto.com/36704204
gtdguy,Spirit flight was fine even though I had to share my seatbelt and Pitot asked before take off if anyone had jumper cables.
gtdguy,Is it strange that the meal on Spirit airlines is food stamps.
gtdguy,They overbooked the flight and are offering a free Spirit flight to anyone who will give up their seat.  I don't support torture.
gtdguy,Wish me luck.  The flight attendant is now auctioning off usage of the armrests.  I need to save money in case I have to use the bathroom.
gtdguy,Should i be concerned that Spirit Airlines is now having us push start the plane?
gtdguy,Spirit airlines is actually charging for carry on bags.  I hope they're wearing a condom.
gtdguy,If the DMV started an airline it would be Spirit Airlines.  No it would be better than Spirit Airlines. Sorry DMV.
gtdguy,"Hey Spirit Airlines, I'm going to S. Carolina not jail.  You've made your  point.  I'll drive next time."
gtdguy,I didn't know Spirit Airlines meant evil spirit.
gtdguy,"Why do we make eating a sushi an activity? We are going out for sushi""!  Well, good luck. I hope you catch some. No one really cares."
gtdguy,http://favstar.fm/users/JimGaffigan  Greatest hits.
gtdguy,RT @FocusFeatures: Get to know the cast Its Kind of a #FunnyStory & Like it on Facebook! @JimGaffigan is featured today http://bit. ...
gtdguy,Just a heads up.  Coughing in someone's mouth while you kiss is apparently not a turn on.
gtdguy,You know who's really shallow? This pond in my back yard.  It cares nothing about the environment. #thatssilly
gtdguy,"You ever accidentally catch someone in their underwear?  That's awkward.  Especially, if youre holding a knife."
gtdguy,"I just finished a marathon! Sure, it was a marathon nap but Im still proud of myself."
gtdguy,"(cough, cough)  What happened? I...I had the wildest dream.  You were there...and you....and YOU!"
gtdguy,#tweetingfromheaven  And the meaning of life is...wait someone is resuscitating me! Nooooo
gtdguy,#tweetingfromheaven  Colonel Sanders just put his hand on my knee.  What should I do?
gtdguy,#tweetingfromheaven My fake neighbor from suicide joke LOVED the suicide joke.
gtdguy,"#tweetingfromheaven  Up here there are SIX seasons of ""The Wire""! #OmarBack"
gtdguy,#tweetingfromheaven  C.S. Lewis just told me that the spelling and grammar police on twitter work for Satan.
gtdguy,#tweetingfromheaven  Saint Anthony just asked if i had seen his keys.
gtdguy,"#tweetingfromheaven  Gandhi just yelled ""Hooot pockets!"" from across the room .  What a dick."
gtdguy,#tweetingfromheaven Playing backgammon with Lincoln (he's got the WORST breath).
gtdguy,"#tweetingfromheaven It's amazing up here. 68 degrees and breezy, free burgers and no reality shows!"
gtdguy,I read so many negative responses about my last joke that I actually killed myself. I hope you're happy now.
gtdguy,My neighbor just committed suicide. So weird. I was just talking to him yesterday. I told him no one loved him.
gtdguy,"Quick question:  It's ok to give babies Red Bull, right?"
gtdguy,Mobile phones are the carbon dating of television shows.
gtdguy,Can we make it federal offense to pass gas on an airplane? http://yfrog.com/9geqpj
gtdguy,Fajitas are like the Ikea of Mexican food. http://yfrog.com/my7ynj
gtdguy,Waiting for my fajitas. I feel like I'm in a Beckett play.
gtdguy,Is it insulting that my favorite part of Southern California is the food from the neighboring country?
gtdguy,At this point am I the last person in America who doesn't have a tatoo?
gtdguy,"Kudos to the parents of the 8 yr old who yelled ""yankees suck"" as I rode by on a tandem bike with my daughter in my NY cap."
gtdguy,"Sunscreen may be an expensive goo that makes you look paler, but it is an effective way to get sand to stick to your body,"
gtdguy,I wonder if they are gonna go younger with Larry King's replacement.
gtdguy,Im so excited to find out who will replace Larry King.  No wait.   Im not interested at all.
gtdguy,Obnoxious. http://yfrog.com/5unygj
gtdguy,@prohibitionsd with @Jordanrubin http://yfrog.com/5m9mkgj
gtdguy,And I thought Richard was a rough name to have. http://yfrog.com/03teohj
gtdguy,What a show off! http://yfrog.com/jtcinj
gtdguy,I ran into your mom today. http://yfrog.com/jk35yfj
gtdguy,Why do I spend most of my day dealing with technical breakdowns on devices that are supposed to make my life easier?
gtdguy,"Why does ""family friendly"" always equal horrible food?"
gtdguy,Why is the kids menu the same as the bar menu?
gtdguy,3rd show added in SEATTLE. 4 shows in NYC.  Don't know about U but i'm going to all of them. http://tinyurl.com/ca2cxa
gtdguy,Maybe I'm not that out of shape. http://yfrog.com/0uobwoj
gtdguy,Dad? http://yfrog.com/j557kij
gtdguy,Great we are now drinking out of old diapers. http://yfrog.com/0an45zj
gtdguy,"I have this bag that my wife calls a purse. Its not a purse!  It's  4 my notes, wallet, lipstick & a back up tampon. it's not a purse!"
gtdguy,Why is it whenever I talk to a British person it feels like they have a PHD and I have a GED?
gtdguy,"Bratwurst is like having a friend visit 4 a month. At 1st ur like, ""this is so great!""  3 weeks later ur like, ""when can I take a shit?"""
gtdguy,This may be the bratwurst talking but I'm winded from foosball. http://yfrog.com/6btx9fj
gtdguy,"By the way, bratwurst does not give u diarreah. Bratwurst makes u fantisize about having diarreah."
gtdguy,I've had bratwurst for 4 days straight.  I think that means I have to pay taxes in Wisconsin now.
gtdguy,What's everyone else having? http://yfrog.com/5jiwnkj
gtdguy,Im rooting for the Netherlands.  I mean Holland.  I mean the Dutch.  I mean the team in those orange crossing guard safety jerseys.
gtdguy,Or something like this? http://yfrog.com/75kryij
gtdguy,"Is there a sngl room in the state of Maryland that does not have a pic, image, or miniature version of 1 of these? http://yfrog.com/1rkzmtj"
gtdguy,"Its impossible to describe why u are angry at a parent without sounding like a lunatic.  ""They wanted me to eat salad! Can u believe that?"""
gtdguy,"Dear Graham Cracker, I just wanted to tell how wonderful you are when you are with chocolate.  I think you two should stay together."
gtdguy,"Congrats @karenbergreen on @NYTimes recommendation. ""Following Polly"" is a great, funny book. http://tinyurl.com/2v6kalq"
gtdguy,"How many times can kids say ""Are we there yet?"" before you're allowed to leave them by the side of the road? http://yfrog.com/4bo76j"
gtdguy,"Why does it seem like everyone I encounter at a rest stop has a southern accent? ""Hey y'all!"" Aren't we in New Jersey?"
gtdguy,Do you think airline mags are in competition to see who can make them most boring? http://yfrog.com/13v60xj
gtdguy,"Room service coffee=$40.  Who's running Vegas, Ticketmaster?  Im bringing my own when I perform here in Sept. http://tinyurl.com/6lnykv"
gtdguy,Out in Vegas last night. I'd like to report we are not slacking off in either the infidel or the douche bag departments.
gtdguy,"It's amazing how we rationalize. ""it's a pomegranite martini.  It has anti-oxidents.  It's practically a vitamin."" http://yfrog.com/bf5rdfj"
gtdguy,My 4 yr old son gave me a hand made card for Father's Day.  Maybe for Christmas I'll draw him a picture of some toys.
gtdguy,Just saw Toy Story 3.  Brilliant.  Is there anyway Pixar can be in charge of all entertainment?
gtdguy,"Today my 4 year old son told me I was fat.  I just said, ""Oh yeah? Well, I slept with your mother""."
gtdguy,Someone just refered to me as Mr.  Gaffigan.  How awkward.  It's actually Sir Mr. Gaffigan.
gtdguy,Make up your mind! http://yfrog.com/5mqxsmj
gtdguy,Hmm.  Too late for lunch.  Too early for dinner.  Looks like it's time for linner. http://yfrog.com/6xxeduj
gtdguy,Which show are you coming to? http://tinyurl.com/6lnykv
gtdguy,"The weight limit sign on elevators should just say, ""Stare at the fat guy"""
gtdguy,The biggest difference btwn a Taco Salad and a taco?  The taco is healthier.
gtdguy,I'm so glad r microwave has a popcorn button.  Every1 knows if ur making popcorn u don't have time to hit 3 buttons http://yfrog.com/jd3wdj
gtdguy,How do I wait 4 my wife outside the women's room w/o lookin like the guy who hangs outside the women's room?  http://yfrog.com/50msejj
gtdguy,"This is how I feel when people yell ""Hot Pockets"" at me.  http://tinyurl.com/dxdkok"
gtdguy,People in NYC should go to @comixny 2night & see @kindlerandy  @eugenemirman .  Saw them last night.  Really great show.
gtdguy,"This show will be watched by 200,000 lesbians and 80 million men. http://yfrog.com/bfwahrj"
gtdguy,Why is this bathroom sign trying to have a conversation with me? http://yfrog.com/3onm3rj
gtdguy,Now your child can enjoy healthy apple slices dipped in a sticky sugar paste. http://yfrog.com/5hfajoj
gtdguy,"So I can fill up my empty 1gallon milk jug if I write an 'M' on it, right? http://yfrog.com/j6ve4dj"
gtdguy,I get it.  It's a shake...with caffeine! Now I can stay up later being fat! http://yfrog.com/62zbkj
gtdguy,"Hmmm, now what color do I want my sugar water? http://yfrog.com/7eo6vj"
gtdguy,Nothing makes food more appetizing than an ogre with brown teeth and a stinky donkey.  Yum! http://yfrog.com/jni4ewj
gtdguy,"Y r the oldst people on earth from most unhealthy places? ""Born in a thatched hut in W Virginia,  workd in coal mine 60yrs & enjoys cigs"""
gtdguy,They shouldn't charge for the Internet or toliet paper.  I'll chip in $ so I never encounter someone who can't afford TP.
gtdguy,"Aloha means hello and goodbye, yet when I say aloha it means, ""I'm a dork""."
gtdguy,The state fish of Hawaii is the humuhumukununukuapua'a and the state fish of Indiana is the Fillet O'Fish.
gtdguy,The only thing nastier than boubon is probably bourbon.
gtdguy,Summer and Fall shows tickets onsale http://tinyurl.com/6lnykv
gtdguy,And I thought I loved NYC. http://yfrog.com/5fdehcj
gtdguy,"Here comes the sun...and right behind him skin cancer...oh, and there are the dermatologist$!"
gtdguy,"Would you like a salad or fries with your cheeseburger?  Hmm, would I like to pretend to eat healthy or would I like to enjoy my meal?"
gtdguy,For pale people sunscren should be a tax write off. http://yfrog.com/89oboj
gtdguy,Cocktails:  For when you are bored with simply drinking. http://yfrog.com/13vj2ij
gtdguy,Rear cleanse or a soft rear cleansing?  Never thought I'd thought I'd be asking myself that question. http://yfrog.com/0d2h5lj
gtdguy,"Hieney shower?  Ok Japan, maybe you are better than us. http://yfrog.com/0n31mvj"
gtdguy,I asked for a room with a view and this is all they give me?  #sarcasmPlusBraggingEqualsDouchebag http://yfrog.com/9fw96j
gtdguy,"Swiss cheese is like an old sock: It has holes, it kinda smells and if it's hanging on a doorknob it means someone's having sex."
gtdguy,The Beer Festival: A cultural event for alcoholics.
gtdguy,Blue cheese is like the blue cheese of cheese.
gtdguy,Macademia nuts are amazing! They are like the Hawaii of nuts!  They are like the nut made in paradise.  They are like a nut from Hawaii!!
gtdguy,"Culinary School,  What is that? The study of how to make people fat?"
gtdguy,Our baby has the wierdest sleeping habits.  Do you think we are giving her too much iced coffee? http://yfrog.com/edsiij
gtdguy,"Dear Apple,  Those Apps for babies are great but Jeannie would like her phone back. http://yfrog.com/1ru6uj"
gtdguy,Seeing a lot of guys in floral prints.  I'm either in Hawaii or at a Jimmy Buffet concert.  http://yfrog.com/0seg8gj
gtdguy,Going to the 7:25 screening of Living Wake at Cinema Village.
gtdguy,Is it possible to say Worcestershire Sauce and not sound like you need to take a breathalyzer?  #speakinOFsauceURcutoff
gtdguy,Hope to c u @ one of my Hawaii shows next weekend.  No excuses. It's only a 10hr flight from the East Coast. http://tinyurl.com/6lnykv
gtdguy,The diving board is really the microphone of the pool.  There is an expectation of a performance and the canon ball is the fart joke.
gtdguy,"Mayo, you vampire of condiments.  Eerily white, you die in sunlight, bad for me but Im strangely drawn to you. My mayo."
gtdguy,"Has anyone ever looked at an ice sculpture and not privately thought, ""What a waste of time and money""?"
gtdguy,I heard they are making Scream 4...in other words Scream $.
gtdguy,If you could get a degree in poor spelling I'd have a PDH.
gtdguy,"Anyone know where I can find out more about celebrities I've never heard of doing non-newsworthy things, besides everywhere?"
gtdguy,"The inception of every microbrewery: ""Hey I got an 100 grand let's make our own beer.  People are provicial, right?"""
gtdguy,My dates for the night @toddbarry and @Hannibalburess http://yfrog.com/0s67xj
gtdguy,"Air conditioning!  My buddy!  How have you been?  Oh yeah, sorry for what i said about ""cold air"" back in February.   I was drunk."
gtdguy,"If u hate blue cheese, return this!  If u dont hate blue cheese, PLEASE support us by RT!  This is important! Exclamation point! RT!"
gtdguy,"Go to the store right now and buy St. Agur blue cheese.  If you dont like it, stop following me.  (Sorry no picture.  I ate it all)"
gtdguy,Is it me or does it seem like Cinco de Mayo is always on May 5th?
gtdguy,Know who doesn't like salads? The Chef.  The Chef Salad is a bowl of cold cuts.
gtdguy,I almost felt guilty eating an entire row of these but that lock was hard to pick. http://yfrog.com/78u52j
gtdguy,86 degrees in NYC.  Feels like July.  Unfortunately it smells like August.
gtdguy,Can't wait to get the Kim Kardasiam perfume!
gtdguy,This is what Greg Kinnear did to me! http://yfrog.com/3wivbwj
gtdguy,Thank you technology.  The liquid sun umbrella. http://yfrog.com/59gpujsj
gtdguy,It's Earth Day but shhh don't tell the earth let's have it be a suprise.
gtdguy,Arrived in Detroit. http://yfrog.com/1gj79j
gtdguy,The service on my iPhone is so bad I'm thinking of calling it my AOL phone.
gtdguy,The abbreviation for Hawaii is HI.  Shouldn't it be ALOHA? http://tinyurl.com/ca2cxa  There in May.  Already applying sunscreen
gtdguy,"It's hard to say Kalamazoo without sounding like your falling.  Show Friday.  http://tinyurl.com/ca2cxa  Upcoming FL, HI, SC & NYC"
gtdguy,If doctors are so smart why are they using the same filing system Bob Cratchit used? http://yfrog.com/4iimg3427j
gtdguy,You'd think with all of our technological advances they'd be able to figure out a way to make cheese good for you.
gtdguy,"I bet If you play NPR backwards you can actually hear them say ""We hate dumb people"""
gtdguy,"I feel like a 100 bucks.  Yeah, that bad."
gtdguy,A cultural difference.  I'm against children peeing on the floor. http://yfrog.com/2wimg3408j
gtdguy,Happy Easter!  #Howabouteggs? http://yfrog.com/1limg3391gj
gtdguy,"It's amazing that 2000 yrs ago Jesus walked around Jerusalem, and now my feet feel like i've been walking around Jerusalem for 2000 yrs."
gtdguy,Outside St James Armenian church.  All these rules seem ridiculous except for 4c. Pet peeve of mine http://yfrog.com/2eimg3339j
gtdguy,I don't know if I just got a mail or a fatwa http://yfrog.com/auimg3292j
gtdguy,I don't mean to brag but I had 5 dates today. http://yfrog.com/9timg3281qj
gtdguy,"Lunch at a Kibbutz.  ""Hey you don't mind if I watch while you eat my body, do ya?"" http://yfrog.com/9timg3266j"
gtdguy,Our hotel has a view of the Sea of Galilee and these! http://yfrog.com/33img3229j
gtdguy,Hmm.  How do we sell more lamb innards? http://yfrog.com/a2img3211j
gtdguy,Next to a Catholic holy site in Nazareth.  Thanks for the welcome! http://yfrog.com/33img3210zj
gtdguy,"RT @nerdist: For the day shift, Nerdist Podcast #8: @jimgaffigan is up! http://afx.cc/gaffigan"
gtdguy,I love traveling internationally I just hate being treated like a tourist.
gtdguy,I'll have the coffee and can you serve it in something that makes me look obnoxious? http://yfrog.com/1yimg3054j
gtdguy,Just went to Old Bethlehem.  Is it me or does Arabic writing kind of look like Hebrew in cursive? http://yfrog.com/1yimg3181j
gtdguy,I'm going on 9 days without bacon.  God grant me the serenity...
gtdguy,Learned on this trip.  The Israeli brkfast is the opposite of the English brkfast.  The Israeli + English brkfast + Bun = American breakfast
gtdguy,"4  those that can't read Hebrew it says Coma, Seven,  .1 taking a dump, crying pie, .1 on turd http://yfrog.com/atimg3044j"
gtdguy,I'd like lunch and I'd like it served on 80 plates.  #Abulafia http://yfrog.com/1limg0679kj
gtdguy,For all of those who ever wondered what I looked like on a camel. http://yfrog.com/a2img3004bj
gtdguy,Performing in Tel Aviv Friday and Jerusalem next Saturday.  Hope they like the bacon jokes.  Just kidding.  Holla! (bread)
gtdguy,"RT @benjilovitt: Pls RT! American comic @JimGaffigan in Israel, performing live in Old Jaffa tomorrow night! http://bit.ly/bB40G9"
gtdguy,Can someone make a sunscreen that doesn't actually make me look PALER?
gtdguy,"The Red Sea - ""Ta-dah!"" Or should i say Toda? http://yfrog.com/a2img0667zj"
gtdguy,"If the English Breakfast were the American Breakfast, the U.S.  would have had public health care years ago."
gtdguy,We leave London today. Will miss the English Breakfast.  Will not miss how I feel AFTER I eat the English Breakfast
gtdguy,"Bacon, Ham AND Sausage.  What is the difference between The English Breakfast and a pile of meat? http://yfrog.com/1dimg0633j"
gtdguy,"I don't care what kind of ""A La"" it is,  I'll never order It. http://yfrog.com/4pfpcbj"
gtdguy,Saw this walking down the street in London. http://yfrog.com/0dbzcqj
gtdguy,"If you are taking pictures of yourself having fun at the club, you are not having fun at the club."
gtdguy,I swear the woman in this inflight video is hitting on me. http://yfrog.com/cbqfvj
gtdguy,"Has anyone ever woke up and thought, ""I'm glad I drank all that champagne""."
gtdguy,I know it's a 7 hr flight but do u have to dress like sock monkies? http://yfrog.com/50np5j
gtdguy,Our tax dollars at work http://yfrog.com/j7ymadj
gtdguy,Happy unofficial alcohol awareness day
gtdguy,Whoever decided to childproof DVD's should be hung.
gtdguy,Performing in Jerusalem Apr 3rd.  I look forward to doing diarrhea jokes in the birthplace of all monotheistic religions.
gtdguy,I'm loving The Wire.  #IjustSawHeat
gtdguy,The Umbrella Graveyard http://yfrog.com/1i760mj
gtdguy,"Who came up with the stationary bike?  ""Here's my bike that goes nowhere, here's my oven that doesn't cook and here's Congress"""
gtdguy,Letterman tonight. Long Island Saturday. http://bit.ly/82bP
gtdguy,"This is the day I was given the most important gift of all, Jeannie.  
Calling Jeannie my wife feels a little (cont) http://tl.gd/f2uo9"
gtdguy,The pre-fax machine tv screens on this plane does not build a lot of confidence. http://yfrog.com/1ryv0j
gtdguy,Confession: Sometime I leave the door open when I use the bathroom.  Mostly  on planes.
gtdguy,"I can't wait to see who wins most popular, I mean best actor."
gtdguy,The Oscars. It's like election night except completely unimportant.
gtdguy,March is officially the worst month of the year.
gtdguy,I love how bored the audience looks on that Dr Oz show.  They acually look like they are waiting to see a doctor. http://yfrog.com/0t2d8sj
gtdguy,Do you have a slot machine that appeals to a 5 year old girl? http://yfrog.com/03vuglj
gtdguy,Patton Oswalt is great on Caprica.
gtdguy,What is the difference between water boarding and overhearing people talk about old musicals? #genekellyismyhero!
gtdguy,"Improv is like bowling.  Fun to do, torture to watch."
gtdguy,"Has anyone ever left a Broadway musical and thought, ""Hey that was worth it""?"
gtdguy,The only thing worse than going to a musical is sitting in a Starbucks and overhearing people LOUDLY plan a musical. #HeyIlikemusicals!
gtdguy,I probably should put on sunscreen before I eat these?  http://yfrog.com/1y7cspj
gtdguy,Why is TV always better with the sound off?
gtdguy,Real goldfish are not as tasty as those goldfish crackers.
gtdguy,Where do all the good pens go? I can only find the dead pens.
gtdguy,I wish all fish tasted like golfish crackers.
gtdguy,They should just call indoor pools germ baths.
gtdguy,"Ugg. That's short for ugly, right? #Iloveuggsdontdisthem"
gtdguy,"I can't really volunteer right now, I'm too busy working on being less self-centered."
gtdguy,If we are gonna have to deal with all this snow you'd think they let us have another Christmas.
gtdguy,What is the difference between a personal trainer and a professional nag?
gtdguy,It's snowing here in NYC  http://yfrog.com/3g3yuvj
gtdguy,"My favorite part of last ""Big Love"" was when Henry Winkler was on water skis in a leather jacket."
gtdguy,I want that USA goalie to be my stock broker. http://yfrog.com/1dym6uj
gtdguy,As if I didn't hate winter enough. http://yfrog.com/3nr8iwj
gtdguy,"""How about I dress like I work at Hooters and you are the closted cowboy?"" http://yfrog.com/1dqm5pmj"
gtdguy,Ice dancing is timeless.  It feels like it will never end. http://yfrog.com/3nd1yqj
gtdguy,Just watced four episodes of Caprica on DVR.  Do I get a nerd merit badge or something?
gtdguy,Really? http://yfrog.com/4amk6jj
gtdguy,Have I died? http://yfrog.com/4aoxzgj
gtdguy,Cheese yes. Head cheese no. http://yfrog.com/aun7mqj
gtdguy,I was thinking of giving up cheeseburgers 4 Lent but that would b way 2 hard.  http://yfrog.com/37h1ewj
