dropbox,"In case you missed the party last night, my site just got a mega makeover!  http://blog.getdropbox.com"
dropbox,thanks to @techcrunch for writing about my redesign! http://bit.ly/coX6o
dropbox,just released serious makeover of my web site. let me know what you think! http://www.getdropbox.com/home
dropbox,released beta that fixes all remaining snow leopard integration issues! :-) http://bit.ly/5nLVw
dropbox,An interview with the writer of my Linux client!  http://blog.getdropbox.com
dropbox,new snow leopard build! come help me test? :-) http://bit.ly/9ttar
dropbox,"taking more testers for my latest snow leopard build!
http://bit.ly/cu5dR"
dropbox,"Oh btw, did i mention that the app is FREE?  (more pics up btw!)  http://blog.getdropbox.com"
dropbox,adding iphone screens to my blog. http://blog.getdropbox.com - RT me? ;-)
dropbox,omg a sneak peek at my iphone app!  http://blog.getdropbox.com
dropbox,"help me out on testing snow leopard compatibility! :) 
http://bit.ly/5Aq9v"
dropbox,update on my iphone app! submitted to app store and waiting for apple's approval :)
dropbox,just updated a tour explaining what I do. let me know what you think ;-) http://www.getdropbox.com/tour
dropbox,We're hiring! http://tinyurl.com/o2xxj3
dropbox,I challenge all of you to a Rock Band duel! &gt;:D  http://blog.getdropbox.com
dropbox,"if you like playing with very experimental software, I have a treat for you! :-) http://bit.ly/4keKB"
dropbox,Yey blog post!  http://blog.getdropbox.com
dropbox,New blog post featuring Dropbox limericks!  Woo!  http://blog.getdropbox.com
dropbox,"I've launched my affiliate program! If you love me, you can earn up to $50/paid subscriber that you send to me! http://tinyurl.com/m3tdrg"
dropbox,"Just a reminder!  Write a limerick for a chance to win 50GB for life!  Head to the forums to enter, but be quick!  Contest ends tonight :)"
dropbox,Oops!  Too many people bombarding my blog!  Sit tight for a bit.. soooorry :(
dropbox,Just a reminder!  50GB version of me still up for grabs!  http://blog.getdropbox.com
dropbox,New @Dropbox blog post (finally!) -- Win a 50GB version of me too!  http://blog.getdropbox.com
dropbox,"ohmagad, I've won http://www.facebook.com/dropbox... :-D"
dropbox,We're hiring!  http://tinyurl.com/o2xxj3
dropbox,"Follow us on Facebook too! Giveaways, updates and more!  Hooray! http://tinyurl.com/r62lcx"
dropbox,miss Quick Look previews in your Dropbox folder? try the latest build of me from the forums :-) http://tinyurl.com/rcpmes
dropbox,Vote me for best infrastructure/storage app of 2009! :D  http://tinyurl.com/clbljd
dropbox,"thanks to all 1 million of you who use me! :-)
http://tinyurl.com/c87kqa"
dropbox,just released a refresh of my web UI. let me know what you think! :-)
dropbox,just released brand new nautilus-dropbox (with ubuntu jaunty compatability) and my official linux CLI client! http://tinyurl.com/d3etsm
dropbox,"latest stable version of me finally available: http://tinyurl.com/co2cup - if you've ever had problems, try upgrading! :-)"
dropbox,"oops, sorry for the bad link! http://tinyurl.com/co2cup"
dropbox,"latest stable version of me finally available: http://tinyurl.com/cqfmbj
if you've ever had problems, try upgrading! :-)"
dropbox,I'll be offline for 15 minutes starting around 1AM pacific (one of my hosting providers is upgrading routers) - sorry for the inconvenience!
dropbox,Only one day left for my OSX menu bar icon contest!  50GB up for grabs!  :D http://tinyurl.com/d6mkwd
dropbox,watch dropbox vs. mozy in a rockband throwdown :-) http://www.justin.tv/mozyvdropbox
dropbox,"@docroc I'd prefer someone on-site (SF, CA), but we're open to off-site :-)"
dropbox,"Hey all, just to clear this up-- I only need a makeover of our Leopard (black and white) icon :)"
dropbox,My OSX Menu bar icon needs a makeover! Halp me out and get a 50GB prize! http://tinyurl.com/d6mkwd
dropbox,@websense no longer classifies me as P2P. have your IT/network admin download the latest websense database update if I'm still blocked :-)
dropbox,interview with one of my founders! http://blog.getdropbox.com
dropbox,@GuiltPop my iphone version is already underway!
dropbox,I'm at MIT recruiting :-)
dropbox,At the Crunchies! Cross your fingers!
dropbox,Dropbox I've made my New Year's resolutions... have you? ;) http://blog.getdropbox.com
dropbox,I made the crunchies! vote me 'best new startup of 2008' ;-) http://tinyurl.com/7kzk9m
dropbox,Happy holidays from Dropbox!  I've got lots of presents in store for y'all in 2009 ;D
dropbox,Lifehacker says I'm popular!  For both Mac http://tinyurl.com/5nzhbl and Windows! http://tinyurl.com/6jw5u3
dropbox,I got a makeover!  http://blog.getdropbox.com
dropbox,My user Wiki is now available!  Gogo!  http://wiki.getdropbox.com
dropbox,"spread the word and halp me out - I'm running for the crunchies! :-)
http://tinyurl.com/5aax3b"
dropbox,"@GiancarloN try the newest os x build in the forums, they feature icons made by @iconaholic :-)"
dropbox,listed on lifehacker's top free software to be thankful for - digg me up :-) http://tinyurl.com/5wenc5
dropbox,I hope you all have a great Thanksgiving!  Eat lots!  Just promise me you won't try to exceed your quota ;) http://blog.getdropbox.com/?p=18
dropbox,I &lt;3 @1Password :-)
dropbox,@Iconaholic will you marry me? :-)
dropbox,"@trav1sty I do auto update, but haven't pushed an update in a while - we will soon :-)"
dropbox,@robwilkerson try the latest version of me http://tinyurl.com/65ycl6
dropbox,@roncioso try rm -rf ~/.dropbox-dist and restart me. that should download the very latest binary (0.6.416) and fix the startup problem
dropbox,"@jduprey this build should take care of all proxy related sync issues :-)
http://tinyurl.com/5t5lh6"
dropbox,more linux love from me (ubuntu 8.10 support :-) http://tinyurl.com/5dpvc7
dropbox,taking suggestions for wiki software... halp! :-) http://tinyurl.com/5vg9hl
dropbox,@Legion No need to worry!  I'm very well protected... ;)
dropbox,looking for a simple bug tracker? try dropbugz! :) http://tinyurl.com/676d8l
dropbox,@clarklesparkle &lt;3
dropbox,@bunsandchou:  Dropbox is proud to have the rabbit seal of approval :D
dropbox,@thobu what exactly is your client trying to sync? how long has it been going long? does quitting/restarting fix it? support@getdropbox.com
dropbox,@joesutton: &lt;3
dropbox,@edr1084: no pacts with the devil here... we promise!  you have our dropbox guarantee  that your soul is still intact :)
dropbox,@revnathan:  i &lt;3 you too!
dropbox,@es:  you've got mail
dropbox,@es: sorry to hear about your troubles- this doesn't sound normal and you shouldn't be counted twice. would you like to dm us to talk?
dropbox,@hfiguiere: I actually am free :D!  Seriously!
dropbox,new version (0.6.405) of me to play with! - http://tinyurl.com/6rlman
dropbox,our launch party at vessel... a huge hit!  thanks to everyone who came to celebrate our success :D
dropbox,i'm back up and running
dropbox,I'm gonna be down for about 10 minutes or so... hold on tight!
dropbox,my linux version getting some love :) http://tinyurl.com/69vl3r
dropbox,@askara try going to http://getdropbox.com/share to rejoin shared folders you left.
dropbox,"We've launched, and been dugg! http://tinyurl.com/5o7esj"
dropbox,bunch of web updates now live. come check me out! :)
dropbox,Dropbox is down for some scheduled maintenance and a super chunky upgrade.  Expect me up and running at around 12:30AM PST.
dropbox,"@garethgreenaway I do, it'll be ready this week :)."
dropbox,new version of me to play with! http://tinyurl.com/698b3p
dropbox,"just an fyi, our hosting provider had an issue with one of their datacenters, which affected dropbox.  everything's fine now though"
dropbox,and we're back up and kickin' like michael phelps
dropbox,"we're having a bit of a hiccup at the moment, sit tight!"
dropbox,another invite wave!
dropbox,@gruber i'm harmless!
dropbox,@brettp i love you too!
dropbox,...and we're back!
dropbox,s3 (and myself) will be up to full functionality in 15 minutes or so
dropbox,service is slowly being restored.  expect everything up and running within the hour.
dropbox,"Because S3 is down, Dropbox is also down.  We'll keep you informed with up to the minute updates."
dropbox,vote for your favorite syncing tool on lifehacker!  (hint: it starts with a 'd' and ends with 'ropbox')  ;)  http://tinyurl.com/559enq
dropbox,dropbox is hiring! http://tinyurl.com/6e7brh
dropbox,New blog post: http://blog.getdropbox.com
dropbox,Dropbox users!  Want to test the linux alpha client?  check out the linux thread on the forums for our haiku contest! ;)
dropbox,"a few changes: new snazzy stuff on the web ui, faster page loads."
dropbox,"Dropbox 0.6.285 pushed -- couple bug fixes, improvements to OSX sleep issue"
dropbox,dropbox featured on lifehacker :) http://tinyurl.com/3s7epl
dropbox,wheeeeee just shot out a few thousand more invites!
dropbox,new blog post!  http://blog.getdropbox.com
dropbox,sending out a ton of invites this week... will you be one of the lucky ones?
dropbox,new linux screenshot!  http://tinyurl.com/67jtfx
dropbox,linux screenshot on front page of digg http://tinyurl.com/3s57ru
dropbox,linux dropbox screenshots leaked http://tinyurl.com/3ofjp2
dropbox,added opt-in early auto-updates http://tinyurl.com/5z3px5
dropbox,"just sent out 5000 invites, more going out soon :)"
dropbox,dev team will be at super happy dev house at 7pm http://tinyurl.com/6qwn6b
dropbox,added commenting to shared folders. http://tinyurl.com/4jkl53
dropbox,New Dropbox blog post!  http://blog.getdropbox.com/  (...invites included!)
dropbox,25 Dropbox invites up for grabs!
dropbox,Up and running!
