dropbox,Spice up your work day with productivity apps that connect to Dropbox! Learn more on our Dropbox at Work blog: http://t.co/AfYAxVAu
dropbox,"Also, check out how others are thankful for Dropbox! https://t.co/vgPgDvEj"
dropbox,"Dropbox is thankful for a lot this year, but most of all for you! &lt;3 https://t.co/UFh8DHwU"
dropbox,RT @dropboxapi: Dropbox Chooser is already popping up all over the web. Check out some of our favorites: https://t.co/4F1LUqzZ
dropbox,"Students, we've doubled referral points for Space Race! Now each new Racer will get you twice as close to free space: http://t.co/VD5KrLTy"
dropbox,Meet the Dropbox Chooser: a new way for developers to let you access the stuff in your Dropbox from any web app! http://t.co/qIJOxiVz
dropbox,"En Espaa? Ya puedes obtener Dropbox es espaol en tu ordenador, tu dispositivo mvil o en la Web. Echa un vistazo a: http://t.co/fjHSbKSO"
dropbox,"Evviva! Dropbox  ora disponibile in italiano per computer, dispositivi mobili e sul Web. Visita: http://t.co/IQUNGFxj"
dropbox,Tell us YOUR Dropbox story and you could win 100 GB for life :) https://t.co/TjQ4Kumk Thanks for sticking with us all these years!
dropbox,Dropboxing at work? We've got a brand new blog that's all about ways to use Dropbox in your business: http://t.co/oEtIWPsP
dropbox,RT @Sofakimou: Hope the folks over at @Dropbox like my Halloween Costume! #GeekStatus http://t.co/s0ik80zh
dropbox,"Have you shared stuff from Dropbox with your Facebook Groups yet? Give it a try! 
 http://t.co/PoHdfH17"
dropbox,Did you get an iPhone 5? Now you can download the latest Dropbox app for iOS 6! http://t.co/cRGTMxvp
dropbox,"Hey Space Racers, the competition just got hotter! Check out how your school stacks up on our new leaderboards: http://t.co/OGbBvlcO"
dropbox,"How do caching algorithms differ in theory vs practice? Find out on the Dropbox Tech blog! Thanks to Pavel, intern '11! http://t.co/G5C875Pe"
dropbox,Hey students! Rep your school and earn a ton of free space for everyone by joining the Great Dropbox Space Race: http://t.co/fhsdnpL1
dropbox,Dropbox for Android has a new photo gallery that puts your pictures front and center &amp; displays them beautifully! http://t.co/DQ9I7qQq
dropbox,Now you can view a gallery of your photos from any mobile phone through http://t.co/DxikmVNv! Check it out: http://t.co/FSeMbkgx
dropbox,Check out the latest post on our tech blog! Comtypes: How Dropbox learned to stop worrying and love the COM: http://t.co/irldj1bm
dropbox,Were psyched to announce that you can now share stuff from Dropbox in your Facebook Groups! Check out our blog! http://t.co/p9Ik6Zws
dropbox,"Vous utilisez Dropbox mobile ? Obtenez 2Go supplmentaires avec SFR, pour prendre encore plus de photos et vidos ! http://t.co/2ihFvZGK"
dropbox,"With the new Dropbox app for #iPhone &amp; #iPad, you can share on Facebook and Twitter and use AirPrint! Even in Korean! http://t.co/ZeTwuNx8"
dropbox,Love CoffeeScript? So does Dropbox! Check out how we rewrote our codebase during Hack Week: http://t.co/NDsT6DaE
dropbox,"Today is the last day to vote and send #Dropbox to SXSW! Check out our panel topics: 
 http://t.co/UxzIgR6l"
dropbox,Hey JavaScript developers! Check out some awesome API magic an intern cooked up this summer! https://t.co/3FrNYJVL
dropbox,Excited that our friends at Vimeo integrated via the @DropboxAPI to let you auto-upload videos straight from Dropbox! http://t.co/NedMR5v1
dropbox,Hey folks! 3 more days to support #Dropbox at SXSW! Click here to vote on our panels! http://t.co/yO6RyWsy
dropbox,We just launched 2-step verification to boost the security of your #Dropbox! Check out our blog and turn it on! http://t.co/OeYjuyEo
dropbox,Wanna know what it's like to work at #Dropbox? Take a sneak peek behind the scenes: http://t.co/1P2FfoEz
dropbox,This is what our internal mascot Panda's world looks like on an average day at #Dropbox: http://t.co/SHS20KJm #SanFrancisco
dropbox,#Dropbox works on Earth but did you know it works in space? See how a Hack Week project explored new frontiers! http://t.co/lmdvlnEr
dropbox,Hey folks! SXSW voting is now open &amp; we need your help getting #Dropbox represented! Click here to vote for our topics! http://t.co/vU8u0JXi
dropbox,"You can now easily print stuff from your #Dropbox through #FedExOffice, online or in-store:  http://t.co/naCLKfjc"
dropbox,Using OS X Mountain Lion? Get the newest version of #Dropbox! Read more on our blog: http://t.co/QUtGK3ix
dropbox,"What's cooler than 100,000 followers? 1 MILLION FOLLOWERS! Thanks y'all for your love and support via Tweets! You're awesome! #Dropbox"
dropbox,Take your stuff with you wherever you go! Install #Dropbox on your phones and tablets: http://t.co/aoKYewhs
dropbox,Were stoked to welcome Matt and Sean of TapEngage to the #Dropbox team! http://t.co/oG9Yrsln
dropbox,Nice little update to #Dropbox shared folders - now you can choose whether to let others invite more people: http://t.co/5pMbCtpU
dropbox,RT @HP: Now you can #print directly from @Dropbox on your #mobile w/ the #FREE #HP ePrint Service #app! Download here: http://t.co/9mCzMWDz
dropbox,"Attending #MBconf? Check out #Dropbox's own Lars Fjeldsoe-Nielsen, Head of Mobile BD, at How Great Design Impacts Viral Growth Panel 1:30pm"
dropbox,Our new Pro plans are now live! #Dropbox Pro users now get double the space &amp; we also have a new 500 GB plan: http://t.co/ekwRc95b
dropbox,Dropbox Pro plans get supercharged! Our Pro users now get twice as much #Dropbox space! http://t.co/K1O2B2eX
dropbox,"Hi folks! If you want to change how you get messages from @Dropbox, check out your Twitter settings: https://t.co/sSDY7faX"
dropbox,#Dropbox Hack Week is just a week away! Watch this video &amp; see for yourself why we're so stoked! http://t.co/wShKSEkm
dropbox,"Bay Area Developers &amp; Designers! Join Dropbox, Facebook, Aviary et al at the 3rd Photo Hack Day @photohacksf #PHD3 http://t.co/3VfX7gzb"
dropbox,Dropquest 2012 results are in! Props to all those who participated &amp; kudos to the winners! http://t.co/qRhqE0Js #Dropbox
dropbox,RT @dropboxapi: You can now sync your @OReillyMedia ebooks straight to Dropbox! Check it out at http://t.co/MESE4SCC
dropbox,Love using Dropbox? Get your business on board! Check out Dropbox for Teams: http://t.co/CeyR6zLZ Follow @DropboxTeams for more!
dropbox,We added a new Undo feature for #Dropbox on the web! It's a quick way to fix the mistakes we all make - try it out! http://t.co/2Huys20I
dropbox,Have you checked out all the different ways you can get free space on #Dropbox! It's easy! Check out: http://t.co/9ZWhkObM
dropbox,Latest Dropbox #iOS app for #iPhones and #iPads is out! Automatically upload your photos &amp; videos and get free space! http://t.co/8Tpapx7Q
dropbox,RT @rnorgan: Come find me at @pacifichelm's designer meetup tonight. I'll be giving out free @Dropbox space and merch. http://t.co/GUzMIAnO
dropbox,   ! @Dropbox is available in Korean!  Check it out: http://t.co/1ro2GLbB http://t.co/VdSgCSpW
dropbox,Watch @DrewHouston talk about the early days of @Dropbox and Finding Your Way as an Entrepreneur http://t.co/bQuOoHBq
dropbox,@Dropbox won People's Voice for Best Product @TheWebbyAwards. Simplify! http://t.co/lL0fhstY
dropbox,How are your @Dropbox referrals looking? Check on the status at https://t.co/7b3brIed and give your friends a nudge!
dropbox,The @Dropbox playoff on @Dribbble has started! Enter to win up to 25 GB for life or vote on the best shots! http://t.co/IfHw72EY
dropbox,Get extra space for spreading the @Dropbox love with a tweet! Check out http://t.co/RMeYwfUL
dropbox,"RT @dribbble: Win space for life in a special rebound playoff presented by our friends at @dropbox! 

http://t.co/ykpBh02t"
dropbox,Check out all the different ways to get more free @Dropbox space! Read our post http://t.co/k4T5lm4x or visit http://t.co/lijdW1En
dropbox,You can now set up @Dropbox accounts with @Soluto! Check out their nifty how to: http://t.co/8KQtOSlx
dropbox,Following @Dropbox on Twitter? Be sure to get your extra space for it!  Visit http://t.co/rbxk0IM1
dropbox,Dropquesters! We'd love to see pics of your desk/notes from this year! Send a link (http://t.co/ynzrRdaC) to dropquesters2012@dropbox.com!
dropbox,And we have a winner for Dropquest 2012!!! Hundreds of prizes are still left though -- keep questing!
dropbox,Seems like we'll have our Dropquest winner shortly...!
dropbox,Dropquest has started! Get to questing for a chance to win 100GB for life! https://t.co/MHSmpZeu
dropbox,Dropquest starts in 10 minutes! Start spamming refresh! https://t.co/MHSmpZeu
dropbox,3 hours until Dropquest! :O http://t.co/7mkcENKF
dropbox,"Dropquest launches in exactly 13 hours! Set your alarm clock, and put on your thinking caps! http://t.co/7mkcENKF"
dropbox,"DROPQUEST II: It's back, and it's epic-er. Solve a scavenger hunt to earn free space and maybe some really cool prizes! http://t.co/7mkcENKF"
dropbox,"Got photos from the weekend? Automatically upload to @Dropbox from any camera, SD card, phone or tablet! http://t.co/J1DJwWdg"
dropbox,Now you can automatically upload to @Dropbox from pretty much anything that has a photo or video on it! http://t.co/axUwhwx9
dropbox,"Introducing the new, lightning fast way to share with @Dropbox  just send a link to a file or folder! http://t.co/1kPXHvId"
dropbox,"@Dropbox has been nominated for 2 @TheWebbyAwards. Cast your votes today!
http://t.co/9yIAyf7j &  http://t.co/APBePvQj"
dropbox,Using Chrome to access http://t.co/DxioUvWF? Install the new @Dropbox app from the Chrome Web store! http://t.co/zAKaXnOd
dropbox,"How strong is that password really? Read about zxcvbn, our password strength estimator, on the @Dropbox tech blog http://t.co/M4VOFIJ8"
dropbox,"Have you tried drag and drop upload for @Dropbox yet?! Drag files from your desktop to http://t.co/DxioUvWF in Chrome, FF & Safari!"
dropbox,"A new way to upload to @Dropbox! Drag files from your desktop to http://t.co/DxioUvWF in Chrome, FF & Safari! http://t.co/n3167R9t"
dropbox,Check out how Masanga manages a hospital in Sierra Leone with the @Podio integration with @Dropbox http://t.co/QSRY0dcR
dropbox,Get twice as much extra free space for each @Dropbox referral! http://t.co/Sgrl4u3z Invite your friends! https://t.co/TayExWGM
dropbox,@Dropbox is excited to welcome Bono & The Edge as investors. Thanks for the support and look forward to great things! http://t.co/17lpnfx2
dropbox,"RT @dropboxapi: Just released the biggest feature request from our API users: http://t.co/yPdo4HLN. Also, includes new OS X SDK."
dropbox,@Dropbox Hack Week was amazing! Check out this video (thanks @ericstrange) of some cool projects and our new office: http://t.co/IGyNLvPI
dropbox,RT @rstevens: Why did Obi-Wan upload his file to @dropbox before emailing? Jedi are not allowed attachments.
dropbox,Pssst! Now you can invite your Facebook friends to @Dropbox shared folders. http://t.co/xGXcsPx0 http://t.co/ZqWvYfow
dropbox,At #SXSW Starting in 15 mins: @Dropbox founder @drewhouston chats with @KaraSwisher. Austin Convn Ctr. Ballroom D
dropbox,Come say hey to the @Dropbox crew at #Pycon -- we're in the exhibition hall!
dropbox,Chillin' at #SXSW? Come watch our founder @drewhouston chat with @KaraSwisher about Dropbox's future! Austin Convn Ctr. Ballroom D at 5PM!
dropbox,"Check out the fresh new http://t.co/GbufYEP8! A clean look, snazzy photo experience, better search and more! http://t.co/wMB2mJCB"
dropbox,The latest Android release has landed! You can now automatically upload all your photos and videos to Dropbox! http://t.co/5ZVlKgfi
dropbox,Vote Dropbox for Best Overall Startup (http://t.co/iQocxK07) and Best Cloud Service (http://t.co/VxhadEEX)! #Crunchies
dropbox,"We believe in an open, vibrant Internet and oppose web censorship bills SOPA and PIPA. Learn more at http://t.co/kjK3evra"
dropbox,Follow us on Facebook http://t.co/2DCuISal
dropbox,"Check out version 2.0 of our Android app! Now with favorites, bulk upload, Ice Cream Sandwich support, and more! http://t.co/vMle6R7k"
dropbox,"Check out this Wired article about the early days of @dropbox with
@drewhouston and @arashf http://t.co/mv4n72Jb"
dropbox,"RT @dropboxapi: Congratulations to @hackpad @yourtrove and @getspool, winners of last week's Dropbox Hackathon.  http://t.co/0627AxPR"
dropbox,"RT @sparrowmailapp: Sparrow 1.5 is now available on the Mac AppStore.
Proud to add @Dropbox, a new search and block images: http://t.co/ ..."
dropbox,"Congrats @arionkrause for winning 100GB for life! Just as a reminder, it's super easy to get free space on Dropbox! http://t.co/EMrkobes"
dropbox,A guide on how to get more free space with Dropbox! http://t.co/nIjwo0nM Retweet for a chance to get +100GB!
dropbox,Introducing Dropbox for Teams: The supercharged Dropbox your business has been waiting for! http://t.co/OTV308yU
dropbox,David Pogue &lt;3s Dropbox! http://t.co/opOpPsQw
dropbox,We've relaunched the Dropbox API! Go build some awesome stuff! http://t.co/WS8496zE
dropbox,RT @Forbes: Dropbox: The inside story of how founder Drew Houston turned down Steve Jobs to build the next big thing. http://t.co/xPj8dnb1
dropbox,"Dropbox is at #TwilioCon! We'll be handing out t-shirts and free space, and a 1TB prize at tonight's Hackathon! http://t.co/J9WHiCe3"
dropbox,We've updated our mobile web interface! http://t.co/tjdOPvD
dropbox,We're honored that the World Economic Forum has named us a WEF Technology Pioneer! Thanks for helping us get here! #WEF #TechPioneers
dropbox,"Read about some great uses for Dropbox at school, and double your referral credit if you're edu! http://t.co/yFGWzUr"
dropbox,Send @drewhouston (our CEO) to @SXSW! http://t.co/CobYHEH Any special things you want him to talk about? Tell us in the comments!
dropbox,Read about our amazing interns! http://t.co/wbljDQ4
dropbox,clarifying: whats yours is yours a TOS update - http://t.co/aSjkq3n
dropbox,an update on our TOS based on your feedback (make sure to scroll!) http://t.co/gQEqUMJ
dropbox,"RT @DropboxOps: Maintenance has started, and will last for about an hour. Thanks!"
dropbox,RT @DropboxOps: Reminder: We'll be starting our maintenance period in about an hour (12AM GMT). We expect this to last for about an hour.
dropbox,"RT @DropboxOps: We're moving data centers tomorrow, and expect about an hour of downtime 6/30 at 5PM PST (7/1, 12AM GMT). Thanks for you ..."
dropbox,http://blog.dropbox.com/?p=811 Got any awesome uses for Dropbox? Let us know at stories@dropbox.com
dropbox,".@ideaflight makes presentations awesome, and works great with
Dropbox! Check it out! http://bit.ly/jThLE1"
dropbox,We're really excited to announce our partnership with @softbank and @sonyericsson! Read more at our blog :) http://blog.dropbox.com/?p=804
dropbox,Hey everyone! Please help @dropbox become the top loved free service on the web by supporting us at http://www.catchfree.com #cfree
dropbox,"Woohoo! Hurra! ! Hourra! Dropbox is now available in French, German, Japanese, and Spanish: http://blog.dropbox.com/?p=709"
dropbox,Learn how people are working with Dropbox to help with the tsunami and earthquake in Japan: http://blog.dropbox.com/?p=697
dropbox,Dropbox is looking for amazing support engineers! Build stuff and help others between free meals and ping pong! http://bit.ly/gR3e0u
dropbox,Dropbox is chilling at #pycon this weekend! @timeserena will give a talk about the history of Dropbox this Saturday at 9AM! Don't miss it!
dropbox,"250K followers!! =O Thanks for all your love, Dropboxers!"
dropbox,"Oops! That email addy should stop bouncing now, sorry! D:"
dropbox,Hey students and teachers! How've you been using Dropbox to make this school year easier? Let us know at edu@dropbox.com!
dropbox,@picplz Oops! The two of us are too powerful for the internets! The link's pointing to Lifehacker now ;)
dropbox,Dropbox + @picplz = supereasy sharing of your mobile pictures on the web! How awesome is that? http://lifehac.kr/eQvOtV
dropbox,"RT @jon_y: My obliterated desk at the office, post Dropquest... http://dl.dropbox.com/u/211024/dropquestaftermath.JPG"
dropbox,Dropquest closes in less than 4 hours! Get to the choppa! http://blog.dropbox.com/?p=659
dropbox,Read about our first ever Dropquest! http://blog.dropbox.com/?p=659
dropbox,Oops sorry! The email address (dropquesters@dropbox.com) shouldn't bounce anymore. Thanks everyone!
dropbox,"Attention Dropquesters! We want pictures of your notes, desk, cranes and other Dropquest escapades! Send them to dropquesters@dropbox.com"
dropbox,Congrats Veronica for being Dropquest champion! RT @veronism: OMG. I AM THE FIRST PLACE WINNER!!! I LOVE @DROPBOX!
dropbox,The Inaugural Dropquest scavenger hunt is now live! Win free space and fantastic prizes for being smart! http://bit.ly/haPJB5
dropbox,5 hours until Dropquest! Hope you're warming up your thinking caps... ;)  http://bit.ly/dSglMT
dropbox,"Read about Dropbox's epic Hack Week! Also, a new chance to earn free space! http://blog.dropbox.com/?p=593"
dropbox,The highly anticipated Dropbox 1.0 is finally released and up for grabs! Read about its epic journey at http://blog.dropbox.com
dropbox,Happy Thanksgiving everyone! Make sure not to exceed your food quota! http://blog.dropbox.com/?p=577
dropbox,hi all! we're doing some short maintenance - should be back in a few minutes!
dropbox,We picked the winners of the RT contest: @TheDarkPower got 100GB PLUS @daddycubed @dakotaryan @HaiColon @davisd79 each got 50GB. Thanks all!
dropbox,Don't worry folks: we'll make international edu addresses work too
dropbox,"That's right, We're going to pick one person that retweets our last tweet about http://db.tt/edu and give them a 100GB capacity bonus"
dropbox,"hey students, we  u. Get 2X referral credit with a .edu email http://db.tt/edu plus retweet this for a chance at 100GB!!"
dropbox,We've got a new App Directory full of apps that'll turbocharge your Dropbox! http://www.dropbox.com/apps
dropbox,Oopsialmostforgot! One more thing!
dropbox,"And #3! Huge update for iPhone and iPad! New home screen, HD support, caching and more! Grab the new hotness here: http://bit.ly/38tJ6q"
dropbox,"Item #2! New release of the Android app! New photo galleries, multi-photo upload, and snazzier looks too! http://www.dropbox.com/android"
dropbox,"First off, Blackberry finally gets some Dropbox &lt;3! http://blog.dropbox.com/?p=555"
dropbox,This is gonna be nuts... y'all ready?
dropbox,Dropbox is hiring! Come check us out :-) http://blog.dropbox.com/?p=545
dropbox,Our Android app is getting lots of love! :) http://bit.ly/bhlwb0 http://bit.ly/dhjwhs
dropbox,Send our CEO to give a talk at #SXSW! http://blog.dropbox.com/?p=532
dropbox,I was mentioned in the Economist! How awesome is that? http://bit.ly/bQjWnQ
dropbox,blackberry beta is OUT... come help test. only a few hundred spots available: http://bit.ly/93gS5y
dropbox,iOS 3.1 users! Download Dropbox 1.2.5 from the App Store to fix those crash woes! http://bit.ly/cG87Cu
dropbox,We're looking for a tech support engineer in SF! Apply here: http://bit.ly/aFqWf2
dropbox,"Hai everyone! Meet Rajiv, Dropbox's server team all-star! http://blog.dropbox.com/?p=516"
dropbox,oh snap! link to any file or folder in your dropbox? that's crazy! http://bit.ly/coA6Iv
dropbox,"Updated Android app! http://bit.ly/d6quQQ New features, fixes and more :D"
dropbox,hi all - amazon s3 is currently having problems that may cause your dropbox to spin. we're told it should be resolved soon - sit tight!
dropbox,ohi! didn't you guys say you wanted selective sync?? http://bit.ly/ctj7Vu
dropbox,update to iphone/ipad app out - go get it! http://itunes.apple.com/us/app/dropbox/id327630330?mt=8
dropbox,"this is gonna be nuts. IPAD APP, ANDROID APP, and MOBILE API are finally  here!! http://blog.dropbox.com/?p=492"
dropbox,Vote me for best web app ever &lt;3! http://bit.ly/b0iFAr
dropbox,@Tumblr So you think you have me on the run?? This means war!
dropbox,there may or may not be a new mobile beta available for the first 500 users to visit the dropbox forums ;-)
dropbox,"New blog post about our move, feature progress, and more! http://bit.ly/du0Jfm"
dropbox,Hey everyone! We've been nominated for a Webby! Vote us for Best Web App! http://bit.ly/bBTbzx
dropbox,Just a reminder: today's the last day to submit your videos to win 500MB and maybe a free t-shirt! http://blog.dropbox.com/?p=359
dropbox,dropbox quota now 10GB(!) if you max out referrals - http://www.dropbox.com/referrals - get busy! :-)
dropbox,"new version of nautilus-dropbox (for ubuntu/fedora) hot off the presses :-)
http://forums.dropbox.com/topic.php?id=18389"
dropbox,Three words: DROPBOX ANDROID APP. Check out screenshots and details!! http://bit.ly/9lZTQf (PS: please digg us up!)
dropbox,It's our Digg Day 2 year anniversary! Win 500MB and a t-shirt! http://blog.dropbox.com/
dropbox,"Hey Dropbox iPhone users! There's a tiny update to the app, get it here: http://bit.ly/csBQ0x And if you really love us, rate us 5 stars!"
dropbox,Woo! Dropbox App 1.1 for iPhone is now up for grabs in the app store!  Go get it!  http://bit.ly/csBQ0x
dropbox,Use Quickoffice to edit docs in your Dropbox straight from your iPhone!  So cool.  http://bit.ly/WGfeN
dropbox,"We need a tech support guru! Halp Dropbox by halping others! http://bit.ly/9jnXrX  Awesome SF location, free lunches and more!"
dropbox,We're aware of the outage and are working toward a fix. View up to the minute updates and progress at @dropboxops
dropbox,Looks like the Dropbox #iPad app needs a suggestion on #votebox :P http://www.dropbox.com/votebox
dropbox,"New blog post! http://blog.dropbox.com New Year's resolutions from the team, #dropboxshirt winners, and more!"
dropbox,#dropboxshirt winners announced in 5 hours! thanks to everyone for entering &lt;3
dropbox,Just a reminder!  Today's the last day for our t-shirt giveaway! http://blog.dropbox.com Just tweet #dropboxshirt to enter!
dropbox,"Dropbox t-shirt giveaway! http://blog.dropbox.com For a chance to win, tweet #dropboxshirt"
dropbox,nominated for best productivity iphone app ever *blushes*. help me win? http://bit.ly/6v9umB
dropbox,everything should be back to normal. sorry again &lt;3
dropbox,sorry we're down! our hosting provider is having some issues and we're working on getting it resolved ASAP.
dropbox,We've been nominated! Vote us Best Internet App of 2009! http://bit.ly/4mZzqr #crunchies
dropbox,New build available!  New blog post too!  http://blog.dropbox.com/?p=257
dropbox,"New stable build released!  LAN sync, memory improvements and more! http://bit.ly/8KoCQM"
dropbox,New 'meet the team' blog post!  http://blog.dropbox.com
dropbox,All back now - sorry again :(
dropbox,Our hosting provider is experiencing small hiccups in service and we're investigating. Updates to follow. Sorry again!
dropbox,Our datacenter and Dropbox will be down for ~15 minutes of router maintenance tonight between 8-9AM GMT (12-1AM PST). See you afterwards! :D
dropbox,I'm Lifehacker's #4 app they're most thankful for! http://bit.ly/8730JQ *blush* Happy Turkey day!  Make sure not to exceed your food quota!
dropbox,"UPDATE:  Phew, everything seems fine now. Sorry again for all this :("
dropbox,We are aware of the outage and are working on it. Sorry for the hassle.
dropbox,We're looking for testers for our upcoming Paypal support!  http://bit.ly/NmpQr
dropbox,Nominate us for Best Internet Application of 2009!  http://crunchies2009.techcrunch.com/vote/?MTpEcm9wYm94 #crunchies
dropbox,Vote on Dropbox's next hot feature with Votebox!  http://dropbox.com/votebox
dropbox,"Blog post:  Some new web goodes: uploader, recent events improvements, and Votebox!  http://blog.dropbox.com"
dropbox,"Having trouble reaching the right folks @ Google re: browser warnings; email abuse@dropbox.com to help, thanks (pls RT! :))"
dropbox,IMPORTANT: Dropbox has not been hacked or exploited; working with Google urgently to resolve false browser warnings.
dropbox,"Just finished moving into my new home! http://dropbox.com  Ahh, home sweet home =D"
dropbox,Dropbox is to Ubuntu as eucalyptus is to koalas!  New blog post:  http://blog.getdropbox.com/?p=166
dropbox,Want a job at Dropbox?  We're hiring!  http://dropbox.com/jobs
dropbox,"my iphone app, now 3.0 friendly! =D http://www.getdropbox.com/iphoneapp"
dropbox,"http://dropbox.com  Go ahead, try it... IT WORKS!! :D"
dropbox,"One more present for y'all!  New mobile-optimized web interface:  http://m.getdropbox.com  Don't worry, more native apps on the way :)"
dropbox,thanks @commoncraft for an awesome video explaining what Dropbox is http://tinyurl.com/6lgzuk - let us (and them!) know what you think ;)
dropbox,"New blog post!  Lots of updates (snow leopard, new video, 2 million users):   http://blog.getdropbox.com/"
dropbox,Like my new 'about us' page? :D  https://www.getdropbox.com/about
dropbox,seems like most of you are eating... what's for breakfast/lunch/dinner? :D
dropbox,"Oops, my bad!  I meant, what's up, late night/early lunch Dropboxers?  :P"
dropbox,"what's up, late night Dropboxers? ;)"
dropbox,sorry about the slow speeds this morning :(.  our provider was having a few issues but everything should be fine now.
dropbox,iPhone app released! Digg us up! http://digg.com/d315uuV RT this too!
dropbox,OMG!!! THE DROPBOX IPHONE APP IS OUT!!!  &lt;3&lt;3 http://blog.getdropbox.com
dropbox,I have 2 million users and just turned 1 year old!  http://tinyurl.com/ycynnco  Happy birthday to meee :D
dropbox,Super spontaneous giveaway on my facebook page!  Win some shwag!  http://facebook.com/dropbox
dropbox,still waiting on apple to approve my #iphone app :(. crossing fingers for next week!
dropbox,my hosting provider is doing network maintenance. I'll be back in about 15 minutes!
dropbox,everything should be ok now! sorry again for the problems :(
dropbox,experiencing upload problems and working with our service provider to resolve it ASAP. very sorry for the inconvenience.
