greysonchance,Philippines fans! Today @ 4pm celebrate Truth Be Told pt.1 @ Trinoma! Come by + even though I am not physically there I am there in spirit(:
greysonchance,RT @novyonggg: Yeaah #Enchancers #Greysonators RT @greysonchance: We did it #Enchancers and #Greysonators now lets be the #1 trending Wo ...
greysonchance,RT @xbeaherrera: @greysonchance #Enchancers and #greysonators are the most supportive fans ever! 
greysonchance,RT @GreysonBaby95: @greysonchance We are By Greyson's Side &lt;333 #Enchancers and #Greysonators
greysonchance,RT @mozerlinda: #Enchancers and #Greysonators @greysonchance 7
greysonchance,We did it #Enchancers and #Greysonators now lets be the #1 trending Worldwide!!!! Come on we can do it!!!
greysonchance,I Love my fans so much!!! Come on let the world know we're the best!!! #Enchancers and #Greysonators
greysonchance,RT @GreysonCisLife: @greysonchance Let's trend By Greysons Side! RT Greyson please?! #Enchancer #Greysonator forever
greysonchance,Happy Bday!! (: RT @iheartSIO @greysonchance Today's my birthday and I'm hoping you can tweet and follow me as a birth http://t.co/S9AMUfDH
greysonchance,RT @Ronalfores: RT @greysonchance: Time to show whose fans are the best!!! Time to TREND Let's Go #Enchancers and #Greysonators
greysonchance,RT @KerriGleeClub: @greysonchance #GREYSONATOR UNTIL THE END OF TIME&lt;3
greysonchance,"RT @WulanMey: ""@greysonchance: Time to show whose fans are the best!!! Time to TREND Let's Go #Enchancers and #Greysonators"""
greysonchance,Time to show whose fans are the best!!! Time to TREND Let's Go #Enchancers and #Greysonators
greysonchance,RT @HelenaCabrera23: We should trend something for @GreysonChance!! Any ideas? (:
greysonchance,A little sad because this is my last day in the studio for a while..But as long as I have my fans I will always be good..who's with me? (:
greysonchance,"I can't wait for you guys to hear the new music!
 http://t.co/HqT8z5He"
greysonchance,"Studio! One of my favorite songs I have done today. Coming soon I promise!!
 http://t.co/i1UUoyHC"
greysonchance,"Nighttime school session! Ordering pizza and learning about nouns, fun!"
greysonchance,Busy busy and looooong day. Goodnight world! I will be dreaming hard tonight :x
greysonchance,I am getting ready for some shows here soon! Just started rehearsing today. Good to be back...
greysonchance,"Don't forget, guys.  I'll be hanging out in http://t.co/DC63PFyK tonight @ 8pm EST. Come check it out!(: http://t.co/9YQuBqrH"
greysonchance,"Bite the bullet extreme! Ahhh!
 http://t.co/oa9cnNcB"
greysonchance,Booo it's Monday! Cheers to being tired all day and looking forward to Friday... #haveagoodday
greysonchance,I am getting really excited for @justinbieber's new single Boyfriend. Can't wait to hear the new sound!
greysonchance,Korean BBQ time! #yes http://t.co/mJJ8ReoL
greysonchance,Can't wait to return to http://t.co/DC63PFyK on Tuesday March 27 @ 8pm EST. Come hang with me!(: http://t.co/9YQuBqrH
greysonchance,Excited to announce the winners of my @EverloopConnect contest: http://t.co/rtmK9b9r Login to see all the photos and join the next contest!
greysonchance,"When you are feeling like you need to twist and shout, here's some blues music to do the trick (: enjoy: http://t.co/zWamSHy6"
greysonchance,Poolside today! #studio #funsocks http://t.co/hU79coU1
greysonchance,Today is #worldwaterday and I'm excited to give up my next birthday for @charitywater. You guys should too! http://t.co/OCAqOcQt
greysonchance,ALL LOS ANGELES CITIZENS help support me and @TobyGad create this beautiful plaza/park in Studio City. Sign now!  http://t.co/pDahPbVY
greysonchance,I've been thinking a lot about documentaries and short films lately...
greysonchance,Last day to win a skype call with me! Head to my @EverloopConnect page to enter. http://t.co/B7ls1Vt2
greysonchance,I love all of your guy's song options. Send me more! I will post more tomorrow. Goodnight (:
greysonchance,@Anas_Sheridan That song is so inspiring. I really love it!
greysonchance,RT @Anas_Sheridan: @greysonchance Skyscraper !
greysonchance,@gtfokatya I LOVE ED SHEERAN! Favorite new artist.
greysonchance,@Horselover260 Love this song! That was my summer jam.
greysonchance,RT @Horselover260: @greysonchance Pumped Up Kicks by Foster The People!! &lt;3
greysonchance,"@aditscostick Maybe one of my favorite Gaga's songs...besides Paparazzi, of course!"
greysonchance,RT @aditscostick: @greysonchance Marry The Night please!
greysonchance,@KayleyHamilton I love that song! Great idea. Beatles are my favorite.
greysonchance,RT @KayleyHamilton: @greysonchance you should cover I Want To Hold Your Hand by The Beatles!!
greysonchance,I'm working on the set list for next month's tour! I'm thinking about doing some new cover songs. What songs should I cover? Let me know(:
greysonchance,Starting the day off right! Coffee and frank. #NP Something Stupid by Frank Sinatra
greysonchance,Taking a quick field trip from school! Hello beach (: http://t.co/QsrszRId
greysonchance,Very boring and uneventful weekend...sometimes it is good to be lazy. Agree? #lazysaturday
greysonchance,I got MY start on a social network &amp; now I want to see what talents my awesome fans have!(: Hang with me on @EverloopConnect!
greysonchance,Been spending time on @ChillLive making a collection of fan vid. Check it out &amp; tweet me links to others I should add! http://t.co/UYS2dkyN
greysonchance,Starting to design the stage for my Asia tour! Can't wait to come back! Did u get ur tix? http://t.co/hKrEvPl3
greysonchance,"One of my favorite rappers. So sad he is gone, such a great album though! Enjoy. http://t.co/oNKkcpeI"
greysonchance,"Learning about Spanish with @Tyreljwill 
Just learned that ""De Nada"" means ""You're welcome"" Wow I need some help in this class..."
greysonchance,RT @Nas: @greysonchance I'm headed to Austin little bro!... Whaddup!
greysonchance,In the booth feeling like @nas tonight. Where are you man?!
greysonchance,"Why is every tv show today about zombies? What, are we all going to turn into blood eating killers? #random #thoughts"
greysonchance,Love getting e-mails with new music attached. Can't wait for this album!!! #excited #determined
greysonchance,RT @Nisa_chanceP: @greysonchance I Love Yooouuuuu please follow or notice me :)
greysonchance,RT @lalalamaryxx: 1 away from 500 followers. im happy that @greysonchance is one of them. &lt;3 c:
greysonchance,"RT @ImaFool4Greyson: Going sleep, tired. Lol bye. Keeping shining @greysonchance Enchancing until the end.&lt;3 make my night and retwee ..."
greysonchance,RT @TheChanceIsMine: @greysonchance you make me head over heels!!!!!!! Love you soooo much!!!!! xx
greysonchance,"Love all these songs you guys have sent me on Spotify! Here are my favorites (:
http://t.co/IqLORpps"
greysonchance,We lost control!! =best lyric ever. #studio
greysonchance,Im so excited to be a part of Everloop! Members can join my loop where Ill have some special contests. Check it out! http://t.co/9jMScMdL
greysonchance,"Love this album! Ed Sheeran is one of my favorites. Check it out. My fave songs are ""The A Team"" &amp; ""Small Bump"" Enjoy! http://t.co/stFBJJst"
greysonchance,1.7 M! Ahhh! We have grown so much... #thankful
greysonchance,You know that feeling when you watch a movie and you are totally moved by it? I love that feeling...
greysonchance,Getting so excited for my shows in Asia! They are coming up soon...got your tickets yet? (:
greysonchance,Got these free McDonald's cards. Too bad I gave up fried food for lent. Boo! #imissfries http://t.co/3i10Itjd
greysonchance,#studiotime
greysonchance,Doing school...and my tutor suggested watching Pixar short films in between lessons. Best teacher ever!!!
greysonchance,"Proud to be part of @EverloopConnect! Cool, new social media site just for kids. Check out my loop: http://t.co/CAPi5YUN"
greysonchance,Heartbroken by this video I saw on YouTube. Stop Kony!!!
greysonchance,Everyone go check out my good friend @theallisimpson's new website http://t.co/mNftWldx it looks amazing already!!
greysonchance,Big day today...wish me luck!
greysonchance,RT @ETonlineAlert: EXCLUSIVE: Greyson Chance's Tribute to Frank Sinatra http://t.co/ydOCLfc4
greysonchance,"Beautiful sunset by the beach. So pretty!!! Don't you think?
 http://t.co/MIkU0qlt"
greysonchance,Oh no Spreecast didn't work so well today. Promise I will do it again this week! See you guys then (:
greysonchance,Happy Monday! Thought I'd brighten up your day with a spreecast chat! Logon @ 3:30PM PST today to chat with me LIVE!(: http://t.co/p54f0KQT
greysonchance,"Swinging in the backyard, pull up in your fast car. #NP Video Games by Lana Del Rey"
greysonchance,"Some people ask what I do in my free time? Star Wars marathon of course! #still14
 http://t.co/mEzNynxz"
greysonchance,RT @1Dmakeyoumine: @greysonchance we love youuuu!
greysonchance,RT @ThanksGreyson: @greysonchance We Love Greyson &lt;3&lt;
greysonchance,RT @Halolovesbtr: @greysonchance dang you got a lot of followers #congrats
greysonchance,RT @TamikaSullivan: @greysonchance congrats :D
greysonchance,"RT @IFancyGreyson: @Greysonchance , the day you reach 2 million , I might cry. We fans love you &lt;3"
greysonchance,"RT @T_S84: @greysonchance  That's awesome:) Congrats, and, you truly deserve each and every one of those followers:)"
greysonchance,RT @lainewillenborg: @greysonchance we all love you #insperation
greysonchance,Thank you to all the fans!
greysonchance,Got on Twitter and realized I had 1.6 M followers today! Ahhhh so crazy. I remember when I only had 100K Wow... #memories #thankful
greysonchance,@michaelawarren aren't we supposed to be writing songs?? #studiolife http://t.co/7BOFsX0L
greysonchance,There's still time to get your questions in to @m_magazine! I'll be taking over their Twitter TODAY at 5pm EST! #GreysonMMag
greysonchance,Do you want to say goodbye? #studio http://t.co/u6KTWWig
greysonchance,I just got out of the studio with my good friend Ariana Grande! It was so great to be writing music with... http://t.co/UCaSlJTb
greysonchance,Who's coming to hang with me @Woozworld today?  See you there at 4:30 PM PST/7:30 PM EST! http://t.co/5XDwqhNU
greysonchance,Don't forget to follow @m_magazine & send in your questions for me! I'll be taking over their Twitter tomorrow at 5pm EST! #GreysonMMag
greysonchance,Proud to call myself a member of this charity. Join now! http://t.co/FXy1ie1S RT and tell all your friends!!!
greysonchance,Don't you worry. I will never grow up. #youngforever RT @_Amyhighlight @greysonchance Dont grow too fast either :')
greysonchance,Come and hang out with me @Woozworld tomorrow at 4:30 PM PST/7:30 PM EST!(:  http://t.co/5XDwqhNU
greysonchance,I'm taking over @m_magazine's Twitter on Friday at 5pm EST. Start following them so I can answer your questions! #GreysonMMag
greysonchance,"Sorry ladies I got myself a new girlfriend (: #puppylove literally.
 http://t.co/2l5CbjsV"
greysonchance,Leap Day is such a random holiday. But I guess I should be kind and say...#HappyLeapDay
greysonchance,@ArianaGrande such a great two days! Can't wait for the fans to hear this one... #oldschool
greysonchance,#NP- Me and Mr. Jones by Amy Winehouse. Good way to start the day!
greysonchance,"""I want to thank Chris Brown!"" - @ArianaGrande What?! #RANDOM"
greysonchance,"Congrats to the winner of the Find Your Voice contest from @MusicArts, Evan J! Can't wait to hang! https://t.co/u6sCJ7CH"
greysonchance,In the studio with @ArianaGrande today! So excited..can't wait to see my little redhead again!!
greysonchance,#MoviesWereBestWhen all you wished for was that Anakin Skywalker would go back to the good side of the force.
greysonchance,Doing science homework right now...probably my least favorite subject. I miss math! What is a proton?
greysonchance,Tonight is Oscar night! Rooting for my friend @chloegmoretz's movie Hugo..#oscars
greysonchance,JFK ---&gt; LAX #backtothebeach
greysonchance,"Malaysia, Singapore, Indonesia, & Philippines! Have u bought ur tickets for my headlining shows yet? Ticket info: http://t.co/hKrEvPl3"
greysonchance,"To my fans in Taiwan! My Special Asia Edition of #HOTTN is out today! For more details on what's included, go here http://t.co/irfxjHhX"
greysonchance,Went to Joanne tonight in NYC! Thanks to @chefartsmith what a great dinner! http://t.co/CqRbqH9b
greysonchance,Check out an interview I did with @ClevverTV on @THR! http://t.co/K6ZYYWnl
greysonchance,RT @karinaalifia: @greysonchance OI I CANT STOP LAUGHING HAHAHAHAHAHAHAHA
greysonchance,RT @GreysonCookies: @greysonchance HAHAHHA BEARDDDDDDD. :D
greysonchance,RT @BeckyChance: @greysonchance OMG you looked funny!!!!! lol........ Love you Greyson!!! (:
greysonchance,RT @enchancer_uk: thought @greysonchance retweeted me for a minute): x
greysonchance,Oh my God what happened! Puberty really hit quick... http://t.co/wBLWDM6z
greysonchance,Favorite city in the world...#newyork http://t.co/Q2MSUR34
greysonchance,Platinum in Indonesia! - Just got the word that Hold On Til The Night went platinum in Indonesia! So... http://t.co/TqzfSRMr
greysonchance,"Designing a new stage plot for upcoming shows. I promise it is not just for Asia though, I will be using my stage for the US too..(:"
greysonchance,Wow this is so sweet! Thank you everyone! (: @abi_kropp Greyson Say Yes To Latinas @greysonchance
greysonchance,Just arrived in NYC! So excited to see my friends at @blackberry again. I love New York City!! http://t.co/WAn3rDDp
greysonchance,OKC ---&gt; JFK #nyc
greysonchance,"#NP Human Nature by Michael Jackson  ""Why Why? Tell him that it's Human Nature!"" http://t.co/N5puEKzK"
greysonchance,Test day is today! Forgot how much I hate these things...#getmeout
greysonchance,I miss NYC too. I hope to live there one day! #empirestateofmind RT @MyICONicDream New York misses you.
greysonchance,I would love to. Always one of my favorite places to go. @luv4codygreyson hey. you youre amazing. I think you should come to wisconsin soon.
greysonchance,I would love to! What would you like? (: hahah RT @justtext143 @greysonchance COOK FOR ME BABE
greysonchance,RT @CamilChance: @greysonchance My favorite song!! ;-) http://t.co/Jc2tc8uA
greysonchance,"For those of you who don't know...I am an excellent cook. And if I wasn't a musician, I would hope to be on the food channel. #icook #random"
greysonchance,Slowly falling in love with @LanaDelRey Such a different + futuristic sound. Love the music! What do you guys think?
greysonchance,Had to come back to OKC to take my state federal school tests. See I am still a normal kid..well sometimes (: #bootests
greysonchance,Nothing better then a copy of Spin Magazine for the plane. Love their list of best albums in 2011. http://t.co/CPj4TEO8
greysonchance,"Philippines! Come get #HOTTN at the fan party at @Astroplus tomorrow! 
http://t.co/LrOx0zwQ"
greysonchance,Korea and Thailand! My Special Asia Edition of #HOTTN has been released! Have you bought your copy yet? http://t.co/irfxjHhX
greysonchance,Back in Young Jimmy's world. My hair makes me look like I am a legoman ...#raisinghope http://t.co/qBSsqUWW
greysonchance,Waiting! Just waiting! Haha very sweet RT @monica_debieber: Just Waiting Outside The Lines for @greysonchance Ain't I Sweet *---* LOL.
greysonchance,I will see you there at 4(:RT @liaenchancers: @greysonchance concert ticket show that 'doors open at 7pm' and i will 'come at 3/4pm' cool 8)
greysonchance,To all my Asian fans! Have you bought your tickets for my headlining shows yet?? Details & ticket info here: http://t.co/hKrEvPl3
greysonchance,Hong Kong fans! My Special Asia Edition of #HOTTN is now out in your city! More details: http://t.co/irfxjHhX
greysonchance,Had a meeting at the record label discussing + playing new music. Coming very soon everyone...! Don't tell anyone I told you this..(;
greysonchance,Hope u're by ur computers b/c I want 2 wish you all a Happy Valentine's Day! I'll be chatting live on spreecast @ 4PST http://t.co/0ZZmT8V2
greysonchance,Taking dating advice from a 10 year old. He is teaching me things I didn't even know! Haha #younglove
greysonchance,Happy Valentines Day everyone (:
greysonchance,E is even more then anyone that you adore
greysonchance,V is very very extraordinary
greysonchance,O is for the only one I see
greysonchance,L is for the way you look at me!
greysonchance,"Happy Valentine's Day, everyone! To celebrate, here's a new @Spotify Valentine's Day playlist I made! http://t.co/cN9xGK0D"
greysonchance,To all of my fans in the Philippines! My Special Asia Edition of #HOTTN is now out! See what's included here: http://t.co/F98N2j0e
greysonchance,http://t.co/IImoPTPk What a great video! Happy Valentines Day to you too. Don't have a valentine this year.. But all of you guys are mine (:
greysonchance,Train inspires me so much as a songwriter. Their lyrics are incredible and motivating..#dropsofjupiter
greysonchance,The entries are in for the Find Your Voice contest from @MusicArts. Need you to vote to help choose the winner! http://t.co/olz7217L
greysonchance,Still can't believe how great the performances were last night! Thank you guys for watching with me (: #GRAMMYS
greysonchance,Holoscene was one of my favorite songs of the year. Go Bon Iver! #GRAMMYS
greysonchance,Best performance of the night by far. Great job Adele! #GRAMMYS
greysonchance,ADELE! #GRAMMYS Yes and she is singing Rolling In The Deep. My favorite.
greysonchance,Yeah T-Swift! #GRAMMYS Love the banjo..
greysonchance,If I am still doing music when I am older...I dream to be like Paul. #GRAMMYS
greysonchance,Beach Boys = Relaxation #GRAMMYS
greysonchance,Lets go Radiohead...! #GRAMMYS
greysonchance,Too many commercials! Boo! #GRAMMYS
greysonchance,A dream of Para-Paradise! What a great lyric..why Coldplay is my favorite band. #GRAMMYS
greysonchance,Here we goooo! #rihanna #GRAMMYS
greysonchance,"I agree! That one was so good. I really liked the gold tux #GRAMMYS RT @TheEmilyCedeno @greysonchance Bruno Mars, it was insane! :)"
greysonchance,What do you guys think of the show so far? What has been your favorite performance? #GRAMMYS
greysonchance,Let's go OTIS! #GRAMMYS
greysonchance,"Someone Like You! So proud of Adele, can't wait to see her perform. #GRAMMYS"
greysonchance,Alicia Keys + a Wurly = Perfection...wow. #GRAMMYS
greysonchance,YES! I am loving this soul + funk vibe with Bruno right now. Well done! #GRAMMYS
greysonchance,"One of the best songs written in history ""I Will Always Love You"" #GRAMMYS"
greysonchance,Here we go Bruce! #GRAMMYS
greysonchance,Only 30 more minutes til the Grammys. Man I am excited to see Coldplay! What about you guys? #GRAMMYS
greysonchance,"Only thirty more minutes til the Grammys. Man I am excited to see Coldplay, what about you guys? #GRAMMYS"
greysonchance,"Will be ""couch commentator"" tonight. So...who wants to watch the Grammys with me tonight? (: haha   #GRAMMYS"
greysonchance,RIP Whitney Houston. So devastating..she was a true performer. #Legend
greysonchance,"Kicking my feet up and watching Austin Powers, yay off time! Now time to grab some potato chips... http://t.co/eBr3blUK"
greysonchance,This is amazing! @odysseylive Thank you so much to everyone who showed up (: Hope you enjoy it!
greysonchance,RT @odysseylive: Hey @greysonchance! Check out the GREYSONATORS gathered here in Odyssey Megamall for your launch! http://t.co/yeAihgbb
greysonchance,"RT @Interscope: Follow @TwitterMusic, @SkylarGrey, @GreysonChance, & @PiaToscano for live #GRAMMYs commentary - http://t.co/3pp8J37x"
greysonchance,RT @TwitterMusic: Here's our official #GRAMMYS couch commentator list so you can follow the conversation easily! https://t.co/TtFSLhr6
greysonchance,To my Philippines fans! Come get #HOTTN early at Odyssey Megamall today! http://t.co/q81tTdy8
greysonchance,Purple Skies and Palm Trees..#LA http://t.co/o3mMeb71
greysonchance,Kissing the ground right now! So excited to be back in the USA. Right now I am loving sunny LA
greysonchance,Tickets are now on sale for my headlining tour in Asia! I can't wait to go back! Details & ticket info here: http://t.co/hKrEvPl3
greysonchance,Don't miss this guys!  Today only save up to 25% off your entire order at my official webstore! http://t.co/5Sm73po6
greysonchance,Back to the US tomorrow. Going to miss England but excited to go back to LA. Have a lot of stuff coming up soon.. (:
greysonchance,Wait they have Papa Johns in England? YES! #lunchtime Anyone wanna have some pizza? (:
greysonchance,Malaysian fans! My Special Asia Edition of #HOTTN is out today in Malaysia!  See what's included here: http://t.co/irfxjHhX
greysonchance,So excited to announce my first headlining tour in Asia! Get all of the details here: http://t.co/hKrEvPl3
greysonchance,Looks like I might be seeing my celebrity + socially awkward parents here pretty soon? @GarretDillahunt @MarthaPlimpton Oh yeah...!
greysonchance,Best TT ever! Love you all (: RT @GreysonMySwag: @Greysonchance Spread The Greygrey Love
greysonchance,@Nandos_Official yay! I cannot wait for the High Kensington St. location. #periperi
greysonchance,Photo: I arrived in London last Monday! I was super excited to be able to come back to England and spend... http://t.co/XAjoHQDS
greysonchance,"I love this movie & I love the soundtrack even more! The Temper Trap, Regina Spektor, Feist... So good! http://t.co/Ff95glpM"
greysonchance,Nothing better then an old whistling piano! #vintage http://t.co/0pLrx3Iq
greysonchance,Indonesia & Singapore! My Special Asia Edition of #HOTTN is out today!  Check out what's included here: http://t.co/irfxjHhX
greysonchance,I'm going for New England...sorry New York...:/ #superbowl
greysonchance,Today is the superbowl! Too bad I can't watch it over here...who are you guys rooting for?
greysonchance,First time to the English Countryside. It is beautiful here! I love this snow. #beautiful http://t.co/Jc8nY8nZ
greysonchance,"To my Asian fans! Don't forget about the TV premiere of my video ""Take A Look At Me Now"" tonight @ 8PM HK/7PM SEA on Channel V & on Myx TV!"
greysonchance,"Video: For those of you who dont know, Im hosting a contest with the help of Music & Arts. The contest is... http://t.co/0kBiLPX1"
greysonchance,"Music Sounds Better With Snow = true. Listening to Adele while it's snowing outside, so much better then when it is sunny. Dont you agree?"
greysonchance,Hailing cabs in the snow...always a fun time #winterlondon http://t.co/PFnykXIL
greysonchance,Favorite London Restaurant..Nando's! #periperi http://t.co/WH8WFexe
greysonchance,"Going sightseeing today in London! Also, having tea with the queen...just kidding... (:"
greysonchance,What a great song...I feel inspired every time I listen to this. Her name is LP! http://t.co/r1Dwxlqf
greysonchance,Is it weird that I love the sitcom Friends? I say not... #bestshowever
greysonchance,Nothing but double decker buses! Love it here... http://t.co/qAEeRqoK
greysonchance,RT @PermataFista: Gotta sleep now. Good night! Emmm good morning! @greysonchance #timedifference
greysonchance,RT @annemarieeeK: @greysonchance I would be better if you tweeted me:)
greysonchance,RT @IndahShawty: @greysonchance i've been waited for you to get online since yesterday. Because yesterday was my birthday :'( 16
greysonchance,Oh wow I haven't tweeted all day! Shame on me..how is everyone doing? (:
greysonchance,Man England is quite dreary and depressing with the rain and the cold...but I love it!  #songwritingweather
greysonchance,"To all my fans in Asia! Don't miss the premiere of ""Take A Look At Me Now"" Feb 5th @ 8PM HK-SG/7PM SEA on @channelVHD http://t.co/XLTH1dOV"
greysonchance,Arrived in England! Went to my favorite London restaurant called Wagamama. Now finally going to sleep...thank God! Goodnight (:
greysonchance,Goodbye USA...hello England!
greysonchance,My dad and I's goal for London..making the guards at Buckingham Palace laugh. Any good jokes?
greysonchance,Ready for the show! Heard there is a huge line outside..#letsgo
greysonchance,Reunited and it feels so good! @haydenmaringer @hitsnapclap #showtime
greysonchance,Just arrived at the venue...sound checking soon..so excited to be performing again! Can't wait to see the fans.
greysonchance,Had a great time with you at the hospital! @PlanetLainy Everyone go support #OperationPurpleSky
greysonchance,Going to be surprising a fan tomorrow. She has flown a long ways away...hope she enjoys it!
greysonchance,Feels good to be back in OKC. Super excited about the show tomorrow! We are going to raise a lot of money. #charity
greysonchance,Early morning flight...was very tired and unhappy til I saw this trending. #GreysonIsOurHero very sweet of you all (: I love my morning gift
greysonchance,School all day..Yay algebra!!! #formulasarekillingme
greysonchance,Happy Birthday to my favorite person in the world @TheEllenShow hope you have a good one (:
greysonchance,"Launched my Google+ profile today, and I recorded a welcome video for you guys! Check it out and add me to your circles http://t.co/hnJh4BXj"
greysonchance,Photo: I know that it is two years away..but I am sure most of you are doing the same thing that I am.... http://t.co/K63xV7AZ
greysonchance,I'm in woozworld now!  Come hang with me! http://t.co/hvXdHT5g
greysonchance,Recording in the same studio that MJ recorded Thriller. Wow. #history
greysonchance,People ask what I am inspired by. The answer is..80's movies about clowns. Why do we watch this? http://t.co/DH8sbJ3h
greysonchance,Lets go! Rolling Stones... @greysonisAgift Camden town&share your headphones with someone while listening to the Kinks & rolling stones! (:
