greysonchance,Philippines fans! Today @ 4pm celebrate Truth Be Told pt.1 @ Trinoma! Come by + even though I am not physically there I am there in spirit(:
greysonchance,"@TheMasonCook I just saw your Nissan commercial. Keep it coming buddy! Represent the OKC dream, and always listen to your mom."
greysonchance,"My MTV sessions aired!! Ahhh I am so excited! In the Dallas airport, trying to watch footage online. Thank you MTV for letting be me."
greysonchance,I'm going to be hanging out in Woozworld today at 7:15pm EST. Come chat with me! http://t.co/Q1IohA8F
greysonchance,Happy Holidays! From whiskey and I. http://t.co/uml5yEy3
greysonchance,"I cannot wait for my MTV sessions to air!! Coming on the 1st, who's excited? #truthbetoldforMTV"
greysonchance,Wanna sing #scl with me? Try it here on Audish! (This is the coolest thing ever!!) http://t.co/0JJiTJwy
greysonchance,"I am perfectly capable to make my own decisions. Kids stick up for yourselves! Listen to parents, stay in school, and conquer the world."
greysonchance,Don't you hate it when people treat you useless children just because they are twice your age? I do.
greysonchance,He's chewing them up and then forcing me to get the broom and clean it up. Whiskey! It's on!!!
greysonchance,"TRUE STORY: While watching the Thunder game, whiskey has brought maybe 10 pine cones inside. Why did we get that doggie door again?!"
greysonchance,"Check out my cover of Gnarls Barkley's ""Crazy"" live at MTV Sessions in Asia. Love this song!
http://t.co/ThLshl83"
greysonchance,"I just saw the final edit for this weeks @awesomenesstv episode! Hint hint this week, it starts with an L. It's so good!!!!! #truthbetold"
greysonchance,@Bailey4Greyson I got your letter sweetheart. Thank you for the thought (:
greysonchance,"If you missed the Black Friday special, my webstore is also having Cyber Monday deals! http://t.co/3qdsfBD2"
greysonchance,Fans are already ripping video footage of the MTV Sessions performances and it hasn't even aired! You little sneaks (; I love you bad kids
greysonchance,"One month until Christmas! Truth Be Told, it's my favorite holiday. #happyholidays http://t.co/vCGPYxxW"
greysonchance,"Here is video 2 of 5!  My live performance of ""Sunshine &amp; City Lights"".  Watch now: http://t.co/aRtagMqJ"
greysonchance,My webstore is having a Black Friday sale! Check it out: http://t.co/3qdsfBD2
greysonchance,Happy Thanksgiving everyone! Enjoy your turkey and stuffing. I know I will. #turkeyday
greysonchance,Another shot of me and New York. http://t.co/vQUMGJao http://t.co/bNlnlIXF
greysonchance,My cats have been getting jealous of the attention whiskey is getting. Sorry kitties #jealousy http://t.co/RrRbIsUm
greysonchance,"After a long day, enjoy some of my favorite songs for unwinding, all on Songza!
http://t.co/QtJX2YQl"
greysonchance,Truth Be Told part 1 is now available on Spotify! Never thought this day would come. Enjoy it!! http://t.co/JomUaQoi
greysonchance,Video 1 of 5! These are all 100% live performances in random beautiful locations. Enjoy!! http://t.co/kUZDY92V
greysonchance,Look who said hello (: http://t.co/S3rkmxpc
greysonchance,Hahaha! RT @YohGreyson: Last night @greysonchance and I were sneaking out of my house..then I woke up #Bejealous
greysonchance,Yay! I am so glad you like it. I have never done anything like it! RT @sassygreyson:  SCL video is by far your best video.
greysonchance,Yes they will! RT @alia_zayn: Sunshine And City Lights Will Guide You Home ! @greysonchance
greysonchance,"Hunt them down!! RT @gweysun: http://t.co/Q4PHdrNl &gt; your existense. if you haven't watched it yet, im hunting you down."
greysonchance,Thank you! RT @NiischaRaheja: Greyson Chance - Sunshine &amp; City Light love this song! It's gonna be on replay!!  http://t.co/ll8RHjjR
greysonchance,RT @whoskarina: WATCH NOW!! Sunshine &amp; City Lights by Greyson Chance ( @greysonchance ) http://t.co/8Fq1xvwM  (;
greysonchance,"You're not, I don't have a kik! it's a fake RT @GreyGreyLoves: I can't believe that I'm chatting @greysonchance in KIK #fangirlingmodeON"
greysonchance,Met Colby today at @stjude He was very brave and strong. See you soon buddy!! http://t.co/hjZAS4VU
greysonchance,Going to visit my friends down at St. Jude's charity walk in Pittsburgh before I leave! Thanks guy for a great trip. #truthbetoldinPA
greysonchance,#sclvideo give it a view if you haven't already! http://t.co/ZkemY4Qw
greysonchance,Goodnight! #truthbetoldinPA
greysonchance,Pittsburgh thank you for a great night! I loved seeing some familiar faces; I have missed them. Also thanks to CBS radio for their support.
greysonchance,Santa caught me backstage! #naughtylist http://t.co/V7kAAHK0
greysonchance,@bubbasugly thank u so much for your support! I love coming to Pittsburgh. See you soon! P.s you make a good ms. Clause http://t.co/wc3D2gzT
greysonchance,"Since there wasn't a meet and greet after the show, I wanted to say a quick hello to some fans before the show! I'll be at the booth in 30."
greysonchance,RT @VEVO: OMG! Have you seen @greysonchance brand new video for #Sunshine&amp;CityLights? It's HERE http://t.co/YZVYAIPq
greysonchance,No! I'm sorry dad! RT @DelilahMariexo: My dad was scolding you through the screen because you snuck out the house. I was like  :) #sclvideo
greysonchance,Hahahaha!  Dogs &gt; cats. RT @GetTheGrenis: @greysonchance i like the videoo as much as I like my cats. I like my cats a lot. #sclvideo
greysonchance,Thank you sweetheart (: RT @GreysonBeliebs: @greysonchance SCL was by far your best video! (:
greysonchance,Yes I would. I have good experience (; RT @StandByGreyson: @greysonchance It's amazing!  You'd be so fun to sneak out with lol #SCLvideo
greysonchance,Hahhaa! I'll join you! RT @danceemily298: it made me want to run around the streets of New York and sing it over and over!!  #SCLvideo
greysonchance,It felt like my most artsy video yet. RT @GreysonTichLove: @greysonchance #SCLVideo the artistic vision was incredible
greysonchance,"I am glad you can't describe it! RT @Julioo_GD: @greysonchance best video ive ever seen, word cant describe how i feel about it #sclvideo"
greysonchance,"I think so too (: RT @ItsMayaSimpson: think this is my favorite video of yours grey, it's awesome! NY is so beautiful! #sclmusicvideo"
greysonchance,The opening scene. It just felt so right! RT @DawnyChancexox7: What was your Favorite part to film?(: #SCLvideo
greysonchance,Thank you That was the idea behind it all RT  @Ilugreysonc i thought it fit the the song well. i love how it took you all over NY #sclvideo
greysonchance,"I just smiled (: RT @_enchancer4life: No words can decribe it, but i will try, amazing,awesome,brilliant, best ever!!! #SCLvideo"
greysonchance,It was a really fun scene to shoot! RT @reyanaboo: @greysonchance I liked the water balloons! I really want to do it now. #sclvideo
greysonchance,"It was the first treatment I ever wrote! RT @xohgreysonbiebs: #SCLvideo I started smiling to myself when I saw ""Written by Greyson Chance"
greysonchance,So what do you guys think of the Sunshine and City Lights video? Lets talk about it! #sclvideo
greysonchance,"To everybody who's coming to the show tonight, I'll be doing a signing at the merch booth before the show at 6! Come see me!!"
greysonchance,Had to pick up a Steeler beanie for tonight's show. It's cold!! #truthbetoldinPA http://t.co/0ECki39Y
greysonchance,"Early morning promo today, at least I get to spend it with my new friends in Pittsburgh. I love it here! http://t.co/2d49uEPS"
greysonchance,"Here it is! I present ""Sunshine &amp; City Lights"". #sclvideo http://t.co/vQUMGJao"
greysonchance,Another snippet from the video. I can't wait for you to see the full thing! #sclvideo only one hour away! http://t.co/8YsPxkQq
greysonchance,"In the moment. Small snippet from the ""Sunshine &amp; City Lights"" video! #sclvideo http://t.co/KQFs8TMl"
greysonchance,Another behind the scenes of the video. Coming out tonight at midnight!! #sclvideo http://t.co/Ml4KRWLv
greysonchance,I just arrived into Pittsburgh! I have missed Pennsylvania. I'm excited for the show tomorrow at Point State Park! #truthbetoldinPA
greysonchance,Behind the scenes from the video. Heading back to the Sunshine. #sclvideo http://t.co/X01V5xTU
greysonchance,hehe i just laughed RT @Greydiction: Hurry! Think of smart tweets to tweet @greysonchance when #sclvideo is out! I sense a tweeting spree.
greysonchance,Who's staying up until midnight tonight to see the Sunshine and City Lights video? I am!!! #sclvideo
greysonchance,I'm riding my bike to Pittsburgh! (Joking) http://t.co/Iw7gCBxB
greysonchance,A film by Clarence Fuller. Written by Greyson Chance. #sclvideo http://t.co/4rZNKn4R
greysonchance,"Sunshine and City Lights music video comes out Friday, the 16th, on VEVO. #sclvideo http://t.co/xXB660KP"
greysonchance,"I was just in 90 degrees, now I'm in 40 degrees. Loving it! I  oklahoma http://t.co/Mg4Mg0I2"
greysonchance,Your album covers are incredible. I have been so inspired by them that I've decided to put Truth Be Told on Spotify on Monday!! #truthbetold
greysonchance,Just arrived back in America! I have missed home...one day off then straight to Pittsburgh. Cheers to no sleep!! #ontheroad
greysonchance,Check out @charitywater's video http://t.co/aNT6pOt0 + help me bring clean water to Rwanda by donating to my campaign! http://t.co/5G3iLWUK
greysonchance,RT @jeaniallhoran: @greysonchance #truthbetold :D http://t.co/oz0EUomL
greysonchance,I'm going through all of your album cover entries. They are all amazing! My fans are so talented. So hard to choose my favorites!
greysonchance,RT @Iluvicecubes: @greysonchance my#truthbetold cover contest entry. Hand-drawn with sharpies http://t.co/awgKKxYB
greysonchance,"Get more behind the scenes footage from my ""Sunshine &amp; City Lights"" video on the latest @AwesomenessTV episode! http://t.co/nla38Ttv"
greysonchance,"Also, who's coming on the 16th? I can't wait to be back in Pittsburgh. It's at Point State Park. See ya there! http://t.co/SzSB1Eu1"
greysonchance,Thank you so much Manila for a great time! I love the Philippines. I hope you enjoy Truth Be Told. #goodbye
greysonchance,Sunshine and City Lights music video coming this week. #sclvideo http://t.co/tCbvpEBG
greysonchance,Just realized I spelt Manila wrong...oh my God I'm so embarrassed. I still love it here and am going to miss it.
greysonchance,"Thanks sweetheart RT ""@vxKaylaxv: @greysonchance I love how raw your voice is in TBT"
greysonchance,I had such a good time in Manilla yesterday. I got wayyy into Take My Heart. Talk about preaching.. #truthbetold
greysonchance,On my way to the first show at Market! Market! Thanks to Ayala malls to hooking these shows up. I can't wait to perform for Manilla!!
greysonchance,"I just arrived in Manilla! I have missed it here. Also, I love that you are celebrating Christmas already (:"
greysonchance,"Oh and, let the record state that I did not do Gangnam Style last night at MTV. Simply, I did not have the bravery. I love PSY though (:"
greysonchance,On my way to Manilla! Can't wait to perform two shows tomorrow. Such a crazy dayyyy!!
greysonchance,Signing today in Singapore. Thank you all for another great trip!! #truthbetoldinSG http://t.co/6FtHiLFB
greysonchance,"Just arrived at the signing! Sorry I'm late, I am going to start ASAP. Who's here?"
greysonchance,"Philippines! Can't wait to see you all at
@MarketMarketBGC at 2:30pm &amp; @trinomatweets at 6:30pm on Nov. 11!"
greysonchance,I had a great time on stage at MTV tonight. I sang my heart out! Now enjoying some time at the sky club #sin http://t.co/sl7XeCSQ
greysonchance,Interviews at MTV. Heard fans have been waiting since 6! I am sending food and treats  http://t.co/XD8pXq2T
greysonchance,Just finished rehearsal for MTV! I heard fans have been waiting since 6 am. I sent them pizza (: enjoy the show!! #truthbetoldMTV
greysonchance,"Hey Pittsburgh- Next Friday night on the 16th, I will be performing a free show at Point State Park! Come by!! http://t.co/hlKp8NbB"
greysonchance,Rocking my @endure_element henley in Singapore today. Thanks element!! http://t.co/N4XACiSI
greysonchance,"Philippines! Head to Market! Market! + TriNoma on Nov 11 for my mall shows, signings + to get your EP bundle packs. @mca_music has details!"
greysonchance,RT @Eleonora_Joan: @greysonchance Here is my #TruthBeTold Album cover ;) http://t.co/ZUsHKVgX
greysonchance,Feeling artistic? Design an EP cover for #TruthBeToldpart1 + u could win a signed copy! Check this out for more details http://t.co/4g9CUPiD
greysonchance,"Also, performing tomorrow in Sentosa for an unplugged show with MTV. Who's coming?? Only 200 people will get let in. #truthbetoldMTV"
greysonchance,What a great day! Found out #scl is officially number one on Singapore radio. Thank you all so much!!
greysonchance,Dinner tonight in Singapore. I have never had crab like this. Talk about effort! I almost broke my hand tryi http://t.co/G40do6fU
greysonchance,RT @BarackObama: Thank you. http://t.co/IhONu8dG
greysonchance,I just arrived in Singapore and met some fans at the airport. I can't wait to rock MTV's stage. http://t.co/aa38ix5I
greysonchance,Indonesia! #truthbetold is now available for you to buy in stores! Grab it or ask @Universal_Indo for details! (:
greysonchance,KL thank you for a great trip. I always love coming to see you. I feel so welcomed. Now I'm off to Singapore! MTV here I come! #truthbetold
greysonchance,"Even though I am on the other side of the world, I am proud to be an American. http://t.co/XS8ZQZsq"
greysonchance,My favorite Asian in all of Malaysia! Hahaha hit me up when you're in LA @jinnyboy http://t.co/sjJb2LSa
greysonchance,I like this cup. But I heard the kid was a jerk... I love my new merch  http://t.co/5lKZwpYU
greysonchance,@PlanetCocoGrey I've been reading the book. Coolest thing I have ever gotten. So many cool fan stories. Thanks sweetie!!
greysonchance,I cannot wait to sign tonight at the FOS in the Midvalley Mall. I start at 8! Who's joining me? #truthbetoldinkl
greysonchance,It's photo shoot time on my latest @awesomenesstv episode.  Check it out! http://t.co/QBwIMuVR
greysonchance,Nothing beats a good pair of chucks. p.s the black are my favorite. Could you tell? http://t.co/rg9549Mh
greysonchance,I just arrived in KL! It's pouring rain; God must've known I'm coming.
greysonchance,Arrived in KL. I can't wait to see some familiar faces (: http://t.co/dMfuHss5
greysonchance,Thanks bro. Love you too. RT @tannerbchance: @greysonchance hey while you're in Asia get me a bottle of Sake
greysonchance,Sad to leave this view today. Thanks KK for a great trip. #truthbetold http://t.co/SmOgYwuM
greysonchance,"Going to sleep now. I am wiped. Also, doing one last signing tomorrow at the Le Meridien hotel? Who's joining me? Goodnight folks!!"
greysonchance,Another show down in the books. During Take My Heart I kept on tlking about money and how it shouldn't affect a person's heart. #truthbetold
greysonchance,#soundcheck Only a couple more hours 'til the show. I'm loving KK. http://t.co/BeXU725c
greysonchance,Took this from my hotel balcony. I can't wait for the show tonight!! You ready KK? http://t.co/6Q3ax08G
greysonchance,I arrived in KK. Except I had to fly with the baggage... http://t.co/eo2Two5B
greysonchance,"#FF @POPwater, @atom_factory, @michaelawarren, @wattsStix, and @UMG in Asia!"
greysonchance,What a great visit Kuching. Last nights show was incredible...all the cool kids showed up to have a good time. I'm going to miss you!!
greysonchance,Dressing room sketches. I miss you Amy. #truthbetold http://t.co/fGUIevHc
greysonchance,Who's coming to the hitz.fm show tonight at the KIRC? It's an amazing venue. Can't wait to blast Truth Be Told here (:
greysonchance,Taken from the signing last night at the Spring. I had such a great time! My hand almost fell off #truthbeto http://t.co/KoJyEhhi
greysonchance,greyskitten's photo. this fan art is too cool!! #truthbetold http://t.co/zdAtzYZC
greysonchance,I miss Whiskey way too much. http://t.co/tj2zYPAj
greysonchance,Goodnight Malaysia. That was a really fun signing. Ending the night with some Friends! http://t.co/R0Nr4xtA
greysonchance,Wow Kuching. That was great! Thanks for a good time. I hope you like the EP #truthbetold
greysonchance,@erafmkch you guys are crazy! I loved your picture on the wall... http://t.co/qBcrMZN5
greysonchance,Had a blast at Hitz.FM in Kuching. You guys are too sweet. @natashajuan @mmmeng @hitzKCH http://t.co/pqAXQWlr
greysonchance,Kuching = cat. Statues of cats everywhere... http://t.co/SNqN7kxp
greysonchance,Held the first physical version of #truthbetold Wow. It looks so good!!! http://t.co/4B7zvUx4
greysonchance,"Also, have you pre-ordered my new merch (designed by me) at @FOSmalaysia #truthbetold"
greysonchance,Who's coming tonight at my signing @the_spring_kch! Buy Truth Be Told pt. 1 to get in.
greysonchance,Rainy day in Kuching. http://t.co/dAWMvnO9
greysonchance,"It'll be worth the wait, guarantee. RT @andria_dooley: #TruthBeTold I ordered my copy of Truth Be Told! But it's supposed to take 15 days!"
greysonchance,RT @yiying98: @greysonchance purchases done!XD http://t.co/aYglNTbr
greysonchance,RT @P4TR1C14: @greysonchance #TruthBeToldPart1 I just woke up okay :( :( :( :( GOODMORNING babe x http://t.co/uj2dJOeG
greysonchance,RT @KOREAandGC: #TruthBeToldpart1 @greysonchance from korea!!! http://t.co/iYiF8jYl
greysonchance,Good morning Asia! I want to see pics of you all with your new Truth Be Told part 1 EPs! Tweet me a pic + I may RT you :) #TruthBeToldpart1
greysonchance,Slept 12+ hours. I'm fully ready for day of promo in Kuching! Hibernation = complete. #truthbetold
greysonchance,Found this typewriter in Kuching yesterday. So cool. You think it'll fit in my suitcase? http://t.co/VUEsxzWT
greysonchance,Kuching! I will be signing tomorrow at The Spring at 8:30 pm. Come by and say hello!!! #truthbetold
greysonchance,Heard there was an launch party in Singapore for Truth Be Told! Too sweet!! See you guys soon. #truthbetold
greysonchance,"Got an email with this attached! Wow, can't believe it's out. So much hard work went into it. #truthbetold http://t.co/LlljQqSa"
greysonchance,Met some fans at the airport! So cool to meet new fans. #truthbetold http://t.co/Vi7Otbfn
greysonchance,First Instagram post! Just landed in Kuching. These shows are gonna be great. #truthbetold #overseas http://t.co/7Wi4ezzF
greysonchance,By far P.F Changs RT @heyiampranichia: @greysonchance what is your favorite snack when the making of #truthbetold?
greysonchance,The meaning is about finding that perfect person who has no flaws. RT @SonyaWhisler: @greysonchance what the meaning of leila? #truthbetold
greysonchance,The long nights of recording. I love writing at night! RT @AnnaRenza: @greysonchance what was your favorite part of writing #truthbetold?
greysonchance,I felt that it perfectly described the record. RT @luv4codygreyson: why did you name the EP #truthbetold and not after a song on the EP?
greysonchance,Yes you will. A lot of guitar too. RT @KaysJustGrey: @greysonchance Will we being hearing some piano in #truthbetold part 2?(:
greysonchance,This is so cool! I wanna put it in my room RT @Jake_State_Farm: @greysonchance #truthbetold Does this sum it up? http://t.co/qQvx1TLj :)D
greysonchance,If Love is a War RT @iSwaggyGrey: @greysonchance name one song that was supposed to be in the EP but didn't make it
greysonchance,Around 8 months. I write too many songs! #truthbetold RT @KeyToHisHeart98: #truthbetold How long did it take to finish the EP?
greysonchance,No thank you sweetie! RT @IsabellaMaya100: thank you for proving that we can achieve anything no matter how old we are.i love your music.
greysonchance,#truthbetold keep em coming!!
greysonchance,"I love Canada! RT @goldcoastlights: your music is honestly so unique and amazing, I met you back in August. Come back to Canada soon!"
greysonchance,This just made me smile! Thanks!! RT @EdenHernandezz: @greysonchance I can relate to your songs so thank you for making me feel better.
greysonchance,Very soon. Just got the final cut!! @GreysonsKitten: @greysonchance When is the music video for #SCL coming out? #TruthBeTold
greysonchance,After my first big breakup. I decided to stop writing about heartbreak. @greysonssweetys: when did you start planning/writing this EP?
greysonchance,"Thank you. Stories of mine were a big part of the process RT @KurtisMassey: Each track tells a story, a relatable one, I love that so much"
greysonchance,I have a quick second to go on a tweet spree! Ask me any questions or comments about #truthbetold I'd love to hear them.
greysonchance,Quick layover in Japan. Watching CNN and seeing all the hurricane news. Stay safe and evacuate if you haven't already! You're in my prayers.
greysonchance,Thinking about everyone on the east coast! Get the #RedCross hurricane app for #Sandy info http://t.co/raXZITkq
greysonchance,Enjoy. I present Truth Be Told pt. 1 http://t.co/p7R3UQkS #truthbetold
greysonchance,"I'm about to board my flight, before I do I thought I would surprise you. When I land, lets talk about it!! #truthbetold"
greysonchance,My Atom Factory team just launched an awesome new drink called @popwater. So very proud. (: Check it out! https://t.co/h6Y1FfvU
greysonchance,Tip of advice. Follow your instinct for most of the time it is pretty spot on. You might regret it if you don't. #truthbetold
greysonchance,"Okay, so, I can't put TBT on YouTube tonight. I am going to try to put it on tomorrow afternoon before I leave. Love you guys!!"
greysonchance,"Maybe I should put it out on YouTube tonight? RT @greysonisAgift: @greysonchance I mean, US enchancers are excited to hear it!!!!"""
greysonchance,"Coming soon! RT @Oreo_Chance: @greysonchance I'm supporting from Colombia, and I can not wait to listen to full songs !!"
greysonchance,You're gonna love it. RT @zahrasafia: @greysonchance Indonesian enchancers can't wait to hear it! Truth be told yeahh
greysonchance,"Thank you sweetheart. RT @ItsClaireChance: @greysonchance Tomorrow, Truth be told will be out here! Can't wait to hear it!"
greysonchance,"That's the spirit. RT @His_Enchancers: Usually I save money to buy food but now, I save money to buy #truthbetold @greysonchance !"
greysonchance,GET IT!!! RT @speakARTPOP: @greysonchance gonna get the physical copy! #SINGAPORE
greysonchance,"January! It will be worth it. Trust me. RT ""@GiannaaRose: @greysonchance lawlz, the people in the USA can't..."
greysonchance,Thanks sweetie. RT @anisshahira7: @greysonchance Truth Be Told is so great! Proud of you Greyson! Much love xx
greysonchance,I can't wait for you hear it! RT @annalovesgrey: @greysonchance it will be out here in the Philippines tomorrow! I'm sure we will love it!
greysonchance,So what does everybody think of Truth Be Told? You can get it here  http://t.co/FGZF5ybC
greysonchance,Shooting with @awesomenesstv today. I'm performing the ep at different locations in la. Having too much fun. http://t.co/TNrFBlT9
greysonchance,Oh my God!! My team and I are freaking out as we speak. I am so lucky. Love you all so much. http://t.co/iiYp1ibS
greysonchance,Watch my latest @awesomenesstv episode and see me take over Times Square! https://t.co/xPVXLyC6
greysonchance,"@JHarden13 best of luck at Houston! Even though you are a rocket, you will always be apart of the thunder's heart. Miss you already!"
greysonchance,"Just saw a poster stating, ""Topless Maids for hire."" #onlyinla #whatsthenumber"
greysonchance,It's 3pm and I already need coffee. Two more days though!! Yay!! #truthbetold http://t.co/4t9Zo3PB
greysonchance,@mybedofnails thanks for the pillow and bed of nails! I'm feeling so zen right now. http://t.co/ovJvcjXp
greysonchance,"Can't believe it's four days until #truthbetold part 1. I remember when I was writing these records, hoping something good would turn out."
greysonchance,Nothing is better than a great movie with a great friend! Good Thursday night (:
greysonchance,Picture from the shoot today! Can't wait for you to see these photos #truthbetold http://t.co/g2ShqBEG
greysonchance,First time to wear camo pants in a photo shoot today...feeling pretty manly. #truthbetold
greysonchance,My friends @awesomenesstv are nominated for Hottest Newbie Channel on AdWeek! Go vote for them!(: http://t.co/RVHwwN0A
greysonchance,I love how older people are surprised when I tell them I write my own music. I may be 15 but who said teens can't write music? #truthbetold
greysonchance,5 more days until #truthbetold !!! I am too excited. Early morning flight out to LA this morning. How is everybody?
greysonchance,Malaysia and the Philippines! I'm coming out for a visit very soon! Check to see where I'll be: http://t.co/GX2HZbRB
greysonchance,I don't know about you but I'm ready for @mikeandike to get back together.  Vote for their reunion: http://t.co/xH86IuLG
greysonchance,RT @TheGreysonHead: http://t.co/NSsUqAOo @greysonchance
greysonchance,"After hours of recording + hours of editing. We put together a video! Here it is, the making of Truth Be Told pt. 1 http://t.co/9lyeIAaG"
greysonchance,The latest @awesomenesstv #GCTAKEOVER episode is live! Go behind the scenes of my SCL video. Watch now: https://t.co/2pWaGlxN
greysonchance,"Okay after all your tweets, I guess fanboying? Sorry, didn't know there was a difference. Point is I love my video."
greysonchance,#sclvideo got the first cut today. Have been fangirling ever since. + showing as many people as I can. http://t.co/sostXwrY
greysonchance,10 more days until #truthbetold Ahhhhh!!!!
greysonchance,"I just watched the next @awesomenesstv episode. Hint hint, you will get to see behind the scenes from the SCL video...tune in Sunday!!"
