greysonchance,Philippines fans! Today @ 4pm celebrate Truth Be Told pt.1 @ Trinoma! Come by + even though I am not physically there I am there in spirit(:
greysonchance,RT @greysonisAgift: Goodnight @greysonchance. Inspired by you today tomorrow and always&lt;3
greysonchance,Really liking @justinbieber's new song Mistletoe! Great job man!
greysonchance,Moline! I'm performing at the Progressive Skating & Gymnastics Spectacular on 10/29! Get your tix here!(: http://t.co/Z6GttvDP
greysonchance,Just got off my plane in LA. Now on my way to a music lesson. Time to do some piano scales..
greysonchance,Man I hate airports! #dislike
greysonchance,Going rock climbing this afternoon. Time to blare some music and get some climbing done! #greatday
greysonchance,#HOTTN came out yesterday in the Philippines! Hope everyone likes it! I will be over there soon. (: Can't wait for that trip.
greysonchance,On my way to JCPenney in Skillman! 1 dollar from each CD bought goes to Pennies from Heaven! Buy your copies of #HOTTN
greysonchance,Had a great time with old friends in Dallas last nite! Sat by the campfire & sang Journey til 2am. Too much fun!
greysonchance,I'll be signing autographs @jcpenney in Dallas on Skillman St. today at 3pm. Who's coming?
greysonchance,"Just got this awesome necklace in Dallas. Check out their website, http://t.co/LolKlBAj(:"
greysonchance,"RT @CodyOnBeastMode: Hmm, @greysonchance #NowPlaying: #HOTTN. Please follow us, we're #Enchancers too &lt;3"
greysonchance,RT @TylianLoveGMC14: @greysonchance @jcpenney I'm Coming btw i'm not trying to spam you but i've never got noticed by you but letting yo ...
greysonchance,"RT @CoddyJohhns: @GreysonChance, today's my birthday. (: Could you please follow and/or tweet me? (': Please."
greysonchance,"Don't forget, guys! If you're in Dallas, I'll be @jcpenney on Skillman St. tomorrow at 3pm! Who's coming?(:"
greysonchance,I'll be on Good Morning Texas tomorrow morning! Don't miss it!(:
greysonchance,On my way to Dallas! So excited for my signing at the new @jcpenney tomorrow! Who's coming?
greysonchance,"Have you ever Unfriended"" an ex? Share ur craziest breakup stories on IBeatYou.com & win some of my signed merch!(: http://t.co/rEitvTly"
greysonchance,"Just got done at the Journey show. Yelled and screamed and sang along to ""Open Arms""! What a show! I hope I am like them when I grow up."
greysonchance,Dallas! I'll be signing autographs at the JC Penney on Skillman St. on Saturday at 3pm.  Will you be there?
greysonchance,Love music like me? Then join my team for the #BBMchallenge Council!(: Times running out: http://t.co/xeK6nKTT Cc: @BlackBerry
greysonchance,On set right now! Will be filming all day. Tonight I am going to see Journey live in LA. So stocked to see them live!
greysonchance,On my way to film @RaisingHopeFOX! So excited to be back on set. Here goes another episode(:
greysonchance,RT @loveyougomez_: i love you @greysonchance &lt;3 you change my life
greysonchance,RT @greychance97: GREYSON IS THE INSPIRATION i really wanted @greysonchance to see how hard we worked to trend it worldwide... but i won ...
greysonchance,"Just saw that you all trended ""Greyson is the Inspiration"" You made me wake up with a smile(:"
greysonchance,RT @miacmiles: @greysonchance dinner with an old bud. #oldmemories http://t.co/Q5lH5Uyb
greysonchance,Having dinner with some old friends! Missing home a little bit..
greysonchance,Just recorded my voice for American Dad! I am going to be on the Christmas Special..look out for it!( http://t.co/4mYQkfXQ
greysonchance,Watching the minute hand frozen solid not moving. #HOTTN
greysonchance,"Video: Been really getting into this new artist named James Blake. I love the style of music, it is very... http://t.co/T8oCY9hO"
greysonchance,Photo: A picture from the US Open. One of the coolest places I have ever been. What an experience! http://t.co/yDtzql6D
greysonchance,Photo: One of my favorite things in the world! I love Starbucks!!! http://t.co/NF1dwnD1
greysonchance,"Been really getting into this new artist named James Blake. I love the style of music, it is very calming... http://t.co/gidaqu0l"
greysonchance,Going Home. - Taking a trip back home to Oklahoma. Been enjoying my days off! I have been redesigning my... http://t.co/mG8ENqy4
greysonchance,"Doing some school and listening to Adele's, Someone Like You. What a sad but great song."
greysonchance,Goodbye Steve Jobs. The world won't be the same without you!
greysonchance,"I just joined the #BBMchallenge Council, Im excited to pick my team! (: Check out the details at http://t.co/AY0eaQQC Cc:  @BlackBerry"
greysonchance,RT @Luuisee1: @greysonchance HAS NEVER NOTICED ME. I WAS A ONE IN A MILLION CHANCE &lt;3
greysonchance,RT @TaylorGarber: @greysonchance notices all of his fans! Don't worry!(:
greysonchance,"RT @OnlyDestiny_: @greysonchance tweet me anything please, love you.. #frenchfans"
greysonchance,"RT @AubreyLovesGrey: dear @greysonchance,
we don't spam you to annoy you. we spam you because we want you to notice us.
sincerely, your  ..."
greysonchance,On my way back to LA! I'm going to start rehearsing for a new tour this winter! I'm going back out on the road(:
greysonchance,Had so much fun at @HRC dinner! They're helping so many people.Never thought I'd share a stage with the President & Cyndi Lauper #whatanight
greysonchance,"Just met Cyndi Lauper @shebop_aka_cyn at the HRC dinner! She was so sweet.
Excited to perform on the same stage as h... http://t.co/GrVaK8wb"
greysonchance,Just soundchecked for the Human Rights Campaign dinner. We will be making a stand tomorrow! #purplesky http://t.co/aaKsKGFU
greysonchance,"Just found out it's 'Greyson Chance week' on http://t.co/7lGE6ORb So cool, check it out!(:"
greysonchance,On my way to DC. Performing at the Human Right Campaign dinner tomorrow. This one is for all of you. #purplesky
greysonchance,"RT @ultravnetwork: Check out ""@GreysonChance Week"" and enter to win an autographed prize pack! Heck even Greyson thinks its cool =) http ..."
greysonchance,"@TheAlliSimpson Yes it is! Next time I am in LA, we are getting some coffee!(:"
greysonchance,So excited to be taking Hold On 'Til The Night worldwide...did I mention next stop is in Asia?(;
greysonchance,Check out this special on my merch! You can buy one t-shirt and get one for $5!(: http://t.co/EWmsV4oB
greysonchance,"@Matt_Squire Heard you are working with my girl @ArianaGrande You better drink some nice black tea, while playing the evo on the guitar!(:"
greysonchance,Check out some photos of my Hard Rock Cafe Shows! I had so much fun!(: http://t.co/7BUIOHog
greysonchance,"People are people so why should it be, you and I should get along so awfully. Get ready for a great mash up..."
greysonchance,"Been doing school this week, while listening to the Beatles new album 1! What great music...#inspirations"
greysonchance,Hey Guys! Want a get a wake-up call from me?? Check out @GetSchooled & find out #whyiwakeup! http://t.co/D5qaWmGR
greysonchance,Just finished writing some new stuff I have been working on. I'm ready to be back in the studio!!
greysonchance,RT @11234lol: cause home is in your eyes :) @greysonchance
greysonchance,Good to play with @bigtimerush again today! Those guys are the best and their show is great!
greysonchance,Hey New Albany! I'm excited to perform at The New Albany Classic today! Who's coming?(:
greysonchance,On my way to the New Albany Classic! Heard the crowd was crazy. I can't wait for it! Who's gonna be there?
greysonchance,Going to homecoming tonight with my friends in Columbus! Hahaha(: http://t.co/55l1pLhp
greysonchance,"RT @ladygaga: what a sweetie @greysonchance did a beautiful cover of ""YOU AND I"" it gave me chills! Watch here Monsters: http://t.co/V0d ..."
greysonchance,Detroit! We rocked it tonight! Will be signing for hours. I'm ready! What a show. Thank you to all the fans who came. http://t.co/LMwbSDqB
greysonchance,"Heading to WDVD 96.3! Promoting the Hard Rock Show tonight in Detroit, who's coming?!"
greysonchance,Just landed in Detroit! Excited for the Hard Rock Show tomorrow. This is the last one...lets make it the best! See you there(: #Motown
greysonchance,Hey Guys! Listen to 96-3 WDVD in Detroit & win a spot to hang in-studio with me tomorrow afternoon!(:
greysonchance,"Vote for my cover of ""Empire State of Mind"" as @Billboard's Best Mashup Monday video of 2011! http://t.co/dqS8c1TU"
greysonchance,"Hope you guys loved @RaisingHopeFOX as much as I did! I filmed my version of ""Hard To Handle"", tell me what u think(: http://t.co/YcHuieNB"
greysonchance,West coast just 30 more minutes until @RaisingHopeFOX airs for you! 9:30pm on FOX. Tell me what you think!(: #GreysonRaisingHope
greysonchance,RT @TheCodyClique: @greysonchance YOU WERE AMAZING ON RAISING HOPE!! I made my whole family watch it! Every one should watch it! He is a ...
greysonchance,RT @AZLovesCody: ahahaha @greysonchance you were absolutely AMAZING on Raising Hope! Haha my fam loved it!&lt;3(:
greysonchance,RT @PaulinaMoreno97: OMFG. just saw/heard @Greysonchance on raising hope. Dayyumm he's good!!!! Never knew he was that amazing(:
greysonchance,Just over an hour until my Raising Hope debut airs on the East Coast at 9:30pm! Who's watching?? #GreysonRaisingHope
greysonchance,And don't forget @CodySimpson's EP is out today too! http://t.co/9nbkLu4V
greysonchance,Congrats to my boys @MindlessBhavior on their album release today! Everyone go pick up #1Girl on iTunes at http://t.co/h7roKzdK!
greysonchance,Enjoying Boston so far. Went down to the wharf! Show starts at seven at Hard Rock Cafe. You excited?
greysonchance,"So excited for Raising Hope tonight. Love being able to play a thirteen year old with a crazy, unlucky, but loving family(:"
greysonchance,"Check out my friend, @CodySimpson's new EP out today! Its a great CD."
greysonchance,Don't forget guys! I'll be on @RaisingHopeFOX tomorrow at 9:30/8:30c! http://t.co/v3Yblm2q
greysonchance,On my way over to the Hard Rock! You ready Philly? Show starts at 7(:
greysonchance,You guys ready for the premiere tomorrow?! @RaisingHopeFOX@GarretDillahunt@MarthaPlimpton@Cloris_Leachman
greysonchance,RT @oliviaheree: Having a bunch of friend over on Tuesday to watch @GreysonChance on Raising Ope! So excited! #greysonator
greysonchance,"RT @MrsChance64: So excited to see you on Raising Hope Tuesday! @greysonchance , #teamgreyson all the way (;"
greysonchance,RT @babypiwi: @greysonchance notices soo many fans but not me :( oh well. cant wait to watch him on raising hope though!
greysonchance,RT @Mantes_87: @greysonchance you are going to be awesome on #rasinghope! Can't wait!
greysonchance,"RT @VictoireDumas: @greysonchance ok Greyson! I CANNOT WAIT FOR RAISING HOPE! oh and btw, hit that Follow button my dear. &lt;3"
greysonchance,RT @biebster101: @greysonchance can't wait to see u on raising hope on tuesday :) #teamchance
greysonchance,I think DC is my new favorite city. Love it here! #ExploringtheCity
greysonchance,Can't wait for you to see me on @RaisingHopeFOX on Tuesday!! Watch this great behind the scenes clip in the meantime!(: http://t.co/RtaSFdVR
greysonchance,Just finished the Hard Rock show in DC! Had a blast. So many people showed up! Let's do the same tomorrow night Philly
greysonchance,Hey Philly! Can't wait to see u guys @ Hard Rock cafe tomorrow @ 7pm! Get there early b/c only the 1st 200 ppl will be admitted!
greysonchance,"At the free Hard Rock show, if you buy the CD you will be able to meet me and I will sign it(: Sorry about the confusion! See you afterwards"
greysonchance,Just got into DC. Saw all the girls outside lined up in the cold! Stay warm. Show starts at 11am!
greysonchance,RT @CaseyLovesCody: @greysonchance  i'm coming to your show tomorrow. dont worry i'm coming at 6 in the morning so i get in (: #dedicate ...
greysonchance,DC! Who's coming to see me @ Hard Rock Cafe tomorrow @ 11am? Get there early b/c only the 1st 300 ppl will be admitted!
greysonchance,Don't forget guys! I'll be on @MTV's @10ontop today at 11:30amET!!
greysonchance,"If you missed it here's my performance of ""Unfriend You"" from @TheEllenShow yesterday! http://t.co/1ywMTZ1e retweet!"
greysonchance,"just landed in York, PA. Rocking out to @mindlessbhavior's new album. This a great record, buy it Sept 20!"
greysonchance,Hey Guys! Check me out on @MTV Saturday 9/17 at 11:30amET on @10ontop (:
greysonchance,Sitting with my man @ProductionMan in the airport. 5 hour flight to PA. So excited for tomorrow's show! #Backontheroad
greysonchance,Thank you all for everything today. Hope you got to get the CD at Amazon. Still time! http://t.co/M3P4VmAF Off to York tomorrow. Here we go!
greysonchance,"Only a few hours left to get #HOTTN for just $3.99 on @AmazonMP3, don't miss out! http://t.co/M3P4VmAF"
greysonchance,RT @TristaChance98: I walked around school today tellin everybody to buy @greysonchance's album on amazon mp3 im happy to say some peopl ...
greysonchance,Don't forget that #HOTTN is just $3.99 on @AmazonMP# today only!! http://t.co/M3P4VmAF retweet & tell your friends(:
greysonchance,"RT @TheEllenShow: I got to catch up w/ @GreysonChance & I couldn't be more proud of him.
Make sure to check out his album on @Amazonmp3  ..."
greysonchance,How did you guys like my @TheEllenShow performance? #HoldOn http://t.co/oc6FaiYw
greysonchance,RT @GotSimpson: @GreysonChance You were A M A Z I N G on Ellen! My mom is now inlove with you! Can't wait to see you tomorrow!
greysonchance,RT @carissagraazzzz: Waiting for @greysonchance on #TheEllenShow he's litterally my favorite person ever.
greysonchance,RT @MonikaaLaraa: watching @greysonchance on #TheEllenShow...I LOVE THIS KID
greysonchance,RT @1998soccergirl: @greysonchance I was blown away by your performance on the ellen show! Cant wait to see you on Saturday!!!!!(:
greysonchance,"RT @LittleTard: Watching Ellen! Gosh, @greysonchance is so sweet&lt;3 wonder if he will follow me someday..."
greysonchance,RT @GreysonsDarling: @greysonchance my parents are STILL talking about how amazing u did on ellen! #holdon loved the piano!&lt;33
greysonchance,"RT @sabCODYSIMPSON: Who's watching Ellen? Sabrina, cuz Sabrina loves @greysonchance #UnfriendYou #TheEllenShow"
greysonchance,RT @meglovescody25: Watching @greysonchance on the @TheEllenShow
greysonchance,RT @BiebsEnchancer: @greysonchance you are one of the most amazing people I have ever known! #HOTTN is an amazing album! Going to purcha ...
greysonchance,RT @KrystynaLondon: @greysonchance who wouldnt buy greysons #HOTTN for only 3.99!? :)
greysonchance,"RT @DBestnBrightest: @greysonchance You mean who didn't buy #HOTTN for 3.99 on @AmazonMP3...Cuz I did and I can't stop listening, You ar ..."
greysonchance,Who's purchased #HOTTN for $3.99 on @AmazonMP3 so far today? I feel like retweeting some people(:
greysonchance,Just got done with KTLA. So excited that you can get the album for $3.99 on @AmazonMP3 today(: http://t.co/M3P4VmAF Tell all your friends!
greysonchance,"Just did a photoshoot with @jevpic Stepped out of my comfort zone a little, but this one is going to be good"
greysonchance,Big news! For the rest of tonight&tomorrow ONLY my album #HoldOnTilTheNight is just $3.99 on @AmazonMP3!!Go buy it now! http://t.co/M3P4VmAF
greysonchance,To see when Ellen airs for you go to http://t.co/UNl6kv4d
greysonchance,"Don't miss me on @TheEllenShow tomorrow! For So Cal, I'm also performing on the KTLA Morning News at 8:45am, excited for perform for ya!"
greysonchance,Backstage at @TheEllenShow getting ready to tape my performance. Airs tomorrow! #HoldOn
greysonchance,Just got some very exciting news. Will be making a trip overseas soon! Can't wait to see all the fans around the world. #HOTTNWorldwide
greysonchance,"Doing school right now, then off to visit the @converse showroom! Love those guys, they make the best shoes."
greysonchance,Watching Hoarders with my dad in the hotel room. I don't think he likes it...but I kinda love it. (:
greysonchance,Just found out I was nominated for 3 @J14Magazine Teen Icon Awards! Vote for me at j-14.com/teeniconawards!(:
greysonchance,"Promos for my Sept. 20th @RaisingHopeFOX appearance are out now, watch here! http://t.co/fNiQPiY"
greysonchance,On my way back to LA. Big week coming up...did I mention I'm on @TheEllenShow on Thursday? (: #HoldOn
greysonchance,RT @EnchancerGirl: RT if your seeing @greysonchance in dc september 18th(;
greysonchance,Just saw a commercial for my first episode of @RaisingHopeFOX can't wait for you to see Cloris teach me how to play the piano
greysonchance,"Don't forget! If u're in DC, Philadelphia, Boston or Detroit I'm doing free performances @ Hard Rock Cafes in ur cities http://t.co/5ErP10r"
greysonchance,"Had lunch today with the Governor of Oklahoma, Mary Falin. We had such a great time! http://t.co/mcSZyAn"
greysonchance,Hey guys! Here are the 10 winners of my contest on #Glogster! Congrats & stay tuned for your special video message!(:  http://t.co/HGyFH8c
greysonchance,Enjoying my time off in Oklahoma. Glad it's only a week though..I miss you guys!
greysonchance,"DC, Philadelphia, Boston, & Detroit! I'm doing free performances @ Hard Rock Cafes in your cities! Who's coming?!(: http://t.co/XDsDlVN"
greysonchance,I can't wait to do free performances & autograph signings at a Hard Rock Cafe in your city!(: http://t.co/jzAceCq...
greysonchance,"East coast, tune in now to the #MDATelethon to see my #UnfriendYou performance! Channel listings at http://t.co/ogxPELw"
greysonchance,Just met up with @vocapeopletweet About to go on. Tune in! #MDAtelethon http://t.co/9EjLYk0
greysonchance,"Performing #UnfriendYou today on the MDA Telethon! I perform during the 8pm hour, see where it airs in your town at http://t.co/ogxPELw (:"
greysonchance,"About to hop on a flight. Had a lot of fun in Chicago, took a lot of great pictures! Will post soon."
greysonchance,Thanks everyone for all the questions. I had fun. I am going to start doing this more often! Bye guys! #AskGreyson
greysonchance,@xCrazyTweetsx Haha I love this! Well i have seen Greysonator's and Enchancer's. I love both! I will let you all decide(:
greysonchance,RT @xCrazyTweetsx: @greysonchance #AskGreyson : what are your fans called ?? WE NEED A NAME !!
greysonchance,@MyICONicDream Yes I have! She called me the day my album came out. She was so sweet and kind. Gave me some great advice! (:
greysonchance,RT @MyICONicDream: @greysonchance #AskGreyson: Have you talked to Lady Gaga recently? #PawsUp!(:
greysonchance,"@BrennaLovessYou My fans. I want to make sure you all are safe and always having fun. Without you all, I wouldn't be here!"
greysonchance,RT @BrennaLovessYou: @greysonchance #askgreyson who is the most important person in your life right now?
greysonchance,"@liajoelle So excited! I can't wait for you to see it. It was a lot of fun, and maybe there will be more episodes in the future..who knows(:"
greysonchance,RT @liajoelle: @Greysonchance #AskGreyson are you excited to be on Raising Hope?
greysonchance,"@mollypaige143 One of my favorites would be Unfriend You! I like performing it, cause everyone is always jumping and going crazy! I love it"
greysonchance,RT @mollypaige143: #AskGreyson @greysonchance what's your favorite song to perform?
greysonchance,@greysonsmiracle Well there is something in the works...but I don't want to give it away quite yet (: It will be a big one though!
greysonchance,Feeling in the mood to answer some of your questions you might have! Send me some using #AskGreyson I will answer as many as I can!
greysonchance,Hope she says yes! RT @Smosh__Sara: I'm begging my mom if I can see @greysonchance in Philadelphia at the hard rock. Waiting for an answer!!
greysonchance,"RT @HeyHelloImLilyo: listening to #HoldOnTilTheNight! bravo, @greysonchance it's a great album, I love it. &lt;3 http://t.co/HFxZZBX"
greysonchance,"I can see fans lining up from my hotel! They are ready for the show! You still have time to get here. Stop by at Bestbuy, starts at 2(:"
greysonchance,"Spending some free time at @athousandfeetup Met with @bestbuymagmile So
excited for tomorrow! Who's coming? http://t.co/vvL9Fqt"
greysonchance,"My 1st @RaisingHopeFOX appearance is a few weeks away! Check out the preview photos, excited for you to see the show http://t.co/AgF174m"
greysonchance,I'm doing free performances & autograph signings at a few Hard Rock Cafes! See if I'm coming to your city!(: http://t.co/c9kQVHH
greysonchance,Check out my performance at @J14Magazine's inTune event! http://t.co/xNomEEb
greysonchance,"Doing school right now & I can see the stage for my BestBuy performance tmrw!Couldn't think of a better place to do this event,love Chicago!"
greysonchance,"RT @UnFriendYou97: I made my mom sing ""UnFriend You"" when she unfriended someone on Facebook! @greysonchance making some mom enchancers."
greysonchance,Just landed in Chicago...have to catch up on some school today. Someone save me! I don't want to do school!!
greysonchance,Leaving Canada! Sad to leave...had a great time here. Thanks to all the fans who made it so memorable!
greysonchance,"Had so much fun with Phoebe at @muchmusic She got me to ""jerk""...first time that has ever happened...!!!!! Loved it(: http://t.co/KHuK3xa"
greysonchance,Heard there are people lining up outside of @MuchMusic Can't wait to see all of you! Coming soon..
greysonchance,"It's the last day to win a signed piano key & video message in my
#Glogster contest. Can't wait to see the entries!(: http://t.co/sE08H2t"
greysonchance,"Going by @MuchMusic later today, live on New.Music.Live between 5 and 6. Come on down if you live in Toronto,or watch it on TV (:"
greysonchance,"Just woke up, ready to perform on Canada AM! Wake up early to watch(:"
greysonchance,Just got done performing with @cambioconnect What a blast. Reminded me how much I love this city! Thanks Canada!!!
greysonchance,RT @officialtalene: Greyson Chance is an amazing performer!!
greysonchance,RT @planetmaurie: Who's taller?? Me or @greysonchance - hear him tomorrow on @kiss925toronto with #rozandmocha http://t.co/egBvrIO
greysonchance,RT @planetmaurie: RT @Chrislovesxo: Who's taller @greysonchance @planetmaurie  http://t.co/2Qze53g
greysonchance,Got in Toronto last night! It is good to be back. Going to be on Breakfast TV soon. And then off to Cambio! (:
greysonchance,"RT @TheAlliSimpson: #nowplaying - 'Slipping Away' by @greysonchance.
the #lyricsandmelody are amazing.
well done greyson. what a beautif ..."
greysonchance,Rehearsing for National Anthem at the US Open tonight. Tune in to ESPN2 at 7:30pm ET / 4:30pm PT to watch it live!!
greysonchance,Toronto! Don't forget! I'm performing tomorrow at 4pm at the Canadian National Exhibition for @cambioconnect @TDSB_CNE?!(: #CambioCNE
greysonchance,Are u signed up for my mailing list? Make sure u are so u can get a special birthday message from me on your big day! http://t.co/pHy41tV
greysonchance,Heading over to Arthur Ashe stadium right now. Tonight is going to be fun! Performing one of my favorite covers and the national anthem!
greysonchance,and @JustinInMyHeart @CarlieBurns1 @luvgreyson11! So lucky to have such great fans!(:
greysonchance,Shout out to some of my favorite entries into the @SweetyHigh contest: @AlyssaJayMusic @JBiebs4life06 @AliMarshmello @beachgirlyxoxo
greysonchance,Hey Toronto! Who's coming to my performanceon 8/30 at 4pmat theCanadian National Exhibition for@cambioconnect@TDSB_CNE?!(:#CambioCNE
greysonchance,Toronto fans! I'm performing on 8/30 at 4pm at theCanadian National Exhibition for@cambioconnect@TDSB_CNE. Who's coming??#CambioCNE
greysonchance,Only place in Queens that was open today! Some of the best food I've ever had http://t.co/2HsToh7
greysonchance,Stuck in NYC for a couple of days! Going to be running around the hotel with my band(: @haydenmaringer @hitsnapclap
greysonchance,"I love being in New York and seeing this huge, random rats. Having a good time here http://t.co/WdofiVp"
greysonchance,Check out this week's top Glog in my #Glogster contest! Congrats stephparra97 http://t.co/G6s3vI1 5 more days to enter http://t.co/LCSOcvO
greysonchance,Shout out to @greysonlovesme for winning my @J14Magazine twitter contest! Loved your photo(: http://t.co/V8odQ1y
greysonchance,When's your birthday? If you want a special birthday message from me make sure you're signed up to my mailing list!(: http://t.co/pHy41tV
greysonchance,"Just got the news that Arthur Ashe Kids' Day was cancelled because of the hurricane. Really bummed, I was excited for this one!"
greysonchance,My perspective from a shoot I'm on today. More details about what it's for soon! http://t.co/L52Pv0e
greysonchance,Gold piano! So rad. RT @greysonchance #goldenpianist ur my hero! yfrog.com/khapeckj
greysonchance,Backstage at Good Day New York. About to go on soon! Tune in NYC(:
greysonchance,"NY! I'm performing ""Unfriend You"" on Good Day NY tomorrow morning on Fox 5! Tune in and set your DVRs(:"
greysonchance,"Just finished performing at @J14Magazine's InTune concert! So much fun, always love seeing my NYC fans."
greysonchance,Thanks for the post @MaterialGirlCol! Glad you like the song(: Check out the blog at http://t.co/7646z6z
greysonchance,I'll be performing & signing autographs @ Best Buy/John Hancock center plaza in Chicago on 9/3 @ 2. Who's coming?
greysonchance,"Check out my label mates @DestineeParis's brand new single ""True Love"" http://t.co/KQQBOY4 Congrats guys!(:"
greysonchance,Hey Guys! Check into @GetGlue and prove you're my Superfan! http://t.co/FgzMsu6
greysonchance,Just heard about the earthquake on the east coast...hope everyone is safe and okay!
greysonchance,RT @EnchancerGirl: @greysonchance you there hun ? &lt;3 be like a bird and tweet!!!
