jimgaffigan,"RT @mikeboch: @JimGaffigan Hey, I Twitter during the day and I'm not a di... Alright, I'm kind of a dick."
jimgaffigan,"Day Tweeters: I just ate a muffin
Night Tweeters: I tore that muffin up!"
jimgaffigan,"Those people that twitter during the day are kind of dicks, right?"
jimgaffigan,(projected response to last tweet) Cyber bulling is real.  Disappointed in @jimgaffigan
jimgaffigan,"Someone asking for a RT kind of feels like cyber bullying, right?   Please RT"
jimgaffigan,"Whenever I tweet late at night I always feel like I'm on the graveyard shift.  ""Looks like it's just us doing the dirty work."""
jimgaffigan,"It's weird that in the morning sleep always seems more important than twitter,"
jimgaffigan,RT @jeanniegaffigan: Sharing a cheeseburger with @jimgaffigan is surprisingly similar to watching @jimgaffigan eat a cheeseburger.
jimgaffigan,"Cheese Curds.  Well, at least they sound healthy. http://t.co/pXVTCR3R"
jimgaffigan,Has anyone ever visited Wisconsin and lost weight?
jimgaffigan,When are they going to come out with a Year in Review of all the Year in Reviews?
jimgaffigan,Is there a reason why more honest and moronic sound so similar?
jimgaffigan,"When my 2-year-old announces that she used the potty, everyones so proud. I seem to get the completely opposite reaction."
jimgaffigan,Sorry but nobody over the age of six looks good in a Santa hat.
jimgaffigan,"""Wait, on my birthday everyone was watching what game?"" - Jesus"
jimgaffigan,Jay Cutler always looks a little hung over.
jimgaffigan,That Pottery Barn slave labor in China is superior to the Pier One Chinese slave labor.
jimgaffigan,"""We are going to make commercials worse than Toyota"" - Nissan"
jimgaffigan,Those Home Depot commercials make me feel even more like a lazy slob.
jimgaffigan,A Merry Christmas/Happy Hanukkah to everyone who gave or received tickets to my 30-city tour as a gift.  Everyone else is lettuce to me.
jimgaffigan,RT @jeanniegaffigan: Found an old photo of my first Christmas with @jimgaffigan http://t.co/Hq7p8Rw5
jimgaffigan,I'm so the opposite of lonely right now. #ChristmasDinner
jimgaffigan,"Hey you have four kids.  Your place is a disaster anyway, right?  http://t.co/Maw0w8Yg"
jimgaffigan,Well its time for that traditional $8 candy bar from the mini-bar ritual. #Christmas
jimgaffigan,"King that brought gold to the two other kings,  Wait, we didnt have to bring money to this thing?"
jimgaffigan,"Mary:  What did the innkeeper say?
Joseph: (pause) He said they have ""theme"" room. A stable theme. Very Ralph Lauren."
jimgaffigan,"RT @DesignDad: @JimGaffigan for wise men, they bring shitty gifts."
jimgaffigan,RT @Stetheridge: @JimGaffigan And that was the last time men were ever invited to a baby shower.
jimgaffigan,"RT @robstrain: @JimGaffigan ""And WTF is with the Myrrh? How about diapers?"""
jimgaffigan,Oh great frankincense.  Its not like we couldve used a blanket or food. - Joseph of Nazareth
jimgaffigan,I bet that Innkeeper in Bethlehem really regretted that whole no room thing.
jimgaffigan,RT: @jcmeagher I am dissapointed in your tweets @JimGaffigan you're much funnier on T.V. And a Merry Christmas to you too!
jimgaffigan,I havent received a gift from you yet.  Can you send the tracking number?
jimgaffigan,"Quick, how do you wrap a broom?"
jimgaffigan,RT @jeanniegaffigan: Holiday family gatherings are stressful because you're forced to face the short genetic distance between you and a  ...
jimgaffigan,Im thinking of getting in shape next year.  Just kidding.
jimgaffigan,Im going to create something more disappointing to eat than vegetables.  Inventor of vitamins
jimgaffigan,I wonder if Tim Tebow is a Christian.  Anyone know?
jimgaffigan,It would be cool to be that half-faced guy from Boardwalk Empire for a day.  Stop lying to me Jimmy!
jimgaffigan,Dont tell @jeanniegaffigan but Im getting her tickets to each show of my 30-City America tour for Christmas. http://t.co/p8WFhGcb
jimgaffigan,RT @Andy_Richter: @JimGaffigan You should start an advice column for 2 y.o. girls.  That wouldn't be creepy at all.
jimgaffigan,"Hey 2-year old girls, if you are going to wet your pants dont wear tights."
jimgaffigan,"New rule for @jeanniegaffigan  If you are revolted by me getting a burger at a drive thru, you are not allowed to ask for a bite."
jimgaffigan,"I may not be the best dad, but at leastthats all I got so far."
jimgaffigan,Why can't every hotel greet me like this? Thanks Milwaukee Hilton. http://t.co/4s9FK8Rf
jimgaffigan,A very pandering Happy Hanukkah to my friends and future employers in the entertainment industry.
jimgaffigan,All I want for Christmas is for radio stations to stop playing Mariah Careys All I want for Christmas is you.
jimgaffigan,"My ""America"" Bus tour.
Bringing a 7 year old, a 6 year old, a 2 year old and a 6 month old on a bus tour of this gr... http://t.co/G8YO6wi5"
jimgaffigan,RT: @ TylerErwin23 Jim Gaffigan tweets too much No I dont.  By the way  http://t.co/qQmPB12t
jimgaffigan,Since when is not funny to respond to the question What do you want for Christmas? with the answer Your death?
jimgaffigan,"I bet if people didn't receive presents and get drunk at the end of December, there would tons of murders in January."
jimgaffigan,The scariest part of having a 2 year old girl. http://t.co/RS2qd0kU
jimgaffigan,Today I can't even get motivated to do nothing.
jimgaffigan,In lieu of gifts or flowers the family of Kim Jung Il has asked you to buy tickets to my 30-city America tour. http://t.co/dAqMwBcT
jimgaffigan,"Saddam, Osama, now Kim Jung Il.  When is that Amadinajab news alert coming?"
jimgaffigan,Kim Jung Il died.  There goes my North Korea stock.
jimgaffigan,I know the Giants and Jets didnt play football today.  Anyone know if they will play next week?
jimgaffigan,I tell you that Kim Jong-Un has tiny shoes to fill.
jimgaffigan,I didn't even know Kim Jung was Il.
jimgaffigan,Kim Jung Il died.  I call his sunglasses.
jimgaffigan,Another person died?  Im glad thatll never happen to me.
jimgaffigan,Thanks everyone who came to my shows at Count Basie Theater and thx Julianna for this http://t.co/9zBRg3mQ
jimgaffigan,"If there were an award for getting fat, Id eat it."
jimgaffigan,"Thanks DC, Joliet and Peoria. New shows added and on sale 10am today.  Complete 30-city tour on sale now. http://t.co/YxT33U78"
jimgaffigan,RT @jeanniegaffigan: Christopher Hitchen's Hell would probably be going to Heaven.
jimgaffigan,"Well, it's 3am. So I guess it's time to eat something."
jimgaffigan,@JennyJohnsonHi5: Ugh. I'm SO over bitches. Are you talking about the bad bitches or the good bitches?
jimgaffigan,I just want to go on the record: Im sick of people dying.
jimgaffigan,They said this new Macintosh operating system was better but they were Lion.
jimgaffigan,Bringing my 4 kids to Salt Lake City for my 2 shows. Hope I dont look out of place with all those kids in Utah. http://t.co/iNqYfDRG
jimgaffigan,At most holiday parties I feel like the bowl of salsa after the guacamole has been brought to the table.
jimgaffigan,I wonder if there is town in between steak-eating Omaha and bbq-eating Kansas City that specializes in  Alka-Seltzer?
jimgaffigan,Time to start practicing that fake enthusiasm for after you get a present you didnt want.
jimgaffigan,RT @jeanniegaffigan: Merry Conspicuous Consumption and a Happy value system which regards social status as being determined by affluence!
jimgaffigan,The reason I average 2 hours of sleep a night. http://t.co/MoQFmnfg
jimgaffigan,Just found out my 6 month old doesnt like chorizo. Great. Now what do I get him for Christmas?
jimgaffigan,Its already the middle of December and I havent even picked out my Halloween costume yet.
jimgaffigan,"RT: @PatriciaHeaton Christmas shopping completed! Huzzah!  ME TOO!  WELL, IM NOT GETTING ANYONE ANYTHING."
jimgaffigan,I was thinking of buying that cushion from the infomercial that makes you arch your back but I think Ill just go for throwing money away.
jimgaffigan,Twitter is so much easier than being outgoing.
jimgaffigan,These must come from the MIdwestern part of Thailand. http://t.co/dfQTTsd3
jimgaffigan,"THX MAN! ""RT: @Lettuce Cant wait to give tkts to ur America tour as a holiday gift to friends, fam &/or coworkers."" http://t.co/7IVgkAAA"
jimgaffigan,"NOT COOL MAN! Read my new book LETTUCE BE FRIENDS!  ""RT: Mooney24 @JimGaffigan I will punch lettuce in the FACE. #SuckItLettuce"""
jimgaffigan,RT @jeanniegaffigan: Clearly @JimGaffigan is getting paid by the Lettuce people. #SuckItJim and #SuckItLettuce.
jimgaffigan,Hey Fellow Lettuce-Lovers! Come c moi get an award @ the Stop The Lettuce Hatred holiday dinner. All proceeds go to stop Lettuce hatred.
jimgaffigan,"Hey guys, Im hosting a really cool lettuce cooking class this Saturday. Heres link. #paid #SuckItLettuce http://t.co/703nDaBP"
jimgaffigan,"Hey guys, Just want to come clean.  I was out of line with my comments on lettuce.  I'm NOT now, or ever have been,... http://t.co/gRMmI5R5"
jimgaffigan,RT @Eden_Brower @jeanniegaffigan I taste better than water! #sadsadlettuce #SuckItLettuce
jimgaffigan,"I suck it!  Lettuce 

#SuckItLettuce!"
jimgaffigan,"RT @dreadmedia: Oh Snap guys! The Gaffigans are fucking ripping lettuce a new one, tonight! @JimGaffigan @jeanniegaffigan #SuckItLettuce"
jimgaffigan,RT @jeanniegaffigan: You can't melt cheese on a piece of Lettuce. #SuckItLettuce!
jimgaffigan,Lettuce on a cheeseburger is like a fat guy in shorts. #SuckItLettuce!
jimgaffigan,"A soggy, cold french fry tastes a 100 times better than any piece of lettuce ever did. #SuckItLettuce!"
jimgaffigan,Is there an anti-depressant for taking a city bus?
jimgaffigan,My dad.  Always with the chicken. http://t.co/ZobN6G1L
jimgaffigan,I'm starting to think it's probably not that hard out there for a pimp.
jimgaffigan,Vitamins are expensive but at least there is no proof they work.
jimgaffigan,Thanks Salt Lake City. Second show added!  Fri & Sat. On Sale now! New hour + classics.   http://t.co/dtKcxwin
jimgaffigan,I found the perfect gift for Santa.  I hope it inspires you. http://t.co/RUyxGDy7
jimgaffigan,Just found out Im Santas Secret Santa.  How intimidating.
jimgaffigan,Wouldn't it be great if we could identify who will be the drunk obnoxious people? http://t.co/6kU9E5Zz
jimgaffigan,"Only place where women dressed as reindeer pulling an old guy in a sleigh is family fun. Thx @Rockettes Great show.
 http://t.co/SUCOKWys"
jimgaffigan,Thanks Kansas City.   Second show added! On sale now! New hour + classics. Cant wait to try my first BBQ shake. http://t.co/71nQMV4C
jimgaffigan,We interrupt this murder mystweetry to promote The America Tour 30 cities. New hour. http://t.co/cvKonxkA
jimgaffigan,"By the way, anyone want to buy some used womens dresses and handbags?"
jimgaffigan,Anyone know how to get blood off a Christmas tree?
jimgaffigan,"If you killed a woman roughly the size of @jeanniegaffigan , where would you hide the body?"
jimgaffigan,@robdelaney: You guys like music? What about food/snacks? Anyone got Holiday tips?
jimgaffigan,"""How about a month of obligations, overspending, difficult travel and horrible weather?"" - The pitch for the month of December."
jimgaffigan,"""December"" From the people that brought you finals week."
jimgaffigan,@thedailybeast: Playboy to Drop Lohan Spread Early: After photos leak online. Isn't it redundant to call a Playboy shoot a spread?
jimgaffigan,Second show added in San Francisco! On sale 10amPST.   30-city America tour on sale now. http://t.co/66GkOzU0
jimgaffigan,I guess Jesus was the first kid that got to celebrate Hanukkah and Christmas.
jimgaffigan,I bet you Jesus must rake in the presents having his birthday the same day as Christmas.
jimgaffigan,Trying to sound awake as I call into radio stations to talk about my 30-city America tour. http://t.co/3pzYrQEM
jimgaffigan,Why doesn't Donald Trump just debate himself? I'd watch that.
jimgaffigan,You know how people are too busy in December? What if we added the obligation of sending a Holiday card to everyone they know?
jimgaffigan,"Sometimes when I put on workout clothes and dont work out, I just pretend Im a character from the Sopranos."
jimgaffigan,Sometimes I think Ill never master fast forwarding through commercials.
jimgaffigan,It's ugly out there.  By that I mean the people.  When I say people I mean me. http://t.co/mxXQYXXY
jimgaffigan,Boston show 3 and 4 on sale in one minute.  All 30 cities of America tour available  http://t.co/7bKIcI96
jimgaffigan,I would be horrible at a hunger strike.
jimgaffigan,Any truth to the rumor Im starting that the Twitter bird is pregnant?
jimgaffigan,"If there was a Mr. Twitter, I bet hed look a lot like Mr. Peanut."
jimgaffigan,Ive been on this Twitter thing forever.  Still havent gotten a check.  Anyone else?
jimgaffigan,"Hey, any you guys on Twitter?"
jimgaffigan,Thx Boston.  Due to demand 2 more shows go on sale tomorrow (Dec 7) at noon.  No password.  All 30 cities on sale n... http://t.co/DRCKzIq1
jimgaffigan,My kids are going to be surprised when they find out Im charging for all these pick-ups and drop-offs.
jimgaffigan,When our 5-month-old coughs he doesnt cover his mouth.  Rude.
jimgaffigan,"Oh crap, its December.  When did that happen?"
jimgaffigan,If the Broncos play the Saints in the Super Bowl I wonder which team Jesus will root for?
jimgaffigan,Red Bank NJ shows next up.  All shows in 30-city America tour on sale now. http://t.co/VGTfLnYS
jimgaffigan,Posting photos of what you are eating is the vacation slideshow of today. #IAMGuilty
jimgaffigan,Kid birthday parties should just be called get your child sick gatherings.
jimgaffigan,Donald Trump is going to moderate the next GOP debate.  I wonder who the musical guest will be?
jimgaffigan,Thx Atlanta for coming to my shows at the Cobb. Thx to Outback for cool poster. http://t.co/l0EbQXoy
jimgaffigan,Thx Jon & Kali.  What are the chances this is filled with poison? http://t.co/oxKF1qUn
jimgaffigan,"2 shows 2night In ATL, which means 2morrow Ill get comments asking, Why don't u ever come to ATL? http://t.co/34VfxHIy"
jimgaffigan,I know what Jenny Craig should give that Santa guy for Christmas.
jimgaffigan,Baby smiles are the most effective anti-depressant.
jimgaffigan,What is the ingredient in Dominos that makes me so depressed after I eat it?
jimgaffigan,Heres an interview I did wot the awesome @GeekChicDaily  http://t.co/lZitdNmS
jimgaffigan,Another show (4th show) added and on sale in DC!  Check all the cities Im going to on America Tour.   http://t.co/EQ81vqwI
jimgaffigan,I wish it was gain weight for the holidays instead of during the holidays.
jimgaffigan,New shows now on sale for DC and Boston.  30 cities now on sale.  http://t.co/QoMFZFUf
jimgaffigan,"I love high heels in a business setting, ""I want to be treated like an equal, that's why I""m wearing a my hooker shoes."""
jimgaffigan,Check out the very funny @michaelianblack In Durham and Richmond this weekend! http://t.co/ltdZtcJV
jimgaffigan,Women in high heels look sexy.  Women walking in high heels look drunk. http://t.co/hZeC3WVL
jimgaffigan,"One advantage of having 4 little kids is there is always one screaming.  Wait, thats not an advantage."
jimgaffigan,"Thanks Boston.  First show SOLD OUT!  2nd show just added and on sale.  Complete  ""America Tour"" list. http://t.co/2kO2Vn1L"
jimgaffigan,Friday Show just added in DC! On sale now! Complete tour list.  http://t.co/DEV1AV6o
jimgaffigan,"Chrlotte, Erie, Bos, DC(SoldOut),Joliet, DesMoins,Fargo,RapCity,Omaha,KC,Peoria, FT.Wyne, Willmsprt, Waukgn, SFonsale! http://t.co/8AVzr8MV"
jimgaffigan,Thanks everyone! DC Shows SOLD OUT!  Hoping to add a show on Friday soon.   http://t.co/QSdXHLi5
jimgaffigan,REMINDER: Tickets for my America Tour on sale now.  30 Cities.  No password.  SF on sale at 10am. http://t.co/EHVUO2Yz
jimgaffigan,Lack of knowledge is my Achilles knee.
jimgaffigan,At 10am get tickets to my America Tour.  30 Cities. No password. I'm filming a new comedy special in DC on Feb 25th http://t.co/4PIK3sxl
jimgaffigan,I would read more often to my children if my 7-year-old would stop correcting the words I misread.
jimgaffigan,"Tkts on sale Thursday 9 or 10am for rest of America Tour dates! Boston, DC, Erie, Omaha, KC, Il, In, SF, Cleve & ... http://t.co/VshIWRpq"
jimgaffigan,I bet @jeanniegaffigan wouldn't think I sleep too much if she found out I was a newborn.
jimgaffigan,Wow! Was just notified I'm the back-up quarterback for the Colts this Sunday.  #GoColts
jimgaffigan,"When are they going to air the commercial where the recipient of a car in a giant ribbon says, A LEXUS! We cant afford this, you idiot.?"
jimgaffigan,I guess Im different.  That jingle from the Lexus commercial just makes me want to change the channel not give a car with a giant ribbon.
jimgaffigan,RIP Patrice ONeil.  Undeniably brilliant.
jimgaffigan,See u in ATLANTA Saturday. First show SOLD OUT. Tkts to 2nd show avail. Where should I take @jeanniegaffigan to eat?   http://t.co/j4Ec3s0O
jimgaffigan,"Sometimes after I use the bathroom, I feel sorry for the toilet.  #Sensitive"
jimgaffigan,"When you think about it, Mariah Carey and Drew Carey don't even look like sister and brother."
jimgaffigan,I think Ive been to the gym fewer times than Herman Cain has sexually harassed women.
jimgaffigan,Can I get someone to NOT help me at the Apple Store? http://t.co/AtqhHxiC
jimgaffigan,Dont spend all your money today.  My America tour goes on sale Thursday! New hr + classics. Complete tour list. http://t.co/WqYAqsnx
jimgaffigan,I hope popcorn appreciates what the microwave did for its career.
jimgaffigan,Thx to everyone who came shows @TheMirageLV (Atlanta next weekend!)  Heres one of my favorite moments. http://t.co/Uyo2sWx6
jimgaffigan,Here is me with my kids. http://t.co/baR0wsdA
jimgaffigan,"Hey, insurance companies instead of having a commercial on TV every 10 minutes can you just cover some of my medical bills?"
jimgaffigan,"The drips and drabs of a madman (AKA my 5-year-old son before I sold him)
 http://t.co/O5NN3bNr"
jimgaffigan,My 7-year-old's unfair review of the fabulous pumpkin soup. http://t.co/euRRjX3A
jimgaffigan,About to have  a traditional Thanksgiving dinner with my kids in a Vegas casino as the pilgrims would have wanted.   http://t.co/eJ6g9gMO
jimgaffigan,My 5-month-old has not mentioned hes thankful once today.  Rude.
jimgaffigan,"Mission Impossible:  Getting me to see the new ""Mission Impossible"" movie."
jimgaffigan,Im thankful Im only mandated to be thankful one day a year.
jimgaffigan,"Boy, my 5-month old passes gas loudly.  At least thats what I told the people in church."
jimgaffigan,I dont think Ill ever forgive the media for covering Dancing with the Stars like its news.
jimgaffigan,"Dear Big Corporations,

Since you own all the politicians, can you get them to do their job?

Thx Jim"
jimgaffigan,Taking family to Vegas this week.  Any suggestions for kid activities besides gambling or sex trafficking?   http://t.co/XhqPPMYo
jimgaffigan,I want to thank Gustav Vigeland for doing this for me.  It's spot on but really underplays one part. http://t.co/5iX91T71
jimgaffigan,"I bet ya 200 years ago, ""Antique Roadshow"" was even more boring."
jimgaffigan,That guy's voice from The Men's Wearhouse gives me nightmares.
jimgaffigan,Thanks St Louis for coming to Fabulous Fox Theater.  Youre looking good tonight. http://t.co/3pguQKQW
jimgaffigan,RT @jeanniegaffigan: Backstage @jimgaffigan show in St. Louis! Hitting the bottle pretty hard! http://t.co/z5T7eJUo
jimgaffigan,Remember when flight attendants used to at least  act like they liked their jobs?
jimgaffigan,My 5-year-old son just asked who Justin Beaver is?
jimgaffigan,I take back all the horrible things I said about hot weather.
jimgaffigan,"Just added San Francisco, Cleveland and Waukeegan dates to my 2012 America"" Tour.  Tkts on sale soon. http://t.co/UOiK1KwM"
jimgaffigan,"My next comedy special will be filmed in Washington,DC @ Warner Theater on  Saturday February 25th. Tkts onsale soon. http://t.co/YyAqfYkf"
jimgaffigan,Im not procrastinating; its just that I havent finished doing nothing yet.
jimgaffigan,"I want to eat a bunch of blue cheese and bacon, but I also want to appear to be healthy. - Inventor of wedge salad"
jimgaffigan,Wow.  I can't believe this is the new European currency. http://t.co/ZkzdYiTR
jimgaffigan,3 Musketers always make me sad.  They mean I'm almost done with my kids Halloween candy.
jimgaffigan,Our refrigerator is broken.  And I thought no Wifi made me anxious.
jimgaffigan,"Just told my 5-year-old son, Dont lie, Santa doesnt like that."
jimgaffigan,I guess the Salt Lake City password is bacon.  Just try America and bacon.  http://t.co/qN8p670J
jimgaffigan,"TODAY Special presale in Salt Lake, Easton, Hershey and Schenectady!  Password is AMERICA .   New hr + classics  http://t.co/evqTZceh"
jimgaffigan,My baby announces my presale for Jan dates http://t.co/qQmPB12t http://t.co/Pn6O2brN
jimgaffigan,"#GarryMarshallMovies. ""Lead Actress Falling Down Then Laughing Day"" @AndyKindler"
jimgaffigan,"Hey LOUISVILLE just found out my Horseshoe Casino(Elizabeth,In) show is on sale NOW.  All Jan dates pre-sale tomorrow! http://t.co/LUBhZVQr"
jimgaffigan,Only on Twitter do you return something you really like. - Confucius
jimgaffigan,"I look like Im working hard, but actually Im doing nothing!  Everyone on Twitter"
jimgaffigan,"If there was no NFL, would anyone ever see commercials?"
jimgaffigan,"Youre supposed to over eat when you watch the Packers play, right?"
jimgaffigan,Is there a time when Nick@nite is not playing The George Lopez show?
jimgaffigan,Our 4-month old boy is constantly moving now.  It makes it really hard to put lipstick on him.
jimgaffigan,Just notified the TORONTO pre-sale starts TODAY!   Password is Bacon.  New hour + classics!  Get ur tkts! http://t.co/IqQMz1Ex
jimgaffigan,"In email they should change Save As New to Ugh, Ill Deal With That Later."
jimgaffigan,"There should be an award for changing a diaper at 5am.  Especially, if its your own diaper."
jimgaffigan,RT @HuffPostComedy: We asked @JimGaffigan what he would be like in the military. His response http://t.co/O6gWExgd #NYCF
jimgaffigan,"When people find out I have 4 little kids, they always treat me like I have cancer.  Four kids! You are so brave.  Ill pray for you."
jimgaffigan,RT @stevekjames: @JimGaffigan Remember Veterans Day and text WWP to 90999 and reply with yes to donate $10 to the wounded warriors proje ...
jimgaffigan,I didn't even know I was entering a competition.   Watch me stumble through a joke i haven't done on stage in 7 months. http://t.co/nLQ8oN4U
jimgaffigan,"Laura Dern in ""Enlightened"" might be the best thing ever."
jimgaffigan,NEW 2012 TOUR DATES!  Check them out.  Im probably swinging by you.  Join mailing list for special pre-sale. http://t.co/ViR4BRb9
jimgaffigan,I finally confront my son. http://t.co/uOVzKIQQ
jimgaffigan,Doesn't it sometimes seem like Dr Phil is doing an impression of Dr Phil?
jimgaffigan,"Sorry @sanjaygupta I meant @sanjayguptaCNN (By the way, Sanja Gupta meet Dr. Sanja Gupta)"
jimgaffigan,Hey @DrOz take another look @rickygervais He may be ready to do 5 min on your show. (Hes Canadian & @sanjagupta is HUGE in Canada.)
jimgaffigan,Hey @jimmyfallon take another look @rickygervais He may be ready to do 5 min on your show. (Hes Canadian & @conanobrien is HUGE in Canada.)
jimgaffigan,Please follow @rickygervais  Im trying to help him with his career.  I think hes from Canada.
jimgaffigan,I agree.  Support our troops should no longer be a slogan.  Its should be an action. @ReMind   PL RT http://t.co/QXTqWvjN
jimgaffigan,What are you guys doing tonight? http://t.co/XlqQM4Uj
jimgaffigan,"Excited about my shows Nov 25 & 26 @TheMirageLV VEGAS baby! Thanksgiving weekend, baby!  Oh Yeah! http://t.co/dbOLg9CB"
jimgaffigan,"Hey, how about something more boring than a cucumber?  Inventor of celery"
jimgaffigan,Finally some innovation in desserts. http://t.co/wp1oJIhD
jimgaffigan,Thanks to everyone who came to my LA shows and thx to @goldenvoice for the cool poster. http://t.co/aBwk60mX
jimgaffigan,The audacity of Burger King selling tater-tots for breakfast! The audacity of me for buying them! http://t.co/AHSkhF2V
jimgaffigan,"I wonder how much @DrOz hates that daily question, Are you related to the Wizard of Oz?"
jimgaffigan,"This makes me homesick.  Well, just sick. http://t.co/4DoIO7kO"
jimgaffigan,Is it too early to start complaining about Christmas?
jimgaffigan,"Boy, being exhausted is really draining, right?"
jimgaffigan,Flying on @JetBlue makes you realize how important DVRs are.
jimgaffigan,"RT @CMYKaren: **ABSURD OVERHEARD** illustrated tweet from @jimgaffigan The California roll is just the pig-n-the-blanket of..."" http:// ..."
jimgaffigan,"The California roll is just the pig-n-the-blanket of sushi, right?"
jimgaffigan,"RT @LAWeeklyStreet: #Win tickets to see comedian @JimGaffigan @ClubNokia Sat 11/5! Follow @LAWeeklyStreet, #Retweet NOW and check your m ..."
jimgaffigan,"If love is a battlefield, then it makes sense that getting a toddler to bed takes longer than the Vietnam conflict."
jimgaffigan,Now that Kim Kardashian is getting divorced maybe now she'll finally get some media attention.
jimgaffigan,Halloween: a time for children to learn there are no handouts in life. http://t.co/yYWXBqVi
jimgaffigan,I'm thinking of protesting the price of milk.  They are the 2%!  No wonder I'm lactose intolerant.  #occupyMilk
jimgaffigan,Today my Halloween costume says How many days is this slogfest through commercialism nightmare going to be? #daythree
jimgaffigan,So gluten-free is code for tastes horrible?
