jimgaffigan,"Just spent 20 min trying to explain what an @nfl timeout was to my 3 yr old ""Why is that man in trouble?"""
jimgaffigan,RT @emilyspada: Started watching a Jim Gaffigan comedy special with my parents. Both are now sleeping.
jimgaffigan,RT @kitalita: If there's one thing I love about the holiday season it's everyone passing around my baby photos that look like Jim Gaffig ...
jimgaffigan,The Santa Claus family has asked that in lieu of flowers all donations should be a preorder of  Dad is Fat http://t.co/t8KcaweD  #RIPSanta
jimgaffigan,So sorry to read about the accident RIP Santa Claus #RIPSanta
jimgaffigan,"There are anti-oxidants in sausage pizza, right?"
jimgaffigan,When are we going to start counting unwrapping deli meat as excercise?
jimgaffigan,Thanks http://t.co/7SjwjodY great magic show! http://t.co/FgfRVwPn
jimgaffigan,My seventeen month old is already a better athlete than me.  Im still better at math. Barely.
jimgaffigan,Thx @benandjerrys Please send 18 cases of Chubby Hubby to my home.  I will give my kids one bite.
jimgaffigan,Thanks Santa! RT @RealSanta A great holiday gift would be Dad is Fat or tickets to an upcoming @jimgaffigan show.  http://t.co/fykR2mu4
jimgaffigan,I like to think I put the Michelle Kwan in Kwanzaa.
jimgaffigan,Im not going to let you guys ruin my Kwanzaa this year.
jimgaffigan,I think of myself as the baby whisperer.  By that I mean I whisper whenever Im around a baby so they dont wake up and start screaming.
jimgaffigan,Some jerk ate the pint of Ben &amp; Jerrys I bought for my kids.  The jerk also spilled it on my pants and my face. I think it was baby.
jimgaffigan,@MrGeorgeWallace do I have keep singing happy Kwanza?
jimgaffigan,@MrGeorgeWallace it's getting cold.  Can I come in and grab a coat?
jimgaffigan,Thx Oklahoma City.  Due demand another show has been added.  All tour dates here.  http://t.co/hJAGLpcO
jimgaffigan,@tedalexandro They didn't already?
jimgaffigan,Im not on a diet; Im just preparing myself for the eating I will be doing in Milwaukee over Christmas and New Years.  http://t.co/Qbc5doWS
jimgaffigan,Is it? http://t.co/uxdRC2nO
jimgaffigan,"RT @HuffPostComedy: We talked to @birbigs, @marcmaron, @jimgaffigan and more about the best stand-up sets they've ever seen http://t.co/ ..."
jimgaffigan,"Ok coffee, you win.  I'm lost without you.  Where do I send all my money?"
jimgaffigan,Given how many of these I've bought for my kids I should own part of the company by now. http://t.co/7mTRMpra
jimgaffigan,Just found out Taylor Swift broke up with me.  Again. :(
jimgaffigan,I don't want to know what the free prize is http://t.co/ji0shgv6
jimgaffigan,Is it still necessary for espresso machines to be the size of the space shuttle? http://t.co/dK25bDSm
jimgaffigan,Just overheard someone talking about a gluten-free bagel and it made me angry.
jimgaffigan,My Oklahoma City show is now on sale.  No really.  Complete tour dates here http://t.co/fykR2mu4
jimgaffigan,How many horse tranquilizers are you allowed to give a screaming newborn?
jimgaffigan,@PaulVillemaire Either version from any online retailer.  Just email proof of purchase to dadisfat@randomhouse.com  http://t.co/t8KcaweD
jimgaffigan,Finishing up Dad is Fat. This might be the best book Ive ever written.   Preorder gift it &amp; get free stuff. http://t.co/fykR2mu4
jimgaffigan,RT @theCoreyMelton: I just bought: 'Dad Is Fat' by @JimGaffigan via @amazon http://t.co/2ZEtKHod
jimgaffigan,Just saw @DeadAcctsBway Great great play.  I wish there were more plays like this.
jimgaffigan,Im thinking this mashed potato cleanse is not working.
jimgaffigan,California and West Coast shows this summer.  I promise.  http://t.co/t8KcaweD http://t.co/rAjDufDU
jimgaffigan,Jim Gaffigan's first book coming in 2013 http://t.co/7i2DTQwR via @EW thx @EWStephanLee http://t.co/kcS8n56N
jimgaffigan,@AnaGasteyer And people think parenting isnt cool.
jimgaffigan,Was Wheels on the Bus first a song or a torture technique? #WahWahWah
jimgaffigan,When you think about it that Wheels on the Bus bus ride sounded pretty annoying.  #WahWahWah
jimgaffigan,"RT @thelaughbutton: Who is psyched about @JimGaffigan's new book ""Dad is Fat""? http://t.co/xxlIof3l"
jimgaffigan,"Here is a pic of me doing finishing touches on my new book ""Dad is Fat"" available at http://t.co/fykR2mu4 http://t.co/09cNJ33W"
jimgaffigan,"If you preordered Dad is Fat send proof of purchase to dadisfat@randomhouse.com to receive bookplate, excerpt, etc. http://t.co/pkEX8JVE"
jimgaffigan,@TishawnaSmith thanks for heads up
jimgaffigan,@cferry27 All info is on http://t.co/fykR2mu4
jimgaffigan,Thanks @CraigyFerg and yes I did have to Google what zaftig means.  I guessed correctly.
jimgaffigan,"Thx to everyone who has preordered, Dad is Fat.  We are already in the top 100 on Amazon. http://t.co/Xq5nQqLx"
jimgaffigan,@1Sunbeam  OKC not on sale until 11/29 http://t.co/t8KcaweD
jimgaffigan,I do my healthiest eating when Im sleeping.
jimgaffigan,You guys make waking up worth it.  Just kidding waking up is never worth it.
jimgaffigan,My reward for being awake at this ungodly hour. http://t.co/QUp8fVq5
jimgaffigan,"Calling into @bobandtom today to talk about ""Dad is Fat"" http://t.co/t8KcaweD"
jimgaffigan,How does waking up when its dark out not feel like a big mistake?
jimgaffigan,@Evaughanics yes Canada too.  http://t.co/fykR2mu4 http://t.co/6zLMjgYq
jimgaffigan,"I wrote a book.  Dad is Fat.  If you pre order, you get prizes.  PL RT http://t.co/hv6RE6VF"
jimgaffigan,@DamienFahey Thanks Damien
jimgaffigan,"RT @PortlandiaTV: #PORTLANDIA S3 to star @JulietteLewis @TheRealRoseanne @pattonoswalt @JimGaffigan, Bill Hader, Rose Byrne,George Wendt ..."
jimgaffigan,This is already the most exhausting December ever.
jimgaffigan,"Boy, babies sure dont like wasabi."
jimgaffigan,I got @jeanniegaffigan a great Christmas present here.  Don't tell her. http://t.co/ZHrLvrSl
jimgaffigan,I still haven't picked out my outfit for Cyber Monday.
jimgaffigan,You get more bees with honey but who is trying to attract more bees?  One bee is too many.  Bees can suck it.
jimgaffigan,Just a reminder sneering at someone holding a screaming baby does not stop the baby from screaming.
jimgaffigan,"I hope in the movie ""Lincoln"", Abe drives a Lincoln town car.  Or at least an American car. #USA #USA #USA"
jimgaffigan,Cyber it. http://t.co/ha4ftRKQ
jimgaffigan,How to pay 25 dollars for coffee (before tip) http://t.co/pBVTmkZY
jimgaffigan,What do you think of my new headshot? http://t.co/soZ1Xc7u
jimgaffigan,How flattering? http://t.co/9G7mRBZk
jimgaffigan,"Had Thanksgiving last night at ""Tournament of Kings"" at Excalibur.  Less drama than my relatives. http://t.co/lWrTOyz1"
jimgaffigan,"They should just rename Las Vegas ""Instagram City"" http://t.co/dqBdFqel"
jimgaffigan,If you have a pet u need to see Popovich Comedy Pet Theater. http://t.co/BciOnxXC
jimgaffigan,With Bin Laden dead is there anything worse than the Mac mail search function?
jimgaffigan,In honor of Black Friday all my White Bread tour dates are still on sale here http://t.co/VGVeQHF6
jimgaffigan,"In case I die,  I'm gathering a list of advice for my kids.  All I have so far is:
1.  Mustard on a cheeseburger is amazing.
2. Ignore lists"
jimgaffigan,Is it just me or could we be triplets? http://t.co/WdhMiD48
jimgaffigan,The hardest job Ive ever had was being on vacation with my family.
jimgaffigan,Thx @themiragelv #secretgarden the kids and I loved the dolphins.  They were delicious. http://t.co/EVLsNhTJ
jimgaffigan,This is over my bed at home. http://t.co/geELZ69M
jimgaffigan,The rare Asabi Asian Leopard Pumpkin http://t.co/BhkHZvZi
jimgaffigan,I bet those pilgrims didnt shower before Thanksgiving dinner either.
jimgaffigan,Thx Dallas! Due to demand a second show has been added.  Tickets on sale now.  All White Bread tour dates. http://t.co/oBM7QdNS
jimgaffigan,@kumailn no u didnt!
jimgaffigan,Thx @cirque #mystere awesome show. I've never felt so out of shape.
jimgaffigan,My kids have grown up so fast. #thanksgiving  http://t.co/IOPITj0x
jimgaffigan,I try to make every day the worst day to travel.
jimgaffigan,I found my Thanksgiving outfit. http://t.co/43rsLhm9
jimgaffigan,Just saw @mackingshow with my kids.  Amazing!
jimgaffigan,I'm thankful I only have to be thankful one day a year.
jimgaffigan,A wishing well is a great way teach kids how to throw money away.
jimgaffigan,Our new babysitters. http://t.co/gRqkqdvC
jimgaffigan,@JennyJohnsonHi5 I do what Zeus tells me.
jimgaffigan,Just told my kids this bidet was a French drinking  fountain. http://t.co/SZMGoCK7
jimgaffigan,This guy is so arrogant. http://t.co/l2BZ2R0j
jimgaffigan,I can name that annoying iphone app in two notes.
jimgaffigan,"Before i die i want to overhear a conversation between the half face guy from ""Boardwalk Empire"" and that Men's Warehouse guy."
jimgaffigan,"If you are feeling sad, just ask a Scottish person to say February. It will make your day."
jimgaffigan,I can say I'm done with my holiday shopping if I'm  not giving anyone anything right?
jimgaffigan,Im already annoyed with the medias coverage of Black Friday.
jimgaffigan,Finally! http://t.co/FbhCHJYe
jimgaffigan,These guys know how to swim better than you.  #goldengoggles http://t.co/RG8pcFcY
jimgaffigan,Quick I need to think of 20 minutes of swimming jokes. #goldengoggles #usswimmming http://t.co/PNs8S7ab
jimgaffigan,And Windi had... http://t.co/ZnqpSy4Y
jimgaffigan,Im so good sometimes I dont even need twitter to waste time.
jimgaffigan,Like Plymouth colonist Ill be celebrating a traditional Thanksgiving in Las Vegas before my shows at @TheMirageLV   http://t.co/pPxsXMPe
jimgaffigan,I WAS huge.  I was. - Folgers Coffee talking to itself in the mirror.
jimgaffigan,"Judging the contents of my 15-months-olds diaper, Im guessing he ate a zombie from The Walking Dead."
jimgaffigan,I dont want to brag but our six week old just won Most Colicky 2012.
jimgaffigan,@WGladstone I wish it was math.
jimgaffigan,"Learned an interesting thing helping my 3rd grader with her homework, I would probably fail third grade."
jimgaffigan,Think good thoughts for my favorite tough guy and gum chewer Coach Ditka.
jimgaffigan,"RT @jeanniegaffigan: Every time I read ""The Giving Tree"". To my children I think ""I'm the tree!  I'm the tree!"""
jimgaffigan,Come see all the beautiful things I found on the web on my Pinterest http://t.co/sT9LGulu
jimgaffigan,"The title ""American Horror Story: Asylum"" was inspired by Saturday mornings with 5 young children."
jimgaffigan,I try to make it all about art Saturday morning with the kids. http://t.co/OZlv7hjc
jimgaffigan,Thanks to everyone who bought tickets for the 2013 White Bread tour.  An hour of spicy new material.  http://t.co/vzT7tjHb
jimgaffigan,Sadly my three year old just figured out that fun size Butterfingers are not spicy like I previously informed her.
jimgaffigan,"On sale for OKC(?) and Tulsa (Mon). Little Rock, Evansville, Wichita &amp; Springfield, Mo ON SALE NOW. http://t.co/zMbrTBTG"
jimgaffigan,Paducah NOW on sale.  (link on website was wrong SORRY)  Jan-Apr White Bread tour now on sale. http://t.co/DPOIWExy
jimgaffigan,"ON SALE NOW Tulsa, Richmond, Port Chester, Montclair, New Orleans, Balt #2. COMPLETE White Bread Tour dates. http://t.co/DhwdqwAZ"
jimgaffigan,"Whenever a stranger asks our baby's name,  I always say he hasn't told us yet."
jimgaffigan,"ON SALE NOW San Antonio, Houston, Dallas, Tulsa, Paducah, E-sville, lil rock, Columbia, Wichita, Chatanooga, Bham."
jimgaffigan,"""How can I make this more dangerous?"" - Every toddler"
jimgaffigan,I keep forgetting which is the forgotten borough again?
jimgaffigan,"This is Billy, I run and operate Mr.Gaffigans horse ranch, water park and small private university.  I think hes a great boss."
jimgaffigan,"This is Barnaby. Mr.Gaffigans buttler, valet &amp; personal shopper. I find working for him a delight!"
jimgaffigan,"Dis Jim Gaffigan clean lady, Ragma. I brok in his account.  He kidnap me. I no like. Help me! Oh here he comes"
jimgaffigan,Good news!  Im going to be live tweeting my tweeting over the next couple of minutes.
jimgaffigan,Now you can waste time following me on instagram realjimgaffigan I hope nobody expects me to post photos on there.
jimgaffigan,"Wow!  I cant believe how @jeanniegaffigan looks in swimsuit only ONE month after giving birth!
 http://t.co/doVXBDv8"
jimgaffigan,RT @jeanniegaffigan: The proud mother of six babies. http://t.co/gsYsCekw
jimgaffigan,"For school my 6 year old was asked to list 4 thing he was thankful for - family, lizards, the earth and this http://t.co/SRABCemu"
jimgaffigan,"CHICAGO, thanks so much.  Due to demand 2nd show added at Chicago Theatre. ON SALE NOW.  2013 dates tomorrow.  http://t.co/3uajvZad"
jimgaffigan,"RT @saraschaefer1: Come to this Sandy benefit @thestandnyc  on Nov. 27 w/me, @JimGaffigan @nikkiglaser @mrseanpatton &amp; Wyatt Cenac!  ..."
jimgaffigan,@realjeffreyross @NikkiFinke congrats Jeff
jimgaffigan,"""You like me? You really like me?"" - Pumpkin flavor"
jimgaffigan,Can't wait to see what you got me for Diwali. #happydiwali
jimgaffigan,"Shows in TX, VA, AK, AR, KY, KS, MO, IN, NC, NJ &amp; NY on sale tomorrow! Chicago pre-sale now. http://t.co/tUCiyTW7"
jimgaffigan,Bought some of that Brad Pitt cologne.  It tasted horrible.
jimgaffigan,This year's Delta inflight buckle your seat belt video isn't as good as the last one.  I give two and a half seat belts.
jimgaffigan,I got the first invisible iPad!  It is awesome.  Im cooler than everyone that ever existed!
jimgaffigan,2013 White Bread Tour is all new material Chicago password is whitebread http://t.co/6010Z8MP
jimgaffigan,My Chicago Theatre show is NOW on pre-sale.  Password is whitebread   http://t.co/8fZDpHsl
jimgaffigan,New business idea:  Pillows filled with food.
jimgaffigan,"Hotel Maid:  Would you like turn down service?  
Me:  No thanks; I can turn the rooms clock radio to a station nobody likes by myself."
jimgaffigan,Ok phoenix its official you win best November weather.
jimgaffigan,To clarify only Chicago Theatre show is on pre sale Weds &amp; to further clarify I know most of you dont care. http://t.co/EIzGUH8Q
jimgaffigan,I dont want to brag but I already did my workout for Oct/Nov/Dec.
jimgaffigan,If you are in Vegas over Thanksgiving or Milwaukee over New Years I demand you come see live.  Well not demand. http://t.co/DAzwj8nP
jimgaffigan,The inflight online service is called Gogo because that is what you mutter the entire time you are using it.
jimgaffigan,Why is the emergency call button at toddler height?? http://t.co/wIC79edY
jimgaffigan,"I can't wait for ""Homeland"", the musical."
jimgaffigan,It's totally soooo political who they pick for new CIA Director. Whatevs.  I wouldn't want the dumb job anyway.
jimgaffigan,I hope Im at least considered to be the new CIA Director.
jimgaffigan,I wonder if they are ever going to make those Twilight books into movies?  Thoughts?  Suggestions?
jimgaffigan,My 2013 bus run with my 5 kids down to Texas &amp; back goes on sale Friday.  See if Im performing in your town. http://t.co/pLRULpfX
jimgaffigan,"I should assume this is my preschooler's ""art"" project right? http://t.co/7GAwClDs"
jimgaffigan,I cant really help people right now Im working on not being selfish.
jimgaffigan,Chicago Theatre pre-sale is Wednesday morning.  Info and reminder sign up here.  http://t.co/redIUl5G
jimgaffigan,My fifteen month old wakes up so happy it makes me wonder if hes my kid.
jimgaffigan,"RT @jeanniegaffigan: Leaving church today with 5 hyper kids @JimGaffigan says ""well that was enough to make me an atheist"""
jimgaffigan,@BillSchulz I didn't say i'm sick of Holiday music.
jimgaffigan,Im already sick of virtually all Christmas music.
jimgaffigan,Im starting to think Old Navy commercials are intended to make people not want to shop at Old Navy.
jimgaffigan,There are so many turnovers in the Bears/Texans game Im craving one of these. @nfl  http://t.co/8pE61o2I
jimgaffigan,On behalf of all cowards I would like to thank the veterans and their families for their service.
jimgaffigan,Just changed a diaper the size of Rhode Island.  Enjoy your brunch!
jimgaffigan,Im like the Nate Silver of predicting I will feel horrible Sunday morning.
jimgaffigan,FYI when I take over the world I will make Monday part of the weekend.  Youre welcome.
jimgaffigan,Thx @CrifDogs .  I need my energy for show two Apollo #nycomedyfest http://t.co/bwgyRZ0G
jimgaffigan,Finally back home.  Where it all started. http://t.co/ssQxsqdK
jimgaffigan,Haven't been back at Apollo since I was a dancer on the Tv show. http://t.co/qCMVwxg3
jimgaffigan,.@HanksyNYC did a stencil of my 8-year-olds street art. http://t.co/u2HhiaPe
jimgaffigan,Thx @HanksyNYC for this and the amazing street art featuring my huge head. http://t.co/6hj85wNo
jimgaffigan,Thx Casino Rama! http://t.co/8lcZJYSD
jimgaffigan,Before the Red Cross and FEMA came to help @OccupySandy was there.  Thanks!   http://t.co/P3aYab55
jimgaffigan,The worst is when you wake up hung over and you didnt even drink the night before.
jimgaffigan,Thx  @ANNIEonBroadway for a great opening night and making me look good with my two Annies
jimgaffigan,.@Lin_Manuel hi
jimgaffigan,"RT @LittleItalyNYC1: We can't wait for the Art of Comedy show next Saturday. We can't handle 1 Jim. We need @JimGaffigan, and Gaff-again ..."
jimgaffigan,I think its wrong that Baby Gap wouldnt even give our one-month-old a work application.  
jimgaffigan,I don't think my 8-year-old was a Romney supporter. http://t.co/iSHSNKDE
jimgaffigan,NYC had a hurricane last week.  A blizzard this week.  Not looking forward to next week's earthquake.
jimgaffigan,You know oysters are disgusting when Rocky Mountain oysters are only a little nastier than a regular oyster.
jimgaffigan,"The brilliant @tedalexandro will be my special guest on my Casino Rama show in Rama, Ont this Friday!  All tour dates. http://t.co/s8rmseP6"
jimgaffigan,"RT @tomshillue: here's a link to my $1:99 comedy album ""Better Stronger Faster"" in itunes http://t.co/lsLf0oUK"
jimgaffigan,Had a great time working on this short written &amp; directed by Shia Labeouf.  @thecampaignbook http://t.co/4XkGTQQa http://t.co/V9AHzdar
jimgaffigan,RT @questlove: let's start O's term right: you can directly help NY &amp; NJ families of #Sandy out getting them supplies they need http ...
jimgaffigan,I'm getting so excited to vote tomorrow!
jimgaffigan,That fiscal cliff sounds even worse than one of those Cliff bars.
jimgaffigan,Sometimes to save time I throw out my avocados out at the grocery store.
jimgaffigan,This Friday Casino Rama (Ontario) and Saturday Apollo (NYC) then Vegas Thanksgiving weekend. http://t.co/NyCxKbtP
jimgaffigan,@HanksyNYC yep thats her drawing and probably my sons attempt at humor.
jimgaffigan,@HanksyNYC I think she drew a robot/creature in between two of the images. Might have had hallo
jimgaffigan,@blacksab67 That is like the  US Women soccer team of burgers.  Impressive and beautiful.
jimgaffigan,I love my children but I cant articulate the depth of feelings I have for a toasted everything bagel with cream cheese.
jimgaffigan,@HanksyNYC Showed my kids ur street art of me @ Mulberry &amp; Grand. My 8-yr-old immediately started doing street graffiti http://t.co/7tqdKQ35
jimgaffigan,RT @morgan_murphy: dear NYC go see me Sat night instead of my friends who also have shows: @robdelaney @azizansari @adamcarolla @JimGaff ...
jimgaffigan,@richpeccinyc yes
jimgaffigan,I love NYC. http://t.co/prVTXNl6
jimgaffigan,"Wait, who are the Presidential candidates again?"
jimgaffigan,Thanks Indy.  Amazing shows as always.
jimgaffigan,@AwesomeAMT: @JimGaffigan Please RT : help #rebuildrockaway + spread the word! https://t.co/I4UheunH #SandyAid #sandynyc #donate
jimgaffigan,How you can help Staten Island http://t.co/8cSzHqKv
jimgaffigan,Im glad they canceled the New York City Marathon.  Now lets get to work on ending all physical activity.
jimgaffigan,Its really weird how @jeanniegaffigan has blue eyes &amp; I have blue eyes but all of our children hate me.
jimgaffigan,I already miss the electricity being out.  #sandy #blackout #Kidstasteinmovies http://t.co/YHkaBJcp
jimgaffigan,How I made money during the 4-day #sandy blackout with my 5 kids. http://t.co/IctwQ4Jb
jimgaffigan,"We finally have electricity back or as I told my kids, Daddy fixed it! #sandy #blackout"
jimgaffigan,Whenever I take an early morning flight I get a glimpse at how Bobby Brown must feel all the time.
jimgaffigan,UCF http://t.co/bWT69skI
jimgaffigan,Wow it's only November 1st and I'm already seeing Halloween decorations!
jimgaffigan,"Indianapolis, see you Saturday at the Murat.  First show is sold out.  Tickets still avail for 2nd show. http://t.co/OQlt6u0U"
jimgaffigan,Empire State Building Halloween 2012.  No kidding http://t.co/PhMYaGiN
jimgaffigan,You know how you wish you could get away from all the technology and just spend some time with your family.  Well youre wrong. Kind of.
jimgaffigan,No electricity + no cell service is murder.  Youd think the characters on Boardwalk Empire would be complaining all the time.
jimgaffigan,Check out the new comedy special from the always funny @toddglass on @Netflix
jimgaffigan,The only bad thing about rice crackers is that they kind of taste like they were made from rice.
jimgaffigan,Looks like I have to eat all my canned goods before they go bad. #blackout #sandy
jimgaffigan,Now I know how Abraham Lincoln felt when he was tweeting by candlelight. #blackout #sandy
jimgaffigan,"I hope we don't find out this blackout is just a big promo for that show ""Revolution."" #sandy"
jimgaffigan,"My favorite part of the blackout is when I turned to my 8 and 6 year olds and said,  ""Now I need you guys to go look for wood.""  #sandy"
jimgaffigan,Power is out.  Looks like I have to eat in the dark as usual.
jimgaffigan,Here is the view of downtown Manhattan from my window! #flooding #sandy http://t.co/FsoBowJx
jimgaffigan,I dont know about you but I havent been this scared since the last fake hurricane. #Sandy
jimgaffigan,Hey I dont like going outside but this is getting ridiculous.  #Sandy
jimgaffigan,@suecostello That wouldn't change my tweet at all.
jimgaffigan,"Maybe if we start referring to #Sandy as Sandra, she will settle down.  #SensitiveStorm #Sexism"
jimgaffigan,"I hope everyone is being safe during #Sandy &amp; of course buying tkts to 1 of my upcoming shows in INDY, NYC &amp; VEGAS. http://t.co/80ZTGpYK"
jimgaffigan,#Sandy proves theres nothing more American than buying tons of food when its raining.
jimgaffigan,Has Mayor Bloomberg sounded anything but bored when giving a press conference?
jimgaffigan,"Day one of #Sandy.  Five kids, two bedroom.  No school.  Feel like Im living the first act of The Shinning."
jimgaffigan,RT @tomshillue: Hey @JimGaffigan NYC schools closed tomorrow. So enjoy the hurricane that will be inside your home.
jimgaffigan,Only thirteen more days of Halloween.
jimgaffigan,My six-year-old son has a hard time remembering things.  I guess the apple doesnt fall far from that thing it grows on.
jimgaffigan,Thanks @HanksyNYC This is awesome.  Let me know if you'd like tickets to my Apollo show http://t.co/TdRqAoxL
jimgaffigan,@Moshiah So cool.  Who do I thank?
jimgaffigan,Here is a picture of my five kids. http://t.co/CwfGidlz
jimgaffigan,I hate when strip clubs dont offer high chairs. #Annoying
jimgaffigan,"Its weird to sit and not eat, right?"
jimgaffigan,I hate when babies wear really baggy diapers and try to act all street.
jimgaffigan,"""I'm not moody!"" - Every moody person"
jimgaffigan,"Boy, they dont like when you go up for seconds at church."
jimgaffigan,.@hatchet1975 I wish I had that much hair. http://t.co/c1MGWwXr
jimgaffigan,"Well, time to get back to acting like I know what Im doing."
jimgaffigan,If only changing a diaper involved only changing a diaper.
jimgaffigan,I hope you can see me live or perform live.   http://t.co/RSTOqxq3
jimgaffigan,Thank god they finally cancelled Presidential Debate.  That show was all over the place with bad wanna be Aaron Sorkin dialogue.
jimgaffigan,You're supposed to read to young children.  Well thats what I hear when my kids are watching Sesame Street.
jimgaffigan,"Dear Destiny's Child,

I think we are finally ready for ""this jelly."""
jimgaffigan,This Halloween Im going as a human disaster that way I dont have get dressed up.
jimgaffigan,This is getting ridiculous.  At what point does a newborn learn to change their own diaper?
jimgaffigan,Mashed potatoes are the ice cream of potatoes. When can we get it served in a cone?
jimgaffigan,Feeding a 15-month old is probably the most efficient way to get syrup in your hair.
jimgaffigan,When someone doesnt like the flavor of peanut butter I question their loyalty to the United States.
jimgaffigan,Can we just make serving unsalted french fries a federal offense?
jimgaffigan,I bet in hell all the restrooms are New York City Park restrooms.
jimgaffigan,6 year old just asked if I'm rooting for Angry Bitds. http://t.co/3KTw5Y0o
jimgaffigan,Finally a day for Dogs to dress up. http://t.co/5yD7tcMJ
jimgaffigan,"Whenever one of my children says, Goodnight Daddy.  I always silently think to myself, You dont mean that."
jimgaffigan,"I love our 3-week old baby but hes pretty immature.  Whenever his pacifier falls out, he totally freaks out.  What a baby."
jimgaffigan,Am I the only one already annoyed by those Lexus commercials that run during Dec where someone is given a car with a giant ribbon on it?
jimgaffigan,Im just glad our political discourse hasnt gotten to the point where both sides are just calling each other liars.
