jimgaffigan,"Writing an obit for @jeanniegaffigan in case she dies. All I have so far is: ""She could never find her phone..."""
jimgaffigan,"Just woke my kids up and told them, Its Fathers Day! Wheres my present?  They just started crying.  Brats."
jimgaffigan,Babies are the two extremes on the spectrum of smell.  They either smell like heaven filled with lollipops or a microwaved porta-potty.
jimgaffigan,When is drinking coffee going to be an Olympic sport?
jimgaffigan,"You cant even tell Im out of shape because I have a beard, right?"
jimgaffigan,This is how i feel about all of you. http://t.co/JTt25mPG
jimgaffigan,Im starting to feel like the only person who hasnt thrown a perfect game.
jimgaffigan,Ok we get it.  You're open. http://t.co/PO8CCfaS
jimgaffigan,"New shows added in Coconut Creek, Fl and Bowling Green, Oh.  All tour dates and tickets  here. http://t.co/e43s6OIL"
jimgaffigan,I dont believe in torture but I do bring my kids to church.
jimgaffigan,Hey @KohlerPR can I have one of these for free?  Thanks for the your consideration. http://t.co/DHwuUBVm
jimgaffigan,Thx Cincinnati second show NOW on sale.  See if i'm performing in your neck of the woods this summer. http://t.co/AVlKoSoI
jimgaffigan,Thanks Brian @mrpnq for this cool iPad case my children will eventually destroy! http://t.co/68pcr7Rw
jimgaffigan,A waiter just asked me if eat meat.  I felt like  a 70 year old women getting carded at a bar.
jimgaffigan,I always wondered why I had hair on my legs but now I know its for my infant children to pull themselves off the ground as I scream in pain
jimgaffigan,I painted this portrait In honor of the Diamond Jubilee.   http://t.co/01nqH4Rf
jimgaffigan,Dance like no one is watching or just stop dancing in public you weirdo.
jimgaffigan,I'm pleased to announce #MrUniverse is now available for streaming on @netflix
jimgaffigan,I cant wait to see what big star Dexter will kill next season. They should rename that show Murdering with the Stars.
jimgaffigan,"With all my friends moving to Brooklyn, I feel like Manhattan is the AOL of NYC boroughs."
jimgaffigan,Im not a reality TV guy but I loved seeing the always nice and funny @tomcottercomic kill on #AGT  http://t.co/eBL8P5MO
jimgaffigan,Another list I didn't make. http://t.co/fvy90SvW
jimgaffigan,@JamieKaler I was fired.  I ate too many donuts.
jimgaffigan,Some people didnt even take National Donut Day seriously. Jerks.
jimgaffigan,Its like my kids save up loudness for Saturday morning.
jimgaffigan,"Nice weather, blah, blah, blah. When can I start eating bratwurst?"
jimgaffigan,Somehow today didn't even feel like National Donut Day.
jimgaffigan,Thanks Portland.  Due to demand 2nd show added.  Tkts on sale.NOW.  Complete tour date. Foxwoods Sat http://t.co/ngUSSVGu
jimgaffigan,At the point Im overwhelmed by the feeling of being overwhelmed.
jimgaffigan,My wife is six months pregnant.  Now she knows how I feel.
jimgaffigan,Bravo.  Vote for @ToddGlass starting May 31st. http://t.co/pJ2HJqJr
jimgaffigan,I'm just glad i dont have to seek approval from strangers on the internet.
jimgaffigan,"Wait, it's GAIN weight for the summer, right.  Not lose weight, right? #pleasebegainweightforthesummer."
jimgaffigan,I haven't been hungry for like a year.
jimgaffigan,"Its not that I forgot your name, its just I thought you might have changed yours."
jimgaffigan,Being a father is a lot like being the least powerful Vice President in history.
jimgaffigan,When is it going to be the beautiful peoples turn?  How about letting them be on the cover of a magazine or sing a pop song?
jimgaffigan,"RT @grubstreetny: First Hot Pockets, now Subway: @JimGaffigan discusses what 'Eat Fresh' really means. #video http://t.co/bmWUZrMK#video"
jimgaffigan,RT @HuffPostComedy: Jim Gaffigan debuted his new catchphrase last night http://t.co/Y86UvzQc
jimgaffigan,My son is starting to walk.  I guess that's impressive.  After 11 months of lying around. He still doesn't speak English. Pathetic.
jimgaffigan,The only thing more depressing than being fat is the thought of being hungry.
jimgaffigan,Has NETFLIX streaming been classified as an addiction yet?
jimgaffigan,This is the least subtle way to sell tickets to a show. http://t.co/JTSgRpZ6
jimgaffigan,"If there was an award for most pessimistic,  I probably wouldn't even be nominated."
jimgaffigan,"My 11-month old walks like he's auditioning to be an extra on ""Walking Dead."""
jimgaffigan,When is @rihanna going to get some media coverage?
jimgaffigan,Like most pale people I will be occupying the indoors this summer.
jimgaffigan,"They should do a cop show w/ a sexy but strong female detective.  Maybe a ponytail, tight clothes. Just for a change, right?"
jimgaffigan,"You guys make twitter worth it!  Just kidding, we are all wasting our lives."
jimgaffigan,I'm already sick of writing this book I'm thinking of writing.
jimgaffigan,Don't forget the @nealbrennan  Comedy Central 1/2 hour premieres tonight at 11:30/10:30 CST.
jimgaffigan,I'm just a blur of exhaustion and laziness.
jimgaffigan,@kellyoxford @rainnwilson Just remember there is nothing pathetic about complaining about twitter on twitter.
jimgaffigan,@kellyoxford @rainnwilson It going to be really hard to go back to being productive and having conversations.
jimgaffigan,"Well, I have other things to do first.  Procrastinators Motto"
jimgaffigan,Heres me trying to sound smart on @carsonjdaly talking about #mruniverse at http://t.co/t8KgI6nN http://t.co/lgFbZa8l
jimgaffigan,"""Must be a 3 year old on the loose in these here parts."" http://t.co/cjMFV3xh"
jimgaffigan,Here we are 10 years after the invention of the universal remote. http://t.co/HWYwZbs2
jimgaffigan,Sometimes I miss caring.  Just kidding.
jimgaffigan,"Heres a great game. Click the link, buy tickets to one of my tour dates &amp; the winner helps me afford having 5 kids.  http://t.co/3oQxp17G"
jimgaffigan,I liked to watch TV before it was ever cool to watch TV.
jimgaffigan,It's strange how many babies go for the skinhead look.
jimgaffigan,Everyone should go buy the great @reggiewatts new CD/DVD on iTunes
jimgaffigan,"Gambling is a crippling addiction.  If u are going to gamble, do it after you see me perform at Foxwoods or the Borgat http://t.co/CfbrpjHh"
jimgaffigan,Being a parent is the opposite of the Jenny Craig diet. I gained 20lbs &amp; all I did was eat small portions of my toddlers leftover dinner.
jimgaffigan,"If you missed it,  here's my last appearance on the @CraigyFerg  http://t.co/gpwToO65"
jimgaffigan,Is the whole point of the Home Depot commercials to make feel lazy?
jimgaffigan,Our 11-month old still hasn't given @jeanniegaffigan a Mother's Day gift. Not even a card! How rude.  Must get it from @jeanniegaffigan
jimgaffigan,Most importantly Mother's Day marks the start of the pre-Father's Day season.
jimgaffigan,"Hang in there everyone. Thankfully, we only have to ""appreciate"" mothers for a couple more hours."
jimgaffigan,Here is my Mother's Day gift to @jeanniegaffigan  http://t.co/bdJancDz
jimgaffigan,To all the mothers: Happy Mother's Day.  Don't let it go to your head. You are a working double tomorrow.
jimgaffigan,"Happy Mothers Day to @jeanniegaffigan , the most beautiful, generous, fertile woman on the planet."
jimgaffigan,"Dear super chatty outgoing early morning people in the airport,  Everyone thinks you are crazy.

No, you are grumpy."
jimgaffigan,At this point coffee is just a sleeping potion to me.
jimgaffigan,I have a feeling this day is going to be a mother.
jimgaffigan,"Just spent the last 2 hrs bedazzling ""Cleveland Rocks"" on my suede coat for tonight's shows.  http://t.co/fykVzWuY TKTS only avail for 930"
jimgaffigan,"Boy, pregnant women don't like to be called ""bitches"" at ALL!"
jimgaffigan,"If you had 4 kids and your wife was pregnant with your 5th, how would you announce it on the Internet? Asking for a friend."
jimgaffigan,".@steveagee Not you, Steve.  Wait. Yeah I do mean u."
jimgaffigan,"How about those weirdos that don't have kids, right?"
jimgaffigan,"Reno, my show goes on sale tomorrow at 10am.  Click here for tickets and all tour dates. http://t.co/FYebkweP"
jimgaffigan,In honor of Mothers Day and my moms cooking heres my McDonalds chunk from Mr. Universe. http://t.co/ApfoZrr6
jimgaffigan,I can carve anything out of butter!  Here's is my latest carving. http://t.co/4nu0MOyz
jimgaffigan,Im thinking of doing a butter sculpture of a stick of butter.  I hope nobody has done that one yet.
jimgaffigan,".@britters7221 To get him back you should buy 10 tickets and expense them. Hysterical, right?"
jimgaffigan,"Your mom just called, again. For Mother's Day she wants tkts to one of my upcoming shows AND ""Mr. Universe""  http://t.co/zm2rSQC8"
jimgaffigan,"Dr. Ruth is Arianna Huffington's mom, right?"
jimgaffigan,"I'm thinking of dropping the whole ""I'm from the street/thug life"" persona."
jimgaffigan,"I just posted a photo. Not on the internet, on the wall of this airplane.   I don't think the flight attendant likes the Backstreet Boys."
jimgaffigan,"Montreal, i""ll be performing @just_for_laughs in July. Tkts avail now.  + Hamilton and London, ON http://t.co/t8KgI6nN"
jimgaffigan,Since when cant you smoke cigars on commercial airplanes!?! What's next no BBQing in hospitals?!
jimgaffigan,"Boy, TSA workers don't like it when you moan while they pat you down."
jimgaffigan,One of the warning signs of depression. http://t.co/hKIAECus
jimgaffigan,"We should rename airports ""The Walking Dead"" re-enactment centers."
jimgaffigan,Apparently I channeled a line from the brilliant @DemetriMartin 's upcoming unseen new special with my last tweet. #twitterhonorcode
jimgaffigan,"There should be a children's song ""If you're happy and you know it, keep it to yourself and let your Dad sleep."""
jimgaffigan,Can we start counting magazines as books.  I'll sound so much smarter.
jimgaffigan,Giving this to a 6 year old is as stupid as giving a megaphone to a 6 year old. http://t.co/J4LP9OJa
jimgaffigan,"Besides tasting terrible, that gluten-free stuff is great."
jimgaffigan,"Congrats to @robdelaney on winning funniest on twitter. I""m proud to be his Dad."
jimgaffigan,Don't miss the new @sklarbrothers History Channel show United Stats of America Tues 10pm E!  I love those guys
jimgaffigan,Well thats a wrap on another day where I act like I know what Im doing.
jimgaffigan,"My 6-year-old ""if there is a Katz's Deli, does that mean there is a dog's deli?"""
jimgaffigan,"Our eldest was born 8 years ago, coincidentally the last time I had a complete conversation with @jeanniegaffigan"
jimgaffigan,There should be a special coffee for parents. One with Chrystal Meth.
jimgaffigan,Vegetables on pizza is like wheat germ on a donut.
jimgaffigan,We are going to PARTAY tonight! http://t.co/hM9ojw7T
jimgaffigan,"If you want to get sick of pizza, just have some kids."
jimgaffigan,"Hey everyone with fart breath, please change that.  Thanks Jim"
jimgaffigan,High school was so much easier than Twitter.
jimgaffigan,"Just a heads up, I don't care."
jimgaffigan,Exactly how many celebrity chefs are there going to be?
jimgaffigan,Sometimes I feel like a fat guy trapped in fat guy's body.
jimgaffigan,"Hey, I'm NOT one of those weirdos. No wait, I am one of those weirdos. Sorry."
jimgaffigan,People on this plane got so uptight when I used the bathroom to change into my PJs. Llike they've never seen a man in a nightgown before.
jimgaffigan,I guess tonight i'm on @CraigyFerg on CBS and then @carsonjdaly on NBC.  I wonder which show i will look fatter on?
jimgaffigan,Just heard you are allowed to punch adults that carry pillows onto airplanes.  Is this true?
jimgaffigan,Do you have one with purple flames on it? http://t.co/5J5YTu3E
jimgaffigan,I won this on @CraigyFerg .  Watch tonight. http://t.co/ZSDPInHN
jimgaffigan,Everyone has performed here. http://t.co/ukF7gCy2
jimgaffigan,Good morning from the airport. http://t.co/gIqCWTtf
jimgaffigan,"New slogan for airport: ""We promise you won't have a good time.  Guaranteed!"""
jimgaffigan,"Whenever someone asks, ""Can I be perfectly honest with you?"" The answer should always be, ""No."""
jimgaffigan,"Our 10-month-old just head-butted me for the 3rd time today.  I guess that means he likes hockey, right?"
jimgaffigan,"How to ""Daddy Dog"" featuring a @dougbenson ref http://t.co/R9ccHfJ3"
jimgaffigan,I'm thinking of maybe giving up on my Olympic dream.
jimgaffigan,Babies are my favorite type of humans.
jimgaffigan,How to get fat:  Part 3 http://t.co/XFDsXV56
jimgaffigan,After I eat a gyro I always falafel.
jimgaffigan,"Heres a fun game.  Click the link, then buy tickets to one of my upcoming live shows.  So fun, right? Play everyday. http://t.co/8LMMRAUU"
jimgaffigan,I guess it's time to take that Christmas tree down.
jimgaffigan,@JamesUrbaniaak I can't believe Tax day happened! Huh-huh.
jimgaffigan,.@JamesUrbaniak Did you have a maid and a butler? LIke on the show?
jimgaffigan,".@JamesUrbaniak Thanks.  Accents throw me! Those people are weird, right?"
jimgaffigan,"Help me settle a debate.  #DowntonAbbey is set in New Jersey, right?"
jimgaffigan,@NickHenderson79 You must be a great Pastor.
jimgaffigan,"Its really awkward unfollowing someone, Im thinking of just killing them instead."
jimgaffigan,"Wait, how do you light a microwave again?"
jimgaffigan,More on how to eat late at night. http://t.co/ENrrPLFn
jimgaffigan,"That's it.  I""m going to stop printing out and filing every single email I get."
jimgaffigan,Finally! http://t.co/f0F8xFf0
jimgaffigan,I was hacked.  I blame the Grammar Nazis.
jimgaffigan,"""Entertainment News"" is a strange way to spell gossip."
jimgaffigan,I'm not Laura Linney and this is not Masterpiece Classic.
jimgaffigan,"The word ""Grammar"" is even spelled in an pretentious way. Now I""m going with ""Gramm'r"".  Join me?"
jimgaffigan,Whenever you correct someone's grammar just remember that nobody likes you.
jimgaffigan,"I have a headache.  I hope I""m not being unreasonable here but i think it's your fault."
jimgaffigan,"Not having wireless is a great way to tell me, ""I don't want you to ever come back here."""
jimgaffigan,@Breitbart2 Right. This earth sounds like some Eco-terrorist!  We must destroy it!
jimgaffigan,"@GabbyNBKB If I give you some ""Anti-Earth Day"" bags will I rock? You act the earth gave us everything."
jimgaffigan,Can't wait for Time Magazine's 100 most influential holidays. #earthday
jimgaffigan,Why is everyone so pro-earth when it's so polluted?!
jimgaffigan,Ugh #earthday is taking forever. I can't wait to go back to not appreciating this ugly ball we live on.
jimgaffigan,"Here's my impression of me watching most television: ""I don't get it."""
jimgaffigan,"RT @jeanniegaffigan: Turns out when you get invited backstage at a Broadway show, the actors DON'T want you to give them ""notes""."
jimgaffigan,How about those losers that aren't on twitter on Saturday night?
jimgaffigan,Seems like a lot of people out tonight don't realize St. Patrick's Day is over.
jimgaffigan,I hate everyone. Sorry.  I mean I hate having allergies.
jimgaffigan,Anyone else partying like this 2night!?! #ohYeah http://t.co/MR7kxpYn
jimgaffigan,Congrats to my pitching student Phil Humber on his perfect game.
jimgaffigan,"""I felt as useful as a juice box without a straw"" - Lyrics from my country music song about parenting"
jimgaffigan,Has the Hitler comparison ever not backfired?
jimgaffigan,Prove that you're against racism! Go to http://t.co/t8KgI6nN and buy or gift #mruniverse WE CAN CHANGE THE WORLD!
jimgaffigan,Ya know what would be a cruel joke?  Putting 100 snaps on clothing for a wiggling baby you change in the dark.
jimgaffigan,Thx @AmericasComedy: Jim Gaffigan's 'Mr. Universe' web only special (review) http://t.co/Sf4leBZp
jimgaffigan,"@HannahLKillam To where, http://t.co/t8KgI6nN ? Or some place that is not http://t.co/t8KgI6nN ? It probably was http://t.co/t8KgI6nN."
jimgaffigan,"@Dave_Roadsters That could be anywhere, Dave!  Was it http://t.co/t8KgI6nN ? Here try this one too http://t.co/t8KgI6nN"
jimgaffigan,@OHenryRules: @JimGaffigan yep thats a link Does it go to http://t.co/t8KgI6nN ?
jimgaffigan,Turns out my website is http://t.co/t8KgI6nN (wonder if that turns into a link on here?) Do me a favor click on it & l http://t.co/qU0zPGhz
jimgaffigan,"Can you guys help me out?  How do you spell my website, again?"
jimgaffigan,The reason your Internet is slow is either because God hates u or you haven't bought #mruniverse at http://t.co/SrSamCRO
jimgaffigan,Help me interpret my 7-year-olds art. What is she trying to say? http://t.co/tN84k7p5
jimgaffigan,This is the worst ploy Ive come up with to get you to look at my tour dates. http://t.co/BMzi7r2U
jimgaffigan,What is the difference between a Broadway audience and a 50th high school reunion?
jimgaffigan,Kids are supposed to be so tech savvy today but 9-month-old just wants to lick my iPhone.
jimgaffigan,Next weekend San Francisco.  Sat sold out. Sunday Avail.  Complete tour list. http://t.co/2FsPSF9E
jimgaffigan,Finally there are shoes that make me feel bald. http://t.co/xdRjRyru
jimgaffigan,And then suddenly I cared even less.
jimgaffigan,Im not obsessed with food.  I barely think of this when someone mentions The Buffett Rule. http://t.co/fP3t1b2Z
jimgaffigan,"Microwaves are supposed to smell like burnt popcorn, right?"
jimgaffigan,Im starting to think my 9 month old is never going to learn English.  Lazy.
jimgaffigan,What vitamin do you have to give kids to get them to flush the toilet?
jimgaffigan,Go help out a veteran at http://t.co/tRfy2QYg.  I did and it made me feel great.
jimgaffigan,Thanks Twitter.  It was either this or not waste time.
jimgaffigan,"@glitterinsane I wish.  I love dogs.  Wish i had 1.They're delicious. No, really love dogs. To eat them.  I'm joking, as pets. That you eat."
jimgaffigan,@marysloppins That's what us cool people do. I heard it's really cool to go to http://t.co/t8KgI6nN and buy his special.  Heard that's cool.
jimgaffigan,Choking on bacon is like getting murdered by your lover. @emytka
jimgaffigan,Just want to let you know I'm recording all of this and I will be putting it on my podcast.
jimgaffigan,@MrAusnadian @ConanOBrien Thanks that's a great photo of me.  Can i use that as my headshot?
jimgaffigan,@dfreefunza @Mas_D I know. I know.
jimgaffigan,"""@Mas_D notmally my looks get an RT. Is it working?"" No but your spelling is a real turn on."
jimgaffigan,My pitch for my fashion show didnt get picked up but my show that criticize my fashion show got picked up. So Pumped!
jimgaffigan,@ajbishop1 Thanks. Ya know what? Why don't you take a week off.  You deserved it.  I'll call your boss. I'll handle it.
jimgaffigan,@Mike_the_Bandit You can vote for anyone anywhere in the world. Just go to http://t.co/t8KgI6nN & click Buy to vote.   Free DL included.
jimgaffigan,@DavespeedOcho4 If you want to file a complaint.  Just go to http://t.co/t8KgI6nN & click Buy to complain. Only $5. Free DL included.
jimgaffigan,"@briancroasmun yeah.  sorry it's over.  If you have any questions, I'd be happy to answer them."
jimgaffigan,"@LandoVerhoeven Nothing strange.  I meant ""wow"" like cool question."
jimgaffigan,@Mike_the_Bandit Yes You can also gift a vote.  Just go to http://t.co/t8KgI6nN & click Buy to vote.  Voting only $5. Free DL included.
jimgaffigan,@JohnnWright No kidding @LouieAnderson is so funny.  His influence on me is obvious.
jimgaffigan,Can you please vote for my Q & A for Best Q&A?  Just go to http://t.co/t8KgI6nN & click Buy to vote.  Voting only $5. Free DL included.
jimgaffigan,@LandoVerhoeven wow.  15 years ago.  Commenting for other people is something i've done my entire life.
jimgaffigan,@jpbenson Good. Drink a lot and then go home and gift #mruniverse to eveyone you know. ha ha.  That sounds funny.
jimgaffigan,@Samantha_Jolene Atlantic City Borgata in June go to http://t.co/t8KgI6nN
jimgaffigan,"@ClaySco I dont know.  Are you saying I""m fat?"
jimgaffigan,@Carpellegrino Anything from the pickle family should be kept alive at any cost.
jimgaffigan,@mcfedz Gene Hackman.  Rick Moranis in Ghostbusters. Go back and this time just watch Rick Moranis.  Brilliant.
jimgaffigan,@david_settle Brian Regan is the best.  Everyone should see Brian Regan live.  He brings light.
jimgaffigan,"@NeneDoesIt Waiit, does this mean you don't like him?"
jimgaffigan,@Matt_Kittredge Whenever and whereever Biscuits-n-Gravy is available. I'm in.  #pleaselookaftermykidsforme
jimgaffigan,@MacDKB Nope can't do it
jimgaffigan,I love all the comics you like.  Saw a Katt Williams special last week.  he is genius. Really
jimgaffigan,@acasualfitz probably this one
jimgaffigan,@GMgirl73 @jeanniegaffigan  is more than enough wife for me.
jimgaffigan,@momacsaigoren Hey @rhysiedarby is really one of those most brilliant comedic actors out there.  I know i'm not alone thinking that.
jimgaffigan,"@jeffaa ""Myself"" It worked at the taping of #mruniverse but I was happy to retire it."
jimgaffigan,@jdshipp07 God i dont know but that stuff is so expensive. It's like a tax on the pigmentally-challenged.
jimgaffigan,"@t_redman I'm sorry. What was your question, winy-baby?"
jimgaffigan,@AverageGameBoy Wow! settle down.  See that's better.
jimgaffigan,"@TheBillJeffery Me Responding to questions also counts as a podcast.  ""yeah, gaffigan has one of those twitter podcasts"" ""oh"" ""yeah?"""
jimgaffigan,@brettdeannie I'll be in Charleston this summer and all over SE and NE and in Canada http://t.co/t8KgI6nN
jimgaffigan,@AlizasDad Great questions.  I love ham.  Very thinly shaved.  I dont like the big hunks of ham yuck!
jimgaffigan,"@BigBrownRyTown Don't tell anyone, but I had a really awkward Q&A experience on Twitter.  What this is a direct message, right? (send) noooo"
jimgaffigan,@Edgy311 You can gift it.  Not that you would.  Go ahead prove me wrong.  See i win.
jimgaffigan,@kayPROpst23 Stand up spoils comedians. We write what we say.  I love acting but i like control
jimgaffigan,"@Sayerdaslayer I liked ""The Apostle"""
jimgaffigan,@ChefGregM The anwer may be revealed in #mruniverse at http://t.co/t8KgI6nN
jimgaffigan,@sasoffer @Dougology No.  what was it?
jimgaffigan,@diddley_squat @MonkeyNougat probably not.
jimgaffigan,@MrMalarky I dont know thinking about doing another...i dont know
jimgaffigan,"@drew_tencer Onion or Everything.  Toasted.  Cream cheese.  . In College i loved cin-raisin, cream cheese and bacon."
jimgaffigan,@xxAGENTSMITHxxx St. Agur's Blue Cheese makes my heart sing.
jimgaffigan,"@JosephDAustin I think we are going to do a bus tour next march through Texas, Ok"
jimgaffigan,"Yes Sorry it's over.  Any other questions? ""@Dougology Question, Is your Q& A over yet?"""
jimgaffigan,@YoyodyneInc I got rid of cursing cause for me it showed laziness in my writing and unnecessary.
jimgaffigan,@YoyodyneInc The swear words dont matter.  The funny matters.
jimgaffigan,@loquaciousl Yeah we are getting to bacon overkill.  Everyone should downlad Mr Universe.
jimgaffigan,@whiteoutgotu Yes and that head actually bought #mruniverse $5 only at http://t.co/t8KgI6nN
jimgaffigan,@haterobics I work mostly Gotham and alt rooms (or whatever they call those rooms now)
jimgaffigan,@xslamox Yes anywhere in the world and you can gift it.
jimgaffigan,@fiendforfootie This special will not be on TV.
jimgaffigan,"To be fair, since I didnt say it WAS 11:OOpm Eastern time.  Ive extended the Q & A until 11:07  #MrUniverse http://t.co/t8KgI6nN"
jimgaffigan,No i'm sorry i'm not going to be able to do that. @ChipsNLaccavole Will you retweet me? Please?
jimgaffigan,Thanks for participating in the Twitter Q & A #MrUniverse $5 http://t.co/t8KgI6nN
jimgaffigan,I will be doing a Twitter Q & A starting at 11:00pm-11:01pm #MrUniverse $5 http://t.co/t8KgI6nN.
jimgaffigan,This is serious and really infuriating.  Why do we treat our own soldiers like this? http://t.co/5YgXE3zR
jimgaffigan,Cant express how much I appreciate everyones help getting word out about #MrUniverse http://t.co/t8KgI6nN Ur the best Marketing Department
jimgaffigan,I can't believe our 9 month old still can't ride a bike.  How pathetic
jimgaffigan,RT @HuffPostComedy .@JimGaffigan is tired of your phone photos http://t.co/vSf6zfat http://t.co/fykVzWuY
jimgaffigan,Thx Atlantic @HamptonStevens: The Radical Averageness of Jim Gaffigan's Stand-Up Comedy - The Atlantic http://t.co/iFYzxW6T
jimgaffigan,Jim Gaffigan Makes Ice Cream better http://t.co/a96Wu57g
jimgaffigan,"If I'm ever murdered, have the police question these neighbors. Listen.. http://t.co/W9K6YZn4"
jimgaffigan,"RT @CollegeHumor: Alright, the infomercial for @JimGaffigan's Stand-Up Special is pretty awesome. Well done, Sir. Well done. http://t.co ..."
jimgaffigan,"Referring to your ""psychic"" is neat way of telling me you are crazy."
jimgaffigan,Did AT&T stop providing mobile phone service and nobody told me?
jimgaffigan,Those sockmonkies of me and Conan were a gift from http://t.co/KppYcRh2
jimgaffigan,Is it possible to eat Burger King by yourself and not look suicidal?
jimgaffigan,Guess where I am? http://t.co/nzPUYJjJ
jimgaffigan,"Thanks to everyone who bought #MrUniverse at http://t.co/UHFmAmYx for $5.  To everyone who didnt, may your printer always be out of paper."
jimgaffigan,Indianapolis date now on sale! Over 40 shows on sale at http://t.co/fykVzWuY
jimgaffigan,Just heard if you buy or gift #MrUniverse at http://t.co/fykVzWuY $5 you DON'T have to go to work today! Available worldwide.
jimgaffigan,RT @Buck: My buddy Jim Gaffigan just released his latest work #MrUniverse for only $5 at http://t.co/AserG6s2. His comedy is brilliant.  ...
