jimgaffigan,THX PB! RT @PassoverBunny Hey @Jimgaffigan Most popular Passover gift has been tickets to ur upcoming shows. http://tinyurl.com/6lnykv
jimgaffigan,THX EB! RT @EasterBunny Hey @Jimgaffigan Most popular Easter gift has been tickets to ur upcoming stand up shows. http://tinyurl.com/6lnykv
jimgaffigan,"4 kids is gonna be easier than 3, right? Cause I'm tired."
jimgaffigan,"Sorry for those offended in Seattle.  I thought u were known for rain.  Maybe we should rename Seattle ""Sensitive""."
jimgaffigan,"More rain.  They should just rename April ""Seattle""."
jimgaffigan,In honor of Earth Day I won't comment on how horrible her weather is.  #46inNYC
jimgaffigan,I have more pictures of my kids than my Dad even looked at me.
jimgaffigan,It's Earth Day but shhh don't tell the earth let's have it be a surprise.
jimgaffigan,"""Exporting Raymond"" Looks good http://www.youtube.com/watch?v=OBbg8oP7_Q0&feature=related"
jimgaffigan,The term FAIL is the Not! of today. And I love itNot! #FAIL
jimgaffigan,I'm sick of the cold.  I'm ready to complain about it being too hot.
jimgaffigan,Today we saw an ultra-sound of our unborn baby.  He already has more hair than me.
jimgaffigan,The best part of online shopping for kids clothes is that it takes twice as long.
jimgaffigan,I'm glad we bombed Libya to stop Gaddafi.  That was worth it. Glad hes gone now.
jimgaffigan,"La-la-la, la-la-la Elmos Worldand we just live in it, right?  Get over yourself Elmo!"
jimgaffigan,Know what would be a great Easter/Passover gift for ur loved 1?  Tkts to one of my upcoming shows -&gt; http://tinyurl.com/6lnykv
jimgaffigan,RT @GregFitzShow: New podcast w/ @jimgaffigan up now! Steve Schirripa (Sopranos) on my Carolines show tonight.
jimgaffigan,Had a dream the media figured out Trump was not running 4 prez and just promoting his reality show.  Oh dreams.
jimgaffigan,I don't know if I'm sick or if I just feel like an audience member of the Dr Oz show.
jimgaffigan,The hardest part of acting is acting like u want to the play after 75 performances. #StillGrateful
jimgaffigan,The word economical is really an inefficient use of letters.
jimgaffigan,I'm about to be the father of 4.  Anyone know where I can get a money printing machine?
jimgaffigan,That Royal Wedding proves the British are right.  Americans are more superficial.
jimgaffigan,I heard the princess to be is pregnant. Yeah right! Like a Prince would have sex before marriage.
jimgaffigan,The Royal wedding is when?  And when is the Royal divorce?
jimgaffigan,"Hey ST LOUIS, Special Pre-sale my @FoxTheatreSTL show. http://tinyurl.com/6lnykv  Password=BACON New Hour + classics."
jimgaffigan,Taco Night with kids.  I think they would make less of a mess if they threw the tacos on the floor.
jimgaffigan,"If u went to Charlie Sheen's live show and were disappointed, that's not Charlie Sheen's fault."
jimgaffigan,So Shaggy is frightened of a sheet but comfortable with dog that talks?
jimgaffigan,"Why is the show called ""Scooby-Doo: Where are you?""  He's in every episode.  They're never looking for him."
jimgaffigan,I bet if I was a Cylon I wouldnt be so depressed.  Or so nerdy.
jimgaffigan,"Hey NYCers, @JeannieGaffigan saw @Tomshillue in Supernormal @PS122.  She loved it.  He is genius.  Go!"
jimgaffigan,Asked my 6 year old if she's been working on her listening.  No answer.
jimgaffigan,Sorry I got nothing.  Check out my upcoming tour dates (new hour + oldies) if you want http://tinyurl.com/6lnykv
jimgaffigan,A government shut down would worry me if I thought they were actually ever open.
jimgaffigan,ORLANDO 2nd show added. Onsale today! http://tinyurl.com/6lnykv  PL RT in FL or have strange adult Disney obsession.
jimgaffigan,LOS ANGELES show finally! Presale today(10am) & Thursday. Password: BACON Tkts http://tinyurl.com/6lnykv PL RT SoCal
jimgaffigan,"""Dress to kilt"" @RealKiefer performs  http://plixi.com/p/89893838"
jimgaffigan,If you ever wondered what I looked like in a skirt... http://plixi.com/p/89871088
jimgaffigan,"@YulVazquez You were so awesome as was @chrisrock & every1 in cast.  ""MotherF$$$er with Hat"" is simply great. Congrats."
jimgaffigan,This has been the worst April Fools Day ever.  APRIL FOOLS!  They're always horrible.
jimgaffigan,THX @MikeBlejer HEY WHAT DOES SUBVERSIVE MEAN? RT @punchlinemag Why @JimGaffigan is more subversive than u think: http://tinyurl.com/48vvtun
jimgaffigan,I don't think this Kringle diet is working.  http://plixi.com/p/88316005
jimgaffigan,"I got my hair cut today.  Not that @jeanniegaffigan noticed. Oh, why do I even bother?"
jimgaffigan,"Dear Twitter police,  I didn't misspell ""creative"".  I spelled it creatively."
jimgaffigan,Thank God they are making ANOTHER Superman movie! And people say creaitivity is dead in Hollywood.
jimgaffigan,Thanks to @PaulNoth RT: @ChutzpahShiksa Young Justice is alright but it's no Pale Force w/ @JimGaffigan and #Conan.
jimgaffigan,"Wisconsin Honorable Mentions:  Spotted Cow Beer, Green Bay Packers, Kopp's and Mader's."
jimgaffigan,"Favorite things from Wisconsin: Bratwurst, Kringle, Cheese & @jeanniegaffigan.  In that order."
jimgaffigan,Mission Accomplished!  #Kringle @jeanniegaffigan #craving http://plixi.com/p/87906522
jimgaffigan,Help Michael!  He's not sick and this is not important really RT @michaelianblack I'm in the Top 10 now.  http://tinyurl.com/4pjwyrg
jimgaffigan,Check out The Confession on @hulu: http://t.co/zeCEQ8p  It's awesome.  Congrats @realkiefer
jimgaffigan,I think Gaddafi should go but while we are at it can we can send some troops to get rid of winter?
jimgaffigan,I'll have a coffee and the half an ounce of orange juice http://plixi.com/p/87832949
jimgaffigan,Scary to think we will soon have 4 kids.  The good news is we live in a 2 bedroom 5-story walk-up.
jimgaffigan,Im presenting at the @shortyawards tonight.  And you thought I wasnt big in the Hip Hop community.
jimgaffigan,I look so much like Brad Pitt in this @PopEater interview http://tinyurl.com/6f2zmr2
jimgaffigan,Screaming children has made me really love the sound of the vacuum cleaner.
jimgaffigan,"Dear Mpls,  A third show is going on sale today at noon! Tour dates -&gt; http://tinyurl.com/ca2cxa  PL RT  MN, WI, SD, ND"
jimgaffigan,"Why don't they just rename the USA Network the ""Law & Order Marathon Network""?"
jimgaffigan,"Sometimes I switch to the Old Twitter for nostalgia.  Ah, Twitter Classic.  Those were the days."
jimgaffigan,I've only been on Broadway for a month and already they're naming things after me. http://plixi.com/p/87461370
jimgaffigan,Can't wait for The Confession.  John Hurt and @RealKiefer online soon http://plixi.com/p/87260323
jimgaffigan,"Fun with Nathan Lane, Jason Patric and @RealKiefer  http://plixi.com/p/87256223"
jimgaffigan,RT @jeanniegaffigan: Law & Order is the Scooby Doo for adults.
jimgaffigan,I like to think of myself...that's all.  I like to think of myself.
jimgaffigan,http://twitvid.com/QGSYZ - Pre-Show gargling #Jameson with Jason Patric.  @thatchampseason
jimgaffigan,LA added. Summer/fall shows will be 1hr of new stuff + classics.  Cities/dates here  http://tinyurl.com/6lnykv RT CA
jimgaffigan,I miss my beard.  I need facial hair.  I feel like I look like a snowman.
jimgaffigan,"Soon Ill have to feed 4 kids!  Of course, after I feed myself.  Those are going be some skinny kids."
jimgaffigan,"Pregnancy cravings are adorable, but when i have cravings i'm a pig.  I call that sexism, folks!  #BurnMyJockStrapIfIhad1"
jimgaffigan,"Help @jeanniegaffigan pregnancy craving of authentic Danish Kringle in NYC?  BTW, what do Danish people call danish?"
jimgaffigan,"RT @SandyKenyonWABC: Comedian Jim Gaffigan may steal the show in a dramatic role, despite a cast full of celebrities. I sat down with... ..."
jimgaffigan,"Hey Minneapolis, special pre-sale 2day 4 my shows today! Password BACON http://tinyurl.com/6lnykv  PL RT in MN, IA, WI"
jimgaffigan,"Hey Chicagoans & Region Rats, Im doing 2 shows @ChiHorseshoe.  Presale 2day http://tinyurl.com/6lnykv  PL RT in IL & IN"
jimgaffigan,"To witness the brilliance of Elizabeth Taylor watch ""Who's afraid of Virginia Woolf""."
jimgaffigan,It's hailing the size of diamonds in NYC.  What did Liz Taylor just die?
jimgaffigan,Luckily I'm one of those people that can work out 3x a week and still look out of shape.
jimgaffigan,If I worked out half as much as I dislike going to the gym Id be ripped.
jimgaffigan,RT @KathyParkes1959: @JimGaffigan funny guy! watch him & @RealKiefer on  #TheView http://www.twitvid.com/ZAKHK
jimgaffigan,"RT @JimAxelrod: cbs sunday morning.  intw with cast of ""that championship season"".  sutherland, noth, patric, cox, gaffigan.  http://bit ..."
jimgaffigan,"If they ever made shampoo and conditioner bottles that looked different, I dont know what Id be annoyed about in the shower."
jimgaffigan,"""Gaddafi Defies Ceasefire""  Gee, that doesn't sound like the Gaddafi I know."
jimgaffigan,My 6 year old just told me I smelled like an airplane seat.  She needs to take the bus more.
jimgaffigan,"Summer shows: Foxwoods, Borgata, Clearwater, Orlando, Detroit, Hammond & Myrtle Bch- http://tinyurl.com/6lnykv  PL RT"
jimgaffigan,Ugh! Too much Guinness last night.  Now I feel how I look.
jimgaffigan,"It's just beautiful out there today.  Well, time for a nap."
jimgaffigan,"RT @ccinsider: Tonight at 11:30/10:30c, we Give It Up for Greg Giraldo with a new special. Tweet your favorite #greggiraldo memories. ht ..."
jimgaffigan,"RT @jeanniegaffigan: Dear @JimGaffigan, @RealKiefer & Jason Patric... this could be a SCANDAL! http://t.co/3VAmKGu"
jimgaffigan,Driving thru Times Sq saw 2 fights.  Looked less like St Paddy's Day and more like UFC auditions.
jimgaffigan,Some of the topics the news media consider news are more depressing than the actual news.
jimgaffigan,Thinking of going to an Irish bar with @jeanniegaffigan.  I wonder if its going to be crowded?
jimgaffigan,"Thanks, @barbbernstein, for helping to make @TwitChange such a big success. @OOIAL and I appreciate it"
jimgaffigan,Thanks for supporting @twitchange and giving to @OOIAL RT @briansmacdonald: Ask a Pregnant Lady http://bit.ly/hx1jfE
jimgaffigan,Im more afraid of mispronouncing nuclear than an actual meltdown.
jimgaffigan,Hey Florida Special pre-sales 4 Clearwater 7/22 today. Orlando 7/23 Password BACON. http://tinyurl.com/6lnykvPl RT in FL
jimgaffigan,Hey Carolinas Special presale for Myrtle Beach today.  Password Bacon. http://tinyurl.com/6lnykv sorry was bad link b4
jimgaffigan,"I always imagine St Patrick is looking down today thinking,  What are they doing? I didnt even drink?"
jimgaffigan,"Happy St Patrick's Day, or for those of you that have already started celebrating, happiay Sainch Patdrich4what?stsday!"
jimgaffigan,RT @broadwaycom: Comedian Jim Gaffigan on transitioning from one-man band to team player in THAT CHAMPIONSHIP SEASON: http://bit.ly/epjC ...
jimgaffigan,This year for lent I'm giving up telling people what I'm giving up for lent.
jimgaffigan,RT @ConanOBrien: Japan needs our help. Go here to donate to @redcross disaster relief: http://bit.ly/eZJDoJ
jimgaffigan,"Hey Detroit, special pre-sale Meadowbrook August 6th http://tinyurl.com/6lnykv Password is BACON case sensitive"
jimgaffigan,"Special pre-sale today for Borgata - ATLANTIC CITY July 9th http://tinyurl.com/6lnykv  Please return in NJ, NY, PA"
jimgaffigan,"'That Championship Season': A boozy, brawling winner - USATODAY.com http://usat.ly/hdA5Zf via @USATODAY"
jimgaffigan,News Review: That Championship Season | EW.com http://t.co/S2uPE6G via @EW
jimgaffigan,Starry cast is smooth in 'Championship Season' - Yahoo! News http://yhoo.it/fZRFZx
jimgaffigan,"RT @marcmaron: The one thing I have to offer in memory of Mike DeStefano is the talk I had with him. Deep, real, life. RIP. http://bit.l ..."
jimgaffigan,Opening night on Broadway for @ThatChampSeason.  Tell me to break a leg.
jimgaffigan,"Special presale Foxwood Casino 6/25.  Password bacon. http://tinyurl.com/6lnykv  PL RT CT, NY, RI"
jimgaffigan,Good to have u in twittersphere RT @RealKiefer Overwhelmed by the welcome. Hanging with @JimGaffigan -- he says hi. Talk to you tomorrow...
jimgaffigan,Sham = bad.  Poo = really bad.  Shampoo = clean hair with?
jimgaffigan,RT @broadwaycom  @Jim Gaffigan tells @JimmyFallon the secret to keeping up with Kiefer Sutherland: http://bit.ly/gV9BsD
jimgaffigan,Tonight Im on @jimmyfallon  promoting @thatchampseason
jimgaffigan,"Shows this summer!  Foxwoods Casino, Atlantic City, Clearwater, Orlando, Detroit,  Hammond, IN http://tinyurl.com/6lnykv"
jimgaffigan,"I don't want to sound out of it, but who is Charlie Sheen?"
jimgaffigan,RT @WSJAE: Jim Gaffigan: A Comic Fish Out of Water http://on.wsj.com/hFsgET
jimgaffigan,Just watched a movie on VHS.  Felt like I was camping.
jimgaffigan,"Win free tkts RT @ThatChampSeason ""Name That Character"" contest! We tweet a quote from play & the 1st to reply correctly wins 2 tkts!"
jimgaffigan,Is it spelled Ghadaffi or Asshole?
jimgaffigan,"Yes ""Beyond the Pale"" IS available on #iTunes - http://itun.es/iFv5Tk"
jimgaffigan,RT @broadwayworld: Photo Flash: First Look at THAT CHAMPIONSHIP SEASON on Stage!  http://t.co/hHa8tnB @JimGaffigan - Love the new pics o ...
jimgaffigan,The advantage of 3 children is that there is always one there to give you the stomach flu.
jimgaffigan,In NOV I was asked to be thankful. In JAN they wanted me to honor.   Now they want me to love.  Dont they realize I live in NYC?
jimgaffigan,"RT @rachelplatten: Check out songs from my album ""Be Here"" at http://bit.ly/fcHp7P The 1st single is on iTunes now!"
jimgaffigan,"Without Valentine's Day, February would be...well, January."
jimgaffigan,"If you're having a birthday today or sometime in the next year, happy birthday!"
jimgaffigan,"Thanks, @rachelplatten, youre my @TwitChange Mega auction winner."
jimgaffigan,"RT @tedalexandro: Seinfeld, Black, Quinn, Norton, Papa, Joyce, Alexandro! Greg Giraldo Benefit Show tonight at the Beacon Theater! http: ..."
jimgaffigan,RT @thecomicscomic: Greg Giraldo's widow and best friend launch foundation for children impacted by addiction http://bit.ly/gClGGJ
jimgaffigan,RT @jeanniegaffigan: So excited! @jimgaffigan @ThatChampSeason http://www.youtube.com/watch?v=kQyGAciA48s
jimgaffigan,I'm on Letterman tonight promoting @ThatChampSeason
jimgaffigan,Learning Taco Bell meat is not meat is like finding out cigarettes are addictive.
jimgaffigan,My wife is 5 months pregnant.  Now she knows how I feel.
jimgaffigan,More snow?  We should just rename NYC East Minneapolis.
jimgaffigan,Aw shucks RT @jeanniegaffigan: Adorable @jimgaffigan on red carpet for premiere of Salvation Boulevard #sundance. http://yfrog.com/gyf65yj
jimgaffigan,But @Jeanniegaffigan you have my complete attention! http://plixi.com/p/72060204
jimgaffigan,Hey @tpolamalu and @TwitChange I am in!!! @TwitChange 2.0: The Fan Takeover @ http://TwitChange.com
jimgaffigan,RT @ThatChampSeason: The cast of @ThatChampSeason prepare for their Times Talk interview @JimGaffigan  http://yfrog.com/gykn6xdj
jimgaffigan,I dont know what's more exhausting about parenting the getting up early or the acting like u know what ur doing.
jimgaffigan,Looks like u could fit 2 of Kiefers heads in my head RT @KatieKWaters look who's on tv http://plixi.com/p/69594221 #thatchampionshipseason
jimgaffigan,Jason Patric looking very old at st Johns game #thatchampionshipseason
jimgaffigan,Playing like a bunch of girls! http://plixi.com/p/69587532
jimgaffigan,At St John's game.  Kiefer's drink or a urine sample? #thatchampionshipseason http://plixi.com/p/69583456
jimgaffigan,No garbage pick up today.  So now an IMPENDING snow storm is an excuse not to do your job?
jimgaffigan,Just watched Jason Patric learn how to fall down stairs drunk. It was like a watching a fish being taught to swim. #thatchampioshipseason
jimgaffigan,Is there anything scarier than a drunk guy in a New York Rangers jacket?
jimgaffigan,Both born with the last name Noth.  My wife and my father-in-law. #thatchampionshipseason http://yfrog.com/h3e26ij
jimgaffigan,Jason Patric and Chris Noth discussing why I'm so good in That Championship Season http://yfrog.com/gy2vegoj
jimgaffigan,"http://tinyurl.com/2uuoqfw Scroll down for marquee photos and tickets to ""That Championship Season"" on Broadway!"
jimgaffigan,"Dear Snow, You just arent that charming after Christmas."
jimgaffigan,"Dear loud talkers, can you at least be discussing something interesting?"
jimgaffigan,The only people you see eating a calzone are people that shouldn't be eating a calzone.
jimgaffigan,"The holiday ecard: ""Wow, you thought enough to spam me."""
jimgaffigan,RT @marcmaron: New Ep @WTFpod is UP! The Lost WTFs. Dan St. Germain @eddiepepiton Toby Huss @JimGaffigan Dr. Steve. Happy New Year! http ...
jimgaffigan,My beer.  Thanks Pabst and Point! http://plixi.com/p/66726167
jimgaffigan,This flu I have is horrible and not just cause I cant eat cheese..
jimgaffigan,Is the Poinsettia the candy corn or Peeps of flowers? #fromlastyear
jimgaffigan,RT @jeanniegaffigan: Yes @jimgaffigan & y r the Kay commercials just a slightly younger version of the Viagra ads?
jimgaffigan,Ok Kay Jewelers we get it. You sell ugly jewelry. You can stop with the commercials. Thanks.
jimgaffigan,Christmas is like finals week for Christians.
jimgaffigan,"RT @withreservation: Photo: @JeannieGaffigan and @JimGaffigan after the show - Nokia Theater - December 18, 2010 http://tumblr.com/xuf13 ..."
jimgaffigan,"Dear God,  If you have any more children, can you have them born in June?"
jimgaffigan,This is how i order pants too http://tinyurl.com/da62jf  Thanks @sheckyb
jimgaffigan,"Benefit 4 Giraldo Family: Seinfeld, @tompapa @jimnorton @iamcolinquinn TKTS avail @10am http://tinyurl.com/27om736 PL RT"
jimgaffigan,"The facebook guy wins ""man of the year"".  Who gets it next year, The guy with the sippy cup from TMZ?"
jimgaffigan,RT @jeanniegaffigan: Was so naughty in bed last night with @jimgaffigan...we ate a whole thing of Ben & Jerry's Peanut Butter Cup. So yum.
jimgaffigan,"Maybe instead of thinking of yourself this holiday season, you could buy me an iPad."
jimgaffigan,Directions to our apartment should always end with and follow the sound of screaming children.
jimgaffigan,"Giraldo Benefit concert: Seinfeld, Lewis Black, @JimNorton @tedalexandro Tkts on sale Sat http://tinyurl.com/29dlafl PL RT"
jimgaffigan,How come you only remember you are out of shampoo when you are in the shower?
jimgaffigan,My baby threw up on me this morning.  She really cant handle her liquor.  No more beer for breakfast.
jimgaffigan,This morning my 5-year-old asked me if I could make his some dessert instead of breakfast.  I guess he is my son.
jimgaffigan,My 6-year-old wrote a letter to Santa and spelled Santa wrong.  I hope spelling doesnt count in Santeas good or bad evaluation.
jimgaffigan,"Premium tickets to ""That Championship Season"" Sutherland, Cox, Patrick, Noth http://tinyurl.com/6lnykv  PL RT"
jimgaffigan,"Yes, that's really me in that picture.  Get tickets here http://tinyurl.com/6lnykv http://yfrog.com/0auboj"
jimgaffigan,Ok winter you've made your point: I'm a pussy.
jimgaffigan,"If Im allowed to pick my last meal, Id like it to be the deep dish sausage pizza from Lou Malnati's."
jimgaffigan,"Um, is there any way we can get a table near the bullet hole? http://yfrog.com/0qiw90j"
jimgaffigan,Guess who I spotted in the East Village?  I couldn't believe it. http://yfrog.com/jwl6901j
jimgaffigan,Thanks every1 who came to my NYC @BestBuy_Theater shows Fri&Sat. So fun. More shows Dec 17 & 18 http://tinyurl.com/6lnykv
jimgaffigan,In honor of Waffle House trending http://tinyurl.com/dkq44f
jimgaffigan,Another reason to love @ToddGlass.  It's Dec and he refused to wear a winter coat. http://yfrog.com/0ek6801j
jimgaffigan,I seem to be most tired when Im awake.
jimgaffigan,Still up.  I can never sleep the night before Hanukkah.
jimgaffigan,What exactly is the difference between a poppy seed muffin and muffin filled with dead fruit flies?
jimgaffigan,"RT @punchlinemag: yay! @JimGaffigan audio interview (26 mins, uncut) from just an hour ago. Listen! http://tinyurl.com/29symz3  pls RT"
jimgaffigan,Happy Hanu...Chanu...um Jewish holiday in December!
jimgaffigan,"Cool poster by @samuelho 4 my NYC shows Dec 3, 4 & 17, 18 Tkts here http://tinyurl.com/6lnykv http://yfrog.com/cbbha0j"
jimgaffigan,"Cyber Monday Special:  If U buy tkts to 1 of my NYC Best Buy Thtr shows, I promise to mention food in my show 4 U. http://tinyurl.com/6lnykv"
jimgaffigan,Can we just make it against the law to serve guacamole without chunks of avocado in it?
jimgaffigan,Why does Santa make a big deal sneaking down the chimney on Xmass when I see him walking around the mall like everyday?
jimgaffigan,"Sorry Orlando date change: I was cast in a B'dway play, That Championship Season, so 1/14 Orlando show NOW 7/24 http://tinyurl.com/29mg5r2"
jimgaffigan,"Next Friday is Pale Friday. Celebrate at the Best Buy Theater in NYC. Then ""Balding"" Saturday. Dec 3,4 & 17,18 http://tinyurl.com/6lnykv"
jimgaffigan,"I forget, is the Sunday after Thanksgving Asian or Hispanic?"
jimgaffigan,Why do they assume the Friday after Thanksgiving is Black?  Does is have a deep voice?
jimgaffigan,Cool poster for tonights Phoenix show.  Thanks to B Wilson. Tkts here http://tinyurl.com/6lnykv http://yfrog.com/mtml00j
jimgaffigan,People shopping is news?  And I thought televising people playing poker was pathetic.
jimgaffigan,"The day after Thanksgiving is like the Dancing with the Stars of shopping days, right?"
jimgaffigan,Do they make the cribs that dont look like baby jails from the 1920s?
jimgaffigan,"Im thankful to all that have come to see my new hour. Upcoming PHX (11/27) NYC (12/3,4 17,18) MILW (12/30,31) http://tinyurl.com/6lnykv"
jimgaffigan,Im thankful that we are only mandated to be thankful 1 day a year. Can you imagine being grateful year round?
jimgaffigan,The North-South Korea fight is really getting in the way of all that important British wedding news.
jimgaffigan,There's nothing sadder than a wet hot dog bun.
jimgaffigan,And i thought being a bathroom attendant was a tough gig. http://yfrog.com/59jc8j
jimgaffigan,Dont you wish there was a Previously on recap segment for when you run into some people?
jimgaffigan,"On Amazon ""Beyond the Pale"" Blue Ray is only $5.99. http://tinyurl.com/2aea3cg I think I make more money when people illegally download it."
jimgaffigan,"Choosing an emotion for this afternoon.  Fear, sadness or anger?  Hmmm. Anger you old pal, get over here."
jimgaffigan,If you are sick of twitter PL RT
jimgaffigan,Flying to Phx Wed for Sat show  @Comerica. http://tinyurl.com/6lnykv What do I wear to be inappropriately touched by TSA?
jimgaffigan,Hey @SenJohnMcCain any interest in opening for me in PHX 11/27?  Must be clean! No filth!  price tkts for @McCainBlogette if you open? Huh?
jimgaffigan,Prediction:  Super Bowl Jets vs Eagles
jimgaffigan,"""Can you believe I'm sitting in a purse?"" http://yfrog.com/69lecrj"
jimgaffigan,"RT @thecomicscomic: Jim Gaffigan adds seventh Nokia Theater date in NYC, talks about taking on Broadway, return of the McRib http://bit. ..."
jimgaffigan,"""Yeah, but is it organic?"" ""I guess he iS Midwestern.""""Wait, is he doing his voice thing on twitter?"" http://plixi.com/p/57779244"
jimgaffigan,Why isn't more of life as good as a toasted everything bagel with cream cheese on?
jimgaffigan,Banco Popular? I don't know anyone who bancos there.
jimgaffigan,Thx to every1 who came to my show @Wang & thx @denisleary for letting me be part of CCH. So fun. Nxt up PHX & NYC http://tinyurl.com/2f4merp
jimgaffigan,I'm on @hbo tonight guest starring on the #boredtodeath finale with @hodgman Thanks again @JonathanAmes for having me!
jimgaffigan,I'm in Boston at The Wang Center tonight which is a coincidence cause that was my mother's maiden name.
jimgaffigan,Dear Veterans.  Thanks.  You did more before 9AM than I ever did.
jimgaffigan,"So someone was like,""You know how people struggle with their addiction to alcohol? Let's mock them! http://yfrog.com/48h1dj"
jimgaffigan,"RT @nerdist: We have a winner for the @JimGaffigan poster challenge on the @node!!! Also, see all entries: http://afx.cc/j92"
jimgaffigan,Just saw Radio City Christmas Spectacular.  The Rockettes were great but I was jealous because I auditioned to be 1 & didn't make the cut.
jimgaffigan,Great to have @ConanOBrien on television.  TBS 11pm/10c  @teamcoco
jimgaffigan,"Shoot, forgot to do the New York City Marathon.  Again."
jimgaffigan,"Sorry, can't have my holiday toy & gift guide b diapers.com.""You know I got u something good cause I got it from http://plixi.com/p/55224194"
jimgaffigan,God Bless America! @dbgb's http://plixi.com/p/55223305
jimgaffigan,"Duchovny and entire cast were amazing in ""The Break of Noon"" at Lucille Lortel theater."
jimgaffigan,Is the Playbill the diploma or the trophy for attending a Broadway play?
jimgaffigan,"Ooo! Didn't know there'd be a flight attendant! @Support ""Actions on Twitter are experiencing delays. We're working to fix difficulties..."""
jimgaffigan,"When a four year old says ""Ew. I dont like mashed potatoes"" you realize how truly dumb children are."
jimgaffigan,Thanks Colin.  Can't wait to see your show.@cqonbroadway Welcome to #Broadway @JimGaffigan. It's a tough street. http://ow.ly/34HKU
jimgaffigan,And i thought I was excited about the McRib being back.  Check this out http://tinyurl.com/36ox2p9 #disbelief
jimgaffigan,"Today EVERYONE is supposed to vote?  Boy, this ""Dancing with the Stars"" thing is getting out of control."
jimgaffigan,"Best costume from last night @mrhoratiosanz ""Che Guevara T-Shirt"" http://yfrog.com/2fkv1j"
