london2012,Gold: Italy have their third #Fencing gold after winning the mens Team Foil tonight #London2012 http://t.co/kHhDSNK6
london2012,More #Wrestling gold!: Russias Roman Vlasov takes the mens 74kg Greco-Roman victory http://t.co/wQQADk97 #London2012
london2012,Gold: Wu Minxia wins gold for China and equals the record for the most Olympic #Diving medals http://t.co/eYxvKUDj #London2012
london2012,#Wrestling gold: Irans first #London2012 gold! H. Soryan Reihanpour wins the 55kg Greco-Roman Final http://t.co/V91X3t0z #London2012
london2012,RT this if you can't wait for the #London2012 men's 100m Final tonight! Who's going to win? #Athletics http://t.co/N1x2BeDs
london2012,"Gold: Earlier on Loof &amp; Salminen (SWE) won men's Star #Sailing. 2nd: Percy &amp; Simpson (GBR), 3rd: Scheidt &amp; Prada (BRA) http://t.co/5BD6eeWH"
london2012,"Gold: Hansen (DEN) wins (despite a nasty leg wound) men's Omnium #TrackCycling. 2nd: Coquard (FRA), 3rd: Clancy (GBR) http://t.co/3rpMkVz9"
london2012,#Tennis gold for Belarus!: Azarenka and Mirnyi beat Robson and Murray of Great Britain in the Mixed Doubles Final http://t.co/IuF0Oh4f
london2012,"Another #Weightlifting gold!: Zhou Lulu of China takes victory with a world record in the womens +75kg 
http://t.co/9kIVp8DY  #London2012"
london2012,Pic: ferocious poses struck by Bernadova &amp; Dufkova of the Czech Republic in the #Synchro #Swimming http://t.co/1soHwE6k
london2012,Pic: Today's #London2012 programme focusses on the men's 100m Final - check out the front cover #Athletics http://t.co/7Ix7i9nF
london2012,"Gold: With a win in the mens Doubles, China have taken all five #Badminton gold medals at #London2012 http://t.co/Jjd6nPn4"
london2012,The first #Synchro #Swimming has started today with the women's Duets. Keep track of this incredibly graceful sport: http://t.co/FGAWQOAD
london2012,#Gymnastics gold!: K. Berki (HUN) wins the men's Pommel Horse with L. Smith (GBR) 2nd &amp; M. Whitlock (GBR) 3rd http://t.co/8tyzQ8gU
london2012,"Andy Murray: ""That's number one for me, the biggest win of my life"" #London2012"
london2012,Gold: Andy Murray beats Roger Federer at Wimbledon to take men's Singles Tennis gold for Great Britain http://t.co/omknor6B #London2012
london2012,Gold: Sandra Raluca Izbasa takes #Gymnastics gold for Romania in the women's Vault http://t.co/VKKT75kN #London2012
london2012,Gold: the USAs Williams sisters win the womens Doubles #Tennis: their 3rd Olympic title http://t.co/FrIYCmcP
london2012,Gold: Ben Ainslie wins his 4th Olympic gold in the men's Finn #Sailing: the most successful sailor in Olympic history http://t.co/oBMyXBpG
london2012,Gold: The medal for the #Gymnastics mens Floor Exercise goes to Chinas Zou Kai http://t.co/epLWTw9S
london2012,Gold: Lin Dan wins the #Badminton mens Singles for a second time! China still on for a clean sweep in the sport: http://t.co/nAiguTme
london2012,Now in the ring: womens #Boxing for the 1st time on the Olympic programme: http://t.co/rn3kvHac
london2012,Gold: Ethiopias Tiki Gelana wins the womens Marathon in 2:23:07  an Olympic record! See great photos here: http://t.co/VDKCC5wp
london2012,Gold: Jin Jongoh (KOR) retains his Olympic title in the men's 50m pistol #Shooting. He wins gold with a score of 662.0 http://t.co/ESJcLD6L
london2012,"Pic: The womens Marathon is under way on Londons streets. The route takes in some iconic sights, like Big Ben http://t.co/nCiaJoa6"
london2012,Pics: Be dazzled by Londons seven most famous bridges beautifully lit up at night in honour of #London2012 http://t.co/5PLCSt5s
london2012,Could it be a clean sweep for China in #Badminton? By the end of today they may have all 5 gold medals up for grabs http://t.co/b5QYwaIp
london2012,Ready for the mens 100m Final? Keep up to date with all things #Athletics today on the #London2012 website http://t.co/KVZjEVOS
london2012,Loved #SuperSaturday?  Are you ready for what weve got in store today? 23 gold medals...  &amp; a lightning Bolt! http://t.co/RCMB55jf
london2012,Pic: Superb aerial view of the packed #London2012 Olympic Stadium on Super Saturday http://t.co/Vq0yLRYW
london2012,Michael Phelps was asked tonight what he wants to do in retirement. The answer?: 'cage dive with great white sharks in South Africa' :-)
london2012,RT @iamwenlock: This picture is called 'EPIC HUG WITH @Mo_Farah :-D' http://t.co/H5dCV59j
london2012,"No more medals this eve, but still plenty of great sport - check our schedule for more #London2012 action tonight: http://t.co/jjTO1LHV"
london2012,What an incredible Super Saturday! #London2012
london2012,Last gold of the day goes to....Jamaica!:  Fraser-Pryce retains gold in the womens 100m Sprint Final: http://t.co/HcvSrXUN #Athletics
london2012,RT @iamwenlock: Had a little hug and dance with a gold medallist :-D
london2012,"#Athletics Gold for Team GB again! Mo Farah wins the men's 10,000m. The Olympic Stadium is going crazy! http://t.co/cqLuhZrY #London2012"
london2012,RT @iamwenlock: This is amazing! I get to cheer from the side of the track during the men's 10000m final! Everyone in the Stadium's goin ...
london2012,More #Athletics Gold!: 1st time Olympian Greg Rutherford wins the mens Long Jump for Team GB with a top jump of 8.31m http://t.co/hELD1axE
london2012,"#Athletics gold for the host-nation!: gold for Jessica Ennis, she wins the women's Heptathlon with style http://t.co/19MRg8nh #London2012"
london2012,"Gold: 1st time Olympian Sandra Perkovic wins the womens Discus, setting a National Record for Croatia http://t.co/79lOfmHn #London2012"
london2012,"Gold: Ilya Ilyin (KAZ) retains Olympic gold in mens 94kg #Weightlifting,setting a new World Record! http://t.co/RaIJN0zr"
london2012,#Swimming gold for USA!: they win the 4x100m Medley Relay. Gold for Michael Phelps in his last Olympic swim http://t.co/XyAPnBmk #London2012
london2012,#Swimming gold &amp; WR!: USA take the women's 4x100m Medley Relay in style with Australia 2nd and Japan 3rd http://t.co/2gHMQ6uK #London2012
london2012,"Gold: China take #Fencing gold in the Womens Team Epee, defeating Republic of Korea by 39 points to 25 http://t.co/SpmlMwiM #London2012"
london2012,"Gold &amp; WR: Sun Yang (CHN) powers to victory in mens 1500m Freestyle #Swimming, smashing the World Record
http://t.co/KefmXz74 #London2012"
london2012,Gold: 21-year-old Kromowidjojo (NED) wins the womens 50m Freestyle #Swimming setting a new Olympic Record of 24.05 http://t.co/3YgjZO9S
london2012,"Rock the Games! @RizzleKicks @mikasounds, @LawsonOfficial + @pixiesongs answer your Qs live on our YouTube channel! http://t.co/SIGsoU40"
london2012,Sir Paul McCartney is seen in the Velodrome crowd as Team GB's women receive their gold &amp; the crowd burst into the 'nananas' of Hey Jude!
london2012,Gold! 19-year-old Ding Chen (CHN) wins the mens 20km Race Walk setting a new Olympic Record of 1:18:46 http://t.co/wn0eEuF4 #London2012
london2012,Gold: Team GB win the 1st ever Olympic womens Team Pursuit #TrackCycling final in a new World Record time http://t.co/ho6ni3sk #London2012
london2012,Gold: The Bryan brothers (USA) win the mens Doubles #Tennis beating Tsonga and Llodra (FR) in 2 sets http://t.co/fmM2jBwh #London2012
london2012,#Badminton Gold!: Tian &amp; Zhao (CHN) win the womens Doubles beating the Japanese pair of Fuji &amp; Kakiiwa 2-0 http://t.co/dnfXfGSO #London2012
london2012,"Pic: The #London2012 gold, silver, and bronze medals. RT this if you want your team to win one of these today! http://t.co/fK3wER2H"
london2012,Gold: Maclennan (CAN) wins womens #Trampoline beating her previous Olympic best ranking of 7th in 2008! http://t.co/PPJbjYqo #London2012
london2012,Gold! Li Xuerui (CHN) wins the women's Singles Badminton Final in 3 sets against her compatriot Wang Yihan http://t.co/0hpmMHur #London2012
london2012,Gold: Serena Williams (USA) wins the womens #Tennis Singles and a career Golden Slam - all 4 majors + Olympic gold! http://t.co/a2ATZarZ
london2012,Pic: Zoom! Usain Bolt (JAM) &amp; James Dasaolu (GBR) power to the finish in the men's 100m Round 1 Heats http://t.co/zaC3uE8O
london2012,RT @L2012StadiumCam: @TeamGB gold! In women's Doubles flag carry. Amazing. #London2012 Hang on. Being told it's a lap of honour. Incredi ...
london2012,Cheer on your team in todays sports to get them up the #SupportYourTeam leaderboard. #Mongolia are currently leading! http://t.co/mlyD2ezT
london2012,"RT @OscarPistorius: Thank you to everyone who has supported me, that was UNBELIEVABLE! Was so amazing to feel the energy from the crowd! ..."
london2012,"Pic: For anyone who blinked, here is the photo finish from the womens #Triathlon earlier today http://t.co/edZ4P9tF"
london2012,Gold: Jamie Lynn Gray (USA) wins women's #Shooting 50m Rifle 3 Positions with an Olympic Record breaking performance http://t.co/15ZZ3tl4
london2012,Gold: The final #Rowing gold medal of #London2012 goes to Miroslava Knapkova (CZE) in the womens Singles Sculls http://t.co/ss9mV4Cc
london2012,RT @L2012Spectators: Got a ticket for Womens Marathon at 11am tomorrow? Arrive early &amp; approach The Mall from the right direction:  ...
london2012,Gold: Denmark win #Rowing gold as Mads Rasmussen &amp; Rasmus Quist triumph in the men's Lightweight Double Sculls http://t.co/Mw41c5Qb
london2012,"Men's #Football heats up with 1/4 finals: Japan v Egypt, Mexico v Senegal, Brazil v Honduras &amp; Team GB v Rep. of Korea http://t.co/bBOggsu9"
london2012,Gold: Katherine Copeland &amp; Sophie Hosking win another #Rowing gold for Team GB in the womens Lightweight Double Sculls http://t.co/qchSna0u
london2012,Gold: Great Britain have edged out Australia to win victory in the mens #Rowing Four at Eton Dorney http://t.co/IilaKsWc
london2012,Gold: In a dramatic fight to the finish at Hyde Park Nicola Spirig (SUI) wins gold in the womens #Triathlon http://t.co/7sB5FFsN
london2012,Oscar Pistorius (RSA) becomes first athlete to compete in Olympic &amp; Paralympic #Athletics. He will advance to 400m semi http://t.co/wNwrncs6
london2012,"The womens Heptathlon continues today. First up is the Long Jump, followed by Javelin + 800m later today http://t.co/r7t9rzmQ #Athletics"
london2012,Pic: An image of Usain Bolt (JAM) projected on the Houses of Parliament. He makes his 1st #London2012 appearance today http://t.co/sNeSflFC
london2012,Today is the final day of the #Rowing competition with 4 golds to be awarded - starting with the mens Four at 11:30 http://t.co/xqQqg3qo
london2012,The women's #Triathlon is under way  starting with a 1500m swim in Hyde Parks Serpentine lake. Follow the race: http://t.co/7sB5FFsN
london2012,"With 25 gold medals up for grabs, #SuperSaturday is here! Dont the miss the buzz from inside the #London2012 venues http://t.co/31oj0HIT"
london2012,Pic: It's been a week since we lit the Olympic Cauldron! How awesome does it look tonight? #London2012 http://t.co/YiNeSv01
london2012,"Gold: Tirunesh Dibaba (ETH), the 'baby-faced destroyer', wins an incredible womens 10,000m final http://t.co/fPqFFbtF #london2012"
london2012,Gold: Our first #Athletics medal! Majewski (POL) takes gold in the mens Shot Put with a 21.89m throw http://t.co/UdmeVtC6 #London2012
london2012,Gold: #Weighlifting win for Polands Zielinski in the men's 85kg. Silver for Aukhadov (RUS); bronze for Rostami (IRI) http://t.co/e57mxNHL
london2012,Both #Tennis Singles finals are set! Serena Williams will face Sharapova &amp; Murray has won to set up clash with Federer http://t.co/yqblsuX2
london2012,Gold: France's Florent Manaudou wins gold in a close-fought mens Freestyle 50m #Swimming final http://t.co/ojgoMXar #London2012
london2012,Gold: Republic of Korea take the mens Team Sabre Fencing gold in a 45-26 win against Romania http://t.co/59nTqNxu #London2012
london2012,"Gold: 15-year-old Katie Ledecky (USA) wins the womens 800m Freestyle, ahead of Belmonte Garcia (ESP) &amp; Adlington (GBR) http://t.co/6TCfQVeT"
london2012,Gold: Phelps wins an incredible 17th Olympic gold in the men's 100m Butterfly for the USA http://t.co/45CPzw3e #London2012
london2012,Gold: Missy Franklin (USA) wins the womens 200m Backstroke final with a new World Record of 2:04.06 http://t.co/MAxGnTKD #London2012
london2012,"We're back at the Olympic Stadium for our first evening of #Athletics, follow all the action as it happens: http://t.co/KVZjEVOS #London2012"
london2012,"Gold: Pendleton wins the women's Keirin in 10.965 for Team GB. Guo (CHN) takes silver, and Lee (HKG) bronze http://t.co/PriBIGPy #London2012"
london2012,"Gold: It's another #Cycling gold, and new World Record of 3:51.659, for Team GB in the men's Team Pursuit! http://t.co/YAzoZFu8"
london2012,"25 Olympic golds are up for grabs during  #SuperSaturday tomorrow, so fire up the BBQ &amp; enjoy!  http://t.co/HYIj1DaX #London2012"
london2012,Gold: Svetlana Podobedova (KAZ) takes gold in a close women's 75kg #Weightlifting final http://t.co/ojuszCL3 #London2012
london2012,Gold: Two in #Judo! Cubas Idalys Ortiz wins the women's +78kg &amp; Frances Teddy Riner takes the men's +100kg finals http://t.co/n1fZg2Kn
london2012,Gold: China increase their total golds with a win for Zhang + Zhao in the #Badminton Mixed Doubles final http://t.co/Wf7sjfF3  #london2012
london2012,Gold: Oh Jin-hyek (KOR) wins in impressive style 1-7 over Furukawa (JPN) in men's Individual #Archery http://t.co/7G3qoCtt  #london2012
london2012,Gold: Dong Dong (CHN) has bounced his way to victory in the men's #Trampoline final with a score of 62.990 http://t.co/bGMo5HNs
london2012,Federer and Del Potro are currently at 12-13 in a final set tie-break in the men's #Tennis semi-finals  http://t.co/dt5dR8nW #london2012
london2012,Gold: Leuris Pip has won Cuba's first gold medal at #London2012 in the men's 25m Rapid Fire Pistol competition. http://t.co/8LuwTWJd
london2012,"RT @L2012TableCam: Wait, where did the table go? The pace of this game must be making me hallucinate. #London2012 http://t.co/RRwnRlge"
london2012,Gold: Congratulations to 44-year-old Sergei Martynov (BLR) who secured gold in the men's 50m Rifle Prone #Shooting http://t.co/snhx55iK
london2012,Happy 28th birthday to Ryan Lochte (USA)! Find out who else is celebrating a birthday today at #London2012: http://t.co/oK3QInqE
london2012,Pic: The Olympic Cauldron shines on the 1st day of sport at the Stadium. You can hear the crowd roar across the Park! http://t.co/9LrbbSSk
london2012,"Gold: Mahe Drysdale makes it a golden day for New Zealand, winning the men's #Rowing Singles Sculls http://t.co/MuA20RYf"
london2012,"Federer v del Potro, Murray v Djokovic, Sharapova v Kirilenko, Azarenka v Williams - today's #Tennis Singles semis! http://t.co/JoPJVpUp"
london2012,Gold for Great Britain: Anna Watkins + Katherine Grainger (GBR) win gold in the final of the women's Double Skulls http://t.co/BPhEvbMz
london2012,Gold: Eric Murray + Hamish Bond have stormed ahead to win gold for New Zealand in the mens #Rowing Pair http://t.co/N6KODmld
london2012,Gold: We have our first medal of Day 7 as Germany achieve a convincing win in the mens #Rowing Quadruple Sculls http://t.co/c5dYLv6O
london2012,Pic: Jessica Ennis (GBR) in action during her world best performance in todays womens Heptathlon 100m hurdles heat http://t.co/tKpV9K94
london2012,Pic: Do you know your Nage waza (throwing) and katame-waza (grappling)? Dont miss the final day of #Judo http://t.co/7bJvgJYE
london2012,Yihan Wang (CHN) has defeated Saina Nehwal (IND) to set up an all-China final in womens #Badminton Singles tomorrow http://t.co/6Gtwmh3M
london2012,"#Athletics begins at 10:00 with some great track + field action. Two medals tonight in mens shot put + womens 10,000m http://t.co/KVZjEVOS"
london2012,Get ready for more #Rowing action today at Eton Dorney! Four more medals to be won today from 11:30. Any predictions? http://t.co/SvR3ZADn
london2012,Following the Games on social media? Check out our #London2012 Social Media Dashboard for loads of ways to join in! http://t.co/zvXYGUtB
london2012,Bring on Day 7! The Olympic Stadium gets another chance to shine with the start of the #Athletics. Preview the action: http://t.co/pNcSis5F
london2012,"RT @L2012PoolCam: Hey, I thought the #Synchro #Swimming hadn't started yet? http://t.co/mWzFCoeZ"
london2012,"RT @l2012bballcam: Uh oh, think this one's gonna hurt, @RussWest44? http://t.co/RYYDhTnZ"
london2012,"Pic: Catherine, Duchess of Cambridge, Prince William &amp; Prince Harry look ecstatic watching the #TrackCycling today http://t.co/kuUPWOjJ"
london2012,That's all of today's medals won - but there's still loads of action to come tonight. Check our schedule http://t.co/jjTO1LHV #London2012
london2012,#Swimming golds: Phelps (USA) wins mens 200m Individual Medley + Kromowidjojo (NED) wins womens 100m Freestyle http://t.co/3bsR9muR
london2012,Gold: Italy win the womens Team Foil  Final 45-31 vs Russia - it's their 5th #Fencing medal at #London2012 http://t.co/a29XkTgu
london2012,Pic: please RT this beautiful picture of Synchronised #Diving taken with a slow shutter speed - amazing effect... http://t.co/cvGXxtzK
london2012,"Fans of Mongolia have made a huge effort to climb our #SupportYourTeam scoreboard, amazing! Tweet your team to victory: http://t.co/7MEDiBm8"
london2012,You know it's an exciting #London2012 Games when 'Another World Record' is trending on Twitter :-)
london2012,"2 #Swimming golds &amp; records for USA! Soni, womens 200m Breaststroke (WR) + Clary, mens 200m Backstroke (OR) http://t.co/3bsR9muR"
london2012,Take a look at the #London2012 Medal Count and see how your team is doing: http://t.co/RcvuCElX
london2012,Gold &amp; a world record! Team GB win the mens #TrackCycling Team Sprint by an amazing 0.413 seconds http://t.co/I1AAm7sg #London2012
london2012,"#TrackCycling gold!: Germany win the womens Team Sprint, beating WR holders China in a dramatic Final #London2012 http://t.co/oeFJKJQM"
london2012,Gold: Douglas (USA) dominates in womens All-Round Individual #ArtisticGymnastics Final  #London2012 http://t.co/fxof4Naw
london2012,The competition's hotting up at #London2012. Fire up the BBQ and cheer on your team this #SuperSaturday ! http://t.co/yWHQwsb7
london2012,Pic: 71 years old &amp; competing at #London2012 today - the amazing Hiroshi Hoketsu (and his horse Whisper :-) ) http://t.co/UZybXVT2
london2012,Gold: Fers dramatic win in womens Kayak (K1) #CanoeSlalom Final increases Frances golds to 6 http://t.co/FoAZIg5P #London2012
london2012,Gold &amp; silver for China!: Zhang (and his famous backhand) defeats Wang in the  #TableTennis mens Singles http://t.co/WE13p1xj #London2012
london2012,"#Judo Gold: Kayla Harrison (USA) beats Gemma Gibbons (GBR), who gets silver, in the womens 78kg Final http://t.co/yNa71oLF #London2012"
london2012,More #Judo gold: Tagir Khaibulaev of Russia wins the men's -100kg competition http://t.co/jDlGy0Gu #London2012
london2012,Gold: Harrison (USA) performs a Kubi-nage to defeat Gibbons (GBR) in an exciting womens 78kg #Judo Final http://t.co/yNa71oLF #London2012
london2012,Gold: The gold rush continues this hour with a win for Ki Bo Bae (KOR) in women's Individual #Archery. Well done! http://t.co/5LCuEs45
london2012,"...and another gold and silver for Team GB! This time in men's Double #CanoeSlalom, with the bronze going to Slovakia http://t.co/pynzcsxC"
london2012,Gold for the host-nation!: Peter Robert Russell Wilson wins the men's #DoubleTrap #Shooting. Congraulations! http://t.co/TM9dLtNH
london2012,RT @iamwenlock: Splash! The USA celebrated their gold medal in the womens Rowing Eight by throwing their cox into the lake! :-) http:// ...
london2012,It will be China v China the mens #TableTennis Singles final. Can Wang Hao achieve his dream of Olympic Singles gold? http://t.co/WE13p1xj
london2012,Stamp of approval! The Royal Mail is issuing a commemorative stamp for each @TeamGB gold medal http://t.co/POgQofmD. Who will be next?
london2012,Gallery: Check out these pics to get in a windy mood for #Sailing action - taking place now at #WeymouthandPortland http://t.co/g77TOtms
london2012,Gold: USA take the victory in the womens Eight winning the final #Rowing gold of the day http://t.co/TF3oppLC #London2012
london2012,"Gold: In a thrilling final at Eton Dorney, South Africa take the gold in the mens #Rowing Lightweight Four http://t.co/gtq7K8IK"
london2012,Gold: #Rowing duo Nathan Cohen + Joseph Sullivan of New Zealands have won gold in the mens Double Sculls! http://t.co/FkucE9ol
london2012,Will #Rowing World Champs New Zealand add Olympic gold to their accolades in mens Double Sculls? Find out at 11:50 http://t.co/FkucE9ol
london2012,"Stay tuned from 11:30 as the likes of Federer, Murray, Williams + Clijsters take the court for #Tennis quarter-finals http://t.co/KRzmzvGZ"
london2012,Our in-venue cameras tweet such great photos that theyre developing personalities of their own! Follow them here: http://t.co/qP2o3XeY
london2012,Pic: Greenwich Park looking fabulous! More #Equestrian action kicks off today at 11.00 for the Dressage Grand Prix http://t.co/AyeMghWS
london2012,Catch up with the #London2012 medal standings: http://t.co/TBpkxBEL. More gold to come today with 3 #Rowing medals up for grabs shortly!
london2012,Youve never seen #Basketball from this angle! Get a unique prespective on the action with our @L2012BballCam Twittercam #London2012
london2012,Day 6 sport is now under way as Women's #Hockey bursts back into action at the Riverbank Arena http://t.co/wfkwQJZ4 #London2012
london2012,Day 6: 18 golds across 21 sports! Phelps (USA) is after his 20th medal + Hoy (GBR) in search of 5th gold http://t.co/wBqL3JWU #London2012
london2012,Gold &amp; Olympic Record for USA: An awesome performance in womens #Swimming 4 x 200m Freestyle Relay Final http://t.co/Q3xoZMJ9 #London2012
london2012,Gold: #Fencing joy for the Republic of Korea as Kim wins the womens Individual Sabre Final http://t.co/dHKhErf8 #London2012
london2012,..and #Swimming golds: L. Jiao (CHN) wins womens 200m Butterfly. N. Adrian (USA) wins mens 100m Freestyle #London2012 http://t.co/j4585p3M
london2012,Gold for Venezuela!: R. Limardo defeats Norways B. Piasecki in mens #Fencing Epee Individual Final http://t.co/p2qfm79Q #London2012
london2012,Gold &amp; WR for China!: Lu Xiaojun wins mens 77kg #Weightlifting Final lifting 379kg (!!!) in total http://t.co/GjVvu4kC #London2012
london2012,Gold &amp; WR: Gyutra (HUN) in mens #Swimming 200m Breaststroke. Jamieson (GBR) silver + Tateishi (JPN) bronze #London2012 http://t.co/5HKcn56k
london2012,#ArtisticGymnastics gold: Kohei Uchimura (JPN) wins the men's Individual All-Around competition in impressive style http://t.co/71VD3QQJ
london2012,Pic: Bradley Wiggins poses proudly on his throne having won Time Trial #RoadCycling  gold at #London2012 earlier today http://t.co/Vwt5V3hg
london2012,Pic: Synchronised #Boxing?! http://t.co/CmGGdAOH
london2012,RT @l2012bballcam: #Basketball ain't always pretty. #London2012 http://t.co/sQd3CfsD
london2012,Gold: Rim (PRK) lifts a total of 261kg (!) to win by a 5kg margin in the womens 69kg #Weightlifting Final http://t.co/5gaoBfCG #London2012
london2012,#Judo golds: Decosse (FRA) takes the womens 70kg Final and Song (KOR) wins the mens 90kg Final too! http://t.co/n1fZg2Kn #London2012
london2012,Double medal win for China!: Gold for Li and silver for Ding in womens #TableTennis Singles Final #London2012 http://t.co/f6YNZa2e
london2012,Gold: Kim (KOR) beats reigning Olympic champion Chen (CHN) in #Shooting womens 25m Pistol #London2012 http://t.co/UDdQXp6G
london2012,"Gold: Italys D. Molmenti wins the mens Kayak (K1) #CanoeSlalom, taking Italys total medal count to 9 http://t.co/wH0F7Zho #London2012"
london2012,"#Roadcycling gold: Wiggins (GBR) mens Ind. Time Trial! Silver for Martin (GER), bronze to Froome (GBR) http://t.co/apvq12XG #London2012"
london2012,Gold: China continues to dominate at #Diving - Luo &amp; Qin win the mens Synchronised 3m Springboard #London2012 http://t.co/6FPxcUhl
london2012,"RT @L2012PoolCam: Thats definitely not a jellyfish, right? They told me there were no jellyfish in this pool. #London2012 http://t.co/G ..."
london2012,Take a look back at the London 1948 mens #Swimming 100m Freestyle. The #London2012 version is on tonight at 20:20: http://t.co/mJnnSYNM
london2012,Pic: Helen Glover + Heather Stanning (GBR) celebrate with their gold medals from the women's #Rowing Pair #London2012 http://t.co/OcVajnsm
london2012,Gold: Kristin Armstrong (USA) comes out of retirement + wins the women's #RoadCycling Individual Time Trial http://t.co/oFnFyAP8 #London2012
london2012,RT @L2012MatCam: This is @L2012MatCam at the #Judo. Can somebody please help this man? #London2012 http://t.co/OhJAMWd1
london2012,More #London2012 action at Hampton Court Palace with womens #RoadCycling individual Time Trial. Here's the course map: http://t.co/SC2Levpy
london2012,And another #Rowing gold: this time Germany claims gold in the mens Eight at Eton Dorney http://t.co/sIQPWcPH #London2012
london2012,Another #Rowing gold: Ukraine takes the victory in the womens Quadruple Skulls http://t.co/2mjJacF8 #London2012
london2012,Gold: Helen Glover + Heather Stanning win the first gold for Great Britain in the womens #Rowing Pair http://t.co/ZkjhJ8aP #London2012
london2012,Pic: Commitment! Edward Ockenden (AUS) stretches for the ball during Australias 5-0 #Hockey win over Spain http://t.co/Qa86mcwK #London2012
london2012,In an action-packed day of #TableTennis we have a China v China final for womens Singles gold at 15:30 http://t.co/16npHP5y #London2012
london2012,"Three medals to be won in #Rowing today: women's Pair, women's Quadruple Sculls + men's Eight. Follow @L2012Rowing for more! #London2012"
