london2012,RT @Olympics: An interior and exterior view of the Iceberg Skating Palace at @Sochi2014OC #bundleup http://t.co/OeW0qzN4
london2012,London 2012 won gold at the @lovieawards! Now we're up for the People's Lovie Award and you can vote for us here - http://t.co/jp3WK86D
london2012,"Glasgow 2014: ""the next great moment in the UK's golden decade of sport,"" London 2012 board member Sir Craig Reedie. Follow @Glasgow2014 #ff"
london2012,Keep updated on future Olympic Games. Follow @olympics #ff #olympics #london2012
london2012,"If you've loved the feel-good factor and amazing sport of the London 2012 Paralympic Games, follow @Paralympic"
london2012,Thank you for an unforgettable summer! #ClosingCeremony
london2012,Thank you London. Thank you UK #ClosingCeremony
london2012,The band play Every Teardrop is a Waterfall as fountains of water symbolise extinguishing the Paralympic Flame #ClosingCeremony
london2012,Coldplay perform The Scientist as sporting highlights from the @London2012 #Paralympics are played #ClosingCeremony
london2012,Pic: We're getting good at these Olympic Stadium fireworks :-) http://t.co/tiwbzluI
london2012,JAY Z and @Rihanna join @Coldplay for a rousing performance of Run This Town #ClosingCeremony
london2012,A torch is lit from the dying Flame and passed among members of the crowd - symbolising how the Flame lives in all of us #ClosingCeremony
london2012,"As the Cauldron opens and the Flame begins to fade, Jonnie Peacock and Ellie Simmonds arrive carrying Paralympic Torches #ClosingCeremony"
london2012,Sir Philip Craven: 'The greatest #Paralympic Games ever' #ClosingCeremony
london2012,London 2012 - made in Britain #ClosingCeremony
london2012,Thank you to all the volunteers! #ThankYouGamesMakers
london2012,"Andrew the Games Maker: ""I was on duty on 7/7, that terrible day. For me - this is closure"" #ClosingCeremony #Paralympics"
london2012,Big cheer for the purple uniform :-) #ThankYouGamesMakers #ClosingCeremony
london2012,Our minds were opened to what people can achieve through sheer talent and determination #ClosingCeremony
london2012,Together these past few weeks we've shared some wonderful days #ClosingCeremony
london2012,"RT @iammandeville: Oh it's ON, @iamwenlock"
london2012,RT @iamwenlock: *Battle dances at @iamMandeville*
london2012,RT @iammandeville: Little-known fact: I am an AWESOME battle dancer :-D
london2012,Dance battle! #ClosingCeremony
london2012,The @Rio2016 segment includes musical performances by Brazilian pop stars accompanied by disabled and non-disabled dancers #ClosingCeremony
london2012,"The Mayor of London passes the #Paralympic Flag to President of the IPC Sir Philip Craven, who passes it on to Mayor of Rio Eduardo Paes"
london2012,On the Winter stage the #Paralympic Flag is lowered to the Paralympic Anthem. The Brazilian flag is raised to the Brazilian National Anthem
london2012,This section concludes with a firework display accompanying Coldplays Vida La Vida as creatures take to the air #ClosingCeremony
london2012,@Coldplay and @Rihanna perform We Found Love from her album Talk About Talk #ClosingCeremony
london2012,Check out the behind-the-scenes videos that have been uploaded during the #ClosingCeremony with Ceremonies Explorer: http://t.co/0r3PY5yJ
london2012,We move into summer - the British Paraorchestra collaborate with @Coldplay on Strawberry Swing #ClosingCeremony
london2012,Coldplay are now joined by Rihanna for Princess of China #ClosingCeremony
london2012,Pic: Flamethrower! #ClosingCeremony http://t.co/tGloYjGy
london2012,"As Charlie Brown plays, 120 children from the Get Set programme run into the audience and bring the fish to life #ClosingCeremony"
london2012,"Pic: the view from above of @Coldplay, on stage at the #ClosingCeremony of the #Paralympics http://t.co/EhZoI3EN"
london2012,"A dazzling burst of sunshine fills the Stadium, winter is over #ClosingCeremony"
london2012,Motorcycle aerialists Laslzo Simet and Lyndsay Adams put on a spectacular display #ClosingCeremony
london2012,Snow-like confetti explodes from cannons on the roof creating a magical winter scene #ClosingCeremony
london2012,We're entering Winter... #ClosingCeremony
london2012,Pic: the flaming heart that was burned into the ground during the #ClosingCeremony http://t.co/qECMfblr
london2012,Para! Para! #Paralympics! #ClosingCeremony
london2012,"During Paradise 19 Fireflies descent from the roof, as Pyrotechnics go off to mark the end of Autumn #ClosingCeremony"
london2012,Autumn continues with Up in Flames. Denis Remnev performs an aerial ballet with disabled artist Lyndsay Care #ClosingCeremony
london2012,Autumn starts as @Coldplay appear for the first time  they open their set with Us Against the World #ClosingCeremony
london2012,"Now it is time to recognise the 70,000 Games Maker volunteers who made the Games #ClosingCeremony #ThankYouGamesMakers"
london2012,Dr Whang Youn Dai presents awards to two athletes who exemplify the spirit of the Games: Michael McKillop (Ireland) and Mary Zakayo (Kenya)
london2012,"A compass is created pointing to Spring, Summer, Autumn and Winter #ClosingCeremony"
london2012,"The vehicles are: Clamposaurus, Hellcopter, The Beast from the East, The Bug, Time Machine, and The Car that had to be Toad #ClosingCeremony"
london2012,A crop circle pattern is burned by flame throwers before a motorcade of amazing trucks invades the Stadium #ClosingCeremony
london2012,"My friends, let the festival commence! #ClosingCeremony"
london2012,The music is Coldplays Life in Technicolour with additional vocals from the Urban Music Collective #ClosingCeremony
london2012,The heart is burned into the ground as the flag bearers and athletes step away #ClosingCeremony
london2012,"The flags of 164 participating nations enter the Olympic Stadium, creating a heart shape on the field of play #ClosingCeremony"
london2012,There is one thing all of us have in common - human spirit #ClosingCeremony
london2012,"Rory Mackenzie, who is also supported by @Help for Heroes, walks to the top of the Sundial Stage and delivers his address #ClosingCeremony"
london2012,"Lissa Hermans, who is blind and autistic, sings the National Anthem #ClosingCeremony"
london2012,The Earl of Wessex &amp; Sir Phillip Craven are driven around the track in an unusual custom-built car #ClosingCeremony
london2012,"Captain Luke Sinnott, who served in Afghanistan in 2010, hangs the Union Flag in a supreme feat of strength and courage #ClosingCeremony"
london2012,"This segment honours servicemen and women, particularly through the work of the @Help for Heroes (H4H) charity #ClosingCeremony"
london2012,The #ClosingCeremony is all about festivals and the power of music to bring us together. Tonight will take us through all four seasons
london2012,"The three inflatable crescents make up the Agitos, the #Paralympic symbol #ClosingCeremony"
london2012,Horn Blowers signal the wind is coming &amp; the Dreamers wake from their sleep to protect the Agitos  a storm is on its way #ClosingCeremony
london2012,In the Stadium the athletes settle into their seats. Time for the Festival of the Flame #ClosingCeremony
london2012,The #ClosingCeremony is beginning! We'll be tweeting along from now - enjoy the show :-)
london2012,See your #ClosingCeremony tweets &amp; pics from the Stadium and worldwide with Ceremonies Pulse. Great stuff there already http://t.co/iz8Pqwkg
london2012,You can watch behind-the scenes vids uploaded as the #ClosingCeremony goes on tonight with Ceremonies Explorer: http://t.co/0r3PY5yJ
london2012,The #ClosingCeremony is only a couple of hours away! We'll be tweeting along with extra info - join us for a great send-off at 20.30 UK time
london2012,Please RT this &amp; show the world that you're proud of your team - here's the final @London2012 #Paralympic medal table http://t.co/nnELcxkC
london2012,The last @London2012 #Paralympic gold has been won by Russia! They beat Ukraine 1-0 at Football 7-a-side: http://t.co/vmnwEnBU #Football7
london2012,RT @L2012PoolCam: Hello? Is there anyone out there? Anyone..? :( http://t.co/9oswZ5od
london2012,The penultimate gold medal of the #Paralympics goes to...Australia! They beat Canada 66-51 in the #WCRugby final: http://t.co/ykb7iVWO
london2012,Pic: Cute alert! David Weir of Great Britain poses with his gold medal with his son Mason after the men's Marathon T54 http://t.co/sEKeby0K
london2012,"In his latest blog, Australias most decorated Paralympian @matt_cowdrey reflects on his #London2012 experience http://t.co/j2veVhWO"
london2012,How do todays Marathon results rank in your personal highlights? Share your favourite moments of London 2012 with #ParalmypicMemories
london2012,"Shirley Reilly of the USA wins the womens Marathon T54, closely followed by Shelly Woods (GBR) and Sandra Graf (SUI) http://t.co/TbVQjLes"
london2012,David Weir of Great Britain wins the men's Marathon T54 and claims London 2012 gold medal number 4! http://t.co/KNAQ3gPA
london2012,Tonights #ClosingCeremony will be a Festival of Flame bringing an outstanding summer of sport to a memorable close http://t.co/lv9VshkJ
london2012,"T54 Marathons are now under way on the streets of London. Follow their progress  men: http://t.co/AdotDEmd, women: http://t.co/eOg3iHIT"
london2012,Congratulations to our first two Marathon champions: Alberto Suarez Laso of Spain (T12) and Tito Sena of Brazil (T46) http://t.co/fZLVGVtJ
london2012,Todays programme cover features @davidweir2012 aiming today for his 4th London 2012 gold in the mens Marathon T54 http://t.co/BxEUyHq9
london2012,Over the past 11 days the world has witnessed unforgettable world-class sport. Tell us your favourite London 2012 #ParalympicMemories
london2012,There are six final medals up for grabs today including the #WCRugby and #Football7 plus four Marathon golds http://t.co/1gBuaN23
london2012,RT @coldplay: Good morning @London2012 Olympic Stadium. Lovely day for a @Paralympic Closing Ceremony. A http://t.co/4HDExaj1
london2012,The last day of #Paralympic sport begins with the mens T12 and T46 Marathon through the streets of London: http://t.co/MTxYYe57
london2012,Pic: We end the night with @OscarPistorius celebrating his 400m T44 gold. See you bright &amp; early for the Marathon! http://t.co/YgxosfWc
london2012,And the mens #WCBasketball gold medal goes to Canada - defeating 2008 #Paralympic champions Australia 68-54 http://t.co/VEqIoh3C
london2012,Pic: Double Dutch! Marjolein Buis &amp; Esther Vergeer of the Netherlands celebrate gold in the women's #WCTennis Doubles http://t.co/dKsBil7C
london2012,And he does it! @OscarPistorius flies ahead to win the 400m T44 gold  the final #Athletics event in the Stadium! http://t.co/w1nEzR6Q
london2012,Just 10 minutes until the mens 400m T44. Can defending champ @OscarPistorius secure an individual gold? #Athletics http://t.co/w1nEzR6Q
london2012,"RT @London2012Fest: A bus dangling from a roof, street art in Bristol, acrobatics on the London Eye... What's your #London2012Festival h ..."
london2012,China take the final #Swimming medal &amp; new WR in 4x100m Medley Relay. What a way to end the #AquaticsCentre action! http://t.co/OBueJD5j
london2012,USA win #WCBasketball bronze medal defeating Great Britain 61-46. Stay tuned for Australia v Canada final http://t.co/0odT1dfa
london2012,Pic: Serverino Gabriel da Silva celebrates his goal which helped Brazil defeat France 2-0 to win the #Football5 gold http://t.co/8nDIMlgI
london2012,Pic: Silver medallist Ellie Simmonds (GBR) congratulates Victoria Arlen (USA) after the women's 100m Freestyle S6 final http://t.co/MTaJ7bz1
london2012,Its the last night of sporting action in the #OlympicStadium but weve got 15 #Athletics medal events coming up soon! http://t.co/fPgA4qTS
london2012,Triple gold medallist David Weir (@DavidWeir2012) chats about his experience so far ahead of the Marathon tomorrow http://t.co/HOlgGE4S
london2012,Pic: The chequered flag waves as Ivano and Lucca Pizzi of Italy celebrate winning the men's Individual B Road Race http://t.co/QjmZBB7G
london2012,Great idea from the athletes  Please RT! @London2012 volunteers to wear uniforms with pride on Monday. Let's all say #thankyougamesmakers!
london2012,Pic: Spain have beaten Argentina to take bronze in the #Football5. Brazil now play France in the gold medal match http://t.co/5GJWvuiA
london2012,RT @L2012PoolCam: Looking pretty speedy up there @EllieSimmonds1! Always nice to see you in my pool. #Paralympics http://t.co/J2NskL8O
london2012,"China have a big lead in 1st, but it's a very close fight for 2nd place (by golds won) on our medal table: http://t.co/nnELcxkC #Paralympics"
london2012,Video blog: Jiri Jezek (CZE) looks like he's enjoying his extra gift as much as his #RoadCycling &amp; #TrackCycling medals http://t.co/yvAHFw0R
london2012,"Pic: Bright blue sky, bright blue pitch - the Riverbank Arena has hosted big crowds for 7-a-side Football #Football7 http://t.co/mN2ervff"
london2012,"Pic: Evan O'Hanlon celebrates double #Athletics gold, sticking out his tongue as he wins the men's 200m - T38 final http://t.co/LybzbnSM"
london2012,"On our final #Swimming day, please RT &amp; share this superb black &amp; white pic of S. Pascoe (NZL) gliding across the water http://t.co/p7kH33Ds"
london2012,"USA's Tatyana McFadden, a triple #Athletics gold winner already at these Games, is today's daily programme cover star http://t.co/AajayZhP"
london2012,"#Swimming, #Boccia, #Football5 &amp; #WCRugby have started, with the host-nation in action in the latter two right now: http://t.co/FVarXmHu"
london2012,It's the penultimate day of the @London2012 #Paralympics - check out all the fantastic sport coming up today on Day 10: http://t.co/qGJt5Z2N
london2012,The final golds of the night go to China in women's #SittingVolleyball and Germany in #WCBasketball. See you tomorrow for the final weekend!
london2012,Pistorius &amp; Oliveira qualify comfortably from their heats and will go head to head in tomorrow's men's 400m - T44 final http://t.co/1xBk8SIO
london2012,There are women's #Goalball and #WCBasketball finals taking place right now! Check out our schedule to stay up to date: http://t.co/qGJt5Z2N
london2012,Pic: take a second to share tonight's spectacular Olympic Park sunset #Paralympics http://t.co/kTpNmBvo
london2012,Jason Smyth is video blogging for you - watch &amp; learn how to start a race well from an #Athletics World Record breaker: http://t.co/d74w2EKH
london2012,Another #Athletics gold &amp; another World Record for Ireland's unstoppable Jason Smyth - he takes men's 200m T13 glory http://t.co/VFikWIjJ
london2012,"More gold for Italy's Alessandro Zanardi! He has won today's men's Individual H 4 Road Race, stunning! http://t.co/Ezndk35t #RoadCycling"
london2012,Pic: So much emotion as Jonnie Peacock embraces family members after his 100m - T44 #Athletics victory last night http://t.co/xvT2q3SE
london2012,"There are 15 more #Swimming golds to be won at the Aquatics Centre tonight, starting in 15 minutes time: http://t.co/jyoUPSrW"
london2012,Pic: Esther Vergeer celebrates a 470th (!) consecutive #WCTennis win and a record 4th consecutive #Paralympic gold http://t.co/ZNCfPm9I
london2012,"Featured on today's daily programme, @ParalympicsGB Mickey Bushell goes for his second gold in the men's 200m T53 http://t.co/0YlaLwD0"
london2012,Rachel Morris and Karen Darke of GB cross the finish line together in the women's Individual H1-3 Road Race http://t.co/iQZbZELh
london2012,Pic: Josie Pearson (GB) broke the world record on her way to gold in the women's Discus Throw F51/52/53 earlier today http://t.co/4peWnJvc
london2012,"Yesterday was full of amazing #Paralympic action, check out our gallery of the best photos: http://t.co/gquU7JEd"
london2012,RT @L2012PoolCam: Can you even see me down here? I wish someone would at least just give me a little wave #Paralympics http://t.co/te0WDXYo
london2012,Pic: David Weir of Great Britain roars past the finish line to win gold in the men's 800m - T54 final #Paralympic http://t.co/i0NV3OJW
london2012,"Its Day 9, the skies are blue and we've got a great day of sport coming up! Check out the action ahead: http://t.co/KGnzy6LU"
london2012,Check out your tweets and pics from #Paralympic venues and around the world with our Paralympic Pulse site: http://t.co/NiU6F1X0
london2012,Pic: David Weir crosses the finish line to take #Athletics gold - but his shirt doesn't make it intact #Paralympics http://t.co/LxQLaubR
london2012,Pic: the moment Jonnie Peacock knew he'd won men's 100m - T44 #Athletics gold #Paralympics http://t.co/jmi5V89z
london2012,Jonnie Peacock (GBR) is the men's 100m - T44 champion! He beats Browne (USA) &amp; Fourie (RSA) and sends the Stadium wild! http://t.co/kBc4qdvu
london2012,David Weir takes his third gold of the #Paralympics - the men's 800m T54 #Athletics - tearing his shirt in the process! http://t.co/nvcxEB2I
london2012,"10 mins to one of tonight's biggest races - men's 100m T44 final, ft. Peacock, Pistorius, Singleton &amp; more: http://t.co/p3L1UjqP #Athletics"
london2012,"#Athletics #Goalball #Swimming, #TableTennis #WCRugby #WCBasketball #SittingVolleyball - all still to come tonight: http://t.co/qGJt5Z2N"
london2012,Pic: we love this fish-eye lens view of Poland's Anna Harkowska taking part in the #RoadCycling http://t.co/uwg6MKxk
london2012,"Great Britain's Josef Craig, aged just 15, wins men's 400m Freestyle - S7 #Swimming gold, breaking his own WR by 3 secs http://t.co/MLqahMAE"
london2012,Pic: One look at this wheelchair will give you an idea of big impacts #WCRugby players are up against #Paralympics http://t.co/0G6c7P4k
london2012,"Sarah Storey wins women's Individual C 4-5 Road Race, her 4th gold of the #Paralympics &amp; her 11th in total http://t.co/1XWRdMLt #RoadCycling"
london2012,Sarah Storey wins #RoadCycling gold &amp; is now ParalympicsGB's most decorated Paralympian with Dame Tanni Grey-Thompson! http://t.co/rqsBcqhh
london2012,Pic: Helena Lucas rides the waves to win Great Britain's first ever Paralympic #Sailing gold http://t.co/dpaULacZ
london2012,Pic: Australias most decorated Paralympian Matthew Cowdrey in action in men's 200m Individual Medley SM9 heats http://t.co/GpCRijBe
london2012,Happy birthday to French #WCRugby player Sallem Riadh. Hell be celebrating by smashing &amp; crashing on court at 19:00! http://t.co/IuJSk9nN
london2012,Pic: Irelands @smyth_jason powers ahead to secure his spot in the men's 200m T13 #Athletics final http://t.co/AzDoclEa
london2012,"RT @OscarPistorius: Just bumped into Alex Zinardi, ex F1 driver and paralympic hand cycling Gold Medallist. One of my hero's. http://t.c ..."
london2012,Covergirl Jessica Long (USA) has broken the WR in the 100m Freestyle S8 heats in search of her 5th #London2012 gold http://t.co/IHyfuGmJ
london2012,Want the latest #Paralympic updates? Follow all your favourite sports throughout the day with our live Twitter feeds: http://t.co/oOaFY5iE
london2012,Jarryd Wallace from the USA #Athletics mens 4 x 100m team blogs about his experience in last nights dramatic final http://t.co/ZC1nSpyN
london2012,"Pic: Clean sweep! Brazil celebrate taking gold, silver and bronze in the women's 100m T11 final #Paralympic http://t.co/1gsyab3y"
london2012,Its Day 8 and theres already a buzz about the mens 100m  T44 final tonight! Check out more of the action to come: http://t.co/lfHE1Kzj
london2012,"Pic: Pistorius, Fourie, Radebe &amp; Smith (RSA) pose by the scoreboard displaying their World Record: http://t.co/XZ5fTvq7"
london2012,"World Record! Pistorius, Fourie, Radebe &amp; Smith win gold in men's 4x100m Relay - T42/T46 #Athletics for South Africa http://t.co/NYgIY20s"
london2012,"Pic: Aged just 14, Victoria Savtsova (UKR) looks delighted with her first ever #Paralympic medal - a #Swimming gold! http://t.co/vQd1M90P"
london2012,"Line up for men's 100m - T44 #Athletics Final: Peacock, Pistorius, Fourie, Brown, Leeper, Singleton, Oliveira, Zhiming http://t.co/eLJYxPIM"
london2012,Jonnie Peacock of ParalympicsGB qualifies fastest for tomorrow night's men's 100m - T44 #Athletics Final http://t.co/DABQUKCA #Paralympics
london2012,"#Athletics is about to begin again, inc. Pistorius, Singleton, Peacock and Oliveira in the men's Men's 100m - T44 heats http://t.co/DABQUKCA"
london2012,Pic: no wonder USA's Jessica Long is smiling - she's won her 4th #Swimming gold (6th medal overall) of the #Paralympics http://t.co/Z1gda1Sf
london2012,Pic: Wheelchair Rugby can be brutal: http://t.co/H2cy0Pzy #WCRugby
london2012,Pic: what a celebration! Alex Zanardi celebrates #RoadCycling gold by raising his hand cycle into the air in triumph! http://t.co/eDRiHOHw
london2012,Former F1 driver Alessandro Zanardi (ITA) takes #RoadCycling gold in the men's Individual H 4 Time Trial! http://t.co/Rx8mWCR1 #Paralympics
london2012,Pic: This is what it's all about! Great close up shot of a #Paralympic gold medal http://t.co/sZ84nMsV
london2012,"In his latest video blog, Greg Polychronidis (@gregpoly) shares his feelings about winning #Boccia Mixed Pairs - BC3 _http://t.co/BeYKkZQ9"
london2012,Pic: Great Britains #Cycling superstar Sarah Storey celebrates her 3rd gold in the women's Individual C 5 Time Trial http://t.co/n1C91AtH
london2012,On the cover of the Day 7 programme is @OscarPistorius - back in action tonight in the men's 4x100m Relay - T42/T46 http://t.co/Jr0ekxkC
london2012,Its game day for #WCRugby! In his video blog Jason Reiger talks to his USA teammates before their first match http://t.co/GeYBlPSy
london2012,"#RoadCycling gets under way this morning. Watch for former F1 driver Alex Zanardi, competing at his first #Paralympics http://t.co/wmBiSBuL"
london2012,Pic: Brothers Oliver and Sam Hynd have both qualified for the mens 200m IM - SM8 final. Tune in tonight at 17:30 http://t.co/adlZ7660
london2012,Pic: Felipe Gomes of Brazil &amp; guide Leonardo Souza Lopes enjoy their moment on the podium for men's 200m - T11 gold http://t.co/E0gBuJSD
london2012,Its Wonderful Wednesday with 65 medals up for grabs. Its also the start of #WCRugby and #RoadCycling! http://t.co/3Yk5n0ls #Paralympics
london2012,David Weir roars in celebration as he crosses the line in the 1500m T54 for his second gold of #London2012 http://t.co/Xgav5VkY
london2012,David Weir of @ParalympicsGB makes it a double gold by winning the men's 1500m - T54 to rapturous applause  http://t.co/SZFel4XO
london2012,Australia's Jacqueline Freney remains unbeaten @London2012 as she wins an astonishing sixth #swimming gold! http://t.co/1kGpBXTe
london2012,Pic: Abderrahim Zhiou (TUN) celebrates with David Devine (GBR) after the 1500m - T13 #Athletics http://t.co/LYUzcsHY http://t.co/CwAYghu5
london2012,Our venues are buzzing tonight! Get the inside scoop with #Paralympic Pulse: http://t.co/NiU6F1X0 #London2012
london2012,Two more women's #WCBasketball quarter-finals to look forward to tonight - Germany v Great Britain then USA v Canada http://t.co/DGL4ZMmx
london2012,Pic: Danielle Brown &amp; Mel Clarke celebrate a @ParalympicsGB one-two in the women's Individual Compound - Open #Archery http://t.co/XqmZ0AA1
london2012,"Another packed evening of #Swimming starts in 5 minutes, with 15 gold medals up for grabs http://t.co/Xl0ry1BQ"
london2012,Pic: Ruslan Katyshev (UKR) leaps to Long Jump F11 gold in the #Athletics as his guide watches on http://t.co/EKCKrUEb http://t.co/aAZhXljY
london2012,RT @L2012PoolCam: Bubbles! Bubbles! Look at all the bubbles! http://t.co/8Uix87HE
london2012,"Meet one of the founders of #WCRugby, as he chats to USA players. Competition starts tomorrow! http://t.co/j8ryFSUW http://t.co/yPBc7kBU"
london2012,"We're now half way through the London 2012 #Paralympics, but don't worry, there's plenty more excitement to come! http://t.co/sPpfqNl1"
london2012,Did you know: The Netherlands has a competitor in each of the women's #WCTennis singles quarter-finals this afternoon! http://t.co/SnJ5nNqF
london2012,Pic: Say hello to Sophie Pascoe (NZL) aiming for her third London 2012 #Swimming gold in the 100m Backstroke - S10 http://t.co/H7h6WGkp
london2012,Pic: Jerusa Geber Santos (BRA) and guide Luiz Henrique Barboza Da Silva compete in the women's #Athletics 100m - T11 http://t.co/aeKQZ8Zk
london2012,The #AquaticsCentre is buzzing right now! Check out whats going on at the venues with #Paralympic Pulse http://t.co/NiU6F1X0
london2012,Brazil go through to the Football 5-a-side semifinals at the top of Pool B after defeating China 1-0 http://t.co/VyLdn7C0 #Football5
london2012,"On the cover of todays programme is archer Danielle Brown, hoping to retain the women's Individual Compound Open title http://t.co/4YnLoGZ2"
london2012,#WheelchairFencing has just got under way for the first time at London 2012. There are 12 medals over 5 days http://t.co/0nnnA46M
london2012,Pic: Great shot! Matt Stutzman (USA) takes the silver medal in the men's #Archery Individual Compound - Open http://t.co/gKOA88qy
london2012,Day 6 sees medals in eight sports including the first #Boccia medals and the start of #WheelchairFencing http://t.co/FkcOHuSO #Paralympics
london2012,Pic: Michael McKillop (IRE) is presented with his men's 1500m - T37 #Athletics gold medal...by his mum Catherine :-) http://t.co/HkIh5HPn
london2012,Michael McKillop has been video blogging for you! Spend 2 minutes listening to him explain how he became a Paralympian: http://t.co/EVVCSTbs
london2012,Ireland's Michael McKillop is a double #Athletics gold medal winner at these Games after winning the men's 1500m - T37 http://t.co/8fcggaXR
london2012,Pic: Oscar Pistorius (silver) and Alan Oliveira (gold) embrace during the men's 200m - T44 #Athletics Victory Ceremony http://t.co/amQBizWm
